"","_comment_sort","_comments","_comments_by_id","_info_url","_orphaned","_params","_replaced_more","_underscore_names","approved_by","archived","author","author_flair_css_class","author_flair_text","banned_by","clicked","created","created_utc","distinguished","domain","downs","edited","gilded","has_fetched","hidden","id","is_self","json_dict","likes","link_flair_css_class","link_flair_text","media","media_embed","mod_reports","name","num_comments","num_reports","over_18","permalink","reddit_session","report_reasons","saved","score","secure_media","secure_media_embed","selftext","selftext_html","stickied","subreddit","subreddit_id","suggested_sort","thumbnail","title","ups","url","user_reports","visited"
"16","","","{}","http://www.reddit.com/api/info/","{}","{}","False","","","True","throwawayaskd","","","","False","1404521458.0","1404517858.0","","self.askgaybros","0","False","0","True","False","29v44y","True","","","","","","{}","[]","t3_29v44y","3","","False","http://www.reddit.com/r/askgaybros/comments/29v44y/only_dated_online_how_do_i_date_in_person/","Unauthenticated reddit sesssion","","False","5","","{}","Throw away account--sorry.
 
Here's my situation. Early twenties. Single for eight months, moved on.
 
My relationships have all been long distance and not in person. I guess because I couldn't find anyone around me who I liked and shared interest with and we always ended up not being able to meet up for different reasons... but now I want to be in a relationship with someone physically near me. Does anyone have any advice for someone who's primary experience dating has been online/long distance? Or even meeting people? I'm not into bars/clubs/or anything like that. The ""dating"" apps scare me and I don't think I want to use them...any tips or advice? ","&lt;!-- SC_OFF --&gt;&lt;div class=""md""&gt;&lt;p&gt;Throw away account--sorry.&lt;/p&gt;

&lt;p&gt;Here&amp;#39;s my situation. Early twenties. Single for eight months, moved on.&lt;/p&gt;

&lt;p&gt;My relationships have all been long distance and not in person. I guess because I couldn&amp;#39;t find anyone around me who I liked and shared interest with and we always ended up not being able to meet up for different reasons... but now I want to be in a relationship with someone physically near me. Does anyone have any advice for someone who&amp;#39;s primary experience dating has been online/long distance? Or even meeting people? I&amp;#39;m not into bars/clubs/or anything like that. The &amp;quot;dating&amp;quot; apps scare me and I don&amp;#39;t think I want to use them...any tips or advice? &lt;/p&gt;
&lt;/div&gt;&lt;!-- SC_ON --&gt;","False","askgaybros","t5_2vgfw","","","Only dated online, how do I date in person? :(","5","http://www.reddit.com/r/askgaybros/comments/29v44y/only_dated_online_how_do_i_date_in_person/","[]","False"
"17","","","{}","http://www.reddit.com/api/info/","{}","{}","False","","","True","cameltoeee","","","","False","1404519321.0","1404515721.0","","self.askgaybros","0","False","0","True","False","29v1nr","True","","","","","","{}","[]","t3_29v1nr","17","","False","http://www.reddit.com/r/askgaybros/comments/29v1nr/homophobic_comments_at_work/","Unauthenticated reddit sesssion","","False","6","","{}","I am pretty off people's gaydar for the most part, especially older people (I'm 22). Anyways, my coworkers (who are all 20+ years older than me) have all been on the verge of making homophobic comments in front of me, and it's only a matter of time before they say something personally offensive. The latest was a story about a transgender mtf trying to get her clothes back from the non-profit I work for, after her dad donated them in a rage. They were laughing about it and basically putting this kid down. There have also been off the cuff comments joking about guys being with guys.

Anyways, I am working there for another 2 months, and it's a small office of a multinational non-profit (I'm on short term contract leading a specific project). I'm the new worker, everyone else has been there for many years. I am wondering if I should just bite my tongue, or speak up. I have no problem speaking up and am not ashamed of myself in any way, but I am wondering if the backlash is even worth it. Most of their comments I overhear, and aren't said directly at me. 

Bonus Question: I also find that since I am younger, regardless of my experience and more up to date ideology, my opinions get glossed over quite often. Even if I am the one who has the most experience doing something, they won't really listen to my suggestions and I feel like I am talking to a wall. What should I do about that?","&lt;!-- SC_OFF --&gt;&lt;div class=""md""&gt;&lt;p&gt;I am pretty off people&amp;#39;s gaydar for the most part, especially older people (I&amp;#39;m 22). Anyways, my coworkers (who are all 20+ years older than me) have all been on the verge of making homophobic comments in front of me, and it&amp;#39;s only a matter of time before they say something personally offensive. The latest was a story about a transgender mtf trying to get her clothes back from the non-profit I work for, after her dad donated them in a rage. They were laughing about it and basically putting this kid down. There have also been off the cuff comments joking about guys being with guys.&lt;/p&gt;

&lt;p&gt;Anyways, I am working there for another 2 months, and it&amp;#39;s a small office of a multinational non-profit (I&amp;#39;m on short term contract leading a specific project). I&amp;#39;m the new worker, everyone else has been there for many years. I am wondering if I should just bite my tongue, or speak up. I have no problem speaking up and am not ashamed of myself in any way, but I am wondering if the backlash is even worth it. Most of their comments I overhear, and aren&amp;#39;t said directly at me. &lt;/p&gt;

&lt;p&gt;Bonus Question: I also find that since I am younger, regardless of my experience and more up to date ideology, my opinions get glossed over quite often. Even if I am the one who has the most experience doing something, they won&amp;#39;t really listen to my suggestions and I feel like I am talking to a wall. What should I do about that?&lt;/p&gt;
&lt;/div&gt;&lt;!-- SC_ON --&gt;","False","askgaybros","t5_2vgfw","","","Homophobic Comments at Work","6","http://www.reddit.com/r/askgaybros/comments/29v1nr/homophobic_comments_at_work/","[]","False"
"18","","","{}","http://www.reddit.com/api/info/","{}","{}","False","","","True","throwaway394809","","","","False","1404515206.0","1404511606.0","","self.askgaybros","0","False","0","True","False","29uwe9","True","","","","","","{}","[]","t3_29uwe9","18","","False","http://www.reddit.com/r/askgaybros/comments/29uwe9/i_told_this_straight_guy_i_liked_him_he_hasnt/","Unauthenticated reddit sesssion","","False","15","","{}","I came out to him a few months before I confessed my feelings; he was cool with it, but the attraction grew stronger and I just had to tell him.  He never said anything about being straight, which lead me to believe something could happen.  I messaged him telling him I did not want this to happen, but I needed to get it off my chest and stop wondering what could have been, and he didn't reply for a month, not one word.  I messaged a month later asking if it would be possible to put it behind us, he told me to think about what I said and how weird it makes everything.  I told him I fucked up and said if we don't cross paths anymore I wish him the best of luck.  He wished me the same, and it's been about 9 months since we last communicated.  

Do you think restoring the friendship could be possible at this point?  Could I take initiative without him freaking out (like wishing him a happy birthday) or should I wait for him to do something?  Also, I'm not out to many other people, so I'm afraid that he would tell others, so I don't want to be persistent about reconciling.  Anyone ever deal with a situation like this?","&lt;!-- SC_OFF --&gt;&lt;div class=""md""&gt;&lt;p&gt;I came out to him a few months before I confessed my feelings; he was cool with it, but the attraction grew stronger and I just had to tell him.  He never said anything about being straight, which lead me to believe something could happen.  I messaged him telling him I did not want this to happen, but I needed to get it off my chest and stop wondering what could have been, and he didn&amp;#39;t reply for a month, not one word.  I messaged a month later asking if it would be possible to put it behind us, he told me to think about what I said and how weird it makes everything.  I told him I fucked up and said if we don&amp;#39;t cross paths anymore I wish him the best of luck.  He wished me the same, and it&amp;#39;s been about 9 months since we last communicated.  &lt;/p&gt;

&lt;p&gt;Do you think restoring the friendship could be possible at this point?  Could I take initiative without him freaking out (like wishing him a happy birthday) or should I wait for him to do something?  Also, I&amp;#39;m not out to many other people, so I&amp;#39;m afraid that he would tell others, so I don&amp;#39;t want to be persistent about reconciling.  Anyone ever deal with a situation like this?&lt;/p&gt;
&lt;/div&gt;&lt;!-- SC_ON --&gt;","False","askgaybros","t5_2vgfw","","","I told this straight guy I liked him, he hasn't talked to me in almost a year, think reconciliation is possible for a friendship?","15","http://www.reddit.com/r/askgaybros/comments/29uwe9/i_told_this_straight_guy_i_liked_him_he_hasnt/","[]","False"
"19","","","{}","http://www.reddit.com/api/info/","{}","{}","False","","","True","alannsmithee","","","","False","1404513101.0","1404509501.0","","self.askgaybros","0","1404519047.0","0","True","False","29utor","True","","","","","","{}","[]","t3_29utor","5","","False","http://www.reddit.com/r/askgaybros/comments/29utor/25_and_never_experienced_mutual_attraction/","Unauthenticated reddit sesssion","","False","14","","{}","It seems so trivial and shallow, but I don't know what it feels like. The attraction I experience is always one sided. I've hooked up with a few guys over the net but I can't say I was terribly attracted to any of them and many of them were older (40+) because apparently guys my age are not attracted me. The guys I'm interested in are not all the archetypal attractive type, some might even be considered 'average' but the perceived level of attractiveness doesn't seem to matter. If I'm  into them in the slightest, I can take that as a sign that the feeling is not mutual.  I feel like I've been so starved of this experience that the first time I feel it I'm going to go batshit over the guy and go too far. 

Anyone share a similar experience or lack of ? Those who've experienced care to describe it ?

Sorry for the pity party. I just needed to vent.","&lt;!-- SC_OFF --&gt;&lt;div class=""md""&gt;&lt;p&gt;It seems so trivial and shallow, but I don&amp;#39;t know what it feels like. The attraction I experience is always one sided. I&amp;#39;ve hooked up with a few guys over the net but I can&amp;#39;t say I was terribly attracted to any of them and many of them were older (40+) because apparently guys my age are not attracted me. The guys I&amp;#39;m interested in are not all the archetypal attractive type, some might even be considered &amp;#39;average&amp;#39; but the perceived level of attractiveness doesn&amp;#39;t seem to matter. If I&amp;#39;m  into them in the slightest, I can take that as a sign that the feeling is not mutual.  I feel like I&amp;#39;ve been so starved of this experience that the first time I feel it I&amp;#39;m going to go batshit over the guy and go too far. &lt;/p&gt;

&lt;p&gt;Anyone share a similar experience or lack of ? Those who&amp;#39;ve experienced care to describe it ?&lt;/p&gt;

&lt;p&gt;Sorry for the pity party. I just needed to vent.&lt;/p&gt;
&lt;/div&gt;&lt;!-- SC_ON --&gt;","False","askgaybros","t5_2vgfw","","","25 and never experienced mutual attraction.","14","http://www.reddit.com/r/askgaybros/comments/29utor/25_and_never_experienced_mutual_attraction/","[]","False"
"20","","","{}","http://www.reddit.com/api/info/","{}","{}","False","","","True","throwmeawayfordays","","","","False","1404497850.0","1404494250.0","","self.askgaybros","0","False","0","True","False","29u87r","True","","","","","","{}","[]","t3_29u87r","4","","False","http://www.reddit.com/r/askgaybros/comments/29u87r/first_relationship_thoughts/","Unauthenticated reddit sesssion","","False","10","","{}","So I've been in my first relationship just about 13 months long and well now I've started having lust issues in general, on top of missing some of the freedoms I got like flirting with whatever I felt like, not having to check in with someone (besides my parents back in the teenage years), I'm pretty young so I don't know if my thoughts that make me upset or give me butterflies in my stomach bother me. We have our ups and downs like everyone else, but this guy doesn't think he'll ever get with another person and it would be the end if I broke up with him. He says that I am the reason he is alive and it's not in a figurative sense either. I don't know what to do because I feel like I can't leave his side. I still like him very much so, but sometimes it just frustrates me to not be alone or go out, party, etc. I would never cheat but I do get strong senses of lust and urges but I never act and now just knowing that I am alone in the sense that he doesn't ever feel like or at least admit to crushing/lusting/liking guys. I don't know am I in the wrong, should I change, is he wrong, what's going on... Is this normal I've never been in a relation and never so confused in my life, I really like him and want to keep him but sometimes I just get these thoughts and start thinking, and I can't figure out how to shut my brain up and behave. I'm ranting at this point and probably repeating everything but I have no idea what to do, and no one to confidently talk about this with","&lt;!-- SC_OFF --&gt;&lt;div class=""md""&gt;&lt;p&gt;So I&amp;#39;ve been in my first relationship just about 13 months long and well now I&amp;#39;ve started having lust issues in general, on top of missing some of the freedoms I got like flirting with whatever I felt like, not having to check in with someone (besides my parents back in the teenage years), I&amp;#39;m pretty young so I don&amp;#39;t know if my thoughts that make me upset or give me butterflies in my stomach bother me. We have our ups and downs like everyone else, but this guy doesn&amp;#39;t think he&amp;#39;ll ever get with another person and it would be the end if I broke up with him. He says that I am the reason he is alive and it&amp;#39;s not in a figurative sense either. I don&amp;#39;t know what to do because I feel like I can&amp;#39;t leave his side. I still like him very much so, but sometimes it just frustrates me to not be alone or go out, party, etc. I would never cheat but I do get strong senses of lust and urges but I never act and now just knowing that I am alone in the sense that he doesn&amp;#39;t ever feel like or at least admit to crushing/lusting/liking guys. I don&amp;#39;t know am I in the wrong, should I change, is he wrong, what&amp;#39;s going on... Is this normal I&amp;#39;ve never been in a relation and never so confused in my life, I really like him and want to keep him but sometimes I just get these thoughts and start thinking, and I can&amp;#39;t figure out how to shut my brain up and behave. I&amp;#39;m ranting at this point and probably repeating everything but I have no idea what to do, and no one to confidently talk about this with&lt;/p&gt;
&lt;/div&gt;&lt;!-- SC_ON --&gt;","False","askgaybros","t5_2vgfw","","","First relationship thoughts?","10","http://www.reddit.com/r/askgaybros/comments/29u87r/first_relationship_thoughts/","[]","False"
"21","","","{}","http://www.reddit.com/api/info/","{}","{}","False","","","True","noparkinghere","","","","False","1404496602.0","1404493002.0","","self.askgaybros","0","False","0","True","False","29u6ci","True","","","","","","{}","[]","t3_29u6ci","26","","False","http://www.reddit.com/r/askgaybros/comments/29u6ci/how_to_flirt_with_older_guys_relatively/","Unauthenticated reddit sesssion","","False","2","","{}","Hey askbros, I'm 19 and want to start getting out more often. I don't have ANY gaybro or gay male friends with who I would discuss the most effective ways to be flirty. Anyway, this one scenario comes up in my head and I've reached a wall. 

What happens when a guy comes up to me and says ""How old are you?"" looking like he's flirting.

I want to flirt back but I can only think of saying ""19"" and smiling. What are some other things I can say without being TOO forward but not too boring.","&lt;!-- SC_OFF --&gt;&lt;div class=""md""&gt;&lt;p&gt;Hey askbros, I&amp;#39;m 19 and want to start getting out more often. I don&amp;#39;t have ANY gaybro or gay male friends with who I would discuss the most effective ways to be flirty. Anyway, this one scenario comes up in my head and I&amp;#39;ve reached a wall. &lt;/p&gt;

&lt;p&gt;What happens when a guy comes up to me and says &amp;quot;How old are you?&amp;quot; looking like he&amp;#39;s flirting.&lt;/p&gt;

&lt;p&gt;I want to flirt back but I can only think of saying &amp;quot;19&amp;quot; and smiling. What are some other things I can say without being TOO forward but not too boring.&lt;/p&gt;
&lt;/div&gt;&lt;!-- SC_ON --&gt;","False","askgaybros","t5_2vgfw","","","How to flirt with older guys (relatively)","2","http://www.reddit.com/r/askgaybros/comments/29u6ci/how_to_flirt_with_older_guys_relatively/","[]","False"
"22","","","{}","http://www.reddit.com/api/info/","{}","{}","False","","","True","AndyAK","","","","False","1404494998.0","1404491398.0","","self.askgaybros","0","False","0","True","False","29u427","True","","","","","","{}","[]","t3_29u427","23","","False","http://www.reddit.com/r/askgaybros/comments/29u427/do_you_think_anyone_would_meet_me_just_for_a/","Unauthenticated reddit sesssion","","False","19","","{}","Like on grindr etc, I understand it sounds weird but I get so lonely sometimes it would be nice just to have a guy cuddle me and think of me as something worth cuddling, just to cuddle in bed would be awesome right now. I sould like a child haha but I am 18, not a kid lol.","&lt;!-- SC_OFF --&gt;&lt;div class=""md""&gt;&lt;p&gt;Like on grindr etc, I understand it sounds weird but I get so lonely sometimes it would be nice just to have a guy cuddle me and think of me as something worth cuddling, just to cuddle in bed would be awesome right now. I sould like a child haha but I am 18, not a kid lol.&lt;/p&gt;
&lt;/div&gt;&lt;!-- SC_ON --&gt;","False","askgaybros","t5_2vgfw","","","Do you think anyone would meet me just for a cuddle?","19","http://www.reddit.com/r/askgaybros/comments/29u427/do_you_think_anyone_would_meet_me_just_for_a/","[]","False"
