"","_comment_sort","_comments","_comments_by_id","_info_url","_orphaned","_params","_replaced_more","_underscore_names","approved_by","archived","author","author_flair_css_class","author_flair_text","banned_by","clicked","created","created_utc","distinguished","domain","downs","edited","gilded","has_fetched","hidden","id","is_self","json_dict","likes","link_flair_css_class","link_flair_text","media","media_embed","mod_reports","name","num_comments","num_reports","over_18","permalink","reddit_session","report_reasons","saved","score","secure_media","secure_media_embed","selftext","selftext_html","stickied","subreddit","subreddit_id","suggested_sort","thumbnail","title","ups","url","user_reports","visited"
"14","","","{}","http://www.reddit.com/api/info/","{}","{}","False","","","False","dpdpp1","","","","False","1422333230.0","1422333230.0","","self.askgaybros","0","False","0","True","False","2tt1wi","True","","","","","","{}","[]","t3_2tt1wi","17","","False","http://www.reddit.com/r/askgaybros/comments/2tt1wi/okay_so_i_matched_with_a_friends_friend_on_tinder/","Unauthenticated reddit sesssion","","False","7","","{}","During winter break (basically the entirety of January) I matched with a friend's friend on Tinder.

He's a really cute guy, seems really smart and interesting, and is a musician.

That being said, there's two problems.

1)  My friend is shipping us and wants me to... I don't know, fuck him? Hook up with him? Something... I don't want that.  This guy seems genuinely interesting and I really want to get to know him beyond the really superficial texting and such.

2)  I'm not sure if he actually likes me back.  I'm not like... in love with him, but, as I said, he seems really cool and interesting... someone I could definitely date or whatever, but I have no way to know if he thinks the same for me.  He could even think I'm annoying or whatever.

What should I do? :P","&lt;!-- SC_OFF --&gt;&lt;div class=""md""&gt;&lt;p&gt;During winter break (basically the entirety of January) I matched with a friend&amp;#39;s friend on Tinder.&lt;/p&gt;

&lt;p&gt;He&amp;#39;s a really cute guy, seems really smart and interesting, and is a musician.&lt;/p&gt;

&lt;p&gt;That being said, there&amp;#39;s two problems.&lt;/p&gt;

&lt;p&gt;1)  My friend is shipping us and wants me to... I don&amp;#39;t know, fuck him? Hook up with him? Something... I don&amp;#39;t want that.  This guy seems genuinely interesting and I really want to get to know him beyond the really superficial texting and such.&lt;/p&gt;

&lt;p&gt;2)  I&amp;#39;m not sure if he actually likes me back.  I&amp;#39;m not like... in love with him, but, as I said, he seems really cool and interesting... someone I could definitely date or whatever, but I have no way to know if he thinks the same for me.  He could even think I&amp;#39;m annoying or whatever.&lt;/p&gt;

&lt;p&gt;What should I do? :P&lt;/p&gt;
&lt;/div&gt;&lt;!-- SC_ON --&gt;","False","askgaybros","t5_2vgfw","","","Okay... So I Matched with a Friend's Friend on Tinder.","7","http://www.reddit.com/r/askgaybros/comments/2tt1wi/okay_so_i_matched_with_a_friends_friend_on_tinder/","[]","False"
"15","","","{}","http://www.reddit.com/api/info/","{}","{}","False","","","False","boston1776pit","","","","False","1422333038.0","1422333038.0","","self.askgaybros","0","False","0","True","False","2tt1ip","True","","","","","","{}","[]","t3_2tt1ip","11","","False","http://www.reddit.com/r/askgaybros/comments/2tt1ip/anyone_have_the_soundtrack_info_for_looking/","Unauthenticated reddit sesssion","","False","8","","{}","Just started watching the second season and I'm loving the music they are playing. Just wondering if anyone knows where I can find the songs","&lt;!-- SC_OFF --&gt;&lt;div class=""md""&gt;&lt;p&gt;Just started watching the second season and I&amp;#39;m loving the music they are playing. Just wondering if anyone knows where I can find the songs&lt;/p&gt;
&lt;/div&gt;&lt;!-- SC_ON --&gt;","False","askgaybros","t5_2vgfw","","","Anyone have the soundtrack info for Looking season 2?","8","http://www.reddit.com/r/askgaybros/comments/2tt1ip/anyone_have_the_soundtrack_info_for_looking/","[]","False"
"16","","","{}","http://www.reddit.com/api/info/","{}","{}","False","","","False","absoluterobert","","","","False","1422331787.0","1422331787.0","","self.askgaybros","0","False","0","True","False","2tsz73","True","","","","","","{}","[]","t3_2tsz73","28","","False","http://www.reddit.com/r/askgaybros/comments/2tsz73/i_settled_and_i_feel_disgusted_with_myself_for/","Unauthenticated reddit sesssion","","False","17","","{}","So I'll try to be brief. 

Met (actually reconnected with) a guy around Christmas. We hung out and it turned into a 24+ hour date. We've been hanging out a decent bit since then. We have great sex, hang out and eat dinner together a lot, talk about a lot of serious things, and have met some of each other's friends while doing activities with said friends. The intimacy is top-notch, and we definitely satisfy each other's physical needs.

It wasn't defined for me what our relationship was until tonight, when I straight up asked him. He called it FwB, and I thought we were dating. He's not interested in settling down right now, simply because he's lost a shitton of weight and basically has his pick of the litter in terms of men. 

I'm not as fortunate. Dating's always been very rough for me and I just have never enjoyed it in general (never been in an relationship, almost 30, barely dated 2 or 3 guys), so when I find something, I really try to make it work. 

When I was younger, I had plenty of FwBs and had all sorts of (mostly  mediocre) sex, and feel like I'm over that point in my life. I want more now. I want to spend time with someone, but he still wants to play the field and not be tied down. 

So tonight, because I'm so ridiculous and lonely, I actually agreed to be his FwB, and nothing more. This is unlike me, but...it's all I can get right now. 

Am I wrong for settling for something I don't want in order to feel...decent about myself?","&lt;!-- SC_OFF --&gt;&lt;div class=""md""&gt;&lt;p&gt;So I&amp;#39;ll try to be brief. &lt;/p&gt;

&lt;p&gt;Met (actually reconnected with) a guy around Christmas. We hung out and it turned into a 24+ hour date. We&amp;#39;ve been hanging out a decent bit since then. We have great sex, hang out and eat dinner together a lot, talk about a lot of serious things, and have met some of each other&amp;#39;s friends while doing activities with said friends. The intimacy is top-notch, and we definitely satisfy each other&amp;#39;s physical needs.&lt;/p&gt;

&lt;p&gt;It wasn&amp;#39;t defined for me what our relationship was until tonight, when I straight up asked him. He called it FwB, and I thought we were dating. He&amp;#39;s not interested in settling down right now, simply because he&amp;#39;s lost a shitton of weight and basically has his pick of the litter in terms of men. &lt;/p&gt;

&lt;p&gt;I&amp;#39;m not as fortunate. Dating&amp;#39;s always been very rough for me and I just have never enjoyed it in general (never been in an relationship, almost 30, barely dated 2 or 3 guys), so when I find something, I really try to make it work. &lt;/p&gt;

&lt;p&gt;When I was younger, I had plenty of FwBs and had all sorts of (mostly  mediocre) sex, and feel like I&amp;#39;m over that point in my life. I want more now. I want to spend time with someone, but he still wants to play the field and not be tied down. &lt;/p&gt;

&lt;p&gt;So tonight, because I&amp;#39;m so ridiculous and lonely, I actually agreed to be his FwB, and nothing more. This is unlike me, but...it&amp;#39;s all I can get right now. &lt;/p&gt;

&lt;p&gt;Am I wrong for settling for something I don&amp;#39;t want in order to feel...decent about myself?&lt;/p&gt;
&lt;/div&gt;&lt;!-- SC_ON --&gt;","False","askgaybros","t5_2vgfw","","","I settled, and I feel disgusted with myself for doing so.","17","http://www.reddit.com/r/askgaybros/comments/2tsz73/i_settled_and_i_feel_disgusted_with_myself_for/","[]","False"
"17","","","{}","http://www.reddit.com/api/info/","{}","{}","False","","","False","EquisPe","","","","False","1422330861.0","1422330861.0","","self.askgaybros","0","1422331144.0","0","True","False","2tsxfq","True","","","","","","{}","[]","t3_2tsxfq","3","","False","http://www.reddit.com/r/askgaybros/comments/2tsxfq/being_easily_influenced_and_developing_feelings/","Unauthenticated reddit sesssion","","False","0","","{}","Just trying to get stuff off of my chest. I feel frustrated about how easily I can develop feelings for guys.

For instance, right now I'm crushing on one of my roommates (I know, I know, bad idea) and that all started just because of some remark my friend said. I've thought quite a few of my roommates are cute, but I usually am able to look passed it and just see them as roommates/friends. I had been particularly friendly with aforementioned roommate for various reasons like having things in common (notably being compatriots in a different country). I thought he was good looking, but hadn't developed feelings him or anything thinking he's just another straight roommate, and that I'm passed straight crushes now. 

But one day, my friend came over to my place spontaneously to see me and maybe hang out. We hang out in the kitchen since I was eating, and in walks my roommate. We all talk until he finishes whatever he came into the kitchen to do (I forgot what that was). My friend suggests going over to her place to hang out, so we do. Once there, she tells me that she thinks he's gay and was checking me out the whole time, which made her feel uncomfortable/awkward and want to go elsewhere. In response, I end up feeling a little bit flustered (don't know if this is the right word?), surprised, and intrigued, saying ""Oh really?"" and wanting to get more out of her, but she's the type to bounce between different topics fast, so we quickly move on to something else. She claims to have really good gaydar being around her gay brother and being close to him. I don't know though. 

Thus commenced these past weeks of me doing the whole try to figure out if you're gay maneuver by trying to be more friendly and flirty toward him (bad idea I know, but it just comes out of me) and painstakingly over-analyzing everything he does. I've even had dreams with him in it, it's frustrating! Thinking about it, at worst he's straight and my roommate, at the best he's gay but in the closet/denial (probably due to being a very churchy Christian guy) and I have to go back home in less than a month anyways.

Another example, while hanging out with a different group of friends, my gay friend (taken) says to my other friend (also taken) that he's the only non-gay among the guys but he's the one having ""girl talk"" with a female friend. He responds saying he's ""half gay"" (so I'm guessing bisexual) which left my gay friend and me pretty surprised/shocked/confused. I don't know if he was serious, but we have come to accept it at face value for some reason. 

Some days later when hanging out with the group again (minus ""half gay"" friend), after discussing the whole reveal, my gay friend tells me that basically we should have sex (""half-gay"" friend and I). I respond simply that he has a girlfriend. My friend then says something along the lines of, ""Well, you don't know if she's open! You guys could have sex, and when you wake up in the morning you guys could sing to each other! Like, I loooove yoouuuuu! That'd be cute!""

I give him a look and say, ""That's really dramatic"" with my female friend agreeing with me.

With all that said, after my gay friend's suggestion, the urge to drunkenly make-out with him has suddenly come up. And now every time I'm around him, I can't help but think about what he said.

I don't know what I'm doing writing all this to you guys. I know on an intellectual level that trying to pursue any of these and the like would be a bad idea, but a part of me still acts on the feelings and wants they have fostered. Not anything on a large scale, but in small interactions (like winking more than usual) and in my thoughts. It's not like I haven't been meeting gay guys, but I guess that nothing substantial has come out of that so far (usually getting along well, but hard to coordinate schedules to hang out more often sometimes). These two guys I talked about on the other hand are people I see regularly. Well, enough of this rambling. If anyone has anything to say, feel free to!","&lt;!-- SC_OFF --&gt;&lt;div class=""md""&gt;&lt;p&gt;Just trying to get stuff off of my chest. I feel frustrated about how easily I can develop feelings for guys.&lt;/p&gt;

&lt;p&gt;For instance, right now I&amp;#39;m crushing on one of my roommates (I know, I know, bad idea) and that all started just because of some remark my friend said. I&amp;#39;ve thought quite a few of my roommates are cute, but I usually am able to look passed it and just see them as roommates/friends. I had been particularly friendly with aforementioned roommate for various reasons like having things in common (notably being compatriots in a different country). I thought he was good looking, but hadn&amp;#39;t developed feelings him or anything thinking he&amp;#39;s just another straight roommate, and that I&amp;#39;m passed straight crushes now. &lt;/p&gt;

&lt;p&gt;But one day, my friend came over to my place spontaneously to see me and maybe hang out. We hang out in the kitchen since I was eating, and in walks my roommate. We all talk until he finishes whatever he came into the kitchen to do (I forgot what that was). My friend suggests going over to her place to hang out, so we do. Once there, she tells me that she thinks he&amp;#39;s gay and was checking me out the whole time, which made her feel uncomfortable/awkward and want to go elsewhere. In response, I end up feeling a little bit flustered (don&amp;#39;t know if this is the right word?), surprised, and intrigued, saying &amp;quot;Oh really?&amp;quot; and wanting to get more out of her, but she&amp;#39;s the type to bounce between different topics fast, so we quickly move on to something else. She claims to have really good gaydar being around her gay brother and being close to him. I don&amp;#39;t know though. &lt;/p&gt;

&lt;p&gt;Thus commenced these past weeks of me doing the whole try to figure out if you&amp;#39;re gay maneuver by trying to be more friendly and flirty toward him (bad idea I know, but it just comes out of me) and painstakingly over-analyzing everything he does. I&amp;#39;ve even had dreams with him in it, it&amp;#39;s frustrating! Thinking about it, at worst he&amp;#39;s straight and my roommate, at the best he&amp;#39;s gay but in the closet/denial (probably due to being a very churchy Christian guy) and I have to go back home in less than a month anyways.&lt;/p&gt;

&lt;p&gt;Another example, while hanging out with a different group of friends, my gay friend (taken) says to my other friend (also taken) that he&amp;#39;s the only non-gay among the guys but he&amp;#39;s the one having &amp;quot;girl talk&amp;quot; with a female friend. He responds saying he&amp;#39;s &amp;quot;half gay&amp;quot; (so I&amp;#39;m guessing bisexual) which left my gay friend and me pretty surprised/shocked/confused. I don&amp;#39;t know if he was serious, but we have come to accept it at face value for some reason. &lt;/p&gt;

&lt;p&gt;Some days later when hanging out with the group again (minus &amp;quot;half gay&amp;quot; friend), after discussing the whole reveal, my gay friend tells me that basically we should have sex (&amp;quot;half-gay&amp;quot; friend and I). I respond simply that he has a girlfriend. My friend then says something along the lines of, &amp;quot;Well, you don&amp;#39;t know if she&amp;#39;s open! You guys could have sex, and when you wake up in the morning you guys could sing to each other! Like, I loooove yoouuuuu! That&amp;#39;d be cute!&amp;quot;&lt;/p&gt;

&lt;p&gt;I give him a look and say, &amp;quot;That&amp;#39;s really dramatic&amp;quot; with my female friend agreeing with me.&lt;/p&gt;

&lt;p&gt;With all that said, after my gay friend&amp;#39;s suggestion, the urge to drunkenly make-out with him has suddenly come up. And now every time I&amp;#39;m around him, I can&amp;#39;t help but think about what he said.&lt;/p&gt;

&lt;p&gt;I don&amp;#39;t know what I&amp;#39;m doing writing all this to you guys. I know on an intellectual level that trying to pursue any of these and the like would be a bad idea, but a part of me still acts on the feelings and wants they have fostered. Not anything on a large scale, but in small interactions (like winking more than usual) and in my thoughts. It&amp;#39;s not like I haven&amp;#39;t been meeting gay guys, but I guess that nothing substantial has come out of that so far (usually getting along well, but hard to coordinate schedules to hang out more often sometimes). These two guys I talked about on the other hand are people I see regularly. Well, enough of this rambling. If anyone has anything to say, feel free to!&lt;/p&gt;
&lt;/div&gt;&lt;!-- SC_ON --&gt;","False","askgaybros","t5_2vgfw","","","Being easily influenced and developing feelings for guys way too easily","0","http://www.reddit.com/r/askgaybros/comments/2tsxfq/being_easily_influenced_and_developing_feelings/","[]","False"
"18","","","{}","http://www.reddit.com/api/info/","{}","{}","False","","","False","SoMuchLeftToGive","","","","False","1422330373.0","1422330373.0","","self.askgaybros","0","False","0","True","False","2tswic","True","","","","","","{}","[]","t3_2tswic","6","","False","http://www.reddit.com/r/askgaybros/comments/2tswic/chatroulette_sites/","Unauthenticated reddit sesssion","","False","2","","{}","I get off on showing off and watching other guys jackoff. Manroulette was fun but it seems like it's down now. Does anyone know of good alternatives?","&lt;!-- SC_OFF --&gt;&lt;div class=""md""&gt;&lt;p&gt;I get off on showing off and watching other guys jackoff. Manroulette was fun but it seems like it&amp;#39;s down now. Does anyone know of good alternatives?&lt;/p&gt;
&lt;/div&gt;&lt;!-- SC_ON --&gt;","False","askgaybros","t5_2vgfw","","","Chatroulette sites","2","http://www.reddit.com/r/askgaybros/comments/2tswic/chatroulette_sites/","[]","False"
"19","","","{}","http://www.reddit.com/api/info/","{}","{}","False","","","False","ahoym80z","","","","False","1422327510.0","1422327510.0","","self.askgaybros","0","False","0","True","False","2tsqnq","True","","","","","","{}","[]","t3_2tsqnq","16","","False","http://www.reddit.com/r/askgaybros/comments/2tsqnq/why_are_you_in_an_open_relationship/","Unauthenticated reddit sesssion","","False","3","","{}","I was talking to my friend the other day, and it turns out neither of us could think of one gay (male) couple that we know who is in a monogamous relationship, which was surprising to me.

He was of the opinion that he thinks he couldn't go back to a monogamous relationship, but it's something I still think I would never feel comfortable with, after having tried two times.

So, enlighten me fellas! Why is open better for you? What benefits has  it brought to your relationship? Has it brought you closer emotionally for any reason? Or is it all just about the sex?

I'm not judging at all and genuinely interested in what you guys have to say! :)","&lt;!-- SC_OFF --&gt;&lt;div class=""md""&gt;&lt;p&gt;I was talking to my friend the other day, and it turns out neither of us could think of one gay (male) couple that we know who is in a monogamous relationship, which was surprising to me.&lt;/p&gt;

&lt;p&gt;He was of the opinion that he thinks he couldn&amp;#39;t go back to a monogamous relationship, but it&amp;#39;s something I still think I would never feel comfortable with, after having tried two times.&lt;/p&gt;

&lt;p&gt;So, enlighten me fellas! Why is open better for you? What benefits has  it brought to your relationship? Has it brought you closer emotionally for any reason? Or is it all just about the sex?&lt;/p&gt;

&lt;p&gt;I&amp;#39;m not judging at all and genuinely interested in what you guys have to say! :)&lt;/p&gt;
&lt;/div&gt;&lt;!-- SC_ON --&gt;","False","askgaybros","t5_2vgfw","","","Why are you in an open relationship?","3","http://www.reddit.com/r/askgaybros/comments/2tsqnq/why_are_you_in_an_open_relationship/","[]","False"
"20","","","{}","http://www.reddit.com/api/info/","{}","{}","False","","","False","ardemash","","","","False","1422325584.0","1422325584.0","","self.askgaybros","0","False","0","True","False","2tsmpr","True","","","","","","{}","[]","t3_2tsmpr","29","","False","http://www.reddit.com/r/askgaybros/comments/2tsmpr/this_is_embarrassing_but_im_having_issues_getting/","Unauthenticated reddit sesssion","","False","15","","{}","I'm 25 and I don't know, but lately I just can't get it up. Even when I masturbate, it takes a while and I can usually only stay erect for 30 seconds or so before losing it. I almost always ejaculate before getting hard while jerking off.

I also have issues getting it up when I'm seeing other guys. I don't know what's wrong with me. I exercise regularly and I'm not obese, so I don't know what the issue is. ","&lt;!-- SC_OFF --&gt;&lt;div class=""md""&gt;&lt;p&gt;I&amp;#39;m 25 and I don&amp;#39;t know, but lately I just can&amp;#39;t get it up. Even when I masturbate, it takes a while and I can usually only stay erect for 30 seconds or so before losing it. I almost always ejaculate before getting hard while jerking off.&lt;/p&gt;

&lt;p&gt;I also have issues getting it up when I&amp;#39;m seeing other guys. I don&amp;#39;t know what&amp;#39;s wrong with me. I exercise regularly and I&amp;#39;m not obese, so I don&amp;#39;t know what the issue is. &lt;/p&gt;
&lt;/div&gt;&lt;!-- SC_ON --&gt;","False","askgaybros","t5_2vgfw","","","This is embarrassing, but I'm having issues... getting it up.","15","http://www.reddit.com/r/askgaybros/comments/2tsmpr/this_is_embarrassing_but_im_having_issues_getting/","[]","False"
"21","","","{}","http://www.reddit.com/api/info/","{}","{}","False","","","False","BumBumiLikeBum","","","","False","1422325520.0","1422325520.0","","self.askgaybros","0","False","0","True","False","2tsmkp","True","","","","","","{}","[]","t3_2tsmkp","7","","False","http://www.reddit.com/r/askgaybros/comments/2tsmkp/anybody_know_any_good_books_on_queer_theory/","Unauthenticated reddit sesssion","","False","8","","{}","I've skimmed a few articles and I'm intrigued by the positions put forward by the Theory. Have any of you guys (and girls) delved into feminist and queer theory?","&lt;!-- SC_OFF --&gt;&lt;div class=""md""&gt;&lt;p&gt;I&amp;#39;ve skimmed a few articles and I&amp;#39;m intrigued by the positions put forward by the Theory. Have any of you guys (and girls) delved into feminist and queer theory?&lt;/p&gt;
&lt;/div&gt;&lt;!-- SC_ON --&gt;","False","askgaybros","t5_2vgfw","","","Anybody know any good books on Queer Theory?","8","http://www.reddit.com/r/askgaybros/comments/2tsmkp/anybody_know_any_good_books_on_queer_theory/","[]","False"
"22","","","{}","http://www.reddit.com/api/info/","{}","{}","False","","","False","rubbersrobber","","","","False","1422323323.0","1422323323.0","","self.askgaybros","0","1422323601.0","0","True","False","2tshxg","True","","","","","","{}","[]","t3_2tshxg","27","","False","http://www.reddit.com/r/askgaybros/comments/2tshxg/i_got_called_a_daddy_today_feel_weird_about_it/","Unauthenticated reddit sesssion","","False","17","","{}","Im 20 years old and this kid who is very interested in me called me a daddy and im so freaked out. I always felt guys calling older guys daddy was super weird and im only 20 and im being called that. How would you guys deal with someone calling you daddy.","&lt;!-- SC_OFF --&gt;&lt;div class=""md""&gt;&lt;p&gt;Im 20 years old and this kid who is very interested in me called me a daddy and im so freaked out. I always felt guys calling older guys daddy was super weird and im only 20 and im being called that. How would you guys deal with someone calling you daddy.&lt;/p&gt;
&lt;/div&gt;&lt;!-- SC_ON --&gt;","False","askgaybros","t5_2vgfw","","","I got called a daddy today. Feel weird about it.","17","http://www.reddit.com/r/askgaybros/comments/2tshxg/i_got_called_a_daddy_today_feel_weird_about_it/","[]","False"
