"","_comment_sort","_comments","_comments_by_id","_info_url","_orphaned","_params","_replaced_more","_underscore_names","approved_by","archived","author","author_flair_css_class","author_flair_text","banned_by","clicked","created","created_utc","distinguished","domain","downs","edited","gilded","has_fetched","hidden","id","is_self","json_dict","likes","link_flair_css_class","link_flair_text","media","media_embed","mod_reports","name","num_comments","num_reports","over_18","permalink","reddit_session","report_reasons","saved","score","secure_media","secure_media_embed","selftext","selftext_html","stickied","subreddit","subreddit_id","suggested_sort","thumbnail","title","ups","url","user_reports","visited"
"21","","","{}","http://www.reddit.com/api/info/","{}","{}","False","","","False","anxious545","","","","False","1426289356.0","1426285756.0","","self.askgaybros","0","False","0","True","False","2yykh8","True","","","","","","{}","[]","t3_2yykh8","3","","False","http://www.reddit.com/r/askgaybros/comments/2yykh8/i_need_some_advice/","Unauthenticated reddit sesssion","","False","2","","{}","Hey bros. I'm a lurker on my main account, but this is my first post here. I could use some advice. Apologies for the long post.

I met this guy about a month ago. We had been talking off and on on Grindr for a few months, and just before Valentine's Day we decided to meet in person for the first time. We clicked almost instantly, and things were awesome.

Over the course of the next month, we moved quickly (too quickly). This is his first serious relationship. I've been in a long term relationship, but this time felt different. It felt like this guy was the one. I'm not sure how, but it did. I met his friends, we hung out a lot, and just got to know each other better. He opened up to me a bit, and I opened up a lot, something I probably shouldn't have done, but I couldn't control it. I felt like I could tell him everything, and it felt good to open up. I told him I was seriously insecure about some things, and he said that was ok. I believe (believed?) him.

Looking back on it, I may have come off as clingy/needy, which is new to me - I've never acted this way before, at least to my knowledge. I have fallen hard for this guy, and he fell for me too. We've joked about how crazy we were.

A month has gone by, and I haven't seen him in a week. Not a big deal, we're both busy. But earlier this week, he got some bad news. I asked if he wanted to hang out, and he said he wanted to be alone. I told him I understood and let him know I was there for him in any way he needed.

We texted briefly the next day, and he said he was ok. However, he stopped responding to me. I asked him a few hours later if he was doing anything later in the week, and no response. I text him the next morning wishing him a good day, and again, no response. That was the last time I tried to contact him.

I'm worried about him. I don't want to call it quits because if he's really going through some problems, I want to be there for him. But I'm also worried I might be wasting my time.

If any of you guys can be of help, I'd very much appreciate it. I'm just a wreck right now, I feel so stupid for opening up to someone only to get hurt, and I may be overthinking this, but what if I'm not?

edit: I should add that because of my insecurity, I have checked a couple of times to see if he's logged into Grindr, and he hasn't, not since we started seeing each other. I just don't know what's up and in case he never talks to me again, I might still check occasionally, and I know it's crazy but I can't help it.","&lt;!-- SC_OFF --&gt;&lt;div class=""md""&gt;&lt;p&gt;Hey bros. I&amp;#39;m a lurker on my main account, but this is my first post here. I could use some advice. Apologies for the long post.&lt;/p&gt;

&lt;p&gt;I met this guy about a month ago. We had been talking off and on on Grindr for a few months, and just before Valentine&amp;#39;s Day we decided to meet in person for the first time. We clicked almost instantly, and things were awesome.&lt;/p&gt;

&lt;p&gt;Over the course of the next month, we moved quickly (too quickly). This is his first serious relationship. I&amp;#39;ve been in a long term relationship, but this time felt different. It felt like this guy was the one. I&amp;#39;m not sure how, but it did. I met his friends, we hung out a lot, and just got to know each other better. He opened up to me a bit, and I opened up a lot, something I probably shouldn&amp;#39;t have done, but I couldn&amp;#39;t control it. I felt like I could tell him everything, and it felt good to open up. I told him I was seriously insecure about some things, and he said that was ok. I believe (believed?) him.&lt;/p&gt;

&lt;p&gt;Looking back on it, I may have come off as clingy/needy, which is new to me - I&amp;#39;ve never acted this way before, at least to my knowledge. I have fallen hard for this guy, and he fell for me too. We&amp;#39;ve joked about how crazy we were.&lt;/p&gt;

&lt;p&gt;A month has gone by, and I haven&amp;#39;t seen him in a week. Not a big deal, we&amp;#39;re both busy. But earlier this week, he got some bad news. I asked if he wanted to hang out, and he said he wanted to be alone. I told him I understood and let him know I was there for him in any way he needed.&lt;/p&gt;

&lt;p&gt;We texted briefly the next day, and he said he was ok. However, he stopped responding to me. I asked him a few hours later if he was doing anything later in the week, and no response. I text him the next morning wishing him a good day, and again, no response. That was the last time I tried to contact him.&lt;/p&gt;

&lt;p&gt;I&amp;#39;m worried about him. I don&amp;#39;t want to call it quits because if he&amp;#39;s really going through some problems, I want to be there for him. But I&amp;#39;m also worried I might be wasting my time.&lt;/p&gt;

&lt;p&gt;If any of you guys can be of help, I&amp;#39;d very much appreciate it. I&amp;#39;m just a wreck right now, I feel so stupid for opening up to someone only to get hurt, and I may be overthinking this, but what if I&amp;#39;m not?&lt;/p&gt;

&lt;p&gt;edit: I should add that because of my insecurity, I have checked a couple of times to see if he&amp;#39;s logged into Grindr, and he hasn&amp;#39;t, not since we started seeing each other. I just don&amp;#39;t know what&amp;#39;s up and in case he never talks to me again, I might still check occasionally, and I know it&amp;#39;s crazy but I can&amp;#39;t help it.&lt;/p&gt;
&lt;/div&gt;&lt;!-- SC_ON --&gt;","False","askgaybros","t5_2vgfw","","","I need some advice.","2","http://www.reddit.com/r/askgaybros/comments/2yykh8/i_need_some_advice/","[]","False"
"22","","","{}","http://www.reddit.com/api/info/","{}","{}","False","","","False","mab1981","","","","False","1426288497.0","1426284897.0","","self.askgaybros","0","False","0","True","False","2yyir6","True","","","","","","{}","[]","t3_2yyir6","3","","False","http://www.reddit.com/r/askgaybros/comments/2yyir6/how_to_go_about_finding_international_work/","Unauthenticated reddit sesssion","","False","3","","{}","Hey bros!  I'm on the verge of finishing my M.Sc. in Epidemiology, and I'd like to get the hell outta Dodge (Ottawa) once my contract at the research institute that I work is done.  I'd love to do some work abroad in remote and developing countries, whether that be more policy level work (I have 8 years of experience in public policy work) or field epi/research. 

Do any of you guys have experience doing this kind of stuff (not necessarily in my field)?  How did you get into it?  Where did you start looking?","&lt;!-- SC_OFF --&gt;&lt;div class=""md""&gt;&lt;p&gt;Hey bros!  I&amp;#39;m on the verge of finishing my M.Sc. in Epidemiology, and I&amp;#39;d like to get the hell outta Dodge (Ottawa) once my contract at the research institute that I work is done.  I&amp;#39;d love to do some work abroad in remote and developing countries, whether that be more policy level work (I have 8 years of experience in public policy work) or field epi/research. &lt;/p&gt;

&lt;p&gt;Do any of you guys have experience doing this kind of stuff (not necessarily in my field)?  How did you get into it?  Where did you start looking?&lt;/p&gt;
&lt;/div&gt;&lt;!-- SC_ON --&gt;","False","askgaybros","t5_2vgfw","","","How to go about finding international work?","3","http://www.reddit.com/r/askgaybros/comments/2yyir6/how_to_go_about_finding_international_work/","[]","False"
"23","","","{}","http://www.reddit.com/api/info/","{}","{}","False","","","False","Laika_Come_Home","","","","False","1426287232.0","1426283632.0","","self.askgaybros","0","False","0","True","False","2yyg3b","True","","","","","","{}","[]","t3_2yyg3b","16","","False","http://www.reddit.com/r/askgaybros/comments/2yyg3b/so_guys_how_did_you_meet_your_bfhusband_and_how/","Unauthenticated reddit sesssion","","False","6","","{}","","","False","askgaybros","t5_2vgfw","","","So, guys, how did you meet your BF/husband? (And how long have you been together?)","6","http://www.reddit.com/r/askgaybros/comments/2yyg3b/so_guys_how_did_you_meet_your_bfhusband_and_how/","[]","False"
"24","","","{}","http://www.reddit.com/api/info/","{}","{}","False","","","False","CaringBigBrother","","","","False","1426287181.0","1426283581.0","","self.askgaybros","0","False","0","True","False","2yyfz5","True","","","","","","{}","[]","t3_2yyfz5","17","","False","http://www.reddit.com/r/askgaybros/comments/2yyfz5/my_brother_is_going_to_come_out_to_me_i_dont_want/","Unauthenticated reddit sesssion","","False","11","","{}","Hi world. So my little brother has come out to almost all of my family, our sisters (younger) and our mother, I am not sure about my dad yet but at this point we all know BUT he does not know we all know out of respect. Its his choice when and how to do it and we don't want to make him feel anything other than support. 

That being said, I know he is saving me for last, Im the older brother, the one that has always given him lady advice (wrong tree I guess, just a joke to lighten the mood) and has had my fair share of ladies throughout the years. I am his big brother and I know I have not alway been here as I went to college and really didnt come home for about 8 years (other family issues). 

I am worried that I have no clue how to react. Of course I support him and do not care what so ever about his life in regards to sexual preference but last time someone came out to me was 10 years ago, I was in HS, and it was the most awkward and poorly timed thing he could have done. I know there is no way that would be repeated (especially here as the friend came out by asking me to come over since his mom wasnt home and he wanted to fool around, caused quite a rift between us and we went from close friends to not talking for 8+ years) but I also don't want to do anything wrong. 

For those on this thread that have come out to someone you looked up to and were nervous about (dads, big brothers, scary mothers, etc.) is there any advice you can give me to make sure I dont muff this up. I love this little dork of a brother of mine and I know he deserves the best as he has had a rough life (we adopted him after years of abuse that he still has memories of even tho he was very young). 

Thank you very much.","&lt;!-- SC_OFF --&gt;&lt;div class=""md""&gt;&lt;p&gt;Hi world. So my little brother has come out to almost all of my family, our sisters (younger) and our mother, I am not sure about my dad yet but at this point we all know BUT he does not know we all know out of respect. Its his choice when and how to do it and we don&amp;#39;t want to make him feel anything other than support. &lt;/p&gt;

&lt;p&gt;That being said, I know he is saving me for last, Im the older brother, the one that has always given him lady advice (wrong tree I guess, just a joke to lighten the mood) and has had my fair share of ladies throughout the years. I am his big brother and I know I have not alway been here as I went to college and really didnt come home for about 8 years (other family issues). &lt;/p&gt;

&lt;p&gt;I am worried that I have no clue how to react. Of course I support him and do not care what so ever about his life in regards to sexual preference but last time someone came out to me was 10 years ago, I was in HS, and it was the most awkward and poorly timed thing he could have done. I know there is no way that would be repeated (especially here as the friend came out by asking me to come over since his mom wasnt home and he wanted to fool around, caused quite a rift between us and we went from close friends to not talking for 8+ years) but I also don&amp;#39;t want to do anything wrong. &lt;/p&gt;

&lt;p&gt;For those on this thread that have come out to someone you looked up to and were nervous about (dads, big brothers, scary mothers, etc.) is there any advice you can give me to make sure I dont muff this up. I love this little dork of a brother of mine and I know he deserves the best as he has had a rough life (we adopted him after years of abuse that he still has memories of even tho he was very young). &lt;/p&gt;

&lt;p&gt;Thank you very much.&lt;/p&gt;
&lt;/div&gt;&lt;!-- SC_ON --&gt;","False","askgaybros","t5_2vgfw","","","My brother is going to come out to me, I dont want to do something wrong","11","http://www.reddit.com/r/askgaybros/comments/2yyfz5/my_brother_is_going_to_come_out_to_me_i_dont_want/","[]","False"
"25","","","{}","http://www.reddit.com/api/info/","{}","{}","False","","","False","HankMardewkus","","","","False","1426284880.0","1426281280.0","","self.askgaybros","0","False","0","True","False","2yyb1f","True","","","","","","{}","[]","t3_2yyb1f","25","","False","http://www.reddit.com/r/askgaybros/comments/2yyb1f/bibro_in_need_of_advice/","Unauthenticated reddit sesssion","","False","3","","{}","Hey gaybros, 

So last year I broke up with my gf of 2 years. After dating her I was experimenting with a few guys at college. It's been nearly I year since I have done anything with another guy. I have since graduated from college, and am back at parents' place until I go back to school in the Fall. Now that I have become completely accepting of my sexuality I find myself craving sex with a guy. I like women more (probably 60/40) but I know I want to try actually dating a guy. Unfortunately, my parents live in a really small town. My odds of finding someone here is so very slim. 

So do I wait until I move away to the larger city my new college is in? I know by then I will be a hot penis/ass craving mess. Is there any point to me trying here? ","&lt;!-- SC_OFF --&gt;&lt;div class=""md""&gt;&lt;p&gt;Hey gaybros, &lt;/p&gt;

&lt;p&gt;So last year I broke up with my gf of 2 years. After dating her I was experimenting with a few guys at college. It&amp;#39;s been nearly I year since I have done anything with another guy. I have since graduated from college, and am back at parents&amp;#39; place until I go back to school in the Fall. Now that I have become completely accepting of my sexuality I find myself craving sex with a guy. I like women more (probably 60/40) but I know I want to try actually dating a guy. Unfortunately, my parents live in a really small town. My odds of finding someone here is so very slim. &lt;/p&gt;

&lt;p&gt;So do I wait until I move away to the larger city my new college is in? I know by then I will be a hot penis/ass craving mess. Is there any point to me trying here? &lt;/p&gt;
&lt;/div&gt;&lt;!-- SC_ON --&gt;","False","askgaybros","t5_2vgfw","","","Bibro in need of advice","3","http://www.reddit.com/r/askgaybros/comments/2yyb1f/bibro_in_need_of_advice/","[]","False"
"26","","","{}","http://www.reddit.com/api/info/","{}","{}","False","","","False","Lycanthrowrug","","","","False","1426280146.0","1426276546.0","","self.askgaybros","0","False","0","True","False","2yy0kl","True","","","","","","{}","[]","t3_2yy0kl","28","","False","http://www.reddit.com/r/askgaybros/comments/2yy0kl/question_for_college_students/","Unauthenticated reddit sesssion","","False","15","","{}","My university is currently conducting an LGBT history project, including interviewing me and other alums and making these interviews part of the school's archive. I was talking to the person running the project today, and he asked me if I had any ideas about what I might want to see happen as a result of this project. Since the school already has an LGBT Center, student groups, and an alumni network, nothing immediately came to mind, so I thought I'd pose the question here: For those of you currently in college (or maybe those heading there), how could the resources, stories, and people brought together by such a project be of value to you?","&lt;!-- SC_OFF --&gt;&lt;div class=""md""&gt;&lt;p&gt;My university is currently conducting an LGBT history project, including interviewing me and other alums and making these interviews part of the school&amp;#39;s archive. I was talking to the person running the project today, and he asked me if I had any ideas about what I might want to see happen as a result of this project. Since the school already has an LGBT Center, student groups, and an alumni network, nothing immediately came to mind, so I thought I&amp;#39;d pose the question here: For those of you currently in college (or maybe those heading there), how could the resources, stories, and people brought together by such a project be of value to you?&lt;/p&gt;
&lt;/div&gt;&lt;!-- SC_ON --&gt;","False","askgaybros","t5_2vgfw","","","Question for college students","15","http://www.reddit.com/r/askgaybros/comments/2yy0kl/question_for_college_students/","[]","False"
"27","","","{}","http://www.reddit.com/api/info/","{}","{}","False","","","False","xgay","","","","False","1426278701.0","1426275101.0","","self.askgaybros","0","False","0","True","False","2yxxed","True","","","","","","{}","[]","t3_2yxxed","10","","False","http://www.reddit.com/r/askgaybros/comments/2yxxed/trouble_fulfilling_sexual_desires/","Unauthenticated reddit sesssion","","False","4","","{}","I am a 21-year-old out gay college student with somewhat unorthodox sexual interests. Basically, I've always had fantasies about being a kinky jail guard or warden and 'abusing' older bears/bear-ish men. I get really turned on by police/prison gear and most of my desires seem to involve dominating other men and role playing.

I've had a difficult time finding outlets to express these desires. I meet a lot of men who float my boat physically but I haven't been able to find one who is willing to explore these fantasies. I coincidentally look like a twink, and most of the hairy older guys I like have told me that they're only interested in topping and don't view young skinny guys as being dominant. 

Nonetheless, I've had some vanilla experiences that have been fun and interesting, but I have never cummed or orgasmed during sex and I'm starting to think that the lack of role playing is the culprit. It doesn't help that I have no disposable income at university and can't buy any gear or pay for premium hookup site subscriptions (i.e. Recon). 

If anyone has suggestions as to how I could find ways to express these desires I would greatly appreciate it.","&lt;!-- SC_OFF --&gt;&lt;div class=""md""&gt;&lt;p&gt;I am a 21-year-old out gay college student with somewhat unorthodox sexual interests. Basically, I&amp;#39;ve always had fantasies about being a kinky jail guard or warden and &amp;#39;abusing&amp;#39; older bears/bear-ish men. I get really turned on by police/prison gear and most of my desires seem to involve dominating other men and role playing.&lt;/p&gt;

&lt;p&gt;I&amp;#39;ve had a difficult time finding outlets to express these desires. I meet a lot of men who float my boat physically but I haven&amp;#39;t been able to find one who is willing to explore these fantasies. I coincidentally look like a twink, and most of the hairy older guys I like have told me that they&amp;#39;re only interested in topping and don&amp;#39;t view young skinny guys as being dominant. &lt;/p&gt;

&lt;p&gt;Nonetheless, I&amp;#39;ve had some vanilla experiences that have been fun and interesting, but I have never cummed or orgasmed during sex and I&amp;#39;m starting to think that the lack of role playing is the culprit. It doesn&amp;#39;t help that I have no disposable income at university and can&amp;#39;t buy any gear or pay for premium hookup site subscriptions (i.e. Recon). &lt;/p&gt;

&lt;p&gt;If anyone has suggestions as to how I could find ways to express these desires I would greatly appreciate it.&lt;/p&gt;
&lt;/div&gt;&lt;!-- SC_ON --&gt;","False","askgaybros","t5_2vgfw","","","Trouble Fulfilling Sexual Desires","4","http://www.reddit.com/r/askgaybros/comments/2yxxed/trouble_fulfilling_sexual_desires/","[]","False"
