"","_comment_sort","_comments","_comments_by_id","_info_url","_orphaned","_params","_replaced_more","_underscore_names","approved_by","archived","author","author_flair_css_class","author_flair_text","banned_by","clicked","created","created_utc","distinguished","domain","downs","edited","gilded","has_fetched","hidden","id","is_self","json_dict","likes","link_flair_css_class","link_flair_text","media","media_embed","mod_reports","name","num_comments","num_reports","over_18","permalink","reddit_session","report_reasons","saved","score","secure_media","secure_media_embed","selftext","selftext_html","stickied","subreddit","subreddit_id","suggested_sort","thumbnail","title","ups","url","user_reports","visited"
"0","","","{}","http://www.reddit.com/api/info/","{}","{}","False","","","False","_fallingforhim","","","","False","1415544697.0","1415544697.0","","self.askgaybros","0","False","0","True","False","2lriel","True","","","","","","{}","[]","t3_2lriel","18","","False","http://www.reddit.com/r/askgaybros/comments/2lriel/i_have_been_sleeping_around_so_much_that_i_forgot/","Unauthenticated reddit sesssion","","False","31","","{}","After a long episode of sleeping around with guys I finally decided to stop fooling around and settle down, maybe for something more permanent.

I have been meeting guys for dates off Okcupid and some other sites/apps that are not hookup oriented. I find it hard to sustain a conversation with guys; I feel that I have lost the ability to connect with guys without physical action.

When I hook up with guys, I usually meet them at a public place, like a cafe, talk a bit and if we like each other's vibes we get down to business. I would start with cuddling and the physical closeness just helps with making myself and the other guy comfortable with each other.

I am such a failure at what today's society deem as a proper date, and I feel bad. They say you should talk about common interests and personal experiences, but everyone is so different. It's not like an interview where everything is formulaic and can be prepared.

Some say that I just haven't met the right person yet and when I do, conversations will flow easily and both of us would know. Some say that dating is just a numbers game and I just have to wade though a lot of guys until I find someone I can connect with.

Advice? How do I engage with guys outside of a sexual context? I need someone to teach me how to date.

Thanks.","&lt;!-- SC_OFF --&gt;&lt;div class=""md""&gt;&lt;p&gt;After a long episode of sleeping around with guys I finally decided to stop fooling around and settle down, maybe for something more permanent.&lt;/p&gt;

&lt;p&gt;I have been meeting guys for dates off Okcupid and some other sites/apps that are not hookup oriented. I find it hard to sustain a conversation with guys; I feel that I have lost the ability to connect with guys without physical action.&lt;/p&gt;

&lt;p&gt;When I hook up with guys, I usually meet them at a public place, like a cafe, talk a bit and if we like each other&amp;#39;s vibes we get down to business. I would start with cuddling and the physical closeness just helps with making myself and the other guy comfortable with each other.&lt;/p&gt;

&lt;p&gt;I am such a failure at what today&amp;#39;s society deem as a proper date, and I feel bad. They say you should talk about common interests and personal experiences, but everyone is so different. It&amp;#39;s not like an interview where everything is formulaic and can be prepared.&lt;/p&gt;

&lt;p&gt;Some say that I just haven&amp;#39;t met the right person yet and when I do, conversations will flow easily and both of us would know. Some say that dating is just a numbers game and I just have to wade though a lot of guys until I find someone I can connect with.&lt;/p&gt;

&lt;p&gt;Advice? How do I engage with guys outside of a sexual context? I need someone to teach me how to date.&lt;/p&gt;

&lt;p&gt;Thanks.&lt;/p&gt;
&lt;/div&gt;&lt;!-- SC_ON --&gt;","False","askgaybros","t5_2vgfw","","","I have been sleeping around so much that I forgot how to make connections and hold conversations during proper dates with gay guys. Help!","31","http://www.reddit.com/r/askgaybros/comments/2lriel/i_have_been_sleeping_around_so_much_that_i_forgot/","[]","False"
"1","","","{}","http://www.reddit.com/api/info/","{}","{}","False","","","False","fappingisgreat","","","","False","1415541799.0","1415541799.0","","self.askgaybros","0","False","0","True","False","2lrf6n","True","","","","","","{}","[]","t3_2lrf6n","20","","False","http://www.reddit.com/r/askgaybros/comments/2lrf6n/guys_that_use_female_names_to_classify_male_body/","Unauthenticated reddit sesssion","","False","36","","{}","That just gets on my nerves. Like guys that will call an asshole a pussy or a cunt. Does this annoy anybody else?","&lt;!-- SC_OFF --&gt;&lt;div class=""md""&gt;&lt;p&gt;That just gets on my nerves. Like guys that will call an asshole a pussy or a cunt. Does this annoy anybody else?&lt;/p&gt;
&lt;/div&gt;&lt;!-- SC_ON --&gt;","False","askgaybros","t5_2vgfw","","","Guys That Use Female Names To Classify Male Body Parts","36","http://www.reddit.com/r/askgaybros/comments/2lrf6n/guys_that_use_female_names_to_classify_male_body/","[]","False"
"2","","","{}","http://www.reddit.com/api/info/","{}","{}","False","","","False","Fonzoal","","","","False","1415540720.0","1415540720.0","","self.askgaybros","0","1415544386.0","0","True","False","2lre33","True","","","","","","{}","[]","t3_2lre33","9","","False","http://www.reddit.com/r/askgaybros/comments/2lre33/i_21m_think_i_fell_too_hard_for_a_guy_20m_dealing/","Unauthenticated reddit sesssion","","False","9","","{}","Hi everyone, long story ahead. I appreciate you in advance for reading.

Last October, I started coming out to my friends/family and becoming comfortable with being gay. I browsed all the apps/dating sites/etc until this past June I came across a guy I had seen around school and was in the music department with me. We talked and soon met in person. We spent the whole summer talking and going on amazing dates, anticipating school starting so we could be together more. He was perfect in every way: handsome, amazing smile, very mature, intelligent, ambitious, and most of all, he was accepting of me in a way that nobody else had ever tried to be. This is my first quasi-relationship and I was getting exited about the possibilities and being there to support him and having him there to support me. Things were going great.

School started and things were still going well. I'm a senior and he's a junior. We're both very busy and have full schedules. I have two jobs and take a full class load along with a student teaching placement and being president of my student organization for music education students. Needless to say, time is a hard thing to find, but I made time to see him whenever I could and we talked all the time. A couple weeks in, I felt the disconnect start to come. He was becoming too overwhelmed with work/exams. We celebrated his birthday together and I met his parents. Then things went slightly downhill but I held on to the hope that we would be okay. Then he asked to talk in early October and said he didn't feel ready for a relationship (we weren't formally dating at the time yet). He's been dealing with depression for a while and actually was hospitalized for it over the summer. He says he doesn't want anyone else caught up in his stuff and that he doesn't think he can handle the romantic/emotional part of a relationship right now nor does he want it. He instead wants to be friends.

Needless to say, I've been completely heartbroken. Not just because of the breakup, but because I don't want him to think that he's undeserving of love/affection because he's dealing with depression. I've been dealing with depression for my whole life. Every aspect of my life is a mess and it's led to my horrible depression and he was the one good thing I had. We still talk but it's always just me asking how he's doing/feeling. There have been a couple times where I ask a lot of questions trying to find out the reason why things had to end. I keep blaming myself and he keeps insisting that I did nothing wrong and that it's just his feelings that changed and he only sees me as a friend. I'm so hurt because I see him as more than that and I was so hopeful for something and once again, my hopes got destroyed. I want to be more than friends, even if that doesn't mean boyfriends, necessarily. I can't pretend like I don't know him on that level. I can't pretend like his smile doesn't light up my heart or that I could stare into his eyes forever. I can't act like I don't find him attractive and miss his little quirks. Calling him my friend feels like a lie but I can't cut him off because 1) he needs someone to be there for him while he goes through these things and I said I would be there for him and 2)I don't want to lose contact with him over something he can't control. It's not like he did anything to me (ie cheat on me, etc.) that gives me a reason to cut him out of my life. But I want him to be more than just my friend. I don't care as much about losing the romantic aspect as I care about losing him. The romantic part was just an added bonus of knowing him.

Nothing about depression/suicide drives me away from him. I just want to be there for him and I want the relationship we have to only make him feel better and lift him up, not stress him out. I can't focus on anything. I think about him and how badly I miss him all the time. Everyone is telling me to cut him out, but I just can't. Maybe it's just because he's the first guy I've really liked and been with, but I think there's something special about him. I just can't seem to convince him no matter what I do or say. Please help. How do I deal with this?

PS - Did I fall in love? Is that what this is?","&lt;!-- SC_OFF --&gt;&lt;div class=""md""&gt;&lt;p&gt;Hi everyone, long story ahead. I appreciate you in advance for reading.&lt;/p&gt;

&lt;p&gt;Last October, I started coming out to my friends/family and becoming comfortable with being gay. I browsed all the apps/dating sites/etc until this past June I came across a guy I had seen around school and was in the music department with me. We talked and soon met in person. We spent the whole summer talking and going on amazing dates, anticipating school starting so we could be together more. He was perfect in every way: handsome, amazing smile, very mature, intelligent, ambitious, and most of all, he was accepting of me in a way that nobody else had ever tried to be. This is my first quasi-relationship and I was getting exited about the possibilities and being there to support him and having him there to support me. Things were going great.&lt;/p&gt;

&lt;p&gt;School started and things were still going well. I&amp;#39;m a senior and he&amp;#39;s a junior. We&amp;#39;re both very busy and have full schedules. I have two jobs and take a full class load along with a student teaching placement and being president of my student organization for music education students. Needless to say, time is a hard thing to find, but I made time to see him whenever I could and we talked all the time. A couple weeks in, I felt the disconnect start to come. He was becoming too overwhelmed with work/exams. We celebrated his birthday together and I met his parents. Then things went slightly downhill but I held on to the hope that we would be okay. Then he asked to talk in early October and said he didn&amp;#39;t feel ready for a relationship (we weren&amp;#39;t formally dating at the time yet). He&amp;#39;s been dealing with depression for a while and actually was hospitalized for it over the summer. He says he doesn&amp;#39;t want anyone else caught up in his stuff and that he doesn&amp;#39;t think he can handle the romantic/emotional part of a relationship right now nor does he want it. He instead wants to be friends.&lt;/p&gt;

&lt;p&gt;Needless to say, I&amp;#39;ve been completely heartbroken. Not just because of the breakup, but because I don&amp;#39;t want him to think that he&amp;#39;s undeserving of love/affection because he&amp;#39;s dealing with depression. I&amp;#39;ve been dealing with depression for my whole life. Every aspect of my life is a mess and it&amp;#39;s led to my horrible depression and he was the one good thing I had. We still talk but it&amp;#39;s always just me asking how he&amp;#39;s doing/feeling. There have been a couple times where I ask a lot of questions trying to find out the reason why things had to end. I keep blaming myself and he keeps insisting that I did nothing wrong and that it&amp;#39;s just his feelings that changed and he only sees me as a friend. I&amp;#39;m so hurt because I see him as more than that and I was so hopeful for something and once again, my hopes got destroyed. I want to be more than friends, even if that doesn&amp;#39;t mean boyfriends, necessarily. I can&amp;#39;t pretend like I don&amp;#39;t know him on that level. I can&amp;#39;t pretend like his smile doesn&amp;#39;t light up my heart or that I could stare into his eyes forever. I can&amp;#39;t act like I don&amp;#39;t find him attractive and miss his little quirks. Calling him my friend feels like a lie but I can&amp;#39;t cut him off because 1) he needs someone to be there for him while he goes through these things and I said I would be there for him and 2)I don&amp;#39;t want to lose contact with him over something he can&amp;#39;t control. It&amp;#39;s not like he did anything to me (ie cheat on me, etc.) that gives me a reason to cut him out of my life. But I want him to be more than just my friend. I don&amp;#39;t care as much about losing the romantic aspect as I care about losing him. The romantic part was just an added bonus of knowing him.&lt;/p&gt;

&lt;p&gt;Nothing about depression/suicide drives me away from him. I just want to be there for him and I want the relationship we have to only make him feel better and lift him up, not stress him out. I can&amp;#39;t focus on anything. I think about him and how badly I miss him all the time. Everyone is telling me to cut him out, but I just can&amp;#39;t. Maybe it&amp;#39;s just because he&amp;#39;s the first guy I&amp;#39;ve really liked and been with, but I think there&amp;#39;s something special about him. I just can&amp;#39;t seem to convince him no matter what I do or say. Please help. How do I deal with this?&lt;/p&gt;

&lt;p&gt;PS - Did I fall in love? Is that what this is?&lt;/p&gt;
&lt;/div&gt;&lt;!-- SC_ON --&gt;","False","askgaybros","t5_2vgfw","","","I [21/M] think I fell too hard for a guy [20/M] dealing with depression and I want to be more than friends.","9","http://www.reddit.com/r/askgaybros/comments/2lre33/i_21m_think_i_fell_too_hard_for_a_guy_20m_dealing/","[]","False"
"3","","","{}","http://www.reddit.com/api/info/","{}","{}","False","","","False","ChukyFox","","","","False","1415539667.0","1415539667.0","","self.askgaybros","0","False","0","True","False","2lrd1c","True","","","","","","{}","[]","t3_2lrd1c","13","","False","http://www.reddit.com/r/askgaybros/comments/2lrd1c/not_sure_where_to_ask_this_about_internet/","Unauthenticated reddit sesssion","","False","1","","{}","I'd like to start off by explaining that i'm not great at writing, and am not an active Reddit poster. Usually i lurk video game related things and the front page. But i feel like I'm in need of some help and was directed to this subreddit.

I've wanted to tell my parents (at least my mother) about being gay, which I'm almost sure my mom would be okay with it (I asked my mom when i was about 10-11 if she would still love me if i were gay and she said she would but she would be a little dissapointed, THIS IS A BIG REASON I HAVEN'T TOLD HER) 

I have several non-diagnosed mental problems that have caused me to go see a doctor, where i had to tell that i don't have any ""real life"" friends (I don't) and i spend most my time with my internet friends, which mean more to me than anyone. They mean so much to me in fact that one of them is my boyfriend. Sadly we live 5,447 mi (8800 KM) away from each other in a different country. Back to the doctor and talking about only having internet friends, every time this has come up my mom and doctor would get upset and tell me that they're pretty much kinda bullshit, and i need to just get some real life friends.

This brings me to one of my biggest problems i'm TERRIFIED of people and meeting people and talking to people, often i'm too scared to go to the store or pick up the phone. i find it easier to talk to people in English than in my native language.

So i have a boyfriend that lives in a different country, that i love so very much. We talk every day even though we recently went trough quite a rough patch. 

And i have a mom that doesn't believe my internet friends are ""real"" in the sense that they can be real relations, AND would be dissapointed if i were gay. But in general accepting of it. 

Add that to being anxious about talking to anyone and you there you have my problem


TL;DR
I'm in love with a guy over the internet, my mom doesn't believe in internet relationships and i have social anxiety and i want to come out to eventually work towards being with my boyfriend.","&lt;!-- SC_OFF --&gt;&lt;div class=""md""&gt;&lt;p&gt;I&amp;#39;d like to start off by explaining that i&amp;#39;m not great at writing, and am not an active Reddit poster. Usually i lurk video game related things and the front page. But i feel like I&amp;#39;m in need of some help and was directed to this subreddit.&lt;/p&gt;

&lt;p&gt;I&amp;#39;ve wanted to tell my parents (at least my mother) about being gay, which I&amp;#39;m almost sure my mom would be okay with it (I asked my mom when i was about 10-11 if she would still love me if i were gay and she said she would but she would be a little dissapointed, THIS IS A BIG REASON I HAVEN&amp;#39;T TOLD HER) &lt;/p&gt;

&lt;p&gt;I have several non-diagnosed mental problems that have caused me to go see a doctor, where i had to tell that i don&amp;#39;t have any &amp;quot;real life&amp;quot; friends (I don&amp;#39;t) and i spend most my time with my internet friends, which mean more to me than anyone. They mean so much to me in fact that one of them is my boyfriend. Sadly we live 5,447 mi (8800 KM) away from each other in a different country. Back to the doctor and talking about only having internet friends, every time this has come up my mom and doctor would get upset and tell me that they&amp;#39;re pretty much kinda bullshit, and i need to just get some real life friends.&lt;/p&gt;

&lt;p&gt;This brings me to one of my biggest problems i&amp;#39;m TERRIFIED of people and meeting people and talking to people, often i&amp;#39;m too scared to go to the store or pick up the phone. i find it easier to talk to people in English than in my native language.&lt;/p&gt;

&lt;p&gt;So i have a boyfriend that lives in a different country, that i love so very much. We talk every day even though we recently went trough quite a rough patch. &lt;/p&gt;

&lt;p&gt;And i have a mom that doesn&amp;#39;t believe my internet friends are &amp;quot;real&amp;quot; in the sense that they can be real relations, AND would be dissapointed if i were gay. But in general accepting of it. &lt;/p&gt;

&lt;p&gt;Add that to being anxious about talking to anyone and you there you have my problem&lt;/p&gt;

&lt;p&gt;TL;DR
I&amp;#39;m in love with a guy over the internet, my mom doesn&amp;#39;t believe in internet relationships and i have social anxiety and i want to come out to eventually work towards being with my boyfriend.&lt;/p&gt;
&lt;/div&gt;&lt;!-- SC_ON --&gt;","False","askgaybros","t5_2vgfw","","","Not sure where to ask this, about internet relations","1","http://www.reddit.com/r/askgaybros/comments/2lrd1c/not_sure_where_to_ask_this_about_internet/","[]","False"
"4","","","{}","http://www.reddit.com/api/info/","{}","{}","False","","","False","doyouthinkthisistrue","","","","False","1415539025.0","1415539025.0","","self.askgaybros","0","1415539243.0","0","True","False","2lrceh","True","","","","","","{}","[]","t3_2lrceh","18","","False","http://www.reddit.com/r/askgaybros/comments/2lrceh/why_do_some_people_have_such_a_hard_time_making_a/","Unauthenticated reddit sesssion","","False","21","","{}","I'm 24 (just turned 24 last month) and I seriously feel like I fail in the friend department.  I don't have a core group of friends, I don't have a 'chosen' family of people that just 'get' me.  I have people that I can hang out with and can have fun with, but at the end of the day, they're not people that I'd go to (except for one) if something really difficult happened.  Some of them, I don't even have a single thing in common with.  I don't even have plans for NYE..

I feel like it's really hard to meet people like me and even in the past, have had friends that normally I wouldn't gravitate towards but that ended up becoming a friend (for instance, the nerdy kid that doesn't say much vs me, more extroverted and not-so-nerdy).  In high school it was the same thing too, as a queer person, I didn't feel like I fit in with the 'popular' group or most people so my friend that I'd known for years just got me involved with her group and I was also a 'floater' and just talked to people from different 'cliques.'  I just feel like I really struggle with meeting like-minded people and it can be disappointing. 

Granted, I haven't put myself out there in terms of meeting other queer people because I'm not living in a metropolitan city at this point, I'm hoping that will change everything once this happens next year.  But, I fear that I'm always going to feel 'different' and not be able to find my people--that I might always have a hard time making a solid group of friends..How do I deal with this?","&lt;!-- SC_OFF --&gt;&lt;div class=""md""&gt;&lt;p&gt;I&amp;#39;m 24 (just turned 24 last month) and I seriously feel like I fail in the friend department.  I don&amp;#39;t have a core group of friends, I don&amp;#39;t have a &amp;#39;chosen&amp;#39; family of people that just &amp;#39;get&amp;#39; me.  I have people that I can hang out with and can have fun with, but at the end of the day, they&amp;#39;re not people that I&amp;#39;d go to (except for one) if something really difficult happened.  Some of them, I don&amp;#39;t even have a single thing in common with.  I don&amp;#39;t even have plans for NYE..&lt;/p&gt;

&lt;p&gt;I feel like it&amp;#39;s really hard to meet people like me and even in the past, have had friends that normally I wouldn&amp;#39;t gravitate towards but that ended up becoming a friend (for instance, the nerdy kid that doesn&amp;#39;t say much vs me, more extroverted and not-so-nerdy).  In high school it was the same thing too, as a queer person, I didn&amp;#39;t feel like I fit in with the &amp;#39;popular&amp;#39; group or most people so my friend that I&amp;#39;d known for years just got me involved with her group and I was also a &amp;#39;floater&amp;#39; and just talked to people from different &amp;#39;cliques.&amp;#39;  I just feel like I really struggle with meeting like-minded people and it can be disappointing. &lt;/p&gt;

&lt;p&gt;Granted, I haven&amp;#39;t put myself out there in terms of meeting other queer people because I&amp;#39;m not living in a metropolitan city at this point, I&amp;#39;m hoping that will change everything once this happens next year.  But, I fear that I&amp;#39;m always going to feel &amp;#39;different&amp;#39; and not be able to find my people--that I might always have a hard time making a solid group of friends..How do I deal with this?&lt;/p&gt;
&lt;/div&gt;&lt;!-- SC_ON --&gt;","False","askgaybros","t5_2vgfw","","","Why do some people have such a hard time making a solid group of friends?","21","http://www.reddit.com/r/askgaybros/comments/2lrceh/why_do_some_people_have_such_a_hard_time_making_a/","[]","False"
