"","_comment_sort","_comments","_comments_by_id","_info_url","_orphaned","_params","_replaced_more","_underscore_names","approved_by","archived","author","author_flair_css_class","author_flair_text","banned_by","clicked","created","created_utc","distinguished","domain","downs","edited","gilded","has_fetched","hidden","id","is_self","json_dict","likes","link_flair_css_class","link_flair_text","media","media_embed","mod_reports","name","num_comments","num_reports","over_18","permalink","reddit_session","report_reasons","saved","score","secure_media","secure_media_embed","selftext","selftext_html","stickied","subreddit","subreddit_id","suggested_sort","thumbnail","title","ups","url","user_reports","visited"
"14","","","{}","http://www.reddit.com/api/info/","{}","{}","False","","","False","TimeToBeRelevant","","","","False","1416800081.0","1416800081.0","","self.askgaybros","0","1416800262.0","0","True","False","2n8978","True","","","","","","{}","[]","t3_2n8978","8","","False","http://www.reddit.com/r/askgaybros/comments/2n8978/i_need_help/","Unauthenticated reddit sesssion","","False","5","","{}","I have never used reddit, and to be honest I would be posting this on imgur, but a lot of my friends know my username so that doesn't really work for me. I'm basically posting this to tell my life story. So here it goes.

When I was younger, maybe 8, guy that used to work in our house tried to molest me. He asked me to touch his dick and I had behind my bed until he went away. I didn't know that what he had asked me to do was wrong, but I just didn't want to do it. When he left, I sent my mother an email, told her what happened and quite literally asked her, ""Is there something we can do about this?"" Needless to say, he no longer works for us.

Fast forward to around age 10. I start going through puberty and I begin to realize that I like guys. Keep in mind this is while I am in elementary school. I already get bullied, people call me gay, faggot, retard. You know, the usual crap. Instead of going to my neighborhood middle school, I go to one across town where no one knows me. The next one year is pretty good until I mature enough to read the news. Then it hits me: 1) Half the country thinks I should be stoned to death for who I am. 2) Half the country thinks that I am a lesser person because of who I am and who I love. 3) What is the point in living if I can't love?

One day, I came home from school went to my bedroom, and locked the door. I remember this day vividly. I had a knife in one hand and the phone in the other. For some (very lucky) reason, there was a small corner of my brain telling me to call someone. So with the knife inches from piercing my skin I dialed the suicide hotline. But then it occurred to me that if I call they will know I am a minor and they will call the police and my parents. I have a problem with that because I really don't want them to know. So I sat there crying for three hours, trying to reason with myself. It was so hard emotionally, I didn't think I would get anywhere from there.

The worst part of all of this is the act. Going to school, seeing ""friends"" and having to say that everything is awesome. Having to talk about all of the hot girls and having to talk about how so and so is a faggot. I put ""friends"" in quotation marks, by the way, because they aren't really friends. How can they be friends if they don't know the real me? Also some of you might tell me to ""be the change that I want to see in the world"". It's not that easy. If I try to be the change and stick up for people, I will literally get the crap beat out of me. I will be in a worse situation than before. 

OK, so I have talked myself out of suicide, but I still sat on that edge so close to the pit that would have trapped me. I decided that I needed something to take the edge off of my life. I turned to videogames. On video games it is insanely easy to lie. You can be different than who you are in real life and I think that's why I liked it so much. But eventually I did make really great friends. In fact, they were the first people that I came out to, and they were fine with it.

I feel like that is a sad statement. The first person that I came out to was someone I had never met in person before. They were just people in a videogame. They were no one. And even worse, coming out to them just made my mood worse because once I picked my head up from the computer I realized that my situation out here is still hopeless. Ya, I tried watching the ""It Gets Better"" videos, but all they did was make me think that there is no way it'll get better until I move out of my parents house and that is still 2-3 years away. 

Let me get closer to a point. I feel totally alone. There is no one that I can talk to about who I am as a person and as a human people because I like both of the guy friends that I have. They are both smart, funny and cute. I don't want to tell them because, first of all, one is anti-gay (fml) and the other one I don't want to tell because I also like him as a friend and I don't want him to drift away. 

Also, I don't want to come out of my parents because I REALLY don't want to fulfill the stereotype that ""Molested as a kid = gay"". 

Just knowing that I can't love like anyone else can love is depressing me. Anyone straight person can walk up to anyone else and tell them that they like them because that is what society perceives as OK. But I can't because I am different. I have to know for a fact that someone is gay before I make a move because if I don't wait I will just embarrass myself. I can't love who I love and it's driving me insane.

Reddit, my life really sucks right now. I'm depressed to the point where I'm just listening to Sam Smith's ""Make It To Me"" on repeat. I really need help guys. 

Thanks for reading.


tl;dr: OP was molested as a child, discovered he was gay, got addicted to video games, first came out to a friend on said video game, and feels like he has no rl friend to talk to about who he is as a person.","&lt;!-- SC_OFF --&gt;&lt;div class=""md""&gt;&lt;p&gt;I have never used reddit, and to be honest I would be posting this on imgur, but a lot of my friends know my username so that doesn&amp;#39;t really work for me. I&amp;#39;m basically posting this to tell my life story. So here it goes.&lt;/p&gt;

&lt;p&gt;When I was younger, maybe 8, guy that used to work in our house tried to molest me. He asked me to touch his dick and I had behind my bed until he went away. I didn&amp;#39;t know that what he had asked me to do was wrong, but I just didn&amp;#39;t want to do it. When he left, I sent my mother an email, told her what happened and quite literally asked her, &amp;quot;Is there something we can do about this?&amp;quot; Needless to say, he no longer works for us.&lt;/p&gt;

&lt;p&gt;Fast forward to around age 10. I start going through puberty and I begin to realize that I like guys. Keep in mind this is while I am in elementary school. I already get bullied, people call me gay, faggot, retard. You know, the usual crap. Instead of going to my neighborhood middle school, I go to one across town where no one knows me. The next one year is pretty good until I mature enough to read the news. Then it hits me: 1) Half the country thinks I should be stoned to death for who I am. 2) Half the country thinks that I am a lesser person because of who I am and who I love. 3) What is the point in living if I can&amp;#39;t love?&lt;/p&gt;

&lt;p&gt;One day, I came home from school went to my bedroom, and locked the door. I remember this day vividly. I had a knife in one hand and the phone in the other. For some (very lucky) reason, there was a small corner of my brain telling me to call someone. So with the knife inches from piercing my skin I dialed the suicide hotline. But then it occurred to me that if I call they will know I am a minor and they will call the police and my parents. I have a problem with that because I really don&amp;#39;t want them to know. So I sat there crying for three hours, trying to reason with myself. It was so hard emotionally, I didn&amp;#39;t think I would get anywhere from there.&lt;/p&gt;

&lt;p&gt;The worst part of all of this is the act. Going to school, seeing &amp;quot;friends&amp;quot; and having to say that everything is awesome. Having to talk about all of the hot girls and having to talk about how so and so is a faggot. I put &amp;quot;friends&amp;quot; in quotation marks, by the way, because they aren&amp;#39;t really friends. How can they be friends if they don&amp;#39;t know the real me? Also some of you might tell me to &amp;quot;be the change that I want to see in the world&amp;quot;. It&amp;#39;s not that easy. If I try to be the change and stick up for people, I will literally get the crap beat out of me. I will be in a worse situation than before. &lt;/p&gt;

&lt;p&gt;OK, so I have talked myself out of suicide, but I still sat on that edge so close to the pit that would have trapped me. I decided that I needed something to take the edge off of my life. I turned to videogames. On video games it is insanely easy to lie. You can be different than who you are in real life and I think that&amp;#39;s why I liked it so much. But eventually I did make really great friends. In fact, they were the first people that I came out to, and they were fine with it.&lt;/p&gt;

&lt;p&gt;I feel like that is a sad statement. The first person that I came out to was someone I had never met in person before. They were just people in a videogame. They were no one. And even worse, coming out to them just made my mood worse because once I picked my head up from the computer I realized that my situation out here is still hopeless. Ya, I tried watching the &amp;quot;It Gets Better&amp;quot; videos, but all they did was make me think that there is no way it&amp;#39;ll get better until I move out of my parents house and that is still 2-3 years away. &lt;/p&gt;

&lt;p&gt;Let me get closer to a point. I feel totally alone. There is no one that I can talk to about who I am as a person and as a human people because I like both of the guy friends that I have. They are both smart, funny and cute. I don&amp;#39;t want to tell them because, first of all, one is anti-gay (fml) and the other one I don&amp;#39;t want to tell because I also like him as a friend and I don&amp;#39;t want him to drift away. &lt;/p&gt;

&lt;p&gt;Also, I don&amp;#39;t want to come out of my parents because I REALLY don&amp;#39;t want to fulfill the stereotype that &amp;quot;Molested as a kid = gay&amp;quot;. &lt;/p&gt;

&lt;p&gt;Just knowing that I can&amp;#39;t love like anyone else can love is depressing me. Anyone straight person can walk up to anyone else and tell them that they like them because that is what society perceives as OK. But I can&amp;#39;t because I am different. I have to know for a fact that someone is gay before I make a move because if I don&amp;#39;t wait I will just embarrass myself. I can&amp;#39;t love who I love and it&amp;#39;s driving me insane.&lt;/p&gt;

&lt;p&gt;Reddit, my life really sucks right now. I&amp;#39;m depressed to the point where I&amp;#39;m just listening to Sam Smith&amp;#39;s &amp;quot;Make It To Me&amp;quot; on repeat. I really need help guys. &lt;/p&gt;

&lt;p&gt;Thanks for reading.&lt;/p&gt;

&lt;p&gt;tl;dr: OP was molested as a child, discovered he was gay, got addicted to video games, first came out to a friend on said video game, and feels like he has no rl friend to talk to about who he is as a person.&lt;/p&gt;
&lt;/div&gt;&lt;!-- SC_ON --&gt;","False","askgaybros","t5_2vgfw","","","I need help","5","http://www.reddit.com/r/askgaybros/comments/2n8978/i_need_help/","[]","False"
"15","","","{}","http://www.reddit.com/api/info/","{}","{}","False","","","False","weoijk","","","","False","1416797194.0","1416797194.0","","self.askgaybros","0","False","0","True","False","2n84e1","True","","","","","","{}","[]","t3_2n84e1","8","","False","http://www.reddit.com/r/askgaybros/comments/2n84e1/am_i_a_narcissist/","Unauthenticated reddit sesssion","","False","2","","{}","I'm not sure really how I identify my sexuality. I've hooked up with girls but I feel like there's something missing. I've never hooked up with a guy and I don't know if I actually want to but I really like the attention I get when I meet gay guys at a bar. I talk with them and kinda flirt back, and usually get their numbers but never contact them. Part of me feels bad for leading them on, but I guess I just like the feeling of being pursued for a change. 

So do you think I'm just sexually confused or being vain? I think it's somewhere in the middle because I'll talk to gays that I'm definitely not interested in.","&lt;!-- SC_OFF --&gt;&lt;div class=""md""&gt;&lt;p&gt;I&amp;#39;m not sure really how I identify my sexuality. I&amp;#39;ve hooked up with girls but I feel like there&amp;#39;s something missing. I&amp;#39;ve never hooked up with a guy and I don&amp;#39;t know if I actually want to but I really like the attention I get when I meet gay guys at a bar. I talk with them and kinda flirt back, and usually get their numbers but never contact them. Part of me feels bad for leading them on, but I guess I just like the feeling of being pursued for a change. &lt;/p&gt;

&lt;p&gt;So do you think I&amp;#39;m just sexually confused or being vain? I think it&amp;#39;s somewhere in the middle because I&amp;#39;ll talk to gays that I&amp;#39;m definitely not interested in.&lt;/p&gt;
&lt;/div&gt;&lt;!-- SC_ON --&gt;","False","askgaybros","t5_2vgfw","","","Am I a narcissist?","2","http://www.reddit.com/r/askgaybros/comments/2n84e1/am_i_a_narcissist/","[]","False"
"16","","","{}","http://www.reddit.com/api/info/","{}","{}","False","","","False","sbcreighton","","","","False","1416797026.0","1416797026.0","","self.askgaybros","0","False","0","True","False","2n8437","True","","","","","","{}","[]","t3_2n8437","8","","False","http://www.reddit.com/r/askgaybros/comments/2n8437/cuddle_too_warm/","Unauthenticated reddit sesssion","","False","3","","{}","My bf and I love to cuddle, but I am a heat factory. We can only spoon for a few minutes and we both start sweating and it get gross. Any suggestions?","&lt;!-- SC_OFF --&gt;&lt;div class=""md""&gt;&lt;p&gt;My bf and I love to cuddle, but I am a heat factory. We can only spoon for a few minutes and we both start sweating and it get gross. Any suggestions?&lt;/p&gt;
&lt;/div&gt;&lt;!-- SC_ON --&gt;","False","askgaybros","t5_2vgfw","","","Cuddle... too warm","3","http://www.reddit.com/r/askgaybros/comments/2n8437/cuddle_too_warm/","[]","False"
"17","","","{}","http://www.reddit.com/api/info/","{}","{}","False","","","False","chrono14","","","","False","1416796715.0","1416796715.0","","self.askgaybros","0","False","0","True","False","2n83i4","True","","","","","","{}","[]","t3_2n83i4","8","","False","http://www.reddit.com/r/askgaybros/comments/2n83i4/girthier_condoms/","Unauthenticated reddit sesssion","","False","3","","{}","Hi guys, 

I'm sick of buying $12 - $16 boxes of condoms just to find one with a little extra girth. My entire life I've only used durex and trojan (I don't care for trojan) but standard durex is just too tight and very difficult to get on and they don't seem to make a larger size. 

I tried trojan magnums only to find out they're vanity sized and the exact same diameter as the durex. I have a pretty tame sex life so usually this isn't an issue but it was the other night and I want to find a good brand but without spending $60+ dollars to do so. 

No one seems to sell small packs anymore, just full boxes. ","&lt;!-- SC_OFF --&gt;&lt;div class=""md""&gt;&lt;p&gt;Hi guys, &lt;/p&gt;

&lt;p&gt;I&amp;#39;m sick of buying $12 - $16 boxes of condoms just to find one with a little extra girth. My entire life I&amp;#39;ve only used durex and trojan (I don&amp;#39;t care for trojan) but standard durex is just too tight and very difficult to get on and they don&amp;#39;t seem to make a larger size. &lt;/p&gt;

&lt;p&gt;I tried trojan magnums only to find out they&amp;#39;re vanity sized and the exact same diameter as the durex. I have a pretty tame sex life so usually this isn&amp;#39;t an issue but it was the other night and I want to find a good brand but without spending $60+ dollars to do so. &lt;/p&gt;

&lt;p&gt;No one seems to sell small packs anymore, just full boxes. &lt;/p&gt;
&lt;/div&gt;&lt;!-- SC_ON --&gt;","False","askgaybros","t5_2vgfw","","","Girthier condoms?","3","http://www.reddit.com/r/askgaybros/comments/2n83i4/girthier_condoms/","[]","False"
"18","","","{}","http://www.reddit.com/api/info/","{}","{}","False","","","False","IsHeReallyStraight","","","","False","1416795477.0","1416795477.0","","self.askgaybros","0","False","0","True","False","2n81da","True","","","","","","{}","[]","t3_2n81da","5","","False","http://www.reddit.com/r/askgaybros/comments/2n81da/do_you_kiss_your_hookups_goodbye/","Unauthenticated reddit sesssion","","False","0","","{}","I usually make it a point to always kiss my hookup goodbye regardless if I ever have a chance of seeing them again. Do other guys do this?","&lt;!-- SC_OFF --&gt;&lt;div class=""md""&gt;&lt;p&gt;I usually make it a point to always kiss my hookup goodbye regardless if I ever have a chance of seeing them again. Do other guys do this?&lt;/p&gt;
&lt;/div&gt;&lt;!-- SC_ON --&gt;","False","askgaybros","t5_2vgfw","","","Do you kiss your hookups goodbye?","0","http://www.reddit.com/r/askgaybros/comments/2n81da/do_you_kiss_your_hookups_goodbye/","[]","False"
"19","","","{}","http://www.reddit.com/api/info/","{}","{}","False","","","False","Frisky_Business24","","","","False","1416794723.0","1416794723.0","","self.askgaybros","0","False","0","True","False","2n8009","True","","","","","","{}","[]","t3_2n8009","3","","False","http://www.reddit.com/r/askgaybros/comments/2n8009/any_suggestionshelp_for_a_bicurious_guy_on_sex/","Unauthenticated reddit sesssion","","False","1","","{}","Hey guys, I'm really new to feeling attracted to other men as well as exploring my body in other ways than I normally would. I recently started using fingers to insert anally while I masturbate but now I'm really wanting to try a sex toy for insertion? Any recommendations? I'm open for dildos/virbrators/beads/butt plugs, anything to get me stimulated anally. Really could use the help as I see that most places market towards women. Thanks for the help!","&lt;!-- SC_OFF --&gt;&lt;div class=""md""&gt;&lt;p&gt;Hey guys, I&amp;#39;m really new to feeling attracted to other men as well as exploring my body in other ways than I normally would. I recently started using fingers to insert anally while I masturbate but now I&amp;#39;m really wanting to try a sex toy for insertion? Any recommendations? I&amp;#39;m open for dildos/virbrators/beads/butt plugs, anything to get me stimulated anally. Really could use the help as I see that most places market towards women. Thanks for the help!&lt;/p&gt;
&lt;/div&gt;&lt;!-- SC_ON --&gt;","False","askgaybros","t5_2vgfw","","","Any suggestions/help for a Bi-Curious guy on sex toys?","1","http://www.reddit.com/r/askgaybros/comments/2n8009/any_suggestionshelp_for_a_bicurious_guy_on_sex/","[]","False"
"20","","","{}","http://www.reddit.com/api/info/","{}","{}","False","","","False","falconhunter92","","","","False","1416792550.0","1416792550.0","","self.askgaybros","0","False","0","True","False","2n7wgb","True","","","","","","{}","[]","t3_2n7wgb","22","","False","http://www.reddit.com/r/askgaybros/comments/2n7wgb/who_is_really_the_sexiest_man_alive/","Unauthenticated reddit sesssion","","False","0","","{}","People magazine says its Chris Hemsworth, but I would've picked John Cena or Bobby Lashley...or maybe Eric Decker.
Who's YOUR pick?
(Pics strongly encouraged.)","&lt;!-- SC_OFF --&gt;&lt;div class=""md""&gt;&lt;p&gt;People magazine says its Chris Hemsworth, but I would&amp;#39;ve picked John Cena or Bobby Lashley...or maybe Eric Decker.
Who&amp;#39;s YOUR pick?
(Pics strongly encouraged.)&lt;/p&gt;
&lt;/div&gt;&lt;!-- SC_ON --&gt;","False","askgaybros","t5_2vgfw","","","Who is really the Sexiest Man Alive?","0","http://www.reddit.com/r/askgaybros/comments/2n7wgb/who_is_really_the_sexiest_man_alive/","[]","False"
"21","","","{}","http://www.reddit.com/api/info/","{}","{}","False","","","False","AquaQuartz","","","","False","1416791798.0","1416791798.0","","self.askgaybros","0","False","0","True","False","2n7v6i","True","","","","","","{}","[]","t3_2n7v6i","15","","False","http://www.reddit.com/r/askgaybros/comments/2n7v6i/so_with_thanksgiving_coming_up_what_are_your/","Unauthenticated reddit sesssion","","False","2","","{}","I'm talking about anything. How do you deal with the good and bad of the holidays, be that recipes,dealing with homophobic family, buying presents, or anything else like that. ","&lt;!-- SC_OFF --&gt;&lt;div class=""md""&gt;&lt;p&gt;I&amp;#39;m talking about anything. How do you deal with the good and bad of the holidays, be that recipes,dealing with homophobic family, buying presents, or anything else like that. &lt;/p&gt;
&lt;/div&gt;&lt;!-- SC_ON --&gt;","False","askgaybros","t5_2vgfw","","","So with thanksgiving coming up, what are your holiday strategies?","2","http://www.reddit.com/r/askgaybros/comments/2n7v6i/so_with_thanksgiving_coming_up_what_are_your/","[]","False"
"22","","","{}","http://www.reddit.com/api/info/","{}","{}","False","","","False","ColoradoAir","","","","False","1416790624.0","1416790624.0","","self.askgaybros","0","False","0","True","False","2n7t5e","True","","","","","","{}","[]","t3_2n7t5e","1","","False","http://www.reddit.com/r/askgaybros/comments/2n7t5e/anyone_dated_someone_who_is_on_globalfight/","Unauthenticated reddit sesssion","","False","0","","{}","I met someone who has a profile on the site, trying to get a feel for how seriously of a relationship he is wanting. Is the site more geared towards hooking up? Only sex.","&lt;!-- SC_OFF --&gt;&lt;div class=""md""&gt;&lt;p&gt;I met someone who has a profile on the site, trying to get a feel for how seriously of a relationship he is wanting. Is the site more geared towards hooking up? Only sex.&lt;/p&gt;
&lt;/div&gt;&lt;!-- SC_ON --&gt;","False","askgaybros","t5_2vgfw","","","Anyone dated someone who is on Globalfight?","0","http://www.reddit.com/r/askgaybros/comments/2n7t5e/anyone_dated_someone_who_is_on_globalfight/","[]","False"
