"","_comment_sort","_comments","_comments_by_id","_info_url","_orphaned","_params","_replaced_more","_underscore_names","approved_by","archived","author","author_flair_css_class","author_flair_text","banned_by","clicked","created","created_utc","distinguished","domain","downs","edited","gilded","has_fetched","hidden","id","is_self","json_dict","likes","link_flair_css_class","link_flair_text","media","media_embed","mod_reports","name","num_comments","num_reports","over_18","permalink","reddit_session","report_reasons","saved","score","secure_media","secure_media_embed","selftext","selftext_html","stickied","subreddit","subreddit_id","suggested_sort","thumbnail","title","ups","url","user_reports","visited"
"12","","","{}","http://www.reddit.com/api/info/","{}","{}","False","","","False","ta1987654321","","","","False","1422748500.0","1422748500.0","","self.askgaybros","0","False","0","True","False","2uctat","True","","","","","","{}","[]","t3_2uctat","6","","False","http://www.reddit.com/r/askgaybros/comments/2uctat/i_need_some_advice/","Unauthenticated reddit sesssion","","False","9","","{}","I need some advice from this subreddit on a situation that I don't know how to approach myself.

I am writing this on a throwaway and am going to being brief with my description.

A friend of mine recently had her cousin come out to her about being gay (they are a part of a pretty conservative family that frowns upon homosexuality). She has been very understanding and holds no reservations against gays.

This cousin (and a couple of his friends who are also gay) has been sleeping around a lot and often times with men 10-20 years his senior. The issue comes down to this though: the cousin and his friends are all 16-17 year olds yet to reach their senior year.

I have already delivered my own advice to how she should handle the situation including bits on practicing safe sex (regular testing and condom use) as well as trying to protect yourself from strangers who are 30-40 years old. 

I am not gay myself, but have a number of gay friends (one of which I am very very close to). This type of behavior though, is pretty concerning to me and I wish there was more that I could say.

Any advice on how to handle this?","&lt;!-- SC_OFF --&gt;&lt;div class=""md""&gt;&lt;p&gt;I need some advice from this subreddit on a situation that I don&amp;#39;t know how to approach myself.&lt;/p&gt;

&lt;p&gt;I am writing this on a throwaway and am going to being brief with my description.&lt;/p&gt;

&lt;p&gt;A friend of mine recently had her cousin come out to her about being gay (they are a part of a pretty conservative family that frowns upon homosexuality). She has been very understanding and holds no reservations against gays.&lt;/p&gt;

&lt;p&gt;This cousin (and a couple of his friends who are also gay) has been sleeping around a lot and often times with men 10-20 years his senior. The issue comes down to this though: the cousin and his friends are all 16-17 year olds yet to reach their senior year.&lt;/p&gt;

&lt;p&gt;I have already delivered my own advice to how she should handle the situation including bits on practicing safe sex (regular testing and condom use) as well as trying to protect yourself from strangers who are 30-40 years old. &lt;/p&gt;

&lt;p&gt;I am not gay myself, but have a number of gay friends (one of which I am very very close to). This type of behavior though, is pretty concerning to me and I wish there was more that I could say.&lt;/p&gt;

&lt;p&gt;Any advice on how to handle this?&lt;/p&gt;
&lt;/div&gt;&lt;!-- SC_ON --&gt;","False","askgaybros","t5_2vgfw","","","I need some advice","9","http://www.reddit.com/r/askgaybros/comments/2uctat/i_need_some_advice/","[]","False"
"13","","","{}","http://www.reddit.com/api/info/","{}","{}","False","","","False","tablechairdoor","","","","False","1422747911.0","1422747911.0","","self.askgaybros","0","False","0","True","False","2ucs66","True","","","","","","{}","[]","t3_2ucs66","14","","False","http://www.reddit.com/r/askgaybros/comments/2ucs66/risks_of_getting_a_rimjobblown/","Unauthenticated reddit sesssion","","False","8","","{}","Hey lads. This looked like a good place to ask.
One of my housemates is gay  and has been hitting on me for a long time. Recently when he did this I figured why not? It would chill him out and for all I know it might be great.
I asked him what he would even want to do and told him I'd think about it.

He said he wants me to come home from work one night and he'll massage/rim/blow me. I've never been with a bloke or been rimmed before and I was wondering if doing this would give me a risk of disease or anything, I'm not really sure. 

Thanks heaps gaybros.","&lt;!-- SC_OFF --&gt;&lt;div class=""md""&gt;&lt;p&gt;Hey lads. This looked like a good place to ask.
One of my housemates is gay  and has been hitting on me for a long time. Recently when he did this I figured why not? It would chill him out and for all I know it might be great.
I asked him what he would even want to do and told him I&amp;#39;d think about it.&lt;/p&gt;

&lt;p&gt;He said he wants me to come home from work one night and he&amp;#39;ll massage/rim/blow me. I&amp;#39;ve never been with a bloke or been rimmed before and I was wondering if doing this would give me a risk of disease or anything, I&amp;#39;m not really sure. &lt;/p&gt;

&lt;p&gt;Thanks heaps gaybros.&lt;/p&gt;
&lt;/div&gt;&lt;!-- SC_ON --&gt;","False","askgaybros","t5_2vgfw","","","Risks of getting a rimjob/blown","8","http://www.reddit.com/r/askgaybros/comments/2ucs66/risks_of_getting_a_rimjobblown/","[]","False"
"14","","","{}","http://www.reddit.com/api/info/","{}","{}","False","","","False","KingofBrittany","","","","False","1422740586.0","1422740586.0","","self.askgaybros","0","False","0","True","False","2ucdsy","True","","","","","","{}","[]","t3_2ucdsy","6","","False","http://www.reddit.com/r/askgaybros/comments/2ucdsy/best_position_for_breaking_into_inexperienced/","Unauthenticated reddit sesssion","","False","6","","{}","Hey gaybros!

I was with a guy the other day who has never done any assplay. I put on my condom, lubed up, and entered relatively easily. However the pain on his part was instantaneous. What can I do to ease into him and make him more comfortable ?

I'm 7"" but I do have a big head. ","&lt;!-- SC_OFF --&gt;&lt;div class=""md""&gt;&lt;p&gt;Hey gaybros!&lt;/p&gt;

&lt;p&gt;I was with a guy the other day who has never done any assplay. I put on my condom, lubed up, and entered relatively easily. However the pain on his part was instantaneous. What can I do to ease into him and make him more comfortable ?&lt;/p&gt;

&lt;p&gt;I&amp;#39;m 7&amp;quot; but I do have a big head. &lt;/p&gt;
&lt;/div&gt;&lt;!-- SC_ON --&gt;","False","askgaybros","t5_2vgfw","","","Best position for breaking into inexperienced bottom boy","6","http://www.reddit.com/r/askgaybros/comments/2ucdsy/best_position_for_breaking_into_inexperienced/","[]","False"
"15","","","{}","http://www.reddit.com/api/info/","{}","{}","False","","","False","KingofBrittany","","","","False","1422739780.0","1422739780.0","","self.askgaybros","0","False","0","True","False","2ucc2j","True","","","","","","{}","[]","t3_2ucc2j","13","","False","http://www.reddit.com/r/askgaybros/comments/2ucc2j/help_i_get_red_bumps_after_shaving_pubic_area/","Unauthenticated reddit sesssion","","False","5","","{}","What products/techniques do you guys use to reduce shaving bumps?","&lt;!-- SC_OFF --&gt;&lt;div class=""md""&gt;&lt;p&gt;What products/techniques do you guys use to reduce shaving bumps?&lt;/p&gt;
&lt;/div&gt;&lt;!-- SC_ON --&gt;","False","askgaybros","t5_2vgfw","","","Help! I get red bumps after shaving pubic area","5","http://www.reddit.com/r/askgaybros/comments/2ucc2j/help_i_get_red_bumps_after_shaving_pubic_area/","[]","False"
"16","","","{}","http://www.reddit.com/api/info/","{}","{}","False","","","False","wooeee","","","","False","1422735600.0","1422735600.0","","self.askgaybros","0","False","0","True","False","2uc3nu","True","","","","","","{}","[]","t3_2uc3nu","13","","False","http://www.reddit.com/r/askgaybros/comments/2uc3nu/how_do_you_guys_meet_other_people/","Unauthenticated reddit sesssion","","False","0","","{}","I know this is the most common question, but how do people from the Toronto area; or even the outer GTA, and other metro areas meet people?

I've met everyone else through random events, and I'm just getting sick of being alone. 

Also does anyone know how to get Grindr on a Blackberry Q10? The Blackberry download isn't compatible with my phone. I know Grindr sucks but I just want somebody.

Every other site I'm on isn't as active as others. Gaydar sucks, OkCupid sucks.

So though I'm open to suggestions, I'm wondering what people in Toronto do? Like average guys in Toronto or other cities.

I'm in the outer city area so I'm not able to go to ""bars"" at a whim and have to use the computer to meet people, 2,000 people live in my town/.

I already added myself to the bromap and I was the only dot within like 45 km, so it's not the greatest way.

Is it just because there are so little gay people in general that I'm having a problem, or could it just be I don't know about other methods.

I don't want a hookup, I did that throughout highschool and really do not care for it anymore, obviously casual hook-up if I hung out with someone is fine, but I don't like the ""come fuck me"" shit that is involved with a lot of apps and chat sites, I feel like those people are mentally unstable for some reason haha.","&lt;!-- SC_OFF --&gt;&lt;div class=""md""&gt;&lt;p&gt;I know this is the most common question, but how do people from the Toronto area; or even the outer GTA, and other metro areas meet people?&lt;/p&gt;

&lt;p&gt;I&amp;#39;ve met everyone else through random events, and I&amp;#39;m just getting sick of being alone. &lt;/p&gt;

&lt;p&gt;Also does anyone know how to get Grindr on a Blackberry Q10? The Blackberry download isn&amp;#39;t compatible with my phone. I know Grindr sucks but I just want somebody.&lt;/p&gt;

&lt;p&gt;Every other site I&amp;#39;m on isn&amp;#39;t as active as others. Gaydar sucks, OkCupid sucks.&lt;/p&gt;

&lt;p&gt;So though I&amp;#39;m open to suggestions, I&amp;#39;m wondering what people in Toronto do? Like average guys in Toronto or other cities.&lt;/p&gt;

&lt;p&gt;I&amp;#39;m in the outer city area so I&amp;#39;m not able to go to &amp;quot;bars&amp;quot; at a whim and have to use the computer to meet people, 2,000 people live in my town/.&lt;/p&gt;

&lt;p&gt;I already added myself to the bromap and I was the only dot within like 45 km, so it&amp;#39;s not the greatest way.&lt;/p&gt;

&lt;p&gt;Is it just because there are so little gay people in general that I&amp;#39;m having a problem, or could it just be I don&amp;#39;t know about other methods.&lt;/p&gt;

&lt;p&gt;I don&amp;#39;t want a hookup, I did that throughout highschool and really do not care for it anymore, obviously casual hook-up if I hung out with someone is fine, but I don&amp;#39;t like the &amp;quot;come fuck me&amp;quot; shit that is involved with a lot of apps and chat sites, I feel like those people are mentally unstable for some reason haha.&lt;/p&gt;
&lt;/div&gt;&lt;!-- SC_ON --&gt;","False","askgaybros","t5_2vgfw","","","How do you guys meet other people?","0","http://www.reddit.com/r/askgaybros/comments/2uc3nu/how_do_you_guys_meet_other_people/","[]","False"
"17","","","{}","http://www.reddit.com/api/info/","{}","{}","False","","","False","mechatoine","","","","False","1422733138.0","1422733138.0","","self.askgaybros","0","False","0","True","False","2ubyoi","True","","","","","","{}","[]","t3_2ubyoi","3","","False","http://www.reddit.com/r/askgaybros/comments/2ubyoi/first_time_ever_wanting_to_try_a_bath_house/","Unauthenticated reddit sesssion","","False","3","","{}","Hi! First thanks for taking the time to read me. Well, first a little bit of background on me: I'm 27, started being sexually active at age 14 and started going to swingers clubs at age 17 (legal in France). I have met a wonderful wife who does swing with me and supports me throughout my sexuality as I support her. She has had plenty of bi experiences. Well it's been years that I've been wondering about trying myself at some bi action. I'm not so much into anal(even though I have played a few times with dildos) but really into fellatio. Anyways, fast forward to today, I'm on business in Chile and there is what appears to be a nice bath house close by my hotel. I'm trying to decide on going there and seeing for myself, but I really need some first time advises as I'm not so sure how to handle all that. Thanks!","&lt;!-- SC_OFF --&gt;&lt;div class=""md""&gt;&lt;p&gt;Hi! First thanks for taking the time to read me. Well, first a little bit of background on me: I&amp;#39;m 27, started being sexually active at age 14 and started going to swingers clubs at age 17 (legal in France). I have met a wonderful wife who does swing with me and supports me throughout my sexuality as I support her. She has had plenty of bi experiences. Well it&amp;#39;s been years that I&amp;#39;ve been wondering about trying myself at some bi action. I&amp;#39;m not so much into anal(even though I have played a few times with dildos) but really into fellatio. Anyways, fast forward to today, I&amp;#39;m on business in Chile and there is what appears to be a nice bath house close by my hotel. I&amp;#39;m trying to decide on going there and seeing for myself, but I really need some first time advises as I&amp;#39;m not so sure how to handle all that. Thanks!&lt;/p&gt;
&lt;/div&gt;&lt;!-- SC_ON --&gt;","False","askgaybros","t5_2vgfw","","","First time ever. Wanting to try a bath house.","3","http://www.reddit.com/r/askgaybros/comments/2ubyoi/first_time_ever_wanting_to_try_a_bath_house/","[]","False"
"18","","","{}","http://www.reddit.com/api/info/","{}","{}","False","","","False","neurevo","","","","False","1422728893.0","1422728893.0","","self.askgaybros","0","1422729483.0","0","True","False","2ubqbq","True","","","","","","{}","[]","t3_2ubqbq","35","","False","http://www.reddit.com/r/askgaybros/comments/2ubqbq/am_i_rightcan_i_do_this_living_situation/","Unauthenticated reddit sesssion","","False","13","","{}","Before I get to the situation/question, just a heads up that this isn't related to my sexuality at all, but this was the best place I figured could possibly help me out. If it's off-topic and/or worthy of being deleted, then so be it, and I apologize.

So I live in a 3-person apartment with 2 girls (I did not pick them, it was random and the management said that living with them was the only option left). I live in a single room, and the two girls share a double. I get along with one of them very well, but the other one is an utter waste of space. Both me and the one I get along with do not like this other girl, and she isn't too fond of us either, and this is mostly because our lifestyles are polar opposites. We have very intensive schoolwork and rarely make any noise or go out much, while the other girl most likely couldn't care less about school, constantly has friends over, and depending on the night, they are sometimes extremely obnoxious. This aside, all three of us are civil with each other, we don't fight or anything, we're respectful.

So here is the problem - my room isn't really a room. I don't have walls, but instead have these sliding panels that act as my ""walls."" This ""room"" is an extension of the kitchen/living room (this apartment is very small). Consequently, I can hear anything and everything that is going on in there. Roommate I get along with went home for the weekend and basically what happened and why I'm writing this is that the other one came home from going out at around 12:30 in the morning last night with about 6 people while I was sleeping. As they walked in, they were yelling and laughing as if they had the place to themselves. They all went into her room, blasted music, and continued being annoying. My roommate and some guy eventually walked out to find a lighter or something, they left the door open, and basically it's just music blasting in the entire apartment, girls screeching and laughing, some guy yelling stupid shit, and I'm here in my ""room"" hearing it all crystal clear because let's be honest, I'm in the room with them. These sliding panels are not walls and do not cancel out sound. They don't even cover the entire length from the floor to the ceiling. This is all particularly infuriating because I have to be up between 6:00 and 7:00 in the morning every single day of the week for work or school, and I have told this roommate exactly this, but she obviously wasn't listening or didn't care. Maybe this all sounds like me pitying myself, but it's honestly so much different when you're there dealing with it. 

So here's where I'm at now: this was so disrespectful and inconsiderate that I'm done with her. She tends to treat the kitchen/living room as if it is her own room, always having friends over, watching TV and talking and laughing and smoking with them for hours a day, and I hear ALL of it. Seriously, they can mumble and I will hear it perfectly from my ""room.""

I don't want to allow this anymore, and I want to know if I can do this. Since the living room isn't HER room, the way I understand it is that if I don't want any of her friends in there, I can make them leave. And if worse came to worst where they just refused to leave or whatever and I called the cops, that they would side with me. I'd tell her that she can have friends over in HER room, but that hanging out in the LIVING room needs to stop. If I had walls, I'd most likely not have a problem with it, but I don't and so long as I'm paying this ridiculous amount for a ""room"", then I need my peace. And if it matters at all, the other roommate would side with me 100%.

So yeah, am I able to enforce not having guests hanging out in the living room since it's imposing on my own wellbeing?","&lt;!-- SC_OFF --&gt;&lt;div class=""md""&gt;&lt;p&gt;Before I get to the situation/question, just a heads up that this isn&amp;#39;t related to my sexuality at all, but this was the best place I figured could possibly help me out. If it&amp;#39;s off-topic and/or worthy of being deleted, then so be it, and I apologize.&lt;/p&gt;

&lt;p&gt;So I live in a 3-person apartment with 2 girls (I did not pick them, it was random and the management said that living with them was the only option left). I live in a single room, and the two girls share a double. I get along with one of them very well, but the other one is an utter waste of space. Both me and the one I get along with do not like this other girl, and she isn&amp;#39;t too fond of us either, and this is mostly because our lifestyles are polar opposites. We have very intensive schoolwork and rarely make any noise or go out much, while the other girl most likely couldn&amp;#39;t care less about school, constantly has friends over, and depending on the night, they are sometimes extremely obnoxious. This aside, all three of us are civil with each other, we don&amp;#39;t fight or anything, we&amp;#39;re respectful.&lt;/p&gt;

&lt;p&gt;So here is the problem - my room isn&amp;#39;t really a room. I don&amp;#39;t have walls, but instead have these sliding panels that act as my &amp;quot;walls.&amp;quot; This &amp;quot;room&amp;quot; is an extension of the kitchen/living room (this apartment is very small). Consequently, I can hear anything and everything that is going on in there. Roommate I get along with went home for the weekend and basically what happened and why I&amp;#39;m writing this is that the other one came home from going out at around 12:30 in the morning last night with about 6 people while I was sleeping. As they walked in, they were yelling and laughing as if they had the place to themselves. They all went into her room, blasted music, and continued being annoying. My roommate and some guy eventually walked out to find a lighter or something, they left the door open, and basically it&amp;#39;s just music blasting in the entire apartment, girls screeching and laughing, some guy yelling stupid shit, and I&amp;#39;m here in my &amp;quot;room&amp;quot; hearing it all crystal clear because let&amp;#39;s be honest, I&amp;#39;m in the room with them. These sliding panels are not walls and do not cancel out sound. They don&amp;#39;t even cover the entire length from the floor to the ceiling. This is all particularly infuriating because I have to be up between 6:00 and 7:00 in the morning every single day of the week for work or school, and I have told this roommate exactly this, but she obviously wasn&amp;#39;t listening or didn&amp;#39;t care. Maybe this all sounds like me pitying myself, but it&amp;#39;s honestly so much different when you&amp;#39;re there dealing with it. &lt;/p&gt;

&lt;p&gt;So here&amp;#39;s where I&amp;#39;m at now: this was so disrespectful and inconsiderate that I&amp;#39;m done with her. She tends to treat the kitchen/living room as if it is her own room, always having friends over, watching TV and talking and laughing and smoking with them for hours a day, and I hear ALL of it. Seriously, they can mumble and I will hear it perfectly from my &amp;quot;room.&amp;quot;&lt;/p&gt;

&lt;p&gt;I don&amp;#39;t want to allow this anymore, and I want to know if I can do this. Since the living room isn&amp;#39;t HER room, the way I understand it is that if I don&amp;#39;t want any of her friends in there, I can make them leave. And if worse came to worst where they just refused to leave or whatever and I called the cops, that they would side with me. I&amp;#39;d tell her that she can have friends over in HER room, but that hanging out in the LIVING room needs to stop. If I had walls, I&amp;#39;d most likely not have a problem with it, but I don&amp;#39;t and so long as I&amp;#39;m paying this ridiculous amount for a &amp;quot;room&amp;quot;, then I need my peace. And if it matters at all, the other roommate would side with me 100%.&lt;/p&gt;

&lt;p&gt;So yeah, am I able to enforce not having guests hanging out in the living room since it&amp;#39;s imposing on my own wellbeing?&lt;/p&gt;
&lt;/div&gt;&lt;!-- SC_ON --&gt;","False","askgaybros","t5_2vgfw","","","Am I right/Can I do this? (Living situation)","13","http://www.reddit.com/r/askgaybros/comments/2ubqbq/am_i_rightcan_i_do_this_living_situation/","[]","False"
