"","_comment_sort","_comments","_comments_by_id","_info_url","_orphaned","_params","_replaced_more","_underscore_names","approved_by","archived","author","author_flair_css_class","author_flair_text","banned_by","clicked","created","created_utc","distinguished","domain","downs","edited","gilded","has_fetched","hidden","id","is_self","json_dict","likes","link_flair_css_class","link_flair_text","media","media_embed","mod_reports","name","num_comments","num_reports","over_18","permalink","reddit_session","report_reasons","saved","score","secure_media","secure_media_embed","selftext","selftext_html","stickied","subreddit","subreddit_id","suggested_sort","thumbnail","title","ups","url","user_reports","visited"
"15","","","{}","http://www.reddit.com/api/info/","{}","{}","False","","","False","blueisawesome","","","","False","1415512695.0","1415512695.0","","self.askgaybros","0","False","0","True","False","2lqppa","True","","","","","","{}","[]","t3_2lqppa","9","","False","http://www.reddit.com/r/askgaybros/comments/2lqppa/would_anyone_be_willing_to_answer_some_interview/","Unauthenticated reddit sesssion","","False","4","","{}","Hello Redditors! I am a senior level college student and have a diversity paper due on Monday. The purpose is to interview three members of a group that is opposite of mine and ask questions relating to how being a member of that group has impacted them in the workplace. I chose to interview LGBT in order to learn more about a group I do not know much about. I am looking to specifically interview lesbian or gay people of any age that have any form of work experience. I had 3 interviews lined up but one person dropped out, and I need one, preferably two in order to write the paper. The interview would only take about 15 minutes of your time, tops, to write your answers. If you are interested and willing to message me I would greatly appreciate it! Just send me a PM or post here and I will send you a Google Doc with the questions. Thank you, thank you, thank you!!!","&lt;!-- SC_OFF --&gt;&lt;div class=""md""&gt;&lt;p&gt;Hello Redditors! I am a senior level college student and have a diversity paper due on Monday. The purpose is to interview three members of a group that is opposite of mine and ask questions relating to how being a member of that group has impacted them in the workplace. I chose to interview LGBT in order to learn more about a group I do not know much about. I am looking to specifically interview lesbian or gay people of any age that have any form of work experience. I had 3 interviews lined up but one person dropped out, and I need one, preferably two in order to write the paper. The interview would only take about 15 minutes of your time, tops, to write your answers. If you are interested and willing to message me I would greatly appreciate it! Just send me a PM or post here and I will send you a Google Doc with the questions. Thank you, thank you, thank you!!!&lt;/p&gt;
&lt;/div&gt;&lt;!-- SC_ON --&gt;","False","askgaybros","t5_2vgfw","","","Would anyone be willing to answer some interview questions for a college assignment?","4","http://www.reddit.com/r/askgaybros/comments/2lqppa/would_anyone_be_willing_to_answer_some_interview/","[]","False"
"16","","","{}","http://www.reddit.com/api/info/","{}","{}","False","","","False","YeezusXD","","","","False","1415507672.0","1415507672.0","","self.askgaybros","0","False","0","True","False","2lqjfl","True","","","","","","{}","[]","t3_2lqjfl","3","","False","http://www.reddit.com/r/askgaybros/comments/2lqjfl/where_would_i_go_about_finding_other_gay_guys/","Unauthenticated reddit sesssion","","False","0","","{}","So I'm 16 and gay :P I haven't told anyone besides some friends I've met online. But I think I'd feel more comfortable if I had a physical gay friend or boyfriend at that. But when ever thinking about it I always run into where to find other gay guys in my area who are my age or a little older to hang out with or more. I feel that if I find that I'd personally be more comfortable in maybe telling a friend or family. 

I've tried out things like Tinder or Hot or Not but most of the guys on there don't respond after us getting a connection which is annoying 

Also I live in Chicago if that helps 

Thanks, to whoever can help :D","&lt;!-- SC_OFF --&gt;&lt;div class=""md""&gt;&lt;p&gt;So I&amp;#39;m 16 and gay :P I haven&amp;#39;t told anyone besides some friends I&amp;#39;ve met online. But I think I&amp;#39;d feel more comfortable if I had a physical gay friend or boyfriend at that. But when ever thinking about it I always run into where to find other gay guys in my area who are my age or a little older to hang out with or more. I feel that if I find that I&amp;#39;d personally be more comfortable in maybe telling a friend or family. &lt;/p&gt;

&lt;p&gt;I&amp;#39;ve tried out things like Tinder or Hot or Not but most of the guys on there don&amp;#39;t respond after us getting a connection which is annoying &lt;/p&gt;

&lt;p&gt;Also I live in Chicago if that helps &lt;/p&gt;

&lt;p&gt;Thanks, to whoever can help :D&lt;/p&gt;
&lt;/div&gt;&lt;!-- SC_ON --&gt;","False","askgaybros","t5_2vgfw","","","Where would i go about finding other gay guys","0","http://www.reddit.com/r/askgaybros/comments/2lqjfl/where_would_i_go_about_finding_other_gay_guys/","[]","False"
"17","","","{}","http://www.reddit.com/api/info/","{}","{}","False","","","False","wtf000000","","","","False","1415505063.0","1415505063.0","","self.askgaybros","0","1415506286.0","0","True","False","2lqftk","True","","","","","","{}","[]","t3_2lqftk","4","","False","http://www.reddit.com/r/askgaybros/comments/2lqftk/how_to_move_on_when_you_have_feelings_for_a/","Unauthenticated reddit sesssion","","False","1","","{}","I posted the story [http://www.reddit.com/r/relationships/comments/2lodxy/what_to_do_when_you_23m_have_feelings_for_a/] last night, but figured that I might get more help here in case people may have been in similar situations. 

So basically, they are both very good friends of mine. He's been a friend for almost a year, and she's always been my roommate and friend since i don't know when, and he moved in with us a couple of months ago.

He's a very understanding and caring guy that i developed some feelings for him, although i never anticipated to seriously let him know what i felt, cuz it'd be more comfortable for both of us to keep the friendship as it was.

Things changed when she told me someday that she's in love with this guy, and he tends to respond positively (yeah, she's also close enough to discuss these types of things). 

I'd really wish them the very best, and always tried to live under the same roof, and hang out as if nothing happens, but their being affectionate is actually driving me crazy. 

So now I'm in the dilemma that, for one, i know it's probably best for me to move out and have a ""new"" life, but on the other hand, i'm reluctant to give up the friendship as they are very close friends of mine.

What would you do if you get into the situation?

----
UPDATE: Congratulations to them, they just had sex next door.","&lt;!-- SC_OFF --&gt;&lt;div class=""md""&gt;&lt;p&gt;I posted the story [&lt;a href=""http://www.reddit.com/r/relationships/comments/2lodxy/what_to_do_when_you_23m_have_feelings_for_a/""&gt;http://www.reddit.com/r/relationships/comments/2lodxy/what_to_do_when_you_23m_have_feelings_for_a/&lt;/a&gt;] last night, but figured that I might get more help here in case people may have been in similar situations. &lt;/p&gt;

&lt;p&gt;So basically, they are both very good friends of mine. He&amp;#39;s been a friend for almost a year, and she&amp;#39;s always been my roommate and friend since i don&amp;#39;t know when, and he moved in with us a couple of months ago.&lt;/p&gt;

&lt;p&gt;He&amp;#39;s a very understanding and caring guy that i developed some feelings for him, although i never anticipated to seriously let him know what i felt, cuz it&amp;#39;d be more comfortable for both of us to keep the friendship as it was.&lt;/p&gt;

&lt;p&gt;Things changed when she told me someday that she&amp;#39;s in love with this guy, and he tends to respond positively (yeah, she&amp;#39;s also close enough to discuss these types of things). &lt;/p&gt;

&lt;p&gt;I&amp;#39;d really wish them the very best, and always tried to live under the same roof, and hang out as if nothing happens, but their being affectionate is actually driving me crazy. &lt;/p&gt;

&lt;p&gt;So now I&amp;#39;m in the dilemma that, for one, i know it&amp;#39;s probably best for me to move out and have a &amp;quot;new&amp;quot; life, but on the other hand, i&amp;#39;m reluctant to give up the friendship as they are very close friends of mine.&lt;/p&gt;

&lt;p&gt;What would you do if you get into the situation?&lt;/p&gt;

&lt;hr/&gt;

&lt;p&gt;UPDATE: Congratulations to them, they just had sex next door.&lt;/p&gt;
&lt;/div&gt;&lt;!-- SC_ON --&gt;","False","askgaybros","t5_2vgfw","","","how to move on when you have feelings for a friend/roommate, while he's in love with another friend/roommate of yours?","1","http://www.reddit.com/r/askgaybros/comments/2lqftk/how_to_move_on_when_you_have_feelings_for_a/","[]","False"
"18","","","{}","http://www.reddit.com/api/info/","{}","{}","False","","","False","nihao-puppychow","","","","False","1415504104.0","1415504104.0","","self.askgaybros","0","False","0","True","False","2lqegp","True","","","","","","{}","[]","t3_2lqegp","17","","False","http://www.reddit.com/r/askgaybros/comments/2lqegp/gay_christian_literature_for_parents/","Unauthenticated reddit sesssion","","False","2","","{}","So here's the story: 33 year old guy. Been with my boyfriend of 4 years, live in a different part of the country than my folks but I'm finally ready to come out.

Problem: Parents and extended family are all Pentecostal / Evangelical Christians. Growing up, I was also the youth pastor and music pastor at my church. but I left it all behind 5 years ago to travel and spread my wings.

Now, I'm honestly scared shitless about telling them knowing they'll say things like ""you've turned away from your faith"" or ""how could you choose this path? you were a pastor before!""

Does anyone have any advice or know of any literature I can use to help explain my faith and sexuality to them?

tl;dr - coming out to conservative Christian parents. need a book to explain why I'm gay and a Christian and how I'm not going to hell for being with a guy","&lt;!-- SC_OFF --&gt;&lt;div class=""md""&gt;&lt;p&gt;So here&amp;#39;s the story: 33 year old guy. Been with my boyfriend of 4 years, live in a different part of the country than my folks but I&amp;#39;m finally ready to come out.&lt;/p&gt;

&lt;p&gt;Problem: Parents and extended family are all Pentecostal / Evangelical Christians. Growing up, I was also the youth pastor and music pastor at my church. but I left it all behind 5 years ago to travel and spread my wings.&lt;/p&gt;

&lt;p&gt;Now, I&amp;#39;m honestly scared shitless about telling them knowing they&amp;#39;ll say things like &amp;quot;you&amp;#39;ve turned away from your faith&amp;quot; or &amp;quot;how could you choose this path? you were a pastor before!&amp;quot;&lt;/p&gt;

&lt;p&gt;Does anyone have any advice or know of any literature I can use to help explain my faith and sexuality to them?&lt;/p&gt;

&lt;p&gt;tl;dr - coming out to conservative Christian parents. need a book to explain why I&amp;#39;m gay and a Christian and how I&amp;#39;m not going to hell for being with a guy&lt;/p&gt;
&lt;/div&gt;&lt;!-- SC_ON --&gt;","False","askgaybros","t5_2vgfw","","","Gay Christian Literature for Parents??","2","http://www.reddit.com/r/askgaybros/comments/2lqegp/gay_christian_literature_for_parents/","[]","False"
"19","","","{}","http://www.reddit.com/api/info/","{}","{}","False","","","False","Bteatesthighlander1","","","","False","1415498973.0","1415498973.0","","self.askgaybros","0","False","0","True","False","2lq79s","True","","","","","","{}","[]","t3_2lq79s","10","","False","http://www.reddit.com/r/askgaybros/comments/2lq79s/what_are_the_3_most_important_things_in_a/","Unauthenticated reddit sesssion","","False","2","","{}","In your opinion/experience, obviously no one can give an objective answer to such a question. ","&lt;!-- SC_OFF --&gt;&lt;div class=""md""&gt;&lt;p&gt;In your opinion/experience, obviously no one can give an objective answer to such a question. &lt;/p&gt;
&lt;/div&gt;&lt;!-- SC_ON --&gt;","False","askgaybros","t5_2vgfw","","","What are the 3 most important things in a relationship?","2","http://www.reddit.com/r/askgaybros/comments/2lq79s/what_are_the_3_most_important_things_in_a/","[]","False"
"20","","","{}","http://www.reddit.com/api/info/","{}","{}","False","","","False","erminizay","","","","False","1415494398.0","1415494398.0","","self.askgaybros","0","False","0","True","False","2lq0a1","True","","","","","","{}","[]","t3_2lq0a1","9","","False","http://www.reddit.com/r/askgaybros/comments/2lq0a1/i_made_a_really_good_friendbut_im_afraid_im_going/","Unauthenticated reddit sesssion","","False","6","","{}","TL;DR: I made a new friend at work who's super friendly and I don't know what I'm doing.

I started working at this new place a month ago and it's been really awesome. I get along with everyone on my floor, I actually like my manager on a personal level- everything is awesome!

This one guy, however, wanted to make me feel welcome, so he started off by having lunches with me and getting to know me etc. and I REALLY appreciated it. We have a lot of things in common and he's fantastic. The only thing is, I've noticed that he's starting to build his schedule around me and it makes me uncomfortable because I think he's really attractive. He'll walk the long way around so that he passes by my desk, he's had to work on a different floor and he came by just to say hi, he'll walk with me when I have to go anywhere and he's had every lunch with me so far, we've went out for drinks and again, it's really great, but I can't help but think ***not again***. Seriously though, not another straight guy. The thing is, I know I'm flirting with him and I honestly can't help it. 

I KNOW he has a girlfriend, I know he's straight, we've talked about that too. But I also told him that I'm seeing a chick or two. The thing is, I know he's okay with gay dudes, but I just don't feel comfortable coming out at work. I don't have a good reputation yet and I don't want to risk harassment from the opinionated crowd. 

I would come out to him, but it's going to change things between us too and I really like the secret alliance going on. I love the frequent jokes throughout the day and I've used goofing off with him as motivation to work and it's been super effective. So far he's been very friendly and I'm not going to lie, I like the fact that I've made a good friend at work. He's invited me over to show off his grilling skills and video games and I asked to reschedule- I honestly don't know if I can handle it. The thing is, the more time we spend together the more I'll fall for him and I know that.

I know he sees me just as a really good friend especially since I like a strange mix of cult things that make sense to only us. If I were straight then I would have met my best friend, but I'm not and I feel like me being gay is ruining everything.

How do I control the situation? How can I continue walking this fine line without messing everything up?","&lt;!-- SC_OFF --&gt;&lt;div class=""md""&gt;&lt;p&gt;TL;DR: I made a new friend at work who&amp;#39;s super friendly and I don&amp;#39;t know what I&amp;#39;m doing.&lt;/p&gt;

&lt;p&gt;I started working at this new place a month ago and it&amp;#39;s been really awesome. I get along with everyone on my floor, I actually like my manager on a personal level- everything is awesome!&lt;/p&gt;

&lt;p&gt;This one guy, however, wanted to make me feel welcome, so he started off by having lunches with me and getting to know me etc. and I REALLY appreciated it. We have a lot of things in common and he&amp;#39;s fantastic. The only thing is, I&amp;#39;ve noticed that he&amp;#39;s starting to build his schedule around me and it makes me uncomfortable because I think he&amp;#39;s really attractive. He&amp;#39;ll walk the long way around so that he passes by my desk, he&amp;#39;s had to work on a different floor and he came by just to say hi, he&amp;#39;ll walk with me when I have to go anywhere and he&amp;#39;s had every lunch with me so far, we&amp;#39;ve went out for drinks and again, it&amp;#39;s really great, but I can&amp;#39;t help but think &lt;strong&gt;&lt;em&gt;not again&lt;/em&gt;&lt;/strong&gt;. Seriously though, not another straight guy. The thing is, I know I&amp;#39;m flirting with him and I honestly can&amp;#39;t help it. &lt;/p&gt;

&lt;p&gt;I KNOW he has a girlfriend, I know he&amp;#39;s straight, we&amp;#39;ve talked about that too. But I also told him that I&amp;#39;m seeing a chick or two. The thing is, I know he&amp;#39;s okay with gay dudes, but I just don&amp;#39;t feel comfortable coming out at work. I don&amp;#39;t have a good reputation yet and I don&amp;#39;t want to risk harassment from the opinionated crowd. &lt;/p&gt;

&lt;p&gt;I would come out to him, but it&amp;#39;s going to change things between us too and I really like the secret alliance going on. I love the frequent jokes throughout the day and I&amp;#39;ve used goofing off with him as motivation to work and it&amp;#39;s been super effective. So far he&amp;#39;s been very friendly and I&amp;#39;m not going to lie, I like the fact that I&amp;#39;ve made a good friend at work. He&amp;#39;s invited me over to show off his grilling skills and video games and I asked to reschedule- I honestly don&amp;#39;t know if I can handle it. The thing is, the more time we spend together the more I&amp;#39;ll fall for him and I know that.&lt;/p&gt;

&lt;p&gt;I know he sees me just as a really good friend especially since I like a strange mix of cult things that make sense to only us. If I were straight then I would have met my best friend, but I&amp;#39;m not and I feel like me being gay is ruining everything.&lt;/p&gt;

&lt;p&gt;How do I control the situation? How can I continue walking this fine line without messing everything up?&lt;/p&gt;
&lt;/div&gt;&lt;!-- SC_ON --&gt;","False","askgaybros","t5_2vgfw","","","I made a really good friend!...But I'm afraid I'm going to get too friendly.","6","http://www.reddit.com/r/askgaybros/comments/2lq0a1/i_made_a_really_good_friendbut_im_afraid_im_going/","[]","False"
"21","","","{}","http://www.reddit.com/api/info/","{}","{}","False","","","False","a_walking_stereotype","","","","False","1415493596.0","1415493596.0","","self.askgaybros","0","False","0","True","False","2lpz0p","True","","","","","","{}","[]","t3_2lpz0p","10","","False","http://www.reddit.com/r/askgaybros/comments/2lpz0p/how_do_i_move_on/","Unauthenticated reddit sesssion","","False","0","","{}","lets clear some context things up: I'm currently in high school (senior year), 17, gay.

I've had a crush (i know it sounds juvenile, but that's the most fitting word in my mind) on this guy for around 5 years. It all started in 7th grade. I was infatuated with him. He probably felt (and feels) nothing for me, but i don't know. 7th, 8th, and 9th grade was a whole lotta [this.](https://cdn.mediacru.sh/k1CP0fATu5q4.gif) 

I've got two guesses as to what the deal really is. The hopeful one is that he did (or maybe still does) have something for me and that we were both too shy or embarrassed to pursue it. Then theres the realistic guess(s). The realistic guess is that he (a) never felt anything for me and I'm not relevant/I'm just another person to him, or (b) he noticed my infatuation and it made/makes him uncomfortable.

The thing is, i really don't want to leave high school with that end loose. I know its a silly thing that i wont care about in ~5 years, but its something i want. 

Oops, i kinda rambled and got off track. The real question was how do i get over this crush? It's been a long ass time and im still very much in love with him. I know that the the truth is there's little chance the feelings are mutual, and i might even creep him out, but that doesn't do anything to stop it. I'm  tired of feeling shitty because the love isn't reciprocated.

I know this is a very ""teen angst"" post, but please give some feedback.","&lt;!-- SC_OFF --&gt;&lt;div class=""md""&gt;&lt;p&gt;lets clear some context things up: I&amp;#39;m currently in high school (senior year), 17, gay.&lt;/p&gt;

&lt;p&gt;I&amp;#39;ve had a crush (i know it sounds juvenile, but that&amp;#39;s the most fitting word in my mind) on this guy for around 5 years. It all started in 7th grade. I was infatuated with him. He probably felt (and feels) nothing for me, but i don&amp;#39;t know. 7th, 8th, and 9th grade was a whole lotta &lt;a href=""https://cdn.mediacru.sh/k1CP0fATu5q4.gif""&gt;this.&lt;/a&gt; &lt;/p&gt;

&lt;p&gt;I&amp;#39;ve got two guesses as to what the deal really is. The hopeful one is that he did (or maybe still does) have something for me and that we were both too shy or embarrassed to pursue it. Then theres the realistic guess(s). The realistic guess is that he (a) never felt anything for me and I&amp;#39;m not relevant/I&amp;#39;m just another person to him, or (b) he noticed my infatuation and it made/makes him uncomfortable.&lt;/p&gt;

&lt;p&gt;The thing is, i really don&amp;#39;t want to leave high school with that end loose. I know its a silly thing that i wont care about in ~5 years, but its something i want. &lt;/p&gt;

&lt;p&gt;Oops, i kinda rambled and got off track. The real question was how do i get over this crush? It&amp;#39;s been a long ass time and im still very much in love with him. I know that the the truth is there&amp;#39;s little chance the feelings are mutual, and i might even creep him out, but that doesn&amp;#39;t do anything to stop it. I&amp;#39;m  tired of feeling shitty because the love isn&amp;#39;t reciprocated.&lt;/p&gt;

&lt;p&gt;I know this is a very &amp;quot;teen angst&amp;quot; post, but please give some feedback.&lt;/p&gt;
&lt;/div&gt;&lt;!-- SC_ON --&gt;","False","askgaybros","t5_2vgfw","","","How do i move on?","0","http://www.reddit.com/r/askgaybros/comments/2lpz0p/how_do_i_move_on/","[]","False"
"22","","","{}","http://www.reddit.com/api/info/","{}","{}","False","","","False","Sir_Swags_A_Lot","","","","False","1415489936.0","1415489936.0","","self.askgaybros","0","False","0","True","False","2lptdo","True","","","","","","{}","[]","t3_2lptdo","8","","False","http://www.reddit.com/r/askgaybros/comments/2lptdo/when_is_it_the_right_time/","Unauthenticated reddit sesssion","","False","6","","{}","I'll make this short and sweet because I'm short on time.

I'm 90% sure that I'm bi.  When I see an attractive woman I think alo NH the lines ""damn I want that"" and over the past year and a half of so, I have to same thoughts about attractive men.  Not sure if It matters but porn use; straight, lesbian, gay, trans, yiff, futa, etc.  I hit most categories

So at this point you can tell or ask me anything that you want more clarification on or whatever, but here comes my actual point.

Only a select few (female) friends know.  I can't bring it to myself to tell my guy friends and let it start spreading.   Let alone my parents! It's not that I don't accept my sexuality, I do.  I'm not ashamed or scared to say it.  But my main priority is I want to...expiriment before I let people know.  It's one thing to look at a guy and go ""mmm"" and another to actually go down on him. 

So...well...suggestions?  Questions? Comments?  I'll try to answer what I can :)","&lt;!-- SC_OFF --&gt;&lt;div class=""md""&gt;&lt;p&gt;I&amp;#39;ll make this short and sweet because I&amp;#39;m short on time.&lt;/p&gt;

&lt;p&gt;I&amp;#39;m 90% sure that I&amp;#39;m bi.  When I see an attractive woman I think alo NH the lines &amp;quot;damn I want that&amp;quot; and over the past year and a half of so, I have to same thoughts about attractive men.  Not sure if It matters but porn use; straight, lesbian, gay, trans, yiff, futa, etc.  I hit most categories&lt;/p&gt;

&lt;p&gt;So at this point you can tell or ask me anything that you want more clarification on or whatever, but here comes my actual point.&lt;/p&gt;

&lt;p&gt;Only a select few (female) friends know.  I can&amp;#39;t bring it to myself to tell my guy friends and let it start spreading.   Let alone my parents! It&amp;#39;s not that I don&amp;#39;t accept my sexuality, I do.  I&amp;#39;m not ashamed or scared to say it.  But my main priority is I want to...expiriment before I let people know.  It&amp;#39;s one thing to look at a guy and go &amp;quot;mmm&amp;quot; and another to actually go down on him. &lt;/p&gt;

&lt;p&gt;So...well...suggestions?  Questions? Comments?  I&amp;#39;ll try to answer what I can :)&lt;/p&gt;
&lt;/div&gt;&lt;!-- SC_ON --&gt;","False","askgaybros","t5_2vgfw","","","When is it the right time?","6","http://www.reddit.com/r/askgaybros/comments/2lptdo/when_is_it_the_right_time/","[]","False"
