"","_comment_sort","_comments","_comments_by_id","_info_url","_orphaned","_params","_replaced_more","_underscore_names","approved_by","archived","author","author_flair_css_class","author_flair_text","banned_by","clicked","created","created_utc","distinguished","domain","downs","edited","gilded","has_fetched","hidden","id","is_self","json_dict","likes","link_flair_css_class","link_flair_text","media","media_embed","mod_reports","name","num_comments","num_reports","over_18","permalink","reddit_session","report_reasons","saved","score","secure_media","secure_media_embed","selftext","selftext_html","stickied","subreddit","subreddit_id","suggested_sort","thumbnail","title","ups","url","user_reports","visited"
"0","","","{}","http://www.reddit.com/api/info/","{}","{}","False","","","True","throwaywaryah","","","","False","1410276527.0","1410272927.0","","self.askgaybros","0","False","0","True","False","2fwqup","True","","","","","","{}","[]","t3_2fwqup","15","","False","http://www.reddit.com/r/askgaybros/comments/2fwqup/i_bottomed_yesterday_and_it_was_fucked_up/","Unauthenticated reddit sesssion","","False","38","","{}","So yesterday, I tried sitting on my boyfriends dick. Well lubed up and as slow as I needed to be, everything went well until it just went a little bit too far. Hurt like hell, I jumped up and literally fainted, waking up +/- 10 seconds after. I've bottomed before and never had this before, and I'm not sure what's different. It has been 7/8 months since my last time, but still. What should I do?","&lt;!-- SC_OFF --&gt;&lt;div class=""md""&gt;&lt;p&gt;So yesterday, I tried sitting on my boyfriends dick. Well lubed up and as slow as I needed to be, everything went well until it just went a little bit too far. Hurt like hell, I jumped up and literally fainted, waking up +/- 10 seconds after. I&amp;#39;ve bottomed before and never had this before, and I&amp;#39;m not sure what&amp;#39;s different. It has been 7/8 months since my last time, but still. What should I do?&lt;/p&gt;
&lt;/div&gt;&lt;!-- SC_ON --&gt;","False","askgaybros","t5_2vgfw","","","I bottomed yesterday and it was fucked up.","38","http://www.reddit.com/r/askgaybros/comments/2fwqup/i_bottomed_yesterday_and_it_was_fucked_up/","[]","False"
"1","","","{}","http://www.reddit.com/api/info/","{}","{}","False","","","True","IgnisXIII","","","","False","1410269002.0","1410265402.0","","self.askgaybros","0","False","0","True","False","2fwfym","True","","","","","","{}","[]","t3_2fwfym","12","","False","http://www.reddit.com/r/askgaybros/comments/2fwfym/any_advice/","Unauthenticated reddit sesssion","","False","11","","{}","*(moved this here from /r/gaybros)*

I feel so lonely. I have really close friends, but I still have this gap in me. I am a gay 24 year old Mexican boy who just this year had a first kiss, and a few months prior had finally accepted and embraced being gay, but despite my efforts I just can't find anyone... I thought that by accepting it I'd just be able to find someone and be happy. Apparently not... 

I use many apps including Grindr and Tinder, and though I did meet a boy several months ago (the one who gave this first kiss), it's just been one hope surge after another, followed by a downfall each. They get my hopes up and then vanish without a trace. Being smart and nice and looking for love makes it harder, strangely. It's almost as if you can't meet anyone unless you're willing to have meaningless sex with them, which I'm not. Also, there's just no one I like around me, not that anyone that's gay as well anyway. And though I know maybe going to clubs and stuff is better than apps, I don't like clubs and would hate getting my hopes up for nothing again.

So, does anyone have some advice with this?

I just want someone to cuddle with :'(","&lt;!-- SC_OFF --&gt;&lt;div class=""md""&gt;&lt;p&gt;&lt;em&gt;(moved this here from &lt;a href=""/r/gaybros""&gt;/r/gaybros&lt;/a&gt;)&lt;/em&gt;&lt;/p&gt;

&lt;p&gt;I feel so lonely. I have really close friends, but I still have this gap in me. I am a gay 24 year old Mexican boy who just this year had a first kiss, and a few months prior had finally accepted and embraced being gay, but despite my efforts I just can&amp;#39;t find anyone... I thought that by accepting it I&amp;#39;d just be able to find someone and be happy. Apparently not... &lt;/p&gt;

&lt;p&gt;I use many apps including Grindr and Tinder, and though I did meet a boy several months ago (the one who gave this first kiss), it&amp;#39;s just been one hope surge after another, followed by a downfall each. They get my hopes up and then vanish without a trace. Being smart and nice and looking for love makes it harder, strangely. It&amp;#39;s almost as if you can&amp;#39;t meet anyone unless you&amp;#39;re willing to have meaningless sex with them, which I&amp;#39;m not. Also, there&amp;#39;s just no one I like around me, not that anyone that&amp;#39;s gay as well anyway. And though I know maybe going to clubs and stuff is better than apps, I don&amp;#39;t like clubs and would hate getting my hopes up for nothing again.&lt;/p&gt;

&lt;p&gt;So, does anyone have some advice with this?&lt;/p&gt;

&lt;p&gt;I just want someone to cuddle with :&amp;#39;(&lt;/p&gt;
&lt;/div&gt;&lt;!-- SC_ON --&gt;","False","askgaybros","t5_2vgfw","","","Any advice?","11","http://www.reddit.com/r/askgaybros/comments/2fwfym/any_advice/","[]","False"
"2","","","{}","http://www.reddit.com/api/info/","{}","{}","False","","","True","vvicker","","","","False","1410260108.0","1410256508.0","","self.askgaybros","0","False","0","True","False","2fw6yi","True","","","","","","{}","[]","t3_2fw6yi","13","","False","http://www.reddit.com/r/askgaybros/comments/2fw6yi/too_much_to_handle_and_dependence/","Unauthenticated reddit sesssion","","False","3","","{}","Wall of text incoming, guys.

I've recently been talking to a guy (all day every day) who will soon be moving from abroad to the same city I study in for university. We initially started talking with just intentions of being friends, then things started to change. We both always wanted to see one another and have exchanged hundreds of photos (all SFW). We've been discussing possible relationships once he moves here, and how we'll give things ago as we seems to like everything about one another.

However, after a weekend of not talking due to being away with friends at home, there was a further day of no communication until the evening. The guy expressed to me his worry of feeling like he shouldn't have gone away and instead stayed committed to some ongoing studies. He spent the entire Saturday morning looking over our photos, and missing talking to me all the time. After, saying he received some messages I sent (there was little stable internet where he was staying) that he had mixed feelings. First feeling relieved he got to hear from me, then realising ""it's kinda crazy we're so attached to one another"". Followed by some worrying about whether it's a healthy situation. That he's confused.

After asking what he meant, he explain that if we're like we are now and we've yet to meet, once he moves over here, he ""bets"" he's going to become too dependent on me. I'll be the only person I know here and we'll want to spend a lot of time with one another (an idea he loves). But he's afraid it'll stop him from getting on over here when he moves. He's worried that he will end up spending all his free time with me, and won't get the opportunity to make new friend, meet new people and to see how he can cope on his own. I can understand the worry he has, as it is a new city in a brand new country.

He says he's still trying to figure our what he thinks about what he told me, but felt I deserve to know what his mind is up to. After me saying there isn't much I can say, said he'd love to hear what I think and that I could clear his thoughts. 

After a little more conversation he said the same thing. He's worried he will be depending too much on me and me too much on him. That the whole relationship could be too much to handle as soon as he arrives (even though I don't really want to get right into a deep, serious relationship on Day 1). I've told him that to me sex is incredibly special, I only want to have it with the guy I adore and potentially spend the rest of my life with. He even says he knows himself how I want things to happen and to come about, but the second thoughts he's having are making him wonder if he's that guy for me. 

We've spoken openly about how much we like one another, and another point he brought up was how he knows he will feel so comfortable with me, he likes me. And he fears he could get really intimate with me right away, saying that he can't say for sure he'll be the man I want him to be. I only want him to be himself, because he as he is, is the only guy I want him to be. 

Finally, he said that it's too much pressure. I'm not sure if it's just the entire relationship consideration thing, or that in combination with the stress from his studies. I asked if he wants us to sort this, to which he replied he need to make up his mind on what he wants, that he can't start something like that with me if he's not 100% sure it's what is best for both of us.

I realise that's a massive read and I thank anyone who took the time to read it. I appreciate it. Hugely. I guess I just want to know what guys think I should do, or say. I'm a little confused, I really do want something to happen badly. I just don't know how to respond, or what to say.

So... yeah... Helps? :)","&lt;!-- SC_OFF --&gt;&lt;div class=""md""&gt;&lt;p&gt;Wall of text incoming, guys.&lt;/p&gt;

&lt;p&gt;I&amp;#39;ve recently been talking to a guy (all day every day) who will soon be moving from abroad to the same city I study in for university. We initially started talking with just intentions of being friends, then things started to change. We both always wanted to see one another and have exchanged hundreds of photos (all SFW). We&amp;#39;ve been discussing possible relationships once he moves here, and how we&amp;#39;ll give things ago as we seems to like everything about one another.&lt;/p&gt;

&lt;p&gt;However, after a weekend of not talking due to being away with friends at home, there was a further day of no communication until the evening. The guy expressed to me his worry of feeling like he shouldn&amp;#39;t have gone away and instead stayed committed to some ongoing studies. He spent the entire Saturday morning looking over our photos, and missing talking to me all the time. After, saying he received some messages I sent (there was little stable internet where he was staying) that he had mixed feelings. First feeling relieved he got to hear from me, then realising &amp;quot;it&amp;#39;s kinda crazy we&amp;#39;re so attached to one another&amp;quot;. Followed by some worrying about whether it&amp;#39;s a healthy situation. That he&amp;#39;s confused.&lt;/p&gt;

&lt;p&gt;After asking what he meant, he explain that if we&amp;#39;re like we are now and we&amp;#39;ve yet to meet, once he moves over here, he &amp;quot;bets&amp;quot; he&amp;#39;s going to become too dependent on me. I&amp;#39;ll be the only person I know here and we&amp;#39;ll want to spend a lot of time with one another (an idea he loves). But he&amp;#39;s afraid it&amp;#39;ll stop him from getting on over here when he moves. He&amp;#39;s worried that he will end up spending all his free time with me, and won&amp;#39;t get the opportunity to make new friend, meet new people and to see how he can cope on his own. I can understand the worry he has, as it is a new city in a brand new country.&lt;/p&gt;

&lt;p&gt;He says he&amp;#39;s still trying to figure our what he thinks about what he told me, but felt I deserve to know what his mind is up to. After me saying there isn&amp;#39;t much I can say, said he&amp;#39;d love to hear what I think and that I could clear his thoughts. &lt;/p&gt;

&lt;p&gt;After a little more conversation he said the same thing. He&amp;#39;s worried he will be depending too much on me and me too much on him. That the whole relationship could be too much to handle as soon as he arrives (even though I don&amp;#39;t really want to get right into a deep, serious relationship on Day 1). I&amp;#39;ve told him that to me sex is incredibly special, I only want to have it with the guy I adore and potentially spend the rest of my life with. He even says he knows himself how I want things to happen and to come about, but the second thoughts he&amp;#39;s having are making him wonder if he&amp;#39;s that guy for me. &lt;/p&gt;

&lt;p&gt;We&amp;#39;ve spoken openly about how much we like one another, and another point he brought up was how he knows he will feel so comfortable with me, he likes me. And he fears he could get really intimate with me right away, saying that he can&amp;#39;t say for sure he&amp;#39;ll be the man I want him to be. I only want him to be himself, because he as he is, is the only guy I want him to be. &lt;/p&gt;

&lt;p&gt;Finally, he said that it&amp;#39;s too much pressure. I&amp;#39;m not sure if it&amp;#39;s just the entire relationship consideration thing, or that in combination with the stress from his studies. I asked if he wants us to sort this, to which he replied he need to make up his mind on what he wants, that he can&amp;#39;t start something like that with me if he&amp;#39;s not 100% sure it&amp;#39;s what is best for both of us.&lt;/p&gt;

&lt;p&gt;I realise that&amp;#39;s a massive read and I thank anyone who took the time to read it. I appreciate it. Hugely. I guess I just want to know what guys think I should do, or say. I&amp;#39;m a little confused, I really do want something to happen badly. I just don&amp;#39;t know how to respond, or what to say.&lt;/p&gt;

&lt;p&gt;So... yeah... Helps? :)&lt;/p&gt;
&lt;/div&gt;&lt;!-- SC_ON --&gt;","False","askgaybros","t5_2vgfw","","","Too much to handle and 'dependence'","3","http://www.reddit.com/r/askgaybros/comments/2fw6yi/too_much_to_handle_and_dependence/","[]","False"
"3","","","{}","http://www.reddit.com/api/info/","{}","{}","False","","","True","stuck898","","","","False","1410257959.0","1410254359.0","","self.askgaybros","0","False","0","True","False","2fw54f","True","","","","","","{}","[]","t3_2fw54f","7","","False","http://www.reddit.com/r/askgaybros/comments/2fw54f/what_do_you_do_if_youre_no_longer_on_speaking/","Unauthenticated reddit sesssion","","False","3","","{}","This guy and I were dating for a couple of years.  The breakup we had ended really badly (I'll spare you the gory details, we were both at fault), but it lead to us no longer speaking to each other at all.  He pretty much blacklisted me despite me agreeing to be civil.  Anyway, it has been almost 3 weeks since this happened and today I got a bill for something that he was responsible for.  

It felt uneasy to have to contact him to inform him, but last night I sent him a picture of it (in three different types of messenger apps in case he blocked me somehow, he already removed me from FB) letting him know if he has any concerns to call the company and to please let me know that he got it so I know it can be taken care of.  

He never replied to me about it.  I know that it went through because on one of the apps it said it was ""read.""   I really don't want this to be a problem, but what happens if this is not taken care of and he still refuses to speak to me?  What can I do in this situation?  He should have at least replied ""ok"" so I can not have to worry about it. ","&lt;!-- SC_OFF --&gt;&lt;div class=""md""&gt;&lt;p&gt;This guy and I were dating for a couple of years.  The breakup we had ended really badly (I&amp;#39;ll spare you the gory details, we were both at fault), but it lead to us no longer speaking to each other at all.  He pretty much blacklisted me despite me agreeing to be civil.  Anyway, it has been almost 3 weeks since this happened and today I got a bill for something that he was responsible for.  &lt;/p&gt;

&lt;p&gt;It felt uneasy to have to contact him to inform him, but last night I sent him a picture of it (in three different types of messenger apps in case he blocked me somehow, he already removed me from FB) letting him know if he has any concerns to call the company and to please let me know that he got it so I know it can be taken care of.  &lt;/p&gt;

&lt;p&gt;He never replied to me about it.  I know that it went through because on one of the apps it said it was &amp;quot;read.&amp;quot;   I really don&amp;#39;t want this to be a problem, but what happens if this is not taken care of and he still refuses to speak to me?  What can I do in this situation?  He should have at least replied &amp;quot;ok&amp;quot; so I can not have to worry about it. &lt;/p&gt;
&lt;/div&gt;&lt;!-- SC_ON --&gt;","False","askgaybros","t5_2vgfw","","","What do you do if you're no longer on speaking terms with a recent ex and you have to get in contact with him over a bill?","3","http://www.reddit.com/r/askgaybros/comments/2fw54f/what_do_you_do_if_youre_no_longer_on_speaking/","[]","False"
"4","","","{}","http://www.reddit.com/api/info/","{}","{}","False","","","True","Eriol_Aldebaran","","","","False","1410247023.0","1410243423.0","","self.askgaybros","0","False","0","True","False","2fvuw7","True","","","","","","{}","[]","t3_2fvuw7","7","","False","http://www.reddit.com/r/askgaybros/comments/2fvuw7/in_panic_mode_right_nowi_accidentally_flashed_my/","Unauthenticated reddit sesssion","","False","16","","{}","So my sister borrowed my laptop to submit an assignment to turnitin.com. I refused but after much arguing...agreed to do it. Anyways, as she clicked the submit button, the pop up folder automatically opened to none other than my porn stash! I immediately closed the window...but not before she's been treated with her closeted brother's lovely collection of fetish porn. I just kept cool and quickly changed the subject. But things got really quiet and it's kinda awkward right now.

Should I just ignore it ever happened? Casually come out to her? Or...? Help...","&lt;!-- SC_OFF --&gt;&lt;div class=""md""&gt;&lt;p&gt;So my sister borrowed my laptop to submit an assignment to turnitin.com. I refused but after much arguing...agreed to do it. Anyways, as she clicked the submit button, the pop up folder automatically opened to none other than my porn stash! I immediately closed the window...but not before she&amp;#39;s been treated with her closeted brother&amp;#39;s lovely collection of fetish porn. I just kept cool and quickly changed the subject. But things got really quiet and it&amp;#39;s kinda awkward right now.&lt;/p&gt;

&lt;p&gt;Should I just ignore it ever happened? Casually come out to her? Or...? Help...&lt;/p&gt;
&lt;/div&gt;&lt;!-- SC_ON --&gt;","False","askgaybros","t5_2vgfw","","","In panic mode right now...I accidentally flashed my sister of my porn stash...help!","16","http://www.reddit.com/r/askgaybros/comments/2fvuw7/in_panic_mode_right_nowi_accidentally_flashed_my/","[]","False"
