"","_comment_sort","_comments","_comments_by_id","_info_url","_orphaned","_params","_replaced_more","_underscore_names","approved_by","archived","author","author_flair_css_class","author_flair_text","banned_by","clicked","created","created_utc","distinguished","domain","downs","edited","gilded","has_fetched","hidden","id","is_self","json_dict","likes","link_flair_css_class","link_flair_text","media","media_embed","mod_reports","name","num_comments","num_reports","over_18","permalink","reddit_session","report_reasons","saved","score","secure_media","secure_media_embed","selftext","selftext_html","stickied","subreddit","subreddit_id","suggested_sort","thumbnail","title","ups","url","user_reports","visited"
"0","","","{}","http://www.reddit.com/api/info/","{}","{}","False","","","False","shing93","","","","False","1421243825.0","1421243825.0","","self.askgaybros","0","False","0","True","False","2seelq","True","","","","","","{}","[]","t3_2seelq","30","","False","http://www.reddit.com/r/askgaybros/comments/2seelq/im_still_trying_to_come_to_terms_with_being_gay/","Unauthenticated reddit sesssion","","False","4","","{}","If being gay is natural and all, then of course it would be natural for men to have sex with other men. But if that is the case then why don't men self lubricate? Gay sex without lube is almost entirely impossible and I guess for some reason this bothers me because it really kills the spontaneous mood. ","&lt;!-- SC_OFF --&gt;&lt;div class=""md""&gt;&lt;p&gt;If being gay is natural and all, then of course it would be natural for men to have sex with other men. But if that is the case then why don&amp;#39;t men self lubricate? Gay sex without lube is almost entirely impossible and I guess for some reason this bothers me because it really kills the spontaneous mood. &lt;/p&gt;
&lt;/div&gt;&lt;!-- SC_ON --&gt;","False","askgaybros","t5_2vgfw","","","I'm still trying to come to terms with being gay, but one thing really bothers me.","4","http://www.reddit.com/r/askgaybros/comments/2seelq/im_still_trying_to_come_to_terms_with_being_gay/","[]","False"
"1","","","{}","http://www.reddit.com/api/info/","{}","{}","False","","","False","joseph_vmp","","","","False","1421237640.0","1421237640.0","","self.askgaybros","0","False","0","True","False","2se6no","True","","","","","","{}","[]","t3_2se6no","29","","False","http://www.reddit.com/r/askgaybros/comments/2se6no/my_bf_wants_to_be_a_drag_but_it_really_turns_me/","Unauthenticated reddit sesssion","","False","3","","{}","Hi redditors, I’ve been in a serious relationship for 8 months now and about a month ago my boyfriend started to show a really big interest in the drag community. He spent his vacations at my house, 30 days in a roll, and started to talk a lot about how brave drags were and how much he looked up for them.

He’s planning on buying a rug this week and posting a picture dressed up on twitter. I know it sounds like prejudice, but I’m really open minded about sexual preference and respect everything a person does to feel good in its skin, the problem is that I feel no sexual desire at all for drags, in fact, just thinking about him dressed up like that really turns me off.

Have any of you been through a similar situation? What would be your response if you were in my shoes?","&lt;!-- SC_OFF --&gt;&lt;div class=""md""&gt;&lt;p&gt;Hi redditors, I’ve been in a serious relationship for 8 months now and about a month ago my boyfriend started to show a really big interest in the drag community. He spent his vacations at my house, 30 days in a roll, and started to talk a lot about how brave drags were and how much he looked up for them.&lt;/p&gt;

&lt;p&gt;He’s planning on buying a rug this week and posting a picture dressed up on twitter. I know it sounds like prejudice, but I’m really open minded about sexual preference and respect everything a person does to feel good in its skin, the problem is that I feel no sexual desire at all for drags, in fact, just thinking about him dressed up like that really turns me off.&lt;/p&gt;

&lt;p&gt;Have any of you been through a similar situation? What would be your response if you were in my shoes?&lt;/p&gt;
&lt;/div&gt;&lt;!-- SC_ON --&gt;","False","askgaybros","t5_2vgfw","","","My bf wants to be a drag, but it really turns me off","3","http://www.reddit.com/r/askgaybros/comments/2se6no/my_bf_wants_to_be_a_drag_but_it_really_turns_me/","[]","False"
"2","","","{}","http://www.reddit.com/api/info/","{}","{}","False","","","False","danielwhack","","","","False","1421233656.0","1421233656.0","","self.askgaybros","0","1421329679.0","0","True","False","2se2du","True","","","","","","{}","[]","t3_2se2du","40","","False","http://www.reddit.com/r/askgaybros/comments/2se2du/medical_emergency_bros/","Unauthenticated reddit sesssion","","False","7","","{}","Hey internet friends. Just writing this so someone out there can give me some piece of mind. I have booked a doctor's appointment for tomorrow before anyone worries.

So over the last few day's I've had that 'kicked in the balls' pain in my epididymis. The pain is mild, not constant and changes from one ball to the other. The balls themselves are fine.
So this morning I go for a piss and notice my left ball is twice as big as normal and higher than normal.

Bros who have nut complaints, give me some good news?

Update:
Okay bros. Something I forgot to add was I've been engaging in nofap and my man has been ill so I had basically not ejaculated for a full week. After writing this I jerked off twice just to see if it were nofap related. Well by yesterday evening my balls were back to normal and no complaints down there continued. Went to the doctor today who confirmed it must have been blue balls. Bros, it was scary! ","&lt;!-- SC_OFF --&gt;&lt;div class=""md""&gt;&lt;p&gt;Hey internet friends. Just writing this so someone out there can give me some piece of mind. I have booked a doctor&amp;#39;s appointment for tomorrow before anyone worries.&lt;/p&gt;

&lt;p&gt;So over the last few day&amp;#39;s I&amp;#39;ve had that &amp;#39;kicked in the balls&amp;#39; pain in my epididymis. The pain is mild, not constant and changes from one ball to the other. The balls themselves are fine.
So this morning I go for a piss and notice my left ball is twice as big as normal and higher than normal.&lt;/p&gt;

&lt;p&gt;Bros who have nut complaints, give me some good news?&lt;/p&gt;

&lt;p&gt;Update:
Okay bros. Something I forgot to add was I&amp;#39;ve been engaging in nofap and my man has been ill so I had basically not ejaculated for a full week. After writing this I jerked off twice just to see if it were nofap related. Well by yesterday evening my balls were back to normal and no complaints down there continued. Went to the doctor today who confirmed it must have been blue balls. Bros, it was scary! &lt;/p&gt;
&lt;/div&gt;&lt;!-- SC_ON --&gt;","False","askgaybros","t5_2vgfw","","","Medical emergency bros!","7","http://www.reddit.com/r/askgaybros/comments/2se2du/medical_emergency_bros/","[]","False"
"3","","","{}","http://www.reddit.com/api/info/","{}","{}","False","","","False","YesAn0therthr0waway","","","","False","1421225241.0","1421225241.0","","self.askgaybros","0","False","0","True","False","2sdtvu","True","","","","","","{}","[]","t3_2sdtvu","5","","False","http://www.reddit.com/r/askgaybros/comments/2sdtvu/will_overcoming_death_grip_help_me_enjoy/","Unauthenticated reddit sesssion","","False","1","","{}","I'm very sure that I suffer from death grip, but i think I conditioned myself towards something worse:  

In addition to using a strong grip, I also have to tense my body (lock my knees, toes pointing sort of out) and I tighten my sphincter muscle when masturbating.  I can enjoy the sensations from a blowjob, but have never come close to orgasm from it.  I'll end up jerking off to finish when I am with someone, and sadly bottoming gives me zero stimulation.  When my prostate is touched it feels like a funny pressure, and definitely not something I can cum from.  Ugh, I really wish I could orgasm while a guy is fucking me.  I certainly know I am a bottom because I love the mental aspect of it, but the physical stimulation just isn't there.  I enjoy being responsive to my partner when something feels great, but I end up faking it when it comes to bottoming. 

Help? :(

","&lt;!-- SC_OFF --&gt;&lt;div class=""md""&gt;&lt;p&gt;I&amp;#39;m very sure that I suffer from death grip, but i think I conditioned myself towards something worse:  &lt;/p&gt;

&lt;p&gt;In addition to using a strong grip, I also have to tense my body (lock my knees, toes pointing sort of out) and I tighten my sphincter muscle when masturbating.  I can enjoy the sensations from a blowjob, but have never come close to orgasm from it.  I&amp;#39;ll end up jerking off to finish when I am with someone, and sadly bottoming gives me zero stimulation.  When my prostate is touched it feels like a funny pressure, and definitely not something I can cum from.  Ugh, I really wish I could orgasm while a guy is fucking me.  I certainly know I am a bottom because I love the mental aspect of it, but the physical stimulation just isn&amp;#39;t there.  I enjoy being responsive to my partner when something feels great, but I end up faking it when it comes to bottoming. &lt;/p&gt;

&lt;p&gt;Help? :(&lt;/p&gt;
&lt;/div&gt;&lt;!-- SC_ON --&gt;","False","askgaybros","t5_2vgfw","","","Will overcoming ""death grip"" help me enjoy bottoming more?","1","http://www.reddit.com/r/askgaybros/comments/2sdtvu/will_overcoming_death_grip_help_me_enjoy/","[]","False"
"4","","","{}","http://www.reddit.com/api/info/","{}","{}","False","","","False","CurryGate","","","","False","1421222538.0","1421222538.0","","self.askgaybros","0","False","0","True","False","2sdr1e","True","","","","","","{}","[]","t3_2sdr1e","3","","False","http://www.reddit.com/r/askgaybros/comments/2sdr1e/so_how_do_i_tell_my_dad/","Unauthenticated reddit sesssion","","False","0","","{}","For a year I've been so worried what he might think, his son that he raised and was so close to all his life. It's been unnerving for him to say the least. A year ago I had decided to pull an epic prank on him by telling him that I was gay. His reaction wasn't what I had expected at all. Instead of an expected verbal lashing, he did something I never thought a father would do in this situation. He teared up and embraced me, ""son I've never been prouder of you my entire life. The courage to do this, to show the world you are strong enough to be a gay man in a misunderstanding and vile world, is something I could never tell my parents. You are the person I had hoped to be at your age.""

So uhh how do I tell my dad that I'm actually straight? He came out right after I did and we've been going to gay bars, listening to Lady Gaga while jamming out with pretend microphones and fake wigs as well as other things. He even has a partner of 3 months named Bill in a nearby city. The two go salsa dancing all the time. The thing is he's never been happier and I don't want to ruin it for him. Do I continue my epic prank or do you think he's the one pranking me even harder? Please help.","&lt;!-- SC_OFF --&gt;&lt;div class=""md""&gt;&lt;p&gt;For a year I&amp;#39;ve been so worried what he might think, his son that he raised and was so close to all his life. It&amp;#39;s been unnerving for him to say the least. A year ago I had decided to pull an epic prank on him by telling him that I was gay. His reaction wasn&amp;#39;t what I had expected at all. Instead of an expected verbal lashing, he did something I never thought a father would do in this situation. He teared up and embraced me, &amp;quot;son I&amp;#39;ve never been prouder of you my entire life. The courage to do this, to show the world you are strong enough to be a gay man in a misunderstanding and vile world, is something I could never tell my parents. You are the person I had hoped to be at your age.&amp;quot;&lt;/p&gt;

&lt;p&gt;So uhh how do I tell my dad that I&amp;#39;m actually straight? He came out right after I did and we&amp;#39;ve been going to gay bars, listening to Lady Gaga while jamming out with pretend microphones and fake wigs as well as other things. He even has a partner of 3 months named Bill in a nearby city. The two go salsa dancing all the time. The thing is he&amp;#39;s never been happier and I don&amp;#39;t want to ruin it for him. Do I continue my epic prank or do you think he&amp;#39;s the one pranking me even harder? Please help.&lt;/p&gt;
&lt;/div&gt;&lt;!-- SC_ON --&gt;","False","askgaybros","t5_2vgfw","","","So how do I tell my dad...?","0","http://www.reddit.com/r/askgaybros/comments/2sdr1e/so_how_do_i_tell_my_dad/","[]","False"
"5","","","{}","http://www.reddit.com/api/info/","{}","{}","False","","","False","jred85","","","","False","1421217767.0","1421217767.0","","self.askgaybros","0","False","0","True","False","2sdl2j","True","","","","","","{}","[]","t3_2sdl2j","8","","False","http://www.reddit.com/r/askgaybros/comments/2sdl2j/what_do_you_class_as_porn/","Unauthenticated reddit sesssion","","False","1","","{}","Wanting to know what you guys class as porn. Is a topless guy on instagram porn?","&lt;!-- SC_OFF --&gt;&lt;div class=""md""&gt;&lt;p&gt;Wanting to know what you guys class as porn. Is a topless guy on instagram porn?&lt;/p&gt;
&lt;/div&gt;&lt;!-- SC_ON --&gt;","False","askgaybros","t5_2vgfw","","","What do you class as porn?","1","http://www.reddit.com/r/askgaybros/comments/2sdl2j/what_do_you_class_as_porn/","[]","False"
"6","","","{}","http://www.reddit.com/api/info/","{}","{}","False","","","False","RICE_RICE_BABY","","","","False","1421217065.0","1421217065.0","","self.askgaybros","0","False","0","True","False","2sdk2t","True","","","","","","{}","[]","t3_2sdk2t","5","","False","http://www.reddit.com/r/askgaybros/comments/2sdk2t/out_to_my_family_but_not_to_my_friends/","Unauthenticated reddit sesssion","","False","1","","{}","I came out to my family in August and it went totally fine, they had long suspected and were totally ready for when I felt ready. A few of my old coworkers are aware, and that's great, but I haven't found the ""right"" time to come out to my high school friends. We have stayed close since graduation and I feel like finally coming out to them the final piece to being able to move forward in this part of my life. 

In December, we had one of our famous LAN parties and I had promised myself after the last get together with them that I would sneak it in at some point during the night. I feel READY to do it (now that I've had some practice) but I just can't seem to string the words together and say them at a poignant time. 

Part of me wants to just post a short and sweet note to Facebook where they'll all see it immediately (as well as other old acquaintances, no worries there) but another part of me wants to come out to them in person. 

I'm not romantically into any of them and I never have been. In the past they've made some hints that they're aware I'm gay but I've always brushed it off (deflection, usually). Funnily enough on two different occasions two different friends saw me browsing this very subreddit with them not quite registering what it was before I closed or switched tabs and changed gears.

How should I go about this, gaybros?
","&lt;!-- SC_OFF --&gt;&lt;div class=""md""&gt;&lt;p&gt;I came out to my family in August and it went totally fine, they had long suspected and were totally ready for when I felt ready. A few of my old coworkers are aware, and that&amp;#39;s great, but I haven&amp;#39;t found the &amp;quot;right&amp;quot; time to come out to my high school friends. We have stayed close since graduation and I feel like finally coming out to them the final piece to being able to move forward in this part of my life. &lt;/p&gt;

&lt;p&gt;In December, we had one of our famous LAN parties and I had promised myself after the last get together with them that I would sneak it in at some point during the night. I feel READY to do it (now that I&amp;#39;ve had some practice) but I just can&amp;#39;t seem to string the words together and say them at a poignant time. &lt;/p&gt;

&lt;p&gt;Part of me wants to just post a short and sweet note to Facebook where they&amp;#39;ll all see it immediately (as well as other old acquaintances, no worries there) but another part of me wants to come out to them in person. &lt;/p&gt;

&lt;p&gt;I&amp;#39;m not romantically into any of them and I never have been. In the past they&amp;#39;ve made some hints that they&amp;#39;re aware I&amp;#39;m gay but I&amp;#39;ve always brushed it off (deflection, usually). Funnily enough on two different occasions two different friends saw me browsing this very subreddit with them not quite registering what it was before I closed or switched tabs and changed gears.&lt;/p&gt;

&lt;p&gt;How should I go about this, gaybros?&lt;/p&gt;
&lt;/div&gt;&lt;!-- SC_ON --&gt;","False","askgaybros","t5_2vgfw","","","Out to my family, but not to my friends","1","http://www.reddit.com/r/askgaybros/comments/2sdk2t/out_to_my_family_but_not_to_my_friends/","[]","False"
"7","","","{}","http://www.reddit.com/api/info/","{}","{}","False","","","False","MarthRoyIke","","","","False","1421216672.0","1421216672.0","","self.askgaybros","0","False","0","True","False","2sdjgd","True","","","","","","{}","[]","t3_2sdjgd","4","","False","http://www.reddit.com/r/askgaybros/comments/2sdjgd/embarrassed_about_my_ex/","Unauthenticated reddit sesssion","","False","1","","{}","I dated my ex for 6 years and we've been separated for 6 months. She was a wonderful woman, she knows about my sexuality, and it was the reason why we separated. Since then I've tried to put myself out there, going to gay events and befriending gay people in order to get more comfortable with myself. I'm finding it awkward talking to other gay guys about my ex because how it comes up seems to be always misleading.

When I share my relationship experiences with others, inevitably my stories use the correct pronouns. Because I am still building my comfort level with being gay, I don't think I've mastered what I need to say or do to leave that signal that I am single AND gay, and not just an ally. I find myself embarrassed to let guys know that my ex was a woman, and coupled with my discomfort I feel like this comes across as bad.

I do the same thing in straight company. I find it hard to bring up my homosexuality and availability, as I organically never talk about my private life unless to close friends, and once I mention my ex and the experiences we had together, the pronouns will lead people to believe that I am straight when indeed I am not. Most people can't get how I indeed had mindblowing sex with her yet I'm still 100% gay.

This isn't a big frustration of mine, but a small hurdle in acceptance. I haven't found the way to navigate this strange new world I've finally decided to explore. I want to be the healthy, well-adjusted, comfortable, attractive, and proud gay man that I know I can be, but I'm afraid this and other insecurities and issues will keep me from finding the right one for me, if they are indeed out there.","&lt;!-- SC_OFF --&gt;&lt;div class=""md""&gt;&lt;p&gt;I dated my ex for 6 years and we&amp;#39;ve been separated for 6 months. She was a wonderful woman, she knows about my sexuality, and it was the reason why we separated. Since then I&amp;#39;ve tried to put myself out there, going to gay events and befriending gay people in order to get more comfortable with myself. I&amp;#39;m finding it awkward talking to other gay guys about my ex because how it comes up seems to be always misleading.&lt;/p&gt;

&lt;p&gt;When I share my relationship experiences with others, inevitably my stories use the correct pronouns. Because I am still building my comfort level with being gay, I don&amp;#39;t think I&amp;#39;ve mastered what I need to say or do to leave that signal that I am single AND gay, and not just an ally. I find myself embarrassed to let guys know that my ex was a woman, and coupled with my discomfort I feel like this comes across as bad.&lt;/p&gt;

&lt;p&gt;I do the same thing in straight company. I find it hard to bring up my homosexuality and availability, as I organically never talk about my private life unless to close friends, and once I mention my ex and the experiences we had together, the pronouns will lead people to believe that I am straight when indeed I am not. Most people can&amp;#39;t get how I indeed had mindblowing sex with her yet I&amp;#39;m still 100% gay.&lt;/p&gt;

&lt;p&gt;This isn&amp;#39;t a big frustration of mine, but a small hurdle in acceptance. I haven&amp;#39;t found the way to navigate this strange new world I&amp;#39;ve finally decided to explore. I want to be the healthy, well-adjusted, comfortable, attractive, and proud gay man that I know I can be, but I&amp;#39;m afraid this and other insecurities and issues will keep me from finding the right one for me, if they are indeed out there.&lt;/p&gt;
&lt;/div&gt;&lt;!-- SC_ON --&gt;","False","askgaybros","t5_2vgfw","","","Embarrassed About My Ex","1","http://www.reddit.com/r/askgaybros/comments/2sdjgd/embarrassed_about_my_ex/","[]","False"
"8","","","{}","http://www.reddit.com/api/info/","{}","{}","False","","","False","Atrumentis","","","","False","1421215535.0","1421215535.0","","self.askgaybros","0","False","0","True","False","2sdhpw","True","","","","","","{}","[]","t3_2sdhpw","12","","False","http://www.reddit.com/r/askgaybros/comments/2sdhpw/simple_workout_routine_without_equipment/","Unauthenticated reddit sesssion","","False","2","","{}","Hey Bros, I want to start working out but I am overwhelmed with all the choices. I just want to do something simple in my own home that will improve my overall tone (I'm skinny so I don't need to lose weight). 

Do you guys do anything in your own home without equipment? 

I tried doing tabata but it almost kills me. I get a headache and feel like I'm dying for the rest of the day even though I eat and drink plenty of water so my urine is clear. I don't get this so called euphoria everyone talks about. 

I need something that is super simple. Like x number of push ups and sit ups and something that helps my ass look good. 

Can anyone help? ","&lt;!-- SC_OFF --&gt;&lt;div class=""md""&gt;&lt;p&gt;Hey Bros, I want to start working out but I am overwhelmed with all the choices. I just want to do something simple in my own home that will improve my overall tone (I&amp;#39;m skinny so I don&amp;#39;t need to lose weight). &lt;/p&gt;

&lt;p&gt;Do you guys do anything in your own home without equipment? &lt;/p&gt;

&lt;p&gt;I tried doing tabata but it almost kills me. I get a headache and feel like I&amp;#39;m dying for the rest of the day even though I eat and drink plenty of water so my urine is clear. I don&amp;#39;t get this so called euphoria everyone talks about. &lt;/p&gt;

&lt;p&gt;I need something that is super simple. Like x number of push ups and sit ups and something that helps my ass look good. &lt;/p&gt;

&lt;p&gt;Can anyone help? &lt;/p&gt;
&lt;/div&gt;&lt;!-- SC_ON --&gt;","False","askgaybros","t5_2vgfw","","","Simple workout routine without equipment?","2","http://www.reddit.com/r/askgaybros/comments/2sdhpw/simple_workout_routine_without_equipment/","[]","False"
"9","","","{}","http://www.reddit.com/api/info/","{}","{}","False","","","False","360Saturn","","","","False","1421214564.0","1421214564.0","","self.askgaybros","0","False","0","True","False","2sdg8y","True","","","","","","{}","[]","t3_2sdg8y","12","","False","http://www.reddit.com/r/askgaybros/comments/2sdg8y/anybody_ever_pulled_a_muscle_in_their_chest_how/","Unauthenticated reddit sesssion","","False","2","","{}","Possibly a weird place to post this but I don't know any advice subreddits and I figured here would have a decently high concentration of people who mightve had sports injuries sometime. 

Google was no help,  and you guys are normally great with answers and advice. Here's hoping - cheers.","&lt;!-- SC_OFF --&gt;&lt;div class=""md""&gt;&lt;p&gt;Possibly a weird place to post this but I don&amp;#39;t know any advice subreddits and I figured here would have a decently high concentration of people who mightve had sports injuries sometime. &lt;/p&gt;

&lt;p&gt;Google was no help,  and you guys are normally great with answers and advice. Here&amp;#39;s hoping - cheers.&lt;/p&gt;
&lt;/div&gt;&lt;!-- SC_ON --&gt;","False","askgaybros","t5_2vgfw","","","Anybody ever pulled a muscle in their chest? How do I 'rest' my chest?","2","http://www.reddit.com/r/askgaybros/comments/2sdg8y/anybody_ever_pulled_a_muscle_in_their_chest_how/","[]","False"
