"","_comment_sort","_comments","_comments_by_id","_info_url","_orphaned","_params","_replaced_more","_underscore_names","approved_by","archived","author","author_flair_css_class","author_flair_text","banned_by","clicked","created","created_utc","distinguished","domain","downs","edited","gilded","has_fetched","hidden","id","is_self","json_dict","likes","link_flair_css_class","link_flair_text","media","media_embed","mod_reports","name","num_comments","num_reports","over_18","permalink","reddit_session","report_reasons","saved","score","secure_media","secure_media_embed","selftext","selftext_html","stickied","subreddit","subreddit_id","suggested_sort","thumbnail","title","ups","url","user_reports","visited"
"5","","","{}","http://www.reddit.com/api/info/","{}","{}","False","","","True","LivingLie2","","","","False","1413014304.0","1413010704.0","","self.askgaybros","0","False","0","True","False","2ixfyc","True","","","","","","{}","[]","t3_2ixfyc","12","","False","http://www.reddit.com/r/askgaybros/comments/2ixfyc/rant_about_perception/","Unauthenticated reddit sesssion","","False","7","","{}","Does anyone else go through periods of depression caused by struggling to accept the negative stereotypes we get? I mean, honestly at my lowest it's enough to make me hate being gay.

I'm not fruity, I'm not too effeminate, I'm not less athletic because I'm gay, I'm not worse at video games because I'm gay, my voice isn't higher because I'm gay, and I'm not into music because I'M FUCKING GAY. I'M JUST ME, GOD DAMN IT. And I just happen to be gay.

I'm so fucking tired of hearing these things. Most of the time it's from assholes on the internet, but I have noticed something that bothers me:
I'm competitive with my friends (they all happen to be straight) and it's like.....I feel like they all forget I'm gay whenever I beat them. If I run faster, if I play a better match of Halo, if I beat them at chess, all of the sudden I'm not the ""gay"" friend. There actions and attitudes change. At first glance, this is great--I don't want to be ""the gay guy."" But it's fucked up that I have to fucking beat them at something for that to be the case! I have to prove that I can do shit. If I were straight it wouldn't fucking matter.

I'm also so tired of hearing people accidentally say ""he's gay BUT he's a great friend,"" ""he's gay BUT he's good at soccer,"" ""he's gay BUT...."" fucking ""BUT"" nothing. It's infuriating. I hate it, and honestly sometimes it makes me really start getting down on myself. It builds up and then I get depressed and then I start hating myself.","&lt;!-- SC_OFF --&gt;&lt;div class=""md""&gt;&lt;p&gt;Does anyone else go through periods of depression caused by struggling to accept the negative stereotypes we get? I mean, honestly at my lowest it&amp;#39;s enough to make me hate being gay.&lt;/p&gt;

&lt;p&gt;I&amp;#39;m not fruity, I&amp;#39;m not too effeminate, I&amp;#39;m not less athletic because I&amp;#39;m gay, I&amp;#39;m not worse at video games because I&amp;#39;m gay, my voice isn&amp;#39;t higher because I&amp;#39;m gay, and I&amp;#39;m not into music because I&amp;#39;M FUCKING GAY. I&amp;#39;M JUST ME, GOD DAMN IT. And I just happen to be gay.&lt;/p&gt;

&lt;p&gt;I&amp;#39;m so fucking tired of hearing these things. Most of the time it&amp;#39;s from assholes on the internet, but I have noticed something that bothers me:
I&amp;#39;m competitive with my friends (they all happen to be straight) and it&amp;#39;s like.....I feel like they all forget I&amp;#39;m gay whenever I beat them. If I run faster, if I play a better match of Halo, if I beat them at chess, all of the sudden I&amp;#39;m not the &amp;quot;gay&amp;quot; friend. There actions and attitudes change. At first glance, this is great--I don&amp;#39;t want to be &amp;quot;the gay guy.&amp;quot; But it&amp;#39;s fucked up that I have to fucking beat them at something for that to be the case! I have to prove that I can do shit. If I were straight it wouldn&amp;#39;t fucking matter.&lt;/p&gt;

&lt;p&gt;I&amp;#39;m also so tired of hearing people accidentally say &amp;quot;he&amp;#39;s gay BUT he&amp;#39;s a great friend,&amp;quot; &amp;quot;he&amp;#39;s gay BUT he&amp;#39;s good at soccer,&amp;quot; &amp;quot;he&amp;#39;s gay BUT....&amp;quot; fucking &amp;quot;BUT&amp;quot; nothing. It&amp;#39;s infuriating. I hate it, and honestly sometimes it makes me really start getting down on myself. It builds up and then I get depressed and then I start hating myself.&lt;/p&gt;
&lt;/div&gt;&lt;!-- SC_ON --&gt;","False","askgaybros","t5_2vgfw","","","Rant About Perception","7","http://www.reddit.com/r/askgaybros/comments/2ixfyc/rant_about_perception/","[]","False"
"6","","","{}","http://www.reddit.com/api/info/","{}","{}","False","","","True","quiethapa","","","","False","1413013048.0","1413009448.0","","self.askgaybros","0","False","0","True","False","2ixeri","True","","","","","","{}","[]","t3_2ixeri","16","","False","http://www.reddit.com/r/askgaybros/comments/2ixeri/gun_oil_is_terrible_lube_or_am_i_using_it_wrong/","Unauthenticated reddit sesssion","","False","9","","{}","I spent a good chunk on gun oil, but it's been terrible. I like fast and rough penetration/getting jack hammered, but gun oil has only allowed for slow/stunted penetration. I've tried using a lot vs a little too and it's just not working out. My KY water-based has been much better for when I get fucked. I'm just kind of disappointed because it's been called the best thing to happen to gay sex and the only lube you'll ever need, but nope...  
  
Also, for what it's worth I've used both kinds of lube with two tops. One who is 8"" and thick (a true 8""x6"") and another who is 5.5-6"" and kind of thick. Both can do fast penetration with the KY, but the gun oil is just bleh. Just wanted to say it wasn't because of the guy's technique which is why I'm giving examples lol.","&lt;!-- SC_OFF --&gt;&lt;div class=""md""&gt;&lt;p&gt;I spent a good chunk on gun oil, but it&amp;#39;s been terrible. I like fast and rough penetration/getting jack hammered, but gun oil has only allowed for slow/stunted penetration. I&amp;#39;ve tried using a lot vs a little too and it&amp;#39;s just not working out. My KY water-based has been much better for when I get fucked. I&amp;#39;m just kind of disappointed because it&amp;#39;s been called the best thing to happen to gay sex and the only lube you&amp;#39;ll ever need, but nope...  &lt;/p&gt;

&lt;p&gt;Also, for what it&amp;#39;s worth I&amp;#39;ve used both kinds of lube with two tops. One who is 8&amp;quot; and thick (a true 8&amp;quot;x6&amp;quot;) and another who is 5.5-6&amp;quot; and kind of thick. Both can do fast penetration with the KY, but the gun oil is just bleh. Just wanted to say it wasn&amp;#39;t because of the guy&amp;#39;s technique which is why I&amp;#39;m giving examples lol.&lt;/p&gt;
&lt;/div&gt;&lt;!-- SC_ON --&gt;","False","askgaybros","t5_2vgfw","","","Gun Oil is terrible lube or am I using it wrong?","9","http://www.reddit.com/r/askgaybros/comments/2ixeri/gun_oil_is_terrible_lube_or_am_i_using_it_wrong/","[]","False"
"7","","","{}","http://www.reddit.com/api/info/","{}","{}","False","","","True","needhelpbroz","","","","False","1413012400.0","1413008800.0","","self.askgaybros","0","False","0","True","False","2ixe5z","True","","","","","","{}","[]","t3_2ixe5z","9","","False","http://www.reddit.com/r/askgaybros/comments/2ixe5z/just_found_out_the_guy_im_seeing_is_a_huge_size/","Unauthenticated reddit sesssion","","False","3","","{}","First it was him posting lyrics to ""don't want no short dick man"" on his Facebook and him talking about huge exes, but then last night while cuddling we were talking about past relationships and he mentioned he broke up with an ex because of his size. I asked him how big he was and he said the guy was 5.5"" or so. I'm 4"". We still haven't had sex, but we send dirty texts to each other. I know he sounds like a bad guy from this, but he really isn't. He is very sweet and is kind and intelligent. This is the only flaw I've seen from him. Unfortunately I foresee this not working and frankly I'm not going to try to just see what happens when we have sex.  
  
So I'm breaking things off after 5 otherwise amazing dates. I just don't know what to tell him. A part of me feels bad because we've both talked about how hard it is to find a quality guy and a (mentally at least) compatible person like we found in each other. We really did quickly hit it off. I don't want to hurt him too badly, but I'm also not going to disappoint him sexually or have sex and then things fizzle out. I would rather just end it before things get even more serious.  
  
What do I tell him? I'm not going to shame him because of his preference, but I can't just make up a shitty excuse. I was thinking maybe saying an ex came back into my life and we want to work things out...I don't know. Help!","&lt;!-- SC_OFF --&gt;&lt;div class=""md""&gt;&lt;p&gt;First it was him posting lyrics to &amp;quot;don&amp;#39;t want no short dick man&amp;quot; on his Facebook and him talking about huge exes, but then last night while cuddling we were talking about past relationships and he mentioned he broke up with an ex because of his size. I asked him how big he was and he said the guy was 5.5&amp;quot; or so. I&amp;#39;m 4&amp;quot;. We still haven&amp;#39;t had sex, but we send dirty texts to each other. I know he sounds like a bad guy from this, but he really isn&amp;#39;t. He is very sweet and is kind and intelligent. This is the only flaw I&amp;#39;ve seen from him. Unfortunately I foresee this not working and frankly I&amp;#39;m not going to try to just see what happens when we have sex.  &lt;/p&gt;

&lt;p&gt;So I&amp;#39;m breaking things off after 5 otherwise amazing dates. I just don&amp;#39;t know what to tell him. A part of me feels bad because we&amp;#39;ve both talked about how hard it is to find a quality guy and a (mentally at least) compatible person like we found in each other. We really did quickly hit it off. I don&amp;#39;t want to hurt him too badly, but I&amp;#39;m also not going to disappoint him sexually or have sex and then things fizzle out. I would rather just end it before things get even more serious.  &lt;/p&gt;

&lt;p&gt;What do I tell him? I&amp;#39;m not going to shame him because of his preference, but I can&amp;#39;t just make up a shitty excuse. I was thinking maybe saying an ex came back into my life and we want to work things out...I don&amp;#39;t know. Help!&lt;/p&gt;
&lt;/div&gt;&lt;!-- SC_ON --&gt;","False","askgaybros","t5_2vgfw","","","Just found out the guy I'm seeing is a huge size queen. Haven't had sex yet, so I've decided to break things off with him. But not sure how to end it.","3","http://www.reddit.com/r/askgaybros/comments/2ixe5z/just_found_out_the_guy_im_seeing_is_a_huge_size/","[]","False"
"8","","","{}","http://www.reddit.com/api/info/","{}","{}","False","","","True","vicigviv","","","","False","1413009528.0","1413005928.0","","self.askgaybros","0","1413181304.0","0","True","False","2ixbbq","True","","","","","","{}","[]","t3_2ixbbq","18","","False","http://www.reddit.com/r/askgaybros/comments/2ixbbq/hard_time_accepting_a_no/","Unauthenticated reddit sesssion","","False","4","","{}","So, same old ""straight crush"". I really liked him for an year, and I told him the last day of class.

He was the greatest - as usual - about it, said he was straight and we became even more friends. e got into different colleges, this helped me get over it.

We remained friends, and, everyone who meets him, immediately thinks he's gay! So, tonight we were out, me, him and his gay cousin. He said: ""But I could be with a guy, if I really liked him""

Now, I know he likes me, we have a great friendship, and he's an amazing human being.

Listening to him saying that kind of was like a knife through the heart... I know I should have gotten over him, but, all the things he does and for the person he is... I have a really hard time letting go!

EDIT: Last day of class: somewhere in december, last year, we've been great friends ever since... He's ""all gay"" from head to toe... Everyone who meets him thinks so... and he has even considered it a few times, but he's not sure, I guess... ","&lt;!-- SC_OFF --&gt;&lt;div class=""md""&gt;&lt;p&gt;So, same old &amp;quot;straight crush&amp;quot;. I really liked him for an year, and I told him the last day of class.&lt;/p&gt;

&lt;p&gt;He was the greatest - as usual - about it, said he was straight and we became even more friends. e got into different colleges, this helped me get over it.&lt;/p&gt;

&lt;p&gt;We remained friends, and, everyone who meets him, immediately thinks he&amp;#39;s gay! So, tonight we were out, me, him and his gay cousin. He said: &amp;quot;But I could be with a guy, if I really liked him&amp;quot;&lt;/p&gt;

&lt;p&gt;Now, I know he likes me, we have a great friendship, and he&amp;#39;s an amazing human being.&lt;/p&gt;

&lt;p&gt;Listening to him saying that kind of was like a knife through the heart... I know I should have gotten over him, but, all the things he does and for the person he is... I have a really hard time letting go!&lt;/p&gt;

&lt;p&gt;EDIT: Last day of class: somewhere in december, last year, we&amp;#39;ve been great friends ever since... He&amp;#39;s &amp;quot;all gay&amp;quot; from head to toe... Everyone who meets him thinks so... and he has even considered it a few times, but he&amp;#39;s not sure, I guess... &lt;/p&gt;
&lt;/div&gt;&lt;!-- SC_ON --&gt;","False","askgaybros","t5_2vgfw","","","Hard time accepting a ""no""","4","http://www.reddit.com/r/askgaybros/comments/2ixbbq/hard_time_accepting_a_no/","[]","False"
"9","","","{}","http://www.reddit.com/api/info/","{}","{}","False","","","True","Bibrah","","","","False","1412999737.0","1412996137.0","","self.askgaybros","0","False","0","True","False","2iwzhn","True","","","","","","{}","[]","t3_2iwzhn","42","","False","http://www.reddit.com/r/askgaybros/comments/2iwzhn/how_many_dates_for_you_with_a_guy_until_you_start/","Unauthenticated reddit sesssion","","False","15","","{}","Been talking to this guy..really curious.","&lt;!-- SC_OFF --&gt;&lt;div class=""md""&gt;&lt;p&gt;Been talking to this guy..really curious.&lt;/p&gt;
&lt;/div&gt;&lt;!-- SC_ON --&gt;","False","askgaybros","t5_2vgfw","","","How many dates for you with a guy until you start having sex?","15","http://www.reddit.com/r/askgaybros/comments/2iwzhn/how_many_dates_for_you_with_a_guy_until_you_start/","[]","False"
"10","","","{}","http://www.reddit.com/api/info/","{}","{}","False","","","True","sputnik84","","","","False","1412998426.0","1412994826.0","","self.askgaybros","0","False","0","True","False","2iwxpx","True","","","","","","{}","[]","t3_2iwxpx","4","","False","http://www.reddit.com/r/askgaybros/comments/2iwxpx/best_way_to_meet_bros_in_boston/","Unauthenticated reddit sesssion","","False","4","","{}","Hi there! I'm 23 and live in Boston, exploring the dating scene a little with Tinder, which is very hit-or-miss. I assume this is how most people meet potential significant others. I've been on a couple of dates with this guy I met through Tinder, and it's been smooth sailing so far, but I'd like to meet up with more gay people, in particular those with more traditionally masculine interests.

Are Tinder and OkCupid the best ways to go about finding dates? I assume the bar/club scene is mostly for hook-ups, with the possible exception of the new Cathedral Station, which is now my favorite bar in town. Is there a place that laid back, quiet, and non-judgmental that may cater to the somewhat younger 20s crowd, or is dating in my general age bracket asking for too much?

Could anyone who lives in Boston offer some advice?

Thank you!","&lt;!-- SC_OFF --&gt;&lt;div class=""md""&gt;&lt;p&gt;Hi there! I&amp;#39;m 23 and live in Boston, exploring the dating scene a little with Tinder, which is very hit-or-miss. I assume this is how most people meet potential significant others. I&amp;#39;ve been on a couple of dates with this guy I met through Tinder, and it&amp;#39;s been smooth sailing so far, but I&amp;#39;d like to meet up with more gay people, in particular those with more traditionally masculine interests.&lt;/p&gt;

&lt;p&gt;Are Tinder and OkCupid the best ways to go about finding dates? I assume the bar/club scene is mostly for hook-ups, with the possible exception of the new Cathedral Station, which is now my favorite bar in town. Is there a place that laid back, quiet, and non-judgmental that may cater to the somewhat younger 20s crowd, or is dating in my general age bracket asking for too much?&lt;/p&gt;

&lt;p&gt;Could anyone who lives in Boston offer some advice?&lt;/p&gt;

&lt;p&gt;Thank you!&lt;/p&gt;
&lt;/div&gt;&lt;!-- SC_ON --&gt;","False","askgaybros","t5_2vgfw","","","Best way to meet bros in Boston?","4","http://www.reddit.com/r/askgaybros/comments/2iwxpx/best_way_to_meet_bros_in_boston/","[]","False"
"11","","","{}","http://www.reddit.com/api/info/","{}","{}","False","","","True","wolfanotaku","","","","False","1412993665.0","1412990065.0","","self.askgaybros","0","False","0","True","False","2iwr74","True","","","","","","{}","[]","t3_2iwr74","13","","False","http://www.reddit.com/r/askgaybros/comments/2iwr74/would_someone_please_explain_poppers_to_me/","Unauthenticated reddit sesssion","","False","6","","{}","As a 30 year old gay male who has been out and sexually active since my teens, I am somewhat embarrassed to say that I never really found out what poppers were. I have been offered them a number of times (usually in the middle of sex) and have turned them down every time thinking that it wasn't time to try to snort something I know nothing about.  

I know a little, I think I remember someone saying that it helped you relax so that anal sex is less difficult, but how does it do that? Are they legal and if so does anyone know what they are made of? If you've tried them before, what is it like?  I have a new fling who brought it up recently and I don't want to seem like a prude but I'm not really into drugs nor do I think I need to relax more, but should I try it?","&lt;!-- SC_OFF --&gt;&lt;div class=""md""&gt;&lt;p&gt;As a 30 year old gay male who has been out and sexually active since my teens, I am somewhat embarrassed to say that I never really found out what poppers were. I have been offered them a number of times (usually in the middle of sex) and have turned them down every time thinking that it wasn&amp;#39;t time to try to snort something I know nothing about.  &lt;/p&gt;

&lt;p&gt;I know a little, I think I remember someone saying that it helped you relax so that anal sex is less difficult, but how does it do that? Are they legal and if so does anyone know what they are made of? If you&amp;#39;ve tried them before, what is it like?  I have a new fling who brought it up recently and I don&amp;#39;t want to seem like a prude but I&amp;#39;m not really into drugs nor do I think I need to relax more, but should I try it?&lt;/p&gt;
&lt;/div&gt;&lt;!-- SC_ON --&gt;","False","askgaybros","t5_2vgfw","","","Would someone please explain poppers to me?","6","http://www.reddit.com/r/askgaybros/comments/2iwr74/would_someone_please_explain_poppers_to_me/","[]","False"
"12","","","{}","http://www.reddit.com/api/info/","{}","{}","False","","","True","hadsomethingforthat","","","","False","1412988815.0","1412985215.0","","self.askgaybros","0","False","0","True","False","2iwk3m","True","","","","","","{}","[]","t3_2iwk3m","13","","False","http://www.reddit.com/r/askgaybros/comments/2iwk3m/legit_concern/","Unauthenticated reddit sesssion","","False","2","","{}","Hey bros

Lurker, first-time-poster here with a question on my mind. 

Thanks to this site, I've decided to get real and come out. I'm ready for any fallout from friends and fam. The problem is, I'm 28 and really concerned that it will be hard to find acceptance among gay guys now. During the years everyone else has been out and visible, I've been hiding and uncounted, for no good reason. I can imagine guys being uncool with that - and I could see why. 

To those of you who came out later,  was this an issue? Coming out is a definite for me now so no turning back, but would like to know what might be in store. ","&lt;!-- SC_OFF --&gt;&lt;div class=""md""&gt;&lt;p&gt;Hey bros&lt;/p&gt;

&lt;p&gt;Lurker, first-time-poster here with a question on my mind. &lt;/p&gt;

&lt;p&gt;Thanks to this site, I&amp;#39;ve decided to get real and come out. I&amp;#39;m ready for any fallout from friends and fam. The problem is, I&amp;#39;m 28 and really concerned that it will be hard to find acceptance among gay guys now. During the years everyone else has been out and visible, I&amp;#39;ve been hiding and uncounted, for no good reason. I can imagine guys being uncool with that - and I could see why. &lt;/p&gt;

&lt;p&gt;To those of you who came out later,  was this an issue? Coming out is a definite for me now so no turning back, but would like to know what might be in store. &lt;/p&gt;
&lt;/div&gt;&lt;!-- SC_ON --&gt;","False","askgaybros","t5_2vgfw","","","Legit concern?","2","http://www.reddit.com/r/askgaybros/comments/2iwk3m/legit_concern/","[]","False"
"13","","","{}","http://www.reddit.com/api/info/","{}","{}","False","","","True","_wildstrawberries","","","","False","1412984967.0","1412981367.0","","self.askgaybros","0","False","0","True","False","2iwe9g","True","","","","","","{}","[]","t3_2iwe9g","16","","False","http://www.reddit.com/r/askgaybros/comments/2iwe9g/worried_that_ill_never_meet_anyone_like_my_ex/","Unauthenticated reddit sesssion","","False","12","","{}","I know it's very naive of me but I can't shake the feeling like I'll never meet anyone like my ex. Like, he's the only person who has ever been interested in me and I never understood why. He was so beautiful and smart and perfect and I was nothing. I haven't spoken to him in 6+ months (NC) and I know I should be over him but I still feel like an anxious mess with no self esteem. How can I shake the feeling, guys?","&lt;!-- SC_OFF --&gt;&lt;div class=""md""&gt;&lt;p&gt;I know it&amp;#39;s very naive of me but I can&amp;#39;t shake the feeling like I&amp;#39;ll never meet anyone like my ex. Like, he&amp;#39;s the only person who has ever been interested in me and I never understood why. He was so beautiful and smart and perfect and I was nothing. I haven&amp;#39;t spoken to him in 6+ months (NC) and I know I should be over him but I still feel like an anxious mess with no self esteem. How can I shake the feeling, guys?&lt;/p&gt;
&lt;/div&gt;&lt;!-- SC_ON --&gt;","False","askgaybros","t5_2vgfw","","","Worried that I'll never meet anyone like my ex","12","http://www.reddit.com/r/askgaybros/comments/2iwe9g/worried_that_ill_never_meet_anyone_like_my_ex/","[]","False"
"14","","","{}","http://www.reddit.com/api/info/","{}","{}","False","","","True","Aoce","","","","False","1412982912.0","1412979312.0","","self.askgaybros","0","False","0","True","False","2iwaz6","True","","","","","","{}","[]","t3_2iwaz6","7","","False","http://www.reddit.com/r/askgaybros/comments/2iwaz6/starting_over/","Unauthenticated reddit sesssion","","False","12","","{}","My boyfriend that I've lived with for five months just ended things yesterday. I have nowhere to go in this state since my parents moved to 1,000 miles away to Florida, so that's where I'm going to go. Its a clean break and I'm not losing any money to move, but I'm still frightened to begin again. 

I know its going to be tough since I don't know anybody and my breakup is still painfully fresh on my mind. Any advice on how to start over in a new place would be awesome.","&lt;!-- SC_OFF --&gt;&lt;div class=""md""&gt;&lt;p&gt;My boyfriend that I&amp;#39;ve lived with for five months just ended things yesterday. I have nowhere to go in this state since my parents moved to 1,000 miles away to Florida, so that&amp;#39;s where I&amp;#39;m going to go. Its a clean break and I&amp;#39;m not losing any money to move, but I&amp;#39;m still frightened to begin again. &lt;/p&gt;

&lt;p&gt;I know its going to be tough since I don&amp;#39;t know anybody and my breakup is still painfully fresh on my mind. Any advice on how to start over in a new place would be awesome.&lt;/p&gt;
&lt;/div&gt;&lt;!-- SC_ON --&gt;","False","askgaybros","t5_2vgfw","","","Starting over","12","http://www.reddit.com/r/askgaybros/comments/2iwaz6/starting_over/","[]","False"
