"","_comment_sort","_comments","_comments_by_id","_info_url","_orphaned","_params","_replaced_more","_underscore_names","approved_by","archived","author","author_flair_css_class","author_flair_text","banned_by","clicked","created","created_utc","distinguished","domain","downs","edited","gilded","has_fetched","hidden","id","is_self","json_dict","likes","link_flair_css_class","link_flair_text","media","media_embed","mod_reports","name","num_comments","num_reports","over_18","permalink","reddit_session","report_reasons","saved","score","secure_media","secure_media_embed","selftext","selftext_html","stickied","subreddit","subreddit_id","suggested_sort","thumbnail","title","ups","url","user_reports","visited"
"16","","","{}","http://www.reddit.com/api/info/","{}","{}","False","","","False","LoManJo","","","","False","1421541569.0","1421541569.0","","self.askgaybros","0","False","0","True","False","2ssabm","True","","","","","","{}","[]","t3_2ssabm","8","","False","http://www.reddit.com/r/askgaybros/comments/2ssabm/dating_another_gay_brother/","Unauthenticated reddit sesssion","","False","8","","{}","So, what if there were two openly gay brothers in a fraternity. The fraternity had no issue with this. But they ended up really, really, bonding and finding out that they both thought that they would like to date and maybe even more.

However, they were torn by the fact that they were fraternal brothers and in the same fraternity. But they wanted to be open and pursue and try out a healthy relationship. This was very, very rare for them and they didn't know what to do.

Is it wrong to date someone in your own fraternity? Is it against fraternal rules of some sort? Just looking for some general thoughts...","&lt;!-- SC_OFF --&gt;&lt;div class=""md""&gt;&lt;p&gt;So, what if there were two openly gay brothers in a fraternity. The fraternity had no issue with this. But they ended up really, really, bonding and finding out that they both thought that they would like to date and maybe even more.&lt;/p&gt;

&lt;p&gt;However, they were torn by the fact that they were fraternal brothers and in the same fraternity. But they wanted to be open and pursue and try out a healthy relationship. This was very, very rare for them and they didn&amp;#39;t know what to do.&lt;/p&gt;

&lt;p&gt;Is it wrong to date someone in your own fraternity? Is it against fraternal rules of some sort? Just looking for some general thoughts...&lt;/p&gt;
&lt;/div&gt;&lt;!-- SC_ON --&gt;","False","askgaybros","t5_2vgfw","","","Dating another gay brother?","8","http://www.reddit.com/r/askgaybros/comments/2ssabm/dating_another_gay_brother/","[]","False"
"17","","","{}","http://www.reddit.com/api/info/","{}","{}","False","","","False","throwthisaway1737383","","","","False","1421538899.0","1421538899.0","","self.askgaybros","0","False","0","True","False","2ss5i7","True","","","","","","{}","[]","t3_2ss5i7","15","","False","http://www.reddit.com/r/askgaybros/comments/2ss5i7/coming_out_at_work/","Unauthenticated reddit sesssion","","False","7","","{}","I just started a new job and am ambivalent about whether to make it known that I am gay. On one hand, I would like them to know and my conversation would not have to be guarded around mention of dating or family. On the other, I am not sure how it would affect my professional life and not sure if people would act differently or uncomfortable. The company seems open and is not in a homophobic area (very liberal) by any means. What has your experience been? And I don't mean like sitting them down and coming out to them. I mean just mentioning my bf in conversation.","&lt;!-- SC_OFF --&gt;&lt;div class=""md""&gt;&lt;p&gt;I just started a new job and am ambivalent about whether to make it known that I am gay. On one hand, I would like them to know and my conversation would not have to be guarded around mention of dating or family. On the other, I am not sure how it would affect my professional life and not sure if people would act differently or uncomfortable. The company seems open and is not in a homophobic area (very liberal) by any means. What has your experience been? And I don&amp;#39;t mean like sitting them down and coming out to them. I mean just mentioning my bf in conversation.&lt;/p&gt;
&lt;/div&gt;&lt;!-- SC_ON --&gt;","False","askgaybros","t5_2vgfw","","","Coming out at work","7","http://www.reddit.com/r/askgaybros/comments/2ss5i7/coming_out_at_work/","[]","False"
"18","","","{}","http://www.reddit.com/api/info/","{}","{}","False","","","False","qsmack","","","","False","1421535822.0","1421535822.0","","self.askgaybros","0","1421536670.0","0","True","False","2srzz7","True","","","","","","{}","[]","t3_2srzz7","15","","False","http://www.reddit.com/r/askgaybros/comments/2srzz7/random_question/","Unauthenticated reddit sesssion","","False","0","","{}","Where do you guys place the limits on being a gay bro? What is too bro, and what is too feminine? This is awfully stereotypical of me to ask, but I'm just being honest. For me, it really doesn't matter if you have some flamboyant tendencies, I just don't necessarily click with guys who are always very flamboyant. I'm able to befriend them, but normally can't have a relationship with them 

Edit: by ""too bro"" I mean completely unable to have any romantic qualities (ex: pet names, PDA) ","&lt;!-- SC_OFF --&gt;&lt;div class=""md""&gt;&lt;p&gt;Where do you guys place the limits on being a gay bro? What is too bro, and what is too feminine? This is awfully stereotypical of me to ask, but I&amp;#39;m just being honest. For me, it really doesn&amp;#39;t matter if you have some flamboyant tendencies, I just don&amp;#39;t necessarily click with guys who are always very flamboyant. I&amp;#39;m able to befriend them, but normally can&amp;#39;t have a relationship with them &lt;/p&gt;

&lt;p&gt;Edit: by &amp;quot;too bro&amp;quot; I mean completely unable to have any romantic qualities (ex: pet names, PDA) &lt;/p&gt;
&lt;/div&gt;&lt;!-- SC_ON --&gt;","False","askgaybros","t5_2vgfw","","","Random question","0","http://www.reddit.com/r/askgaybros/comments/2srzz7/random_question/","[]","False"
"19","","","{}","http://www.reddit.com/api/info/","{}","{}","False","","","False","ssnobele","","","","False","1421535627.0","1421535627.0","","self.askgaybros","0","False","0","True","False","2srzm1","True","","","","","","{}","[]","t3_2srzm1","3","","False","http://www.reddit.com/r/askgaybros/comments/2srzm1/how_do_you_know_when_its_time_to_let_go/","Unauthenticated reddit sesssion","","False","1","","{}","I've been in a relationship with a guy for going on 9 years now.  We've been engaged for nearly 3 but for the past several months I've been starting to feel like that was a mistake.  I'm worried about being able to maintain my commitment for the long-term and while I am and have been resolved to not cheating, I feel like that resolve is weakening.

We make great friends, we click really well, but it feels like we've started to get a little jaded with each other lately.  Our sex life is dwindling and uneventful and I'm worried that we're both just settling instead of going through a rough patch.  Worse, I feel like I'm the one dragging him down and holding him back.

When do you know that the relationship isn't working?  When do you decide that you're both better off apart than you are together?","&lt;!-- SC_OFF --&gt;&lt;div class=""md""&gt;&lt;p&gt;I&amp;#39;ve been in a relationship with a guy for going on 9 years now.  We&amp;#39;ve been engaged for nearly 3 but for the past several months I&amp;#39;ve been starting to feel like that was a mistake.  I&amp;#39;m worried about being able to maintain my commitment for the long-term and while I am and have been resolved to not cheating, I feel like that resolve is weakening.&lt;/p&gt;

&lt;p&gt;We make great friends, we click really well, but it feels like we&amp;#39;ve started to get a little jaded with each other lately.  Our sex life is dwindling and uneventful and I&amp;#39;m worried that we&amp;#39;re both just settling instead of going through a rough patch.  Worse, I feel like I&amp;#39;m the one dragging him down and holding him back.&lt;/p&gt;

&lt;p&gt;When do you know that the relationship isn&amp;#39;t working?  When do you decide that you&amp;#39;re both better off apart than you are together?&lt;/p&gt;
&lt;/div&gt;&lt;!-- SC_ON --&gt;","False","askgaybros","t5_2vgfw","","","How do you know when it's time to let go?","1","http://www.reddit.com/r/askgaybros/comments/2srzm1/how_do_you_know_when_its_time_to_let_go/","[]","False"
"20","","","{}","http://www.reddit.com/api/info/","{}","{}","False","","","False","madman-dreamerawake","","","","False","1421531021.0","1421531021.0","","self.askgaybros","0","False","0","True","False","2srqve","True","","","","","","{}","[]","t3_2srqve","9","","False","http://www.reddit.com/r/askgaybros/comments/2srqve/wearing_my_butt_plug/","Unauthenticated reddit sesssion","","False","3","","{}","Hey Bros,

Pretty new to this....

I bought a butt plug.  I've only used it at home by myself.  I guess my question is can I leave it in and go out?  Is there a limited amount of time I should leave it in?  Any problems I should be aware of if I go out wearing it?  Thanks! ","&lt;!-- SC_OFF --&gt;&lt;div class=""md""&gt;&lt;p&gt;Hey Bros,&lt;/p&gt;

&lt;p&gt;Pretty new to this....&lt;/p&gt;

&lt;p&gt;I bought a butt plug.  I&amp;#39;ve only used it at home by myself.  I guess my question is can I leave it in and go out?  Is there a limited amount of time I should leave it in?  Any problems I should be aware of if I go out wearing it?  Thanks! &lt;/p&gt;
&lt;/div&gt;&lt;!-- SC_ON --&gt;","False","askgaybros","t5_2vgfw","","","Wearing my butt plug?","3","http://www.reddit.com/r/askgaybros/comments/2srqve/wearing_my_butt_plug/","[]","False"
"21","","","{}","http://www.reddit.com/api/info/","{}","{}","False","","","False","sorbyag","","","","False","1421524362.0","1421524362.0","","self.askgaybros","0","False","0","True","False","2sre80","True","","","","","","{}","[]","t3_2sre80","9","","False","http://www.reddit.com/r/askgaybros/comments/2sre80/first_date_advice/","Unauthenticated reddit sesssion","","False","8","","{}","I'm sure something like this has been posted but whatever.

So I'm 19 and going on my first date (ever) tomorrow. What should I expect, and how do I prevent myself from coming across as a complete idiot?","&lt;!-- SC_OFF --&gt;&lt;div class=""md""&gt;&lt;p&gt;I&amp;#39;m sure something like this has been posted but whatever.&lt;/p&gt;

&lt;p&gt;So I&amp;#39;m 19 and going on my first date (ever) tomorrow. What should I expect, and how do I prevent myself from coming across as a complete idiot?&lt;/p&gt;
&lt;/div&gt;&lt;!-- SC_ON --&gt;","False","askgaybros","t5_2vgfw","","","First date advice","8","http://www.reddit.com/r/askgaybros/comments/2sre80/first_date_advice/","[]","False"
"22","","","{}","http://www.reddit.com/api/info/","{}","{}","False","","","False","Goddammit_charlie","","","","False","1421523776.0","1421523776.0","","self.askgaybros","0","False","0","True","False","2srd0m","True","","","","","","{}","[]","t3_2srd0m","7","","False","http://www.reddit.com/r/askgaybros/comments/2srd0m/spontaneous_hookup/","Unauthenticated reddit sesssion","","False","1","","{}","Hey guys, I'm pretty new to this board, I've started browing it like maybe a month ago but whatever that's not the point. Lately I've been thinking about that classical movie spontaneous sex and that if it's appliable irl as well. My question is mainly for bottoms I guess. (I'm utterly inexperienced in the whole sex thing. Even though I'm like 20yo. Late bloomer). So is it possible to have those spontaneous hookups or not? Because I think that one can't be always ready? or?
I apologize if it's a dumb question, I just thought I'd rather get answers from you than google.
","&lt;!-- SC_OFF --&gt;&lt;div class=""md""&gt;&lt;p&gt;Hey guys, I&amp;#39;m pretty new to this board, I&amp;#39;ve started browing it like maybe a month ago but whatever that&amp;#39;s not the point. Lately I&amp;#39;ve been thinking about that classical movie spontaneous sex and that if it&amp;#39;s appliable irl as well. My question is mainly for bottoms I guess. (I&amp;#39;m utterly inexperienced in the whole sex thing. Even though I&amp;#39;m like 20yo. Late bloomer). So is it possible to have those spontaneous hookups or not? Because I think that one can&amp;#39;t be always ready? or?
I apologize if it&amp;#39;s a dumb question, I just thought I&amp;#39;d rather get answers from you than google.&lt;/p&gt;
&lt;/div&gt;&lt;!-- SC_ON --&gt;","False","askgaybros","t5_2vgfw","","","Spontaneous ""hookup""","1","http://www.reddit.com/r/askgaybros/comments/2srd0m/spontaneous_hookup/","[]","False"
"23","","","{}","http://www.reddit.com/api/info/","{}","{}","False","","","False","IsHeReallyStraight","","","","False","1421522107.0","1421522107.0","","self.askgaybros","0","False","0","True","False","2sr9tr","True","","","","","","{}","[]","t3_2sr9tr","20","","False","http://www.reddit.com/r/askgaybros/comments/2sr9tr/commitment_if_the_guy_your_seeing_doesnt_want_it/","Unauthenticated reddit sesssion","","False","10","","{}","Long story short. I like a guy. He likes me. He doesn't want commitment or to define the relationship. I do. Should I move on? What would you do?","&lt;!-- SC_OFF --&gt;&lt;div class=""md""&gt;&lt;p&gt;Long story short. I like a guy. He likes me. He doesn&amp;#39;t want commitment or to define the relationship. I do. Should I move on? What would you do?&lt;/p&gt;
&lt;/div&gt;&lt;!-- SC_ON --&gt;","False","askgaybros","t5_2vgfw","","","Commitment. If the guy your seeing doesn't want it, is it a deal breaker?","10","http://www.reddit.com/r/askgaybros/comments/2sr9tr/commitment_if_the_guy_your_seeing_doesnt_want_it/","[]","False"
"24","","","{}","http://www.reddit.com/api/info/","{}","{}","False","","","False","joshmbrown","","","","False","1421518250.0","1421518250.0","","self.askgaybros","0","False","0","True","False","2sr2cq","True","","","","","","{}","[]","t3_2sr2cq","6","","False","http://www.reddit.com/r/askgaybros/comments/2sr2cq/advice_for_a_bro/","Unauthenticated reddit sesssion","","False","0","","{}","Hey gay bros!

Long time reader, first post

I really love the whole bro thing. That bonding experience is what I want. How do I go about finding a new bro to guide me to total gay broness? :P

Maybe there's a bro out there willing to help and answer any q's.

Much bro love!","&lt;!-- SC_OFF --&gt;&lt;div class=""md""&gt;&lt;p&gt;Hey gay bros!&lt;/p&gt;

&lt;p&gt;Long time reader, first post&lt;/p&gt;

&lt;p&gt;I really love the whole bro thing. That bonding experience is what I want. How do I go about finding a new bro to guide me to total gay broness? :P&lt;/p&gt;

&lt;p&gt;Maybe there&amp;#39;s a bro out there willing to help and answer any q&amp;#39;s.&lt;/p&gt;

&lt;p&gt;Much bro love!&lt;/p&gt;
&lt;/div&gt;&lt;!-- SC_ON --&gt;","False","askgaybros","t5_2vgfw","","","Advice for a bro","0","http://www.reddit.com/r/askgaybros/comments/2sr2cq/advice_for_a_bro/","[]","False"
"25","","","{}","http://www.reddit.com/api/info/","{}","{}","False","","","False","irishjerseybean","","","","False","1421516898.0","1421516898.0","","self.askgaybros","0","False","0","True","False","2sqzt3","True","","","","","","{}","[]","t3_2sqzt3","57","","False","http://www.reddit.com/r/askgaybros/comments/2sqzt3/caution_bro_venting/","Unauthenticated reddit sesssion","","False","48","","{}","Just wanted to throw this out there and see what the general consensus is...

So I stayed at my parents house last weekend and my niece who is 5 was there, who I adore, shes the only niece or nephew I have. I was hanging out with her before I was leaving to go to my boyfriends. When the time came she asked me where I was going and I said 'to my boyfriends', which I could see confused her somewhat as shes never had this idea put to her before. She asks if we kiss and I say that sometimes boys kiss boys and sometimes girls kiss girls, nothing more. She then asks me if we will sleep together and if we'll be naked, at this I said no I will be going to my own house and to my own bed and that was really it.

The next day I was due to meet my mom in town but she ignored all 8 of my calls throughout the day. My dad eventually called me that night and said after I left that my niece brought up me and my boyfriend at the dinner table and that we get naked in bed etc. I assured him that yes I said I was going to my boyfriends but that it was her who put the question to me about sleeping arrangements...so now my mom isnt talking to me thinking that im spreading some gay agenda or recruiting my niece or some shit, assuming the worst of me without even talking to me. My sister told me she felt sick when she heard her daughter say this, meanwhile she has had 3 different relationships including my niece's father so my niece is acquainted with the term 'boyfriend' and has connotations associated with it from elsewhere, least of all me.

In hindsight, I shouldn't have said anything about where I was going I guess, but I didn't see the harm really, the worst being that she'll grow up thinking its ok for members of the same sex to be together...fairly torn about the whole thing to be honest. Im 24 and came out last April, my folks only really came round to the idea a few months ago and now this...

I'de appreciate some input bros :)","&lt;!-- SC_OFF --&gt;&lt;div class=""md""&gt;&lt;p&gt;Just wanted to throw this out there and see what the general consensus is...&lt;/p&gt;

&lt;p&gt;So I stayed at my parents house last weekend and my niece who is 5 was there, who I adore, shes the only niece or nephew I have. I was hanging out with her before I was leaving to go to my boyfriends. When the time came she asked me where I was going and I said &amp;#39;to my boyfriends&amp;#39;, which I could see confused her somewhat as shes never had this idea put to her before. She asks if we kiss and I say that sometimes boys kiss boys and sometimes girls kiss girls, nothing more. She then asks me if we will sleep together and if we&amp;#39;ll be naked, at this I said no I will be going to my own house and to my own bed and that was really it.&lt;/p&gt;

&lt;p&gt;The next day I was due to meet my mom in town but she ignored all 8 of my calls throughout the day. My dad eventually called me that night and said after I left that my niece brought up me and my boyfriend at the dinner table and that we get naked in bed etc. I assured him that yes I said I was going to my boyfriends but that it was her who put the question to me about sleeping arrangements...so now my mom isnt talking to me thinking that im spreading some gay agenda or recruiting my niece or some shit, assuming the worst of me without even talking to me. My sister told me she felt sick when she heard her daughter say this, meanwhile she has had 3 different relationships including my niece&amp;#39;s father so my niece is acquainted with the term &amp;#39;boyfriend&amp;#39; and has connotations associated with it from elsewhere, least of all me.&lt;/p&gt;

&lt;p&gt;In hindsight, I shouldn&amp;#39;t have said anything about where I was going I guess, but I didn&amp;#39;t see the harm really, the worst being that she&amp;#39;ll grow up thinking its ok for members of the same sex to be together...fairly torn about the whole thing to be honest. Im 24 and came out last April, my folks only really came round to the idea a few months ago and now this...&lt;/p&gt;

&lt;p&gt;I&amp;#39;de appreciate some input bros :)&lt;/p&gt;
&lt;/div&gt;&lt;!-- SC_ON --&gt;","False","askgaybros","t5_2vgfw","","","Caution; Bro Venting","48","http://www.reddit.com/r/askgaybros/comments/2sqzt3/caution_bro_venting/","[]","False"
"26","","","{}","http://www.reddit.com/api/info/","{}","{}","False","","","False","cheatedonongrindr","","","","False","1421515126.0","1421515126.0","","self.askgaybros","0","False","0","True","False","2sqwih","True","","","","","","{}","[]","t3_2sqwih","19","","False","http://www.reddit.com/r/askgaybros/comments/2sqwih/update_my_boyfriend_is_using_grinder_to_cheat_on/","Unauthenticated reddit sesssion","","False","8","","{}","As promised, here is an update.

We are still together.

To those who doubted, it CAN work.

I told him I knew about everything. I made him tell me. Some of it was taken out of context and he proved it. It was a power play that was the catalyst for the entire event. It was much more harmless than initially believed but still hurtful and awful.

To those with similar problems, communication is key. Be open about your feelings and don't sit on them. It will only prove more difficult and drive you absolutely insane if you keep your feelings and knowledge hidden.

I wish all of you with problems like this luck. I would also like to thank all of you who messaged me with votes of confidence and your kind words.

Be safe, everyone. You deserve it.","&lt;!-- SC_OFF --&gt;&lt;div class=""md""&gt;&lt;p&gt;As promised, here is an update.&lt;/p&gt;

&lt;p&gt;We are still together.&lt;/p&gt;

&lt;p&gt;To those who doubted, it CAN work.&lt;/p&gt;

&lt;p&gt;I told him I knew about everything. I made him tell me. Some of it was taken out of context and he proved it. It was a power play that was the catalyst for the entire event. It was much more harmless than initially believed but still hurtful and awful.&lt;/p&gt;

&lt;p&gt;To those with similar problems, communication is key. Be open about your feelings and don&amp;#39;t sit on them. It will only prove more difficult and drive you absolutely insane if you keep your feelings and knowledge hidden.&lt;/p&gt;

&lt;p&gt;I wish all of you with problems like this luck. I would also like to thank all of you who messaged me with votes of confidence and your kind words.&lt;/p&gt;

&lt;p&gt;Be safe, everyone. You deserve it.&lt;/p&gt;
&lt;/div&gt;&lt;!-- SC_ON --&gt;","False","askgaybros","t5_2vgfw","","","UPDATE: My boyfriend is using Grinder to cheat on me","8","http://www.reddit.com/r/askgaybros/comments/2sqwih/update_my_boyfriend_is_using_grinder_to_cheat_on/","[]","False"
"27","","","{}","http://www.reddit.com/api/info/","{}","{}","False","","","False","daniellayne","","","","False","1421512478.0","1421512478.0","","self.askgaybros","0","1421512730.0","0","True","False","2sqrqp","True","","","","","","{}","[]","t3_2sqrqp","56","","False","http://www.reddit.com/r/askgaybros/comments/2sqrqp/has_anyone_noticed_a_trend_in_unconventional/","Unauthenticated reddit sesssion","","False","34","","{}","I haven't met a lot of people in person who identify as one of the ""unconventional"" identities, I use the word unconventional with no negative connotation whatsoever, but why is it developing into a trend? (I'm looking at /r/LGBTeens  )
I'm not saying people are faking it or making it up, but I'm pretty sure most people who identify as one of those identities probably isn't being very truthful with themselves and/or others. So what do you guys think it is? I'm not trying to bash the sub, it just baffles me because it seems so circle-jerky and almost cult-like; and I'd really appreciate some insight and opinions.","&lt;!-- SC_OFF --&gt;&lt;div class=""md""&gt;&lt;p&gt;I haven&amp;#39;t met a lot of people in person who identify as one of the &amp;quot;unconventional&amp;quot; identities, I use the word unconventional with no negative connotation whatsoever, but why is it developing into a trend? (I&amp;#39;m looking at &lt;a href=""/r/LGBTeens""&gt;/r/LGBTeens&lt;/a&gt;  )
I&amp;#39;m not saying people are faking it or making it up, but I&amp;#39;m pretty sure most people who identify as one of those identities probably isn&amp;#39;t being very truthful with themselves and/or others. So what do you guys think it is? I&amp;#39;m not trying to bash the sub, it just baffles me because it seems so circle-jerky and almost cult-like; and I&amp;#39;d really appreciate some insight and opinions.&lt;/p&gt;
&lt;/div&gt;&lt;!-- SC_ON --&gt;","False","askgaybros","t5_2vgfw","","","Has anyone noticed a trend in ""unconventional"" gender/sexual identities among teenagers?","34","http://www.reddit.com/r/askgaybros/comments/2sqrqp/has_anyone_noticed_a_trend_in_unconventional/","[]","False"
"28","","","{}","http://www.reddit.com/api/info/","{}","{}","False","","","False","Farthur1","","","","False","1421510635.0","1421510635.0","","self.askgaybros","0","False","0","True","False","2sqon6","True","","","","","","{}","[]","t3_2sqon6","39","","False","http://www.reddit.com/r/askgaybros/comments/2sqon6/i_am_a_little_confused_about_lgbt/","Unauthenticated reddit sesssion","","False","3","","{}","Hey everyone, 

First of all, this is not meant to be offensive or discrimintating  to anyone!!!

So I was wondering why transgenders are very often put together with lesbian, gay and bisexuals like in the term LGBT. Being transgender is being in the wrong body right? So aren't they actually just straight people with the wrong equipments?","&lt;!-- SC_OFF --&gt;&lt;div class=""md""&gt;&lt;p&gt;Hey everyone, &lt;/p&gt;

&lt;p&gt;First of all, this is not meant to be offensive or discrimintating  to anyone!!!&lt;/p&gt;

&lt;p&gt;So I was wondering why transgenders are very often put together with lesbian, gay and bisexuals like in the term LGBT. Being transgender is being in the wrong body right? So aren&amp;#39;t they actually just straight people with the wrong equipments?&lt;/p&gt;
&lt;/div&gt;&lt;!-- SC_ON --&gt;","False","askgaybros","t5_2vgfw","","","I am a little confused about LGBT","3","http://www.reddit.com/r/askgaybros/comments/2sqon6/i_am_a_little_confused_about_lgbt/","[]","False"
