"","_comment_sort","_comments","_comments_by_id","_info_url","_orphaned","_params","_replaced_more","_underscore_names","approved_by","archived","author","author_flair_css_class","author_flair_text","banned_by","clicked","created","created_utc","distinguished","domain","downs","edited","gilded","has_fetched","hidden","id","is_self","json_dict","likes","link_flair_css_class","link_flair_text","media","media_embed","mod_reports","name","num_comments","num_reports","over_18","permalink","reddit_session","report_reasons","saved","score","secure_media","secure_media_embed","selftext","selftext_html","stickied","subreddit","subreddit_id","suggested_sort","thumbnail","title","ups","url","user_reports","visited"
"0","","","{}","http://www.reddit.com/api/info/","{}","{}","False","","","True","Jubilee_Street","","","","False","1407336002.0","1407332402.0","","self.askgaybros","0","False","0","True","False","2csb5k","True","","","","","","{}","[]","t3_2csb5k","19","","False","http://www.reddit.com/r/askgaybros/comments/2csb5k/angry_and_need_to_vent/","Unauthenticated reddit sesssion","","False","5","","{}","So five weeks back I met this guy on a dating website. We started talking and hit it off so I got his contact details and stuff and started talking over facebook. After meeting him on a dating website I figured I would ask him out *on a date*. So he said yes once he got back from his holidays. So the first week I asked if he wanted to do something, he said no he just got back and had to get organised for university and stuff. Which is understandable. Second week he said he was busy, same with the third and then we come to this week. He said in the third week he would be free Thursday (tomorrow) and Friday. So tonight I messaged him asking if he was free... He told me ""I am not ready to date anyone just yet"" **AFTER 4 WEEKS OF PUTTING THIS OFF AND LEADING ME ON HE TELLS ME THIS NOW!?!**. Needless to say I am really fucking pissed off at the moment. The third week of him delaying this so much I even asked him ""Are you sure you want to date, you're not putting this off are you because you don't want to"" to which he responded ""Yeah I'd go on a date with you, just been busy""... I just don't get it, why!? We were getting along so well and then all of a sudden just this, outta no where. I mean if he wasn't interested why didn't he just say so from the start, I fucking don't get it.

Sorry for the rant and stuff I just needed to yell this out to someone or something. I just can't wrap my head around it, it's made me really fucking angry and I just can't deal with it.","&lt;!-- SC_OFF --&gt;&lt;div class=""md""&gt;&lt;p&gt;So five weeks back I met this guy on a dating website. We started talking and hit it off so I got his contact details and stuff and started talking over facebook. After meeting him on a dating website I figured I would ask him out &lt;em&gt;on a date&lt;/em&gt;. So he said yes once he got back from his holidays. So the first week I asked if he wanted to do something, he said no he just got back and had to get organised for university and stuff. Which is understandable. Second week he said he was busy, same with the third and then we come to this week. He said in the third week he would be free Thursday (tomorrow) and Friday. So tonight I messaged him asking if he was free... He told me &amp;quot;I am not ready to date anyone just yet&amp;quot; &lt;strong&gt;AFTER 4 WEEKS OF PUTTING THIS OFF AND LEADING ME ON HE TELLS ME THIS NOW!?!&lt;/strong&gt;. Needless to say I am really fucking pissed off at the moment. The third week of him delaying this so much I even asked him &amp;quot;Are you sure you want to date, you&amp;#39;re not putting this off are you because you don&amp;#39;t want to&amp;quot; to which he responded &amp;quot;Yeah I&amp;#39;d go on a date with you, just been busy&amp;quot;... I just don&amp;#39;t get it, why!? We were getting along so well and then all of a sudden just this, outta no where. I mean if he wasn&amp;#39;t interested why didn&amp;#39;t he just say so from the start, I fucking don&amp;#39;t get it.&lt;/p&gt;

&lt;p&gt;Sorry for the rant and stuff I just needed to yell this out to someone or something. I just can&amp;#39;t wrap my head around it, it&amp;#39;s made me really fucking angry and I just can&amp;#39;t deal with it.&lt;/p&gt;
&lt;/div&gt;&lt;!-- SC_ON --&gt;","False","askgaybros","t5_2vgfw","","","Angry and Need to Vent","5","http://www.reddit.com/r/askgaybros/comments/2csb5k/angry_and_need_to_vent/","[]","False"
"1","","","{}","http://www.reddit.com/api/info/","{}","{}","False","","","True","musclebearlover","","","","False","1407331750.0","1407328150.0","","self.askgaybros","0","False","0","True","False","2cs58x","True","","","","","","{}","[]","t3_2cs58x","21","","False","http://www.reddit.com/r/askgaybros/comments/2cs58x/just_had_my_first_sexual_experience_and_i_have_a/","Unauthenticated reddit sesssion","","False","22","","{}","So I was hanging out with this guy (we are both 18) and we both knew each other pretty well. He knows i am gay and I know he is gay. I had literally no previous sexual experiences prior to this, I hadn't even kissed a guy before. Eventually, we were giving each other handjobs and i had never been more nervous in my life. I couldn't get hard all the way and couldn't finish and he blamed himself. Has anyone else had this problem?","&lt;!-- SC_OFF --&gt;&lt;div class=""md""&gt;&lt;p&gt;So I was hanging out with this guy (we are both 18) and we both knew each other pretty well. He knows i am gay and I know he is gay. I had literally no previous sexual experiences prior to this, I hadn&amp;#39;t even kissed a guy before. Eventually, we were giving each other handjobs and i had never been more nervous in my life. I couldn&amp;#39;t get hard all the way and couldn&amp;#39;t finish and he blamed himself. Has anyone else had this problem?&lt;/p&gt;
&lt;/div&gt;&lt;!-- SC_ON --&gt;","False","askgaybros","t5_2vgfw","","","just had my first sexual experience... and I have a question","22","http://www.reddit.com/r/askgaybros/comments/2cs58x/just_had_my_first_sexual_experience_and_i_have_a/","[]","False"
"2","","","{}","http://www.reddit.com/api/info/","{}","{}","False","","","True","ThatGuyNamedElliot","","","","False","1407327906.0","1407324306.0","","self.askgaybros","0","False","0","True","False","2cs0ys","True","","","","","","{}","[]","t3_2cs0ys","38","","False","http://www.reddit.com/r/askgaybros/comments/2cs0ys/whats_it_like_being_gay_in_university_college/","Unauthenticated reddit sesssion","","False","19","","{}","I'm 17 so I got a couple years left in school yet but I'm curious into what it's like being gay in university. I'm British so it may be different between American and British universities but overall what's it actually like? Do you get into a lot more relationships than in school? Do you meet plenty of other gay people? Are you treated any differently? If anyone has been to college did you meet your SO or any boyfriends there? And how did you meet them? Thanks x","&lt;!-- SC_OFF --&gt;&lt;div class=""md""&gt;&lt;p&gt;I&amp;#39;m 17 so I got a couple years left in school yet but I&amp;#39;m curious into what it&amp;#39;s like being gay in university. I&amp;#39;m British so it may be different between American and British universities but overall what&amp;#39;s it actually like? Do you get into a lot more relationships than in school? Do you meet plenty of other gay people? Are you treated any differently? If anyone has been to college did you meet your SO or any boyfriends there? And how did you meet them? Thanks x&lt;/p&gt;
&lt;/div&gt;&lt;!-- SC_ON --&gt;","False","askgaybros","t5_2vgfw","","","What's it like being gay in University (college)?","19","http://www.reddit.com/r/askgaybros/comments/2cs0ys/whats_it_like_being_gay_in_university_college/","[]","False"
"3","","","{}","http://www.reddit.com/api/info/","{}","{}","False","","","True","Bibrah","","","","False","1407316311.0","1407312711.0","","self.askgaybros","0","False","0","True","False","2crqf7","True","","","","","","{}","[]","t3_2crqf7","71","","False","http://www.reddit.com/r/askgaybros/comments/2crqf7/the_word_faggothow_do_you_gaybros_feel_about_it/","Unauthenticated reddit sesssion","","False","10","","{}","I don't care if people say it..wbu?","&lt;!-- SC_OFF --&gt;&lt;div class=""md""&gt;&lt;p&gt;I don&amp;#39;t care if people say it..wbu?&lt;/p&gt;
&lt;/div&gt;&lt;!-- SC_ON --&gt;","False","askgaybros","t5_2vgfw","","","The word faggot..how do you gaybros feel about it?","10","http://www.reddit.com/r/askgaybros/comments/2crqf7/the_word_faggothow_do_you_gaybros_feel_about_it/","[]","False"
"4","","","{}","http://www.reddit.com/api/info/","{}","{}","False","","","True","KindaSmiling","","","","False","1407315660.0","1407312060.0","","self.askgaybros","0","False","0","True","False","2crppr","True","","","","","","{}","[]","t3_2crppr","8","","False","http://www.reddit.com/r/askgaybros/comments/2crppr/stuck_in_a_rut_what_to_do/","Unauthenticated reddit sesssion","","False","7","","{}","I've been single for several months and truthfully tired of it.  I seem to be able to find enough dates (through okcupid, grindr, whatever) but nothing worth while.  

I'm from a small town and have been on a date with almost every guy on Okcupid in 50 miles or so and I'm grossed out by grindr guys.  Without any gay bars, do I have any other options?  ","&lt;!-- SC_OFF --&gt;&lt;div class=""md""&gt;&lt;p&gt;I&amp;#39;ve been single for several months and truthfully tired of it.  I seem to be able to find enough dates (through okcupid, grindr, whatever) but nothing worth while.  &lt;/p&gt;

&lt;p&gt;I&amp;#39;m from a small town and have been on a date with almost every guy on Okcupid in 50 miles or so and I&amp;#39;m grossed out by grindr guys.  Without any gay bars, do I have any other options?  &lt;/p&gt;
&lt;/div&gt;&lt;!-- SC_ON --&gt;","False","askgaybros","t5_2vgfw","","","Stuck in a rut. What to do?","7","http://www.reddit.com/r/askgaybros/comments/2crppr/stuck_in_a_rut_what_to_do/","[]","False"
"5","","","{}","http://www.reddit.com/api/info/","{}","{}","False","","","True","Night_anthem","","","","False","1407302349.0","1407298749.0","","self.askgaybros","0","False","0","True","False","2cra0l","True","","","","","","{}","[]","t3_2cra0l","10","","False","http://www.reddit.com/r/askgaybros/comments/2cra0l/life_advice_how_do_i_balance_it_all/","Unauthenticated reddit sesssion","","False","10","","{}","So for the past few years I've been living on my own, working and paying my own way through school. I'm starting to get close to finishing my undergraduate degree. I was wondering whats the best way to balance work, school, social life, relationship life (we live together if it helps), and all the adult responsibilities that come with living on your own. It doesn't help that I do shift work so my schedule always all over the place and never consistent. I've been doing it for years but I was wondering if you guys had any tips that could make it easier.","&lt;!-- SC_OFF --&gt;&lt;div class=""md""&gt;&lt;p&gt;So for the past few years I&amp;#39;ve been living on my own, working and paying my own way through school. I&amp;#39;m starting to get close to finishing my undergraduate degree. I was wondering whats the best way to balance work, school, social life, relationship life (we live together if it helps), and all the adult responsibilities that come with living on your own. It doesn&amp;#39;t help that I do shift work so my schedule always all over the place and never consistent. I&amp;#39;ve been doing it for years but I was wondering if you guys had any tips that could make it easier.&lt;/p&gt;
&lt;/div&gt;&lt;!-- SC_ON --&gt;","False","askgaybros","t5_2vgfw","","","Life advice: How do I balance it all?","10","http://www.reddit.com/r/askgaybros/comments/2cra0l/life_advice_how_do_i_balance_it_all/","[]","False"
"6","","","{}","http://www.reddit.com/api/info/","{}","{}","False","","","True","esosa233","","","","False","1407302286.0","1407298686.0","","self.askgaybros","0","False","0","True","False","2cr9x9","True","","","","","","{}","[]","t3_2cr9x9","20","","False","http://www.reddit.com/r/askgaybros/comments/2cr9x9/ive_decided_to_become_independent_any_tips/","Unauthenticated reddit sesssion","","False","13","","{}","Its a long and complicated story but I'll cut it short. My very religious and culturally conservative parents found out I was gay, by a freak accident. And now I'm facing the very real possibility of being thrown out.

I'm 19, male, and a certified pharmacy technician. I haven't worked with it, but I have extensive medical experience. I currently school at university of pittsburgh, but I'm in houston due to vacation. My options are that realistically my parents tell me to stay here under their nose and go to school. On the extreme end I'm completely thrown out. Then they may give me the option to go to pittsburgh and they'll cut me off. My brothers and my dad said that in the event I get kicked out they'll house me but just out of the prinicple I want finally own up to my life. I dont want to give up on my hopes and dreams because of *this*. And I'm willing to work and struggle to be where I want to be. I feel like this is the most honest thing to do.

 I have a partial scholarship so the only thing I have to pay for is room and board. Currently at my university that is ten thousand a semester. My plan is that I'll take out my federal loans for the upcoming semester. Find a pharmtech job as immidiately as possible, look for an apartment deal with a person looking for a roommate or sublet. And then try to live my life. 

It'll help to get some advice, pittsburgh has a good metro system so I dont have to worry about that. And my university gives us health insurance and etc. There many apartments that are already fully furnished and do light/internet/cable bundles that'll make things easier on me. And housing is quite cheap around 500 can get you somewhere. Im planning that I'll change my major to nursing or pharmacy something shorter than premed. I'm sorry about the grammar and/or spelling as I'm being a little bitch and crying as I type this.","&lt;!-- SC_OFF --&gt;&lt;div class=""md""&gt;&lt;p&gt;Its a long and complicated story but I&amp;#39;ll cut it short. My very religious and culturally conservative parents found out I was gay, by a freak accident. And now I&amp;#39;m facing the very real possibility of being thrown out.&lt;/p&gt;

&lt;p&gt;I&amp;#39;m 19, male, and a certified pharmacy technician. I haven&amp;#39;t worked with it, but I have extensive medical experience. I currently school at university of pittsburgh, but I&amp;#39;m in houston due to vacation. My options are that realistically my parents tell me to stay here under their nose and go to school. On the extreme end I&amp;#39;m completely thrown out. Then they may give me the option to go to pittsburgh and they&amp;#39;ll cut me off. My brothers and my dad said that in the event I get kicked out they&amp;#39;ll house me but just out of the prinicple I want finally own up to my life. I dont want to give up on my hopes and dreams because of &lt;em&gt;this&lt;/em&gt;. And I&amp;#39;m willing to work and struggle to be where I want to be. I feel like this is the most honest thing to do.&lt;/p&gt;

&lt;p&gt;I have a partial scholarship so the only thing I have to pay for is room and board. Currently at my university that is ten thousand a semester. My plan is that I&amp;#39;ll take out my federal loans for the upcoming semester. Find a pharmtech job as immidiately as possible, look for an apartment deal with a person looking for a roommate or sublet. And then try to live my life. &lt;/p&gt;

&lt;p&gt;It&amp;#39;ll help to get some advice, pittsburgh has a good metro system so I dont have to worry about that. And my university gives us health insurance and etc. There many apartments that are already fully furnished and do light/internet/cable bundles that&amp;#39;ll make things easier on me. And housing is quite cheap around 500 can get you somewhere. Im planning that I&amp;#39;ll change my major to nursing or pharmacy something shorter than premed. I&amp;#39;m sorry about the grammar and/or spelling as I&amp;#39;m being a little bitch and crying as I type this.&lt;/p&gt;
&lt;/div&gt;&lt;!-- SC_ON --&gt;","False","askgaybros","t5_2vgfw","","","I've decided to become independent. Any tips?","13","http://www.reddit.com/r/askgaybros/comments/2cr9x9/ive_decided_to_become_independent_any_tips/","[]","False"
"7","","","{}","http://www.reddit.com/api/info/","{}","{}","False","","","True","aerocastle","","","","False","1407295474.0","1407291874.0","","self.askgaybros","0","False","0","True","False","2cqzl8","True","","","","","","{}","[]","t3_2cqzl8","19","","False","http://www.reddit.com/r/askgaybros/comments/2cqzl8/i_selfishly_need_some_encouragement_to_come_out/","Unauthenticated reddit sesssion","","False","6","","{}","I'm still in the closet, and it's become incredibly unhealthy, and it's ruining my summer. I know that I need to come out to someone, instead of keeping it all in. I'm meeting up with a friend (tonight, aaah) who is very liberal and will not have any issues with what I want to say. I've decided that they would be the first to know, but I've delayed it for months and months.

I'm scared that I'll chicken out.

So, I selfishly need some support and encouragement to have the balls to go through with what I've gone over in my head hundreds of times.

I feel like if I had to be held accountable to people, I would actually do it.

I'm sorry for clogging this subreddit with more generic coming out help-I know my situation is not unique at all. But I need all the pushes I can get to take the first step.","&lt;!-- SC_OFF --&gt;&lt;div class=""md""&gt;&lt;p&gt;I&amp;#39;m still in the closet, and it&amp;#39;s become incredibly unhealthy, and it&amp;#39;s ruining my summer. I know that I need to come out to someone, instead of keeping it all in. I&amp;#39;m meeting up with a friend (tonight, aaah) who is very liberal and will not have any issues with what I want to say. I&amp;#39;ve decided that they would be the first to know, but I&amp;#39;ve delayed it for months and months.&lt;/p&gt;

&lt;p&gt;I&amp;#39;m scared that I&amp;#39;ll chicken out.&lt;/p&gt;

&lt;p&gt;So, I selfishly need some support and encouragement to have the balls to go through with what I&amp;#39;ve gone over in my head hundreds of times.&lt;/p&gt;

&lt;p&gt;I feel like if I had to be held accountable to people, I would actually do it.&lt;/p&gt;

&lt;p&gt;I&amp;#39;m sorry for clogging this subreddit with more generic coming out help-I know my situation is not unique at all. But I need all the pushes I can get to take the first step.&lt;/p&gt;
&lt;/div&gt;&lt;!-- SC_ON --&gt;","False","askgaybros","t5_2vgfw","","","I (selfishly) need some encouragement to come out!","6","http://www.reddit.com/r/askgaybros/comments/2cqzl8/i_selfishly_need_some_encouragement_to_come_out/","[]","False"
"8","","","{}","http://www.reddit.com/api/info/","{}","{}","False","","","True","gaysiancomingout","","","","False","1407294146.0","1407290546.0","","self.askgaybros","0","1407291331.0","0","True","False","2cqxj4","True","","","","","","{}","[]","t3_2cqxj4","2","","False","http://www.reddit.com/r/askgaybros/comments/2cqxj4/ive_been_forced_out_of_the_closet_and_need_some/","Unauthenticated reddit sesssion","","False","3","","{}","I am an asian male outed as bi, in a relationship with a guy. My parents, while not having a negative reaction, don't really approve. 

There's a lot to educate them. My mom thinks that, because I've never had a serious relationship with a girl, that I might ""change my mind"" later. My dad thinks that I should just be friends instead, and not have a sexual relationship (too late dad).

Do you guys have any advice? What to say? How to educate them? Reading materials for parents? I tried finding ones specifically talking about bisexuals for asians but didn't get too many besides [this one.](http://qaspace.apiequalityla.org/resources/parents)","&lt;!-- SC_OFF --&gt;&lt;div class=""md""&gt;&lt;p&gt;I am an asian male outed as bi, in a relationship with a guy. My parents, while not having a negative reaction, don&amp;#39;t really approve. &lt;/p&gt;

&lt;p&gt;There&amp;#39;s a lot to educate them. My mom thinks that, because I&amp;#39;ve never had a serious relationship with a girl, that I might &amp;quot;change my mind&amp;quot; later. My dad thinks that I should just be friends instead, and not have a sexual relationship (too late dad).&lt;/p&gt;

&lt;p&gt;Do you guys have any advice? What to say? How to educate them? Reading materials for parents? I tried finding ones specifically talking about bisexuals for asians but didn&amp;#39;t get too many besides &lt;a href=""http://qaspace.apiequalityla.org/resources/parents""&gt;this one.&lt;/a&gt;&lt;/p&gt;
&lt;/div&gt;&lt;!-- SC_ON --&gt;","False","askgaybros","t5_2vgfw","","","I've been forced out of the closet, and need some advice.","3","http://www.reddit.com/r/askgaybros/comments/2cqxj4/ive_been_forced_out_of_the_closet_and_need_some/","[]","False"
