"","_comment_sort","_comments","_comments_by_id","_info_url","_orphaned","_params","_replaced_more","_underscore_names","approved_by","archived","author","author_flair_css_class","author_flair_text","banned_by","clicked","created","created_utc","distinguished","domain","downs","edited","gilded","has_fetched","hidden","id","is_self","json_dict","likes","link_flair_css_class","link_flair_text","media","media_embed","mod_reports","name","num_comments","num_reports","over_18","permalink","reddit_session","report_reasons","saved","score","secure_media","secure_media_embed","selftext","selftext_html","stickied","subreddit","subreddit_id","suggested_sort","thumbnail","title","ups","url","user_reports","visited"
"9","","","{}","http://www.reddit.com/api/info/","{}","{}","False","","","True","comethrowawaywithme1","","","","False","1404531778.0","1404528178.0","","self.askgaybros","0","False","0","True","False","29vfau","True","","","","","","{}","[]","t3_29vfau","7","","False","http://www.reddit.com/r/askgaybros/comments/29vfau/thinking_about_going_out_with_an_ex_again_but_i/","Unauthenticated reddit sesssion","","False","3","","{}","Hey dudes, so about 7 or 8 months ago I dated this guy. We went out for about a month, had lots of fun but unfortunately broke up. The reason being was he wanted an open relationship and I at the time didn't want that. Commence sadness (of course lol) nothing serious, I mean, it's been a while since then so I was awesome for six months, you know, focused on school, hung out with friends, classic getting over a break up stuff.

HOWEVER, recently he contacted me saying he was near my area and wanted to know where I lived, since he apparently forgot. Being such a long time since we talked I was kinda skeptical but I eventually gave in and told him where I lived. He came over for a bit, we went for a walk, hung out for a couple of hours, and just caught up. Overall, it was good, though (and here's the first problem) I didn't know what the intention of the visit was. I couldn't tell if he wanted to be friends or maybe that he wanted to go out once more, so I asked him if he wanted to hang out again soon, and so I could get to the bottom of this.

A week goes by, and we make the plans to hang out, go for a walk, grab some food, and basically chill. I try not to read too much into the smiley faces that he puts into his texts (dammit brain) but you know how the mind works. Anyways, we eventually hang out and it's great, lots of fun had, but I found a flirtatious undertone to the whole evening, so I was thinking ""Okay, this HAS to be a date, but be ready in case it's not."" Of course I was too chicken to ask and also, I admit, a little afraid if he said it wasn't but I'll get to that later. So we finish eating, head home, hug goodbye, and that was it. I get back home and told him I forgot to thank him for the food (since he paid) and then made a little joke. We text briefly then I realize I gotta ask. If I don't this is gonna drive me nuts. So I do. I ask him if it was a date because I got a date vibe. He tells me he doesn't know and to call it whatever, but either way he had fun. THEN he says if I was hoping things to go further then I should know that he still wants an open relationship. I took this as ""No, it wasn't a date, and we should just be friends"" and so I told him that's cool, I just wanted to know what was up. Then I cried. Yup, I've been good for about six months but now it felt like a break up again. Luckily at this point, I've learned to deal with heavy emotions, which for me, is playing music and just letting it all happen. So I cry it out and and the next day I feel so much better, but I realize I need to do something about this.

At this point I realized the things I did wrong. I knew I should've been clear right off the bat if it was a date or not. That could've saved me so much grief. I would've been fine being friends had that been established as the intent but I secretly hoped that he had wanted to get together and so that's why I didn't ask, and in the end I ended finding myself liking this guy all over again. The next day I realized that I need to have a peace of mind so I decided to come up with a list of options. **Option** **1**, I tell him that I don't think we can be friends cause in the end I'll always have romantic feelings and that's just no fun. **Option** **2** is to wait it out and realize that I've gotten over him before and maybe I can do it again and while it may be a lengthy process, it's still viable. AND FINALLY **OPTION** **3** (and this is where it gets interesting) is that we get back together. What I finally realized (after talking about it with some peeps) is that he didn't actually say that it WASN'T a date and then gave me the option to continue if I was groovy with it. But also you're probably thinking, ""Yo man, you guys broke up cuz you wanted different things. How can you expect to date him knowing that?"" and I hear you. But like I said, it's been a while, and in that period I've slept around casually and have gotten used to sex as something  that can be more open (only if done safe tho lol) and so now I'm at a point where I'd say I wouldn't actively seek an open relationship but I don't think it will bother me having one. However, an issue that I have is that I hope this change isn't stemming from wanting to be with him and is secretly overriding any form of logic to enter my mind, and that eventually I won't be okay with an open relationship (risky way of knowing for sure though). 

Anyways, I've been hoping to get some opinions so I've been opening up to some of my friends about this as well as hopefully get some opinions from you guys. And although I wouldn't mind any of the options I've laid out, I guess I am more partial to getting back together but I way prefer having a peace of mind and do what's healthy for me. But who knows, we dated only for a month and maybe I'm being *waaaay* to dramatic, in the end another problem could possibly arise that ends it all (gotta be realistic, right?). So lemme know what you guys think I should do.

**TL;DR** Dated a guy, broke up cause we wanted different things, six months later we reconnected, feelings came back but also I've changed since then and now open in regards to what we want in the relationship, and now the option to date again may now be open.","&lt;!-- SC_OFF --&gt;&lt;div class=""md""&gt;&lt;p&gt;Hey dudes, so about 7 or 8 months ago I dated this guy. We went out for about a month, had lots of fun but unfortunately broke up. The reason being was he wanted an open relationship and I at the time didn&amp;#39;t want that. Commence sadness (of course lol) nothing serious, I mean, it&amp;#39;s been a while since then so I was awesome for six months, you know, focused on school, hung out with friends, classic getting over a break up stuff.&lt;/p&gt;

&lt;p&gt;HOWEVER, recently he contacted me saying he was near my area and wanted to know where I lived, since he apparently forgot. Being such a long time since we talked I was kinda skeptical but I eventually gave in and told him where I lived. He came over for a bit, we went for a walk, hung out for a couple of hours, and just caught up. Overall, it was good, though (and here&amp;#39;s the first problem) I didn&amp;#39;t know what the intention of the visit was. I couldn&amp;#39;t tell if he wanted to be friends or maybe that he wanted to go out once more, so I asked him if he wanted to hang out again soon, and so I could get to the bottom of this.&lt;/p&gt;

&lt;p&gt;A week goes by, and we make the plans to hang out, go for a walk, grab some food, and basically chill. I try not to read too much into the smiley faces that he puts into his texts (dammit brain) but you know how the mind works. Anyways, we eventually hang out and it&amp;#39;s great, lots of fun had, but I found a flirtatious undertone to the whole evening, so I was thinking &amp;quot;Okay, this HAS to be a date, but be ready in case it&amp;#39;s not.&amp;quot; Of course I was too chicken to ask and also, I admit, a little afraid if he said it wasn&amp;#39;t but I&amp;#39;ll get to that later. So we finish eating, head home, hug goodbye, and that was it. I get back home and told him I forgot to thank him for the food (since he paid) and then made a little joke. We text briefly then I realize I gotta ask. If I don&amp;#39;t this is gonna drive me nuts. So I do. I ask him if it was a date because I got a date vibe. He tells me he doesn&amp;#39;t know and to call it whatever, but either way he had fun. THEN he says if I was hoping things to go further then I should know that he still wants an open relationship. I took this as &amp;quot;No, it wasn&amp;#39;t a date, and we should just be friends&amp;quot; and so I told him that&amp;#39;s cool, I just wanted to know what was up. Then I cried. Yup, I&amp;#39;ve been good for about six months but now it felt like a break up again. Luckily at this point, I&amp;#39;ve learned to deal with heavy emotions, which for me, is playing music and just letting it all happen. So I cry it out and and the next day I feel so much better, but I realize I need to do something about this.&lt;/p&gt;

&lt;p&gt;At this point I realized the things I did wrong. I knew I should&amp;#39;ve been clear right off the bat if it was a date or not. That could&amp;#39;ve saved me so much grief. I would&amp;#39;ve been fine being friends had that been established as the intent but I secretly hoped that he had wanted to get together and so that&amp;#39;s why I didn&amp;#39;t ask, and in the end I ended finding myself liking this guy all over again. The next day I realized that I need to have a peace of mind so I decided to come up with a list of options. &lt;strong&gt;Option&lt;/strong&gt; &lt;strong&gt;1&lt;/strong&gt;, I tell him that I don&amp;#39;t think we can be friends cause in the end I&amp;#39;ll always have romantic feelings and that&amp;#39;s just no fun. &lt;strong&gt;Option&lt;/strong&gt; &lt;strong&gt;2&lt;/strong&gt; is to wait it out and realize that I&amp;#39;ve gotten over him before and maybe I can do it again and while it may be a lengthy process, it&amp;#39;s still viable. AND FINALLY &lt;strong&gt;OPTION&lt;/strong&gt; &lt;strong&gt;3&lt;/strong&gt; (and this is where it gets interesting) is that we get back together. What I finally realized (after talking about it with some peeps) is that he didn&amp;#39;t actually say that it WASN&amp;#39;T a date and then gave me the option to continue if I was groovy with it. But also you&amp;#39;re probably thinking, &amp;quot;Yo man, you guys broke up cuz you wanted different things. How can you expect to date him knowing that?&amp;quot; and I hear you. But like I said, it&amp;#39;s been a while, and in that period I&amp;#39;ve slept around casually and have gotten used to sex as something  that can be more open (only if done safe tho lol) and so now I&amp;#39;m at a point where I&amp;#39;d say I wouldn&amp;#39;t actively seek an open relationship but I don&amp;#39;t think it will bother me having one. However, an issue that I have is that I hope this change isn&amp;#39;t stemming from wanting to be with him and is secretly overriding any form of logic to enter my mind, and that eventually I won&amp;#39;t be okay with an open relationship (risky way of knowing for sure though). &lt;/p&gt;

&lt;p&gt;Anyways, I&amp;#39;ve been hoping to get some opinions so I&amp;#39;ve been opening up to some of my friends about this as well as hopefully get some opinions from you guys. And although I wouldn&amp;#39;t mind any of the options I&amp;#39;ve laid out, I guess I am more partial to getting back together but I way prefer having a peace of mind and do what&amp;#39;s healthy for me. But who knows, we dated only for a month and maybe I&amp;#39;m being &lt;em&gt;waaaay&lt;/em&gt; to dramatic, in the end another problem could possibly arise that ends it all (gotta be realistic, right?). So lemme know what you guys think I should do.&lt;/p&gt;

&lt;p&gt;&lt;strong&gt;TL;DR&lt;/strong&gt; Dated a guy, broke up cause we wanted different things, six months later we reconnected, feelings came back but also I&amp;#39;ve changed since then and now open in regards to what we want in the relationship, and now the option to date again may now be open.&lt;/p&gt;
&lt;/div&gt;&lt;!-- SC_ON --&gt;","False","askgaybros","t5_2vgfw","","","Thinking about going out with an ex again but I think I need a second opinion.","3","http://www.reddit.com/r/askgaybros/comments/29vfau/thinking_about_going_out_with_an_ex_again_but_i/","[]","False"
"10","","","{}","http://www.reddit.com/api/info/","{}","{}","False","","","True","monkey_sage","","","","False","1404531723.0","1404528123.0","","self.askgaybros","0","False","0","True","False","29vf8u","True","","","","","","{}","[]","t3_29vf8u","21","","False","http://www.reddit.com/r/askgaybros/comments/29vf8u/i_honestly_dont_believe_i_have_a_prostate/","Unauthenticated reddit sesssion","","False","3","","{}","I've stared at anatomy pictures for hours, I've had my fingers up my ass for days at a time. There is no pea-sized protrusion, there is nothing that when I press on it makes me feel amazing or like I need to pee bad or anything of the like. There's just nothing in there.

Am I a mutant or is there anyone else like me out there?","&lt;!-- SC_OFF --&gt;&lt;div class=""md""&gt;&lt;p&gt;I&amp;#39;ve stared at anatomy pictures for hours, I&amp;#39;ve had my fingers up my ass for days at a time. There is no pea-sized protrusion, there is nothing that when I press on it makes me feel amazing or like I need to pee bad or anything of the like. There&amp;#39;s just nothing in there.&lt;/p&gt;

&lt;p&gt;Am I a mutant or is there anyone else like me out there?&lt;/p&gt;
&lt;/div&gt;&lt;!-- SC_ON --&gt;","False","askgaybros","t5_2vgfw","","","I honestly don't believe I have a prostate","3","http://www.reddit.com/r/askgaybros/comments/29vf8u/i_honestly_dont_believe_i_have_a_prostate/","[]","False"
"11","","","{}","http://www.reddit.com/api/info/","{}","{}","False","","","True","Jothua","","","","False","1404529883.0","1404526283.0","","self.askgaybros","0","False","0","True","False","29vdcb","True","","","","","","{}","[]","t3_29vdcb","32","","False","http://www.reddit.com/r/askgaybros/comments/29vdcb/how_many_of_you_get_social_anxiety/","Unauthenticated reddit sesssion","","False","21","","{}","I'm kind of starting to see a bit of a trend on this subreddit. A lot of guys on here seem to get high social anxiety.

While anxiety is a natural occurrence and everyone gets it from time to time, it's a bit worrying when it stops so many people from living their lives freely and stops them from doing what they want.

So all I really want, is a show of hands. What kind of situations really give you anxiety, so much anxiety that it's palpable, you can feel it physically?","&lt;!-- SC_OFF --&gt;&lt;div class=""md""&gt;&lt;p&gt;I&amp;#39;m kind of starting to see a bit of a trend on this subreddit. A lot of guys on here seem to get high social anxiety.&lt;/p&gt;

&lt;p&gt;While anxiety is a natural occurrence and everyone gets it from time to time, it&amp;#39;s a bit worrying when it stops so many people from living their lives freely and stops them from doing what they want.&lt;/p&gt;

&lt;p&gt;So all I really want, is a show of hands. What kind of situations really give you anxiety, so much anxiety that it&amp;#39;s palpable, you can feel it physically?&lt;/p&gt;
&lt;/div&gt;&lt;!-- SC_ON --&gt;","False","askgaybros","t5_2vgfw","","","How many of you get social anxiety?","21","http://www.reddit.com/r/askgaybros/comments/29vdcb/how_many_of_you_get_social_anxiety/","[]","False"
"12","","","{}","http://www.reddit.com/api/info/","{}","{}","False","","","True","TESTlNG","","","","False","1404525206.0","1404521606.0","","self.askgaybros","0","False","0","True","False","29v8gj","True","","","","","","{}","[]","t3_29v8gj","17","","False","http://www.reddit.com/r/askgaybros/comments/29v8gj/starting_to_feel_like_my_boyfriend_isnt_treating/","Unauthenticated reddit sesssion","","False","7","","{}","He also doesn't seem to give a shit when I prove it to him.


Beyond just breaking up with him, how can I make him that I'm not happy with the way he's treating me? 

I've straight up told him, multiple times. He apologizes, and then he's right back to being a shitty boyfriend the next day. A lot of times I'm wondering why the fuck I'm even with this guy, and then the next day he's doing something that pulls me back in.


What the hell do I do here?","&lt;!-- SC_OFF --&gt;&lt;div class=""md""&gt;&lt;p&gt;He also doesn&amp;#39;t seem to give a shit when I prove it to him.&lt;/p&gt;

&lt;p&gt;Beyond just breaking up with him, how can I make him that I&amp;#39;m not happy with the way he&amp;#39;s treating me? &lt;/p&gt;

&lt;p&gt;I&amp;#39;ve straight up told him, multiple times. He apologizes, and then he&amp;#39;s right back to being a shitty boyfriend the next day. A lot of times I&amp;#39;m wondering why the fuck I&amp;#39;m even with this guy, and then the next day he&amp;#39;s doing something that pulls me back in.&lt;/p&gt;

&lt;p&gt;What the hell do I do here?&lt;/p&gt;
&lt;/div&gt;&lt;!-- SC_ON --&gt;","False","askgaybros","t5_2vgfw","","","Starting to feel like my boyfriend isn't treating me nearly as well as he should, or as well as I treat him.","7","http://www.reddit.com/r/askgaybros/comments/29v8gj/starting_to_feel_like_my_boyfriend_isnt_treating/","[]","False"
"13","","","{}","http://www.reddit.com/api/info/","{}","{}","False","","","True","ansdry88","","","","False","1404524813.0","1404521213.0","","self.askgaybros","0","False","0","True","False","29v80r","True","","","","","","{}","[]","t3_29v80r","21","","False","http://www.reddit.com/r/askgaybros/comments/29v80r/how_do_you_know_a_guy_is_flirting/","Unauthenticated reddit sesssion","","False","43","","{}","Particularly in non gay spaces like bars, clubs etc. I'm not a fan of either and would consider myself more of an introvert.

How do you differentiate between ordinary friendlies and flirting?

Do you have an experience where it was a thin line but you just knew ? How did you know?

I feel like I am potentially missing out on meeting some fantastic people.","&lt;!-- SC_OFF --&gt;&lt;div class=""md""&gt;&lt;p&gt;Particularly in non gay spaces like bars, clubs etc. I&amp;#39;m not a fan of either and would consider myself more of an introvert.&lt;/p&gt;

&lt;p&gt;How do you differentiate between ordinary friendlies and flirting?&lt;/p&gt;

&lt;p&gt;Do you have an experience where it was a thin line but you just knew ? How did you know?&lt;/p&gt;

&lt;p&gt;I feel like I am potentially missing out on meeting some fantastic people.&lt;/p&gt;
&lt;/div&gt;&lt;!-- SC_ON --&gt;","False","askgaybros","t5_2vgfw","","","How do you know a guy is flirting?","43","http://www.reddit.com/r/askgaybros/comments/29v80r/how_do_you_know_a_guy_is_flirting/","[]","False"
"14","","","{}","http://www.reddit.com/api/info/","{}","{}","False","","","True","Historyofwrongguys","","","","False","1404523597.0","1404519997.0","","self.askgaybros","0","False","0","True","False","29v6m4","True","","","","","","{}","[]","t3_29v6m4","1","","False","http://www.reddit.com/r/askgaybros/comments/29v6m4/my_boyfriend_took_advantage_of_my_friendex/","Unauthenticated reddit sesssion","","False","3","","{}","Hi all,

So I'm having some concerns, and I'm looking for advice. The guy I'm currently seeing has always been very sweet to me while we've been dating and for the most part, I really enjoy being with him. Certainly, he's a bit of an ass on occasion, but his arrogance is a part of his charm, I think.

But to the point, a friend of mine that I used to date two years ago came to me and told me about a date that he went on with my now-current boyfriend a few months ago. From what he said, it definitely sounds like my boyfriend got him very drunk to have sex, and he says he definitely would not have slept with him if he hadn't been so drunk. My friend was very ""if you like him, don't let what I'm saying affect you,"" but I can't really do that, like, at all.

I don't really know what I should do with this info. I don't feel very comfortable being around my boyfriend at the moment, and I know that if I confront him, he'll find some way to talk his way out, or start way too much conflict for my friend, and I don't want to open him up to that.

So yeah, I'm open to any advice. I'm sorry I can't get into more specifics, but that's the gist of where I'm at. I'm also going to be moving away from the area in a month, so I'm not sure how much drama I really want to fit into my schedule.","&lt;!-- SC_OFF --&gt;&lt;div class=""md""&gt;&lt;p&gt;Hi all,&lt;/p&gt;

&lt;p&gt;So I&amp;#39;m having some concerns, and I&amp;#39;m looking for advice. The guy I&amp;#39;m currently seeing has always been very sweet to me while we&amp;#39;ve been dating and for the most part, I really enjoy being with him. Certainly, he&amp;#39;s a bit of an ass on occasion, but his arrogance is a part of his charm, I think.&lt;/p&gt;

&lt;p&gt;But to the point, a friend of mine that I used to date two years ago came to me and told me about a date that he went on with my now-current boyfriend a few months ago. From what he said, it definitely sounds like my boyfriend got him very drunk to have sex, and he says he definitely would not have slept with him if he hadn&amp;#39;t been so drunk. My friend was very &amp;quot;if you like him, don&amp;#39;t let what I&amp;#39;m saying affect you,&amp;quot; but I can&amp;#39;t really do that, like, at all.&lt;/p&gt;

&lt;p&gt;I don&amp;#39;t really know what I should do with this info. I don&amp;#39;t feel very comfortable being around my boyfriend at the moment, and I know that if I confront him, he&amp;#39;ll find some way to talk his way out, or start way too much conflict for my friend, and I don&amp;#39;t want to open him up to that.&lt;/p&gt;

&lt;p&gt;So yeah, I&amp;#39;m open to any advice. I&amp;#39;m sorry I can&amp;#39;t get into more specifics, but that&amp;#39;s the gist of where I&amp;#39;m at. I&amp;#39;m also going to be moving away from the area in a month, so I&amp;#39;m not sure how much drama I really want to fit into my schedule.&lt;/p&gt;
&lt;/div&gt;&lt;!-- SC_ON --&gt;","False","askgaybros","t5_2vgfw","","","My boyfriend took advantage of my friend/ex","3","http://www.reddit.com/r/askgaybros/comments/29v6m4/my_boyfriend_took_advantage_of_my_friendex/","[]","False"
"15","","","{}","http://www.reddit.com/api/info/","{}","{}","False","","","True","gafftapes10","","","","False","1404522511.0","1404518911.0","","self.askgaybros","0","1404519463.0","0","True","False","29v5fo","True","","","","","","{}","[]","t3_29v5fo","6","","False","http://www.reddit.com/r/askgaybros/comments/29v5fo/a_girl_two_gays_boys_and_entangled_relationships/","Unauthenticated reddit sesssion","","False","2","","{}","Okay so this situation just got really complicated.  I dated this guy on and off for about 9 months.  We were pretty close friends.  Anyway we broke up after a fight and our friendship evaporated.  After a few months of not talking we start talking again this past week.  Things have been tenuous.  He hasn't been that responsive, but he says its not me, but he just has a lot to think about.  

Now for the complicated bit.  I started to talk to one of his best friends, a girl.  I approached her for some advice in resuming a friendship with him.  Apparently he has been feeling down for the past week because of her.  Her story goes like this: Two weeks after our fight they started dating. She had a crush on him for years going back to high school.  She knew he was gay, and he never pretended otherwise.  Okay so they're dating, and she said it felt like it wasn't real.  She said she loves him.  she thinks she messed up her friendship with him permanently.  He told her earlier this week that he couldn't be romantically involved with her.  Her heart is broken.  I feel bad for both of them.  I expressed my sympathy and we decided to meet up tomorrow.  

I have no idea what to make about all of this.","&lt;!-- SC_OFF --&gt;&lt;div class=""md""&gt;&lt;p&gt;Okay so this situation just got really complicated.  I dated this guy on and off for about 9 months.  We were pretty close friends.  Anyway we broke up after a fight and our friendship evaporated.  After a few months of not talking we start talking again this past week.  Things have been tenuous.  He hasn&amp;#39;t been that responsive, but he says its not me, but he just has a lot to think about.  &lt;/p&gt;

&lt;p&gt;Now for the complicated bit.  I started to talk to one of his best friends, a girl.  I approached her for some advice in resuming a friendship with him.  Apparently he has been feeling down for the past week because of her.  Her story goes like this: Two weeks after our fight they started dating. She had a crush on him for years going back to high school.  She knew he was gay, and he never pretended otherwise.  Okay so they&amp;#39;re dating, and she said it felt like it wasn&amp;#39;t real.  She said she loves him.  she thinks she messed up her friendship with him permanently.  He told her earlier this week that he couldn&amp;#39;t be romantically involved with her.  Her heart is broken.  I feel bad for both of them.  I expressed my sympathy and we decided to meet up tomorrow.  &lt;/p&gt;

&lt;p&gt;I have no idea what to make about all of this.&lt;/p&gt;
&lt;/div&gt;&lt;!-- SC_ON --&gt;","False","askgaybros","t5_2vgfw","","","A girl, two gays boys and entangled relationships. What am I going to do?","2","http://www.reddit.com/r/askgaybros/comments/29v5fo/a_girl_two_gays_boys_and_entangled_relationships/","[]","False"
