"","_comment_sort","_comments","_comments_by_id","_info_url","_orphaned","_params","_replaced_more","_underscore_names","approved_by","archived","author","author_flair_css_class","author_flair_text","banned_by","clicked","created","created_utc","distinguished","domain","downs","edited","gilded","has_fetched","hidden","id","is_self","json_dict","likes","link_flair_css_class","link_flair_text","media","media_embed","mod_reports","name","num_comments","num_reports","over_18","permalink","reddit_session","report_reasons","saved","score","secure_media","secure_media_embed","selftext","selftext_html","stickied","subreddit","subreddit_id","suggested_sort","thumbnail","title","ups","url","user_reports","visited"
"0","","","{}","http://www.reddit.com/api/info/","{}","{}","False","","","False","MinisterforFun","","","","False","1428163279.0","1428159679.0","","self.askgaybros","0","False","0","True","False","31f9op","True","","","","","","{}","[]","t3_31f9op","2","","False","http://www.reddit.com/r/askgaybros/comments/31f9op/question_about_rejection_reasons/","Unauthenticated reddit sesssion","","False","3","","{}","Has anyone said they didn't want to be bfs with you simply because you couldn't perform sexually well enough for him?

I.E., not lasting long enough, same sexual position, etc.","&lt;!-- SC_OFF --&gt;&lt;div class=""md""&gt;&lt;p&gt;Has anyone said they didn&amp;#39;t want to be bfs with you simply because you couldn&amp;#39;t perform sexually well enough for him?&lt;/p&gt;

&lt;p&gt;I.E., not lasting long enough, same sexual position, etc.&lt;/p&gt;
&lt;/div&gt;&lt;!-- SC_ON --&gt;","False","askgaybros","t5_2vgfw","","","Question about rejection reasons","3","http://www.reddit.com/r/askgaybros/comments/31f9op/question_about_rejection_reasons/","[]","False"
"1","","","{}","http://www.reddit.com/api/info/","{}","{}","False","","","False","PatrickStarsMouse","","","","False","1428161615.0","1428158015.0","","self.askgaybros","0","False","0","True","False","31f6xr","True","","","","","","{}","[]","t3_31f6xr","98","","False","http://www.reddit.com/r/askgaybros/comments/31f6xr/i_think_i_am_racist/","Unauthenticated reddit sesssion","","False","34","","{}","I've been set up on a blind date and I found out that the guy is black and I feel unsure about this, I don't feel like we will have anything in common, if he was white I wouldn't feel like this but I can't see me and a black guy having anything in common, especially as I am 18 and he is 26 and I feel really bad for saying that. I feel so bad even writing this. ","&lt;!-- SC_OFF --&gt;&lt;div class=""md""&gt;&lt;p&gt;I&amp;#39;ve been set up on a blind date and I found out that the guy is black and I feel unsure about this, I don&amp;#39;t feel like we will have anything in common, if he was white I wouldn&amp;#39;t feel like this but I can&amp;#39;t see me and a black guy having anything in common, especially as I am 18 and he is 26 and I feel really bad for saying that. I feel so bad even writing this. &lt;/p&gt;
&lt;/div&gt;&lt;!-- SC_ON --&gt;","False","askgaybros","t5_2vgfw","","","I think I am racist","34","http://www.reddit.com/r/askgaybros/comments/31f6xr/i_think_i_am_racist/","[]","False"
"2","","","{}","http://www.reddit.com/api/info/","{}","{}","False","","","False","wakuani","","","","False","1428159827.0","1428156227.0","","self.askgaybros","0","False","0","True","False","31f45r","True","","","","","","{}","[]","t3_31f45r","32","","False","http://www.reddit.com/r/askgaybros/comments/31f45r/how_do_i_approach_guys_on_grindr_if_im_into_ltr/","Unauthenticated reddit sesssion","","False","10","","{}","I'm still pretty new to gay dating apps. I'm not there to have one-night stands, I actually want to meet guys and get to know some. But how do I approach a guy if I'm not looking for sex? The whole ""what are you looking for"" thing seems very oriented towards sex. I basically need conversation starters and a Grindr teacher because I'm lost! ","&lt;!-- SC_OFF --&gt;&lt;div class=""md""&gt;&lt;p&gt;I&amp;#39;m still pretty new to gay dating apps. I&amp;#39;m not there to have one-night stands, I actually want to meet guys and get to know some. But how do I approach a guy if I&amp;#39;m not looking for sex? The whole &amp;quot;what are you looking for&amp;quot; thing seems very oriented towards sex. I basically need conversation starters and a Grindr teacher because I&amp;#39;m lost! &lt;/p&gt;
&lt;/div&gt;&lt;!-- SC_ON --&gt;","False","askgaybros","t5_2vgfw","","","How do I approach guys on Grindr if I'm into LTR?","10","http://www.reddit.com/r/askgaybros/comments/31f45r/how_do_i_approach_guys_on_grindr_if_im_into_ltr/","[]","False"
"3","","","{}","http://www.reddit.com/api/info/","{}","{}","False","","","False","motherfreakingdragon","","","","False","1428159802.0","1428156202.0","","self.askgaybros","0","False","0","True","False","31f44j","True","","","","","","{}","[]","t3_31f44j","24","","False","http://www.reddit.com/r/askgaybros/comments/31f44j/describe_the_best_first_date_you_had/","Unauthenticated reddit sesssion","","False","17","","{}","I need ideas cause I feel like I'm doing a lot of the same stuff with the only variables being the people I go on dates with. Hookup stories welcome but looking to change what I do BEFORE I hit the sack. Thanks in advance bros. ","&lt;!-- SC_OFF --&gt;&lt;div class=""md""&gt;&lt;p&gt;I need ideas cause I feel like I&amp;#39;m doing a lot of the same stuff with the only variables being the people I go on dates with. Hookup stories welcome but looking to change what I do BEFORE I hit the sack. Thanks in advance bros. &lt;/p&gt;
&lt;/div&gt;&lt;!-- SC_ON --&gt;","False","askgaybros","t5_2vgfw","","","Describe the best first date you had","17","http://www.reddit.com/r/askgaybros/comments/31f44j/describe_the_best_first_date_you_had/","[]","False"
"4","","","{}","http://www.reddit.com/api/info/","{}","{}","False","","","False","chromestock","","","","False","1428147245.0","1428143645.0","","self.askgaybros","0","False","0","True","False","31epw8","True","","","","","","{}","[]","t3_31epw8","5","","False","http://www.reddit.com/r/askgaybros/comments/31epw8/asking_out_a_guy_i_dont_get_to_talk_to/","Unauthenticated reddit sesssion","","False","3","","{}","So there is this guy I see everyday and I want to ask him out, however I can never seem to find a reason to talk to him.","&lt;!-- SC_OFF --&gt;&lt;div class=""md""&gt;&lt;p&gt;So there is this guy I see everyday and I want to ask him out, however I can never seem to find a reason to talk to him.&lt;/p&gt;
&lt;/div&gt;&lt;!-- SC_ON --&gt;","False","askgaybros","t5_2vgfw","","","Asking out a guy I don't get to talk to","3","http://www.reddit.com/r/askgaybros/comments/31epw8/asking_out_a_guy_i_dont_get_to_talk_to/","[]","False"
"5","","","{}","http://www.reddit.com/api/info/","{}","{}","False","","","False","thisisnotlegit11","","","","False","1428146710.0","1428143110.0","","self.askgaybros","0","False","0","True","False","31epee","True","","","","","","{}","[]","t3_31epee","7","","False","http://www.reddit.com/r/askgaybros/comments/31epee/right_love_wrong_time_stories/","Unauthenticated reddit sesssion","","False","6","","{}","Please tell me more about it","&lt;!-- SC_OFF --&gt;&lt;div class=""md""&gt;&lt;p&gt;Please tell me more about it&lt;/p&gt;
&lt;/div&gt;&lt;!-- SC_ON --&gt;","False","askgaybros","t5_2vgfw","","","""Right love, wrong time"" stories?","6","http://www.reddit.com/r/askgaybros/comments/31epee/right_love_wrong_time_stories/","[]","False"
"6","","","{}","http://www.reddit.com/api/info/","{}","{}","False","","","False","MinisterforFun","","","","False","1428145703.0","1428142103.0","","self.askgaybros","0","1428159263.0","0","True","False","31eog2","True","","","","","","{}","[]","t3_31eog2","10","","False","http://www.reddit.com/r/askgaybros/comments/31eog2/any_bodybuilders_here/","Unauthenticated reddit sesssion","","False","5","","{}","What sort of guys are you attracted to?

What's your criteria for someone to be bf material?

Are you guys only attracted to guys of similar size? Similar sportiness?","&lt;!-- SC_OFF --&gt;&lt;div class=""md""&gt;&lt;p&gt;What sort of guys are you attracted to?&lt;/p&gt;

&lt;p&gt;What&amp;#39;s your criteria for someone to be bf material?&lt;/p&gt;

&lt;p&gt;Are you guys only attracted to guys of similar size? Similar sportiness?&lt;/p&gt;
&lt;/div&gt;&lt;!-- SC_ON --&gt;","False","askgaybros","t5_2vgfw","","","Any bodybuilders here?","5","http://www.reddit.com/r/askgaybros/comments/31eog2/any_bodybuilders_here/","[]","False"
"7","","","{}","http://www.reddit.com/api/info/","{}","{}","False","","","False","terrorhorrible","","","","False","1428135232.0","1428131632.0","","self.askgaybros","0","False","0","True","False","31eel3","True","","","","","","{}","[]","t3_31eel3","6","","False","http://www.reddit.com/r/askgaybros/comments/31eel3/has_anyone_heard_someone_new_by_hozier/","Unauthenticated reddit sesssion","","False","0","","{}","Anyone??? It's a really good song! I don't know why, but when this part comes up, it gets me worked up, I really like it. Anyone relate?  

And so I fall in love just a little, oh a little bit every day with someone new
I fall in love just a little, oh a little bit every day with someone new
I fall in love just a little, oh a little bit every day with someone new
I fall in love just a little, oh a little bit every day with someone new


This part too :


Love with every stranger, the stranger the better
Love with every stranger, the stranger the better
Love with every stranger, the stranger the better
Love with every stranger, the stranger the better
Love with every stranger, the stranger the better
Love with every stranger, the stranger the better","&lt;!-- SC_OFF --&gt;&lt;div class=""md""&gt;&lt;p&gt;Anyone??? It&amp;#39;s a really good song! I don&amp;#39;t know why, but when this part comes up, it gets me worked up, I really like it. Anyone relate?  &lt;/p&gt;

&lt;p&gt;And so I fall in love just a little, oh a little bit every day with someone new
I fall in love just a little, oh a little bit every day with someone new
I fall in love just a little, oh a little bit every day with someone new
I fall in love just a little, oh a little bit every day with someone new&lt;/p&gt;

&lt;p&gt;This part too :&lt;/p&gt;

&lt;p&gt;Love with every stranger, the stranger the better
Love with every stranger, the stranger the better
Love with every stranger, the stranger the better
Love with every stranger, the stranger the better
Love with every stranger, the stranger the better
Love with every stranger, the stranger the better&lt;/p&gt;
&lt;/div&gt;&lt;!-- SC_ON --&gt;","False","askgaybros","t5_2vgfw","","","Has anyone heard ""Someone New"" by Hozier?!?","0","http://www.reddit.com/r/askgaybros/comments/31eel3/has_anyone_heard_someone_new_by_hozier/","[]","False"
"8","","","{}","http://www.reddit.com/api/info/","{}","{}","False","","","False","Gayteentalking","","","","False","1428133876.0","1428130276.0","","self.askgaybros","0","False","0","True","False","31ed2v","True","","","","","","{}","[]","t3_31ed2v","3","","False","http://www.reddit.com/r/askgaybros/comments/31ed2v/shaving_advice/","Unauthenticated reddit sesssion","","False","3","","{}","I like to keep things smooth down there and so does my boyfriend. Just personal preference is all. I was wondering, because I like to keep the rest of my (that covers pretty much my entire body) where do I stop so it doesnt look odd? I am happy to shave anything under shorts and t shirt, is there a technique to keeping this area looking good?","&lt;!-- SC_OFF --&gt;&lt;div class=""md""&gt;&lt;p&gt;I like to keep things smooth down there and so does my boyfriend. Just personal preference is all. I was wondering, because I like to keep the rest of my (that covers pretty much my entire body) where do I stop so it doesnt look odd? I am happy to shave anything under shorts and t shirt, is there a technique to keeping this area looking good?&lt;/p&gt;
&lt;/div&gt;&lt;!-- SC_ON --&gt;","False","askgaybros","t5_2vgfw","","","Shaving advice?","3","http://www.reddit.com/r/askgaybros/comments/31ed2v/shaving_advice/","[]","False"
"9","","","{}","http://www.reddit.com/api/info/","{}","{}","False","","","False","Smeggmer","","","","False","1428133345.0","1428129745.0","","self.askgaybros","0","False","0","True","False","31ech1","True","","","","","","{}","[]","t3_31ech1","5","","False","http://www.reddit.com/r/askgaybros/comments/31ech1/increase_in_smegma/","Unauthenticated reddit sesssion","","False","6","","{}","Yes I am already going to the doctor but I haven't had time yet

Idk if I have an sti. I usually pull back my foreskin when showering everyday and run water over it and that's always been enough but now it's like the smegma doesn't really wash off and my urine kind of has a much stronger odor

My penis doesn't hurt or burn or anything but the smegma thing is kind of gross...and it's like I'm a bottom so I guess I got an sti from unprotected oral? Ugh is that even possible?","&lt;!-- SC_OFF --&gt;&lt;div class=""md""&gt;&lt;p&gt;Yes I am already going to the doctor but I haven&amp;#39;t had time yet&lt;/p&gt;

&lt;p&gt;Idk if I have an sti. I usually pull back my foreskin when showering everyday and run water over it and that&amp;#39;s always been enough but now it&amp;#39;s like the smegma doesn&amp;#39;t really wash off and my urine kind of has a much stronger odor&lt;/p&gt;

&lt;p&gt;My penis doesn&amp;#39;t hurt or burn or anything but the smegma thing is kind of gross...and it&amp;#39;s like I&amp;#39;m a bottom so I guess I got an sti from unprotected oral? Ugh is that even possible?&lt;/p&gt;
&lt;/div&gt;&lt;!-- SC_ON --&gt;","False","askgaybros","t5_2vgfw","","","Increase in smegma?","6","http://www.reddit.com/r/askgaybros/comments/31ech1/increase_in_smegma/","[]","False"
"10","","","{}","http://www.reddit.com/api/info/","{}","{}","False","","","False","tossaway111111112","","","","False","1428130202.0","1428126602.0","","self.askgaybros","0","False","0","True","False","31e8lv","True","","","","","","{}","[]","t3_31e8lv","22","","False","http://www.reddit.com/r/askgaybros/comments/31e8lv/advice_needed_should_i_return_money_that_was_a/","Unauthenticated reddit sesssion","","False","4","","{}","My partner comes from an old money family and a few years back when we graduated from uni, his parents gave us a 7 figure sum as a gift because we decided to make a few big purchases. anyways, these past few months have been rough on them, bad investments and family problems with his younger brother gambling in asia. I haven't spoken to my partner about this, but I've been thinking about it a lot lately. ","&lt;!-- SC_OFF --&gt;&lt;div class=""md""&gt;&lt;p&gt;My partner comes from an old money family and a few years back when we graduated from uni, his parents gave us a 7 figure sum as a gift because we decided to make a few big purchases. anyways, these past few months have been rough on them, bad investments and family problems with his younger brother gambling in asia. I haven&amp;#39;t spoken to my partner about this, but I&amp;#39;ve been thinking about it a lot lately. &lt;/p&gt;
&lt;/div&gt;&lt;!-- SC_ON --&gt;","False","askgaybros","t5_2vgfw","","","Advice needed... Should I return money that was a gift due to their change of circumstance?","4","http://www.reddit.com/r/askgaybros/comments/31e8lv/advice_needed_should_i_return_money_that_was_a/","[]","False"
"11","","","{}","http://www.reddit.com/api/info/","{}","{}","False","","","False","mattburner","","","","False","1428130060.0","1428126460.0","","self.askgaybros","0","False","0","True","False","31e8eu","True","","","","","","{}","[]","t3_31e8eu","7","","False","http://www.reddit.com/r/askgaybros/comments/31e8eu/i_fucked_up_need_advice/","Unauthenticated reddit sesssion","","False","1","","{}","Ok, so I am a long time lurker of this sub, and am only recently out. 

I have done very little with guys up until this point, but knew enough to be safe. Am typically a pretty sensible person. 

To cut a long story short, I unintentionally ended up hooking up with a guy from university, and didn't use protection. I threw caution to the wind, and stupidly softened a little on my usually rigid stance.

We didn't end up having fully penetrative sex, (I was too tight) but he did try, and may have entered partially (I mean, maybe an inch or less). He didn't cum in me either.

I am already berating myself for my lapse in judgement. But i am slightly freaking out.

Should I be concerned? I've already decided to go get tested, but for HIV testing, it takes a couple of months for it to reveal itself. Is there anything I should do in the meantime, apart from being less of an idiot?","&lt;!-- SC_OFF --&gt;&lt;div class=""md""&gt;&lt;p&gt;Ok, so I am a long time lurker of this sub, and am only recently out. &lt;/p&gt;

&lt;p&gt;I have done very little with guys up until this point, but knew enough to be safe. Am typically a pretty sensible person. &lt;/p&gt;

&lt;p&gt;To cut a long story short, I unintentionally ended up hooking up with a guy from university, and didn&amp;#39;t use protection. I threw caution to the wind, and stupidly softened a little on my usually rigid stance.&lt;/p&gt;

&lt;p&gt;We didn&amp;#39;t end up having fully penetrative sex, (I was too tight) but he did try, and may have entered partially (I mean, maybe an inch or less). He didn&amp;#39;t cum in me either.&lt;/p&gt;

&lt;p&gt;I am already berating myself for my lapse in judgement. But i am slightly freaking out.&lt;/p&gt;

&lt;p&gt;Should I be concerned? I&amp;#39;ve already decided to go get tested, but for HIV testing, it takes a couple of months for it to reveal itself. Is there anything I should do in the meantime, apart from being less of an idiot?&lt;/p&gt;
&lt;/div&gt;&lt;!-- SC_ON --&gt;","False","askgaybros","t5_2vgfw","","","I fucked up. Need advice.","1","http://www.reddit.com/r/askgaybros/comments/31e8eu/i_fucked_up_need_advice/","[]","False"
"12","","","{}","http://www.reddit.com/api/info/","{}","{}","False","","","False","bottomboythrowaway2","","","","False","1428119820.0","1428116220.0","","self.askgaybros","0","False","0","True","False","31dt44","True","","","","","","{}","[]","t3_31dt44","17","","False","http://www.reddit.com/r/askgaybros/comments/31dt44/bf_doesnt_know_im_a_bottom/","Unauthenticated reddit sesssion","","False","1","","{}","This is my first relationship that's getting serious. We've been together for almost 9 months and we're talking about moving in together soon. I, 23 yrs old, had never had anal sex prior but I always imagined myself as a total bottom. I like being the submissive one and getting penetrated. The first time we had anal he took the bottom position and I just followed his lead. It was fine but I didn't expect to top every single time. I only got to bottom two times (and I enjoyed it). He doesn't like to top at all and is fine with being on bottom indefinitely. When I talked to him about him being a bottom he was glad he would ""never have to top."" He'll top for me when I ask but I know how much he dislikes it. I don't like topping either. We both want a power top type experience (which he's had in the past). What should I do? I value our relationship and sex is only a part but I don't want either of us to be unsatisfied. 

  TLDR;My boyfriend and I are both total bottoms. He doesn't know i'm a bottom. ","&lt;!-- SC_OFF --&gt;&lt;div class=""md""&gt;&lt;p&gt;This is my first relationship that&amp;#39;s getting serious. We&amp;#39;ve been together for almost 9 months and we&amp;#39;re talking about moving in together soon. I, 23 yrs old, had never had anal sex prior but I always imagined myself as a total bottom. I like being the submissive one and getting penetrated. The first time we had anal he took the bottom position and I just followed his lead. It was fine but I didn&amp;#39;t expect to top every single time. I only got to bottom two times (and I enjoyed it). He doesn&amp;#39;t like to top at all and is fine with being on bottom indefinitely. When I talked to him about him being a bottom he was glad he would &amp;quot;never have to top.&amp;quot; He&amp;#39;ll top for me when I ask but I know how much he dislikes it. I don&amp;#39;t like topping either. We both want a power top type experience (which he&amp;#39;s had in the past). What should I do? I value our relationship and sex is only a part but I don&amp;#39;t want either of us to be unsatisfied. &lt;/p&gt;

&lt;p&gt;TLDR;My boyfriend and I are both total bottoms. He doesn&amp;#39;t know i&amp;#39;m a bottom. &lt;/p&gt;
&lt;/div&gt;&lt;!-- SC_ON --&gt;","False","askgaybros","t5_2vgfw","","","Bf doesn't know I'm a bottom","1","http://www.reddit.com/r/askgaybros/comments/31dt44/bf_doesnt_know_im_a_bottom/","[]","False"
"13","","","{}","http://www.reddit.com/api/info/","{}","{}","False","","","False","nsdwight","","","","False","1428115848.0","1428112248.0","","self.askgaybros","0","False","0","True","False","31dmh4","True","","","","","","{}","[]","t3_31dmh4","6","","False","http://www.reddit.com/r/askgaybros/comments/31dmh4/i_got_a_pimple_on_my_dick_is_it_aids_mostly/","Unauthenticated reddit sesssion","","False","0","","{}","Anyone else freak out about little things every now and then?","&lt;!-- SC_OFF --&gt;&lt;div class=""md""&gt;&lt;p&gt;Anyone else freak out about little things every now and then?&lt;/p&gt;
&lt;/div&gt;&lt;!-- SC_ON --&gt;","False","askgaybros","t5_2vgfw","","","I got a pimple on my dick, is it AIDS? (Mostly sarcastic)","0","http://www.reddit.com/r/askgaybros/comments/31dmh4/i_got_a_pimple_on_my_dick_is_it_aids_mostly/","[]","False"
"14","","","{}","http://www.reddit.com/api/info/","{}","{}","False","","","False","1029384strait","","","","False","1428115838.0","1428112238.0","","self.askgaybros","0","False","0","True","False","31dmgc","True","","","","","","{}","[]","t3_31dmgc","10","","False","http://www.reddit.com/r/askgaybros/comments/31dmgc/have_you_ever_rejected_a_guy_you_liked/","Unauthenticated reddit sesssion","","False","3","","{}","And what was the reason/reasons.","&lt;!-- SC_OFF --&gt;&lt;div class=""md""&gt;&lt;p&gt;And what was the reason/reasons.&lt;/p&gt;
&lt;/div&gt;&lt;!-- SC_ON --&gt;","False","askgaybros","t5_2vgfw","","","Have you ever rejected a guy you liked?","3","http://www.reddit.com/r/askgaybros/comments/31dmgc/have_you_ever_rejected_a_guy_you_liked/","[]","False"
"15","","","{}","http://www.reddit.com/api/info/","{}","{}","False","","","False","throwaway46238746234","","","","False","1428113126.0","1428109526.0","","self.askgaybros","0","False","0","True","False","31dhr6","True","","","","","","{}","[]","t3_31dhr6","9","","False","http://www.reddit.com/r/askgaybros/comments/31dhr6/new_relationship_he_keeps_saying_i_love_you/","Unauthenticated reddit sesssion","","False","0","","{}","Hey bros, I'm 17 and closeted, and started dating a pretty alright guy a week or so ago. We've gone out once, but texted a ton. Right after we started talking he expressed a lot of interest in having sex, and that we'd primarily just hook up but after going out with him he kept making excuses and delaying when we could (he's most recently said ""by the end of the month""). This is fine by me, but he keeps saying ""i love you"" and similar things, and I'm not sure I feel the same way. I enjoy talking to him, but I don't think this relationship is going to last very long considering I'm closeted atm, and also I'm going to be at university after the summer. I'd like to be in a casual relationship with him, but I don't want to lead him on and waste our time. What should I do?","&lt;!-- SC_OFF --&gt;&lt;div class=""md""&gt;&lt;p&gt;Hey bros, I&amp;#39;m 17 and closeted, and started dating a pretty alright guy a week or so ago. We&amp;#39;ve gone out once, but texted a ton. Right after we started talking he expressed a lot of interest in having sex, and that we&amp;#39;d primarily just hook up but after going out with him he kept making excuses and delaying when we could (he&amp;#39;s most recently said &amp;quot;by the end of the month&amp;quot;). This is fine by me, but he keeps saying &amp;quot;i love you&amp;quot; and similar things, and I&amp;#39;m not sure I feel the same way. I enjoy talking to him, but I don&amp;#39;t think this relationship is going to last very long considering I&amp;#39;m closeted atm, and also I&amp;#39;m going to be at university after the summer. I&amp;#39;d like to be in a casual relationship with him, but I don&amp;#39;t want to lead him on and waste our time. What should I do?&lt;/p&gt;
&lt;/div&gt;&lt;!-- SC_ON --&gt;","False","askgaybros","t5_2vgfw","","","New relationship, he keeps saying ""i love you""?","0","http://www.reddit.com/r/askgaybros/comments/31dhr6/new_relationship_he_keeps_saying_i_love_you/","[]","False"
