"","_comment_sort","_comments","_comments_by_id","_info_url","_orphaned","_params","_replaced_more","_underscore_names","approved_by","archived","author","author_flair_css_class","author_flair_text","banned_by","clicked","created","created_utc","distinguished","domain","downs","edited","gilded","has_fetched","hidden","id","is_self","json_dict","likes","link_flair_css_class","link_flair_text","media","media_embed","mod_reports","name","num_comments","num_reports","over_18","permalink","reddit_session","report_reasons","saved","score","secure_media","secure_media_embed","selftext","selftext_html","stickied","subreddit","subreddit_id","suggested_sort","thumbnail","title","ups","url","user_reports","visited"
"10","","","{}","http://www.reddit.com/api/info/","{}","{}","False","","","False","youtbuddcody","","","","False","1421214454.0","1421214454.0","","self.askgaybros","0","1421214801.0","0","True","False","2sdg1l","True","","","","","","{}","[]","t3_2sdg1l","46","","False","http://www.reddit.com/r/askgaybros/comments/2sdg1l/how_would_your_opinion_change_of_a_guy_you_were/","Unauthenticated reddit sesssion","","False","22","","{}","I've been dating a guy for a month now and I opened up to him and told him I had depression/ptsd. I told him I was really afraid to tell him because I didn't want things to change between us. He said he was supportive and that he understands because he had a rough past himself and I can open up to him whenever I need to. I did explain to him that my problems don't effect how I am with other people, but instead I close in on myself.

We havnt made the title of 'boyfriends' yet, but things have been going really well between us and we both really like eachother. But since we're still dating, I still have a tiny doubt in the back of my mind that things won't work out. That he'll lose interest of me now knowing these things.

So Gaybros, would your opinion of a guy change if he opened up to you like this? Would this be an issue with you guys?

","&lt;!-- SC_OFF --&gt;&lt;div class=""md""&gt;&lt;p&gt;I&amp;#39;ve been dating a guy for a month now and I opened up to him and told him I had depression/ptsd. I told him I was really afraid to tell him because I didn&amp;#39;t want things to change between us. He said he was supportive and that he understands because he had a rough past himself and I can open up to him whenever I need to. I did explain to him that my problems don&amp;#39;t effect how I am with other people, but instead I close in on myself.&lt;/p&gt;

&lt;p&gt;We havnt made the title of &amp;#39;boyfriends&amp;#39; yet, but things have been going really well between us and we both really like eachother. But since we&amp;#39;re still dating, I still have a tiny doubt in the back of my mind that things won&amp;#39;t work out. That he&amp;#39;ll lose interest of me now knowing these things.&lt;/p&gt;

&lt;p&gt;So Gaybros, would your opinion of a guy change if he opened up to you like this? Would this be an issue with you guys?&lt;/p&gt;
&lt;/div&gt;&lt;!-- SC_ON --&gt;","False","askgaybros","t5_2vgfw","","","How would your opinion change of a guy you were dating if he told you he had depression/PTSD?","22","http://www.reddit.com/r/askgaybros/comments/2sdg1l/how_would_your_opinion_change_of_a_guy_you_were/","[]","False"
"11","","","{}","http://www.reddit.com/api/info/","{}","{}","False","","","False","HooGuy90","","","","False","1421214052.0","1421214052.0","","self.askgaybros","0","False","0","True","False","2sdffv","True","","","","","","{}","[]","t3_2sdffv","16","","False","http://www.reddit.com/r/askgaybros/comments/2sdffv/im_very_curious_about_rimming/","Unauthenticated reddit sesssion","","False","18","","{}","So yeah, this is definitely the number one thing I want to try with a dude. I'm very curious about giving and receiving a rimjob.

I wouldn't want to unless the dude and I had showered together beforehand for obvious reasons, but I'm still curious about a lot of things. What does it feel like? Taste like? Are most guys into it? Is it considered common courtesy before topping a guy? Do you actually probe the hole with your tongue or just sort of work around the edges?

Just wanted to hear from you gaybros who have done it / do it on a regular basis.","&lt;!-- SC_OFF --&gt;&lt;div class=""md""&gt;&lt;p&gt;So yeah, this is definitely the number one thing I want to try with a dude. I&amp;#39;m very curious about giving and receiving a rimjob.&lt;/p&gt;

&lt;p&gt;I wouldn&amp;#39;t want to unless the dude and I had showered together beforehand for obvious reasons, but I&amp;#39;m still curious about a lot of things. What does it feel like? Taste like? Are most guys into it? Is it considered common courtesy before topping a guy? Do you actually probe the hole with your tongue or just sort of work around the edges?&lt;/p&gt;

&lt;p&gt;Just wanted to hear from you gaybros who have done it / do it on a regular basis.&lt;/p&gt;
&lt;/div&gt;&lt;!-- SC_ON --&gt;","False","askgaybros","t5_2vgfw","","","I'm VERY curious about rimming . . .","18","http://www.reddit.com/r/askgaybros/comments/2sdffv/im_very_curious_about_rimming/","[]","False"
"12","","","{}","http://www.reddit.com/api/info/","{}","{}","False","","","False","mrmotey01","","","","False","1421211433.0","1421211433.0","","self.askgaybros","0","1421755550.0","0","True","False","2sdawn","True","","","","","","{}","[]","t3_2sdawn","19","","False","http://www.reddit.com/r/askgaybros/comments/2sdawn/i_have_a_crush_with_friends_brother/","Unauthenticated reddit sesssion","","False","20","","{}","Hello Bros! So i currently have a crush -kinda obsession- with a friend's brother. 

He is younger than me and i don't see him that much. Also i don't have idea if he is is gay-bi or no.  I used to chat with him a little in PS4 but we stoped playing  so i have no way to talk to him. How can i befriend him? Is it weird to just talk to him over facebook? Do i just fuck everything and get to the point to telling him that i want to hang out with him? 

His brother knows that i'm gay so any personal approach could be akward. LOL.

UPDATE: i talked to him a little bit over facebook chat. Normal stuff, i told him that if he goes to our school gym and he told me that he wants to but doesn't have anyone to drive him back home so i kinda volunteer to do so ( so obvious )  i have hopes that he will go jaja. Then we talked about videogames but wasn't really a long talk. What can i do to keep talking to him without looking creepy? How often? ","&lt;!-- SC_OFF --&gt;&lt;div class=""md""&gt;&lt;p&gt;Hello Bros! So i currently have a crush -kinda obsession- with a friend&amp;#39;s brother. &lt;/p&gt;

&lt;p&gt;He is younger than me and i don&amp;#39;t see him that much. Also i don&amp;#39;t have idea if he is is gay-bi or no.  I used to chat with him a little in PS4 but we stoped playing  so i have no way to talk to him. How can i befriend him? Is it weird to just talk to him over facebook? Do i just fuck everything and get to the point to telling him that i want to hang out with him? &lt;/p&gt;

&lt;p&gt;His brother knows that i&amp;#39;m gay so any personal approach could be akward. LOL.&lt;/p&gt;

&lt;p&gt;UPDATE: i talked to him a little bit over facebook chat. Normal stuff, i told him that if he goes to our school gym and he told me that he wants to but doesn&amp;#39;t have anyone to drive him back home so i kinda volunteer to do so ( so obvious )  i have hopes that he will go jaja. Then we talked about videogames but wasn&amp;#39;t really a long talk. What can i do to keep talking to him without looking creepy? How often? &lt;/p&gt;
&lt;/div&gt;&lt;!-- SC_ON --&gt;","False","askgaybros","t5_2vgfw","","","I have a crush with friend's brother.","20","http://www.reddit.com/r/askgaybros/comments/2sdawn/i_have_a_crush_with_friends_brother/","[]","False"
"13","","","{}","http://www.reddit.com/api/info/","{}","{}","False","","","False","cool_story_bro12","","","","False","1421211067.0","1421211067.0","","self.askgaybros","0","False","0","True","False","2sda9y","True","","","","","","{}","[]","t3_2sda9y","13","","False","http://www.reddit.com/r/askgaybros/comments/2sda9y/guy_im_talking_to_is_really_into_asians_and_that/","Unauthenticated reddit sesssion","","False","2","","{}","I started talking to this one guy and we seemed to like each other enough to continue texting and all that. However, the moment he said he was really into Asians and referring to me as a ""little Asian guy"" the conversation started to get a bit offputting. I want to give this guy a chance and I think he's attractive but I don't know how to feel about what he said. I know it doesn't have to be a problem if it's not something that gets out of control and as long as it's not some kind of fetish, I guess I just don't want to sexualized and put into some kind of box. I hate that I have to think about this sometimes since I feel like any other dude who likes dudes. ","&lt;!-- SC_OFF --&gt;&lt;div class=""md""&gt;&lt;p&gt;I started talking to this one guy and we seemed to like each other enough to continue texting and all that. However, the moment he said he was really into Asians and referring to me as a &amp;quot;little Asian guy&amp;quot; the conversation started to get a bit offputting. I want to give this guy a chance and I think he&amp;#39;s attractive but I don&amp;#39;t know how to feel about what he said. I know it doesn&amp;#39;t have to be a problem if it&amp;#39;s not something that gets out of control and as long as it&amp;#39;s not some kind of fetish, I guess I just don&amp;#39;t want to sexualized and put into some kind of box. I hate that I have to think about this sometimes since I feel like any other dude who likes dudes. &lt;/p&gt;
&lt;/div&gt;&lt;!-- SC_ON --&gt;","False","askgaybros","t5_2vgfw","","","Guy I'm Talking to is really into Asians and that makes me feel weird.","2","http://www.reddit.com/r/askgaybros/comments/2sda9y/guy_im_talking_to_is_really_into_asians_and_that/","[]","False"
"14","","","{}","http://www.reddit.com/api/info/","{}","{}","False","","","False","Galvantulord","","","","False","1421208550.0","1421208550.0","","self.askgaybros","0","False","0","True","False","2sd5ju","True","","","","","","{}","[]","t3_2sd5ju","21","","False","http://www.reddit.com/r/askgaybros/comments/2sd5ju/honest_to_god_would_you_want_to_date_a_guy_who/","Unauthenticated reddit sesssion","","False","17","","{}","I'm 18 (turning 19 tomorrow) and for a while, I've been talking to a 28 year old I met on Grindr a while back. We met for the first time yesterday, and he completely charmed my pants off, both literally and figuratively. Like, I seriously dig this guy, and it seems he digs me, too. Problem is I'm not out, and I live in a small Hispanic household where there is very little concept of privacy, so when he implies or makes a op passing comment about how he'd like to talk to me over the phone or over voice messages, this huge hole forms in my chest because no matter how much I'd like to, my surroundings make it difficult. This also crosses over into going out or hanging out with him; I've never really had any friends or gone out at all during high school, so it's not like I can tell my family that I'm talking to or hanging out with a friend, and even if I did, they're very nosy so they wouldn't let it slide with such a simple explanation.

It's kinda starting to affect my self esteem when it comes to getting to know guys, because it makes me feel like no guy is gonna wanna put up with me like that, so it makes me feel like there's no point in pursuing guys at all.","&lt;!-- SC_OFF --&gt;&lt;div class=""md""&gt;&lt;p&gt;I&amp;#39;m 18 (turning 19 tomorrow) and for a while, I&amp;#39;ve been talking to a 28 year old I met on Grindr a while back. We met for the first time yesterday, and he completely charmed my pants off, both literally and figuratively. Like, I seriously dig this guy, and it seems he digs me, too. Problem is I&amp;#39;m not out, and I live in a small Hispanic household where there is very little concept of privacy, so when he implies or makes a op passing comment about how he&amp;#39;d like to talk to me over the phone or over voice messages, this huge hole forms in my chest because no matter how much I&amp;#39;d like to, my surroundings make it difficult. This also crosses over into going out or hanging out with him; I&amp;#39;ve never really had any friends or gone out at all during high school, so it&amp;#39;s not like I can tell my family that I&amp;#39;m talking to or hanging out with a friend, and even if I did, they&amp;#39;re very nosy so they wouldn&amp;#39;t let it slide with such a simple explanation.&lt;/p&gt;

&lt;p&gt;It&amp;#39;s kinda starting to affect my self esteem when it comes to getting to know guys, because it makes me feel like no guy is gonna wanna put up with me like that, so it makes me feel like there&amp;#39;s no point in pursuing guys at all.&lt;/p&gt;
&lt;/div&gt;&lt;!-- SC_ON --&gt;","False","askgaybros","t5_2vgfw","","","Honest to god, would you want to date a guy who can't talk to you on the phone or send voice messages and has to go behind his family's back to just go out with you?","17","http://www.reddit.com/r/askgaybros/comments/2sd5ju/honest_to_god_would_you_want_to_date_a_guy_who/","[]","False"
"15","","","{}","http://www.reddit.com/api/info/","{}","{}","False","","","False","Notasoutherner","","","","False","1421206147.0","1421206147.0","","self.askgaybros","0","False","0","True","False","2sd0rf","True","","","","","","{}","[]","t3_2sd0rf","58","","False","http://www.reddit.com/r/askgaybros/comments/2sd0rf/from_a_sociological_perspective_i_would_like_to/","Unauthenticated reddit sesssion","","False","24","","{}","How did the mainstream flamboyant stereotype of gay men effect you then and now. ","&lt;!-- SC_OFF --&gt;&lt;div class=""md""&gt;&lt;p&gt;How did the mainstream flamboyant stereotype of gay men effect you then and now. &lt;/p&gt;
&lt;/div&gt;&lt;!-- SC_ON --&gt;","False","askgaybros","t5_2vgfw","","","From a sociological perspective: I would like to hear from stereotypically ""straight"" gay men and how the stereotype of gay men effected them early in life.","24","http://www.reddit.com/r/askgaybros/comments/2sd0rf/from_a_sociological_perspective_i_would_like_to/","[]","False"
"16","","","{}","http://www.reddit.com/api/info/","{}","{}","False","","","False","throwmeaway_cle","","","","False","1421205229.0","1421205229.0","","self.askgaybros","0","False","0","True","False","2scyxk","True","","","","","","{}","[]","t3_2scyxk","11","","False","http://www.reddit.com/r/askgaybros/comments/2scyxk/i_have_an_opportunity_to_experiment_should_i_do_it/","Unauthenticated reddit sesssion","","False","15","","{}","I've been bi-curious for a while now. I have been texting with a guy I met online and he's invited me to come over. He knows I've never done anything like this before and he's been understanding. We discussed boundaries and he knows I really just want to try getting blown. I'm really nervous, but I know that if I don't go out there and try it at least once, I'm going to regret it. Any advice? Should I go and do this so I know?","&lt;!-- SC_OFF --&gt;&lt;div class=""md""&gt;&lt;p&gt;I&amp;#39;ve been bi-curious for a while now. I have been texting with a guy I met online and he&amp;#39;s invited me to come over. He knows I&amp;#39;ve never done anything like this before and he&amp;#39;s been understanding. We discussed boundaries and he knows I really just want to try getting blown. I&amp;#39;m really nervous, but I know that if I don&amp;#39;t go out there and try it at least once, I&amp;#39;m going to regret it. Any advice? Should I go and do this so I know?&lt;/p&gt;
&lt;/div&gt;&lt;!-- SC_ON --&gt;","False","askgaybros","t5_2vgfw","","","I have an opportunity to experiment. Should I do it?","15","http://www.reddit.com/r/askgaybros/comments/2scyxk/i_have_an_opportunity_to_experiment_should_i_do_it/","[]","False"
"17","","","{}","http://www.reddit.com/api/info/","{}","{}","False","","","False","potpocket","","","","False","1421204372.0","1421204372.0","","self.askgaybros","0","False","0","True","False","2scx7b","True","","","","","","{}","[]","t3_2scx7b","6","","False","http://www.reddit.com/r/askgaybros/comments/2scx7b/how_many_of_you_have_dealt_with_porn_addiction/","Unauthenticated reddit sesssion","","False","5","","{}","I am right now and it's incredibly challenging and embarrassing. :(","&lt;!-- SC_OFF --&gt;&lt;div class=""md""&gt;&lt;p&gt;I am right now and it&amp;#39;s incredibly challenging and embarrassing. :(&lt;/p&gt;
&lt;/div&gt;&lt;!-- SC_ON --&gt;","False","askgaybros","t5_2vgfw","","","How many of you have dealt with porn addiction?","5","http://www.reddit.com/r/askgaybros/comments/2scx7b/how_many_of_you_have_dealt_with_porn_addiction/","[]","False"
"18","","","{}","http://www.reddit.com/api/info/","{}","{}","False","","","False","ObviousTrojan","","","","False","1421203625.0","1421203625.0","","self.askgaybros","0","False","0","True","False","2scvok","True","","","","","","{}","[]","t3_2scvok","232","","False","http://www.reddit.com/r/askgaybros/comments/2scvok/what_cars_do_you_gaybros_drive/","Unauthenticated reddit sesssion","","False","16","","{}","I'm sure this has been asked in the past, but I'm curious to know whether gaybros take pride in their cars or whether they're just a form of transport. 

I have a red WRX. I wouldn't say I'm a car guy anymore, but I definitely know about cars and I know what to/what not to drive. ","&lt;!-- SC_OFF --&gt;&lt;div class=""md""&gt;&lt;p&gt;I&amp;#39;m sure this has been asked in the past, but I&amp;#39;m curious to know whether gaybros take pride in their cars or whether they&amp;#39;re just a form of transport. &lt;/p&gt;

&lt;p&gt;I have a red WRX. I wouldn&amp;#39;t say I&amp;#39;m a car guy anymore, but I definitely know about cars and I know what to/what not to drive. &lt;/p&gt;
&lt;/div&gt;&lt;!-- SC_ON --&gt;","False","askgaybros","t5_2vgfw","","","What cars do you gaybros drive?","16","http://www.reddit.com/r/askgaybros/comments/2scvok/what_cars_do_you_gaybros_drive/","[]","False"
"19","","","{}","http://www.reddit.com/api/info/","{}","{}","False","","","False","askgbthrowawayy","","","","False","1421201781.0","1421201781.0","","self.askgaybros","0","1421202676.0","0","True","False","2scrya","True","","","","","","{}","[]","t3_2scrya","10","","False","http://www.reddit.com/r/askgaybros/comments/2scrya/new_to_situation_feedback_wanted/","Unauthenticated reddit sesssion","","False","5","","{}","Hi – first time poster and need someone’s object take on the situation.

So after Christmas I started talking to this guy from OKC, lets call him Jake.  Jake is five years younger and is cute, charming and someone I could see myself in a relationship with.

Since messaging Jake on OKC, we’ve been messaging each other daily (quite a lot actually), then started talking on the phone almost every night since.  We agreed to meet up for a quick bite a week ago and clicked; I don’t think I’ve felt this comfortable with someone before.  It sounds like a cliché and is probably my wishful thinking of the new situation, but I feel like I’ve known him in forever.

Jake thought we clicked as well and said he’d like to see me again, to which I agreed to.  The problem is the distance between us; its a three hour drive.  In any case, we both have said we would make the effort so Jake is planning on driving down my area for a few nights.

At first I was on board and did not really hesitate until a friend of mine put things into perspective and said it that it was weird to have Jake stay with me for a few days after just one date.  I thought the same and shared this with Jake and said he is happy to go on another date before spending that much time with me at mine.  Do you think I’m rushing this?

I should point out, I’m rather new to this despite being 29 years old.  I’ve never been in a relationship and have not done anything with a guy (yes I’m a pathetic loser).  We did talk about sex and he said he’s happy to cuddle and take things slow; and that we didn’t have to have sex.  Jake was very upfront about this.  Now, I did not tell him I’m very new to this but have said I’m inexperienced.  Do you think I should tell him I’ve not done anything at all with a guy in terms of sex?

On another note, I have body image issues and don’t have the biggest dick.  I don’t know if this is a deal breaker but should I be upfront about it?  I was circumcised as a child and I think there is some residual foreskin there that I’m really self conscious about. :S

Any input or feedback is greatly appreciated.

TL;DR – met guy from OKC, planning on him spending a few nights over at mine.  New to guys and relationships.  Should I be upfront and honest?
","&lt;!-- SC_OFF --&gt;&lt;div class=""md""&gt;&lt;p&gt;Hi – first time poster and need someone’s object take on the situation.&lt;/p&gt;

&lt;p&gt;So after Christmas I started talking to this guy from OKC, lets call him Jake.  Jake is five years younger and is cute, charming and someone I could see myself in a relationship with.&lt;/p&gt;

&lt;p&gt;Since messaging Jake on OKC, we’ve been messaging each other daily (quite a lot actually), then started talking on the phone almost every night since.  We agreed to meet up for a quick bite a week ago and clicked; I don’t think I’ve felt this comfortable with someone before.  It sounds like a cliché and is probably my wishful thinking of the new situation, but I feel like I’ve known him in forever.&lt;/p&gt;

&lt;p&gt;Jake thought we clicked as well and said he’d like to see me again, to which I agreed to.  The problem is the distance between us; its a three hour drive.  In any case, we both have said we would make the effort so Jake is planning on driving down my area for a few nights.&lt;/p&gt;

&lt;p&gt;At first I was on board and did not really hesitate until a friend of mine put things into perspective and said it that it was weird to have Jake stay with me for a few days after just one date.  I thought the same and shared this with Jake and said he is happy to go on another date before spending that much time with me at mine.  Do you think I’m rushing this?&lt;/p&gt;

&lt;p&gt;I should point out, I’m rather new to this despite being 29 years old.  I’ve never been in a relationship and have not done anything with a guy (yes I’m a pathetic loser).  We did talk about sex and he said he’s happy to cuddle and take things slow; and that we didn’t have to have sex.  Jake was very upfront about this.  Now, I did not tell him I’m very new to this but have said I’m inexperienced.  Do you think I should tell him I’ve not done anything at all with a guy in terms of sex?&lt;/p&gt;

&lt;p&gt;On another note, I have body image issues and don’t have the biggest dick.  I don’t know if this is a deal breaker but should I be upfront about it?  I was circumcised as a child and I think there is some residual foreskin there that I’m really self conscious about. :S&lt;/p&gt;

&lt;p&gt;Any input or feedback is greatly appreciated.&lt;/p&gt;

&lt;p&gt;TL;DR – met guy from OKC, planning on him spending a few nights over at mine.  New to guys and relationships.  Should I be upfront and honest?&lt;/p&gt;
&lt;/div&gt;&lt;!-- SC_ON --&gt;","False","askgaybros","t5_2vgfw","","","new to situation.. feedback wanted..","5","http://www.reddit.com/r/askgaybros/comments/2scrya/new_to_situation_feedback_wanted/","[]","False"
"20","","","{}","http://www.reddit.com/api/info/","{}","{}","False","","","False","throwmeaway_alex","","","","False","1421198816.0","1421198816.0","","self.askgaybros","0","False","0","True","False","2sclr1","True","","","","","","{}","[]","t3_2sclr1","24","","False","http://www.reddit.com/r/askgaybros/comments/2sclr1/bro_fetish/","Unauthenticated reddit sesssion","","False","18","","{}","Hi Guys,

This guy I'm seeing has told me he always has had a fetish for roleplaying brothers with another guy. Now while I'm open and willing to give this a shot, I was the only child and have no idea how the 'little bro' should act..

Ideas?","&lt;!-- SC_OFF --&gt;&lt;div class=""md""&gt;&lt;p&gt;Hi Guys,&lt;/p&gt;

&lt;p&gt;This guy I&amp;#39;m seeing has told me he always has had a fetish for roleplaying brothers with another guy. Now while I&amp;#39;m open and willing to give this a shot, I was the only child and have no idea how the &amp;#39;little bro&amp;#39; should act..&lt;/p&gt;

&lt;p&gt;Ideas?&lt;/p&gt;
&lt;/div&gt;&lt;!-- SC_ON --&gt;","False","askgaybros","t5_2vgfw","","","Bro Fetish","18","http://www.reddit.com/r/askgaybros/comments/2sclr1/bro_fetish/","[]","False"
