"","_comment_sort","_comments","_comments_by_id","_info_url","_orphaned","_params","_replaced_more","_underscore_names","approved_by","archived","author","author_flair_css_class","author_flair_text","banned_by","clicked","created","created_utc","distinguished","domain","downs","edited","gilded","has_fetched","hidden","id","is_self","json_dict","likes","link_flair_css_class","link_flair_text","media","media_embed","mod_reports","name","num_comments","num_reports","over_18","permalink","reddit_session","report_reasons","saved","score","secure_media","secure_media_embed","selftext","selftext_html","stickied","subreddit","subreddit_id","suggested_sort","thumbnail","title","ups","url","user_reports","visited"
"23","","","{}","http://www.reddit.com/api/info/","{}","{}","False","","","False","KinkyAndLove","","","","False","1416789398.0","1416789398.0","","self.askgaybros","0","1416789636.0","0","True","False","2n7r1o","True","","","","","","{}","[]","t3_2n7r1o","12","","False","http://www.reddit.com/r/askgaybros/comments/2n7r1o/how_do_you_find_a_relationship_with_someone/","Unauthenticated reddit sesssion","","False","4","","{}","Lately I've been majorly torn about whether I want to find a boyfriend or a sexual partner. I have active profiles on both OKCupid and Fetlife. Ideally... I want someone who's into both, but I don't have the slightest idea how to find that. 

Every relationship I've been in, the sex has been very tame. I hesitate to say vanilla, because there has been some light bondage play, and some sexual torture things... But I have a DEEPLY submissive side. A really hot sexual scene for me is where the guy I'm with sexually humiliates and degrades me, subjecting me to things that a less horny me would think is repulsive. I like being with guys that expect to have control, and expect to be recognized as basically a god. I can find that on fetlife. 

But I also want just normal sex sometimes. I want cuddling, conversations, love... Equity in relationship dynamics. This is easy to find on OKC, but most prospects balk at kink that goes beyond edging.

Are any of you, or have any of you ever been in a situation like this? Where maybe every other/every third/fourth/whateverth sex session is really really kinky... but outside of that it was a mostly ""normal"" romantic relationship? How do you find this?

I'm just starting to feel anxious. I feel like right now, I have to either log into fetlife and constantly remind myself not to fall for the guys I talk to/play with... or I have to log into OKC and constantly remind myself that love matters more than sex, and bad sex with a partner I care about will be better than amazing sex with a stranger, ect. 

Quite frankly, I want both. Or something resembling both, at least a bit....

**TL;DR: How do I find someone that wants to cuddle with me for hours, just chatting and being adorable, and then tie me up, blindfold me, gag me with his dirty boxers and fuck me relentlessly with his foot pressing down on my cheek?**
","&lt;!-- SC_OFF --&gt;&lt;div class=""md""&gt;&lt;p&gt;Lately I&amp;#39;ve been majorly torn about whether I want to find a boyfriend or a sexual partner. I have active profiles on both OKCupid and Fetlife. Ideally... I want someone who&amp;#39;s into both, but I don&amp;#39;t have the slightest idea how to find that. &lt;/p&gt;

&lt;p&gt;Every relationship I&amp;#39;ve been in, the sex has been very tame. I hesitate to say vanilla, because there has been some light bondage play, and some sexual torture things... But I have a DEEPLY submissive side. A really hot sexual scene for me is where the guy I&amp;#39;m with sexually humiliates and degrades me, subjecting me to things that a less horny me would think is repulsive. I like being with guys that expect to have control, and expect to be recognized as basically a god. I can find that on fetlife. &lt;/p&gt;

&lt;p&gt;But I also want just normal sex sometimes. I want cuddling, conversations, love... Equity in relationship dynamics. This is easy to find on OKC, but most prospects balk at kink that goes beyond edging.&lt;/p&gt;

&lt;p&gt;Are any of you, or have any of you ever been in a situation like this? Where maybe every other/every third/fourth/whateverth sex session is really really kinky... but outside of that it was a mostly &amp;quot;normal&amp;quot; romantic relationship? How do you find this?&lt;/p&gt;

&lt;p&gt;I&amp;#39;m just starting to feel anxious. I feel like right now, I have to either log into fetlife and constantly remind myself not to fall for the guys I talk to/play with... or I have to log into OKC and constantly remind myself that love matters more than sex, and bad sex with a partner I care about will be better than amazing sex with a stranger, ect. &lt;/p&gt;

&lt;p&gt;Quite frankly, I want both. Or something resembling both, at least a bit....&lt;/p&gt;

&lt;p&gt;&lt;strong&gt;TL;DR: How do I find someone that wants to cuddle with me for hours, just chatting and being adorable, and then tie me up, blindfold me, gag me with his dirty boxers and fuck me relentlessly with his foot pressing down on my cheek?&lt;/strong&gt;&lt;/p&gt;
&lt;/div&gt;&lt;!-- SC_ON --&gt;","False","askgaybros","t5_2vgfw","","","How do you find a relationship with someone majorly into kinkplay?","4","http://www.reddit.com/r/askgaybros/comments/2n7r1o/how_do_you_find_a_relationship_with_someone/","[]","False"
"24","","","{}","http://www.reddit.com/api/info/","{}","{}","False","","","False","DAMNITTHREWAWAY","","","","False","1416787031.0","1416787031.0","","self.askgaybros","0","False","0","True","False","2n7mne","True","","","","","","{}","[]","t3_2n7mne","44","","False","http://www.reddit.com/r/askgaybros/comments/2n7mne/i_am_a_15_year_old_sex_worker_who_lives_in_turkey/","Unauthenticated reddit sesssion","","False","14","","{}","","","False","askgaybros","t5_2vgfw","","","I am a 15 year old sex worker who lives in turkey. Ask me anything you wish.","14","http://www.reddit.com/r/askgaybros/comments/2n7mne/i_am_a_15_year_old_sex_worker_who_lives_in_turkey/","[]","False"
"25","","","{}","http://www.reddit.com/api/info/","{}","{}","False","","","False","FurryNavel","","","","False","1416786359.0","1416786359.0","","self.askgaybros","0","False","0","True","False","2n7leq","True","","","","","","{}","[]","t3_2n7leq","20","","False","http://www.reddit.com/r/askgaybros/comments/2n7leq/does_gay_sex_make_you_gay/","Unauthenticated reddit sesssion","","False","1","","{}","So I am having a discussion at work with my coworkers and the topic is: does gay sex make you gay?

I personally think that it doesn't. Being gay means you are sexually attracted to the same sex. You don't have to be attracted to someone to have sex with them. I could have sex with a women, but that doesn't make me straight. 

My coworkers don't seem to agree with me. Give me your thoughts. ","&lt;!-- SC_OFF --&gt;&lt;div class=""md""&gt;&lt;p&gt;So I am having a discussion at work with my coworkers and the topic is: does gay sex make you gay?&lt;/p&gt;

&lt;p&gt;I personally think that it doesn&amp;#39;t. Being gay means you are sexually attracted to the same sex. You don&amp;#39;t have to be attracted to someone to have sex with them. I could have sex with a women, but that doesn&amp;#39;t make me straight. &lt;/p&gt;

&lt;p&gt;My coworkers don&amp;#39;t seem to agree with me. Give me your thoughts. &lt;/p&gt;
&lt;/div&gt;&lt;!-- SC_ON --&gt;","False","askgaybros","t5_2vgfw","","","Does gay sex make you gay?","1","http://www.reddit.com/r/askgaybros/comments/2n7leq/does_gay_sex_make_you_gay/","[]","False"
"26","","","{}","http://www.reddit.com/api/info/","{}","{}","False","","","False","basicspace_","","","","False","1416782678.0","1416782678.0","","self.askgaybros","0","False","0","True","False","2n7etu","True","","","","","","{}","[]","t3_2n7etu","8","","False","http://www.reddit.com/r/askgaybros/comments/2n7etu/questions_about_hpv/","Unauthenticated reddit sesssion","","False","6","","{}","Okay going to try to make a long story short. The guy Ive been with for about 4 months found some spots on his butt that looked abnormal. He started panicking and looked to the internet (always a bad choice) and began to deduce that it was HPV. After checking with a doctor they said it is indeed HPV.

Now I'm not looking for a lecture about not wearing condoms or being reckless. We both have had blood work done before dating and it said we were clear however there is no test for HPV in men so that just wasn't an option. He plans to see the doctor again to see what he needs to do and then a dermatologist to remove the warts

Here's my questions:

After the removal of the warts how long should we abstain from anal sex?

Is oral still an option?

Can I still receive as long as he wears protection?

What are the chances of warts coming back?

Is there anything I can do in the way of clearing or preventing the virus from further problems?

There are probably more questions I'm forgetting but I'm looking for any information from someone who has knoweldge on the virus or has had an experience before. Thanks again guys. ","&lt;!-- SC_OFF --&gt;&lt;div class=""md""&gt;&lt;p&gt;Okay going to try to make a long story short. The guy Ive been with for about 4 months found some spots on his butt that looked abnormal. He started panicking and looked to the internet (always a bad choice) and began to deduce that it was HPV. After checking with a doctor they said it is indeed HPV.&lt;/p&gt;

&lt;p&gt;Now I&amp;#39;m not looking for a lecture about not wearing condoms or being reckless. We both have had blood work done before dating and it said we were clear however there is no test for HPV in men so that just wasn&amp;#39;t an option. He plans to see the doctor again to see what he needs to do and then a dermatologist to remove the warts&lt;/p&gt;

&lt;p&gt;Here&amp;#39;s my questions:&lt;/p&gt;

&lt;p&gt;After the removal of the warts how long should we abstain from anal sex?&lt;/p&gt;

&lt;p&gt;Is oral still an option?&lt;/p&gt;

&lt;p&gt;Can I still receive as long as he wears protection?&lt;/p&gt;

&lt;p&gt;What are the chances of warts coming back?&lt;/p&gt;

&lt;p&gt;Is there anything I can do in the way of clearing or preventing the virus from further problems?&lt;/p&gt;

&lt;p&gt;There are probably more questions I&amp;#39;m forgetting but I&amp;#39;m looking for any information from someone who has knoweldge on the virus or has had an experience before. Thanks again guys. &lt;/p&gt;
&lt;/div&gt;&lt;!-- SC_ON --&gt;","False","askgaybros","t5_2vgfw","","","Questions about HPV","6","http://www.reddit.com/r/askgaybros/comments/2n7etu/questions_about_hpv/","[]","False"
"27","","","{}","http://www.reddit.com/api/info/","{}","{}","False","","","False","jjs30","","","","False","1416781928.0","1416781928.0","","self.askgaybros","0","False","0","True","False","2n7dki","True","","","","","","{}","[]","t3_2n7dki","18","","False","http://www.reddit.com/r/askgaybros/comments/2n7dki/what_are_you_getting_your_boyfriendpartner_or/","Unauthenticated reddit sesssion","","False","8","","{}","My boyfriend has very specific tastes, but I'm starting to know what he likes as gifts. We went to Europe this year for vacation and a couple of ideas stuck out, and I'm kicking myself for not buying this stuff there (who would've thought in this day and age I can't just order anything to be shipped internationally).
So far on my list I have: Bernard beer (from Czech Republic, if anyone knows how I can get this in Canada that would be great), coffee (taking recommendations on good coffee beans) and a scarf we saw in Germany at a store called Peek &amp; Cloppenburg (which I also can't ship to Canada as far as I can tell).","&lt;!-- SC_OFF --&gt;&lt;div class=""md""&gt;&lt;p&gt;My boyfriend has very specific tastes, but I&amp;#39;m starting to know what he likes as gifts. We went to Europe this year for vacation and a couple of ideas stuck out, and I&amp;#39;m kicking myself for not buying this stuff there (who would&amp;#39;ve thought in this day and age I can&amp;#39;t just order anything to be shipped internationally).
So far on my list I have: Bernard beer (from Czech Republic, if anyone knows how I can get this in Canada that would be great), coffee (taking recommendations on good coffee beans) and a scarf we saw in Germany at a store called Peek &amp;amp; Cloppenburg (which I also can&amp;#39;t ship to Canada as far as I can tell).&lt;/p&gt;
&lt;/div&gt;&lt;!-- SC_ON --&gt;","False","askgaybros","t5_2vgfw","","","What are you getting your boyfriend/partner or close guy friends for Christmas this year?","8","http://www.reddit.com/r/askgaybros/comments/2n7dki/what_are_you_getting_your_boyfriendpartner_or/","[]","False"
"28","","","{}","http://www.reddit.com/api/info/","{}","{}","False","","","False","FlowersOfSodom","","","","False","1416780471.0","1416780471.0","","self.askgaybros","0","False","0","True","False","2n7b2c","True","","","","","","{}","[]","t3_2n7b2c","9","","True","http://www.reddit.com/r/askgaybros/comments/2n7b2c/straight_friend_might_be_bicurious_nsfw_language/","Unauthenticated reddit sesssion","","False","0","","{}","I know I've asked this on Gaybros a while back but didn't get many responses. A friend of mine that I've known since high school gives, I guess you could say, signs, that he might be bicurious. He jokes about hooking up with me from time to time; asked if I was single after I came out to him and announced he was single, too; and will say things like, ""Craving a blow job, but my girl's passed out in the other room."" or will tell me he's horny or jacking off whenever I ask him ""What's up?"" from time to time. Maybe I'm reading too much into it because I've had a crush on him since we met in high school, but there might be possibly something going on there? Ever had a similar experience?","&lt;!-- SC_OFF --&gt;&lt;div class=""md""&gt;&lt;p&gt;I know I&amp;#39;ve asked this on Gaybros a while back but didn&amp;#39;t get many responses. A friend of mine that I&amp;#39;ve known since high school gives, I guess you could say, signs, that he might be bicurious. He jokes about hooking up with me from time to time; asked if I was single after I came out to him and announced he was single, too; and will say things like, &amp;quot;Craving a blow job, but my girl&amp;#39;s passed out in the other room.&amp;quot; or will tell me he&amp;#39;s horny or jacking off whenever I ask him &amp;quot;What&amp;#39;s up?&amp;quot; from time to time. Maybe I&amp;#39;m reading too much into it because I&amp;#39;ve had a crush on him since we met in high school, but there might be possibly something going on there? Ever had a similar experience?&lt;/p&gt;
&lt;/div&gt;&lt;!-- SC_ON --&gt;","False","askgaybros","t5_2vgfw","","","Straight friend might be bicurious? NSFW language","0","http://www.reddit.com/r/askgaybros/comments/2n7b2c/straight_friend_might_be_bicurious_nsfw_language/","[]","False"
"29","","","{}","http://www.reddit.com/api/info/","{}","{}","False","","","False","Throwaway8523690","","","","False","1416780118.0","1416780118.0","","self.askgaybros","0","1416781217.0","0","True","False","2n7afy","True","","","","","","{}","[]","t3_2n7afy","3","","False","http://www.reddit.com/r/askgaybros/comments/2n7afy/wanting_to_change_knowing_i_did_wrong_need_advice/","Unauthenticated reddit sesssion","","False","4","","{}","First of all I had dated my boyfriend about a year and a half both 21, starting in august of last year. We got along very well from the start, clicked almost instantly, were able to talk about anything and just listen to each other. Over that Christmas break I went home and got on grindr to see if any old friends were on there, and one was and asked me to come over to one of his parties, I went and ended up getting date raped. I had deleted grindr by then and it was too late for the police to do anything. I had filed a report but they were never able to do anything about it. I was given anti-anxiety meds to deal with things but i never really stuck to them. Over the past year things have been a very slippery slope for me and just stress along with everything has kept me on the brink of losing it a lot. My boyfriend was always there for me but I was afraid to talk about a lot of stuff or just didnt want to. This continued for awhile, we talked but we didnt talk about a lot of stuff as well. We are both somewhat introverts. I struggled and continue to struggle with the post rape. I had started getting on grindr to make myself feel better, getting compliments from guys saying I was cute or just talking to them. I never wanted to hook up. I struggled downloading and uninstalling grindr for a long time. I ended up meeting up with an old friend at one point and stuff happened and I couldnt tell him no. My boyfriend found out and nearly broke things off but decided not to and give me another chance. I started therapy and taking my pills again but that didnt last long. This past couple weeks he had seen my phone, I had fallen back into the grindr addiction. I had recently been extremely struggling paying off a card that had been racking up since last year, going up and down constantly. I felt trapped with no way out. I had gotten on grindr and a guy said he would help out and all he wanted to do was suck me off and jack himself off. I told him that would be it because I didnt want any penetration or kissing. my boyfriend had seen me on grindr and that morning got on my phone and went through and saw the messages and found out. He then broke up with me and I have been devastated. I had been so lost in everything that I was not able to think or anything. Things finally hit me after the breakup and ive actually been able to think about everything that I have done...I dont know why I could just not tell people no. I should have been able to. My ex now and I never really fought, we got along very well. I just really want to change. I know people say cheaters are always a cheater but I do not want that. I lost something I feel I cannot lose right now. I know this is all my fault and It is eating me alive. I have gotten back on my medications and am starting therapy again and plan on sticking to it no matter what this time. I am taking measures to make it happen. I dont know if he thinks I can change or not, I just wish he could see the better side of me. We have decided to stay friends for now, I just wish there could be more. I am not sure that it will ever happen. I know I don't deserve any type of chance from him now. If any time it would be after I fix the problems with myself. We currently live together and are the same major so we have the same schedule for the next 2 years essentially.

Just needing some advice, stories, experience or whatever people have to offer. I know I did terrible things but I have been really messed up since the rape and never fixed these things. They got out of control. I dont need people harassing me. I just need some help from fellow bros.","&lt;!-- SC_OFF --&gt;&lt;div class=""md""&gt;&lt;p&gt;First of all I had dated my boyfriend about a year and a half both 21, starting in august of last year. We got along very well from the start, clicked almost instantly, were able to talk about anything and just listen to each other. Over that Christmas break I went home and got on grindr to see if any old friends were on there, and one was and asked me to come over to one of his parties, I went and ended up getting date raped. I had deleted grindr by then and it was too late for the police to do anything. I had filed a report but they were never able to do anything about it. I was given anti-anxiety meds to deal with things but i never really stuck to them. Over the past year things have been a very slippery slope for me and just stress along with everything has kept me on the brink of losing it a lot. My boyfriend was always there for me but I was afraid to talk about a lot of stuff or just didnt want to. This continued for awhile, we talked but we didnt talk about a lot of stuff as well. We are both somewhat introverts. I struggled and continue to struggle with the post rape. I had started getting on grindr to make myself feel better, getting compliments from guys saying I was cute or just talking to them. I never wanted to hook up. I struggled downloading and uninstalling grindr for a long time. I ended up meeting up with an old friend at one point and stuff happened and I couldnt tell him no. My boyfriend found out and nearly broke things off but decided not to and give me another chance. I started therapy and taking my pills again but that didnt last long. This past couple weeks he had seen my phone, I had fallen back into the grindr addiction. I had recently been extremely struggling paying off a card that had been racking up since last year, going up and down constantly. I felt trapped with no way out. I had gotten on grindr and a guy said he would help out and all he wanted to do was suck me off and jack himself off. I told him that would be it because I didnt want any penetration or kissing. my boyfriend had seen me on grindr and that morning got on my phone and went through and saw the messages and found out. He then broke up with me and I have been devastated. I had been so lost in everything that I was not able to think or anything. Things finally hit me after the breakup and ive actually been able to think about everything that I have done...I dont know why I could just not tell people no. I should have been able to. My ex now and I never really fought, we got along very well. I just really want to change. I know people say cheaters are always a cheater but I do not want that. I lost something I feel I cannot lose right now. I know this is all my fault and It is eating me alive. I have gotten back on my medications and am starting therapy again and plan on sticking to it no matter what this time. I am taking measures to make it happen. I dont know if he thinks I can change or not, I just wish he could see the better side of me. We have decided to stay friends for now, I just wish there could be more. I am not sure that it will ever happen. I know I don&amp;#39;t deserve any type of chance from him now. If any time it would be after I fix the problems with myself. We currently live together and are the same major so we have the same schedule for the next 2 years essentially.&lt;/p&gt;

&lt;p&gt;Just needing some advice, stories, experience or whatever people have to offer. I know I did terrible things but I have been really messed up since the rape and never fixed these things. They got out of control. I dont need people harassing me. I just need some help from fellow bros.&lt;/p&gt;
&lt;/div&gt;&lt;!-- SC_ON --&gt;","False","askgaybros","t5_2vgfw","","","Wanting to Change, knowing I did wrong. Need advice.","4","http://www.reddit.com/r/askgaybros/comments/2n7afy/wanting_to_change_knowing_i_did_wrong_need_advice/","[]","False"
"30","","","{}","http://www.reddit.com/api/info/","{}","{}","False","","","False","ruhigbitte","","","","False","1416778010.0","1416778010.0","","self.askgaybros","0","1416783715.0","0","True","False","2n76qg","True","","","","","","{}","[]","t3_2n76qg","9","","False","http://www.reddit.com/r/askgaybros/comments/2n76qg/i_cant_seem_to_get_this_thought_out_of_my_head/","Unauthenticated reddit sesssion","","False","3","","{}","I went on a date Friday night and I went to my friends house afterwards.  I showed him a picture of the guy I went out with and he said that the guy is too gay for me.  What should I do?

Edit: Thanks guys.  No he isn't someone I would normally go after, but we had a really good time on our date this weekend.","&lt;!-- SC_OFF --&gt;&lt;div class=""md""&gt;&lt;p&gt;I went on a date Friday night and I went to my friends house afterwards.  I showed him a picture of the guy I went out with and he said that the guy is too gay for me.  What should I do?&lt;/p&gt;

&lt;p&gt;Edit: Thanks guys.  No he isn&amp;#39;t someone I would normally go after, but we had a really good time on our date this weekend.&lt;/p&gt;
&lt;/div&gt;&lt;!-- SC_ON --&gt;","False","askgaybros","t5_2vgfw","","","I can't seem to get this thought out of my head.","3","http://www.reddit.com/r/askgaybros/comments/2n76qg/i_cant_seem_to_get_this_thought_out_of_my_head/","[]","False"
