"","_comment_sort","_comments","_comments_by_id","_info_url","_orphaned","_params","_replaced_more","_underscore_names","approved_by","archived","author","author_flair_css_class","author_flair_text","banned_by","clicked","created","created_utc","distinguished","domain","downs","edited","gilded","has_fetched","hidden","id","is_self","json_dict","likes","link_flair_css_class","link_flair_text","media","media_embed","mod_reports","name","num_comments","num_reports","over_18","permalink","reddit_session","report_reasons","saved","score","secure_media","secure_media_embed","selftext","selftext_html","stickied","subreddit","subreddit_id","suggested_sort","thumbnail","title","ups","url","user_reports","visited"
"0","","","{}","http://www.reddit.com/api/info/","{}","{}","False","","","False","lilcalthecman","","","","False","1422373291.0","1422373291.0","","self.askgaybros","0","False","0","True","False","2tuk2g","True","","","","","","{}","[]","t3_2tuk2g","42","","False","http://www.reddit.com/r/askgaybros/comments/2tuk2g/whats_a_good_way_to_prevent_myself_from_ever/","Unauthenticated reddit sesssion","","False","0","","{}","So after having had gay sex a few times I've decided I didn't like it and that gay stuff as a whole is too dangerous (homophobia, AIDS, etc). I already had very little gay sex to begin with, like once a year, but now I've decided to cut out all homo stuff out of my life save for porn. Now I can't access porn 24/7 so what's a good way to fight back the urges? ","&lt;!-- SC_OFF --&gt;&lt;div class=""md""&gt;&lt;p&gt;So after having had gay sex a few times I&amp;#39;ve decided I didn&amp;#39;t like it and that gay stuff as a whole is too dangerous (homophobia, AIDS, etc). I already had very little gay sex to begin with, like once a year, but now I&amp;#39;ve decided to cut out all homo stuff out of my life save for porn. Now I can&amp;#39;t access porn 24/7 so what&amp;#39;s a good way to fight back the urges? &lt;/p&gt;
&lt;/div&gt;&lt;!-- SC_ON --&gt;","False","askgaybros","t5_2vgfw","","","What's a good way to prevent myself from ever having gay sex?","0","http://www.reddit.com/r/askgaybros/comments/2tuk2g/whats_a_good_way_to_prevent_myself_from_ever/","[]","False"
"1","","","{}","http://www.reddit.com/api/info/","{}","{}","False","","","False","DrMisterSir","","","","False","1422369105.0","1422369105.0","","self.askgaybros","0","False","0","True","False","2tuc1o","True","","","","","","{}","[]","t3_2tuc1o","11","","False","http://www.reddit.com/r/askgaybros/comments/2tuc1o/is_anal_always_this_good/","Unauthenticated reddit sesssion","","False","13","","{}","I just started using dildos two days ago because I've always been curious. I bought a set of three (S, M, L) and since the first time the small 'popped' in I have been in quivering ecstasy every time I use them, even without touching my dick. 

Partly I just wanted to share with someone how mindblowing this is, but I also wanted to know; Is this normal? Will the extreme pleasure fade as I get used to anal?","&lt;!-- SC_OFF --&gt;&lt;div class=""md""&gt;&lt;p&gt;I just started using dildos two days ago because I&amp;#39;ve always been curious. I bought a set of three (S, M, L) and since the first time the small &amp;#39;popped&amp;#39; in I have been in quivering ecstasy every time I use them, even without touching my dick. &lt;/p&gt;

&lt;p&gt;Partly I just wanted to share with someone how mindblowing this is, but I also wanted to know; Is this normal? Will the extreme pleasure fade as I get used to anal?&lt;/p&gt;
&lt;/div&gt;&lt;!-- SC_ON --&gt;","False","askgaybros","t5_2vgfw","","","Is Anal always this good?","13","http://www.reddit.com/r/askgaybros/comments/2tuc1o/is_anal_always_this_good/","[]","False"
"2","","","{}","http://www.reddit.com/api/info/","{}","{}","False","","","False","RealHumanHere","","","","False","1422368026.0","1422368026.0","","self.askgaybros","0","False","0","True","False","2tuaad","True","","","","","","{}","[]","t3_2tuaad","16","","False","http://www.reddit.com/r/askgaybros/comments/2tuaad/does_truvada_actually_work_to_prevent_getting_hiv/","Unauthenticated reddit sesssion","","False","2","","{}","","","False","askgaybros","t5_2vgfw","","","Does Truvada actually work to prevent getting HIV? Is it safe healthwise?","2","http://www.reddit.com/r/askgaybros/comments/2tuaad/does_truvada_actually_work_to_prevent_getting_hiv/","[]","False"
"3","","","{}","http://www.reddit.com/api/info/","{}","{}","False","","","False","roboguy12","","","","False","1422364921.0","1422364921.0","","self.askgaybros","0","False","0","True","False","2tu5nd","True","","","","","","{}","[]","t3_2tu5nd","44","","False","http://www.reddit.com/r/askgaybros/comments/2tu5nd/can_gay_sex_be_spontaneous/","Unauthenticated reddit sesssion","","False","35","","{}","I apologize for any ignorance with this question, it's just something that occurred to me this morning. Actually, please point out and correct any ignorance. So here's the question:

When my fiancée and I have sex, usually there's a turnaround time from initial contact (making out, feeling up, etc) to penis-in-vagina of under 5 minutes or so. It's happened in under a minute before, when we've been really horny. The natural lubrication of her vagina usually makes the additional lube on the condom unnecessary. But, whenever we've had anal sex, there's usually a fair amount of preparation that goes into it. For example, we won't do it if she feels like she has to poop or if she hasn't done it in like the past hour or so (we don't want any accidental messes). We usually use a good amount of lube and even after that, it's pretty slow going because I don't want her to get hurt.

So then I started wondering how spontaneous gay sex can be. Given that you only have that one penetrative option and it takes so much foresight and preparation to do it properly, can you ever go from sitting on the couch straight to sex, or is there some kind of delay? How do you handle that delay, if you have one? Or do you consider ""sex"" to be all-encompassing, meaning anal, oral, and (for lack of a better term) jacking each other off? I'm curious.","&lt;!-- SC_OFF --&gt;&lt;div class=""md""&gt;&lt;p&gt;I apologize for any ignorance with this question, it&amp;#39;s just something that occurred to me this morning. Actually, please point out and correct any ignorance. So here&amp;#39;s the question:&lt;/p&gt;

&lt;p&gt;When my fiancée and I have sex, usually there&amp;#39;s a turnaround time from initial contact (making out, feeling up, etc) to penis-in-vagina of under 5 minutes or so. It&amp;#39;s happened in under a minute before, when we&amp;#39;ve been really horny. The natural lubrication of her vagina usually makes the additional lube on the condom unnecessary. But, whenever we&amp;#39;ve had anal sex, there&amp;#39;s usually a fair amount of preparation that goes into it. For example, we won&amp;#39;t do it if she feels like she has to poop or if she hasn&amp;#39;t done it in like the past hour or so (we don&amp;#39;t want any accidental messes). We usually use a good amount of lube and even after that, it&amp;#39;s pretty slow going because I don&amp;#39;t want her to get hurt.&lt;/p&gt;

&lt;p&gt;So then I started wondering how spontaneous gay sex can be. Given that you only have that one penetrative option and it takes so much foresight and preparation to do it properly, can you ever go from sitting on the couch straight to sex, or is there some kind of delay? How do you handle that delay, if you have one? Or do you consider &amp;quot;sex&amp;quot; to be all-encompassing, meaning anal, oral, and (for lack of a better term) jacking each other off? I&amp;#39;m curious.&lt;/p&gt;
&lt;/div&gt;&lt;!-- SC_ON --&gt;","False","askgaybros","t5_2vgfw","","","Can gay sex be spontaneous?","35","http://www.reddit.com/r/askgaybros/comments/2tu5nd/can_gay_sex_be_spontaneous/","[]","False"
"4","","","{}","http://www.reddit.com/api/info/","{}","{}","False","","","False","donut-comment","","","","False","1422354306.0","1422354306.0","","self.askgaybros","0","False","0","True","False","2tttss","True","","","","","","{}","[]","t3_2tttss","13","","False","http://www.reddit.com/r/askgaybros/comments/2tttss/i_can_only_get_off_to_lesbian_porn_but_find_it/","Unauthenticated reddit sesssion","","False","0","","{}","I'm gay but I can't get off to gay porn and my mind gets off on stuff that normally grosses me out (girls). Anyone experience this? ","&lt;!-- SC_OFF --&gt;&lt;div class=""md""&gt;&lt;p&gt;I&amp;#39;m gay but I can&amp;#39;t get off to gay porn and my mind gets off on stuff that normally grosses me out (girls). Anyone experience this? &lt;/p&gt;
&lt;/div&gt;&lt;!-- SC_ON --&gt;","False","askgaybros","t5_2vgfw","","","I can only get off to lesbian porn but find it disgusting when I'm not horny.","0","http://www.reddit.com/r/askgaybros/comments/2tttss/i_can_only_get_off_to_lesbian_porn_but_find_it/","[]","False"
"5","","","{}","http://www.reddit.com/api/info/","{}","{}","False","","","False","eneka","","","","False","1422351886.0","1422351886.0","","self.askgaybros","0","False","0","True","False","2ttr9t","True","","","","","","{}","[]","t3_2ttr9t","2","","False","http://www.reddit.com/r/askgaybros/comments/2ttr9t/i_keep_thinking_about_him/","Unauthenticated reddit sesssion","","False","4","","{}","So I've been with my current boyfriend for about 6 months, we've been talking for over a year now and everything is going great, he is seriously the best boyfriend I have ever hand.

So I split up with my ex about 2 years ago. For some reason though, I keep thinking about him, but not in ways like ""I miss him"" or anything like that, It's more like ""Fuck I'm so glad things are over""....It's like little things too, I was in class looking at my eraser and it just reminded me the time when he was bitching about my god damn eraser. It's just weird because I just want to forget about him and not ever think about our past but little things keep reminding me of the shit I had to put up with him. Do I have some built up hatred or something inside of me? Or is it cause I got so emotionally damaged I don't think it was ""fair"" for him to move on so easily after I broke things off with him. I've actually posted here before when I was still with him describing our relationship and how I felt, and one of the top comments was ""the dude is a controlling manipulative piece of shit."" if that says anything about him heh. How do I ""move on"" from this? ","&lt;!-- SC_OFF --&gt;&lt;div class=""md""&gt;&lt;p&gt;So I&amp;#39;ve been with my current boyfriend for about 6 months, we&amp;#39;ve been talking for over a year now and everything is going great, he is seriously the best boyfriend I have ever hand.&lt;/p&gt;

&lt;p&gt;So I split up with my ex about 2 years ago. For some reason though, I keep thinking about him, but not in ways like &amp;quot;I miss him&amp;quot; or anything like that, It&amp;#39;s more like &amp;quot;Fuck I&amp;#39;m so glad things are over&amp;quot;....It&amp;#39;s like little things too, I was in class looking at my eraser and it just reminded me the time when he was bitching about my god damn eraser. It&amp;#39;s just weird because I just want to forget about him and not ever think about our past but little things keep reminding me of the shit I had to put up with him. Do I have some built up hatred or something inside of me? Or is it cause I got so emotionally damaged I don&amp;#39;t think it was &amp;quot;fair&amp;quot; for him to move on so easily after I broke things off with him. I&amp;#39;ve actually posted here before when I was still with him describing our relationship and how I felt, and one of the top comments was &amp;quot;the dude is a controlling manipulative piece of shit.&amp;quot; if that says anything about him heh. How do I &amp;quot;move on&amp;quot; from this? &lt;/p&gt;
&lt;/div&gt;&lt;!-- SC_ON --&gt;","False","askgaybros","t5_2vgfw","","","I keep thinking about him..","4","http://www.reddit.com/r/askgaybros/comments/2ttr9t/i_keep_thinking_about_him/","[]","False"
"6","","","{}","http://www.reddit.com/api/info/","{}","{}","False","","","False","that429writer","","","","False","1422346205.0","1422346205.0","","self.askgaybros","0","1422411177.0","0","True","False","2ttlg1","True","","","","","","{}","[]","t3_2ttlg1","32","","True","http://www.reddit.com/r/askgaybros/comments/2ttlg1/do_any_other_gaybros_have_a_thing_for_bald_guys/","Unauthenticated reddit sesssion","","False","26","","{}","I was watching a razor commercial and this guy was waiting in the lobby with other guys for a job interview. He notices the past presidents of the company are bald so he shaves his beard and his head. I immediately got an insta-boner. This isn't the first commercial I've seen where the guy shaves his head and every time, without fail, my friend downstairs gets real excited. So, what's your stance on bald guys? 

EDIT: I found it!! I also found a few of my other favorites while searching for it! Top one is the one I described in my question. Enjoy! 

http://youtu.be/sFP7kCZbUkI

http://youtu.be/z2-YRuzaAP0

http://youtu.be/ZeLHX1qHuJI

http://youtu.be/0MGqtJAv8BI



","&lt;!-- SC_OFF --&gt;&lt;div class=""md""&gt;&lt;p&gt;I was watching a razor commercial and this guy was waiting in the lobby with other guys for a job interview. He notices the past presidents of the company are bald so he shaves his beard and his head. I immediately got an insta-boner. This isn&amp;#39;t the first commercial I&amp;#39;ve seen where the guy shaves his head and every time, without fail, my friend downstairs gets real excited. So, what&amp;#39;s your stance on bald guys? &lt;/p&gt;

&lt;p&gt;EDIT: I found it!! I also found a few of my other favorites while searching for it! Top one is the one I described in my question. Enjoy! &lt;/p&gt;

&lt;p&gt;&lt;a href=""http://youtu.be/sFP7kCZbUkI""&gt;http://youtu.be/sFP7kCZbUkI&lt;/a&gt;&lt;/p&gt;

&lt;p&gt;&lt;a href=""http://youtu.be/z2-YRuzaAP0""&gt;http://youtu.be/z2-YRuzaAP0&lt;/a&gt;&lt;/p&gt;

&lt;p&gt;&lt;a href=""http://youtu.be/ZeLHX1qHuJI""&gt;http://youtu.be/ZeLHX1qHuJI&lt;/a&gt;&lt;/p&gt;

&lt;p&gt;&lt;a href=""http://youtu.be/0MGqtJAv8BI""&gt;http://youtu.be/0MGqtJAv8BI&lt;/a&gt;&lt;/p&gt;
&lt;/div&gt;&lt;!-- SC_ON --&gt;","False","askgaybros","t5_2vgfw","","","Do any other gaybros have a thing for bald guys? NSFW (ish)","26","http://www.reddit.com/r/askgaybros/comments/2ttlg1/do_any_other_gaybros_have_a_thing_for_bald_guys/","[]","False"
"7","","","{}","http://www.reddit.com/api/info/","{}","{}","False","","","False","ThrownLYH","","","","False","1422340721.0","1422340721.0","","self.askgaybros","0","False","0","True","False","2ttefe","True","","","","","","{}","[]","t3_2ttefe","21","","False","http://www.reddit.com/r/askgaybros/comments/2ttefe/sexually_assaulted_last_year_hemorrhoid_wont_quit/","Unauthenticated reddit sesssion","","False","1","","{}","Hey Gaybros,

My boss came at me last year and since then I've been through a heck of a lot of pain healing from hemorrhoids. I've made it past the blinding pain but for nearly two months now I've had this one small, persistent external hemorrhoid that just wont go away.

 I've been using prep h which can be embarrassing because it gets on my pants in an obvious way but nothing. Last night I tried to get a vibrator part way in there which was tricky but seemed to relax things and so I've done that three times now. I noticed just before the third time though that I might have inflammation on the internal aspect of the hemorrhoid since its kind of puffy on the outside. This didn't cause me any pain but that spot is tender to press. I'm writing from the tub.

Any help would be greatly appreciated.","&lt;!-- SC_OFF --&gt;&lt;div class=""md""&gt;&lt;p&gt;Hey Gaybros,&lt;/p&gt;

&lt;p&gt;My boss came at me last year and since then I&amp;#39;ve been through a heck of a lot of pain healing from hemorrhoids. I&amp;#39;ve made it past the blinding pain but for nearly two months now I&amp;#39;ve had this one small, persistent external hemorrhoid that just wont go away.&lt;/p&gt;

&lt;p&gt;I&amp;#39;ve been using prep h which can be embarrassing because it gets on my pants in an obvious way but nothing. Last night I tried to get a vibrator part way in there which was tricky but seemed to relax things and so I&amp;#39;ve done that three times now. I noticed just before the third time though that I might have inflammation on the internal aspect of the hemorrhoid since its kind of puffy on the outside. This didn&amp;#39;t cause me any pain but that spot is tender to press. I&amp;#39;m writing from the tub.&lt;/p&gt;

&lt;p&gt;Any help would be greatly appreciated.&lt;/p&gt;
&lt;/div&gt;&lt;!-- SC_ON --&gt;","False","askgaybros","t5_2vgfw","","","Sexually assaulted last year, hemorrhoid won't quit","1","http://www.reddit.com/r/askgaybros/comments/2ttefe/sexually_assaulted_last_year_hemorrhoid_wont_quit/","[]","False"
"8","","","{}","http://www.reddit.com/api/info/","{}","{}","False","","","False","boss_tic","","","","False","1422340661.0","1422340661.0","","self.askgaybros","0","False","0","True","False","2ttebv","True","","","","","","{}","[]","t3_2ttebv","1","","False","http://www.reddit.com/r/askgaybros/comments/2ttebv/i_need_help_with_opinions_of_gay_bars_in_tulsa_ok/","Unauthenticated reddit sesssion","","False","2","","{}","Title explains it all. I want to know what the best gay bars are for a 22 year old guy! If any of you bros are familiar with them let me know!","&lt;!-- SC_OFF --&gt;&lt;div class=""md""&gt;&lt;p&gt;Title explains it all. I want to know what the best gay bars are for a 22 year old guy! If any of you bros are familiar with them let me know!&lt;/p&gt;
&lt;/div&gt;&lt;!-- SC_ON --&gt;","False","askgaybros","t5_2vgfw","","","I need help with opinions of gay bars in Tulsa, OK!","2","http://www.reddit.com/r/askgaybros/comments/2ttebv/i_need_help_with_opinions_of_gay_bars_in_tulsa_ok/","[]","False"
"9","","","{}","http://www.reddit.com/api/info/","{}","{}","False","","","False","jampayne","","","","False","1422339529.0","1422339529.0","","i.imgur.com","0","False","0","True","False","2ttco0","False","","","","","","{}","[]","t3_2ttco0","65","","False","http://www.reddit.com/r/askgaybros/comments/2ttco0/i_feel_unattractive_im_the_heaviest_i_have_ever/","Unauthenticated reddit sesssion","","False","18","","{}","","","False","askgaybros","t5_2vgfw","","","I feel unattractive. I'm the heaviest I have ever been. Any tips besides cardio?","18","http://i.imgur.com/bHBxUeQ.jpg","[]","False"
"10","","","{}","http://www.reddit.com/api/info/","{}","{}","False","","","False","ddarry","","","","False","1422339062.0","1422339062.0","","self.askgaybros","0","False","0","True","False","2ttbzj","True","","","","","","{}","[]","t3_2ttbzj","7","","False","http://www.reddit.com/r/askgaybros/comments/2ttbzj/how_do_i_stay_close_friends_with_straight_guys/","Unauthenticated reddit sesssion","","False","2","","{}","i'm a teen, and i feel like although i have close friendships with straight guys, small things they do like ignoring me to talk to other guys gets to me alot, how do i stop it(stop thinking it/ask them to stop ignoring me)? ","&lt;!-- SC_OFF --&gt;&lt;div class=""md""&gt;&lt;p&gt;i&amp;#39;m a teen, and i feel like although i have close friendships with straight guys, small things they do like ignoring me to talk to other guys gets to me alot, how do i stop it(stop thinking it/ask them to stop ignoring me)? &lt;/p&gt;
&lt;/div&gt;&lt;!-- SC_ON --&gt;","False","askgaybros","t5_2vgfw","","","how do i stay close friends with straight guys?","2","http://www.reddit.com/r/askgaybros/comments/2ttbzj/how_do_i_stay_close_friends_with_straight_guys/","[]","False"
"11","","","{}","http://www.reddit.com/api/info/","{}","{}","False","","","False","timeforathrowaway121","","","","False","1422338494.0","1422338494.0","","self.askgaybros","0","False","0","True","False","2ttb29","True","","","","","","{}","[]","t3_2ttb29","11","","False","http://www.reddit.com/r/askgaybros/comments/2ttb29/is_it_appropriate_to_come_out_through_a_text/","Unauthenticated reddit sesssion","","False","4","","{}","I, a sixteen year old guy, have reached the point where I'm finally comfortable with my sexuality. I've been fine with myself for a few months now, and feel confident enough to start telling a few people. 

I sporadically came out to a close girl friend last week who said nothings different, yada yada yada. So now I want to tell a good buddy of mine. I'd prefer to do it over text with him because we *very* rarely have any time alone together, and also because I'm really not sure how he'll take it. 

Is it inappropriate to do this over text? Should I avoid making a habit of it?    ","&lt;!-- SC_OFF --&gt;&lt;div class=""md""&gt;&lt;p&gt;I, a sixteen year old guy, have reached the point where I&amp;#39;m finally comfortable with my sexuality. I&amp;#39;ve been fine with myself for a few months now, and feel confident enough to start telling a few people. &lt;/p&gt;

&lt;p&gt;I sporadically came out to a close girl friend last week who said nothings different, yada yada yada. So now I want to tell a good buddy of mine. I&amp;#39;d prefer to do it over text with him because we &lt;em&gt;very&lt;/em&gt; rarely have any time alone together, and also because I&amp;#39;m really not sure how he&amp;#39;ll take it. &lt;/p&gt;

&lt;p&gt;Is it inappropriate to do this over text? Should I avoid making a habit of it?    &lt;/p&gt;
&lt;/div&gt;&lt;!-- SC_ON --&gt;","False","askgaybros","t5_2vgfw","","","Is it appropriate to come out through a text message?","4","http://www.reddit.com/r/askgaybros/comments/2ttb29/is_it_appropriate_to_come_out_through_a_text/","[]","False"
"12","","","{}","http://www.reddit.com/api/info/","{}","{}","False","","","False","LeytonForest","","","","False","1422338461.0","1422338461.0","","self.askgaybros","0","False","0","True","False","2ttb0d","True","","","","","","{}","[]","t3_2ttb0d","11","","False","http://www.reddit.com/r/askgaybros/comments/2ttb0d/guys_falling_off_the_face_of_the_earth/","Unauthenticated reddit sesssion","","False","8","","{}","Hey guys! 
           Over the past few months I have spent time on Tinder and OkCupid. I find that I will hit it off with someone exchange numbers, facebooks etc. We will text a lot for a week, make plans to meet soon and then they go MIA! I'll text them here and there but don't want to come across as obnoxious. I feel like I am always texting them first! Shouldn't it be a two way thing? Perhaps because the guys I talk to are all in college they find they don't actually have time for dating? I don't know! It's sucky because its hurtful but definitely a learning experience! Perhaps I get attached too quickly! I'm new to the dating scene and stuff! Any advice would be much appreciated! ","&lt;!-- SC_OFF --&gt;&lt;div class=""md""&gt;&lt;p&gt;Hey guys! 
           Over the past few months I have spent time on Tinder and OkCupid. I find that I will hit it off with someone exchange numbers, facebooks etc. We will text a lot for a week, make plans to meet soon and then they go MIA! I&amp;#39;ll text them here and there but don&amp;#39;t want to come across as obnoxious. I feel like I am always texting them first! Shouldn&amp;#39;t it be a two way thing? Perhaps because the guys I talk to are all in college they find they don&amp;#39;t actually have time for dating? I don&amp;#39;t know! It&amp;#39;s sucky because its hurtful but definitely a learning experience! Perhaps I get attached too quickly! I&amp;#39;m new to the dating scene and stuff! Any advice would be much appreciated! &lt;/p&gt;
&lt;/div&gt;&lt;!-- SC_ON --&gt;","False","askgaybros","t5_2vgfw","","","Guys falling off the face of the earth?","8","http://www.reddit.com/r/askgaybros/comments/2ttb0d/guys_falling_off_the_face_of_the_earth/","[]","False"
"13","","","{}","http://www.reddit.com/api/info/","{}","{}","False","","","False","woofwoof3","","","","False","1422336555.0","1422336555.0","","self.askgaybros","0","False","0","True","False","2tt7tr","True","","","","","","{}","[]","t3_2tt7tr","7","","False","http://www.reddit.com/r/askgaybros/comments/2tt7tr/does_anyone_else_feel_this_way/","Unauthenticated reddit sesssion","","False","1","","{}","Hi guys. Do any of you feel like you don't have any real interests? I open my computer and the only things I can think of doing are checking my email, porn and facebook. ","&lt;!-- SC_OFF --&gt;&lt;div class=""md""&gt;&lt;p&gt;Hi guys. Do any of you feel like you don&amp;#39;t have any real interests? I open my computer and the only things I can think of doing are checking my email, porn and facebook. &lt;/p&gt;
&lt;/div&gt;&lt;!-- SC_ON --&gt;","False","askgaybros","t5_2vgfw","","","does anyone else feel this way?","1","http://www.reddit.com/r/askgaybros/comments/2tt7tr/does_anyone_else_feel_this_way/","[]","False"
