"","_comment_sort","_comments","_comments_by_id","_info_url","_orphaned","_params","_replaced_more","_underscore_names","approved_by","archived","author","author_flair_css_class","author_flair_text","banned_by","clicked","created","created_utc","distinguished","domain","downs","edited","gilded","has_fetched","hidden","id","is_self","json_dict","likes","link_flair_css_class","link_flair_text","media","media_embed","mod_reports","name","num_comments","num_reports","over_18","permalink","reddit_session","report_reasons","saved","score","secure_media","secure_media_embed","selftext","selftext_html","stickied","subreddit","subreddit_id","suggested_sort","thumbnail","title","ups","url","user_reports","visited"
"11","","","{}","http://www.reddit.com/api/info/","{}","{}","False","","","False","throwaway_5461","","","","False","1426316697.0","1426313097.0","","self.askgaybros","0","False","0","True","False","2yzv8w","True","","","","","","{}","[]","t3_2yzv8w","3","","False","http://www.reddit.com/r/askgaybros/comments/2yzv8w/uh_oh_i_think_fucked_up_update/","Unauthenticated reddit sesssion","","False","2","","{}","For those that don't know: http://www.reddit.com/r/askgaybros/comments/284e8u/uh_oh_i_think_i_fucked_up/

Update: I decided to pursue that the guy (discretely) and see where it could go. We had a purely physical relationship for a couple months and I experimented alot. i'm a bottom only and we tried anal but it didn't work.

Since then I haven't had anything with anyone for a few months... it sucks.","&lt;!-- SC_OFF --&gt;&lt;div class=""md""&gt;&lt;p&gt;For those that don&amp;#39;t know: &lt;a href=""http://www.reddit.com/r/askgaybros/comments/284e8u/uh_oh_i_think_i_fucked_up/""&gt;http://www.reddit.com/r/askgaybros/comments/284e8u/uh_oh_i_think_i_fucked_up/&lt;/a&gt;&lt;/p&gt;

&lt;p&gt;Update: I decided to pursue that the guy (discretely) and see where it could go. We had a purely physical relationship for a couple months and I experimented alot. i&amp;#39;m a bottom only and we tried anal but it didn&amp;#39;t work.&lt;/p&gt;

&lt;p&gt;Since then I haven&amp;#39;t had anything with anyone for a few months... it sucks.&lt;/p&gt;
&lt;/div&gt;&lt;!-- SC_ON --&gt;","False","askgaybros","t5_2vgfw","","","""Uh oh I think fucked up"" UPDATE","2","http://www.reddit.com/r/askgaybros/comments/2yzv8w/uh_oh_i_think_fucked_up_update/","[]","False"
"12","","","{}","http://www.reddit.com/api/info/","{}","{}","False","","","False","imposiblea","","","","False","1426313403.0","1426309803.0","","self.askgaybros","0","False","0","True","False","2yzqy9","True","","","","","","{}","[]","t3_2yzqy9","19","","False","http://www.reddit.com/r/askgaybros/comments/2yzqy9/is_it_possible_to_turn_back_into_a_twink_if_youve/","Unauthenticated reddit sesssion","","False","7","","{}","if you work out for a long time and become pretty buff, would it be possible to turn back to twink if you stop working out? or would all that muscle turn into fat? ","&lt;!-- SC_OFF --&gt;&lt;div class=""md""&gt;&lt;p&gt;if you work out for a long time and become pretty buff, would it be possible to turn back to twink if you stop working out? or would all that muscle turn into fat? &lt;/p&gt;
&lt;/div&gt;&lt;!-- SC_ON --&gt;","False","askgaybros","t5_2vgfw","","","is it possible to turn back into a twink if you've worked out for a long time?","7","http://www.reddit.com/r/askgaybros/comments/2yzqy9/is_it_possible_to_turn_back_into_a_twink_if_youve/","[]","False"
"13","","","{}","http://www.reddit.com/api/info/","{}","{}","False","","","False","PraEur","","","","False","1426312897.0","1426309297.0","","self.askgaybros","0","False","0","True","False","2yzq8g","True","","","","","","{}","[]","t3_2yzq8g","28","","False","http://www.reddit.com/r/askgaybros/comments/2yzq8g/are_young_guys_actually_into_me/","Unauthenticated reddit sesssion","","False","1","","{}","Even if I'm in my early 30s, only recently I manned up and started looking for dates with guys.

I started to notice that not only guys around my age are interested in me, but also young American ones (I’m European). Since I take care of my body, I was quite pleased by this interest and, honestly, I started fantasizing about sex with these guys.

What I started to notice is, however, that the discussion topics were quite limited: what is your job, where you live, do you have a PS4/gaming PC, etc...
Initially I assumed that simply they didn't know what to ask to an older foreign guy, hence the standard questions. However, a college student yesterday asked if he can move in with me since he can barely afford housing.

Life in this part of the US is quite cheap and my discretionary income is, consequently, not low. This means that I can afford fairly expensive stuff (e.g. I have a 911), even if I'm not an NBA player. So, I'm starting to think that these guys are interested in me only because I appear wealthy.

How should interpret this interest? Am I just a stupid gullible guy?
","&lt;!-- SC_OFF --&gt;&lt;div class=""md""&gt;&lt;p&gt;Even if I&amp;#39;m in my early 30s, only recently I manned up and started looking for dates with guys.&lt;/p&gt;

&lt;p&gt;I started to notice that not only guys around my age are interested in me, but also young American ones (I’m European). Since I take care of my body, I was quite pleased by this interest and, honestly, I started fantasizing about sex with these guys.&lt;/p&gt;

&lt;p&gt;What I started to notice is, however, that the discussion topics were quite limited: what is your job, where you live, do you have a PS4/gaming PC, etc...
Initially I assumed that simply they didn&amp;#39;t know what to ask to an older foreign guy, hence the standard questions. However, a college student yesterday asked if he can move in with me since he can barely afford housing.&lt;/p&gt;

&lt;p&gt;Life in this part of the US is quite cheap and my discretionary income is, consequently, not low. This means that I can afford fairly expensive stuff (e.g. I have a 911), even if I&amp;#39;m not an NBA player. So, I&amp;#39;m starting to think that these guys are interested in me only because I appear wealthy.&lt;/p&gt;

&lt;p&gt;How should interpret this interest? Am I just a stupid gullible guy?&lt;/p&gt;
&lt;/div&gt;&lt;!-- SC_ON --&gt;","False","askgaybros","t5_2vgfw","","","Are young guys actually into me?","1","http://www.reddit.com/r/askgaybros/comments/2yzq8g/are_young_guys_actually_into_me/","[]","False"
"14","","","{}","http://www.reddit.com/api/info/","{}","{}","False","","","False","ipegasus88","","","","False","1426312247.0","1426308647.0","","self.askgaybros","0","False","0","True","False","2yzpc0","True","","","","","","{}","[]","t3_2yzpc0","6","","False","http://www.reddit.com/r/askgaybros/comments/2yzpc0/the_guy_at_work/","Unauthenticated reddit sesssion","","False","0","","{}","I am new to this blogging thing so I hope I can get some answers.

So I've worked at this company for about 5 years and being that is so big I have met and worked with many different people and gotten close to certain people. Now with this most recent change I have gotten to know some more people within the company. I've kind of understood the ideal of keeping work and pleasure separate. So I've recently met this guy (we shall call him Sam). I have known of Sam but never really interacted with him. Now that we are on a new team for this new project we are working on I have gotten to know Sam. Sam is gay and is very attractive. I have come to realize that Sam is also involved with someone and it is serious. Like this is the drumroll to marriage. Sam, myself and a couple other people on our team have started hanging out and I feel like I sort of belong so it will be sad when this project ends. Sam has gotten really playful and me being me I play along its harmless fun right. Others have picked up on it and implied that he maybe flirting with me. Then I realize that I have a thing for this guy, when he happened to take a mini-vacation and he comes back and the ecstatic emotion when I see Sam's face. I feel really stupid for feeling this way, especially since he is with someone else. To me I am the only one the has feelings which is fine, but other people think the feeling is mutual. With what they have seen and relaying to me I am starting to think the same as well. Am I reading too much into this? 

Thanks,
The guy feeling like Patrick from ""Looking""","&lt;!-- SC_OFF --&gt;&lt;div class=""md""&gt;&lt;p&gt;I am new to this blogging thing so I hope I can get some answers.&lt;/p&gt;

&lt;p&gt;So I&amp;#39;ve worked at this company for about 5 years and being that is so big I have met and worked with many different people and gotten close to certain people. Now with this most recent change I have gotten to know some more people within the company. I&amp;#39;ve kind of understood the ideal of keeping work and pleasure separate. So I&amp;#39;ve recently met this guy (we shall call him Sam). I have known of Sam but never really interacted with him. Now that we are on a new team for this new project we are working on I have gotten to know Sam. Sam is gay and is very attractive. I have come to realize that Sam is also involved with someone and it is serious. Like this is the drumroll to marriage. Sam, myself and a couple other people on our team have started hanging out and I feel like I sort of belong so it will be sad when this project ends. Sam has gotten really playful and me being me I play along its harmless fun right. Others have picked up on it and implied that he maybe flirting with me. Then I realize that I have a thing for this guy, when he happened to take a mini-vacation and he comes back and the ecstatic emotion when I see Sam&amp;#39;s face. I feel really stupid for feeling this way, especially since he is with someone else. To me I am the only one the has feelings which is fine, but other people think the feeling is mutual. With what they have seen and relaying to me I am starting to think the same as well. Am I reading too much into this? &lt;/p&gt;

&lt;p&gt;Thanks,
The guy feeling like Patrick from &amp;quot;Looking&amp;quot;&lt;/p&gt;
&lt;/div&gt;&lt;!-- SC_ON --&gt;","False","askgaybros","t5_2vgfw","","","The guy at work!","0","http://www.reddit.com/r/askgaybros/comments/2yzpc0/the_guy_at_work/","[]","False"
"15","","","{}","http://www.reddit.com/api/info/","{}","{}","False","","","False","ricocosco","","","","False","1426304947.0","1426301347.0","","self.askgaybros","0","False","0","True","False","2yzdbd","True","","","","","","{}","[]","t3_2yzdbd","16","","False","http://www.reddit.com/r/askgaybros/comments/2yzdbd/am_i_gay/","Unauthenticated reddit sesssion","","False","0","","{}","Every day at P.E. my class changes clothes and gets down to our underwear. There's two guys that I am sexually attracted to, for their 2 parts and their bodies. I even think that they are cute, but I know I am not gay. It's weird because it's only those two guys that I am attracted too, no one else. I do not want to be gay. Any way to change my sexuality? And yes, I have kissed 3 girls when I was younger. I have had 0 sexual/romantic relations with guys. Every day I day-dream thinking about having sex with them, and all of those dirty things. Neither of them have come out and said they are gay. It's an all boys school, so there's not even a single person I know that is gay there. One of the two has a girlfriend, but anyone can have a girlfriend and be gay. Please help me!","&lt;!-- SC_OFF --&gt;&lt;div class=""md""&gt;&lt;p&gt;Every day at P.E. my class changes clothes and gets down to our underwear. There&amp;#39;s two guys that I am sexually attracted to, for their 2 parts and their bodies. I even think that they are cute, but I know I am not gay. It&amp;#39;s weird because it&amp;#39;s only those two guys that I am attracted too, no one else. I do not want to be gay. Any way to change my sexuality? And yes, I have kissed 3 girls when I was younger. I have had 0 sexual/romantic relations with guys. Every day I day-dream thinking about having sex with them, and all of those dirty things. Neither of them have come out and said they are gay. It&amp;#39;s an all boys school, so there&amp;#39;s not even a single person I know that is gay there. One of the two has a girlfriend, but anyone can have a girlfriend and be gay. Please help me!&lt;/p&gt;
&lt;/div&gt;&lt;!-- SC_ON --&gt;","False","askgaybros","t5_2vgfw","","","Am I gay?","0","http://www.reddit.com/r/askgaybros/comments/2yzdbd/am_i_gay/","[]","False"
"16","","","{}","http://www.reddit.com/api/info/","{}","{}","False","","","False","Kinkydating","","","","False","1426302674.0","1426299074.0","","self.askgaybros","0","False","0","True","False","2yz9fi","True","","","","","","{}","[]","t3_2yz9fi","9","","False","http://www.reddit.com/r/askgaybros/comments/2yz9fi/chasing_dates_away_because_im_kinky_help/","Unauthenticated reddit sesssion","","False","5","","{}","I'm 24 and have been running into a problem while dating and being kinky... I'll have no problem going on a few dates with a guy, but without fail, when more sexual topics come up... They back out. I'm fairly kinky.. Fairly submissive. I like to be dominated... Humiliated a bit. Nothing too extreme like scat, but... tied up, gagged... forced to smell feet, armpits, ass... underwear... forced face sitting. Rimming. I just like to be manhandled. ""Abused"" a bit. I've been in a non-romantic D/s relationship before.. But I'd like to date.

When do I bring this up when dating someone? Any time a date asks about kinks... I feel like I have to be honest about this. I'd feel bad to spring it on them later. And it's not like I ALWAYS need this... not at all. But a fulfilling relationship for me could include this stuff from time to time, at a minimum. I COULD see myself in a relationship where my boyfriend is my ""Master,"" but I never go THAT far with it when leading this conversation with dates. Just that I like to be tied up and dominated and ""forced"" to take things a little bit. With how much of a deal breaker this has been, I feel like I need to bring it up really early. How would you want to find out about this... How can I manage this in a way that doesn't chase guys away? Obviously some of it is... I'll just never be compatible with a vanilla guy. But I'm getting so discouraged. :/","&lt;!-- SC_OFF --&gt;&lt;div class=""md""&gt;&lt;p&gt;I&amp;#39;m 24 and have been running into a problem while dating and being kinky... I&amp;#39;ll have no problem going on a few dates with a guy, but without fail, when more sexual topics come up... They back out. I&amp;#39;m fairly kinky.. Fairly submissive. I like to be dominated... Humiliated a bit. Nothing too extreme like scat, but... tied up, gagged... forced to smell feet, armpits, ass... underwear... forced face sitting. Rimming. I just like to be manhandled. &amp;quot;Abused&amp;quot; a bit. I&amp;#39;ve been in a non-romantic D/s relationship before.. But I&amp;#39;d like to date.&lt;/p&gt;

&lt;p&gt;When do I bring this up when dating someone? Any time a date asks about kinks... I feel like I have to be honest about this. I&amp;#39;d feel bad to spring it on them later. And it&amp;#39;s not like I ALWAYS need this... not at all. But a fulfilling relationship for me could include this stuff from time to time, at a minimum. I COULD see myself in a relationship where my boyfriend is my &amp;quot;Master,&amp;quot; but I never go THAT far with it when leading this conversation with dates. Just that I like to be tied up and dominated and &amp;quot;forced&amp;quot; to take things a little bit. With how much of a deal breaker this has been, I feel like I need to bring it up really early. How would you want to find out about this... How can I manage this in a way that doesn&amp;#39;t chase guys away? Obviously some of it is... I&amp;#39;ll just never be compatible with a vanilla guy. But I&amp;#39;m getting so discouraged. :/&lt;/p&gt;
&lt;/div&gt;&lt;!-- SC_ON --&gt;","False","askgaybros","t5_2vgfw","","","Chasing dates away because I'm kinky. Help.","5","http://www.reddit.com/r/askgaybros/comments/2yz9fi/chasing_dates_away_because_im_kinky_help/","[]","False"
"17","","","{}","http://www.reddit.com/api/info/","{}","{}","False","","","False","gildagra","","","","False","1426300371.0","1426296771.0","","self.askgaybros","0","False","0","True","False","2yz5d6","True","","","","","","{}","[]","t3_2yz5d6","22","","False","http://www.reddit.com/r/askgaybros/comments/2yz5d6/how_important_to_you_are_a_persons_finances_if/","Unauthenticated reddit sesssion","","False","5","","{}","Let's say there's a guy you like who's cute, funny, seems to have good morals, etc..and you both have great chemistry together. Basically everything you're looking for! But, then you find out he's in a bit of a 'rough patch' financially...has a low-income job. No car. And he's a bit older..doesn't have bad credit but not so great either. Does this affect how you'd feel about dating him? 

I'd like to hear your thoughts on this.","&lt;!-- SC_OFF --&gt;&lt;div class=""md""&gt;&lt;p&gt;Let&amp;#39;s say there&amp;#39;s a guy you like who&amp;#39;s cute, funny, seems to have good morals, etc..and you both have great chemistry together. Basically everything you&amp;#39;re looking for! But, then you find out he&amp;#39;s in a bit of a &amp;#39;rough patch&amp;#39; financially...has a low-income job. No car. And he&amp;#39;s a bit older..doesn&amp;#39;t have bad credit but not so great either. Does this affect how you&amp;#39;d feel about dating him? &lt;/p&gt;

&lt;p&gt;I&amp;#39;d like to hear your thoughts on this.&lt;/p&gt;
&lt;/div&gt;&lt;!-- SC_ON --&gt;","False","askgaybros","t5_2vgfw","","","How important to you are a person's finances if potentially dating?","5","http://www.reddit.com/r/askgaybros/comments/2yz5d6/how_important_to_you_are_a_persons_finances_if/","[]","False"
"18","","","{}","http://www.reddit.com/api/info/","{}","{}","False","","","False","Jungkunstler","","","","False","1426300296.0","1426296696.0","","self.askgaybros","0","1426297692.0","0","True","False","2yz589","True","","","","","","{}","[]","t3_2yz589","3","","False","http://www.reddit.com/r/askgaybros/comments/2yz589/almost_a_year/","Unauthenticated reddit sesssion","","False","1","","{}","First post on ask gay bros sorry if it's long 
So I (17mbi) have been with my current boyfriend (also 17mgay) for about six months at this point. It's by a good margin the longest relationship either of us have been in. Now I've been out for around three years and have played the field with some luck that whole time. My boyfriend (let's call him lance) is in the awkward interim of coming out to a few friends and family members so his support network is basically me and his lesbian bestie. We're both juniors in highschool naturally but we live in neighboring districts so we see eachother Friday nights, weekends or holidays (whenever we can) which is tough but manageable. 
Here inlies my dilemma: my mother (primary legal guardian- haven't talked to my dad in months) is moving from our present home in Georgia to Washington DC for work. Now while I'm happy she is so successful and doing well in her male dominated career (mother is my biggest role model) but I'm unsure of what to do about lance. We both deeply empathic committed people and so the thought of my moving away is difficult to handle of course. I've moved seven times at this point and have gotten pretty comfortable with saying goodbyes but I really think lance and I have something (I get worried if he doesn't call or text to say he loves me back before class or work). Now I've moved while in a relationship before and opted to break up just cause I've never felt this strongly about a boy (or girl) but this time I'm really not sure.
Would it be preemptive and unnecessary to break up with my boyfriend if I'm going to be gone for months at a time for at least a year?
Now this isn't ecause I want to date other people where I move to; I'm in love with my boyfriend and would happily have him be my last. I'm worried I'm holding him back. He's a tall, clever, charismatic guy who could get another boy in a week if he wanted to but he's scared to come out and we're really happy together. 
I'm lances first boyfriend and basically his security blanket from his family at times; am I hurting him by enabling him to hide and not letting him see what dating around is like? 
Do I need to break up with him for his own good?","&lt;!-- SC_OFF --&gt;&lt;div class=""md""&gt;&lt;p&gt;First post on ask gay bros sorry if it&amp;#39;s long 
So I (17mbi) have been with my current boyfriend (also 17mgay) for about six months at this point. It&amp;#39;s by a good margin the longest relationship either of us have been in. Now I&amp;#39;ve been out for around three years and have played the field with some luck that whole time. My boyfriend (let&amp;#39;s call him lance) is in the awkward interim of coming out to a few friends and family members so his support network is basically me and his lesbian bestie. We&amp;#39;re both juniors in highschool naturally but we live in neighboring districts so we see eachother Friday nights, weekends or holidays (whenever we can) which is tough but manageable. 
Here inlies my dilemma: my mother (primary legal guardian- haven&amp;#39;t talked to my dad in months) is moving from our present home in Georgia to Washington DC for work. Now while I&amp;#39;m happy she is so successful and doing well in her male dominated career (mother is my biggest role model) but I&amp;#39;m unsure of what to do about lance. We both deeply empathic committed people and so the thought of my moving away is difficult to handle of course. I&amp;#39;ve moved seven times at this point and have gotten pretty comfortable with saying goodbyes but I really think lance and I have something (I get worried if he doesn&amp;#39;t call or text to say he loves me back before class or work). Now I&amp;#39;ve moved while in a relationship before and opted to break up just cause I&amp;#39;ve never felt this strongly about a boy (or girl) but this time I&amp;#39;m really not sure.
Would it be preemptive and unnecessary to break up with my boyfriend if I&amp;#39;m going to be gone for months at a time for at least a year?
Now this isn&amp;#39;t ecause I want to date other people where I move to; I&amp;#39;m in love with my boyfriend and would happily have him be my last. I&amp;#39;m worried I&amp;#39;m holding him back. He&amp;#39;s a tall, clever, charismatic guy who could get another boy in a week if he wanted to but he&amp;#39;s scared to come out and we&amp;#39;re really happy together. 
I&amp;#39;m lances first boyfriend and basically his security blanket from his family at times; am I hurting him by enabling him to hide and not letting him see what dating around is like? 
Do I need to break up with him for his own good?&lt;/p&gt;
&lt;/div&gt;&lt;!-- SC_ON --&gt;","False","askgaybros","t5_2vgfw","","","Almost a year","1","http://www.reddit.com/r/askgaybros/comments/2yz589/almost_a_year/","[]","False"
"19","","","{}","http://www.reddit.com/api/info/","{}","{}","False","","","False","42069it","","","","False","1426295451.0","1426291851.0","","self.askgaybros","0","False","0","True","False","2yywgs","True","","","","","","{}","[]","t3_2yywgs","7","","False","http://www.reddit.com/r/askgaybros/comments/2yywgs/question_about_fisting/","Unauthenticated reddit sesssion","","False","3","","{}","Does it make you loose? Stretching my ass and fisting is something that greatly intrigues me, but before I embark on this endeavor I want to know if it actually makes your ass loose in the long term.  ","&lt;!-- SC_OFF --&gt;&lt;div class=""md""&gt;&lt;p&gt;Does it make you loose? Stretching my ass and fisting is something that greatly intrigues me, but before I embark on this endeavor I want to know if it actually makes your ass loose in the long term.  &lt;/p&gt;
&lt;/div&gt;&lt;!-- SC_ON --&gt;","False","askgaybros","t5_2vgfw","","","Question about fisting..","3","http://www.reddit.com/r/askgaybros/comments/2yywgs/question_about_fisting/","[]","False"
"20","","","{}","http://www.reddit.com/api/info/","{}","{}","False","","","False","93throwaway96","","","","False","1426291823.0","1426288223.0","","self.askgaybros","0","False","0","True","False","2yypg0","True","","","","","","{}","[]","t3_2yypg0","33","","False","http://www.reddit.com/r/askgaybros/comments/2yypg0/whats_your_worst_coming_out_experience_bros/","Unauthenticated reddit sesssion","","False","5","","{}","","","False","askgaybros","t5_2vgfw","","","What's your worst coming out experience bros?","5","http://www.reddit.com/r/askgaybros/comments/2yypg0/whats_your_worst_coming_out_experience_bros/","[]","False"
