"","_comment_sort","_comments","_comments_by_id","_info_url","_orphaned","_params","_replaced_more","_underscore_names","approved_by","archived","author","author_flair_css_class","author_flair_text","banned_by","clicked","created","created_utc","distinguished","domain","downs","edited","gilded","has_fetched","hidden","id","is_self","json_dict","likes","link_flair_css_class","link_flair_text","media","media_embed","mod_reports","name","num_comments","num_reports","over_18","permalink","reddit_session","report_reasons","saved","score","secure_media","secure_media_embed","selftext","selftext_html","stickied","subreddit","subreddit_id","suggested_sort","thumbnail","title","ups","url","user_reports","visited"
"0","","","{}","http://www.reddit.com/api/info/","{}","{}","False","","","True","Laika_Come_Home","","","","False","1407687561.0","1407683961.0","","self.askgaybros","0","False","0","True","False","2d5gkz","True","","","","","","{}","[]","t3_2d5gkz","53","","False","http://www.reddit.com/r/askgaybros/comments/2d5gkz/you_wanna_talk_to_someone_you_think_is_cute_whats/","Unauthenticated reddit sesssion","","False","23","","{}","Be it on Grindr, at parties, in the mall, etc.","&lt;!-- SC_OFF --&gt;&lt;div class=""md""&gt;&lt;p&gt;Be it on Grindr, at parties, in the mall, etc.&lt;/p&gt;
&lt;/div&gt;&lt;!-- SC_ON --&gt;","False","askgaybros","t5_2vgfw","","","You wanna talk to someone you think is cute; what's your opening line? What do you do?","23","http://www.reddit.com/r/askgaybros/comments/2d5gkz/you_wanna_talk_to_someone_you_think_is_cute_whats/","[]","False"
"1","","","{}","http://www.reddit.com/api/info/","{}","{}","False","","","True","sadsadsadboy","","","","False","1407671187.0","1407667587.0","","self.askgaybros","0","False","0","True","False","2d50t7","True","","","","","","{}","[]","t3_2d50t7","3","","False","http://www.reddit.com/r/askgaybros/comments/2d50t7/a_friend_of_mine_recently_lost_his_mom_to_cancer/","Unauthenticated reddit sesssion","","False","6","","{}","She passed away about a month ago and I'm doing my best to be there for him. But I'm really at a loss. When things like this happen I become very feminine (for lack of a better word right now I'm so exhausted) in the way that I handle things like this. I've grown up with adult women all my life and I really did learn how to kind of nurse people whenever they are in need. I guess its a maternal thing in a strange way. For example I'm very empathetic and sympathetic with people. Especially if they are a loved one of mine, like a friend. And its usually paired with affection, hospitality, accommodation and just affirming kind words like ""I love you, I'm here for you.""  

 The issue is that he is straight, I'm not. And he doesn't know that yet. That's not important. What is important is that I don't act on all of this so much that I make it weird for him. I've tried a little bit in the way that I know how to do it. But he doesn't seem to receive it well. I've told him I love him, I'm there for him. He just says it back and thanks in a monotone voice. Not to say that necessarily means anything but I guess I feel like theres more I could do. I've offered him a place to stay at my place anytime he wants to (he tells me he can't sleep and has bad dreams) so I told him just come over, my house is his. And anything I can do for him I will. But he just says thanks. I just feel like I'm pushing it or just not doing it the appropriate way for him.

 I don't know how to handle it in a ""bro"" way I guess you could say. And he is too sad, his mind is so cloudy, I can't ask him how I should help him. But I'm at a loss because everything that comes natural to me seems kind of like a sentiment rather than actually helpful to him but I mean it with my heart. Maybe I'm over thinking it, but I just am trying to be a good friend and be there for him because I really do love him and want to be there in the best way that I can. But what that is, I'm not quite sure right now? How would you guys handle a situation like this? Even if you didn't worry about the whole seeming gay thing. How do you comfort/be there for a grieving guy friend of yours? Thanks guys in advance. Going to try and sleep now. I'll check replies tomorrow.  ","&lt;!-- SC_OFF --&gt;&lt;div class=""md""&gt;&lt;p&gt;She passed away about a month ago and I&amp;#39;m doing my best to be there for him. But I&amp;#39;m really at a loss. When things like this happen I become very feminine (for lack of a better word right now I&amp;#39;m so exhausted) in the way that I handle things like this. I&amp;#39;ve grown up with adult women all my life and I really did learn how to kind of nurse people whenever they are in need. I guess its a maternal thing in a strange way. For example I&amp;#39;m very empathetic and sympathetic with people. Especially if they are a loved one of mine, like a friend. And its usually paired with affection, hospitality, accommodation and just affirming kind words like &amp;quot;I love you, I&amp;#39;m here for you.&amp;quot;  &lt;/p&gt;

&lt;p&gt;The issue is that he is straight, I&amp;#39;m not. And he doesn&amp;#39;t know that yet. That&amp;#39;s not important. What is important is that I don&amp;#39;t act on all of this so much that I make it weird for him. I&amp;#39;ve tried a little bit in the way that I know how to do it. But he doesn&amp;#39;t seem to receive it well. I&amp;#39;ve told him I love him, I&amp;#39;m there for him. He just says it back and thanks in a monotone voice. Not to say that necessarily means anything but I guess I feel like theres more I could do. I&amp;#39;ve offered him a place to stay at my place anytime he wants to (he tells me he can&amp;#39;t sleep and has bad dreams) so I told him just come over, my house is his. And anything I can do for him I will. But he just says thanks. I just feel like I&amp;#39;m pushing it or just not doing it the appropriate way for him.&lt;/p&gt;

&lt;p&gt;I don&amp;#39;t know how to handle it in a &amp;quot;bro&amp;quot; way I guess you could say. And he is too sad, his mind is so cloudy, I can&amp;#39;t ask him how I should help him. But I&amp;#39;m at a loss because everything that comes natural to me seems kind of like a sentiment rather than actually helpful to him but I mean it with my heart. Maybe I&amp;#39;m over thinking it, but I just am trying to be a good friend and be there for him because I really do love him and want to be there in the best way that I can. But what that is, I&amp;#39;m not quite sure right now? How would you guys handle a situation like this? Even if you didn&amp;#39;t worry about the whole seeming gay thing. How do you comfort/be there for a grieving guy friend of yours? Thanks guys in advance. Going to try and sleep now. I&amp;#39;ll check replies tomorrow.  &lt;/p&gt;
&lt;/div&gt;&lt;!-- SC_ON --&gt;","False","askgaybros","t5_2vgfw","","","A friend of mine recently lost his mom to cancer. How can I help?","6","http://www.reddit.com/r/askgaybros/comments/2d50t7/a_friend_of_mine_recently_lost_his_mom_to_cancer/","[]","False"
"2","","","{}","http://www.reddit.com/api/info/","{}","{}","False","","","True","Bibrah","","","","False","1407666161.0","1407662561.0","","self.askgaybros","0","False","0","True","False","2d4xcc","True","","","","","","{}","[]","t3_2d4xcc","25","","False","http://www.reddit.com/r/askgaybros/comments/2d4xcc/is_the_gay_voice_faked/","Unauthenticated reddit sesssion","","False","0","","{}","(NO HATE..JUST WONDERING)I've been having this thought in my head for some time..honestly..at first I thought every gay man..sounded like that..but stereotypes in media get the best in everyone.The gay voice is a very controversial topic..some say it's faked...somebody wants to fit the stereotypes,and want to express and show the whole world they love cock,Some say they are confused and want to be women..Help me out bros..I'm really confused about ""the gay voice""..is it really their actual voice..or is it influenced by media..and they just like to sound more feminine just to fit the stereotype.I mean honestly..anybody can change their voice..tell me what it is bros.. I thought of making this thread after I watched this video lol https://www.youtube.com/watch?v=NlHC1h1Jcws","&lt;!-- SC_OFF --&gt;&lt;div class=""md""&gt;&lt;p&gt;(NO HATE..JUST WONDERING)I&amp;#39;ve been having this thought in my head for some time..honestly..at first I thought every gay man..sounded like that..but stereotypes in media get the best in everyone.The gay voice is a very controversial topic..some say it&amp;#39;s faked...somebody wants to fit the stereotypes,and want to express and show the whole world they love cock,Some say they are confused and want to be women..Help me out bros..I&amp;#39;m really confused about &amp;quot;the gay voice&amp;quot;..is it really their actual voice..or is it influenced by media..and they just like to sound more feminine just to fit the stereotype.I mean honestly..anybody can change their voice..tell me what it is bros.. I thought of making this thread after I watched this video lol &lt;a href=""https://www.youtube.com/watch?v=NlHC1h1Jcws""&gt;https://www.youtube.com/watch?v=NlHC1h1Jcws&lt;/a&gt;&lt;/p&gt;
&lt;/div&gt;&lt;!-- SC_ON --&gt;","False","askgaybros","t5_2vgfw","","","Is the ""gay voice"" faked?","0","http://www.reddit.com/r/askgaybros/comments/2d4xcc/is_the_gay_voice_faked/","[]","False"
"3","","","{}","http://www.reddit.com/api/info/","{}","{}","False","","","True","Chunks1992","","","","False","1407661850.0","1407658250.0","","self.askgaybros","0","False","0","True","False","2d4u79","True","","","","","","{}","[]","t3_2d4u79","10","","False","http://www.reddit.com/r/askgaybros/comments/2d4u79/has_anyones_driving_habits_ruined_a_date_night/","Unauthenticated reddit sesssion","","False","14","","{}","tl;dr guy sucks at driving so incredibly bad it ruins the date and becomes a deal breaker.

Thought I'd share this with you all to make sure I'm not over reacting but I went on a casual date tonight and to be honest I'm surprised I survived the trip.

Before I start I am not a back seat driver or one of those people that freaks out about every little mistake that people make by driving BUT...

So the guy comes to pick me up at my house and we set out to drive to the movies which is about a 30 minute drive away. Now I live in a relatively rural area dominated by one lane roads. You know, the ones you always go down and seem to be trapped behind the grandma doing 30 in a 55. Yep, that was us. But hey, when it's a stop sign we're not going that fast so he can stop in time right? Wrong. 9/10 times he would wait till the very last second and SLAM on the brakes. Like full blow seat belts lock up and ABS going insane slam. Only to stop some 10+ feet pass the line, practically half way through the intersection. 

Well surely things would get better once we got on the Interstate. Nope. We merged right on with a healthy speed of 40mph with Semis blowing past us. We ever so slowly climb up to 80mph but it only gets worse. We're cutting people off and turn signals are non existent. We cut off a tractor trailer and I swear I thought we were going to get run over. But the best part has yet to come. We're in the far left lane and our exit is coming up in a quarter mile. So what does this guy do? Turns on the turn signal but proceeds to cross 5 FUCKING LANES in one huge dive and in the process cuts off a [5 ton military truck](http://armytrucksinc.com/wp-content/gallery/inventory/5.%20CARGO%20TRUCKS/002.jpg) and goes right through the [gore point](http://media.komonews.com/images/gore_point.jpg) on the exit. Then we finally pull into the parking lot and he starts driving around and texting. He is about to run a stop sign with people in the intersection and is looking down at his phone so I straight up reach down and yank the parking brake to stop us. He freaks out and apologizes and I brush it off. I just want out. 

We watch the movie and all is fine but on the ride home it's basically the same story. But at the end of this rant lies my question. Have you ever gone on a date that they drove so bad it was more or less a deal breaker for you?","&lt;!-- SC_OFF --&gt;&lt;div class=""md""&gt;&lt;p&gt;tl;dr guy sucks at driving so incredibly bad it ruins the date and becomes a deal breaker.&lt;/p&gt;

&lt;p&gt;Thought I&amp;#39;d share this with you all to make sure I&amp;#39;m not over reacting but I went on a casual date tonight and to be honest I&amp;#39;m surprised I survived the trip.&lt;/p&gt;

&lt;p&gt;Before I start I am not a back seat driver or one of those people that freaks out about every little mistake that people make by driving BUT...&lt;/p&gt;

&lt;p&gt;So the guy comes to pick me up at my house and we set out to drive to the movies which is about a 30 minute drive away. Now I live in a relatively rural area dominated by one lane roads. You know, the ones you always go down and seem to be trapped behind the grandma doing 30 in a 55. Yep, that was us. But hey, when it&amp;#39;s a stop sign we&amp;#39;re not going that fast so he can stop in time right? Wrong. 9/10 times he would wait till the very last second and SLAM on the brakes. Like full blow seat belts lock up and ABS going insane slam. Only to stop some 10+ feet pass the line, practically half way through the intersection. &lt;/p&gt;

&lt;p&gt;Well surely things would get better once we got on the Interstate. Nope. We merged right on with a healthy speed of 40mph with Semis blowing past us. We ever so slowly climb up to 80mph but it only gets worse. We&amp;#39;re cutting people off and turn signals are non existent. We cut off a tractor trailer and I swear I thought we were going to get run over. But the best part has yet to come. We&amp;#39;re in the far left lane and our exit is coming up in a quarter mile. So what does this guy do? Turns on the turn signal but proceeds to cross 5 FUCKING LANES in one huge dive and in the process cuts off a &lt;a href=""http://armytrucksinc.com/wp-content/gallery/inventory/5.%20CARGO%20TRUCKS/002.jpg""&gt;5 ton military truck&lt;/a&gt; and goes right through the &lt;a href=""http://media.komonews.com/images/gore_point.jpg""&gt;gore point&lt;/a&gt; on the exit. Then we finally pull into the parking lot and he starts driving around and texting. He is about to run a stop sign with people in the intersection and is looking down at his phone so I straight up reach down and yank the parking brake to stop us. He freaks out and apologizes and I brush it off. I just want out. &lt;/p&gt;

&lt;p&gt;We watch the movie and all is fine but on the ride home it&amp;#39;s basically the same story. But at the end of this rant lies my question. Have you ever gone on a date that they drove so bad it was more or less a deal breaker for you?&lt;/p&gt;
&lt;/div&gt;&lt;!-- SC_ON --&gt;","False","askgaybros","t5_2vgfw","","","Has anyone's driving habits ruined a date night? /rant","14","http://www.reddit.com/r/askgaybros/comments/2d4u79/has_anyones_driving_habits_ruined_a_date_night/","[]","False"
"4","","","{}","http://www.reddit.com/api/info/","{}","{}","False","","","True","distortion__182","","","","False","1407654251.0","1407650651.0","","self.askgaybros","0","False","0","True","False","2d4nd6","True","","","","","","{}","[]","t3_2d4nd6","22","","False","http://www.reddit.com/r/askgaybros/comments/2d4nd6/im_straight_but_all_3_times_ive_done_cocaine_i/","Unauthenticated reddit sesssion","","False","15","","{}","I know I know, drugs are bad. I've only done cocaine 3 times, but all 3 times I hook up with a guy. My friends have no idea and say that I just wandered away from the group at some point... I don't know what to make of all this.","&lt;!-- SC_OFF --&gt;&lt;div class=""md""&gt;&lt;p&gt;I know I know, drugs are bad. I&amp;#39;ve only done cocaine 3 times, but all 3 times I hook up with a guy. My friends have no idea and say that I just wandered away from the group at some point... I don&amp;#39;t know what to make of all this.&lt;/p&gt;
&lt;/div&gt;&lt;!-- SC_ON --&gt;","False","askgaybros","t5_2vgfw","","","I'm straight, but all 3 times I've done cocaine I end up hooking up with a guy... am I unconsciously suppressing something?","15","http://www.reddit.com/r/askgaybros/comments/2d4nd6/im_straight_but_all_3_times_ive_done_cocaine_i/","[]","False"
"5","","","{}","http://www.reddit.com/api/info/","{}","{}","False","","","True","throwawaypeeps","","","","False","1407648548.0","1407644948.0","","self.askgaybros","0","False","0","True","False","2d4h65","True","","","","","","{}","[]","t3_2d4h65","11","","False","http://www.reddit.com/r/askgaybros/comments/2d4h65/i_feel_so_unloved_i_feel_alone/","Unauthenticated reddit sesssion","","False","43","","{}","I am hurting so much. I just got home after going to the movies alone again. I have lost over 100 pounds and I feel like its not enough. I have a handful of friends and they all forget about me sometimes I feel. For instance last week in was invited to go to the bar with a friend and a group of five people. No one would make eye contact with me all night. No one would include me in their conversations. If I said something they would ignore me. They asked me to take their group photo and I wasn't included in it. Ever since that night I've just felt my heart feel like it wants to explode from sadness and depression. In the past month I've gone outside my comfort zone and have talked two guys. Who liked my pictures they liked talking to on text messages.  But after we met they want nothing to do with me . . I don't understand what is wrong with me and why I can't keep friends. I feel like I'm a normal person. I don't talk funny. I don't have any hideous outside blemishes or disfigurations. I'm just a bigger guy in the process of slimming down. I feel so depressed. ;.

I dunno. If any of you just want to talk to me. Pm me and I'll give you my Kik. I just need people to talk to. Please :/


","&lt;!-- SC_OFF --&gt;&lt;div class=""md""&gt;&lt;p&gt;I am hurting so much. I just got home after going to the movies alone again. I have lost over 100 pounds and I feel like its not enough. I have a handful of friends and they all forget about me sometimes I feel. For instance last week in was invited to go to the bar with a friend and a group of five people. No one would make eye contact with me all night. No one would include me in their conversations. If I said something they would ignore me. They asked me to take their group photo and I wasn&amp;#39;t included in it. Ever since that night I&amp;#39;ve just felt my heart feel like it wants to explode from sadness and depression. In the past month I&amp;#39;ve gone outside my comfort zone and have talked two guys. Who liked my pictures they liked talking to on text messages.  But after we met they want nothing to do with me . . I don&amp;#39;t understand what is wrong with me and why I can&amp;#39;t keep friends. I feel like I&amp;#39;m a normal person. I don&amp;#39;t talk funny. I don&amp;#39;t have any hideous outside blemishes or disfigurations. I&amp;#39;m just a bigger guy in the process of slimming down. I feel so depressed. ;.&lt;/p&gt;

&lt;p&gt;I dunno. If any of you just want to talk to me. Pm me and I&amp;#39;ll give you my Kik. I just need people to talk to. Please :/&lt;/p&gt;
&lt;/div&gt;&lt;!-- SC_ON --&gt;","False","askgaybros","t5_2vgfw","","","I feel so unloved. I feel alone.","43","http://www.reddit.com/r/askgaybros/comments/2d4h65/i_feel_so_unloved_i_feel_alone/","[]","False"
"6","","","{}","http://www.reddit.com/api/info/","{}","{}","False","","","True","darbyy","","","","False","1407647283.0","1407643683.0","","self.askgaybros","0","False","0","True","False","2d4fjm","True","","","","","","{}","[]","t3_2d4fjm","5","","False","http://www.reddit.com/r/askgaybros/comments/2d4fjm/am_i_selfish/","Unauthenticated reddit sesssion","","False","2","","{}","When I hang out with guys and they do the majority of the work when we engage in any sexual act? Like I am honestly just laying/sitting there enjoying it, while they go down on me but when I try to return the favour I am told ""no"" or my hands are forced away from their crotch area. I get that some guys aren't comfortable with it but I have had this happen with my most recent hookups and now I am at the point where I am anxious to even try to do it with the same guys or new guys that I meet.

I guess in a way it's sort of flattering that someone would devote the majority of our time together to pleasure me but I guess they would be enjoying it too. 

Idk, I just feel sort of shitty if I cum and the other guy doesn't :( Today I met up with this guy that I have been messaging the past week and we finally met up early this morning after being out the whole night. And yet again he did all the work, despite me being so fucking attracted to him I just didn't want to upset him or do something he didn't want me doing. 

When we were making out I kept rubbing his dick but then he grabbed my hands immediately and put them above my head in bed and the making out became more intense, even with his hard dick rubbing against me, he just didn't want my hands down there? He seemed really into me but I'd just really want to thank him in a way that's not verbal. 

Sorry for rambling, just quite frustrated atm. ","&lt;!-- SC_OFF --&gt;&lt;div class=""md""&gt;&lt;p&gt;When I hang out with guys and they do the majority of the work when we engage in any sexual act? Like I am honestly just laying/sitting there enjoying it, while they go down on me but when I try to return the favour I am told &amp;quot;no&amp;quot; or my hands are forced away from their crotch area. I get that some guys aren&amp;#39;t comfortable with it but I have had this happen with my most recent hookups and now I am at the point where I am anxious to even try to do it with the same guys or new guys that I meet.&lt;/p&gt;

&lt;p&gt;I guess in a way it&amp;#39;s sort of flattering that someone would devote the majority of our time together to pleasure me but I guess they would be enjoying it too. &lt;/p&gt;

&lt;p&gt;Idk, I just feel sort of shitty if I cum and the other guy doesn&amp;#39;t :( Today I met up with this guy that I have been messaging the past week and we finally met up early this morning after being out the whole night. And yet again he did all the work, despite me being so fucking attracted to him I just didn&amp;#39;t want to upset him or do something he didn&amp;#39;t want me doing. &lt;/p&gt;

&lt;p&gt;When we were making out I kept rubbing his dick but then he grabbed my hands immediately and put them above my head in bed and the making out became more intense, even with his hard dick rubbing against me, he just didn&amp;#39;t want my hands down there? He seemed really into me but I&amp;#39;d just really want to thank him in a way that&amp;#39;s not verbal. &lt;/p&gt;

&lt;p&gt;Sorry for rambling, just quite frustrated atm. &lt;/p&gt;
&lt;/div&gt;&lt;!-- SC_ON --&gt;","False","askgaybros","t5_2vgfw","","","Am I selfish?","2","http://www.reddit.com/r/askgaybros/comments/2d4fjm/am_i_selfish/","[]","False"
"7","","","{}","http://www.reddit.com/api/info/","{}","{}","False","","","True","Laika_Come_Home","","","","False","1407645401.0","1407641801.0","","self.askgaybros","0","False","0","True","False","2d4d51","True","","","","","","{}","[]","t3_2d4d51","26","","False","http://www.reddit.com/r/askgaybros/comments/2d4d51/how_to_overcome_shyness_in_barsclubsparties/","Unauthenticated reddit sesssion","","False","8","","{}","I keep shutting myself down before I can try (be it dancing, flirting, talking, etc). Fuck that. I don't want to admit it at times, but part of it may be low self-esteem and feelings of unattractiveness. I don't want that to ruin my social life.

But, what can I do? What do I do? At times, it's like I don't know how to talk to people. It's weird.","&lt;!-- SC_OFF --&gt;&lt;div class=""md""&gt;&lt;p&gt;I keep shutting myself down before I can try (be it dancing, flirting, talking, etc). Fuck that. I don&amp;#39;t want to admit it at times, but part of it may be low self-esteem and feelings of unattractiveness. I don&amp;#39;t want that to ruin my social life.&lt;/p&gt;

&lt;p&gt;But, what can I do? What do I do? At times, it&amp;#39;s like I don&amp;#39;t know how to talk to people. It&amp;#39;s weird.&lt;/p&gt;
&lt;/div&gt;&lt;!-- SC_ON --&gt;","False","askgaybros","t5_2vgfw","","","How to overcome shyness in bars/clubs/parties without alcohol?","8","http://www.reddit.com/r/askgaybros/comments/2d4d51/how_to_overcome_shyness_in_barsclubsparties/","[]","False"
