"","_comment_sort","_comments","_comments_by_id","_info_url","_orphaned","_params","_replaced_more","_underscore_names","approved_by","archived","author","author_flair_css_class","author_flair_text","banned_by","clicked","created","created_utc","distinguished","domain","downs","edited","gilded","has_fetched","hidden","id","is_self","json_dict","likes","link_flair_css_class","link_flair_text","media","media_embed","mod_reports","name","num_comments","num_reports","over_18","permalink","reddit_session","report_reasons","saved","score","secure_media","secure_media_embed","selftext","selftext_html","stickied","subreddit","subreddit_id","suggested_sort","thumbnail","title","ups","url","user_reports","visited"
"0","","","{}","http://www.reddit.com/api/info/","{}","{}","False","","","True","FeelingEverything","","","","False","1414428898.0","1414425298.0","","self.askgaybros","0","False","0","True","False","2kh1de","True","","","","","","{}","[]","t3_2kh1de","20","","False","http://www.reddit.com/r/askgaybros/comments/2kh1de/why_does_everyone_like_muscle_so_much_when_its/","Unauthenticated reddit sesssion","","False","0","","{}","","","False","askgaybros","t5_2vgfw","","","Why does everyone like muscle so much when itâ€™s pretty obvious we twinks are the best in the bed?","0","http://www.reddit.com/r/askgaybros/comments/2kh1de/why_does_everyone_like_muscle_so_much_when_its/","[]","False"
"1","","","{}","http://www.reddit.com/api/info/","{}","{}","False","","","True","hINKHonkHenk","","","","False","1414427686.0","1414424086.0","","self.askgaybros","0","False","0","True","False","2kgz9h","True","","","","","","{}","[]","t3_2kgz9h","18","","False","http://www.reddit.com/r/askgaybros/comments/2kgz9h/why_do_people_come_out_in_conservative_families/","Unauthenticated reddit sesssion","","False","0","","{}","This is only vaguely related to my situation, but I keep hearing about people who get shunned or even abandoned by their families because they're conservative and aren't fine with their child or nephew or grandchild being homos.

Now here's something that bothers me. If you know your loved ones, who do love you and care for you, would begin to dislike you for being gay, why would you tell them that? If I had to choose between my sexuality and my family, I'd choose my family.

It's just sort of baffling to me when people know their family refer to homos as faggots and freaks and think it's going to turn out well when they decide to tell their family.

I've seen the argument that ""well, if they can't accept you, they don't deserve you"", but to me that's a very poor way to think. If they hate me for being gay, who am I to hate them for disliking homosexuals? It's unneccessary bridge-burning.

What do you think?","&lt;!-- SC_OFF --&gt;&lt;div class=""md""&gt;&lt;p&gt;This is only vaguely related to my situation, but I keep hearing about people who get shunned or even abandoned by their families because they&amp;#39;re conservative and aren&amp;#39;t fine with their child or nephew or grandchild being homos.&lt;/p&gt;

&lt;p&gt;Now here&amp;#39;s something that bothers me. If you know your loved ones, who do love you and care for you, would begin to dislike you for being gay, why would you tell them that? If I had to choose between my sexuality and my family, I&amp;#39;d choose my family.&lt;/p&gt;

&lt;p&gt;It&amp;#39;s just sort of baffling to me when people know their family refer to homos as faggots and freaks and think it&amp;#39;s going to turn out well when they decide to tell their family.&lt;/p&gt;

&lt;p&gt;I&amp;#39;ve seen the argument that &amp;quot;well, if they can&amp;#39;t accept you, they don&amp;#39;t deserve you&amp;quot;, but to me that&amp;#39;s a very poor way to think. If they hate me for being gay, who am I to hate them for disliking homosexuals? It&amp;#39;s unneccessary bridge-burning.&lt;/p&gt;

&lt;p&gt;What do you think?&lt;/p&gt;
&lt;/div&gt;&lt;!-- SC_ON --&gt;","False","askgaybros","t5_2vgfw","","","Why do people come out in conservative families? At what point is it ever a good idea.","0","http://www.reddit.com/r/askgaybros/comments/2kgz9h/why_do_people_come_out_in_conservative_families/","[]","False"
"2","","","{}","http://www.reddit.com/api/info/","{}","{}","False","","","True","MooseKnocker","","","","False","1414423858.0","1414420258.0","","self.askgaybros","0","False","0","True","False","2kgsoy","True","","","","","","{}","[]","t3_2kgsoy","15","","False","http://www.reddit.com/r/askgaybros/comments/2kgsoy/finding_a_gay_friendly_doctors/","Unauthenticated reddit sesssion","","False","10","","{}","It's all in the title. How do you find a gay friendly doctor.","&lt;!-- SC_OFF --&gt;&lt;div class=""md""&gt;&lt;p&gt;It&amp;#39;s all in the title. How do you find a gay friendly doctor.&lt;/p&gt;
&lt;/div&gt;&lt;!-- SC_ON --&gt;","False","askgaybros","t5_2vgfw","","","Finding a gay friendly doctors","10","http://www.reddit.com/r/askgaybros/comments/2kgsoy/finding_a_gay_friendly_doctors/","[]","False"
"3","","","{}","http://www.reddit.com/api/info/","{}","{}","False","","","True","AdelaideStevenson","","","","False","1414423539.0","1414419939.0","","self.askgaybros","0","False","0","True","False","2kgs5m","True","","","","","","{}","[]","t3_2kgs5m","21","","False","http://www.reddit.com/r/askgaybros/comments/2kgs5m/do_you_refer_to_your_midsection_as_your_abs_belly/","Unauthenticated reddit sesssion","","False","0","","{}","I want to see who i'm working with here. ","&lt;!-- SC_OFF --&gt;&lt;div class=""md""&gt;&lt;p&gt;I want to see who i&amp;#39;m working with here. &lt;/p&gt;
&lt;/div&gt;&lt;!-- SC_ON --&gt;","False","askgaybros","t5_2vgfw","","","Do you refer to your midsection as your ""abs"", ""belly"", ""stomach"", or ""torso""?","0","http://www.reddit.com/r/askgaybros/comments/2kgs5m/do_you_refer_to_your_midsection_as_your_abs_belly/","[]","False"
"4","","","{}","http://www.reddit.com/api/info/","{}","{}","False","","","True","Converse1981","","","","False","1414421132.0","1414417532.0","","self.askgaybros","0","1414606448.0","0","True","False","2kgoaz","True","","","","","","{}","[]","t3_2kgoaz","13","","False","http://www.reddit.com/r/askgaybros/comments/2kgoaz/need_some_help_guys/","Unauthenticated reddit sesssion","","False","17","","{}","So I had a date Saturday with a guy who I initially didn't want to go on a date with. We met on OKCupid and I was a tad hesitant. But once we met I thought we hit it off well. We talked a lot, no lulls in convo, and even held hands at one point. The problem is that he struck me as being introverted and shy. I texted him a brief message the next day but he didn't respond. So I want to send him another text today asking if he wants to hang out again.
Gaybros, what's the most creative, sincere, and gainful text I can send him today that'll help me score another date??? I want this to work. If it doesn't work out its not the end of the world, but I want to give this a shot!
Give me your best ideas!

Edit: He never texted back. Oh well, next!","&lt;!-- SC_OFF --&gt;&lt;div class=""md""&gt;&lt;p&gt;So I had a date Saturday with a guy who I initially didn&amp;#39;t want to go on a date with. We met on OKCupid and I was a tad hesitant. But once we met I thought we hit it off well. We talked a lot, no lulls in convo, and even held hands at one point. The problem is that he struck me as being introverted and shy. I texted him a brief message the next day but he didn&amp;#39;t respond. So I want to send him another text today asking if he wants to hang out again.
Gaybros, what&amp;#39;s the most creative, sincere, and gainful text I can send him today that&amp;#39;ll help me score another date??? I want this to work. If it doesn&amp;#39;t work out its not the end of the world, but I want to give this a shot!
Give me your best ideas!&lt;/p&gt;

&lt;p&gt;Edit: He never texted back. Oh well, next!&lt;/p&gt;
&lt;/div&gt;&lt;!-- SC_ON --&gt;","False","askgaybros","t5_2vgfw","","","Need some help, guys!","17","http://www.reddit.com/r/askgaybros/comments/2kgoaz/need_some_help_guys/","[]","False"
"5","","","{}","http://www.reddit.com/api/info/","{}","{}","False","","","True","Firecrotch2014","","","","False","1414420704.0","1414417104.0","","self.askgaybros","0","False","0","True","False","2kgnma","True","","","","","","{}","[]","t3_2kgnma","96","","False","http://www.reddit.com/r/askgaybros/comments/2kgnma/the_age_old_question_if_youre_not_attracted_to_a/","Unauthenticated reddit sesssion","","False","7","","{}","So yeah, I'm probably opening a huge barrel of monkeys here but this has been a problem that has plagued me for years.

Alittle background:  I'm from Georgia, which is still probably one of the most racially divided states left.  This is especially true in the more rural areas where I lived.  So basically I grew up around the sentiment that basically white people are the best and other races are not.(That is not a sentiment that I still hold thankfully especially after leaving and moving to California)

 It's not something that I was taught directly but growing up I saw how my parents and other adults acted around people of color and those they perceived as different.  This is something I've literally had to battle against in my mind growing up.  You know those in the heat of the moment thoughts you sometimes have that you know would hurt someone deeply if you said it aloud but then as soon as you think that you reprimand yourself for thinking such terrible things about them.  At least that's been my experience.  I've hated myself and my upbringing for this for a very long time.  Although I think as I've gotten older I'm more able to get a handle on it now. Obviously I don't act on those thoughts/emotions either which I feel is a huge factor.  I treat people as people no matter their race.

So on to my question/problem.  I can honestly say I've never seen a full on dark skinned black person that I'm attracted to physically.  I can't recall a single black person that I would think to myself, "" damn I want to do him so bad!""  I do want to say that I have no ill feelings consciously against black people. I think they are the same as everyone else.  I don't consider them a lesser race or anything crazy like that.  I wouldn't be opposed to dating a black guy if I found one to be attractive and with other qualities I look for.(intelligence, humor etc).  I am in a serious relationship already though so that point is kind of moot.

I guess my question is do you think my lack of physical attraction to black people is due to my upbringing or just personal preference?  I also have no problem with dark skinned people either.  My bf is Asian(rather tanned) and I think guys like Tyler Posey and Taylor Lautner are super hot. But at the same time guys like Denzel Washington or Will Smith do nothing for me.  Am I worrying for nothing?","&lt;!-- SC_OFF --&gt;&lt;div class=""md""&gt;&lt;p&gt;So yeah, I&amp;#39;m probably opening a huge barrel of monkeys here but this has been a problem that has plagued me for years.&lt;/p&gt;

&lt;p&gt;Alittle background:  I&amp;#39;m from Georgia, which is still probably one of the most racially divided states left.  This is especially true in the more rural areas where I lived.  So basically I grew up around the sentiment that basically white people are the best and other races are not.(That is not a sentiment that I still hold thankfully especially after leaving and moving to California)&lt;/p&gt;

&lt;p&gt;It&amp;#39;s not something that I was taught directly but growing up I saw how my parents and other adults acted around people of color and those they perceived as different.  This is something I&amp;#39;ve literally had to battle against in my mind growing up.  You know those in the heat of the moment thoughts you sometimes have that you know would hurt someone deeply if you said it aloud but then as soon as you think that you reprimand yourself for thinking such terrible things about them.  At least that&amp;#39;s been my experience.  I&amp;#39;ve hated myself and my upbringing for this for a very long time.  Although I think as I&amp;#39;ve gotten older I&amp;#39;m more able to get a handle on it now. Obviously I don&amp;#39;t act on those thoughts/emotions either which I feel is a huge factor.  I treat people as people no matter their race.&lt;/p&gt;

&lt;p&gt;So on to my question/problem.  I can honestly say I&amp;#39;ve never seen a full on dark skinned black person that I&amp;#39;m attracted to physically.  I can&amp;#39;t recall a single black person that I would think to myself, &amp;quot; damn I want to do him so bad!&amp;quot;  I do want to say that I have no ill feelings consciously against black people. I think they are the same as everyone else.  I don&amp;#39;t consider them a lesser race or anything crazy like that.  I wouldn&amp;#39;t be opposed to dating a black guy if I found one to be attractive and with other qualities I look for.(intelligence, humor etc).  I am in a serious relationship already though so that point is kind of moot.&lt;/p&gt;

&lt;p&gt;I guess my question is do you think my lack of physical attraction to black people is due to my upbringing or just personal preference?  I also have no problem with dark skinned people either.  My bf is Asian(rather tanned) and I think guys like Tyler Posey and Taylor Lautner are super hot. But at the same time guys like Denzel Washington or Will Smith do nothing for me.  Am I worrying for nothing?&lt;/p&gt;
&lt;/div&gt;&lt;!-- SC_ON --&gt;","False","askgaybros","t5_2vgfw","","","The age old question: if you're not attracted to a particular race, does that make you racist?","7","http://www.reddit.com/r/askgaybros/comments/2kgnma/the_age_old_question_if_youre_not_attracted_to_a/","[]","False"
"6","","","{}","http://www.reddit.com/api/info/","{}","{}","False","","","True","Caitlinmitcheem","","","","False","1414417623.0","1414414023.0","","self.askgaybros","0","False","0","True","False","2kgjfb","True","","","","","","{}","[]","t3_2kgjfb","11","","False","http://www.reddit.com/r/askgaybros/comments/2kgjfb/not_sure_if_im_overthinking_this_but_weird/","Unauthenticated reddit sesssion","","False","0","","{}","So, there's this guy that I see on my college campus all the time and every time we see each other, we make eye contact for like 20 minutes and it's kind of freaking me out. I saw him on grindr a few weeks ago ( the staring contest started weeks before I sent the message) and he never responded, so I figured he's just not interested or is possibly freaked out by that fact that I stare at him. But I saw him again when I walked into the library and we stared at each other! He was walking towards the exit, btw. So, I pretended to look through my bag so it wouldn't seem like I was stalking him  ( super slick, I know), but when I looked back up, he was staring at me again. But here's the thing: We're not walking on the same path, I'm walking straight and he's sort of walking diagonally, so to look at me he has to turn his head. Also, like two minutes after I walk past him, I turn around and notice that he turned around too and is still looking at me. So I walked around the corner, found a seat, and sat down, but he's no where to be found. Could he have just forgotten something and decided to return to the library? AM I reading too much into this? Also, I apologize for any spelling errors, I have a midterm in like half an hour I have yet to study for, but I figure this is way more important so I quickly typed this up. ","&lt;!-- SC_OFF --&gt;&lt;div class=""md""&gt;&lt;p&gt;So, there&amp;#39;s this guy that I see on my college campus all the time and every time we see each other, we make eye contact for like 20 minutes and it&amp;#39;s kind of freaking me out. I saw him on grindr a few weeks ago ( the staring contest started weeks before I sent the message) and he never responded, so I figured he&amp;#39;s just not interested or is possibly freaked out by that fact that I stare at him. But I saw him again when I walked into the library and we stared at each other! He was walking towards the exit, btw. So, I pretended to look through my bag so it wouldn&amp;#39;t seem like I was stalking him  ( super slick, I know), but when I looked back up, he was staring at me again. But here&amp;#39;s the thing: We&amp;#39;re not walking on the same path, I&amp;#39;m walking straight and he&amp;#39;s sort of walking diagonally, so to look at me he has to turn his head. Also, like two minutes after I walk past him, I turn around and notice that he turned around too and is still looking at me. So I walked around the corner, found a seat, and sat down, but he&amp;#39;s no where to be found. Could he have just forgotten something and decided to return to the library? AM I reading too much into this? Also, I apologize for any spelling errors, I have a midterm in like half an hour I have yet to study for, but I figure this is way more important so I quickly typed this up. &lt;/p&gt;
&lt;/div&gt;&lt;!-- SC_ON --&gt;","False","askgaybros","t5_2vgfw","","","Not sure if I'm overthinking this, but WEIRD staring question","0","http://www.reddit.com/r/askgaybros/comments/2kgjfb/not_sure_if_im_overthinking_this_but_weird/","[]","False"
"7","","","{}","http://www.reddit.com/api/info/","{}","{}","False","","","True","GloriousSunrise","","","","False","1414416841.0","1414413241.0","","i0.wp.com","0","False","0","True","False","2kgigm","False","","","","","","{}","[]","t3_2kgigm","16","","False","http://www.reddit.com/r/askgaybros/comments/2kgigm/dont_you_just_love_the_diversity_of_the_fashion/","Unauthenticated reddit sesssion","","False","6","","{}","","","False","askgaybros","t5_2vgfw","","","Don't you just love the diversity of the fashion industry? - Top Male Models","6","http://i0.wp.com/www.derriuspierre.com/wp-content/uploads/2014/02/10-Supermodels-For-Details-Magazine-Cover-Story-March-2014-issue-DerriusPierreCom-1.jpg","[]","False"
"8","","","{}","http://www.reddit.com/api/info/","{}","{}","False","","","True","aviskiss","","","","False","1414416408.0","1414412808.0","","self.askgaybros","0","False","0","True","False","2kghy8","True","","","","","","{}","[]","t3_2kghy8","4","","False","http://www.reddit.com/r/askgaybros/comments/2kghy8/need_advice_on_uneven_libidos_in_relationship/","Unauthenticated reddit sesssion","","False","3","","{}","So, my boyfriend and I have been together now for about 8 months, and I'm so happy with him, and still very in love. We've been through a lot together already (family issues), and we both strongly support each other when we need it most. I really, really love him. However, our libidos seem to be contrasting. His is quite low, and mine is very, very- VERY high. I haven't always been like this though- I left a previous relationship where I would go weeks, sometimes months without wanting to engage in any activities. Now, though, and without fail, I could and want to have him every day, multiple times a day. I know this isn't necessarily a normal desire, because relationships tend to reach a point of normality after a while, but I really can't keep my hands off of him. 

Something to consider, which is actually making it much worse for me, is that I've recently started taking a medication for depression (non-SSRI) which super charges my libido, even more so from its normal high. 

When I ask him if he's in the mood, or try to initiate it, he apologizes and explains that he's just been in a sexual 'low' lately, which is completely understanding and I try not to impress any pressure on him, because that wouldn't be fair and it would be damaging to the relationship. However, every time that happens, I think back to my previous relationship and consider whether or not he's as attracted to me as I am to him (the main reason my libido was low previously). 

One more piece of information: We do have 'fun' about once every 4-7 days, which I'm pretty sure is 'normal', but I want it every day, or at least every-other. It's hard for me to focus when I'm SO in the mood and he's laying right there in all of his glory, but he just wants to relax. 

My question is-- are there people out there who are in relationships with someone whose libido is either significantly higher or lower than theirs? How do you make it work? What are some tips you have? Is there a way to safely lower my libido (I don't want to even try to increase his, because there's nothing wrong with him and I feel like I'm just too charged)? 

I'd REALLY love to hear from other people in this situation, or with boyfriends who have a much higher libido, and to hear how you make it work. 

Thanks!","&lt;!-- SC_OFF --&gt;&lt;div class=""md""&gt;&lt;p&gt;So, my boyfriend and I have been together now for about 8 months, and I&amp;#39;m so happy with him, and still very in love. We&amp;#39;ve been through a lot together already (family issues), and we both strongly support each other when we need it most. I really, really love him. However, our libidos seem to be contrasting. His is quite low, and mine is very, very- VERY high. I haven&amp;#39;t always been like this though- I left a previous relationship where I would go weeks, sometimes months without wanting to engage in any activities. Now, though, and without fail, I could and want to have him every day, multiple times a day. I know this isn&amp;#39;t necessarily a normal desire, because relationships tend to reach a point of normality after a while, but I really can&amp;#39;t keep my hands off of him. &lt;/p&gt;

&lt;p&gt;Something to consider, which is actually making it much worse for me, is that I&amp;#39;ve recently started taking a medication for depression (non-SSRI) which super charges my libido, even more so from its normal high. &lt;/p&gt;

&lt;p&gt;When I ask him if he&amp;#39;s in the mood, or try to initiate it, he apologizes and explains that he&amp;#39;s just been in a sexual &amp;#39;low&amp;#39; lately, which is completely understanding and I try not to impress any pressure on him, because that wouldn&amp;#39;t be fair and it would be damaging to the relationship. However, every time that happens, I think back to my previous relationship and consider whether or not he&amp;#39;s as attracted to me as I am to him (the main reason my libido was low previously). &lt;/p&gt;

&lt;p&gt;One more piece of information: We do have &amp;#39;fun&amp;#39; about once every 4-7 days, which I&amp;#39;m pretty sure is &amp;#39;normal&amp;#39;, but I want it every day, or at least every-other. It&amp;#39;s hard for me to focus when I&amp;#39;m SO in the mood and he&amp;#39;s laying right there in all of his glory, but he just wants to relax. &lt;/p&gt;

&lt;p&gt;My question is-- are there people out there who are in relationships with someone whose libido is either significantly higher or lower than theirs? How do you make it work? What are some tips you have? Is there a way to safely lower my libido (I don&amp;#39;t want to even try to increase his, because there&amp;#39;s nothing wrong with him and I feel like I&amp;#39;m just too charged)? &lt;/p&gt;

&lt;p&gt;I&amp;#39;d REALLY love to hear from other people in this situation, or with boyfriends who have a much higher libido, and to hear how you make it work. &lt;/p&gt;

&lt;p&gt;Thanks!&lt;/p&gt;
&lt;/div&gt;&lt;!-- SC_ON --&gt;","False","askgaybros","t5_2vgfw","","","Need advice on uneven libidos in relationship","3","http://www.reddit.com/r/askgaybros/comments/2kghy8/need_advice_on_uneven_libidos_in_relationship/","[]","False"
"9","","","{}","http://www.reddit.com/api/info/","{}","{}","False","","","True","Ventura1","","","","False","1414416244.0","1414412644.0","","self.askgaybros","0","False","0","True","False","2kghr2","True","","","","","","{}","[]","t3_2kghr2","17","","False","http://www.reddit.com/r/askgaybros/comments/2kghr2/im_scared_of_him_a_little_bit/","Unauthenticated reddit sesssion","","False","1","","{}","My boyfriend wants to control like every aspect of my life. He isn't really violent or anything. He broke my wrist last month but that was sort of my fault, he grabbed me and I did some crazy ninja moves to try and escape lol was nothing really. I just feel like he has the potential to well I don't know, I don't feel safe with him, I feel like he's just unpredictable. I don't know what to do. He's older than me and he was in the army, so I think that may have messed his head up a bit. Part of me wants to leave, part of me wants to stay and help him, it might not be his fault at all. I mean I am 24 years old, I am not a child. ","&lt;!-- SC_OFF --&gt;&lt;div class=""md""&gt;&lt;p&gt;My boyfriend wants to control like every aspect of my life. He isn&amp;#39;t really violent or anything. He broke my wrist last month but that was sort of my fault, he grabbed me and I did some crazy ninja moves to try and escape lol was nothing really. I just feel like he has the potential to well I don&amp;#39;t know, I don&amp;#39;t feel safe with him, I feel like he&amp;#39;s just unpredictable. I don&amp;#39;t know what to do. He&amp;#39;s older than me and he was in the army, so I think that may have messed his head up a bit. Part of me wants to leave, part of me wants to stay and help him, it might not be his fault at all. I mean I am 24 years old, I am not a child. &lt;/p&gt;
&lt;/div&gt;&lt;!-- SC_ON --&gt;","False","askgaybros","t5_2vgfw","","","I'm scared of him a little bit","1","http://www.reddit.com/r/askgaybros/comments/2kghr2/im_scared_of_him_a_little_bit/","[]","False"
