"","_comment_sort","_comments","_comments_by_id","_info_url","_orphaned","_params","_replaced_more","_underscore_names","approved_by","archived","author","author_flair_css_class","author_flair_text","banned_by","clicked","created","created_utc","distinguished","domain","downs","edited","gilded","has_fetched","hidden","id","is_self","json_dict","likes","link_flair_css_class","link_flair_text","media","media_embed","mod_reports","name","num_comments","num_reports","over_18","permalink","reddit_session","report_reasons","saved","score","secure_media","secure_media_embed","selftext","selftext_html","stickied","subreddit","subreddit_id","suggested_sort","thumbnail","title","ups","url","user_reports","visited"
"22","","","{}","http://www.reddit.com/api/info/","{}","{}","False","","","False","captainstardriver","","","","False","1415586376.0","1415586376.0","","self.askgaybros","0","False","0","True","False","2ltjjk","True","","","","","","{}","[]","t3_2ltjjk","39","","False","http://www.reddit.com/r/askgaybros/comments/2ltjjk/what_about_you_would_someone_find_awesome_andor/","Unauthenticated reddit sesssion","","False","24","","{}","Hey guys, I read a lot of posts on here talking asking ""What is wrong with me?"" / ""Why won't guys talk to me?"" / etc., so I was thinking it might be interesting and positive to get people thinking about what's great about themselves and why other guys would be happy to date them...Someone else go first, please. :)","&lt;!-- SC_OFF --&gt;&lt;div class=""md""&gt;&lt;p&gt;Hey guys, I read a lot of posts on here talking asking &amp;quot;What is wrong with me?&amp;quot; / &amp;quot;Why won&amp;#39;t guys talk to me?&amp;quot; / etc., so I was thinking it might be interesting and positive to get people thinking about what&amp;#39;s great about themselves and why other guys would be happy to date them...Someone else go first, please. :)&lt;/p&gt;
&lt;/div&gt;&lt;!-- SC_ON --&gt;","False","askgaybros","t5_2vgfw","","","What about you would someone find awesome and/or why are you date-able?","24","http://www.reddit.com/r/askgaybros/comments/2ltjjk/what_about_you_would_someone_find_awesome_andor/","[]","False"
"23","","","{}","http://www.reddit.com/api/info/","{}","{}","False","","","False","Dr_Clobber","","","","False","1415581015.0","1415581015.0","","self.askgaybros","0","False","0","True","False","2ltahw","True","","","","","","{}","[]","t3_2ltahw","14","","False","http://www.reddit.com/r/askgaybros/comments/2ltahw/bicurious_straight_guy_here_experimented_with_a/","Unauthenticated reddit sesssion","","False","21","","{}","I'll preface this by saying I'm 23 and never really tested my sexuality or experimented at all. Recently I've felt bi-curious, but really only felt an attraction to ""traps"" or very, very effeminate guys.

My friend is gay and very masculine. We had a bit too much to drink and talked about me being bi-curious. He always found me attractive so I decided we'd fool around a bit.

I really wasn't into it, and couldn't finish/had trouble staying up. I think he took it badly because the next day was very awkward.

I explained to him that I'm pretty sure I'm straight, but I can't help but feel this wrecked our friendship a bit. He knows it was a casual thing, but I feel like he really wanted my first gay experience to be a good one and doesn't feel good enough. I'm not sure how to proceed/talk to him about this.

Thanks guys.","&lt;!-- SC_OFF --&gt;&lt;div class=""md""&gt;&lt;p&gt;I&amp;#39;ll preface this by saying I&amp;#39;m 23 and never really tested my sexuality or experimented at all. Recently I&amp;#39;ve felt bi-curious, but really only felt an attraction to &amp;quot;traps&amp;quot; or very, very effeminate guys.&lt;/p&gt;

&lt;p&gt;My friend is gay and very masculine. We had a bit too much to drink and talked about me being bi-curious. He always found me attractive so I decided we&amp;#39;d fool around a bit.&lt;/p&gt;

&lt;p&gt;I really wasn&amp;#39;t into it, and couldn&amp;#39;t finish/had trouble staying up. I think he took it badly because the next day was very awkward.&lt;/p&gt;

&lt;p&gt;I explained to him that I&amp;#39;m pretty sure I&amp;#39;m straight, but I can&amp;#39;t help but feel this wrecked our friendship a bit. He knows it was a casual thing, but I feel like he really wanted my first gay experience to be a good one and doesn&amp;#39;t feel good enough. I&amp;#39;m not sure how to proceed/talk to him about this.&lt;/p&gt;

&lt;p&gt;Thanks guys.&lt;/p&gt;
&lt;/div&gt;&lt;!-- SC_ON --&gt;","False","askgaybros","t5_2vgfw","","","Bi-curious straight guy here. Experimented with a good friend. Things got weird and I'm not sure how to proceed.","21","http://www.reddit.com/r/askgaybros/comments/2ltahw/bicurious_straight_guy_here_experimented_with_a/","[]","False"
"24","","","{}","http://www.reddit.com/api/info/","{}","{}","False","","","False","Laika_Come_Home","","","","False","1415578972.0","1415578972.0","","self.askgaybros","0","False","0","True","False","2lt77a","True","","","","","","{}","[]","t3_2lt77a","24","","False","http://www.reddit.com/r/askgaybros/comments/2lt77a/im_risking_a_gamble_by_wanting_to_come_out_but_i/","Unauthenticated reddit sesssion","","False","9","","{}","I'm 21, a college student, and still largely in the closet. I know who I am and what I like, but I know my family doesn't approve. My father is, for the time being, my sole means of financial support. My father also spent a good portion of my childhood ""correcting"" certain behaviors or mannerisms of mine because ""only gay people/women do that"", or he ""didn't raise a faggot"". Nothing physical, thankfully, but he would always tell me to stop, and tell me how I *should* do things. 

My mother claims she's my ""best supporter"", but she's a very religious, ""church every Sunday"" type of lady whose close sister (my aunt) is one of the most homophobic people I've ever met (almost to Westboro Baptist Church levels, to give any indication). I don't know how to break the news to her; I *know* she'll have a panic attack.

Most of my friends don't know. ESPECIALLY my friends I grew up with. Thing is, I don't know who to trust, and I have no idea who to go to or what to say.

I feel like, to some degree, I'm still censoring my words or behaviors, in part, due to fear of judgment. And, this is part of why I drink; alcohol sets me free, often times allowing me to be who I want to be.

TL;DR: My life's a mess, and I'm surrendering my problems to drugs because I don't know how to proceed.","&lt;!-- SC_OFF --&gt;&lt;div class=""md""&gt;&lt;p&gt;I&amp;#39;m 21, a college student, and still largely in the closet. I know who I am and what I like, but I know my family doesn&amp;#39;t approve. My father is, for the time being, my sole means of financial support. My father also spent a good portion of my childhood &amp;quot;correcting&amp;quot; certain behaviors or mannerisms of mine because &amp;quot;only gay people/women do that&amp;quot;, or he &amp;quot;didn&amp;#39;t raise a faggot&amp;quot;. Nothing physical, thankfully, but he would always tell me to stop, and tell me how I &lt;em&gt;should&lt;/em&gt; do things. &lt;/p&gt;

&lt;p&gt;My mother claims she&amp;#39;s my &amp;quot;best supporter&amp;quot;, but she&amp;#39;s a very religious, &amp;quot;church every Sunday&amp;quot; type of lady whose close sister (my aunt) is one of the most homophobic people I&amp;#39;ve ever met (almost to Westboro Baptist Church levels, to give any indication). I don&amp;#39;t know how to break the news to her; I &lt;em&gt;know&lt;/em&gt; she&amp;#39;ll have a panic attack.&lt;/p&gt;

&lt;p&gt;Most of my friends don&amp;#39;t know. ESPECIALLY my friends I grew up with. Thing is, I don&amp;#39;t know who to trust, and I have no idea who to go to or what to say.&lt;/p&gt;

&lt;p&gt;I feel like, to some degree, I&amp;#39;m still censoring my words or behaviors, in part, due to fear of judgment. And, this is part of why I drink; alcohol sets me free, often times allowing me to be who I want to be.&lt;/p&gt;

&lt;p&gt;TL;DR: My life&amp;#39;s a mess, and I&amp;#39;m surrendering my problems to drugs because I don&amp;#39;t know how to proceed.&lt;/p&gt;
&lt;/div&gt;&lt;!-- SC_ON --&gt;","False","askgaybros","t5_2vgfw","","","I'm risking a gamble by wanting to come out, but I need to know how. I feel being closeted has me spiraling deeper into alcoholism and depression.","9","http://www.reddit.com/r/askgaybros/comments/2lt77a/im_risking_a_gamble_by_wanting_to_come_out_but_i/","[]","False"
"25","","","{}","http://www.reddit.com/api/info/","{}","{}","False","","","False","superstoney","","","","False","1415578843.0","1415578843.0","","self.askgaybros","0","False","0","True","False","2lt6yo","True","","","","","","{}","[]","t3_2lt6yo","7","","False","http://www.reddit.com/r/askgaybros/comments/2lt6yo/pressure_to_come_out/","Unauthenticated reddit sesssion","","False","1","","{}","Lately I've been feeling a lot of pressure from my friends and others to come out and admit to them that I'm gay/bi. They'll drop small and subtle hints at me insinuating that they know and that they want me to tell them etc. But do I really have to? I feel like it's my decision whether I feel comfortable around you enough to share that kind of information. I never ask them about their sexual exploits for the very reason that I like to keep mine private. Also to be fair, I feel like I shouldn't ever have to ""come out"". None of my friends ever admitted to me like 'hey superstoney, just to let you know I love fucking pussy' so why should I have to do the same. It all seems so ridiculous but I feel like its getting to a point where people are starting to distance themselves from me because of it. I guess mostly I just wanted to rant..so yeah.
tl;dr: Do I seriously have to make an announcement just because others might be uncomfortable with my personal choices?","&lt;!-- SC_OFF --&gt;&lt;div class=""md""&gt;&lt;p&gt;Lately I&amp;#39;ve been feeling a lot of pressure from my friends and others to come out and admit to them that I&amp;#39;m gay/bi. They&amp;#39;ll drop small and subtle hints at me insinuating that they know and that they want me to tell them etc. But do I really have to? I feel like it&amp;#39;s my decision whether I feel comfortable around you enough to share that kind of information. I never ask them about their sexual exploits for the very reason that I like to keep mine private. Also to be fair, I feel like I shouldn&amp;#39;t ever have to &amp;quot;come out&amp;quot;. None of my friends ever admitted to me like &amp;#39;hey superstoney, just to let you know I love fucking pussy&amp;#39; so why should I have to do the same. It all seems so ridiculous but I feel like its getting to a point where people are starting to distance themselves from me because of it. I guess mostly I just wanted to rant..so yeah.
tl;dr: Do I seriously have to make an announcement just because others might be uncomfortable with my personal choices?&lt;/p&gt;
&lt;/div&gt;&lt;!-- SC_ON --&gt;","False","askgaybros","t5_2vgfw","","","Pressure to come out","1","http://www.reddit.com/r/askgaybros/comments/2lt6yo/pressure_to_come_out/","[]","False"
"26","","","{}","http://www.reddit.com/api/info/","{}","{}","False","","","False","iamathrowaway161","","","","False","1415574143.0","1415574143.0","","self.askgaybros","0","False","0","True","False","2lsyij","True","","","","","","{}","[]","t3_2lsyij","10","","False","http://www.reddit.com/r/askgaybros/comments/2lsyij/thinking_about_coming_out_to_my_mom_should_i_tell/","Unauthenticated reddit sesssion","","False","2","","{}","","","False","askgaybros","t5_2vgfw","","","Thinking about coming out to my mom. Should I tell her i'm bi or just say i'm gay to make it a bit easier.","2","http://www.reddit.com/r/askgaybros/comments/2lsyij/thinking_about_coming_out_to_my_mom_should_i_tell/","[]","False"
"27","","","{}","http://www.reddit.com/api/info/","{}","{}","False","","","False","Spazayd","","","","False","1415571730.0","1415571730.0","","self.askgaybros","0","False","0","True","False","2lstws","True","","","","","","{}","[]","t3_2lstws","11","","False","http://www.reddit.com/r/askgaybros/comments/2lstws/long_distance/","Unauthenticated reddit sesssion","","False","2","","{}","This is more of a rant, hoping for maybe a little advice.

So long story short, I met a guy from out of state. We both have pretty strong feelings for one another. We wanted to try and build something long distance.

It's been about a month and he suddenly got quiet. I made sure I wasn't being annoying and texting/snapping too much. He said it wasn't me and he ""just gets real quiet sometimes, as weird as it sounds."" However, he apparently has time to chat up with guys on Grindr. We said we weren't going to tie each other down right now, as it wasn't fair to either of us, as long as we were honest. The only reason I know he was on there was cause the little green bubble that pops up on their profile when they are online. 
*I saved his messages, that's why I can still see it although hes like 1000+ miles away.* 

Anyways in the same conversation about his quietness, he also said he would never do anything to hurt me. Its not the fact that he's on Grindr that's hurting me, its the fact that he didn't bother to text me back during that conversation, or hasn't sent a single snap, which he used to do a lot, but he has time to talk to guys on Grindr. 

I don't know what I should do. Its been since 10am est yesterday since any form of conversation has been made. He talks like he cares, and in fact says he cares, but he isn't acting like it. 

**TLDR** Long Distance guy suddenly goes quite. Says he cares but doesn't act like it. Hasn't made any effort to talk.","&lt;!-- SC_OFF --&gt;&lt;div class=""md""&gt;&lt;p&gt;This is more of a rant, hoping for maybe a little advice.&lt;/p&gt;

&lt;p&gt;So long story short, I met a guy from out of state. We both have pretty strong feelings for one another. We wanted to try and build something long distance.&lt;/p&gt;

&lt;p&gt;It&amp;#39;s been about a month and he suddenly got quiet. I made sure I wasn&amp;#39;t being annoying and texting/snapping too much. He said it wasn&amp;#39;t me and he &amp;quot;just gets real quiet sometimes, as weird as it sounds.&amp;quot; However, he apparently has time to chat up with guys on Grindr. We said we weren&amp;#39;t going to tie each other down right now, as it wasn&amp;#39;t fair to either of us, as long as we were honest. The only reason I know he was on there was cause the little green bubble that pops up on their profile when they are online. 
&lt;em&gt;I saved his messages, that&amp;#39;s why I can still see it although hes like 1000+ miles away.&lt;/em&gt; &lt;/p&gt;

&lt;p&gt;Anyways in the same conversation about his quietness, he also said he would never do anything to hurt me. Its not the fact that he&amp;#39;s on Grindr that&amp;#39;s hurting me, its the fact that he didn&amp;#39;t bother to text me back during that conversation, or hasn&amp;#39;t sent a single snap, which he used to do a lot, but he has time to talk to guys on Grindr. &lt;/p&gt;

&lt;p&gt;I don&amp;#39;t know what I should do. Its been since 10am est yesterday since any form of conversation has been made. He talks like he cares, and in fact says he cares, but he isn&amp;#39;t acting like it. &lt;/p&gt;

&lt;p&gt;&lt;strong&gt;TLDR&lt;/strong&gt; Long Distance guy suddenly goes quite. Says he cares but doesn&amp;#39;t act like it. Hasn&amp;#39;t made any effort to talk.&lt;/p&gt;
&lt;/div&gt;&lt;!-- SC_ON --&gt;","False","askgaybros","t5_2vgfw","","","Long Distance","2","http://www.reddit.com/r/askgaybros/comments/2lstws/long_distance/","[]","False"
"28","","","{}","http://www.reddit.com/api/info/","{}","{}","False","","","False","CalebUT","","","","False","1415570647.0","1415570647.0","","self.askgaybros","0","False","0","True","False","2lsrt1","True","","","","","","{}","[]","t3_2lsrt1","188","","False","http://www.reddit.com/r/askgaybros/comments/2lsrt1/i_told_my_dad_i_was_gay_he_said_when_youre_18/","Unauthenticated reddit sesssion","","False","193","","{}","I am 18 in a month. I’m frightened. I was supposed to be at college, my dad wouldn’t pay after I told him. I am so stupid if I hadn’t said anything I would be away from here by now. What can I do???? ","&lt;!-- SC_OFF --&gt;&lt;div class=""md""&gt;&lt;p&gt;I am 18 in a month. I’m frightened. I was supposed to be at college, my dad wouldn’t pay after I told him. I am so stupid if I hadn’t said anything I would be away from here by now. What can I do???? &lt;/p&gt;
&lt;/div&gt;&lt;!-- SC_ON --&gt;","False","askgaybros","t5_2vgfw","","","I told my dad I was gay, he said “when you’re 18 you’re out of here” I have nowhere to go","193","http://www.reddit.com/r/askgaybros/comments/2lsrt1/i_told_my_dad_i_was_gay_he_said_when_youre_18/","[]","False"
"29","","","{}","http://www.reddit.com/api/info/","{}","{}","False","","","False","GloriousSunrise","","","","False","1415569979.0","1415569979.0","","bloomberg.com","0","False","0","True","False","2lsqky","False","","","","","","{}","[]","t3_2lsqky","3","","False","http://www.reddit.com/r/askgaybros/comments/2lsqky/young_republican_guy_thinking_about_obama/","Unauthenticated reddit sesssion","","False","0","","{}","","","False","askgaybros","t5_2vgfw","","","Young Republican guy thinking about Obama","0","http://www.bloomberg.com/apps/data?pid=avimage&amp;iid=iyIfKoYK8rPA","[]","False"
"30","","","{}","http://www.reddit.com/api/info/","{}","{}","False","","","False","invisiblebastard","","","","False","1415564827.0","1415564827.0","","self.askgaybros","0","False","0","True","False","2lshhf","True","","","","","","{}","[]","t3_2lshhf","12","","False","http://www.reddit.com/r/askgaybros/comments/2lshhf/is_it_possible_to_enjoy_to_the_power_dynamic_in/","Unauthenticated reddit sesssion","","False","0","","{}","Perhaps I should start off by disclaiming that I have only ever watched same-sex porn. More accurately, I have only ever watched lesbian porn since I started watching porn.  Heterosexual porn does nothing for me even though this is the only sex I partake in.    

A few times, I have had internal debates with myself over if I might bisexual or even gay, and I've approached these internal debates with the possibility and acceptance that I might actually be. I do not think I am gay, and I do not believe I am in denial over it.  I can look at another man and understand what makes him attractive in our society.

I believe all this started when I had a gay roommate once upon a time, and I came home when he was having sex with his SO, and they left their bedroom door open.

To jump to something else, I think I'd be open to pegging, but I am not really interested in having sex with another man. 

If you guys have insight to give me, I'd appreciate it.  

 

","&lt;!-- SC_OFF --&gt;&lt;div class=""md""&gt;&lt;p&gt;Perhaps I should start off by disclaiming that I have only ever watched same-sex porn. More accurately, I have only ever watched lesbian porn since I started watching porn.  Heterosexual porn does nothing for me even though this is the only sex I partake in.    &lt;/p&gt;

&lt;p&gt;A few times, I have had internal debates with myself over if I might bisexual or even gay, and I&amp;#39;ve approached these internal debates with the possibility and acceptance that I might actually be. I do not think I am gay, and I do not believe I am in denial over it.  I can look at another man and understand what makes him attractive in our society.&lt;/p&gt;

&lt;p&gt;I believe all this started when I had a gay roommate once upon a time, and I came home when he was having sex with his SO, and they left their bedroom door open.&lt;/p&gt;

&lt;p&gt;To jump to something else, I think I&amp;#39;d be open to pegging, but I am not really interested in having sex with another man. &lt;/p&gt;

&lt;p&gt;If you guys have insight to give me, I&amp;#39;d appreciate it.  &lt;/p&gt;
&lt;/div&gt;&lt;!-- SC_ON --&gt;","False","askgaybros","t5_2vgfw","","","Is it possible to enjoy to the power dynamic in gay porn as a straight male, and not actually be gay?","0","http://www.reddit.com/r/askgaybros/comments/2lshhf/is_it_possible_to_enjoy_to_the_power_dynamic_in/","[]","False"
"31","","","{}","http://www.reddit.com/api/info/","{}","{}","False","","","False","throw_away_541","","","","False","1415564077.0","1415564077.0","","self.askgaybros","0","False","0","True","False","2lsg6l","True","","","","","","{}","[]","t3_2lsg6l","3","","False","http://www.reddit.com/r/askgaybros/comments/2lsg6l/need_advice_for_a_friend_being_harrassed_xpost/","Unauthenticated reddit sesssion","","False","5","","{}","So a friend of mine from Canada (we'll call him Jerry) had just told some freeloader to get out of his house since he was past due on rent for going on two months (let's call him Tom). What happened after, still astonishes me.

So Tom decided to tell his whole family that Jerry had raped him and that started a whole line of crap. Tom kept sending him threatening texts on his life, on telling him that he should die. Threatening to get a bunch of people to come and hurt him. It got to the point where Jerry had to call the police and ended up getting escorted to the police station to file a report.

Come a week later, Jerry is still getting these harassing text messages and even worse, his sexual assaulter from a few years ago is now messaging him because of Tom; apparently sending photos of that traumatic event to him. He hasn't reported that yet because he doesn't think he's strong enough to relive that event again...Now, assaulter and Tom are both threatening to do things to him.

It sounds like a crazy story, but it's completely true. What should he do now? There hasn't been any real action from the police as far as I know. Any advice is welcome.

TL;DR: Friend is being threatened by guy that was kicked out and sexual assaulter. Police were notified, but it's considered a ""non-emergency"" because they are only threats.
**Update: He changed all his locks and applied for a protection order. He also has been in contact with the officer on his case and was told it has been sent to the crown counsel. And yes, Jerry is gay**


[Link to original](http://www.reddit.com/r/Advice/comments/2lqh81/need_advice_for_a_friend_being_harrassed/)

Edit: Formatting","&lt;!-- SC_OFF --&gt;&lt;div class=""md""&gt;&lt;p&gt;So a friend of mine from Canada (we&amp;#39;ll call him Jerry) had just told some freeloader to get out of his house since he was past due on rent for going on two months (let&amp;#39;s call him Tom). What happened after, still astonishes me.&lt;/p&gt;

&lt;p&gt;So Tom decided to tell his whole family that Jerry had raped him and that started a whole line of crap. Tom kept sending him threatening texts on his life, on telling him that he should die. Threatening to get a bunch of people to come and hurt him. It got to the point where Jerry had to call the police and ended up getting escorted to the police station to file a report.&lt;/p&gt;

&lt;p&gt;Come a week later, Jerry is still getting these harassing text messages and even worse, his sexual assaulter from a few years ago is now messaging him because of Tom; apparently sending photos of that traumatic event to him. He hasn&amp;#39;t reported that yet because he doesn&amp;#39;t think he&amp;#39;s strong enough to relive that event again...Now, assaulter and Tom are both threatening to do things to him.&lt;/p&gt;

&lt;p&gt;It sounds like a crazy story, but it&amp;#39;s completely true. What should he do now? There hasn&amp;#39;t been any real action from the police as far as I know. Any advice is welcome.&lt;/p&gt;

&lt;p&gt;TL;DR: Friend is being threatened by guy that was kicked out and sexual assaulter. Police were notified, but it&amp;#39;s considered a &amp;quot;non-emergency&amp;quot; because they are only threats.
&lt;strong&gt;Update: He changed all his locks and applied for a protection order. He also has been in contact with the officer on his case and was told it has been sent to the crown counsel. And yes, Jerry is gay&lt;/strong&gt;&lt;/p&gt;

&lt;p&gt;&lt;a href=""http://www.reddit.com/r/Advice/comments/2lqh81/need_advice_for_a_friend_being_harrassed/""&gt;Link to original&lt;/a&gt;&lt;/p&gt;

&lt;p&gt;Edit: Formatting&lt;/p&gt;
&lt;/div&gt;&lt;!-- SC_ON --&gt;","False","askgaybros","t5_2vgfw","","","Need advice for a friend being harrassed... (X-post from /r/Advice)","5","http://www.reddit.com/r/askgaybros/comments/2lsg6l/need_advice_for_a_friend_being_harrassed_xpost/","[]","False"
