"","_comment_sort","_comments","_comments_by_id","_info_url","_orphaned","_params","_replaced_more","_underscore_names","approved_by","archived","author","author_flair_css_class","author_flair_text","banned_by","clicked","created","created_utc","distinguished","domain","downs","edited","gilded","has_fetched","hidden","id","is_self","json_dict","likes","link_flair_css_class","link_flair_text","media","media_embed","mod_reports","name","num_comments","num_reports","over_18","permalink","reddit_session","report_reasons","saved","score","secure_media","secure_media_embed","selftext","selftext_html","stickied","subreddit","subreddit_id","suggested_sort","thumbnail","title","ups","url","user_reports","visited"
"0","","","{}","http://www.reddit.com/api/info/","{}","{}","False","","","True","curiousdo","","","","False","1402833525.0","1402829925.0","","self.askgaybros","0","False","0","True","False","2870wr","True","","","","","","{}","[]","t3_2870wr","6","","False","http://www.reddit.com/r/askgaybros/comments/2870wr/straight_curious_looking_for_advice/","Unauthenticated reddit sesssion","","False","2","","{}","I've never done anything remotely sexual with a guy. Today I wanked off to gay porn; I'd watched gay porn before for a rare minute once in a while but had been consistently turned off and had gone back to straight porn almost immediately, but today I was turned off by straight porn! My homosexual interest has been developing over the years. I'm 25. What is more likely: 1. I'm gay 2. I'm bi...? Also, I just got Grindr and I'm planning to hook up in the near future. I'd appreciate any advice on: 1. how to make sure i find the right guy for a great first experience 2. things to consider/do before/during my first gay encounter","&lt;!-- SC_OFF --&gt;&lt;div class=""md""&gt;&lt;p&gt;I&amp;#39;ve never done anything remotely sexual with a guy. Today I wanked off to gay porn; I&amp;#39;d watched gay porn before for a rare minute once in a while but had been consistently turned off and had gone back to straight porn almost immediately, but today I was turned off by straight porn! My homosexual interest has been developing over the years. I&amp;#39;m 25. What is more likely: 1. I&amp;#39;m gay 2. I&amp;#39;m bi...? Also, I just got Grindr and I&amp;#39;m planning to hook up in the near future. I&amp;#39;d appreciate any advice on: 1. how to make sure i find the right guy for a great first experience 2. things to consider/do before/during my first gay encounter&lt;/p&gt;
&lt;/div&gt;&lt;!-- SC_ON --&gt;","False","askgaybros","t5_2vgfw","","","straight, curious, looking for advice","2","http://www.reddit.com/r/askgaybros/comments/2870wr/straight_curious_looking_for_advice/","[]","False"
"1","","","{}","http://www.reddit.com/api/info/","{}","{}","False","","","True","jayhow90","","","","False","1402810597.0","1402806997.0","","self.askgaybros","0","False","0","True","False","286ju9","True","","","","","","{}","[]","t3_286ju9","10","","False","http://www.reddit.com/r/askgaybros/comments/286ju9/people_collecting_your_pics_on_apps_and_blocking/","Unauthenticated reddit sesssion","","False","2","","{}","So you're talking to a guy, exchanging pics and they keep asking for more pics of cock/ass then block you when you've sent them.

OR you start talking dirty and they seem keen to hook up and then they block you after agreeing to come over.

I'm paranoid it's someone I know trying to embarrass me/collecting pictures to post online :(

Why do people do this? Does it happen to you guys too?","&lt;!-- SC_OFF --&gt;&lt;div class=""md""&gt;&lt;p&gt;So you&amp;#39;re talking to a guy, exchanging pics and they keep asking for more pics of cock/ass then block you when you&amp;#39;ve sent them.&lt;/p&gt;

&lt;p&gt;OR you start talking dirty and they seem keen to hook up and then they block you after agreeing to come over.&lt;/p&gt;

&lt;p&gt;I&amp;#39;m paranoid it&amp;#39;s someone I know trying to embarrass me/collecting pictures to post online :(&lt;/p&gt;

&lt;p&gt;Why do people do this? Does it happen to you guys too?&lt;/p&gt;
&lt;/div&gt;&lt;!-- SC_ON --&gt;","False","askgaybros","t5_2vgfw","","","People collecting your pics on apps and blocking you, why do they do this? Help?","2","http://www.reddit.com/r/askgaybros/comments/286ju9/people_collecting_your_pics_on_apps_and_blocking/","[]","False"
"2","","","{}","http://www.reddit.com/api/info/","{}","{}","False","","","True","bigballs90","","","","False","1402809410.0","1402805810.0","","self.askgaybros","0","False","0","True","False","286ihb","True","","","","","","{}","[]","t3_286ihb","12","","False","http://www.reddit.com/r/askgaybros/comments/286ihb/do_you_guys_find_big_balls_a_turn_off/","Unauthenticated reddit sesssion","","False","2","","{}","Hey,

So I have been told by nearly every guy that I have been with that I have big balls. I am pretty self conscious about it but guess I am used to it but wasn't sure how big the average size of them was until I got with other guys. I find that I am generally quite a bit bigger than other guys so I am usually paranoid about it. Do you guys like a guy with big balls or prefer just a smaller size. To make it worse my cock isn't big or anything. Just average/small at 5.5 inches. ","&lt;!-- SC_OFF --&gt;&lt;div class=""md""&gt;&lt;p&gt;Hey,&lt;/p&gt;

&lt;p&gt;So I have been told by nearly every guy that I have been with that I have big balls. I am pretty self conscious about it but guess I am used to it but wasn&amp;#39;t sure how big the average size of them was until I got with other guys. I find that I am generally quite a bit bigger than other guys so I am usually paranoid about it. Do you guys like a guy with big balls or prefer just a smaller size. To make it worse my cock isn&amp;#39;t big or anything. Just average/small at 5.5 inches. &lt;/p&gt;
&lt;/div&gt;&lt;!-- SC_ON --&gt;","False","askgaybros","t5_2vgfw","","","Do you guys find big balls a turn off?","2","http://www.reddit.com/r/askgaybros/comments/286ihb/do_you_guys_find_big_balls_a_turn_off/","[]","False"
"3","","","{}","http://www.reddit.com/api/info/","{}","{}","False","","","True","kat_arina","","","","False","1402803031.0","1402799431.0","","self.askgaybros","0","False","0","True","False","286b0h","True","","","","","","{}","[]","t3_286b0h","24","","False","http://www.reddit.com/r/askgaybros/comments/286b0h/confused_about_my_sexuality_i_love_giving/","Unauthenticated reddit sesssion","","False","11","","{}","So in highschool I experimented with a good friend of mine. 

We blew each other while watching porn and it was great, it didn't affect our friendship nor did it change anything.

We would just hang out as per usual, and when we were alone we would blow each other. It was amazing, thinking about it gets me hard.

Now the thing is that friend moved to a different country and I have no one.

I love giving and getting blowjobs but I'm not attracted to men.

The idea of sucking dick, having a warm load shot into my mouth is the second hottest thing I can think of. But I don't like dudes.


So I've been watching a lot of shemale porn which is great but I still physically WANT it.


---


As a solution I've looked at online websites like craigslist for a hookup, but everytime I see pics of those dudes I'm not attracted to them, I'm repulsed even.

So idk, there is is.

In my years I've learned that sexuality is not black and white, and I don't care about titles such as bi-sexual or gay or straight.

I just want a cock in my mouth.

I don't know how to go about doing this, I mean how to you experience guys hook up?","&lt;!-- SC_OFF --&gt;&lt;div class=""md""&gt;&lt;p&gt;So in highschool I experimented with a good friend of mine. &lt;/p&gt;

&lt;p&gt;We blew each other while watching porn and it was great, it didn&amp;#39;t affect our friendship nor did it change anything.&lt;/p&gt;

&lt;p&gt;We would just hang out as per usual, and when we were alone we would blow each other. It was amazing, thinking about it gets me hard.&lt;/p&gt;

&lt;p&gt;Now the thing is that friend moved to a different country and I have no one.&lt;/p&gt;

&lt;p&gt;I love giving and getting blowjobs but I&amp;#39;m not attracted to men.&lt;/p&gt;

&lt;p&gt;The idea of sucking dick, having a warm load shot into my mouth is the second hottest thing I can think of. But I don&amp;#39;t like dudes.&lt;/p&gt;

&lt;p&gt;So I&amp;#39;ve been watching a lot of shemale porn which is great but I still physically WANT it.&lt;/p&gt;

&lt;hr/&gt;

&lt;p&gt;As a solution I&amp;#39;ve looked at online websites like craigslist for a hookup, but everytime I see pics of those dudes I&amp;#39;m not attracted to them, I&amp;#39;m repulsed even.&lt;/p&gt;

&lt;p&gt;So idk, there is is.&lt;/p&gt;

&lt;p&gt;In my years I&amp;#39;ve learned that sexuality is not black and white, and I don&amp;#39;t care about titles such as bi-sexual or gay or straight.&lt;/p&gt;

&lt;p&gt;I just want a cock in my mouth.&lt;/p&gt;

&lt;p&gt;I don&amp;#39;t know how to go about doing this, I mean how to you experience guys hook up?&lt;/p&gt;
&lt;/div&gt;&lt;!-- SC_ON --&gt;","False","askgaybros","t5_2vgfw","","","Confused about my sexuality. I love giving blowjobs, but I'm not attracted to men.","11","http://www.reddit.com/r/askgaybros/comments/286b0h/confused_about_my_sexuality_i_love_giving/","[]","False"
"4","","","{}","http://www.reddit.com/api/info/","{}","{}","False","","","True","Bi_Zephyr","","","","False","1402798952.0","1402795352.0","","self.askgaybros","0","1402795612.0","0","True","False","2866e1","True","","","","","","{}","[]","t3_2866e1","24","","False","http://www.reddit.com/r/askgaybros/comments/2866e1/first_same_sex_relationship/","Unauthenticated reddit sesssion","","False","43","","{}","Hey gaybros! I'm a bibro and this is my first post, but I've been lurking for about 2 months. I have 4 questions in this post. 

Okay, so my mind is racing, but I guess I'll start with some background information. I (Zephyr) am 21 and I've had sexual encounters with both sexes before, but I've only been in relationships with women until now. When I began perusing gaybros I thought I was physically attracted to both sexes, but only romantically attracted to women. Because of the amazing stories I read on gaybros and the fact that my last two relationships were disasters, I decided that I would open myself up to the possibilities of relationships with men. About my last two relationships: in the first I was drugged with Xanax and raped while blackout. In the second I received HPV from my girlfriend, although she was unaware she had the virus because she wasn't showing symptoms. Both fell apart shortly after. 

Anyway, I'm in my home state for the summer until school starts again and I get on Grindr, Jack'd, Scruff and Adam4Adam and changed my profiles to indicate that I was interested in dating and a possible long term relationship instead of the typical hookups. It doesn't take long before I'm talking to a guy we'll call B. He's 19, gay, and I met him on Adam4Adam of all places. We start texting for about a week and we're getting along great. I had no particular goal in mind and I learn that he works on a farm near by hometown and knows how to weld. That sounds intriguing and I ask B if he would be able to teach me. He finds that enthralling, his words, and we really start to hit it off. 

Our first meetup falls through because I get called into work at the last minute, but we continue to text. Shortly after this I confess to him that I have HPV and I tell B it's alright if he doesn't want to meet me or hangout. He says, ""please don't think I'm so shallow that I wouldn't talk to or date someone just because of an STD"". Mind. Blown. So we plan a second meetup at an A&amp;W. This one goes perfectly and afterwards we drive down some backroads in my truck and he shows me all his family's properties and farmland. At this point I would like to point out that we're both closeted because we live in small, rural, conservative towns. He directs me to a secluded spot off the roads and we park there and talk for about an hour. I'm playing music the whole time and telling him about the music festivals I attend and we slowly move closer to each other until I have my arm around him. I start telling him about one of my favorite artists, Above &amp; Beyond, and that their live shows always bring me to tears. Above &amp; Beyond communicate to the crowd by typing messages on their screen and I tell B about the time they display the quote, ""You can't measure love with distance"". This quote gets to me because of how often I travel, but without missing a beat or letting me finish the story he says, ""that's because you measure love with this"" and he kisses me deeply. We stop, stare at each other, and then proceed to spend the next three hours holding each other, cuddling, making out and talking. 

We plan a trip for 4 days later to see a theatre performance of Les Miserable in Canada, which is about 45 minutes from where we live. During the performance we hold hands and B leans on my shoulder. We hang out in Canada a bit afterwards until we head back over the border to our hotel. We get there and almost immediately we're all over each other. We planned on taking a shower together but it takes 45 minutes because every time we got off the bed to get in there we'd start making out and fall back on the bed. Eventually we get to the shower by making out and walking there at the same time. We spend the next 3 hours in a sexual marathon (with protection) in and out of the shower. I bottomed for the first time, I'd only topped when I hooked up, and we flip for each other. We're talking the whole time and it feels incredibly comfortable and natural. Eventually we fall asleep tangled in each others limbs. We wake up, eat the continental breakfast, come back and spoon and sleep more for a few hours. It was magic and after we wake up we agree that we want to be in an exclusive committed relationship. That was yesterday. 

Now that I have that off my chest, I have some fears that I'm hoping you gaybros can assuage. 

1. B's family is hyper religious and he's waiting to come out to them until he's financially independent. I, on the other hand, could come out to my parents and although it would initially be awkward, I could immediately start bringing B over and introduce him to my family. The thing is, I don't feel ready. Before Gaybros I thought I would stay closeted forever. This experience has nudged me even closer to coming out, but I'm not there yet. The only way we can meet in private is hotels and we can't afford that often. Am I being selfish?

2. B is going to get vaccinated for HPV, but the process takes some time and in the mean time we plan on using protection and being as safe as possible. He said that he wants to do everything he can to prevent himself from receiving HPV, but says he would be okay with getting it if that happened. This really bothered me. I want him to be happy and I don't want to feel responsible for inflicting a disease on B. Do you guys have any advice about this?

3. We have all summer to be together, but come fall I have to return to my school that is a 19 hour drive away. We've already discussed this and we want to make things work despite the distance. I'll be back every holiday and maybe once or twice besides if I can get the money together for plane tickets. I've never been in a long distance and I was wondering if you guys had any advice how to make it work? Am I being Naive? 

4. Finally, do you guys have any tips in general about being in a same sex relationship? In a lot of ways it's similar to being in a relationship with a women, but it's different in others. So far the relationship with B feels remarkably free because I don't feel any gender expectations to be masculine. I feel more free to be myself and I don't feel I need to fit myself into society's mold of what a man in a relationship should be. 

Thanks for reading this long winded post gaybros! I appreciate any answers or help you can give me!","&lt;!-- SC_OFF --&gt;&lt;div class=""md""&gt;&lt;p&gt;Hey gaybros! I&amp;#39;m a bibro and this is my first post, but I&amp;#39;ve been lurking for about 2 months. I have 4 questions in this post. &lt;/p&gt;

&lt;p&gt;Okay, so my mind is racing, but I guess I&amp;#39;ll start with some background information. I (Zephyr) am 21 and I&amp;#39;ve had sexual encounters with both sexes before, but I&amp;#39;ve only been in relationships with women until now. When I began perusing gaybros I thought I was physically attracted to both sexes, but only romantically attracted to women. Because of the amazing stories I read on gaybros and the fact that my last two relationships were disasters, I decided that I would open myself up to the possibilities of relationships with men. About my last two relationships: in the first I was drugged with Xanax and raped while blackout. In the second I received HPV from my girlfriend, although she was unaware she had the virus because she wasn&amp;#39;t showing symptoms. Both fell apart shortly after. &lt;/p&gt;

&lt;p&gt;Anyway, I&amp;#39;m in my home state for the summer until school starts again and I get on Grindr, Jack&amp;#39;d, Scruff and Adam4Adam and changed my profiles to indicate that I was interested in dating and a possible long term relationship instead of the typical hookups. It doesn&amp;#39;t take long before I&amp;#39;m talking to a guy we&amp;#39;ll call B. He&amp;#39;s 19, gay, and I met him on Adam4Adam of all places. We start texting for about a week and we&amp;#39;re getting along great. I had no particular goal in mind and I learn that he works on a farm near by hometown and knows how to weld. That sounds intriguing and I ask B if he would be able to teach me. He finds that enthralling, his words, and we really start to hit it off. &lt;/p&gt;

&lt;p&gt;Our first meetup falls through because I get called into work at the last minute, but we continue to text. Shortly after this I confess to him that I have HPV and I tell B it&amp;#39;s alright if he doesn&amp;#39;t want to meet me or hangout. He says, &amp;quot;please don&amp;#39;t think I&amp;#39;m so shallow that I wouldn&amp;#39;t talk to or date someone just because of an STD&amp;quot;. Mind. Blown. So we plan a second meetup at an A&amp;amp;W. This one goes perfectly and afterwards we drive down some backroads in my truck and he shows me all his family&amp;#39;s properties and farmland. At this point I would like to point out that we&amp;#39;re both closeted because we live in small, rural, conservative towns. He directs me to a secluded spot off the roads and we park there and talk for about an hour. I&amp;#39;m playing music the whole time and telling him about the music festivals I attend and we slowly move closer to each other until I have my arm around him. I start telling him about one of my favorite artists, Above &amp;amp; Beyond, and that their live shows always bring me to tears. Above &amp;amp; Beyond communicate to the crowd by typing messages on their screen and I tell B about the time they display the quote, &amp;quot;You can&amp;#39;t measure love with distance&amp;quot;. This quote gets to me because of how often I travel, but without missing a beat or letting me finish the story he says, &amp;quot;that&amp;#39;s because you measure love with this&amp;quot; and he kisses me deeply. We stop, stare at each other, and then proceed to spend the next three hours holding each other, cuddling, making out and talking. &lt;/p&gt;

&lt;p&gt;We plan a trip for 4 days later to see a theatre performance of Les Miserable in Canada, which is about 45 minutes from where we live. During the performance we hold hands and B leans on my shoulder. We hang out in Canada a bit afterwards until we head back over the border to our hotel. We get there and almost immediately we&amp;#39;re all over each other. We planned on taking a shower together but it takes 45 minutes because every time we got off the bed to get in there we&amp;#39;d start making out and fall back on the bed. Eventually we get to the shower by making out and walking there at the same time. We spend the next 3 hours in a sexual marathon (with protection) in and out of the shower. I bottomed for the first time, I&amp;#39;d only topped when I hooked up, and we flip for each other. We&amp;#39;re talking the whole time and it feels incredibly comfortable and natural. Eventually we fall asleep tangled in each others limbs. We wake up, eat the continental breakfast, come back and spoon and sleep more for a few hours. It was magic and after we wake up we agree that we want to be in an exclusive committed relationship. That was yesterday. &lt;/p&gt;

&lt;p&gt;Now that I have that off my chest, I have some fears that I&amp;#39;m hoping you gaybros can assuage. &lt;/p&gt;

&lt;ol&gt;
&lt;li&gt;&lt;p&gt;B&amp;#39;s family is hyper religious and he&amp;#39;s waiting to come out to them until he&amp;#39;s financially independent. I, on the other hand, could come out to my parents and although it would initially be awkward, I could immediately start bringing B over and introduce him to my family. The thing is, I don&amp;#39;t feel ready. Before Gaybros I thought I would stay closeted forever. This experience has nudged me even closer to coming out, but I&amp;#39;m not there yet. The only way we can meet in private is hotels and we can&amp;#39;t afford that often. Am I being selfish?&lt;/p&gt;&lt;/li&gt;
&lt;li&gt;&lt;p&gt;B is going to get vaccinated for HPV, but the process takes some time and in the mean time we plan on using protection and being as safe as possible. He said that he wants to do everything he can to prevent himself from receiving HPV, but says he would be okay with getting it if that happened. This really bothered me. I want him to be happy and I don&amp;#39;t want to feel responsible for inflicting a disease on B. Do you guys have any advice about this?&lt;/p&gt;&lt;/li&gt;
&lt;li&gt;&lt;p&gt;We have all summer to be together, but come fall I have to return to my school that is a 19 hour drive away. We&amp;#39;ve already discussed this and we want to make things work despite the distance. I&amp;#39;ll be back every holiday and maybe once or twice besides if I can get the money together for plane tickets. I&amp;#39;ve never been in a long distance and I was wondering if you guys had any advice how to make it work? Am I being Naive? &lt;/p&gt;&lt;/li&gt;
&lt;li&gt;&lt;p&gt;Finally, do you guys have any tips in general about being in a same sex relationship? In a lot of ways it&amp;#39;s similar to being in a relationship with a women, but it&amp;#39;s different in others. So far the relationship with B feels remarkably free because I don&amp;#39;t feel any gender expectations to be masculine. I feel more free to be myself and I don&amp;#39;t feel I need to fit myself into society&amp;#39;s mold of what a man in a relationship should be. &lt;/p&gt;&lt;/li&gt;
&lt;/ol&gt;

&lt;p&gt;Thanks for reading this long winded post gaybros! I appreciate any answers or help you can give me!&lt;/p&gt;
&lt;/div&gt;&lt;!-- SC_ON --&gt;","False","askgaybros","t5_2vgfw","","","First same sex relationship","43","http://www.reddit.com/r/askgaybros/comments/2866e1/first_same_sex_relationship/","[]","False"
"5","","","{}","http://www.reddit.com/api/info/","{}","{}","False","","","True","iamanonymousthrow","","","","False","1402796117.0","1402792517.0","","self.askgaybros","0","1402818484.0","0","True","False","2862se","True","","","","","","{}","[]","t3_2862se","15","","False","http://www.reddit.com/r/askgaybros/comments/2862se/mom_talking_to_exgay_therapy_groups/","Unauthenticated reddit sesssion","","False","24","","{}","So I came out earlier this year to my parents.  My father seems to be okay with it but my mom, who I haven't seen since I came out, seems to be researching ex-Gay therapy.  Anyone have experience dealing with a parent who can only see their son being gay as some kind of mental problem.  It so saddens me and I don't know exactly how to deal with it.

Edit: I live out of the house at college and have enough money to be financially independent if I needed to.  That said I don't think she will ever force me into therapy even if she had the legal ability to do so.  I think I just got scared a little bit of how she can possibly see this type of thing as anything more than crazy scientifically inaccurate bullshit.  People scare me sometimes, even people I love like my mother.
","&lt;!-- SC_OFF --&gt;&lt;div class=""md""&gt;&lt;p&gt;So I came out earlier this year to my parents.  My father seems to be okay with it but my mom, who I haven&amp;#39;t seen since I came out, seems to be researching ex-Gay therapy.  Anyone have experience dealing with a parent who can only see their son being gay as some kind of mental problem.  It so saddens me and I don&amp;#39;t know exactly how to deal with it.&lt;/p&gt;

&lt;p&gt;Edit: I live out of the house at college and have enough money to be financially independent if I needed to.  That said I don&amp;#39;t think she will ever force me into therapy even if she had the legal ability to do so.  I think I just got scared a little bit of how she can possibly see this type of thing as anything more than crazy scientifically inaccurate bullshit.  People scare me sometimes, even people I love like my mother.&lt;/p&gt;
&lt;/div&gt;&lt;!-- SC_ON --&gt;","False","askgaybros","t5_2vgfw","","","Mom talking to ex-Gay therapy groups","24","http://www.reddit.com/r/askgaybros/comments/2862se/mom_talking_to_exgay_therapy_groups/","[]","False"
