"","_comment_sort","_comments","_comments_by_id","_info_url","_orphaned","_params","_replaced_more","_underscore_names","approved_by","archived","author","author_flair_css_class","author_flair_text","banned_by","clicked","created","created_utc","distinguished","domain","downs","edited","gilded","has_fetched","hidden","id","is_self","json_dict","likes","link_flair_css_class","link_flair_text","media","media_embed","mod_reports","name","num_comments","num_reports","over_18","permalink","reddit_session","report_reasons","saved","score","secure_media","secure_media_embed","selftext","selftext_html","stickied","subreddit","subreddit_id","suggested_sort","thumbnail","title","ups","url","user_reports","visited"
"0","","","{}","http://www.reddit.com/api/info/","{}","{}","False","","","False","GloriousSunrise","","","","False","1417017287.0","1417017287.0","","cdn0.vox-cdn.com","0","False","0","True","False","2nhism","False","","","","","","{}","[]","t3_2nhism","9","","False","http://www.reddit.com/r/askgaybros/comments/2nhism/watch_america_change_from_a_nation_of_baby_boys/","Unauthenticated reddit sesssion","","False","4","","{}","","","False","askgaybros","t5_2vgfw","","","Watch America change from a nation of baby boys into a nation of old women","4","https://cdn0.vox-cdn.com/thumbor/y-Bk5278NWi7LQzXEYeaBmyVyf0=/cdn0.vox-cdn.com/uploads/chorus_asset/file/2459078/t3Vf1xk.0.gif","[]","False"
"1","","","{}","http://www.reddit.com/api/info/","{}","{}","False","","","False","senoranaranjado","","","","False","1417012792.0","1417012792.0","","self.askgaybros","0","False","0","True","False","2nhb3v","True","","","","","","{}","[]","t3_2nhb3v","21","","False","http://www.reddit.com/r/askgaybros/comments/2nhb3v/am_i_really_attracted_to_men_if_im_not_interested/","Unauthenticated reddit sesssion","","False","3","","{}","Not that penises bother me, they're just...not sexually interesting.  Anuses I am obsessed with.  When I think about sex with men who are attractive (emotionally and physically) it always centers on their anuses, looking at them, touching them, sticking things in them, and so on.  Thinking about penises breaks the mood, and I don't know why.  

I'm capable of getting emotionally/romantically attached to anyone regardless of gender, but am I cursed to restrict my *consummated* affections to women?  Does the exclusive interest in orifices mean that I'm not really sexually attracted to men, even if I think I am?","&lt;!-- SC_OFF --&gt;&lt;div class=""md""&gt;&lt;p&gt;Not that penises bother me, they&amp;#39;re just...not sexually interesting.  Anuses I am obsessed with.  When I think about sex with men who are attractive (emotionally and physically) it always centers on their anuses, looking at them, touching them, sticking things in them, and so on.  Thinking about penises breaks the mood, and I don&amp;#39;t know why.  &lt;/p&gt;

&lt;p&gt;I&amp;#39;m capable of getting emotionally/romantically attached to anyone regardless of gender, but am I cursed to restrict my &lt;em&gt;consummated&lt;/em&gt; affections to women?  Does the exclusive interest in orifices mean that I&amp;#39;m not really sexually attracted to men, even if I think I am?&lt;/p&gt;
&lt;/div&gt;&lt;!-- SC_ON --&gt;","False","askgaybros","t5_2vgfw","","","Am I really attracted to men if I'm not interested in penis?","3","http://www.reddit.com/r/askgaybros/comments/2nhb3v/am_i_really_attracted_to_men_if_im_not_interested/","[]","False"
"2","","","{}","http://www.reddit.com/api/info/","{}","{}","False","","","False","Bibrah","","","","False","1417001449.0","1417001449.0","","self.askgaybros","0","False","0","True","False","2ngxiq","True","","","","","","{}","[]","t3_2ngxiq","31","","False","http://www.reddit.com/r/askgaybros/comments/2ngxiq/how_small_is_too_small/","Unauthenticated reddit sesssion","","False","8","","{}","I'm 6' myself erect  but mad small unerect like thumb size small..how small is too small bros?","&lt;!-- SC_OFF --&gt;&lt;div class=""md""&gt;&lt;p&gt;I&amp;#39;m 6&amp;#39; myself erect  but mad small unerect like thumb size small..how small is too small bros?&lt;/p&gt;
&lt;/div&gt;&lt;!-- SC_ON --&gt;","False","askgaybros","t5_2vgfw","","","How small is too small?","8","http://www.reddit.com/r/askgaybros/comments/2ngxiq/how_small_is_too_small/","[]","False"
"3","","","{}","http://www.reddit.com/api/info/","{}","{}","False","","","False","gvw1982","","","","False","1416981184.0","1416981184.0","","self.askgaybros","0","False","0","True","False","2ngc1r","True","","","","","","{}","[]","t3_2ngc1r","8","","False","http://www.reddit.com/r/askgaybros/comments/2ngc1r/what_do_you_do_when_you_have_to_call_your_first/","Unauthenticated reddit sesssion","","False","6","","{}","What do you do when you've been together for 3 years? You share a car, a house, a dog. Your first real relationship. Your first gay relationship. When everything is so right except when its so wrong. You learned gay sex together. You learned coming out together. You learned what it means to not be alone, together. You learned each other, and yourselves, together. How do you survive when you know you can't be together any longer?","&lt;!-- SC_OFF --&gt;&lt;div class=""md""&gt;&lt;p&gt;What do you do when you&amp;#39;ve been together for 3 years? You share a car, a house, a dog. Your first real relationship. Your first gay relationship. When everything is so right except when its so wrong. You learned gay sex together. You learned coming out together. You learned what it means to not be alone, together. You learned each other, and yourselves, together. How do you survive when you know you can&amp;#39;t be together any longer?&lt;/p&gt;
&lt;/div&gt;&lt;!-- SC_ON --&gt;","False","askgaybros","t5_2vgfw","","","What do you do when you have to ""call"" your first relationship?","6","http://www.reddit.com/r/askgaybros/comments/2ngc1r/what_do_you_do_when_you_have_to_call_your_first/","[]","False"
"4","","","{}","http://www.reddit.com/api/info/","{}","{}","False","","","False","lovesouthernaccents","","","","False","1416979240.0","1416979240.0","","self.askgaybros","0","False","0","True","False","2ng90y","True","","","","","","{}","[]","t3_2ng90y","9","","False","http://www.reddit.com/r/askgaybros/comments/2ng90y/feeling_kind_of_lost/","Unauthenticated reddit sesssion","","False","8","","{}","I don't know why, I just feel so lost and confused with my life. Kind of feel like everything just doesn't go my way anymore and it kind of sucks. Idk what my question is really, maybe some advice on how to not feel so lost? Or something? Maybe even just a nice chat. I just feel like my life is stagnant and it's very unnerving and kind of making me feel a little depressed.","&lt;!-- SC_OFF --&gt;&lt;div class=""md""&gt;&lt;p&gt;I don&amp;#39;t know why, I just feel so lost and confused with my life. Kind of feel like everything just doesn&amp;#39;t go my way anymore and it kind of sucks. Idk what my question is really, maybe some advice on how to not feel so lost? Or something? Maybe even just a nice chat. I just feel like my life is stagnant and it&amp;#39;s very unnerving and kind of making me feel a little depressed.&lt;/p&gt;
&lt;/div&gt;&lt;!-- SC_ON --&gt;","False","askgaybros","t5_2vgfw","","","Feeling kind of lost.","8","http://www.reddit.com/r/askgaybros/comments/2ng90y/feeling_kind_of_lost/","[]","False"
"5","","","{}","http://www.reddit.com/api/info/","{}","{}","False","","","False","jrgaythrowaway","","","","False","1416978907.0","1416978907.0","","self.askgaybros","0","False","0","True","False","2ng8hk","True","","","","","","{}","[]","t3_2ng8hk","29","","False","http://www.reddit.com/r/askgaybros/comments/2ng8hk/teen_gaybro_here_my_father_hates_the_fact_i_am/","Unauthenticated reddit sesssion","","False","18","","{}","Throwaway because my friends/family (those who I am not out to) see my main account.

Here are some things, I am 13, I don't live with my father, I visit him &amp; I have been out to him for a bit.

My father is really conservative and fundamentalist, he supports chick-fil-a, loves the salvation army &amp; hates the fact I am gay. He loves to make up hilarious stories as to why I am not an ""icky gay"", my personal favorite is that I talk to ""my online pervert boyfriend who has recruited me into the gay lifestyle"" (Not even joking, this is one of the things he tell himself to justify me not being gay).

I don't live with him due to this and many reasons, I live with my mother, who does not care that I am gay at all. While my dad.. yeah...

On top of many things, my father outed me to his family (he claims he did not, but its obvious he did.) and said how I am just ""confused.""
Constantly brings up politics in everything and thinks I am going to hell and constantly wants to start a fight.


At this point I am considering cutting contact, but, I kind of don't want to get a call a month after cutting contact to hear he died and regret not having a relationship with him, I don't think I could forgive myself for that.

Advice, please?","&lt;!-- SC_OFF --&gt;&lt;div class=""md""&gt;&lt;p&gt;Throwaway because my friends/family (those who I am not out to) see my main account.&lt;/p&gt;

&lt;p&gt;Here are some things, I am 13, I don&amp;#39;t live with my father, I visit him &amp;amp; I have been out to him for a bit.&lt;/p&gt;

&lt;p&gt;My father is really conservative and fundamentalist, he supports chick-fil-a, loves the salvation army &amp;amp; hates the fact I am gay. He loves to make up hilarious stories as to why I am not an &amp;quot;icky gay&amp;quot;, my personal favorite is that I talk to &amp;quot;my online pervert boyfriend who has recruited me into the gay lifestyle&amp;quot; (Not even joking, this is one of the things he tell himself to justify me not being gay).&lt;/p&gt;

&lt;p&gt;I don&amp;#39;t live with him due to this and many reasons, I live with my mother, who does not care that I am gay at all. While my dad.. yeah...&lt;/p&gt;

&lt;p&gt;On top of many things, my father outed me to his family (he claims he did not, but its obvious he did.) and said how I am just &amp;quot;confused.&amp;quot;
Constantly brings up politics in everything and thinks I am going to hell and constantly wants to start a fight.&lt;/p&gt;

&lt;p&gt;At this point I am considering cutting contact, but, I kind of don&amp;#39;t want to get a call a month after cutting contact to hear he died and regret not having a relationship with him, I don&amp;#39;t think I could forgive myself for that.&lt;/p&gt;

&lt;p&gt;Advice, please?&lt;/p&gt;
&lt;/div&gt;&lt;!-- SC_ON --&gt;","False","askgaybros","t5_2vgfw","","","teen gaybro here. My father hates the fact I am gay and tries to politicize everything. I need advice.","18","http://www.reddit.com/r/askgaybros/comments/2ng8hk/teen_gaybro_here_my_father_hates_the_fact_i_am/","[]","False"
"6","","","{}","http://www.reddit.com/api/info/","{}","{}","False","","","False","RintooPanda","","","","False","1416976389.0","1416976389.0","","self.askgaybros","0","False","0","True","False","2ng4kl","True","","","","","","{}","[]","t3_2ng4kl","4","","False","http://www.reddit.com/r/askgaybros/comments/2ng4kl/needs_advice_teenage_gay_teen_finally_falling_for/","Unauthenticated reddit sesssion","","False","6","","{}","Hey, Bros- 

This is my first post here, but I come seeking some advice!
I'm sixteen years old, half-way through, and have personally began to accept the fact that I'm gay. I went through the ""curious"" to the ""bisexual"" to the ""asexual"" to the whatever cop-out I could, but after a few years, it's just reality. That's all good and fine.

However, I've never been the romantic type. Any relationship I had attempted before (with girls and guys alike) has been stale, forced, and ultimately pointless; peer pressure and all that. But recently, I've found myself falling for a guy in a way that I never really have before. Thinking of him makes me happy, in a simple way. :)

He's told me before, off-handedly, that he's bisexual. I think he may be like me, doubting himself, but I'm not sure. I've hung out with him a few times, occasionally at school, but he's not really in my social circle, so it's not regular- But for the past month or two, we've been texting each other, and while neither of us have ever mentioned feelings for one another, there's hints.

The issue is, we're both super fucking awkward and introverted (sorry for being that teenager stereotype, but it's true), him more-so than I. He's never been very social, and a lot of people find him unattractive physically (I disagree, personally), and he's never been in a proper relationship- his self-esteem is pretty low, so there's no way he'd openly show proper signs of really feeling the same way.

I'm not sure how he feels, and I'm scared to ask. I'm worried that it's not fair to assume that I DO have feelings for him because we only really text, and don't hang out a lot. But we talk about everything, and he's witty, and he's more open with me than most people, I feel like, and he's just great, in my eyes. I'm smitten, for the first time in a long time. :)

But I don't know how to really take it to that next level (whatever that level may be without potentially scaring him off. Any help?","&lt;!-- SC_OFF --&gt;&lt;div class=""md""&gt;&lt;p&gt;Hey, Bros- &lt;/p&gt;

&lt;p&gt;This is my first post here, but I come seeking some advice!
I&amp;#39;m sixteen years old, half-way through, and have personally began to accept the fact that I&amp;#39;m gay. I went through the &amp;quot;curious&amp;quot; to the &amp;quot;bisexual&amp;quot; to the &amp;quot;asexual&amp;quot; to the whatever cop-out I could, but after a few years, it&amp;#39;s just reality. That&amp;#39;s all good and fine.&lt;/p&gt;

&lt;p&gt;However, I&amp;#39;ve never been the romantic type. Any relationship I had attempted before (with girls and guys alike) has been stale, forced, and ultimately pointless; peer pressure and all that. But recently, I&amp;#39;ve found myself falling for a guy in a way that I never really have before. Thinking of him makes me happy, in a simple way. :)&lt;/p&gt;

&lt;p&gt;He&amp;#39;s told me before, off-handedly, that he&amp;#39;s bisexual. I think he may be like me, doubting himself, but I&amp;#39;m not sure. I&amp;#39;ve hung out with him a few times, occasionally at school, but he&amp;#39;s not really in my social circle, so it&amp;#39;s not regular- But for the past month or two, we&amp;#39;ve been texting each other, and while neither of us have ever mentioned feelings for one another, there&amp;#39;s hints.&lt;/p&gt;

&lt;p&gt;The issue is, we&amp;#39;re both super fucking awkward and introverted (sorry for being that teenager stereotype, but it&amp;#39;s true), him more-so than I. He&amp;#39;s never been very social, and a lot of people find him unattractive physically (I disagree, personally), and he&amp;#39;s never been in a proper relationship- his self-esteem is pretty low, so there&amp;#39;s no way he&amp;#39;d openly show proper signs of really feeling the same way.&lt;/p&gt;

&lt;p&gt;I&amp;#39;m not sure how he feels, and I&amp;#39;m scared to ask. I&amp;#39;m worried that it&amp;#39;s not fair to assume that I DO have feelings for him because we only really text, and don&amp;#39;t hang out a lot. But we talk about everything, and he&amp;#39;s witty, and he&amp;#39;s more open with me than most people, I feel like, and he&amp;#39;s just great, in my eyes. I&amp;#39;m smitten, for the first time in a long time. :)&lt;/p&gt;

&lt;p&gt;But I don&amp;#39;t know how to really take it to that next level (whatever that level may be without potentially scaring him off. Any help?&lt;/p&gt;
&lt;/div&gt;&lt;!-- SC_ON --&gt;","False","askgaybros","t5_2vgfw","","","Needs Advice: Teenage gay teen finally falling for a guy, but is clueless!","6","http://www.reddit.com/r/askgaybros/comments/2ng4kl/needs_advice_teenage_gay_teen_finally_falling_for/","[]","False"
"7","","","{}","http://www.reddit.com/api/info/","{}","{}","False","","","False","the7way","","","","False","1416974111.0","1416974111.0","","self.askgaybros","0","False","0","True","False","2ng0x4","True","","","","","","{}","[]","t3_2ng0x4","4","","False","http://www.reddit.com/r/askgaybros/comments/2ng0x4/relationship_advice_4month_whats_normal_here/","Unauthenticated reddit sesssion","","False","4","","{}","Hey Guys! I need your help!
Been with this pretty amazing man for 4 ish months. I know not very long or anything. I go out of town a lot for this internship (5-6days away, 4 home) and think about him a lot. I look forward to texting him from the hotel at night and he crosses my mind relatively often throughout the day (which I think is a great thing, RIGHT?). I’d like to think this is a healthy mind set to be at this point, and especially when I am away and relatively lonely it’s a warming thought to be going home to him at the end of the trip. 

 When we first started dating I was pretty conscious of how often I texted him while I was away- I didn’t want our relationship to be all text; so kept it to one conversation a day kind of thing. 

I’ve been noticing a trend and it’s starting to eat away at me. Not sure if I’m being rational. 

Essentially, he seldomly initiates the texting and/or meeting up when I am in town. I don’t know if this is because he is (gasp) less interested in me or if it’s just the roles we’ve kind of fallen into (I text, he replies)? I feel like a 14 year old girl but it makes me feel like he might not be thinking about me when I am away and I guess I am insecure about that. 

I only have one other long term (2 year) relationship to base this off of- and in that one we basically were in a constant text chat all the time, called daily and whatnot (I wanted to avoid this overkill, so that’s why I tried to hold back on the texting). I am not saying this is normal (is it?) but I really don’t know what I should be calling normal this early in the relationship?

As always thank you for your advice. 
","&lt;!-- SC_OFF --&gt;&lt;div class=""md""&gt;&lt;p&gt;Hey Guys! I need your help!
Been with this pretty amazing man for 4 ish months. I know not very long or anything. I go out of town a lot for this internship (5-6days away, 4 home) and think about him a lot. I look forward to texting him from the hotel at night and he crosses my mind relatively often throughout the day (which I think is a great thing, RIGHT?). I’d like to think this is a healthy mind set to be at this point, and especially when I am away and relatively lonely it’s a warming thought to be going home to him at the end of the trip. &lt;/p&gt;

&lt;p&gt;When we first started dating I was pretty conscious of how often I texted him while I was away- I didn’t want our relationship to be all text; so kept it to one conversation a day kind of thing. &lt;/p&gt;

&lt;p&gt;I’ve been noticing a trend and it’s starting to eat away at me. Not sure if I’m being rational. &lt;/p&gt;

&lt;p&gt;Essentially, he seldomly initiates the texting and/or meeting up when I am in town. I don’t know if this is because he is (gasp) less interested in me or if it’s just the roles we’ve kind of fallen into (I text, he replies)? I feel like a 14 year old girl but it makes me feel like he might not be thinking about me when I am away and I guess I am insecure about that. &lt;/p&gt;

&lt;p&gt;I only have one other long term (2 year) relationship to base this off of- and in that one we basically were in a constant text chat all the time, called daily and whatnot (I wanted to avoid this overkill, so that’s why I tried to hold back on the texting). I am not saying this is normal (is it?) but I really don’t know what I should be calling normal this early in the relationship?&lt;/p&gt;

&lt;p&gt;As always thank you for your advice. &lt;/p&gt;
&lt;/div&gt;&lt;!-- SC_ON --&gt;","False","askgaybros","t5_2vgfw","","","Relationship Advice- 4month- Whats normal here?","4","http://www.reddit.com/r/askgaybros/comments/2ng0x4/relationship_advice_4month_whats_normal_here/","[]","False"
"8","","","{}","http://www.reddit.com/api/info/","{}","{}","False","","","False","Dbg1500","","","","False","1416966392.0","1416966392.0","","self.askgaybros","0","False","0","True","False","2nfnui","True","","","","","","{}","[]","t3_2nfnui","34","","False","http://www.reddit.com/r/askgaybros/comments/2nfnui/is_being_called_cuteadorable_on_apps_like_grindr/","Unauthenticated reddit sesssion","","False","16","","{}","Obviously it's a compliment, but is it just a soft let down or is it usually genuine? ","&lt;!-- SC_OFF --&gt;&lt;div class=""md""&gt;&lt;p&gt;Obviously it&amp;#39;s a compliment, but is it just a soft let down or is it usually genuine? &lt;/p&gt;
&lt;/div&gt;&lt;!-- SC_ON --&gt;","False","askgaybros","t5_2vgfw","","","Is being called ""cute""/""Adorable"" on apps like Grindr a compliment or a soft let down","16","http://www.reddit.com/r/askgaybros/comments/2nfnui/is_being_called_cuteadorable_on_apps_like_grindr/","[]","False"
"9","","","{}","http://www.reddit.com/api/info/","{}","{}","False","","","False","ahoym80z","","","","False","1416961006.0","1416961006.0","","self.askgaybros","0","False","0","True","False","2nfej1","True","","","","","","{}","[]","t3_2nfej1","168","","False","http://www.reddit.com/r/askgaybros/comments/2nfej1/what_are_you_struggling_with_now/","Unauthenticated reddit sesssion","","False","36","","{}","End of the semester grind? Relationship stuff? Gay life a bit overwhelming? Or just life in general?

Let it all out, fellas!","&lt;!-- SC_OFF --&gt;&lt;div class=""md""&gt;&lt;p&gt;End of the semester grind? Relationship stuff? Gay life a bit overwhelming? Or just life in general?&lt;/p&gt;

&lt;p&gt;Let it all out, fellas!&lt;/p&gt;
&lt;/div&gt;&lt;!-- SC_ON --&gt;","False","askgaybros","t5_2vgfw","","","What are you struggling with now?","36","http://www.reddit.com/r/askgaybros/comments/2nfej1/what_are_you_struggling_with_now/","[]","False"
"10","","","{}","http://www.reddit.com/api/info/","{}","{}","False","","","False","Conflux","","","","False","1416960508.0","1416960508.0","","self.askgaybros","0","False","0","True","False","2nfdok","True","","","","","","{}","[]","t3_2nfdok","8","","False","http://www.reddit.com/r/askgaybros/comments/2nfdok/made_new_friends_but_its_complicated/","Unauthenticated reddit sesssion","","False","6","","{}","Recently one of my best friends in the city threw a party. I always attend these parties as they're a blast and just a place for most of my LGBT friends meet.

Anyways there was a new couple at the party I'd never met before. I introduced myself and my partner. We chatted for a good portion of the night bonding over video games and sketch comedy. We all decided that we should meet up for drinks and occasionally visit each other for smash bros and other games.

We've been hitting it off really well with no bumps in sight until today. I find out the couple is close friends with a guy I hooked up with in the past who I can not stand.

The guy in question started off pretty cool. But quickly devolved into wanting to suck my dick at inappropriate times, and sending me nsfw pictures while on my breaks at work over Facebook.

Needless to say I have blocked him on every form or social media possible. So gaybros what do I do? Do I tell the couple that their friend is wildly inappropriate? That I can't stand being in the same room as him? Or do I just play it off if I see him with them?","&lt;!-- SC_OFF --&gt;&lt;div class=""md""&gt;&lt;p&gt;Recently one of my best friends in the city threw a party. I always attend these parties as they&amp;#39;re a blast and just a place for most of my LGBT friends meet.&lt;/p&gt;

&lt;p&gt;Anyways there was a new couple at the party I&amp;#39;d never met before. I introduced myself and my partner. We chatted for a good portion of the night bonding over video games and sketch comedy. We all decided that we should meet up for drinks and occasionally visit each other for smash bros and other games.&lt;/p&gt;

&lt;p&gt;We&amp;#39;ve been hitting it off really well with no bumps in sight until today. I find out the couple is close friends with a guy I hooked up with in the past who I can not stand.&lt;/p&gt;

&lt;p&gt;The guy in question started off pretty cool. But quickly devolved into wanting to suck my dick at inappropriate times, and sending me nsfw pictures while on my breaks at work over Facebook.&lt;/p&gt;

&lt;p&gt;Needless to say I have blocked him on every form or social media possible. So gaybros what do I do? Do I tell the couple that their friend is wildly inappropriate? That I can&amp;#39;t stand being in the same room as him? Or do I just play it off if I see him with them?&lt;/p&gt;
&lt;/div&gt;&lt;!-- SC_ON --&gt;","False","askgaybros","t5_2vgfw","","","Made new friends but its complicated","6","http://www.reddit.com/r/askgaybros/comments/2nfdok/made_new_friends_but_its_complicated/","[]","False"
"11","","","{}","http://www.reddit.com/api/info/","{}","{}","False","","","False","limsicle","","","","False","1416956657.0","1416956657.0","","self.askgaybros","0","False","0","True","False","2nf6h4","True","","","","","","{}","[]","t3_2nf6h4","22","","False","http://www.reddit.com/r/askgaybros/comments/2nf6h4/do_gay_phases_exist_has_anyone_exclusively_liked/","Unauthenticated reddit sesssion","","False","0","","{}","","","False","askgaybros","t5_2vgfw","","","Do gay phases exist? Has anyone exclusively liked men for a short period of time, but in the end only found interest in women?","0","http://www.reddit.com/r/askgaybros/comments/2nf6h4/do_gay_phases_exist_has_anyone_exclusively_liked/","[]","False"
