"","_comment_sort","_comments","_comments_by_id","_info_url","_orphaned","_params","_replaced_more","_underscore_names","approved_by","archived","author","author_flair_css_class","author_flair_text","banned_by","clicked","created","created_utc","distinguished","domain","downs","edited","gilded","has_fetched","hidden","id","is_self","json_dict","likes","link_flair_css_class","link_flair_text","media","media_embed","mod_reports","name","num_comments","num_reports","over_18","permalink","reddit_session","report_reasons","saved","score","secure_media","secure_media_embed","selftext","selftext_html","stickied","subreddit","subreddit_id","suggested_sort","thumbnail","title","ups","url","user_reports","visited"
"0","","","{}","http://www.reddit.com/api/info/","{}","{}","False","","","True","Rangerone1","","","","False","1400000024.0","1399996424.0","","self.askgaybros","0","False","0","True","False","25ggg1","True","","","","","","{}","[]","t3_25ggg1","11","","False","http://www.reddit.com/r/askgaybros/comments/25ggg1/needing_help_in_the_love_department/","Unauthenticated reddit sesssion","","False","10","","{}","Okay so pretty much, me and my bf have been dating for three months. We both agreed that it would be a good idea if we refrained from sex for a while so our relationship wouldn't be based around sex. It was cool at first, I was really into this guy, so I had no problem putting my sexual desires aside just to get closer to this guy. After a few weeks in, we began messing around. No anal, just more of blow jobs and jacking each other off. Don't get me wrong, it was great. We messed around almost daily and I loved it. I've only been messing around with guys for about a year now (I'm 21) and my bf has been with WAAAAAY more guys than me seeing he came out in high school (hell be 21 next month)--. I love sex, but I feel as if my bf has been with so many guys sex is just like ""blah"" to him. We've been together for three month and this past month we've probably fucked around one time. It seems like He doesn't even want to come near my dick and it kinda bothers me. I even tried to suck his dick today and he wasn't into it at all. It kind of upsets me because I want to be intimate with him but I feel as if he's not even attracted to me anymore. I'm a very good looking guy if I don't say so myself.. I'm well groomed and go to the gym on a regular basis. I've told him that I've felt ignored lately and he has made an effort to give me more attention but when I say I feel ignored, I kind of mean it as, we don't fuck around like we used to. I don't wanna flat out and say that cause I don't wanna make to seems like sex is all I want, because it's not. I really do love my bf. this is the first guy I've ever been serious with. Idk if I'm just smitten or if what we have is truly genuine. What do you guys think? You think I'm a dick for wanting sex? Whenever I get around him I'm automatically horny, but I rarely try anything with him anymore because when I do he's just so blah about it and not into it. I don't wanna end a relationship just because we don't have sex but I love sex. And if things are like this now I'm just thinking of what our sex life will be like down the road. Idk what to think. Any advice bros?","&lt;!-- SC_OFF --&gt;&lt;div class=""md""&gt;&lt;p&gt;Okay so pretty much, me and my bf have been dating for three months. We both agreed that it would be a good idea if we refrained from sex for a while so our relationship wouldn&amp;#39;t be based around sex. It was cool at first, I was really into this guy, so I had no problem putting my sexual desires aside just to get closer to this guy. After a few weeks in, we began messing around. No anal, just more of blow jobs and jacking each other off. Don&amp;#39;t get me wrong, it was great. We messed around almost daily and I loved it. I&amp;#39;ve only been messing around with guys for about a year now (I&amp;#39;m 21) and my bf has been with WAAAAAY more guys than me seeing he came out in high school (hell be 21 next month)--. I love sex, but I feel as if my bf has been with so many guys sex is just like &amp;quot;blah&amp;quot; to him. We&amp;#39;ve been together for three month and this past month we&amp;#39;ve probably fucked around one time. It seems like He doesn&amp;#39;t even want to come near my dick and it kinda bothers me. I even tried to suck his dick today and he wasn&amp;#39;t into it at all. It kind of upsets me because I want to be intimate with him but I feel as if he&amp;#39;s not even attracted to me anymore. I&amp;#39;m a very good looking guy if I don&amp;#39;t say so myself.. I&amp;#39;m well groomed and go to the gym on a regular basis. I&amp;#39;ve told him that I&amp;#39;ve felt ignored lately and he has made an effort to give me more attention but when I say I feel ignored, I kind of mean it as, we don&amp;#39;t fuck around like we used to. I don&amp;#39;t wanna flat out and say that cause I don&amp;#39;t wanna make to seems like sex is all I want, because it&amp;#39;s not. I really do love my bf. this is the first guy I&amp;#39;ve ever been serious with. Idk if I&amp;#39;m just smitten or if what we have is truly genuine. What do you guys think? You think I&amp;#39;m a dick for wanting sex? Whenever I get around him I&amp;#39;m automatically horny, but I rarely try anything with him anymore because when I do he&amp;#39;s just so blah about it and not into it. I don&amp;#39;t wanna end a relationship just because we don&amp;#39;t have sex but I love sex. And if things are like this now I&amp;#39;m just thinking of what our sex life will be like down the road. Idk what to think. Any advice bros?&lt;/p&gt;
&lt;/div&gt;&lt;!-- SC_ON --&gt;","False","askgaybros","t5_2vgfw","","","Needing help in the ""love"" department","10","http://www.reddit.com/r/askgaybros/comments/25ggg1/needing_help_in_the_love_department/","[]","False"
"1","","","{}","http://www.reddit.com/api/info/","{}","{}","False","","","True","medallian","","","","False","1399973494.0","1399969894.0","","self.askgaybros","0","False","0","True","False","25fn67","True","","","","","","{}","[]","t3_25fn67","18","","False","http://www.reddit.com/r/askgaybros/comments/25fn67/children/","Unauthenticated reddit sesssion","","False","7","","{}","What are your opinions on children? I am thinking of starting the adoption process or surrogacy. I would like to know how hard adoption/surrogacy is to achieve. ","&lt;!-- SC_OFF --&gt;&lt;div class=""md""&gt;&lt;p&gt;What are your opinions on children? I am thinking of starting the adoption process or surrogacy. I would like to know how hard adoption/surrogacy is to achieve. &lt;/p&gt;
&lt;/div&gt;&lt;!-- SC_ON --&gt;","False","askgaybros","t5_2vgfw","","","Children?","7","http://www.reddit.com/r/askgaybros/comments/25fn67/children/","[]","False"
"2","","","{}","http://www.reddit.com/api/info/","{}","{}","False","","","True","ThatsAGodQuestion","","","","False","1399964608.0","1399961008.0","","self.askgaybros","0","False","0","True","False","25ffrd","True","","","","","","{}","[]","t3_25ffrd","45","","False","http://www.reddit.com/r/askgaybros/comments/25ffrd/gaybros_in_college_could_you_ever_date_someone/","Unauthenticated reddit sesssion","","False","24","","{}","Recently I've been very selfconcious of the fact that I never went to college. I'm your typical lazy pseudo intellectual redditor who could have succeeded if he had applied himself but didn't, and so I'm kind of stuck where I feel more comfortable with white collar folk, but am part of the blue collar work force. When I'm looking for a guy to date I find I'm more attracted to the college and graduate students but I'm afraid I'll just be dismissed because of the path I chose. Would you ever date someone who never went beyond a high school degree?","&lt;!-- SC_OFF --&gt;&lt;div class=""md""&gt;&lt;p&gt;Recently I&amp;#39;ve been very selfconcious of the fact that I never went to college. I&amp;#39;m your typical lazy pseudo intellectual redditor who could have succeeded if he had applied himself but didn&amp;#39;t, and so I&amp;#39;m kind of stuck where I feel more comfortable with white collar folk, but am part of the blue collar work force. When I&amp;#39;m looking for a guy to date I find I&amp;#39;m more attracted to the college and graduate students but I&amp;#39;m afraid I&amp;#39;ll just be dismissed because of the path I chose. Would you ever date someone who never went beyond a high school degree?&lt;/p&gt;
&lt;/div&gt;&lt;!-- SC_ON --&gt;","False","askgaybros","t5_2vgfw","","","Gaybros in college, could you ever date someone who didn't pursue higher education?","24","http://www.reddit.com/r/askgaybros/comments/25ffrd/gaybros_in_college_could_you_ever_date_someone/","[]","False"
"3","","","{}","http://www.reddit.com/api/info/","{}","{}","False","","","True","superslurm94","","","","False","1399951968.0","1399948368.0","","self.askgaybros","0","False","0","True","False","25ezw8","True","","","","","","{}","[]","t3_25ezw8","8","","False","http://www.reddit.com/r/askgaybros/comments/25ezw8/need_some_help_getting_over_some_unwanted_feelings/","Unauthenticated reddit sesssion","","False","2","","{}","So my best friend is straight (as far as my knowledge goes) and about a year ago I came out to him as Bi. Recently though ive started to have some feelings for him. I don't want to have any of those kind of feelings for him though hes my bestfriend. its also kind of hard not to because some of the conversations and things weve done together sometimes makes me question wether he really is straight. any Advice for trying to get over these feelings?","&lt;!-- SC_OFF --&gt;&lt;div class=""md""&gt;&lt;p&gt;So my best friend is straight (as far as my knowledge goes) and about a year ago I came out to him as Bi. Recently though ive started to have some feelings for him. I don&amp;#39;t want to have any of those kind of feelings for him though hes my bestfriend. its also kind of hard not to because some of the conversations and things weve done together sometimes makes me question wether he really is straight. any Advice for trying to get over these feelings?&lt;/p&gt;
&lt;/div&gt;&lt;!-- SC_ON --&gt;","False","askgaybros","t5_2vgfw","","","Need some help getting over some unwanted feelings","2","http://www.reddit.com/r/askgaybros/comments/25ezw8/need_some_help_getting_over_some_unwanted_feelings/","[]","False"
"4","","","{}","http://www.reddit.com/api/info/","{}","{}","False","","","True","Semi-Misanthrope1","","","","False","1399948567.0","1399944967.0","","self.askgaybros","0","False","0","True","False","25euo8","True","","","","","","{}","[]","t3_25euo8","24","","False","http://www.reddit.com/r/askgaybros/comments/25euo8/advice_for_dating_a_vietnamese_man/","Unauthenticated reddit sesssion","","False","5","","{}","To be honest, I grew up in a town with like 5 Asian people, so my knowledge on their culture is a little limited. But I've been chatting with this Vietnamese guy, and he seems really chill. He's really involved in the Vietnamese community, so I don't really know what to expect since I dont know much about their culture or customs. And yes, I know I could just google it, but I feel people's personal experinces will give a lot more knowledge.","&lt;!-- SC_OFF --&gt;&lt;div class=""md""&gt;&lt;p&gt;To be honest, I grew up in a town with like 5 Asian people, so my knowledge on their culture is a little limited. But I&amp;#39;ve been chatting with this Vietnamese guy, and he seems really chill. He&amp;#39;s really involved in the Vietnamese community, so I don&amp;#39;t really know what to expect since I dont know much about their culture or customs. And yes, I know I could just google it, but I feel people&amp;#39;s personal experinces will give a lot more knowledge.&lt;/p&gt;
&lt;/div&gt;&lt;!-- SC_ON --&gt;","False","askgaybros","t5_2vgfw","","","Advice for dating a Vietnamese man?","5","http://www.reddit.com/r/askgaybros/comments/25euo8/advice_for_dating_a_vietnamese_man/","[]","False"
"5","","","{}","http://www.reddit.com/api/info/","{}","{}","False","","","True","metalsd","","","","False","1399948426.0","1399944826.0","","self.askgaybros","0","False","0","True","False","25eufl","True","","","","","","{}","[]","t3_25eufl","24","","False","http://www.reddit.com/r/askgaybros/comments/25eufl/does_size_matter/","Unauthenticated reddit sesssion","","False","0","","{}","So I just watched that movie unhung hero on Netflix and I cracked up but I was thinking it doesn't really matter until I remember once I hooked up with a guy with such a small pennies that I couldn't help but excuse myself go to the bathroom laugh and get the fuck out of there. So what do you think reedit bros??","&lt;!-- SC_OFF --&gt;&lt;div class=""md""&gt;&lt;p&gt;So I just watched that movie unhung hero on Netflix and I cracked up but I was thinking it doesn&amp;#39;t really matter until I remember once I hooked up with a guy with such a small pennies that I couldn&amp;#39;t help but excuse myself go to the bathroom laugh and get the fuck out of there. So what do you think reedit bros??&lt;/p&gt;
&lt;/div&gt;&lt;!-- SC_ON --&gt;","False","askgaybros","t5_2vgfw","","","Does size matter??","0","http://www.reddit.com/r/askgaybros/comments/25eufl/does_size_matter/","[]","False"
"6","","","{}","http://www.reddit.com/api/info/","{}","{}","False","","","True","Laika_Come_Home","","","","False","1399948116.0","1399944516.0","","self.askgaybros","0","1399947728.0","0","True","False","25etx3","True","","","","","","{}","[]","t3_25etx3","142","","False","http://www.reddit.com/r/askgaybros/comments/25etx3/being_a_black_man_in_the_gay_community_seems_like/","Unauthenticated reddit sesssion","","False","40","","{}","The last thing I want to do is claim anyone to be racist; I understand we all have preferences, and that's simply a fact of life.

That being said, I know I'm not a perfect ten, just as I know I won't connect with *everybody*.

That's life.

But, from experience, it seems so much harder for guys to give me any time of day, be it at the bars, in clubs, etc. And, admittedly, I'd say that the blame is partially on me; I'm not perfect, and maybe I said something wrong, couldn't keep up with the beat, or maybe had spinach in my teeth. Who knows?

*But*, what I have seen is other gay men who've claimed that their race often results in a smaller dating pool, and a less fulfilling dating life. And, while I can't say I've experienced the same, overtly, I *might* be experiencing it in more subtle ways.

*I'd be damned if I get replies back on Grindr, Hornet, or OKCupid.*

*If I don't lead a conversation (be it in a bar, club, etc.), I generally won't be approached.*

*If I AM approached, I'm fetishized, as if the only functioningpart of me is my penis.*

So, my question is, firstly, (and I hate to ask this, but) is it because I'm black?

And, out of curiosity, what is it I can do about it? Something with my hair, maybe? Should I get a new wardrobe?

**EDIT:** It was suggested that I edit my post to add my appearance, so [here I am](http://i.imgur.com/umywhAh.jpg). In which case, if I'm attractive, maybe I need to work more on my personality?","&lt;!-- SC_OFF --&gt;&lt;div class=""md""&gt;&lt;p&gt;The last thing I want to do is claim anyone to be racist; I understand we all have preferences, and that&amp;#39;s simply a fact of life.&lt;/p&gt;

&lt;p&gt;That being said, I know I&amp;#39;m not a perfect ten, just as I know I won&amp;#39;t connect with &lt;em&gt;everybody&lt;/em&gt;.&lt;/p&gt;

&lt;p&gt;That&amp;#39;s life.&lt;/p&gt;

&lt;p&gt;But, from experience, it seems so much harder for guys to give me any time of day, be it at the bars, in clubs, etc. And, admittedly, I&amp;#39;d say that the blame is partially on me; I&amp;#39;m not perfect, and maybe I said something wrong, couldn&amp;#39;t keep up with the beat, or maybe had spinach in my teeth. Who knows?&lt;/p&gt;

&lt;p&gt;&lt;em&gt;But&lt;/em&gt;, what I have seen is other gay men who&amp;#39;ve claimed that their race often results in a smaller dating pool, and a less fulfilling dating life. And, while I can&amp;#39;t say I&amp;#39;ve experienced the same, overtly, I &lt;em&gt;might&lt;/em&gt; be experiencing it in more subtle ways.&lt;/p&gt;

&lt;p&gt;&lt;em&gt;I&amp;#39;d be damned if I get replies back on Grindr, Hornet, or OKCupid.&lt;/em&gt;&lt;/p&gt;

&lt;p&gt;&lt;em&gt;If I don&amp;#39;t lead a conversation (be it in a bar, club, etc.), I generally won&amp;#39;t be approached.&lt;/em&gt;&lt;/p&gt;

&lt;p&gt;&lt;em&gt;If I AM approached, I&amp;#39;m fetishized, as if the only functioningpart of me is my penis.&lt;/em&gt;&lt;/p&gt;

&lt;p&gt;So, my question is, firstly, (and I hate to ask this, but) is it because I&amp;#39;m black?&lt;/p&gt;

&lt;p&gt;And, out of curiosity, what is it I can do about it? Something with my hair, maybe? Should I get a new wardrobe?&lt;/p&gt;

&lt;p&gt;&lt;strong&gt;EDIT:&lt;/strong&gt; It was suggested that I edit my post to add my appearance, so &lt;a href=""http://i.imgur.com/umywhAh.jpg""&gt;here I am&lt;/a&gt;. In which case, if I&amp;#39;m attractive, maybe I need to work more on my personality?&lt;/p&gt;
&lt;/div&gt;&lt;!-- SC_ON --&gt;","False","askgaybros","t5_2vgfw","","","Being a black man in the gay community seems like being dealt the worst hand in a game of poker. But, is there anything I, myself, can do about it? Is there a way I can improve my odds?","40","http://www.reddit.com/r/askgaybros/comments/25etx3/being_a_black_man_in_the_gay_community_seems_like/","[]","False"
"7","","","{}","http://www.reddit.com/api/info/","{}","{}","False","","","True","cowboysauce","","","","False","1399946963.0","1399943363.0","","self.askgaybros","0","False","0","True","False","25es4t","True","","","","","","{}","[]","t3_25es4t","9","","False","http://www.reddit.com/r/askgaybros/comments/25es4t/condom_advice_for_an_uncut_guy/","Unauthenticated reddit sesssion","","False","9","","{}","I haven't had sex yet, but when I do I want to be prepared. So I bought some condoms to make sure they fit and practice putting them on. From what I've read, if you're uncut you should pull back your foreskin and then put the condom on. The problem is that when I do this and jerk off, the condom gets rolled between my foreskin and the head. Aside from being uncomfortable, it causes the condom to start getting pulled off. I tried putting lube in the condom before putting it on, but it didn't seem to help, maybe I didn't put enough?

Secondly, can anyone recommend condoms that are wider at the tip than base? I found that trojan ultra ribbed condoms are the perfect size, but they lack a reservoir tip and from what I understand, that's not a good thing.","&lt;!-- SC_OFF --&gt;&lt;div class=""md""&gt;&lt;p&gt;I haven&amp;#39;t had sex yet, but when I do I want to be prepared. So I bought some condoms to make sure they fit and practice putting them on. From what I&amp;#39;ve read, if you&amp;#39;re uncut you should pull back your foreskin and then put the condom on. The problem is that when I do this and jerk off, the condom gets rolled between my foreskin and the head. Aside from being uncomfortable, it causes the condom to start getting pulled off. I tried putting lube in the condom before putting it on, but it didn&amp;#39;t seem to help, maybe I didn&amp;#39;t put enough?&lt;/p&gt;

&lt;p&gt;Secondly, can anyone recommend condoms that are wider at the tip than base? I found that trojan ultra ribbed condoms are the perfect size, but they lack a reservoir tip and from what I understand, that&amp;#39;s not a good thing.&lt;/p&gt;
&lt;/div&gt;&lt;!-- SC_ON --&gt;","False","askgaybros","t5_2vgfw","","","Condom advice for an uncut guy?","9","http://www.reddit.com/r/askgaybros/comments/25es4t/condom_advice_for_an_uncut_guy/","[]","False"
"8","","","{}","http://www.reddit.com/api/info/","{}","{}","False","","","True","septhfn","","","","False","1399942084.0","1399938484.0","","self.askgaybros","0","False","0","True","False","25ekn7","True","","","","","","{}","[]","t3_25ekn7","12","","False","http://www.reddit.com/r/askgaybros/comments/25ekn7/how_do_i_tell_him_this/","Unauthenticated reddit sesssion","","False","5","","{}","I have always been afraid of commitment. Every boyfriend I've had lasted maybe 3-4 months and I would break it off as soon as it got serious cause I didnt want things to escalate. I dont even know why. A few weeks ago I broke up with my boyfriend of 6 months (longest relationship ive ever had) after he told me he loved me. I didnt know what to do, so after a week, i told him i couldnt do it anymore. He was upset and so was i. I'm single now, and I felt relieved right after I broke up with him, but now, I think i actually might feel the same way for him. I miss him a lot and I cant seem to stop thinking about our relationship. He did call me a few times after the break up to see if i had changed my mind, but i was so keen on being single again that he stopped talking to me altogether. I dont want to be single cause I want to hook-up or meet other people, it's just a really bad gut feeling. Now, I think maybe ive gotten over it, and now im starting to realize i made a massive mistake. I actually really want him back, but have no idea how to tell him this.","&lt;!-- SC_OFF --&gt;&lt;div class=""md""&gt;&lt;p&gt;I have always been afraid of commitment. Every boyfriend I&amp;#39;ve had lasted maybe 3-4 months and I would break it off as soon as it got serious cause I didnt want things to escalate. I dont even know why. A few weeks ago I broke up with my boyfriend of 6 months (longest relationship ive ever had) after he told me he loved me. I didnt know what to do, so after a week, i told him i couldnt do it anymore. He was upset and so was i. I&amp;#39;m single now, and I felt relieved right after I broke up with him, but now, I think i actually might feel the same way for him. I miss him a lot and I cant seem to stop thinking about our relationship. He did call me a few times after the break up to see if i had changed my mind, but i was so keen on being single again that he stopped talking to me altogether. I dont want to be single cause I want to hook-up or meet other people, it&amp;#39;s just a really bad gut feeling. Now, I think maybe ive gotten over it, and now im starting to realize i made a massive mistake. I actually really want him back, but have no idea how to tell him this.&lt;/p&gt;
&lt;/div&gt;&lt;!-- SC_ON --&gt;","False","askgaybros","t5_2vgfw","","","How do I tell him this?","5","http://www.reddit.com/r/askgaybros/comments/25ekn7/how_do_i_tell_him_this/","[]","False"
