"","_comment_sort","_comments","_comments_by_id","_info_url","_orphaned","_params","_replaced_more","_underscore_names","approved_by","archived","author","author_flair_css_class","author_flair_text","banned_by","clicked","created","created_utc","distinguished","domain","downs","edited","gilded","has_fetched","hidden","id","is_self","json_dict","likes","link_flair_css_class","link_flair_text","media","media_embed","mod_reports","name","num_comments","num_reports","over_18","permalink","reddit_session","report_reasons","saved","score","secure_media","secure_media_embed","selftext","selftext_html","stickied","subreddit","subreddit_id","suggested_sort","thumbnail","title","ups","url","user_reports","visited"
"15","","","{}","http://www.reddit.com/api/info/","{}","{}","False","","","True","jbh007","","","","False","1412981031.0","1412977431.0","","self.askgaybros","0","False","0","True","False","2iw7rs","True","","","","","","{}","[]","t3_2iw7rs","13","","False","http://www.reddit.com/r/askgaybros/comments/2iw7rs/am_i_being_unreasonable/","Unauthenticated reddit sesssion","","False","3","","{}","My ex broke up with me saying that he felt guilty letting his ex manipulate him into having sex, and that this guy constantly coerce him into doing things he doesn't want to do.

He broke down in my arms and told me he was so ashamed of himself and that he hates everything about what he's done, and that he doesn't deserve to be happy. He told me that we would still be together if it wasn't for his ex manipulating him. He also agreed with my sentiment that his ex caused us to break up because he wanted him to be his boytoy, and the only reason he lets his ex do this is because he (the ""friend"") took my ex's virginity so he ""has to.""

My therapist said that this guy is clearly mentally abusing and controlling my ex, and that the way my ex spun things, the guy sexually assaulted him.

My ex also bitched about me behind my back telling people I was a sexual repulsive, immature oddball who was bad at sex.

He still told me that it was all goes ex's fault we broke up after I confronted him about that, and he would constantly say that we could get back together in time.

I then confronted his ex about all the shit my ex told me about, and he claimed my ex just went to him to bitch about me and he just convinced him to end it. He also prided himself on being able to manipulate my ex saying that if it wasn't for him doing that, my ex and I would never have dated.

Now, am I being unreasonable to want to sit down with my ex and have him tell me the fucking truth, because everyone thinks I'm just being a clingy ass hole, and my ex refuses to admit I exist after I told him I talked to the other guy. My ex is constantly posting on Facebook how awesome this guy is, contradicting everything he told me, and I'm 90% sure they're sleeping together again.","&lt;!-- SC_OFF --&gt;&lt;div class=""md""&gt;&lt;p&gt;My ex broke up with me saying that he felt guilty letting his ex manipulate him into having sex, and that this guy constantly coerce him into doing things he doesn&amp;#39;t want to do.&lt;/p&gt;

&lt;p&gt;He broke down in my arms and told me he was so ashamed of himself and that he hates everything about what he&amp;#39;s done, and that he doesn&amp;#39;t deserve to be happy. He told me that we would still be together if it wasn&amp;#39;t for his ex manipulating him. He also agreed with my sentiment that his ex caused us to break up because he wanted him to be his boytoy, and the only reason he lets his ex do this is because he (the &amp;quot;friend&amp;quot;) took my ex&amp;#39;s virginity so he &amp;quot;has to.&amp;quot;&lt;/p&gt;

&lt;p&gt;My therapist said that this guy is clearly mentally abusing and controlling my ex, and that the way my ex spun things, the guy sexually assaulted him.&lt;/p&gt;

&lt;p&gt;My ex also bitched about me behind my back telling people I was a sexual repulsive, immature oddball who was bad at sex.&lt;/p&gt;

&lt;p&gt;He still told me that it was all goes ex&amp;#39;s fault we broke up after I confronted him about that, and he would constantly say that we could get back together in time.&lt;/p&gt;

&lt;p&gt;I then confronted his ex about all the shit my ex told me about, and he claimed my ex just went to him to bitch about me and he just convinced him to end it. He also prided himself on being able to manipulate my ex saying that if it wasn&amp;#39;t for him doing that, my ex and I would never have dated.&lt;/p&gt;

&lt;p&gt;Now, am I being unreasonable to want to sit down with my ex and have him tell me the fucking truth, because everyone thinks I&amp;#39;m just being a clingy ass hole, and my ex refuses to admit I exist after I told him I talked to the other guy. My ex is constantly posting on Facebook how awesome this guy is, contradicting everything he told me, and I&amp;#39;m 90% sure they&amp;#39;re sleeping together again.&lt;/p&gt;
&lt;/div&gt;&lt;!-- SC_ON --&gt;","False","askgaybros","t5_2vgfw","","","Am I being unreasonable?","3","http://www.reddit.com/r/askgaybros/comments/2iw7rs/am_i_being_unreasonable/","[]","False"
"16","","","{}","http://www.reddit.com/api/info/","{}","{}","False","","","True","crobert123","","","","False","1412980562.0","1412976962.0","","self.askgaybros","0","False","0","True","False","2iw6yb","True","","","","","","{}","[]","t3_2iw6yb","7","","False","http://www.reddit.com/r/askgaybros/comments/2iw6yb/please_help/","Unauthenticated reddit sesssion","","False","0","","{}","So I'm 18 just graduated high school last year and since I graduated I started smoking weed more often and started drinking for the first times. But the last time I drank I hooked up with a girl and I was really happy because I've been straight my whole life so I always liked girls but she tried to get a guy involved and I kinda wanted to try it but I was too scared but ever since then I keep thinking about it and I want to try things with another guy I couldn't do anal and I'm not sure I could suck a dick but I could jerk a guy off but I really want to get a blow job from another guy. .. does that make me gay?","&lt;!-- SC_OFF --&gt;&lt;div class=""md""&gt;&lt;p&gt;So I&amp;#39;m 18 just graduated high school last year and since I graduated I started smoking weed more often and started drinking for the first times. But the last time I drank I hooked up with a girl and I was really happy because I&amp;#39;ve been straight my whole life so I always liked girls but she tried to get a guy involved and I kinda wanted to try it but I was too scared but ever since then I keep thinking about it and I want to try things with another guy I couldn&amp;#39;t do anal and I&amp;#39;m not sure I could suck a dick but I could jerk a guy off but I really want to get a blow job from another guy. .. does that make me gay?&lt;/p&gt;
&lt;/div&gt;&lt;!-- SC_ON --&gt;","False","askgaybros","t5_2vgfw","","","Please help!","0","http://www.reddit.com/r/askgaybros/comments/2iw6yb/please_help/","[]","False"
"17","","","{}","http://www.reddit.com/api/info/","{}","{}","False","","","True","lovesouthernaccents","","","","False","1412980449.0","1412976849.0","","self.askgaybros","0","False","0","True","False","2iw6qr","True","","","","","","{}","[]","t3_2iw6qr","16","","False","http://www.reddit.com/r/askgaybros/comments/2iw6qr/help_get_my_ducks_in_a_row/","Unauthenticated reddit sesssion","","False","0","","{}","So I'm 18, hate living at home; and I've decided to move out on my own... The only thing is I have no idea what to do...","&lt;!-- SC_OFF --&gt;&lt;div class=""md""&gt;&lt;p&gt;So I&amp;#39;m 18, hate living at home; and I&amp;#39;ve decided to move out on my own... The only thing is I have no idea what to do...&lt;/p&gt;
&lt;/div&gt;&lt;!-- SC_ON --&gt;","False","askgaybros","t5_2vgfw","","","Help get my ducks in a row?","0","http://www.reddit.com/r/askgaybros/comments/2iw6qr/help_get_my_ducks_in_a_row/","[]","False"
"18","","","{}","http://www.reddit.com/api/info/","{}","{}","False","","","True","gafftapes10","","","","False","1412977907.0","1412974307.0","","self.askgaybros","0","1412974658.0","0","True","False","2iw27d","True","","","","","","{}","[]","t3_2iw27d","8","","False","http://www.reddit.com/r/askgaybros/comments/2iw27d/update_finally_talked_to_my_friend_about_what_was/","Unauthenticated reddit sesssion","","False","0","","{}","the context can be found  here www.reddit.com/r/askgaybros/comments/2ih5cg/i_would_like_some_advice_in_dealing_with_a_friend/

I talked to my friend who has been withdrawn.  It turns out she doesn't know how to deal with our friendship.  She doesn't trust me because of the aftermath of falling out with my ex.  She doesn't want what happened to him and I to happen to me and her.  (the falling out was ugly and almost completely my fault).

I assured her that what happened between him and I is not what I ever want to happen and that I would commit myself to make sure that it wouldn't.  

She said that she was feeling conflicting feelings about our friendship because I had been a great friend to her so far.  She said she felt shitty because she kept of trying to find reason why our friendship wasn't as good as it appears, because I had incredibly nice to her.  She said she never expected this friendship to progress like it did.  She also said she said she should be completely content, but she doesn't know why she doesn't.  Now she doesn't know what to do.

I told her that my behavior towards my ex made me ashamed, and I understood why he wouldn't forgive me, and that I realized that I had been selfish and hadn't considered his feelings at all.  

I also told her that I was grateful for the friendship we shared, and I didn't want to fell like I was placing a burden on her.  I just wanted everyone to be at peace.  I promised her that I would work on our friendship because she was important to me and that I cared about her.  I end the conversation that after break if she wanted to sit down and talk about it that we could.

Now I don't know what my next move should be.  I am a little lost in how to deal with all the information.

","&lt;!-- SC_OFF --&gt;&lt;div class=""md""&gt;&lt;p&gt;the context can be found  here &lt;a href=""http://www.reddit.com/r/askgaybros/comments/2ih5cg/i_would_like_some_advice_in_dealing_with_a_friend/""&gt;www.reddit.com/r/askgaybros/comments/2ih5cg/i_would_like_some_advice_in_dealing_with_a_friend/&lt;/a&gt;&lt;/p&gt;

&lt;p&gt;I talked to my friend who has been withdrawn.  It turns out she doesn&amp;#39;t know how to deal with our friendship.  She doesn&amp;#39;t trust me because of the aftermath of falling out with my ex.  She doesn&amp;#39;t want what happened to him and I to happen to me and her.  (the falling out was ugly and almost completely my fault).&lt;/p&gt;

&lt;p&gt;I assured her that what happened between him and I is not what I ever want to happen and that I would commit myself to make sure that it wouldn&amp;#39;t.  &lt;/p&gt;

&lt;p&gt;She said that she was feeling conflicting feelings about our friendship because I had been a great friend to her so far.  She said she felt shitty because she kept of trying to find reason why our friendship wasn&amp;#39;t as good as it appears, because I had incredibly nice to her.  She said she never expected this friendship to progress like it did.  She also said she said she should be completely content, but she doesn&amp;#39;t know why she doesn&amp;#39;t.  Now she doesn&amp;#39;t know what to do.&lt;/p&gt;

&lt;p&gt;I told her that my behavior towards my ex made me ashamed, and I understood why he wouldn&amp;#39;t forgive me, and that I realized that I had been selfish and hadn&amp;#39;t considered his feelings at all.  &lt;/p&gt;

&lt;p&gt;I also told her that I was grateful for the friendship we shared, and I didn&amp;#39;t want to fell like I was placing a burden on her.  I just wanted everyone to be at peace.  I promised her that I would work on our friendship because she was important to me and that I cared about her.  I end the conversation that after break if she wanted to sit down and talk about it that we could.&lt;/p&gt;

&lt;p&gt;Now I don&amp;#39;t know what my next move should be.  I am a little lost in how to deal with all the information.&lt;/p&gt;
&lt;/div&gt;&lt;!-- SC_ON --&gt;","False","askgaybros","t5_2vgfw","","","Update: Finally talked to my friend about what was going on. Now I am not sure what to do.","0","http://www.reddit.com/r/askgaybros/comments/2iw27d/update_finally_talked_to_my_friend_about_what_was/","[]","False"
"19","","","{}","http://www.reddit.com/api/info/","{}","{}","False","","","True","wwham","","","","False","1412976093.0","1412972493.0","","self.askgaybros","0","False","0","True","False","2ivysr","True","","","","","","{}","[]","t3_2ivysr","67","","False","http://www.reddit.com/r/askgaybros/comments/2ivysr/what_is_your_gay_selfacceptance_song/","Unauthenticated reddit sesssion","","False","23","","{}","I know it's not entirely about 'accepting yourself as gay', but I love A Little Respect by Erasure. It reminds me of a string of guys I've had feelings for, where I've accepted the fact I'm gay, I'm comfortable with it, and I feel good and open about things.

Come on guys, I feel like making a whole playlist of these, and I want some contributions!","&lt;!-- SC_OFF --&gt;&lt;div class=""md""&gt;&lt;p&gt;I know it&amp;#39;s not entirely about &amp;#39;accepting yourself as gay&amp;#39;, but I love A Little Respect by Erasure. It reminds me of a string of guys I&amp;#39;ve had feelings for, where I&amp;#39;ve accepted the fact I&amp;#39;m gay, I&amp;#39;m comfortable with it, and I feel good and open about things.&lt;/p&gt;

&lt;p&gt;Come on guys, I feel like making a whole playlist of these, and I want some contributions!&lt;/p&gt;
&lt;/div&gt;&lt;!-- SC_ON --&gt;","False","askgaybros","t5_2vgfw","","","What is your gay self-acceptance song?","23","http://www.reddit.com/r/askgaybros/comments/2ivysr/what_is_your_gay_selfacceptance_song/","[]","False"
"20","","","{}","http://www.reddit.com/api/info/","{}","{}","False","","","True","thrash94","","","","False","1412973884.0","1412970284.0","","self.askgaybros","0","False","0","True","False","2ivupa","True","","","","","","{}","[]","t3_2ivupa","24","","False","http://www.reddit.com/r/askgaybros/comments/2ivupa/appropriate_attire_for_a_gay_club/","Unauthenticated reddit sesssion","","False","15","","{}","So last time I went to a gay club it was my first time at any type of club. Is there a certain way to dress? Last time I went in shorts and a shirt with cats on it and I didn't known if that was too dressed down or not.","&lt;!-- SC_OFF --&gt;&lt;div class=""md""&gt;&lt;p&gt;So last time I went to a gay club it was my first time at any type of club. Is there a certain way to dress? Last time I went in shorts and a shirt with cats on it and I didn&amp;#39;t known if that was too dressed down or not.&lt;/p&gt;
&lt;/div&gt;&lt;!-- SC_ON --&gt;","False","askgaybros","t5_2vgfw","","","Appropriate attire for a gay club?","15","http://www.reddit.com/r/askgaybros/comments/2ivupa/appropriate_attire_for_a_gay_club/","[]","False"
"21","","","{}","http://www.reddit.com/api/info/","{}","{}","False","","","True","thrash94","","","","False","1412969414.0","1412965814.0","","self.askgaybros","0","False","0","True","False","2ivml6","True","","","","","","{}","[]","t3_2ivml6","7","","False","http://www.reddit.com/r/askgaybros/comments/2ivml6/advice_for_a_meetup/","Unauthenticated reddit sesssion","","False","12","","{}","So tonight, they are having a columbus gaybros meetup and I'm really nervous and stressed. I have exams so I'm gonna be studying basically up until the last minute. I'm really shy and introverted and rather young (20 and idk how old everybody else will be). Has anybody done one of these before? Is it kinda awkward?","&lt;!-- SC_OFF --&gt;&lt;div class=""md""&gt;&lt;p&gt;So tonight, they are having a columbus gaybros meetup and I&amp;#39;m really nervous and stressed. I have exams so I&amp;#39;m gonna be studying basically up until the last minute. I&amp;#39;m really shy and introverted and rather young (20 and idk how old everybody else will be). Has anybody done one of these before? Is it kinda awkward?&lt;/p&gt;
&lt;/div&gt;&lt;!-- SC_ON --&gt;","False","askgaybros","t5_2vgfw","","","Advice for a meetup?","12","http://www.reddit.com/r/askgaybros/comments/2ivml6/advice_for_a_meetup/","[]","False"
"22","","","{}","http://www.reddit.com/api/info/","{}","{}","False","","","True","parabolicuk","","","","False","1412964424.0","1412960824.0","","self.askgaybros","0","False","0","True","False","2ivd98","True","","","","","","{}","[]","t3_2ivd98","10","","False","http://www.reddit.com/r/askgaybros/comments/2ivd98/family_to_visit_or_not/","Unauthenticated reddit sesssion","","False","2","","{}","Short version: my father (68 years old) has broken his hip and is in hospital. Given the only time I've seen him in the last 3 years was my grandfather's funeral, and when I had appendicitis - their choice - should I go visit? I'm inclined to no, the bf says I aught to. 
Thoughts?","&lt;!-- SC_OFF --&gt;&lt;div class=""md""&gt;&lt;p&gt;Short version: my father (68 years old) has broken his hip and is in hospital. Given the only time I&amp;#39;ve seen him in the last 3 years was my grandfather&amp;#39;s funeral, and when I had appendicitis - their choice - should I go visit? I&amp;#39;m inclined to no, the bf says I aught to. 
Thoughts?&lt;/p&gt;
&lt;/div&gt;&lt;!-- SC_ON --&gt;","False","askgaybros","t5_2vgfw","","","Family: to visit or not?","2","http://www.reddit.com/r/askgaybros/comments/2ivd98/family_to_visit_or_not/","[]","False"
