"","_comment_sort","_comments","_comments_by_id","_info_url","_orphaned","_params","_replaced_more","_underscore_names","approved_by","archived","author","author_flair_css_class","author_flair_text","banned_by","clicked","created","created_utc","distinguished","domain","downs","edited","gilded","has_fetched","hidden","id","is_self","json_dict","likes","link_flair_css_class","link_flair_text","media","media_embed","mod_reports","name","num_comments","num_reports","over_18","permalink","reddit_session","report_reasons","saved","score","secure_media","secure_media_embed","selftext","selftext_html","stickied","subreddit","subreddit_id","suggested_sort","thumbnail","title","ups","url","user_reports","visited"
"27","","","{}","http://www.reddit.com/api/info/","{}","{}","False","","","True","gary1995","","","","False","1414360259.0","1414356659.0","","self.askgaybros","0","False","0","True","False","2kef0d","True","","","","","","{}","[]","t3_2kef0d","41","","False","http://www.reddit.com/r/askgaybros/comments/2kef0d/what_country_do_you_think_has_the_best_looking_men/","Unauthenticated reddit sesssion","","False","7","","{}","Ok before we begin and people get all political on me. I know there are beautiful and ugly people all over the world, in every country in the world.

My question is have you ever went anywhere and thought OMG hotties everywhere here :P 
","&lt;!-- SC_OFF --&gt;&lt;div class=""md""&gt;&lt;p&gt;Ok before we begin and people get all political on me. I know there are beautiful and ugly people all over the world, in every country in the world.&lt;/p&gt;

&lt;p&gt;My question is have you ever went anywhere and thought OMG hotties everywhere here :P &lt;/p&gt;
&lt;/div&gt;&lt;!-- SC_ON --&gt;","False","askgaybros","t5_2vgfw","","","What country do you think has the best looking men?","7","http://www.reddit.com/r/askgaybros/comments/2kef0d/what_country_do_you_think_has_the_best_looking_men/","[]","False"
"28","","","{}","http://www.reddit.com/api/info/","{}","{}","False","","","True","homosaurusrexalot","","","","False","1414355050.0","1414351450.0","","self.askgaybros","0","False","0","True","False","2ke55x","True","","","","","","{}","[]","t3_2ke55x","4","","False","http://www.reddit.com/r/askgaybros/comments/2ke55x/anyone_have_a_fave_online_source_for_poppers/","Unauthenticated reddit sesssion","","False","0","","{}","I'll admit it: I'm a popperbator. I love to goon out. What's your go-to website for ordering poppers online? I'm sick of paying $20+ at my local sex shop for a small bottle. I'd rather get a good combo pack or maybe order from Europe/Canada? Help me out, GayBros! Whaddaya recommend?","&lt;!-- SC_OFF --&gt;&lt;div class=""md""&gt;&lt;p&gt;I&amp;#39;ll admit it: I&amp;#39;m a popperbator. I love to goon out. What&amp;#39;s your go-to website for ordering poppers online? I&amp;#39;m sick of paying $20+ at my local sex shop for a small bottle. I&amp;#39;d rather get a good combo pack or maybe order from Europe/Canada? Help me out, GayBros! Whaddaya recommend?&lt;/p&gt;
&lt;/div&gt;&lt;!-- SC_ON --&gt;","False","askgaybros","t5_2vgfw","","","Anyone have a fave online source for poppers?","0","http://www.reddit.com/r/askgaybros/comments/2ke55x/anyone_have_a_fave_online_source_for_poppers/","[]","False"
"29","","","{}","http://www.reddit.com/api/info/","{}","{}","False","","","True","throwaway1026145","","","","False","1414350749.0","1414347149.0","","self.askgaybros","0","False","0","True","False","2kdxss","True","","","","","","{}","[]","t3_2kdxss","20","","False","http://www.reddit.com/r/askgaybros/comments/2kdxss/tips_on_making_a_move_on_a_friend/","Unauthenticated reddit sesssion","","False","9","","{}","I met this guy last september when we were both starting the same university program. He was nice, cute, interesting but I assumed he was straight and never gave him that much thought. We hung out a few times at school events, and became good friends, but never *that* close.

A few months ago I found out that he is gay, and that he knows I'm gay as well. It came up naturally in conversation, but I was surprised.

Since then I have started to develop feelings for him. I value his friendship, but I want more. I've got some hints that he might be interested in me (mostly just how friendly he is with me), but I am still not sure.

We have been drifting apart lately. I have not seen him in a few weeks. We are in different classes and have different groups of friends. I want to make a move before it's too late.

I have never asked anyone out except online. I do not know if he is interested in me, or even if he is single. I know I should say something to him, but I'm not sure what. Some things I have thought about doing:

(1) Asking him out on a date


(2) asking him to hang out as friends and then flirting with him (this would be new to me, Ive never flirted with anyone in real life)

(3) asking him to hang out and then being honest about my feelings

(4) sending him a long facebook message explaining how I feel

(5) Getting a mutual friend to find out if he is interested (yes, I'm a pre-teen girl with a crush)

(6) Not doing anything and hope we somehow start seeing each other more

(7) Wait until the next time we are in the same room, pulling him aside, and telling him the truth. This might not be for a few more weeks,

If anyone has any tips for how to make a move, without risking our friendship or coming off creepy and desperate, let me know. I am not *in love* with the guy, but I do spend an unpleasant amount of time thinking about him.

TLDR: I like a guy. I want to take it from friends to something more. tips?

","&lt;!-- SC_OFF --&gt;&lt;div class=""md""&gt;&lt;p&gt;I met this guy last september when we were both starting the same university program. He was nice, cute, interesting but I assumed he was straight and never gave him that much thought. We hung out a few times at school events, and became good friends, but never &lt;em&gt;that&lt;/em&gt; close.&lt;/p&gt;

&lt;p&gt;A few months ago I found out that he is gay, and that he knows I&amp;#39;m gay as well. It came up naturally in conversation, but I was surprised.&lt;/p&gt;

&lt;p&gt;Since then I have started to develop feelings for him. I value his friendship, but I want more. I&amp;#39;ve got some hints that he might be interested in me (mostly just how friendly he is with me), but I am still not sure.&lt;/p&gt;

&lt;p&gt;We have been drifting apart lately. I have not seen him in a few weeks. We are in different classes and have different groups of friends. I want to make a move before it&amp;#39;s too late.&lt;/p&gt;

&lt;p&gt;I have never asked anyone out except online. I do not know if he is interested in me, or even if he is single. I know I should say something to him, but I&amp;#39;m not sure what. Some things I have thought about doing:&lt;/p&gt;

&lt;p&gt;(1) Asking him out on a date&lt;/p&gt;

&lt;p&gt;(2) asking him to hang out as friends and then flirting with him (this would be new to me, Ive never flirted with anyone in real life)&lt;/p&gt;

&lt;p&gt;(3) asking him to hang out and then being honest about my feelings&lt;/p&gt;

&lt;p&gt;(4) sending him a long facebook message explaining how I feel&lt;/p&gt;

&lt;p&gt;(5) Getting a mutual friend to find out if he is interested (yes, I&amp;#39;m a pre-teen girl with a crush)&lt;/p&gt;

&lt;p&gt;(6) Not doing anything and hope we somehow start seeing each other more&lt;/p&gt;

&lt;p&gt;(7) Wait until the next time we are in the same room, pulling him aside, and telling him the truth. This might not be for a few more weeks,&lt;/p&gt;

&lt;p&gt;If anyone has any tips for how to make a move, without risking our friendship or coming off creepy and desperate, let me know. I am not &lt;em&gt;in love&lt;/em&gt; with the guy, but I do spend an unpleasant amount of time thinking about him.&lt;/p&gt;

&lt;p&gt;TLDR: I like a guy. I want to take it from friends to something more. tips?&lt;/p&gt;
&lt;/div&gt;&lt;!-- SC_ON --&gt;","False","askgaybros","t5_2vgfw","","","Tips on making a move on a friend?","9","http://www.reddit.com/r/askgaybros/comments/2kdxss/tips_on_making_a_move_on_a_friend/","[]","False"
"30","","","{}","http://www.reddit.com/api/info/","{}","{}","False","","","True","The_significant","","","","False","1414349622.0","1414346022.0","","self.askgaybros","0","False","0","True","False","2kdvtm","True","","","","","","{}","[]","t3_2kdvtm","8","","False","http://www.reddit.com/r/askgaybros/comments/2kdvtm/bathhouses_whats_the_protocol_saw_a_post_a_few/","Unauthenticated reddit sesssion","","False","8","","{}","","","False","askgaybros","t5_2vgfw","","","Bathhouses. What's the protocol? (Saw a post a few days ago about this now I can't find it)","8","http://www.reddit.com/r/askgaybros/comments/2kdvtm/bathhouses_whats_the_protocol_saw_a_post_a_few/","[]","False"
"31","","","{}","http://www.reddit.com/api/info/","{}","{}","False","","","True","Baconbits4e","","","","False","1414349053.0","1414345453.0","","self.askgaybros","0","False","0","True","False","2kduv1","True","","","","","","{}","[]","t3_2kduv1","9","","False","http://www.reddit.com/r/askgaybros/comments/2kduv1/relationship/","Unauthenticated reddit sesssion","","False","6","","{}","Sooooo, I met this great guy, we've been hanging out a lot, and I do like him but I have some hang ups about going out with him, he's 19 (I'm 28) in school full time and doesn't have a car. The relationship so far is very dependent on me, if I don't pick him up we don't hang out. Can a relationship work like this? Do you guys think I'm wasting my time?","&lt;!-- SC_OFF --&gt;&lt;div class=""md""&gt;&lt;p&gt;Sooooo, I met this great guy, we&amp;#39;ve been hanging out a lot, and I do like him but I have some hang ups about going out with him, he&amp;#39;s 19 (I&amp;#39;m 28) in school full time and doesn&amp;#39;t have a car. The relationship so far is very dependent on me, if I don&amp;#39;t pick him up we don&amp;#39;t hang out. Can a relationship work like this? Do you guys think I&amp;#39;m wasting my time?&lt;/p&gt;
&lt;/div&gt;&lt;!-- SC_ON --&gt;","False","askgaybros","t5_2vgfw","","","Relationship?","6","http://www.reddit.com/r/askgaybros/comments/2kduv1/relationship/","[]","False"
"32","","","{}","http://www.reddit.com/api/info/","{}","{}","False","","","True","AspiringStoic","","","","False","1414344363.0","1414340763.0","","self.askgaybros","0","False","0","True","False","2kdn3j","True","","","","","","{}","[]","t3_2kdn3j","11","","False","http://www.reddit.com/r/askgaybros/comments/2kdn3j/gaybros_infrom_argentina/","Unauthenticated reddit sesssion","","False","3","","{}","How is the life for gays in Argentina? Would it be comparable to a U.S. or Western European city? Opportunities may arise in the future for me to work most likely in Buenos Aires.

I'd be 22 and would be a young professional there.","&lt;!-- SC_OFF --&gt;&lt;div class=""md""&gt;&lt;p&gt;How is the life for gays in Argentina? Would it be comparable to a U.S. or Western European city? Opportunities may arise in the future for me to work most likely in Buenos Aires.&lt;/p&gt;

&lt;p&gt;I&amp;#39;d be 22 and would be a young professional there.&lt;/p&gt;
&lt;/div&gt;&lt;!-- SC_ON --&gt;","False","askgaybros","t5_2vgfw","","","Gaybros in/from Argentina","3","http://www.reddit.com/r/askgaybros/comments/2kdn3j/gaybros_infrom_argentina/","[]","False"
