"","_comment_sort","_comments","_comments_by_id","_info_url","_orphaned","_params","_replaced_more","_underscore_names","approved_by","archived","author","author_flair_css_class","author_flair_text","banned_by","clicked","created","created_utc","distinguished","domain","downs","edited","gilded","has_fetched","hidden","id","is_self","json_dict","likes","link_flair_css_class","link_flair_text","media","media_embed","mod_reports","name","num_comments","num_reports","over_18","permalink","reddit_session","report_reasons","saved","score","secure_media","secure_media_embed","selftext","selftext_html","stickied","subreddit","subreddit_id","suggested_sort","thumbnail","title","ups","url","user_reports","visited"
"11","","","{}","http://www.reddit.com/api/info/","{}","{}","False","","","False","COMPUTER_FREAK","","","","False","1418779189.0","1418779189.0","","self.askgaybros","0","False","0","True","False","2pj378","True","","","","","","{}","[]","t3_2pj378","8","","False","http://www.reddit.com/r/askgaybros/comments/2pj378/how_many_homophobes_have_you_encountered_in_your/","Unauthenticated reddit sesssion","","False","1","","{}","I have encountered one that told me he wasn't dissing gays, even known he said that we should all burn in the deepest depths of hell, but he was just trying spread the word of God. That is obviously dissing gays. What are some stupid things people have said to you?
","&lt;!-- SC_OFF --&gt;&lt;div class=""md""&gt;&lt;p&gt;I have encountered one that told me he wasn&amp;#39;t dissing gays, even known he said that we should all burn in the deepest depths of hell, but he was just trying spread the word of God. That is obviously dissing gays. What are some stupid things people have said to you?&lt;/p&gt;
&lt;/div&gt;&lt;!-- SC_ON --&gt;","False","askgaybros","t5_2vgfw","","","How many homophobes have you encountered in your life that were just plain stupid?","1","http://www.reddit.com/r/askgaybros/comments/2pj378/how_many_homophobes_have_you_encountered_in_your/","[]","False"
"12","","","{}","http://www.reddit.com/api/info/","{}","{}","False","","","False","nervousgy","","","","False","1418774676.0","1418774676.0","","self.askgaybros","0","False","0","True","False","2piulc","True","","","","","","{}","[]","t3_2piulc","20","","False","http://www.reddit.com/r/askgaybros/comments/2piulc/1st_experience_wguy_and_needed_to_jerk_myself/","Unauthenticated reddit sesssion","","False","4","","{}","Hi all, I'm sure you get a lot of these, but I need some advice or hopefully something to calm my nerves.

I am 26 and for various reasons that I've been working on I am still a virgin. Long story short, I've been working on the reasons and met up with a nice guy who said he was only interested in cuddling ""platonically"". He was attractive enough and prob the only reason I was willing was because cuddling seemed so safe to me with no expectations...even if I was mad curious if he actually really did just want to cuddle.

So, i invite him over and we pick a movie and start cuddling and it's great. I am doing my best to not give up myself as a horny teenager that gets turned on by every little thing (I still do because of my inexperience I'm sure). Finally, movie finishes and we're talking and then start kissing and it goes from there.

I only kissed one other guy and it was on vacation this past summer at a gay bar. It came naturally to me and I enjoyed kissing him even if looking back the guy wasn't really attractive to me much at all. But this guy...I'm liking that I can now feel him up and he's not AMAZING, but he is cute, but I just didn't seem to feel all that much kissing him. I felt like I was having to think about what I was doing and it just wasn't going well...but no idea if he felt the same.

Anyway, we move the bedroom and continue kissing. I take off his pants and start sucking a bit on his dick through his underwear. I take it off and I feel horrible for saying it...but he was kinda small and idk it just didn't do much for me. I guess I was a little disappointed? I don't consider myself a size queen at all and maybe I just have bad expectations, but I think he was below 5 for sure.

Anyway I suck him a bit, but he doesn't really do much but then pulls me up to kiss him and then he takes my pants off. This is where I get worried because he started sucking me (although I really don't feel anything at all?) and jerking me but I can't stay hard. I am really worrying now and not understand how that is. I'm guessing he got the picture because he stops and comes back up and we just resume kissing.

I played around a bit more from that rolling around the bed, trying 69 a little bit and whatever. That usually got my at least a little hard again, but idk once his hand or mouth was involved and I wasn't doing anything I couldn't seem to be too enthused :(.

I ended up jerking him off at the end and then I used my own hand for me while he kissed me.

Guys, I'm really worried. What if I've watched too much porn and stuff and won't be able to get off except with my own hand and thoughts instead of what's actually going on in real life? I never have trouble getting off myself even several times a day. I am constantly horny...too horny really. But then I get a real guy and can't perform?

I'm trying to placate myself in that he didn't really communicate much or moan or anything which I think I'd love. Didn't seem too interested in blowing me or anything, but i just don't know if that's the reason or not.

he seemed like a nice enough guy, I liked his body mostly (except his dick :( ) and was turned on when cuddling and stuff but idk. grinding out bodies together or him using his hand or mouth did nothing for me. 

What do you guys think? Btw, this is a throwaway account in case you couldn't tell.","&lt;!-- SC_OFF --&gt;&lt;div class=""md""&gt;&lt;p&gt;Hi all, I&amp;#39;m sure you get a lot of these, but I need some advice or hopefully something to calm my nerves.&lt;/p&gt;

&lt;p&gt;I am 26 and for various reasons that I&amp;#39;ve been working on I am still a virgin. Long story short, I&amp;#39;ve been working on the reasons and met up with a nice guy who said he was only interested in cuddling &amp;quot;platonically&amp;quot;. He was attractive enough and prob the only reason I was willing was because cuddling seemed so safe to me with no expectations...even if I was mad curious if he actually really did just want to cuddle.&lt;/p&gt;

&lt;p&gt;So, i invite him over and we pick a movie and start cuddling and it&amp;#39;s great. I am doing my best to not give up myself as a horny teenager that gets turned on by every little thing (I still do because of my inexperience I&amp;#39;m sure). Finally, movie finishes and we&amp;#39;re talking and then start kissing and it goes from there.&lt;/p&gt;

&lt;p&gt;I only kissed one other guy and it was on vacation this past summer at a gay bar. It came naturally to me and I enjoyed kissing him even if looking back the guy wasn&amp;#39;t really attractive to me much at all. But this guy...I&amp;#39;m liking that I can now feel him up and he&amp;#39;s not AMAZING, but he is cute, but I just didn&amp;#39;t seem to feel all that much kissing him. I felt like I was having to think about what I was doing and it just wasn&amp;#39;t going well...but no idea if he felt the same.&lt;/p&gt;

&lt;p&gt;Anyway, we move the bedroom and continue kissing. I take off his pants and start sucking a bit on his dick through his underwear. I take it off and I feel horrible for saying it...but he was kinda small and idk it just didn&amp;#39;t do much for me. I guess I was a little disappointed? I don&amp;#39;t consider myself a size queen at all and maybe I just have bad expectations, but I think he was below 5 for sure.&lt;/p&gt;

&lt;p&gt;Anyway I suck him a bit, but he doesn&amp;#39;t really do much but then pulls me up to kiss him and then he takes my pants off. This is where I get worried because he started sucking me (although I really don&amp;#39;t feel anything at all?) and jerking me but I can&amp;#39;t stay hard. I am really worrying now and not understand how that is. I&amp;#39;m guessing he got the picture because he stops and comes back up and we just resume kissing.&lt;/p&gt;

&lt;p&gt;I played around a bit more from that rolling around the bed, trying 69 a little bit and whatever. That usually got my at least a little hard again, but idk once his hand or mouth was involved and I wasn&amp;#39;t doing anything I couldn&amp;#39;t seem to be too enthused :(.&lt;/p&gt;

&lt;p&gt;I ended up jerking him off at the end and then I used my own hand for me while he kissed me.&lt;/p&gt;

&lt;p&gt;Guys, I&amp;#39;m really worried. What if I&amp;#39;ve watched too much porn and stuff and won&amp;#39;t be able to get off except with my own hand and thoughts instead of what&amp;#39;s actually going on in real life? I never have trouble getting off myself even several times a day. I am constantly horny...too horny really. But then I get a real guy and can&amp;#39;t perform?&lt;/p&gt;

&lt;p&gt;I&amp;#39;m trying to placate myself in that he didn&amp;#39;t really communicate much or moan or anything which I think I&amp;#39;d love. Didn&amp;#39;t seem too interested in blowing me or anything, but i just don&amp;#39;t know if that&amp;#39;s the reason or not.&lt;/p&gt;

&lt;p&gt;he seemed like a nice enough guy, I liked his body mostly (except his dick :( ) and was turned on when cuddling and stuff but idk. grinding out bodies together or him using his hand or mouth did nothing for me. &lt;/p&gt;

&lt;p&gt;What do you guys think? Btw, this is a throwaway account in case you couldn&amp;#39;t tell.&lt;/p&gt;
&lt;/div&gt;&lt;!-- SC_ON --&gt;","False","askgaybros","t5_2vgfw","","","1st experience w/guy and needed to jerk myself? :(","4","http://www.reddit.com/r/askgaybros/comments/2piulc/1st_experience_wguy_and_needed_to_jerk_myself/","[]","False"
"13","","","{}","http://www.reddit.com/api/info/","{}","{}","False","","","False","ahoym80z","","","","False","1418774254.0","1418774254.0","","self.askgaybros","0","False","0","True","False","2pitrb","True","","","","","","{}","[]","t3_2pitrb","13","","False","http://www.reddit.com/r/askgaybros/comments/2pitrb/first_sex_toy/","Unauthenticated reddit sesssion","","False","6","","{}","Hi guys,

I was looking to buy my first sex toy, but really don't know what to get.

I'm vers, so anything would be cool, but I don't know if I want a fleshlight or a dildo. Or perhaps an Aneros prostate massager?

I've heard fleshlights are awesome, but a pain in the ass to clean regularly. Worth it?

A bigger dildo seems like it could be fun, but I feel like I want something more exciting, so I thought the prostate massager. Any thoughts on that?

Any suggestions/feedback would be awesome! I'm planning on buying from Amazon just for simplicity's sake.","&lt;!-- SC_OFF --&gt;&lt;div class=""md""&gt;&lt;p&gt;Hi guys,&lt;/p&gt;

&lt;p&gt;I was looking to buy my first sex toy, but really don&amp;#39;t know what to get.&lt;/p&gt;

&lt;p&gt;I&amp;#39;m vers, so anything would be cool, but I don&amp;#39;t know if I want a fleshlight or a dildo. Or perhaps an Aneros prostate massager?&lt;/p&gt;

&lt;p&gt;I&amp;#39;ve heard fleshlights are awesome, but a pain in the ass to clean regularly. Worth it?&lt;/p&gt;

&lt;p&gt;A bigger dildo seems like it could be fun, but I feel like I want something more exciting, so I thought the prostate massager. Any thoughts on that?&lt;/p&gt;

&lt;p&gt;Any suggestions/feedback would be awesome! I&amp;#39;m planning on buying from Amazon just for simplicity&amp;#39;s sake.&lt;/p&gt;
&lt;/div&gt;&lt;!-- SC_ON --&gt;","False","askgaybros","t5_2vgfw","","","First sex toy","6","http://www.reddit.com/r/askgaybros/comments/2pitrb/first_sex_toy/","[]","False"
"14","","","{}","http://www.reddit.com/api/info/","{}","{}","False","","","False","mentos345","","","","False","1418766322.0","1418766322.0","","self.askgaybros","0","1418768650.0","0","True","False","2pie1p","True","","","","","","{}","[]","t3_2pie1p","22","","False","http://www.reddit.com/r/askgaybros/comments/2pie1p/im_in_love_with_my_best_friend_and_i_need_help_to/","Unauthenticated reddit sesssion","","False","6","","{}","I'm in love with my straight best friend and I'm currently living with him. He doesn't know I'm gay and up until a few days ago I don't think he suspected. On the last night of the semester I fell asleep on our couch with my phone on grindr. When I woke up I realized he covered be with a blanket and my phone was still on. I suspect he saw my phone but he hasn't said anything since. I really want to tell him I love him cause my semester went to hell trying to please him and worrying about my jealousy. I feel like telling him will help me cope and allow me to begin a a better semester but it would be life changing. any advice?","&lt;!-- SC_OFF --&gt;&lt;div class=""md""&gt;&lt;p&gt;I&amp;#39;m in love with my straight best friend and I&amp;#39;m currently living with him. He doesn&amp;#39;t know I&amp;#39;m gay and up until a few days ago I don&amp;#39;t think he suspected. On the last night of the semester I fell asleep on our couch with my phone on grindr. When I woke up I realized he covered be with a blanket and my phone was still on. I suspect he saw my phone but he hasn&amp;#39;t said anything since. I really want to tell him I love him cause my semester went to hell trying to please him and worrying about my jealousy. I feel like telling him will help me cope and allow me to begin a a better semester but it would be life changing. any advice?&lt;/p&gt;
&lt;/div&gt;&lt;!-- SC_ON --&gt;","False","askgaybros","t5_2vgfw","","","I'm in love with my best friend and I need help to cope","6","http://www.reddit.com/r/askgaybros/comments/2pie1p/im_in_love_with_my_best_friend_and_i_need_help_to/","[]","False"
"15","","","{}","http://www.reddit.com/api/info/","{}","{}","False","","","False","pitabread58","","","","False","1418764518.0","1418764518.0","","self.askgaybros","0","False","0","True","False","2piabs","True","","","","","","{}","[]","t3_2piabs","24","","False","http://www.reddit.com/r/askgaybros/comments/2piabs/research_study_nurse_off_limits/","Unauthenticated reddit sesssion","","False","1","","{}","Ok, so long story short, I'm part of a research study at an lgbt clinic (essentially undetectable without going on meds), and all 3 of my nurses have been really nice, attractive guys.

Now, would you consider this off-limits? I'm assuming so, but I just wanted other people's opinions on this. I'm not saying hookup but asking them out. I'm bad at this haha.","&lt;!-- SC_OFF --&gt;&lt;div class=""md""&gt;&lt;p&gt;Ok, so long story short, I&amp;#39;m part of a research study at an lgbt clinic (essentially undetectable without going on meds), and all 3 of my nurses have been really nice, attractive guys.&lt;/p&gt;

&lt;p&gt;Now, would you consider this off-limits? I&amp;#39;m assuming so, but I just wanted other people&amp;#39;s opinions on this. I&amp;#39;m not saying hookup but asking them out. I&amp;#39;m bad at this haha.&lt;/p&gt;
&lt;/div&gt;&lt;!-- SC_ON --&gt;","False","askgaybros","t5_2vgfw","","","Research study nurse: off limits?","1","http://www.reddit.com/r/askgaybros/comments/2piabs/research_study_nurse_off_limits/","[]","False"
"16","","","{}","http://www.reddit.com/api/info/","{}","{}","False","","","False","DogOfSevenless","","","","False","1418762539.0","1418762539.0","","self.askgaybros","0","False","0","True","False","2pi67z","True","","","","","","{}","[]","t3_2pi67z","7","","False","http://www.reddit.com/r/askgaybros/comments/2pi67z/is_coming_out_something_i_should_be_doing_asap/","Unauthenticated reddit sesssion","","False","1","","{}","I feel like it's something that's potentially holding my life back. I'm out to my friends but not my family. I have no idea how they will react. I'm just generally scared of doing it and don't know how to do it. Would a hand written note mean any less than telling them in person. Is there even any rush to tell them? I'm 19.","&lt;!-- SC_OFF --&gt;&lt;div class=""md""&gt;&lt;p&gt;I feel like it&amp;#39;s something that&amp;#39;s potentially holding my life back. I&amp;#39;m out to my friends but not my family. I have no idea how they will react. I&amp;#39;m just generally scared of doing it and don&amp;#39;t know how to do it. Would a hand written note mean any less than telling them in person. Is there even any rush to tell them? I&amp;#39;m 19.&lt;/p&gt;
&lt;/div&gt;&lt;!-- SC_ON --&gt;","False","askgaybros","t5_2vgfw","","","Is coming out something I should be doing ASAP?","1","http://www.reddit.com/r/askgaybros/comments/2pi67z/is_coming_out_something_i_should_be_doing_asap/","[]","False"
"17","","","{}","http://www.reddit.com/api/info/","{}","{}","False","","","False","Munchieman2","","","","False","1418760498.0","1418760498.0","","self.askgaybros","0","False","0","True","False","2pi20t","True","","","","","","{}","[]","t3_2pi20t","11","","False","http://www.reddit.com/r/askgaybros/comments/2pi20t/coming_out_to_coworkers/","Unauthenticated reddit sesssion","","False","11","","{}","Hey all, I have been working for a school system for the past 5 years. I was hired full time about 6 months ago. Our department has about 10 people and I respect them all. 

Everybody talks about their lives and knows a lot about each other's personal life. When I'm asked how my weekend was I usually go ehh nothing interesting happened because I don't want to give anything away. 

I feel that in order for me to be comfortable I need to tell them. How did you guys do it? Should I tell the boss first? Should I tell the department all at once? one by one? It's just something that I know I need to get out, but I hate awkward situations so I never do anything about it.","&lt;!-- SC_OFF --&gt;&lt;div class=""md""&gt;&lt;p&gt;Hey all, I have been working for a school system for the past 5 years. I was hired full time about 6 months ago. Our department has about 10 people and I respect them all. &lt;/p&gt;

&lt;p&gt;Everybody talks about their lives and knows a lot about each other&amp;#39;s personal life. When I&amp;#39;m asked how my weekend was I usually go ehh nothing interesting happened because I don&amp;#39;t want to give anything away. &lt;/p&gt;

&lt;p&gt;I feel that in order for me to be comfortable I need to tell them. How did you guys do it? Should I tell the boss first? Should I tell the department all at once? one by one? It&amp;#39;s just something that I know I need to get out, but I hate awkward situations so I never do anything about it.&lt;/p&gt;
&lt;/div&gt;&lt;!-- SC_ON --&gt;","False","askgaybros","t5_2vgfw","","","Coming out to coworkers?","11","http://www.reddit.com/r/askgaybros/comments/2pi20t/coming_out_to_coworkers/","[]","False"
"18","","","{}","http://www.reddit.com/api/info/","{}","{}","False","","","False","NotAmused1001","","","","False","1418758764.0","1418758764.0","","self.askgaybros","0","False","0","True","False","2phygk","True","","","","","","{}","[]","t3_2phygk","5","","False","http://www.reddit.com/r/askgaybros/comments/2phygk/nye_in_palm_springs/","Unauthenticated reddit sesssion","","False","0","","{}","Hey guys, my SO and I will be spending NYE in Palm Springs this year.  Anyone have any suggestions on what to do for the evening?  I've never been, so your advice is welcome!","&lt;!-- SC_OFF --&gt;&lt;div class=""md""&gt;&lt;p&gt;Hey guys, my SO and I will be spending NYE in Palm Springs this year.  Anyone have any suggestions on what to do for the evening?  I&amp;#39;ve never been, so your advice is welcome!&lt;/p&gt;
&lt;/div&gt;&lt;!-- SC_ON --&gt;","False","askgaybros","t5_2vgfw","","","NYE in Palm Springs?","0","http://www.reddit.com/r/askgaybros/comments/2phygk/nye_in_palm_springs/","[]","False"
"19","","","{}","http://www.reddit.com/api/info/","{}","{}","False","","","False","look76","","","","False","1418758306.0","1418758306.0","","self.askgaybros","0","False","0","True","False","2phxj4","True","","","","","","{}","[]","t3_2phxj4","10","","False","http://www.reddit.com/r/askgaybros/comments/2phxj4/do_you_have_a_boyfriend_what_he_like_only/","Unauthenticated reddit sesssion","","False","0","","{}","","","False","askgaybros","t5_2vgfw","","","Do you have a boyfriend? What he like? Only positive responses please! :)","0","http://www.reddit.com/r/askgaybros/comments/2phxj4/do_you_have_a_boyfriend_what_he_like_only/","[]","False"
