"","_comment_sort","_comments","_comments_by_id","_info_url","_orphaned","_params","_replaced_more","_underscore_names","approved_by","archived","author","author_flair_css_class","author_flair_text","banned_by","clicked","created","created_utc","distinguished","domain","downs","edited","gilded","has_fetched","hidden","id","is_self","json_dict","likes","link_flair_css_class","link_flair_text","media","media_embed","mod_reports","name","num_comments","num_reports","over_18","permalink","reddit_session","report_reasons","saved","score","secure_media","secure_media_embed","selftext","selftext_html","stickied","subreddit","subreddit_id","suggested_sort","thumbnail","title","ups","url","user_reports","visited"
"12","","","{}","http://www.reddit.com/api/info/","{}","{}","False","","","False","danielwhack","","","","False","1416956065.0","1416956065.0","","self.askgaybros","0","False","0","True","False","2nf5c6","True","","","","","","{}","[]","t3_2nf5c6","11","","False","http://www.reddit.com/r/askgaybros/comments/2nf5c6/have_you_ever_had_to_dump_a_bro/","Unauthenticated reddit sesssion","","False","2","","{}","Has anyone had to seriously break up a friendship with someone when neither you nor the friend in question had actually done something wrong?

I had a really great friend who I used to have over twice a week for hang time and every couple weeks I would go out with him and his clique. Then for reasons of busyness our hangs died down to a couple times a month and I stopped being invited out with his clique altogether. 
Cut to a year later and we haven't hung for a good couple months, which both of us are upset by. So we actually come up with a strategy to hang more and plan a couple weekends worth of stuff to happen in the coming weeks. He forgets to turn up or has to work through all of these things. One of them that really bugged me was his girlfriend was going away for a whole week so he had all his evenings and the weekend to hang. Then out of the blue he had to work all that week in the other side of the country, not back until late Friday night. That Friday night he got back at about midnight and was out with his clique and was so hung over we didn't hang that weekend. This really annoyed me so we had a heart to heart where I ask why I was dropped from his clique and he confessed that while his friends 'really liked me' he felt that there wasn't that group dynamic when I was there. At the end of this talk (which I felt humiliated for just bring up) we vowed to make an effort to see each other more.
So a year later and nothing really changed. We had a few dinners with partners (belurgh) and he invited me out to the movies with him whenever his girlfriend didn't want to go. We are not hang friends at all any more.
A couple months ago I was helping him move house. Technically I was helping his girlfriend move because he had to emergency work, and, interestingly for me, the two major players in his clique also turned up to help. After the move his girlfriend treated the four of us to lunch and as we finished up one of the clique started to work out what they should all get up to that night to celebrate moving in. They did this while I sat there. I was not involved or even thrown some eye contact as these three people who I used to hang with, and just spent the whole day working with, planned a party that I was not invited to. I felt so low at that point. I can't imagine a scenario where I wouldn't even throw an empty 'Oh you are invited too"" to someone I didn't  like to save my own embarrassment. But that was not a problem for either of the three of them. I learned from that moment that not only was I not 'really liked' by these people, nor was I even disliked, I was a non-entity to them. And these are the people my friend spends 10:1 of his time with compared to me.
I realise now I have become a 'private friend' in this guys life, and because I am explicitly excluded from his social life, it is never going to get better. I have friends who I think of as 'stable friends', friends you might call on to go see Transformers III or call on to make up a 5-a-side football team, but they are not hang-time friends. I don't want to be a stable friend to this guy.

TLDR
So what do I do. My friend is tied to a clique that I am excluded from. I can see fairly regularly *if* I host the hang-time, but I know that the should I slow down on it I won't see him any more. I think his friendship must mean a lot to me because I get a tummy ache thinking about it. And on the couple times I've slighted him he's told me it hurt, so I'm confident he likes me just as much too. 

Will I be happier to break it off and have that regret, or just continue to let this idle friendship limp on forever?","&lt;!-- SC_OFF --&gt;&lt;div class=""md""&gt;&lt;p&gt;Has anyone had to seriously break up a friendship with someone when neither you nor the friend in question had actually done something wrong?&lt;/p&gt;

&lt;p&gt;I had a really great friend who I used to have over twice a week for hang time and every couple weeks I would go out with him and his clique. Then for reasons of busyness our hangs died down to a couple times a month and I stopped being invited out with his clique altogether. 
Cut to a year later and we haven&amp;#39;t hung for a good couple months, which both of us are upset by. So we actually come up with a strategy to hang more and plan a couple weekends worth of stuff to happen in the coming weeks. He forgets to turn up or has to work through all of these things. One of them that really bugged me was his girlfriend was going away for a whole week so he had all his evenings and the weekend to hang. Then out of the blue he had to work all that week in the other side of the country, not back until late Friday night. That Friday night he got back at about midnight and was out with his clique and was so hung over we didn&amp;#39;t hang that weekend. This really annoyed me so we had a heart to heart where I ask why I was dropped from his clique and he confessed that while his friends &amp;#39;really liked me&amp;#39; he felt that there wasn&amp;#39;t that group dynamic when I was there. At the end of this talk (which I felt humiliated for just bring up) we vowed to make an effort to see each other more.
So a year later and nothing really changed. We had a few dinners with partners (belurgh) and he invited me out to the movies with him whenever his girlfriend didn&amp;#39;t want to go. We are not hang friends at all any more.
A couple months ago I was helping him move house. Technically I was helping his girlfriend move because he had to emergency work, and, interestingly for me, the two major players in his clique also turned up to help. After the move his girlfriend treated the four of us to lunch and as we finished up one of the clique started to work out what they should all get up to that night to celebrate moving in. They did this while I sat there. I was not involved or even thrown some eye contact as these three people who I used to hang with, and just spent the whole day working with, planned a party that I was not invited to. I felt so low at that point. I can&amp;#39;t imagine a scenario where I wouldn&amp;#39;t even throw an empty &amp;#39;Oh you are invited too&amp;quot; to someone I didn&amp;#39;t  like to save my own embarrassment. But that was not a problem for either of the three of them. I learned from that moment that not only was I not &amp;#39;really liked&amp;#39; by these people, nor was I even disliked, I was a non-entity to them. And these are the people my friend spends 10:1 of his time with compared to me.
I realise now I have become a &amp;#39;private friend&amp;#39; in this guys life, and because I am explicitly excluded from his social life, it is never going to get better. I have friends who I think of as &amp;#39;stable friends&amp;#39;, friends you might call on to go see Transformers III or call on to make up a 5-a-side football team, but they are not hang-time friends. I don&amp;#39;t want to be a stable friend to this guy.&lt;/p&gt;

&lt;p&gt;TLDR
So what do I do. My friend is tied to a clique that I am excluded from. I can see fairly regularly &lt;em&gt;if&lt;/em&gt; I host the hang-time, but I know that the should I slow down on it I won&amp;#39;t see him any more. I think his friendship must mean a lot to me because I get a tummy ache thinking about it. And on the couple times I&amp;#39;ve slighted him he&amp;#39;s told me it hurt, so I&amp;#39;m confident he likes me just as much too. &lt;/p&gt;

&lt;p&gt;Will I be happier to break it off and have that regret, or just continue to let this idle friendship limp on forever?&lt;/p&gt;
&lt;/div&gt;&lt;!-- SC_ON --&gt;","False","askgaybros","t5_2vgfw","","","Have you ever had to dump a bro?","2","http://www.reddit.com/r/askgaybros/comments/2nf5c6/have_you_ever_had_to_dump_a_bro/","[]","False"
"13","","","{}","http://www.reddit.com/api/info/","{}","{}","False","","","False","PepeAndMrDuck","","","","False","1416953360.0","1416953360.0","","self.askgaybros","0","1416955972.0","0","True","False","2nf03r","True","","","","","","{}","[]","t3_2nf03r","14","","False","http://www.reddit.com/r/askgaybros/comments/2nf03r/do_i_have_to_tell_my_ex_gf/","Unauthenticated reddit sesssion","","False","2","","{}","I feel like she is going to find out or has found out anyway and, even though we cross paths amiably every so often, I still know she's a bitch deep down, and would probably love to bring it up in a snarky way.

Haven't seen her in many years since before I came out and I might see her over xmas break. What do you do when that awkward mess happens?","&lt;!-- SC_OFF --&gt;&lt;div class=""md""&gt;&lt;p&gt;I feel like she is going to find out or has found out anyway and, even though we cross paths amiably every so often, I still know she&amp;#39;s a bitch deep down, and would probably love to bring it up in a snarky way.&lt;/p&gt;

&lt;p&gt;Haven&amp;#39;t seen her in many years since before I came out and I might see her over xmas break. What do you do when that awkward mess happens?&lt;/p&gt;
&lt;/div&gt;&lt;!-- SC_ON --&gt;","False","askgaybros","t5_2vgfw","","","Do I have to tell my ex gf? :/","2","http://www.reddit.com/r/askgaybros/comments/2nf03r/do_i_have_to_tell_my_ex_gf/","[]","False"
"14","","","{}","http://www.reddit.com/api/info/","{}","{}","False","","","False","SachBren","","","","False","1416949255.0","1416949255.0","","self.askgaybros","0","False","0","True","False","2nerku","True","","","","","","{}","[]","t3_2nerku","9","","False","http://www.reddit.com/r/askgaybros/comments/2nerku/was_told_by_rgaybros_to_post_this_here_need_advice/","Unauthenticated reddit sesssion","","False","14","","{}","**WARNING: LONG STORY**

To those who don't like personal stories/complaints, stop reading now and feel free to downvote. This is just something that I feel I can ask you guys about and get advice from an unbiased third-party.

I dated this guy for about a year. Let's call him G. I started seeing him the beginning of my sophomore year at college. A couple weeks into a semi-official monogamous relationship, I got black-out one night and cheated, something I never saw myself, or see myself ever again, doing. A month later, he found out. We had a rough patch after that but we managed to work it out.

Around the springtime, about 6 months in, I start getting messages from guys on skype. It started out as a ""friend"" of mine asking if I could help him discover if a guy he had a crush on was gay or not. I put friend in quotations because the skype username used the full name of an old friend of mine whom I hadn't talked to in a while.

Basically, this sends me down a rabbit hole. Guy 1 references me to Guy 2, Guy 2 to Guy 3 etc. All of these guys, by the pictures they send me, are stupid attractive. Like...9/10, 10/10. They flirt, I'm flattered but keep on insisting that I am taken. They are persistent. They claim to know G, my bf. They say he wants a threesome, and that they want in. Either that, or they reference me to the next guy.
This goes on for a while. Eventually G and I break up. Mostly from pressure by his friends who hate me, and also for personal reasons.

But these guys keep on messaging me. And no longer only on skype, but on Grindr (which I redownloaded a couple months after I became single) as well.

I start to see a pattern. Super hot guys who message me, flirt, who's cams are ""broken"" and phone's are too cheap to have any apps, too busy to take calls.

I realize it: I am being catfished. And not only a random catfish, but a huge thought-out catfishing operation.
They all have the same MO: ask the same stuff in the same way, use the same emoticons, have the same excuses, talk about threesomes.

On grindr you can see how far someone is right? At school they are all, every single one, 1 mile away. G, my ex, lives 1 mile away. He works in DC every other day. On those days, he is 49 miles away. Every single account is then 49 miles away.

Now, I would not give a duck's shit about this if it were not for the fact that it has been going on for over a year now. I barely use grindr, and its usually for shits and gigs, but whichever profile is in use at the time always messages me. Attractive guys. Makes you feel good. When they're fake, dampens your confidence a bit.

And, not to mention, he/they have been sending around pictures of myself, private pictures I had only sent to my ex, to other guys on grindr. Saying I am dtf and want a threesome. There is more stuff/proof out there but I can't think of it at the top of my head at the moment.

So...advice? I want to confront him. This is fucked up. But should I waste my time? Is it worth the confrontation?

**TLDR: ex is possibly a psychopath/sociopath. Need advice**","&lt;!-- SC_OFF --&gt;&lt;div class=""md""&gt;&lt;p&gt;&lt;strong&gt;WARNING: LONG STORY&lt;/strong&gt;&lt;/p&gt;

&lt;p&gt;To those who don&amp;#39;t like personal stories/complaints, stop reading now and feel free to downvote. This is just something that I feel I can ask you guys about and get advice from an unbiased third-party.&lt;/p&gt;

&lt;p&gt;I dated this guy for about a year. Let&amp;#39;s call him G. I started seeing him the beginning of my sophomore year at college. A couple weeks into a semi-official monogamous relationship, I got black-out one night and cheated, something I never saw myself, or see myself ever again, doing. A month later, he found out. We had a rough patch after that but we managed to work it out.&lt;/p&gt;

&lt;p&gt;Around the springtime, about 6 months in, I start getting messages from guys on skype. It started out as a &amp;quot;friend&amp;quot; of mine asking if I could help him discover if a guy he had a crush on was gay or not. I put friend in quotations because the skype username used the full name of an old friend of mine whom I hadn&amp;#39;t talked to in a while.&lt;/p&gt;

&lt;p&gt;Basically, this sends me down a rabbit hole. Guy 1 references me to Guy 2, Guy 2 to Guy 3 etc. All of these guys, by the pictures they send me, are stupid attractive. Like...9/10, 10/10. They flirt, I&amp;#39;m flattered but keep on insisting that I am taken. They are persistent. They claim to know G, my bf. They say he wants a threesome, and that they want in. Either that, or they reference me to the next guy.
This goes on for a while. Eventually G and I break up. Mostly from pressure by his friends who hate me, and also for personal reasons.&lt;/p&gt;

&lt;p&gt;But these guys keep on messaging me. And no longer only on skype, but on Grindr (which I redownloaded a couple months after I became single) as well.&lt;/p&gt;

&lt;p&gt;I start to see a pattern. Super hot guys who message me, flirt, who&amp;#39;s cams are &amp;quot;broken&amp;quot; and phone&amp;#39;s are too cheap to have any apps, too busy to take calls.&lt;/p&gt;

&lt;p&gt;I realize it: I am being catfished. And not only a random catfish, but a huge thought-out catfishing operation.
They all have the same MO: ask the same stuff in the same way, use the same emoticons, have the same excuses, talk about threesomes.&lt;/p&gt;

&lt;p&gt;On grindr you can see how far someone is right? At school they are all, every single one, 1 mile away. G, my ex, lives 1 mile away. He works in DC every other day. On those days, he is 49 miles away. Every single account is then 49 miles away.&lt;/p&gt;

&lt;p&gt;Now, I would not give a duck&amp;#39;s shit about this if it were not for the fact that it has been going on for over a year now. I barely use grindr, and its usually for shits and gigs, but whichever profile is in use at the time always messages me. Attractive guys. Makes you feel good. When they&amp;#39;re fake, dampens your confidence a bit.&lt;/p&gt;

&lt;p&gt;And, not to mention, he/they have been sending around pictures of myself, private pictures I had only sent to my ex, to other guys on grindr. Saying I am dtf and want a threesome. There is more stuff/proof out there but I can&amp;#39;t think of it at the top of my head at the moment.&lt;/p&gt;

&lt;p&gt;So...advice? I want to confront him. This is fucked up. But should I waste my time? Is it worth the confrontation?&lt;/p&gt;

&lt;p&gt;&lt;strong&gt;TLDR: ex is possibly a psychopath/sociopath. Need advice&lt;/strong&gt;&lt;/p&gt;
&lt;/div&gt;&lt;!-- SC_ON --&gt;","False","askgaybros","t5_2vgfw","","","Was told by /r/gaybros to post this here. Need advice..","14","http://www.reddit.com/r/askgaybros/comments/2nerku/was_told_by_rgaybros_to_post_this_here_need_advice/","[]","False"
"15","","","{}","http://www.reddit.com/api/info/","{}","{}","False","","","False","Ooheythere","","","","False","1416943563.0","1416943563.0","","self.askgaybros","0","False","0","True","False","2nef5i","True","","","","","","{}","[]","t3_2nef5i","11","","False","http://www.reddit.com/r/askgaybros/comments/2nef5i/anyone_else_feel_like_theyve_never_made_love/","Unauthenticated reddit sesssion","","False","12","","{}","I mean, I've had sex but I get this sense that there's more to it.  I've never been with anyone for very long, and I've never been in love.  I'm guessing you'd have to be in love with someone to experience that...  Or I'm just once again an overly hopeless romantic, haha!  ","&lt;!-- SC_OFF --&gt;&lt;div class=""md""&gt;&lt;p&gt;I mean, I&amp;#39;ve had sex but I get this sense that there&amp;#39;s more to it.  I&amp;#39;ve never been with anyone for very long, and I&amp;#39;ve never been in love.  I&amp;#39;m guessing you&amp;#39;d have to be in love with someone to experience that...  Or I&amp;#39;m just once again an overly hopeless romantic, haha!  &lt;/p&gt;
&lt;/div&gt;&lt;!-- SC_ON --&gt;","False","askgaybros","t5_2vgfw","","","Anyone else feel like they've never made love?","12","http://www.reddit.com/r/askgaybros/comments/2nef5i/anyone_else_feel_like_theyve_never_made_love/","[]","False"
"16","","","{}","http://www.reddit.com/api/info/","{}","{}","False","","","False","3486842384","","","","False","1416940615.0","1416940615.0","","self.askgaybros","0","1416949641.0","0","True","False","2ne8o7","True","","","","","","{}","[]","t3_2ne8o7","24","","False","http://www.reddit.com/r/askgaybros/comments/2ne8o7/has_anyone_been_circumcised_as_an_adult_looking/","Unauthenticated reddit sesssion","","False","8","","{}","Hey, so my boyfriend had to get a circumcision for medical reasons yesterday.

He is in a lot of pain when he moves and finds it really hard to change the dressing. I'm hoping someone who has been through it can give us some advice.

* How long does the pain/discomfort last?

* Any tips on washing it and changing the dressing?

* How long until the hypersensitivity goes away?

* How do you deal with the hypersensitivity?

He's also concerned about what it will look like.

* How did yours turn out?

* Does it look the same as someone who was circumcised when they were young?

* How long does it take before it looks normal?

* Any other general advice?

Thanks

Edit: I'm just looking for general advice from other sources, not catch-all medical advice. I understand everyone is different but a technique you've tried or a tip you've heard may help him out a little.  
He isn't going to do something stupid/dangerous because reddit told him.","&lt;!-- SC_OFF --&gt;&lt;div class=""md""&gt;&lt;p&gt;Hey, so my boyfriend had to get a circumcision for medical reasons yesterday.&lt;/p&gt;

&lt;p&gt;He is in a lot of pain when he moves and finds it really hard to change the dressing. I&amp;#39;m hoping someone who has been through it can give us some advice.&lt;/p&gt;

&lt;ul&gt;
&lt;li&gt;&lt;p&gt;How long does the pain/discomfort last?&lt;/p&gt;&lt;/li&gt;
&lt;li&gt;&lt;p&gt;Any tips on washing it and changing the dressing?&lt;/p&gt;&lt;/li&gt;
&lt;li&gt;&lt;p&gt;How long until the hypersensitivity goes away?&lt;/p&gt;&lt;/li&gt;
&lt;li&gt;&lt;p&gt;How do you deal with the hypersensitivity?&lt;/p&gt;&lt;/li&gt;
&lt;/ul&gt;

&lt;p&gt;He&amp;#39;s also concerned about what it will look like.&lt;/p&gt;

&lt;ul&gt;
&lt;li&gt;&lt;p&gt;How did yours turn out?&lt;/p&gt;&lt;/li&gt;
&lt;li&gt;&lt;p&gt;Does it look the same as someone who was circumcised when they were young?&lt;/p&gt;&lt;/li&gt;
&lt;li&gt;&lt;p&gt;How long does it take before it looks normal?&lt;/p&gt;&lt;/li&gt;
&lt;li&gt;&lt;p&gt;Any other general advice?&lt;/p&gt;&lt;/li&gt;
&lt;/ul&gt;

&lt;p&gt;Thanks&lt;/p&gt;

&lt;p&gt;Edit: I&amp;#39;m just looking for general advice from other sources, not catch-all medical advice. I understand everyone is different but a technique you&amp;#39;ve tried or a tip you&amp;#39;ve heard may help him out a little.&lt;br/&gt;
He isn&amp;#39;t going to do something stupid/dangerous because reddit told him.&lt;/p&gt;
&lt;/div&gt;&lt;!-- SC_ON --&gt;","False","askgaybros","t5_2vgfw","","","Has anyone been circumcised as an adult? looking for some advice.","8","http://www.reddit.com/r/askgaybros/comments/2ne8o7/has_anyone_been_circumcised_as_an_adult_looking/","[]","False"
"17","","","{}","http://www.reddit.com/api/info/","{}","{}","False","","","False","arthureld","","","","False","1416937678.0","1416937678.0","","self.askgaybros","0","False","0","True","False","2ne2x3","True","","","","","","{}","[]","t3_2ne2x3","14","","False","http://www.reddit.com/r/askgaybros/comments/2ne2x3/how_have_you_tackled_mismatched_sex_drives_andor/","Unauthenticated reddit sesssion","","False","21","","{}","My current relationship is great. Just want to start there as this isn't a question coming out of crisis, but of curiosity.  My partner and I have very mismatched sex drives -- I want it all the time, he's pretty content at once a week (maybe less).  I should say here sex is in the global sense, not just anal.  Also, we are both in our mid-30s (so I feel like the outlier compared to ""normal"").  

We're doing well focusing on communication about our wants and needs.  It seems to be working, but part of me worries about feelings of being neglected or feelings of being inadequate to fulfill your partner's urges could be a long term problem if we're not careful.

Any success stories or pointers that have helped others?  I will also say that while opening the relationship is an option for some folks, it's not here (we have had frank serious talks about if it would work for us and the answer was a pretty resounding NO from both of us). ","&lt;!-- SC_OFF --&gt;&lt;div class=""md""&gt;&lt;p&gt;My current relationship is great. Just want to start there as this isn&amp;#39;t a question coming out of crisis, but of curiosity.  My partner and I have very mismatched sex drives -- I want it all the time, he&amp;#39;s pretty content at once a week (maybe less).  I should say here sex is in the global sense, not just anal.  Also, we are both in our mid-30s (so I feel like the outlier compared to &amp;quot;normal&amp;quot;).  &lt;/p&gt;

&lt;p&gt;We&amp;#39;re doing well focusing on communication about our wants and needs.  It seems to be working, but part of me worries about feelings of being neglected or feelings of being inadequate to fulfill your partner&amp;#39;s urges could be a long term problem if we&amp;#39;re not careful.&lt;/p&gt;

&lt;p&gt;Any success stories or pointers that have helped others?  I will also say that while opening the relationship is an option for some folks, it&amp;#39;s not here (we have had frank serious talks about if it would work for us and the answer was a pretty resounding NO from both of us). &lt;/p&gt;
&lt;/div&gt;&lt;!-- SC_ON --&gt;","False","askgaybros","t5_2vgfw","","","How have you tackled mismatched sex drives and/or sexual expectations?","21","http://www.reddit.com/r/askgaybros/comments/2ne2x3/how_have_you_tackled_mismatched_sex_drives_andor/","[]","False"
