"","_comment_sort","_comments","_comments_by_id","_info_url","_orphaned","_params","_replaced_more","_underscore_names","approved_by","archived","author","author_flair_css_class","author_flair_text","banned_by","clicked","created","created_utc","distinguished","domain","downs","edited","gilded","has_fetched","hidden","id","is_self","json_dict","likes","link_flair_css_class","link_flair_text","media","media_embed","mod_reports","name","num_comments","num_reports","over_18","permalink","reddit_session","report_reasons","saved","score","secure_media","secure_media_embed","selftext","selftext_html","stickied","subreddit","subreddit_id","suggested_sort","thumbnail","title","ups","url","user_reports","visited"
"6","","","{}","http://www.reddit.com/api/info/","{}","{}","False","","","False","jaguirre88","","","","False","1416814515.0","1416814515.0","","self.askgaybros","0","False","0","True","False","2n8u1k","True","","","","","","{}","[]","t3_2n8u1k","3","","False","http://www.reddit.com/r/askgaybros/comments/2n8u1k/was_this_guy_flirting_with_me/","Unauthenticated reddit sesssion","","False","2","","{}","I was in one of those used book/music/movie stores the other day, browsing the dvd section, when through my peripheral vision, I saw a man walk past the isle I was in and briefly glance at me, before making his way to the book section in the back. I know what you're thinking, and I didn't think anything of it at first, until he walked over and stood literally 2 feet from where I was standing and proceeded to browse the shelf in front of him. I was pulling out a dvd from the shelf when, again, from my peripheral vision, I see him glancing over my way. He then asked me if there was ""anything good?"" and made a comment in response the wide selection of movies, along the lines of 'digging through the crap to find the gems' as he flashed a big smile. He was a very attractive man in his late twenties/early thirties in work/business attire. Of course, I was completely caught off guard, and naturally I didn't know what to say back, except 'yeah' and smile. I then proceeded to (pretend) glance over the shelves again, nervously freaking out inside, thinking of something to say, while he continued to browse next to me, though it seemed like he wasn't interested in what was on the shelf, and was possibly looking for an 'in' to start a conversation with me. This lasted for about a minute, and then he left. I seriously contemplated leaving to follow him, but didn't want to potentially weird him out and embarrass myself if I was wrong, which seems kind of silly now, and I'm really regretting it. It's not so much shyness, although that's part of it, as much as it is just me not knowing what the fuck to say, especially when I am caught off guard like that.

I was somewhat of an ugly ducking growing up, (may still be, I'm not sure) and as a result, am very ambivalent about these sort of things. The concept of a mutual attraction is hard for me to grasp since it's always been a one sided thing for me.

missed opportunity ? anyone been in a similar scenario and care to share their stories?","&lt;!-- SC_OFF --&gt;&lt;div class=""md""&gt;&lt;p&gt;I was in one of those used book/music/movie stores the other day, browsing the dvd section, when through my peripheral vision, I saw a man walk past the isle I was in and briefly glance at me, before making his way to the book section in the back. I know what you&amp;#39;re thinking, and I didn&amp;#39;t think anything of it at first, until he walked over and stood literally 2 feet from where I was standing and proceeded to browse the shelf in front of him. I was pulling out a dvd from the shelf when, again, from my peripheral vision, I see him glancing over my way. He then asked me if there was &amp;quot;anything good?&amp;quot; and made a comment in response the wide selection of movies, along the lines of &amp;#39;digging through the crap to find the gems&amp;#39; as he flashed a big smile. He was a very attractive man in his late twenties/early thirties in work/business attire. Of course, I was completely caught off guard, and naturally I didn&amp;#39;t know what to say back, except &amp;#39;yeah&amp;#39; and smile. I then proceeded to (pretend) glance over the shelves again, nervously freaking out inside, thinking of something to say, while he continued to browse next to me, though it seemed like he wasn&amp;#39;t interested in what was on the shelf, and was possibly looking for an &amp;#39;in&amp;#39; to start a conversation with me. This lasted for about a minute, and then he left. I seriously contemplated leaving to follow him, but didn&amp;#39;t want to potentially weird him out and embarrass myself if I was wrong, which seems kind of silly now, and I&amp;#39;m really regretting it. It&amp;#39;s not so much shyness, although that&amp;#39;s part of it, as much as it is just me not knowing what the fuck to say, especially when I am caught off guard like that.&lt;/p&gt;

&lt;p&gt;I was somewhat of an ugly ducking growing up, (may still be, I&amp;#39;m not sure) and as a result, am very ambivalent about these sort of things. The concept of a mutual attraction is hard for me to grasp since it&amp;#39;s always been a one sided thing for me.&lt;/p&gt;

&lt;p&gt;missed opportunity ? anyone been in a similar scenario and care to share their stories?&lt;/p&gt;
&lt;/div&gt;&lt;!-- SC_ON --&gt;","False","askgaybros","t5_2vgfw","","","Was this guy flirting with me?","2","http://www.reddit.com/r/askgaybros/comments/2n8u1k/was_this_guy_flirting_with_me/","[]","False"
"7","","","{}","http://www.reddit.com/api/info/","{}","{}","False","","","False","Yrvtrvughfkaoa","","","","False","1416809667.0","1416809667.0","","self.askgaybros","0","False","0","True","False","2n8nzn","True","","","","","","{}","[]","t3_2n8nzn","9","","False","http://www.reddit.com/r/askgaybros/comments/2n8nzn/im_attracted_to_someone_who_i_think_is_too_young/","Unauthenticated reddit sesssion","","False","4","","{}","I'm a junior in high school. There's this guy who goes to my school and he's sort of exactly my type - his face, build, even his voice are all essentially tailored to my own personal interests. Normally he'd be one of those guys you just pass in the hallway every now and then and admire from afar. But the thing is, he's a freshman.

I've always thought two years of separation was where things start getting sort of weird when it comes to high school romances or whatever. I tried to justify my attraction to him by telling myself that these types of relationships do exist, but then I realized I was a gay junior secretly ogling some unwitting, most likely straight freshman. That felt sort of... Predatory. So I've started trying to ignore him when I see him, but sometimes I can't help but glance his way. 

This type of thing has never really been a problem for me before. I entered high school being only attracted to guys much older than myself, and only while being here have I discovered a taste for guys around my own age. Now I'm mixed up between the fact that I like this guy and the fact that he doesn't really fit my criteria for ""allowable attraction.""

I guess what I'm asking here is, is this weird? Am as I creepy/gross as I feel? And does anyone know how I can get him out of my mind? Thanks, any insight is appreciated. ","&lt;!-- SC_OFF --&gt;&lt;div class=""md""&gt;&lt;p&gt;I&amp;#39;m a junior in high school. There&amp;#39;s this guy who goes to my school and he&amp;#39;s sort of exactly my type - his face, build, even his voice are all essentially tailored to my own personal interests. Normally he&amp;#39;d be one of those guys you just pass in the hallway every now and then and admire from afar. But the thing is, he&amp;#39;s a freshman.&lt;/p&gt;

&lt;p&gt;I&amp;#39;ve always thought two years of separation was where things start getting sort of weird when it comes to high school romances or whatever. I tried to justify my attraction to him by telling myself that these types of relationships do exist, but then I realized I was a gay junior secretly ogling some unwitting, most likely straight freshman. That felt sort of... Predatory. So I&amp;#39;ve started trying to ignore him when I see him, but sometimes I can&amp;#39;t help but glance his way. &lt;/p&gt;

&lt;p&gt;This type of thing has never really been a problem for me before. I entered high school being only attracted to guys much older than myself, and only while being here have I discovered a taste for guys around my own age. Now I&amp;#39;m mixed up between the fact that I like this guy and the fact that he doesn&amp;#39;t really fit my criteria for &amp;quot;allowable attraction.&amp;quot;&lt;/p&gt;

&lt;p&gt;I guess what I&amp;#39;m asking here is, is this weird? Am as I creepy/gross as I feel? And does anyone know how I can get him out of my mind? Thanks, any insight is appreciated. &lt;/p&gt;
&lt;/div&gt;&lt;!-- SC_ON --&gt;","False","askgaybros","t5_2vgfw","","","I'm attracted to someone who I think is too young for me. What do I do?","4","http://www.reddit.com/r/askgaybros/comments/2n8nzn/im_attracted_to_someone_who_i_think_is_too_young/","[]","False"
"8","","","{}","http://www.reddit.com/api/info/","{}","{}","False","","","False","mrtsebra","","","","False","1416808542.0","1416808542.0","","self.askgaybros","0","False","0","True","False","2n8mht","True","","","","","","{}","[]","t3_2n8mht","9","","False","http://www.reddit.com/r/askgaybros/comments/2n8mht/alone_for_thanksgiving/","Unauthenticated reddit sesssion","","False","6","","{}","the title says it all. this will be my first year at home by myself for it. any of you gaybros in GA wanna come bring me turkey? maybe we can discuss some stuffing lol but seriously thinking of hosting a small reddit meet up if anyone would be interested. feel free to pm me or just reply. happy (hopefully not lonesome) holidays! ","&lt;!-- SC_OFF --&gt;&lt;div class=""md""&gt;&lt;p&gt;the title says it all. this will be my first year at home by myself for it. any of you gaybros in GA wanna come bring me turkey? maybe we can discuss some stuffing lol but seriously thinking of hosting a small reddit meet up if anyone would be interested. feel free to pm me or just reply. happy (hopefully not lonesome) holidays! &lt;/p&gt;
&lt;/div&gt;&lt;!-- SC_ON --&gt;","False","askgaybros","t5_2vgfw","","","alone for thanksgiving","6","http://www.reddit.com/r/askgaybros/comments/2n8mht/alone_for_thanksgiving/","[]","False"
"9","","","{}","http://www.reddit.com/api/info/","{}","{}","False","","","False","Azarias59","","","","False","1416806604.0","1416806604.0","","self.askgaybros","0","1416806873.0","0","True","False","2n8jny","True","","","","","","{}","[]","t3_2n8jny","13","","False","http://www.reddit.com/r/askgaybros/comments/2n8jny/any_exjws_or_affiliates_here/","Unauthenticated reddit sesssion","","False","5","","{}","I can't help but wonder if any of you bros have experience with Jehovah's Witnesses.

Right now I'm dealing with a bunch of unpleasantness because of my JW upbringing, but I'm too tired to post my long, detailed and emotional story. Just out of curiosity, though, is there anyone else here that has been raised or affiliated with Jehovah's Witnesses as well? Anything encouraging you might be able to say to me? ","&lt;!-- SC_OFF --&gt;&lt;div class=""md""&gt;&lt;p&gt;I can&amp;#39;t help but wonder if any of you bros have experience with Jehovah&amp;#39;s Witnesses.&lt;/p&gt;

&lt;p&gt;Right now I&amp;#39;m dealing with a bunch of unpleasantness because of my JW upbringing, but I&amp;#39;m too tired to post my long, detailed and emotional story. Just out of curiosity, though, is there anyone else here that has been raised or affiliated with Jehovah&amp;#39;s Witnesses as well? Anything encouraging you might be able to say to me? &lt;/p&gt;
&lt;/div&gt;&lt;!-- SC_ON --&gt;","False","askgaybros","t5_2vgfw","","","Any EX-JW's (or affiliates) here?","5","http://www.reddit.com/r/askgaybros/comments/2n8jny/any_exjws_or_affiliates_here/","[]","False"
"10","","","{}","http://www.reddit.com/api/info/","{}","{}","False","","","False","GayThoughtsThrowaway","","","","False","1416806186.0","1416806186.0","","self.askgaybros","0","False","0","True","False","2n8j01","True","","","","","","{}","[]","t3_2n8j01","3","","False","http://www.reddit.com/r/askgaybros/comments/2n8j01/i_am_having_gay_thoughts_about_friends/","Unauthenticated reddit sesssion","","False","2","","{}","Hi there. I am a 15 y/o straight teenager. I have discovered porn and masturbation and the like. Recently, I have been having sexual fantasies that involve me and my best friend. The most common is of us sitting on my couch masturbating together. After having these thoughts, I get an erection. I don't know whether to be disgusted, aroused, or what. I kinda wanna ask him if he'd be aight with it, but I don't know. 

We both have had girlfriends in the past, yet the never seem to stay. We are both 100% straight, at least I am. Is this normal? What should I do?","&lt;!-- SC_OFF --&gt;&lt;div class=""md""&gt;&lt;p&gt;Hi there. I am a 15 y/o straight teenager. I have discovered porn and masturbation and the like. Recently, I have been having sexual fantasies that involve me and my best friend. The most common is of us sitting on my couch masturbating together. After having these thoughts, I get an erection. I don&amp;#39;t know whether to be disgusted, aroused, or what. I kinda wanna ask him if he&amp;#39;d be aight with it, but I don&amp;#39;t know. &lt;/p&gt;

&lt;p&gt;We both have had girlfriends in the past, yet the never seem to stay. We are both 100% straight, at least I am. Is this normal? What should I do?&lt;/p&gt;
&lt;/div&gt;&lt;!-- SC_ON --&gt;","False","askgaybros","t5_2vgfw","","","I am having gay thoughts about friends","2","http://www.reddit.com/r/askgaybros/comments/2n8j01/i_am_having_gay_thoughts_about_friends/","[]","False"
"11","","","{}","http://www.reddit.com/api/info/","{}","{}","False","","","False","Becii2","","","","False","1416805636.0","1416805636.0","","self.askgaybros","0","False","0","True","False","2n8i4i","True","","","","","","{}","[]","t3_2n8i4i","13","","False","http://www.reddit.com/r/askgaybros/comments/2n8i4i/advice_on_cheating_boyfriend/","Unauthenticated reddit sesssion","","False","11","","{}","Hey guys, been struggling with this in a newer (5 month) relationship. Why do I keep assuming my boyfriend is cheating on me?

We've both been in long term relationships before. I have never been cheated on before, I have never cheated on anyone before. He has been cheated on before (in a short relationship) and a few weeks ago, to my horror, accused me of talking with guys online/cheating: we worked through that and I convinced him of the truth. 

Ever since I've been having these odd feelings that he's cheating on me… I don’t think physically cheating but emotionally? As in I think he's going on dates… I find myself essentially not trusting him and I hate it. When he's doing his own thing I now think about what he might be doing (?) and whenever he changes his plans I find myself trying to ""catch-him"".  The brain is a amazing organ as I have now been able to paste together a reasonably feasible timeline /story of him meeting up with another guy and dates.

I know I'm being slightly crazy so I have decided not to talk about the subject head on but I have been trying to get information on this other guy and my bf schedule so I can disprove my theory. Is this mad? 

The thing is I have a lot of feelings for this man and I have no idea where this insecurity came from. 

Any advice? My gut is all twisted in a knot and I really don’t know what to do. 
Thank you  
","&lt;!-- SC_OFF --&gt;&lt;div class=""md""&gt;&lt;p&gt;Hey guys, been struggling with this in a newer (5 month) relationship. Why do I keep assuming my boyfriend is cheating on me?&lt;/p&gt;

&lt;p&gt;We&amp;#39;ve both been in long term relationships before. I have never been cheated on before, I have never cheated on anyone before. He has been cheated on before (in a short relationship) and a few weeks ago, to my horror, accused me of talking with guys online/cheating: we worked through that and I convinced him of the truth. &lt;/p&gt;

&lt;p&gt;Ever since I&amp;#39;ve been having these odd feelings that he&amp;#39;s cheating on me… I don’t think physically cheating but emotionally? As in I think he&amp;#39;s going on dates… I find myself essentially not trusting him and I hate it. When he&amp;#39;s doing his own thing I now think about what he might be doing (?) and whenever he changes his plans I find myself trying to &amp;quot;catch-him&amp;quot;.  The brain is a amazing organ as I have now been able to paste together a reasonably feasible timeline /story of him meeting up with another guy and dates.&lt;/p&gt;

&lt;p&gt;I know I&amp;#39;m being slightly crazy so I have decided not to talk about the subject head on but I have been trying to get information on this other guy and my bf schedule so I can disprove my theory. Is this mad? &lt;/p&gt;

&lt;p&gt;The thing is I have a lot of feelings for this man and I have no idea where this insecurity came from. &lt;/p&gt;

&lt;p&gt;Any advice? My gut is all twisted in a knot and I really don’t know what to do. 
Thank you  &lt;/p&gt;
&lt;/div&gt;&lt;!-- SC_ON --&gt;","False","askgaybros","t5_2vgfw","","","Advice on cheating (?) boyfriend.","11","http://www.reddit.com/r/askgaybros/comments/2n8i4i/advice_on_cheating_boyfriend/","[]","False"
"12","","","{}","http://www.reddit.com/api/info/","{}","{}","False","","","False","Revengeisitworthit","","","","False","1416804532.0","1416804532.0","","self.askgaybros","0","False","0","True","False","2n8gcj","True","","","","","","{}","[]","t3_2n8gcj","11","","False","http://www.reddit.com/r/askgaybros/comments/2n8gcj/ready_to_beat_the_shit_out_of_my_ex_friend_for/","Unauthenticated reddit sesssion","","False","3","","{}","I can't even write a novel about this.  He stretched the truth saying I tried to physically hook up with him, when this wasn't the case, and he's spreading rumors about me being a total perv and all.  And this was only because I confessed how I felt about him.  He pretended to act cool about it, but then admitted how disgusting and messed up it is.  I have a couple mutual friends takings side, and some others taking his and refusing to talk to me.  

This is post high school by the way, so it's not like I have to face the constant bullying, but it's the principle of the matter.  I tried to restore the friendship too after he ditched me, but it just made him act worse than before.

How do I get through this?  I want to plot revenge some how, but I don't think it is worth it, but I'm not sure. ","&lt;!-- SC_OFF --&gt;&lt;div class=""md""&gt;&lt;p&gt;I can&amp;#39;t even write a novel about this.  He stretched the truth saying I tried to physically hook up with him, when this wasn&amp;#39;t the case, and he&amp;#39;s spreading rumors about me being a total perv and all.  And this was only because I confessed how I felt about him.  He pretended to act cool about it, but then admitted how disgusting and messed up it is.  I have a couple mutual friends takings side, and some others taking his and refusing to talk to me.  &lt;/p&gt;

&lt;p&gt;This is post high school by the way, so it&amp;#39;s not like I have to face the constant bullying, but it&amp;#39;s the principle of the matter.  I tried to restore the friendship too after he ditched me, but it just made him act worse than before.&lt;/p&gt;

&lt;p&gt;How do I get through this?  I want to plot revenge some how, but I don&amp;#39;t think it is worth it, but I&amp;#39;m not sure. &lt;/p&gt;
&lt;/div&gt;&lt;!-- SC_ON --&gt;","False","askgaybros","t5_2vgfw","","","Ready to beat the shit out of my ex friend for outing me because I liked him. I know its not worth it, but I feel like he ruined me...","3","http://www.reddit.com/r/askgaybros/comments/2n8gcj/ready_to_beat_the_shit_out_of_my_ex_friend_for/","[]","False"
"13","","","{}","http://www.reddit.com/api/info/","{}","{}","False","","","False","Spader623","","","","False","1416800997.0","1416800997.0","","self.askgaybros","0","False","0","True","False","2n8apu","True","","","","","","{}","[]","t3_2n8apu","7","","False","http://www.reddit.com/r/askgaybros/comments/2n8apu/how_do_i_get_ready_to_bottom/","Unauthenticated reddit sesssion","","False","0","","{}","so I'm pretty inexperienced in anal as a whole, only topped and.. Let's just say that while I enjoyed it, I made some (big) mistakes. ANYWAY, I want to try bottoming but I'm a big scared. For one, I havnt fingered my self or have a dildo or anything. Two, poop. I've heard I need a douche but idk how to hide that from parents (I'm 18) and three, if I don't like it, I don't want to just ask him to pull out and go. Any advice? ","&lt;!-- SC_OFF --&gt;&lt;div class=""md""&gt;&lt;p&gt;so I&amp;#39;m pretty inexperienced in anal as a whole, only topped and.. Let&amp;#39;s just say that while I enjoyed it, I made some (big) mistakes. ANYWAY, I want to try bottoming but I&amp;#39;m a big scared. For one, I havnt fingered my self or have a dildo or anything. Two, poop. I&amp;#39;ve heard I need a douche but idk how to hide that from parents (I&amp;#39;m 18) and three, if I don&amp;#39;t like it, I don&amp;#39;t want to just ask him to pull out and go. Any advice? &lt;/p&gt;
&lt;/div&gt;&lt;!-- SC_ON --&gt;","False","askgaybros","t5_2vgfw","","","How do I get ready to bottom?","0","http://www.reddit.com/r/askgaybros/comments/2n8apu/how_do_i_get_ready_to_bottom/","[]","False"
