"","_comment_sort","_comments","_comments_by_id","_info_url","_orphaned","_params","_replaced_more","_underscore_names","approved_by","archived","author","author_flair_css_class","author_flair_text","banned_by","clicked","created","created_utc","distinguished","domain","downs","edited","gilded","has_fetched","hidden","id","is_self","json_dict","likes","link_flair_css_class","link_flair_text","media","media_embed","mod_reports","name","num_comments","num_reports","over_18","permalink","reddit_session","report_reasons","saved","score","secure_media","secure_media_embed","selftext","selftext_html","stickied","subreddit","subreddit_id","suggested_sort","thumbnail","title","ups","url","user_reports","visited"
"5","","","{}","http://www.reddit.com/api/info/","{}","{}","False","","","True","throwaway0921807","","","","False","1404562652.0","1404559052.0","","self.askgaybros","0","False","0","True","False","29w3yv","True","","","","","","{}","[]","t3_29w3yv","22","","False","http://www.reddit.com/r/askgaybros/comments/29w3yv/my_personal_hell_any_suggestions/","Unauthenticated reddit sesssion","","False","7","","{}","1) Closeted

2) Fall in love for the first and only time with next-door neighbor, who is openly gay.

3) We get in an argument a few days after we both confess we like each other and started seeing each other. He decides he wants out because he's hurt. I had told him I wasn't ready for anything sexual yet so if he had needs it would be understandable for me if he went with someone else. Crass, I know, but I didn't want him to get frustrated with me.

4) He is a member of my circle of friends who happen to all live down the street. So I have to see him if I want to not be 100% alone.

5) Starts going out with someone else but still sends me mixed messages when things get rough with their relationship. 

6) Tells me he's been thinking about us a lot and that you don't know what you have until it's gone. I try not to believe him because he does this thing where he'll beat around the bush and insinuate that he still likes me (e.g., tell me how cute I look, tell me he wants to go skinny-dipping, sleep over at my house) and then tell me he meant it as a friend whenever I ask him what his intentions are. He sends me on this constant roller coaster of building up expectations only to be let down.

7) He contacts me while I'm away on a trip and says he'd like to talk like we used to, and tells me he wants to know how my coming out is going. I ask him how his love life is going, and he tell me there's absolutely nothing going on. I try to keep distant, but one thing leads to another and he's sending intimate pictures of him and I of me. He makes plans with me for when I return (sleeping over at my house, asking me to give him a massage, going skinny-dipping together) I get my hopes up.

8) When I return back from my trip, I go on his twitter, which I had not visited in months, only to confirm he still is, and has been for a very long time, very much infatuated with his ex and seeing him from time to time.

9) I ask him if he still likes his ex and he says ""of course!"". I ask him what I am to him, and he says only a friend and that's the way it's always been. I ask him why the fuck he was sexting me and he says he did it because he thought it was silly and to have a few laughs between friends. I confront him about it and tell him it really hurts me. He says it's all in my head but nonetheless he'll change his behavior around me, but I can't keep up the friendship thing. It's devastating.

10) I had gotten over the fact we aren't together, and I still care for him, but he says I'm selfish for cutting contact once I saw him and his ex (who he had told me he wasn't seeing anymore a week prior) leave his house together.

11) I think he cares for me deeply as a friend, at least, and even though I know cutting contact has hurt him, his actions have fucked me up beyond words. I've told him so and he said he would change the way he behaves towards me, but I can't get over the fact he has led me on so many times and that now he's with his ex, who seems to be a nice guy with a smooth voice and kind way about him. It makes me physically sick.

12) He's making me feel like the bad guy for cutting contact with him. I didn't do it out of hatred or animosity, but out of a desire to isolate myself from this whirlwind of pain. I get that he thinks he's my friend, but I can't subject myself to this any longer.

TL;DR never go out with a neighbor. Any tips for moving past this?
","&lt;!-- SC_OFF --&gt;&lt;div class=""md""&gt;&lt;p&gt;1) Closeted&lt;/p&gt;

&lt;p&gt;2) Fall in love for the first and only time with next-door neighbor, who is openly gay.&lt;/p&gt;

&lt;p&gt;3) We get in an argument a few days after we both confess we like each other and started seeing each other. He decides he wants out because he&amp;#39;s hurt. I had told him I wasn&amp;#39;t ready for anything sexual yet so if he had needs it would be understandable for me if he went with someone else. Crass, I know, but I didn&amp;#39;t want him to get frustrated with me.&lt;/p&gt;

&lt;p&gt;4) He is a member of my circle of friends who happen to all live down the street. So I have to see him if I want to not be 100% alone.&lt;/p&gt;

&lt;p&gt;5) Starts going out with someone else but still sends me mixed messages when things get rough with their relationship. &lt;/p&gt;

&lt;p&gt;6) Tells me he&amp;#39;s been thinking about us a lot and that you don&amp;#39;t know what you have until it&amp;#39;s gone. I try not to believe him because he does this thing where he&amp;#39;ll beat around the bush and insinuate that he still likes me (e.g., tell me how cute I look, tell me he wants to go skinny-dipping, sleep over at my house) and then tell me he meant it as a friend whenever I ask him what his intentions are. He sends me on this constant roller coaster of building up expectations only to be let down.&lt;/p&gt;

&lt;p&gt;7) He contacts me while I&amp;#39;m away on a trip and says he&amp;#39;d like to talk like we used to, and tells me he wants to know how my coming out is going. I ask him how his love life is going, and he tell me there&amp;#39;s absolutely nothing going on. I try to keep distant, but one thing leads to another and he&amp;#39;s sending intimate pictures of him and I of me. He makes plans with me for when I return (sleeping over at my house, asking me to give him a massage, going skinny-dipping together) I get my hopes up.&lt;/p&gt;

&lt;p&gt;8) When I return back from my trip, I go on his twitter, which I had not visited in months, only to confirm he still is, and has been for a very long time, very much infatuated with his ex and seeing him from time to time.&lt;/p&gt;

&lt;p&gt;9) I ask him if he still likes his ex and he says &amp;quot;of course!&amp;quot;. I ask him what I am to him, and he says only a friend and that&amp;#39;s the way it&amp;#39;s always been. I ask him why the fuck he was sexting me and he says he did it because he thought it was silly and to have a few laughs between friends. I confront him about it and tell him it really hurts me. He says it&amp;#39;s all in my head but nonetheless he&amp;#39;ll change his behavior around me, but I can&amp;#39;t keep up the friendship thing. It&amp;#39;s devastating.&lt;/p&gt;

&lt;p&gt;10) I had gotten over the fact we aren&amp;#39;t together, and I still care for him, but he says I&amp;#39;m selfish for cutting contact once I saw him and his ex (who he had told me he wasn&amp;#39;t seeing anymore a week prior) leave his house together.&lt;/p&gt;

&lt;p&gt;11) I think he cares for me deeply as a friend, at least, and even though I know cutting contact has hurt him, his actions have fucked me up beyond words. I&amp;#39;ve told him so and he said he would change the way he behaves towards me, but I can&amp;#39;t get over the fact he has led me on so many times and that now he&amp;#39;s with his ex, who seems to be a nice guy with a smooth voice and kind way about him. It makes me physically sick.&lt;/p&gt;

&lt;p&gt;12) He&amp;#39;s making me feel like the bad guy for cutting contact with him. I didn&amp;#39;t do it out of hatred or animosity, but out of a desire to isolate myself from this whirlwind of pain. I get that he thinks he&amp;#39;s my friend, but I can&amp;#39;t subject myself to this any longer.&lt;/p&gt;

&lt;p&gt;TL;DR never go out with a neighbor. Any tips for moving past this?&lt;/p&gt;
&lt;/div&gt;&lt;!-- SC_ON --&gt;","False","askgaybros","t5_2vgfw","","","My personal hell (any suggestions?)","7","http://www.reddit.com/r/askgaybros/comments/29w3yv/my_personal_hell_any_suggestions/","[]","False"
"6","","","{}","http://www.reddit.com/api/info/","{}","{}","False","","","True","renerdrat","","","","False","1404558124.0","1404554524.0","","self.askgaybros","0","False","0","True","False","29w15b","True","","","","","","{}","[]","t3_29w15b","18","","False","http://www.reddit.com/r/askgaybros/comments/29w15b/i_like_getting_my_nipples_sucked_more_than/","Unauthenticated reddit sesssion","","False","27","","{}","I just love the feeling, more so than getting head, what do you guys think about sucking nipples or compared to other things like getting rimmed neck kissing ear licking etc","&lt;!-- SC_OFF --&gt;&lt;div class=""md""&gt;&lt;p&gt;I just love the feeling, more so than getting head, what do you guys think about sucking nipples or compared to other things like getting rimmed neck kissing ear licking etc&lt;/p&gt;
&lt;/div&gt;&lt;!-- SC_ON --&gt;","False","askgaybros","t5_2vgfw","","","I like getting my nipples sucked more than getting head","27","http://www.reddit.com/r/askgaybros/comments/29w15b/i_like_getting_my_nipples_sucked_more_than/","[]","False"
"7","","","{}","http://www.reddit.com/api/info/","{}","{}","False","","","True","Ian_09","","","","False","1404533751.0","1404530151.0","","self.askgaybros","0","False","0","True","False","29vhd3","True","","","","","","{}","[]","t3_29vhd3","3","","False","http://www.reddit.com/r/askgaybros/comments/29vhd3/inexperienced_considering_hooking_up_need_advices/","Unauthenticated reddit sesssion","","False","3","","{}","Hey guys, lurker here but this time I need to post to seek your help !  
English is my second language so let me cut to the chase.  

Long story short, I'm a 22 years old guy, I have no experience at all when it comes to sex or even any form of intimate relationship with a man or a woman.  
I don't want to identify myself as gay yet, but i'm pretty sure it's where i'm going to end.  

I sick of my situation and I want to break the ice by hooking up with a guy that understands my situation and ok with it.  
Tonight I downloaded Grindr and even though I don't have a profile picture yet, several guys started chatting with me and I had a good time.  
I know Grindr can be a dangerous place and being a really shy guy who is absolutely terrified of being recognized since i'm not out about being curious to anyone I am very careful with it.

Now the questions are:  
- Am I being naive thinking I could find a guy that would be ok going through this kind of experience ?  
- I am aware of the danger regarding STD, I will not under any circumstances have unprotected anal sex but shall I use a condom for oral sex ? I know, better safe than sorry but i've never heard of someone using a condom for a blowjob and I think it would be (and taste) really weird ...  

If you want to share a similar story, go for it.  
If there is something you'd like to ask me, go for it.  
If you have any advice you'd want to give, go for it.  

","&lt;!-- SC_OFF --&gt;&lt;div class=""md""&gt;&lt;p&gt;Hey guys, lurker here but this time I need to post to seek your help !&lt;br/&gt;
English is my second language so let me cut to the chase.  &lt;/p&gt;

&lt;p&gt;Long story short, I&amp;#39;m a 22 years old guy, I have no experience at all when it comes to sex or even any form of intimate relationship with a man or a woman.&lt;br/&gt;
I don&amp;#39;t want to identify myself as gay yet, but i&amp;#39;m pretty sure it&amp;#39;s where i&amp;#39;m going to end.  &lt;/p&gt;

&lt;p&gt;I sick of my situation and I want to break the ice by hooking up with a guy that understands my situation and ok with it.&lt;br/&gt;
Tonight I downloaded Grindr and even though I don&amp;#39;t have a profile picture yet, several guys started chatting with me and I had a good time.&lt;br/&gt;
I know Grindr can be a dangerous place and being a really shy guy who is absolutely terrified of being recognized since i&amp;#39;m not out about being curious to anyone I am very careful with it.&lt;/p&gt;

&lt;p&gt;Now the questions are:&lt;br/&gt;
- Am I being naive thinking I could find a guy that would be ok going through this kind of experience ?&lt;br/&gt;
- I am aware of the danger regarding STD, I will not under any circumstances have unprotected anal sex but shall I use a condom for oral sex ? I know, better safe than sorry but i&amp;#39;ve never heard of someone using a condom for a blowjob and I think it would be (and taste) really weird ...  &lt;/p&gt;

&lt;p&gt;If you want to share a similar story, go for it.&lt;br/&gt;
If there is something you&amp;#39;d like to ask me, go for it.&lt;br/&gt;
If you have any advice you&amp;#39;d want to give, go for it.  &lt;/p&gt;
&lt;/div&gt;&lt;!-- SC_ON --&gt;","False","askgaybros","t5_2vgfw","","","Inexperienced, considering hooking up, need advices.","3","http://www.reddit.com/r/askgaybros/comments/29vhd3/inexperienced_considering_hooking_up_need_advices/","[]","False"
"8","","","{}","http://www.reddit.com/api/info/","{}","{}","False","","","True","Worried500","","","","False","1404533110.0","1404529510.0","","self.askgaybros","0","False","0","True","False","29vgpp","True","","","","","","{}","[]","t3_29vgpp","8","","False","http://www.reddit.com/r/askgaybros/comments/29vgpp/hiv_risk/","Unauthenticated reddit sesssion","","False","2","","{}","In May I had sex as a bottom for the first time.  I'd been hooking up with the guy for a few months, and it was pretty uncomfortable for me but I let him finish because I liked him.  The next morning I woke up and starting vomiting.  I was pretty weak that day, and even though I perked up and stopped vomiting I had... irritable bowels for about 10 days afterwards.

About six weeks earlier to that I had sex as a top for the first time with a guy I didn't know.  I used a condom for both oral and anal sex and I tested negative at 5 weeks.

Should I be still concerned about HIV?","&lt;!-- SC_OFF --&gt;&lt;div class=""md""&gt;&lt;p&gt;In May I had sex as a bottom for the first time.  I&amp;#39;d been hooking up with the guy for a few months, and it was pretty uncomfortable for me but I let him finish because I liked him.  The next morning I woke up and starting vomiting.  I was pretty weak that day, and even though I perked up and stopped vomiting I had... irritable bowels for about 10 days afterwards.&lt;/p&gt;

&lt;p&gt;About six weeks earlier to that I had sex as a top for the first time with a guy I didn&amp;#39;t know.  I used a condom for both oral and anal sex and I tested negative at 5 weeks.&lt;/p&gt;

&lt;p&gt;Should I be still concerned about HIV?&lt;/p&gt;
&lt;/div&gt;&lt;!-- SC_ON --&gt;","False","askgaybros","t5_2vgfw","","","HIV Risk?","2","http://www.reddit.com/r/askgaybros/comments/29vgpp/hiv_risk/","[]","False"
