"","_comment_sort","_comments","_comments_by_id","_info_url","_orphaned","_params","_replaced_more","_underscore_names","approved_by","archived","author","author_flair_css_class","author_flair_text","banned_by","clicked","created","created_utc","distinguished","domain","downs","edited","gilded","has_fetched","hidden","id","is_self","json_dict","likes","link_flair_css_class","link_flair_text","media","media_embed","mod_reports","name","num_comments","num_reports","over_18","permalink","reddit_session","report_reasons","saved","score","secure_media","secure_media_embed","selftext","selftext_html","stickied","subreddit","subreddit_id","suggested_sort","thumbnail","title","ups","url","user_reports","visited"
"8","","","{}","http://www.reddit.com/api/info/","{}","{}","False","","","False","Stuckandneedadvice","","","","False","1421561025.0","1421561025.0","","self.askgaybros","0","False","0","True","False","2st4uy","True","","","","","","{}","[]","t3_2st4uy","11","","False","http://www.reddit.com/r/askgaybros/comments/2st4uy/yet_another_straight_friend_dilemma_sorry/","Unauthenticated reddit sesssion","","False","5","","{}","So my situation seems to be a variant on a common theme running through this sub-reddit. Yes, it involves my ‘straight’ friend - wow what a surprise huh?

But first I feel like I need to give some backstory. I am a fully closeted 20 y/o, and am finally coming to terms with the fact I am gay. Boy, it has been a long road  - there was never a moment in which it clicked that I was gay, more a gradual progression. One that featured much denial, anger etc... starting from around 15 when I discovered porn &amp; masturbation (late bloomer). I slowly transitioned from straight to gay porn but even then did not accept my gayness. It was only about a year ago that I EVENTUALLY began to accept that I am in fact gay (still feels weird to write it).

I have not come out to anyone before, I don’t think I am ready to trust someone with that information before I am fully ready to come out. The thought of telling my family and friends brings on tears and makes me sick to my stomach. I am 99% sure my parents and siblings would take it well, but not so sure about grandparents and extended family. 

Friends are another issue altogether - because I am so deeply closeted and don’t come across as gay, we talk about people from school who came out. Let’s just say the comments are not always positive, I know they are half joking but it hurts me deep inside to realise this is how they would talk about ME behind my back if they knew. So yeah, I have to emphasise while progress has been made, I am in no way shape or form ready or psyched up enough to come out yet.

Making the situation worse is the fact that I have no gay friends (a common theme it seems with people who have these straight guy high school crushes). I actually feel really comfortable around my straight mates, and I feel like I am straight in every respect apart from well, the gay part (I hope you understand what I’m getting at). I have even hooked up with many girls in town, I guess to keep up a persona - never slept with any though. I have had two random, drunken gay experiences but these were with complete strangers and were quickly shut down by me.

Okay this is getting really long (sorry) and I haven’t started on my friend yet but I wanted to give some backstory and emphasise that I am not in a position to come out yet.

So, my ‘straight’ friend comes into the picture at the start of secondary school (sorry, not american) - about 11-12 y/o I guess. To start with I hardly even noticed him, just sort of an extra in my life. When we were probably 15 we started to hang out a bit, being in the same friend group. This is where the little things started.

He would sit unnecessarily close to me on the couch. I would bend over to tie my shoe and he would jokingly dry hump my butt. He would randomly jump up and start play fighting with me and then just sort of lie on top of me. He would sit on my lap… the list goes on. One time at a school ball (prom), he deliberately rubbed past me, making me feel his rock hard erection on my thigh.

So inevitably I started to fantasise about him and developed a crush on him. Being a bit of an awkward kid myself, and deeply closeted, I would hardly initiate these ‘events’ myself and if I did it would be something small like touching his thigh with mine when we were sitting next to each other. Often, he would move his leg away and say something like ‘Don’t be such a fag’ or ‘Stop trying to kiss me’.

I don’t really see him making that much contact with our other friends, and as you can imagine, my brain goes into overdrive, going over every contact that happens, feeling elated one minute, devastated the next - just classic crush behaviour. Its the over analysis which really gets to me though.

I moved away for university (college) when I left school, and these thoughts would fade over time, which was really nice, but as soon as I come home for the summer the feelings are quick to return. This current summer (southern hemisphere), we have been better mates than ever, spending more time together than ever before.

So heres the dilemma - I have my suspicions he is not as straight as he might claim (sorta like me!), but at the same time I am equally sure that he is. Even if he is in fact gay, I don’t even know if he likes me. He will always have multiple girls on the go and even invited one back to my house the other night when a few of us were having drinks there (and got a hand job). But then i’ll watch him in public and his eyes will follow the guys who wander past, not the women. I am so confused and it is doing my head in. By this point, I would have assumed something would have happened between us by now if he did fancy me, but then again I haven’t been very forward either, and he can be a little awkward/shy himself.

I need a resolution - either something substantial happens here or I bury my thoughts and move on with my life, rejecting any further contact he tries to make because I just wouldn’t be able to handle it anymore. I would really like to try initiate something, but in a subtle enough way that it would not blow my cover or leave me deeply rejected and hurting. I definitely feel there is SOMETHING between us but it could very realistically be all in my head.

Any advice on how I progress from this point onwards? How do I know if he’s really gay or not? And that he likes me? Were all those ‘contacts’ meaningless or were they him trying to make some sort of move? 

I’m sure some of you have been in similar situations… please… guys?!

Oh god this is killing me bros. Sorry about the essay and verbal diarrhoea but it feels good to finally put my thoughts into writing. ","&lt;!-- SC_OFF --&gt;&lt;div class=""md""&gt;&lt;p&gt;So my situation seems to be a variant on a common theme running through this sub-reddit. Yes, it involves my ‘straight’ friend - wow what a surprise huh?&lt;/p&gt;

&lt;p&gt;But first I feel like I need to give some backstory. I am a fully closeted 20 y/o, and am finally coming to terms with the fact I am gay. Boy, it has been a long road  - there was never a moment in which it clicked that I was gay, more a gradual progression. One that featured much denial, anger etc... starting from around 15 when I discovered porn &amp;amp; masturbation (late bloomer). I slowly transitioned from straight to gay porn but even then did not accept my gayness. It was only about a year ago that I EVENTUALLY began to accept that I am in fact gay (still feels weird to write it).&lt;/p&gt;

&lt;p&gt;I have not come out to anyone before, I don’t think I am ready to trust someone with that information before I am fully ready to come out. The thought of telling my family and friends brings on tears and makes me sick to my stomach. I am 99% sure my parents and siblings would take it well, but not so sure about grandparents and extended family. &lt;/p&gt;

&lt;p&gt;Friends are another issue altogether - because I am so deeply closeted and don’t come across as gay, we talk about people from school who came out. Let’s just say the comments are not always positive, I know they are half joking but it hurts me deep inside to realise this is how they would talk about ME behind my back if they knew. So yeah, I have to emphasise while progress has been made, I am in no way shape or form ready or psyched up enough to come out yet.&lt;/p&gt;

&lt;p&gt;Making the situation worse is the fact that I have no gay friends (a common theme it seems with people who have these straight guy high school crushes). I actually feel really comfortable around my straight mates, and I feel like I am straight in every respect apart from well, the gay part (I hope you understand what I’m getting at). I have even hooked up with many girls in town, I guess to keep up a persona - never slept with any though. I have had two random, drunken gay experiences but these were with complete strangers and were quickly shut down by me.&lt;/p&gt;

&lt;p&gt;Okay this is getting really long (sorry) and I haven’t started on my friend yet but I wanted to give some backstory and emphasise that I am not in a position to come out yet.&lt;/p&gt;

&lt;p&gt;So, my ‘straight’ friend comes into the picture at the start of secondary school (sorry, not american) - about 11-12 y/o I guess. To start with I hardly even noticed him, just sort of an extra in my life. When we were probably 15 we started to hang out a bit, being in the same friend group. This is where the little things started.&lt;/p&gt;

&lt;p&gt;He would sit unnecessarily close to me on the couch. I would bend over to tie my shoe and he would jokingly dry hump my butt. He would randomly jump up and start play fighting with me and then just sort of lie on top of me. He would sit on my lap… the list goes on. One time at a school ball (prom), he deliberately rubbed past me, making me feel his rock hard erection on my thigh.&lt;/p&gt;

&lt;p&gt;So inevitably I started to fantasise about him and developed a crush on him. Being a bit of an awkward kid myself, and deeply closeted, I would hardly initiate these ‘events’ myself and if I did it would be something small like touching his thigh with mine when we were sitting next to each other. Often, he would move his leg away and say something like ‘Don’t be such a fag’ or ‘Stop trying to kiss me’.&lt;/p&gt;

&lt;p&gt;I don’t really see him making that much contact with our other friends, and as you can imagine, my brain goes into overdrive, going over every contact that happens, feeling elated one minute, devastated the next - just classic crush behaviour. Its the over analysis which really gets to me though.&lt;/p&gt;

&lt;p&gt;I moved away for university (college) when I left school, and these thoughts would fade over time, which was really nice, but as soon as I come home for the summer the feelings are quick to return. This current summer (southern hemisphere), we have been better mates than ever, spending more time together than ever before.&lt;/p&gt;

&lt;p&gt;So heres the dilemma - I have my suspicions he is not as straight as he might claim (sorta like me!), but at the same time I am equally sure that he is. Even if he is in fact gay, I don’t even know if he likes me. He will always have multiple girls on the go and even invited one back to my house the other night when a few of us were having drinks there (and got a hand job). But then i’ll watch him in public and his eyes will follow the guys who wander past, not the women. I am so confused and it is doing my head in. By this point, I would have assumed something would have happened between us by now if he did fancy me, but then again I haven’t been very forward either, and he can be a little awkward/shy himself.&lt;/p&gt;

&lt;p&gt;I need a resolution - either something substantial happens here or I bury my thoughts and move on with my life, rejecting any further contact he tries to make because I just wouldn’t be able to handle it anymore. I would really like to try initiate something, but in a subtle enough way that it would not blow my cover or leave me deeply rejected and hurting. I definitely feel there is SOMETHING between us but it could very realistically be all in my head.&lt;/p&gt;

&lt;p&gt;Any advice on how I progress from this point onwards? How do I know if he’s really gay or not? And that he likes me? Were all those ‘contacts’ meaningless or were they him trying to make some sort of move? &lt;/p&gt;

&lt;p&gt;I’m sure some of you have been in similar situations… please… guys?!&lt;/p&gt;

&lt;p&gt;Oh god this is killing me bros. Sorry about the essay and verbal diarrhoea but it feels good to finally put my thoughts into writing. &lt;/p&gt;
&lt;/div&gt;&lt;!-- SC_ON --&gt;","False","askgaybros","t5_2vgfw","","","Yet another 'straight' friend dilemma... sorry!","5","http://www.reddit.com/r/askgaybros/comments/2st4uy/yet_another_straight_friend_dilemma_sorry/","[]","False"
"9","","","{}","http://www.reddit.com/api/info/","{}","{}","False","","","False","Alwaysparched","","","","False","1421559765.0","1421559765.0","","self.askgaybros","0","False","0","True","False","2st381","True","","","","","","{}","[]","t3_2st381","6","","False","http://www.reddit.com/r/askgaybros/comments/2st381/do_you_guys_know_the_best_place_to_sell_used/","Unauthenticated reddit sesssion","","False","0","","{}","I want to make some extra money by selling my used undies and socks. ","&lt;!-- SC_OFF --&gt;&lt;div class=""md""&gt;&lt;p&gt;I want to make some extra money by selling my used undies and socks. &lt;/p&gt;
&lt;/div&gt;&lt;!-- SC_ON --&gt;","False","askgaybros","t5_2vgfw","","","do you guys know the best place to sell used underwear/socks?","0","http://www.reddit.com/r/askgaybros/comments/2st381/do_you_guys_know_the_best_place_to_sell_used/","[]","False"
"10","","","{}","http://www.reddit.com/api/info/","{}","{}","False","","","False","daringthrowaway","","","","False","1421554542.0","1421554542.0","","self.askgaybros","0","False","0","True","False","2ssvhi","True","","","","","","{}","[]","t3_2ssvhi","9","","True","http://www.reddit.com/r/askgaybros/comments/2ssvhi/help_purchasing_a_nsfw/","Unauthenticated reddit sesssion","","False","1","","{}","Hey there bros really weird question: 

19 and I've never done butt stuff. I kinda want to try some stuff on my own before I find a gentleman friend with whom I will engage in...activities. 

So to that effect, do you have any recommendations for toys I should be buying? Dildos, plugs, etc. I'm on like a $20 budget. Also if there's a way to make it as discreet as possible that would also be great. 

Thanks in advance! ","&lt;!-- SC_OFF --&gt;&lt;div class=""md""&gt;&lt;p&gt;Hey there bros really weird question: &lt;/p&gt;

&lt;p&gt;19 and I&amp;#39;ve never done butt stuff. I kinda want to try some stuff on my own before I find a gentleman friend with whom I will engage in...activities. &lt;/p&gt;

&lt;p&gt;So to that effect, do you have any recommendations for toys I should be buying? Dildos, plugs, etc. I&amp;#39;m on like a $20 budget. Also if there&amp;#39;s a way to make it as discreet as possible that would also be great. &lt;/p&gt;

&lt;p&gt;Thanks in advance! &lt;/p&gt;
&lt;/div&gt;&lt;!-- SC_ON --&gt;","False","askgaybros","t5_2vgfw","","","Help purchasing a... (NSFW?)","1","http://www.reddit.com/r/askgaybros/comments/2ssvhi/help_purchasing_a_nsfw/","[]","False"
"11","","","{}","http://www.reddit.com/api/info/","{}","{}","False","","","False","HooGuy90","","","","False","1421551037.0","1421551037.0","","self.askgaybros","0","False","0","True","False","2ssq2i","True","","","","","","{}","[]","t3_2ssq2i","43","","False","http://www.reddit.com/r/askgaybros/comments/2ssq2i/anyone_else_have_a_thing_for_southern_dudes/","Unauthenticated reddit sesssion","","False","13","","{}","You know, not the redneck, truck-driving types, but the intelligent, charming, outgoing ones with that slight Southern twang in their accent that makes you want to (ahem) get down on your knees.

What can I say? I'm a Southern boy, and you can take the gay boy out of the South, but . . .

Shout out to all my fellow Southern gaybros out there.","&lt;!-- SC_OFF --&gt;&lt;div class=""md""&gt;&lt;p&gt;You know, not the redneck, truck-driving types, but the intelligent, charming, outgoing ones with that slight Southern twang in their accent that makes you want to (ahem) get down on your knees.&lt;/p&gt;

&lt;p&gt;What can I say? I&amp;#39;m a Southern boy, and you can take the gay boy out of the South, but . . .&lt;/p&gt;

&lt;p&gt;Shout out to all my fellow Southern gaybros out there.&lt;/p&gt;
&lt;/div&gt;&lt;!-- SC_ON --&gt;","False","askgaybros","t5_2vgfw","","","Anyone else have a thing for Southern dudes?","13","http://www.reddit.com/r/askgaybros/comments/2ssq2i/anyone_else_have_a_thing_for_southern_dudes/","[]","False"
"12","","","{}","http://www.reddit.com/api/info/","{}","{}","False","","","False","jofnj","","","","False","1421550671.0","1421550671.0","","self.askgaybros","0","False","0","True","False","2sspgi","True","","","","","","{}","[]","t3_2sspgi","27","","False","http://www.reddit.com/r/askgaybros/comments/2sspgi/what_do_you_use_for_improving_fiber_intake/","Unauthenticated reddit sesssion","","False","3","","{}","Simply put: I do not take in nearly as much fiber as one should. In fact, I have had issues with it for the last 8 years or so; however, the two doctors I have had in that span of time sort of ignored it. They just brush it off. Time for me to take charge.

What exactly are *your* ways of getting fiber? It can be foods or supplements, but the latter of the two would be more helpful for me since I'm a picky eater.

**Disclaimer:** I am seeking health advice. I am aware that fiber is also a good way to keep the derriere prepped and ready at all times. That's just an extra advantage!","&lt;!-- SC_OFF --&gt;&lt;div class=""md""&gt;&lt;p&gt;Simply put: I do not take in nearly as much fiber as one should. In fact, I have had issues with it for the last 8 years or so; however, the two doctors I have had in that span of time sort of ignored it. They just brush it off. Time for me to take charge.&lt;/p&gt;

&lt;p&gt;What exactly are &lt;em&gt;your&lt;/em&gt; ways of getting fiber? It can be foods or supplements, but the latter of the two would be more helpful for me since I&amp;#39;m a picky eater.&lt;/p&gt;

&lt;p&gt;&lt;strong&gt;Disclaimer:&lt;/strong&gt; I am seeking health advice. I am aware that fiber is also a good way to keep the derriere prepped and ready at all times. That&amp;#39;s just an extra advantage!&lt;/p&gt;
&lt;/div&gt;&lt;!-- SC_ON --&gt;","False","askgaybros","t5_2vgfw","","","What do you use for improving fiber intake?","3","http://www.reddit.com/r/askgaybros/comments/2sspgi/what_do_you_use_for_improving_fiber_intake/","[]","False"
"13","","","{}","http://www.reddit.com/api/info/","{}","{}","False","","","False","Laika_Come_Home","","","","False","1421550439.0","1421550439.0","","self.askgaybros","0","False","0","True","False","2ssp2h","True","","","","","","{}","[]","t3_2ssp2h","43","","False","http://www.reddit.com/r/askgaybros/comments/2ssp2h/does_anyone_else_feel_straightattractive_as/","Unauthenticated reddit sesssion","","False","35","","{}","Seriously, it seems like I get more interest from women than I do from men. :/","&lt;!-- SC_OFF --&gt;&lt;div class=""md""&gt;&lt;p&gt;Seriously, it seems like I get more interest from women than I do from men. :/&lt;/p&gt;
&lt;/div&gt;&lt;!-- SC_ON --&gt;","False","askgaybros","t5_2vgfw","","","Does anyone else feel ""straight-attractive"" as opposed to ""gay-attractive""?","35","http://www.reddit.com/r/askgaybros/comments/2ssp2h/does_anyone_else_feel_straightattractive_as/","[]","False"
"14","","","{}","http://www.reddit.com/api/info/","{}","{}","False","","","False","Firecrotch2014","","","","False","1421547924.0","1421547924.0","","self.askgaybros","0","False","0","True","False","2sskzs","True","","","","","","{}","[]","t3_2sskzs","35","","False","http://www.reddit.com/r/askgaybros/comments/2sskzs/so_my_bf_hit_it_out_of_the_park_for_my_birthday/","Unauthenticated reddit sesssion","","False","133","","{}","So I told my bf that I wanted a really simple birthday this year.  All I wanted was a small cake and some ice cream from Whole Foods and for him to cook me a home made dinner of spaghetti and garlic bread.  I told him specifically I didnt want any presents since we'd just had Christmas and both of us kinda went all out. So we go out and get the stuff for my birthday meal.  We come home and he cooks and we eat like normal. It finally gets late and I get really sleepy and decide to go to bed.  He isnt sleepy so he stays up.  

Like two hours or so pass and its like just past 1 am.  He comes in the bedroom and asks me if I wanted to wake up.  I didnt really feel like it but I figured I should since he had to work tomorrow. Im glad I did! lol I walked into the living room and he handed me a PS4 controller.  I was like WTF is that. And he was like ""its our new PS4!""  I was pretty much floored.  I started to cry, like Oprah's ugly cry.  I just couldnt believe he had spent so much money on me right after Christmas.  I guess it was the fact that I told him before I always got shafted on my birthday growing up since it was so close to Christmas.  He also knows I love fighting games so he got me Injustice: Gods Among Us to go with the PS4 along with it coming with The Last Of Us. 

Anyways, sorry this story is getting so long winded, I just wanted to share what an unbelieveably great guy I have! ","&lt;!-- SC_OFF --&gt;&lt;div class=""md""&gt;&lt;p&gt;So I told my bf that I wanted a really simple birthday this year.  All I wanted was a small cake and some ice cream from Whole Foods and for him to cook me a home made dinner of spaghetti and garlic bread.  I told him specifically I didnt want any presents since we&amp;#39;d just had Christmas and both of us kinda went all out. So we go out and get the stuff for my birthday meal.  We come home and he cooks and we eat like normal. It finally gets late and I get really sleepy and decide to go to bed.  He isnt sleepy so he stays up.  &lt;/p&gt;

&lt;p&gt;Like two hours or so pass and its like just past 1 am.  He comes in the bedroom and asks me if I wanted to wake up.  I didnt really feel like it but I figured I should since he had to work tomorrow. Im glad I did! lol I walked into the living room and he handed me a PS4 controller.  I was like WTF is that. And he was like &amp;quot;its our new PS4!&amp;quot;  I was pretty much floored.  I started to cry, like Oprah&amp;#39;s ugly cry.  I just couldnt believe he had spent so much money on me right after Christmas.  I guess it was the fact that I told him before I always got shafted on my birthday growing up since it was so close to Christmas.  He also knows I love fighting games so he got me Injustice: Gods Among Us to go with the PS4 along with it coming with The Last Of Us. &lt;/p&gt;

&lt;p&gt;Anyways, sorry this story is getting so long winded, I just wanted to share what an unbelieveably great guy I have! &lt;/p&gt;
&lt;/div&gt;&lt;!-- SC_ON --&gt;","False","askgaybros","t5_2vgfw","","","So my bf hit it out of the park for my birthday this year...","133","http://www.reddit.com/r/askgaybros/comments/2sskzs/so_my_bf_hit_it_out_of_the_park_for_my_birthday/","[]","False"
"15","","","{}","http://www.reddit.com/api/info/","{}","{}","False","","","False","danthaman15","","","","False","1421547190.0","1421547190.0","","self.askgaybros","0","False","0","True","False","2ssjt5","True","","","","","","{}","[]","t3_2ssjt5","2","","False","http://www.reddit.com/r/askgaybros/comments/2ssjt5/does_pornhub_keep_crashing_for_anyone_else/","Unauthenticated reddit sesssion","","False","3","","{}","I literally can't go a day without getting this screen:

http://i.imgur.com/xkugjOg.png

I'm not sure if this happens for anyone else. But once it's up, it will be hours or the next day before I can get back on. Any advice?","&lt;!-- SC_OFF --&gt;&lt;div class=""md""&gt;&lt;p&gt;I literally can&amp;#39;t go a day without getting this screen:&lt;/p&gt;

&lt;p&gt;&lt;a href=""http://i.imgur.com/xkugjOg.png""&gt;http://i.imgur.com/xkugjOg.png&lt;/a&gt;&lt;/p&gt;

&lt;p&gt;I&amp;#39;m not sure if this happens for anyone else. But once it&amp;#39;s up, it will be hours or the next day before I can get back on. Any advice?&lt;/p&gt;
&lt;/div&gt;&lt;!-- SC_ON --&gt;","False","askgaybros","t5_2vgfw","","","Does pornhub keep crashing for anyone else?","3","http://www.reddit.com/r/askgaybros/comments/2ssjt5/does_pornhub_keep_crashing_for_anyone_else/","[]","False"
