"","_comment_sort","_comments","_comments_by_id","_info_url","_orphaned","_params","_replaced_more","_underscore_names","approved_by","archived","author","author_flair_css_class","author_flair_text","banned_by","clicked","created","created_utc","distinguished","domain","downs","edited","gilded","has_fetched","hidden","id","is_self","json_dict","likes","link_flair_css_class","link_flair_text","media","media_embed","mod_reports","name","num_comments","num_reports","over_18","permalink","reddit_session","report_reasons","saved","score","secure_media","secure_media_embed","selftext","selftext_html","stickied","subreddit","subreddit_id","suggested_sort","thumbnail","title","ups","url","user_reports","visited"
"0","","","{}","http://www.reddit.com/api/info/","{}","{}","False","","","False","breakingbrad11","","","","False","1426349911.0","1426346311.0","","self.askgaybros","0","False","0","True","False","2z0wna","True","","","","","","{}","[]","t3_2z0wna","3","","False","http://www.reddit.com/r/askgaybros/comments/2z0wna/dont_know_where_else_to_ask_this/","Unauthenticated reddit sesssion","","False","0","","{}","Just hanging out, thinking about life... How awesome it is to be human. Anyone else feel like this?","&lt;!-- SC_OFF --&gt;&lt;div class=""md""&gt;&lt;p&gt;Just hanging out, thinking about life... How awesome it is to be human. Anyone else feel like this?&lt;/p&gt;
&lt;/div&gt;&lt;!-- SC_ON --&gt;","False","askgaybros","t5_2vgfw","","","Don't know where else to ask this...?","0","http://www.reddit.com/r/askgaybros/comments/2z0wna/dont_know_where_else_to_ask_this/","[]","False"
"1","","","{}","http://www.reddit.com/api/info/","{}","{}","False","","","False","herpadurr1","","","","False","1426349483.0","1426345883.0","","self.askgaybros","0","False","0","True","False","2z0vv6","True","","","","","","{}","[]","t3_2z0vv6","3","","False","http://www.reddit.com/r/askgaybros/comments/2z0vv6/how_do_i_prepare_for_my_first_time_as_a_bottom/","Unauthenticated reddit sesssion","","False","0","","{}","A little bit of backstory: Me and my best friend (not yet boyfriend, we'll see if that's gonna be a thing or not) met online half a year ago, we live around 600km from each other which is why we were only able to meet once so far. We did some stuff at that meetup (mostly oral), but because we're both closeted virgins we didn't want to do more without being really prepared for it. The next time we're gonna meet is in around three months, and we definitely want to have sex then.


Which is exactly why I read up some stuff about preparing for doing anal for the first time, but I still don't know what's the best way to prepare. I ordered myself an [anal training kit](https://i.imgur.com/2ms0wy2.jpg), some water-based lube as well as an anal douche, but how exactly should I prepare myself so it's gonna be as enjoyable as possible for when we actually have sex for the first time? Do I just use the anal dilators every evening with some lube, do I move them in and out, do I keep them inside me for a while so I get used to the feeling?

I feel a bit like an idiot because I'm asking for the best way to put up stuff in my butt, but I'm just completely clueless about how I should go about doing that without causing any harm. I just want the time me and my friend are gonna have together to be as much of an enjoyment as possible without any pain or even worse things involved if possible.","&lt;!-- SC_OFF --&gt;&lt;div class=""md""&gt;&lt;p&gt;A little bit of backstory: Me and my best friend (not yet boyfriend, we&amp;#39;ll see if that&amp;#39;s gonna be a thing or not) met online half a year ago, we live around 600km from each other which is why we were only able to meet once so far. We did some stuff at that meetup (mostly oral), but because we&amp;#39;re both closeted virgins we didn&amp;#39;t want to do more without being really prepared for it. The next time we&amp;#39;re gonna meet is in around three months, and we definitely want to have sex then.&lt;/p&gt;

&lt;p&gt;Which is exactly why I read up some stuff about preparing for doing anal for the first time, but I still don&amp;#39;t know what&amp;#39;s the best way to prepare. I ordered myself an &lt;a href=""https://i.imgur.com/2ms0wy2.jpg""&gt;anal training kit&lt;/a&gt;, some water-based lube as well as an anal douche, but how exactly should I prepare myself so it&amp;#39;s gonna be as enjoyable as possible for when we actually have sex for the first time? Do I just use the anal dilators every evening with some lube, do I move them in and out, do I keep them inside me for a while so I get used to the feeling?&lt;/p&gt;

&lt;p&gt;I feel a bit like an idiot because I&amp;#39;m asking for the best way to put up stuff in my butt, but I&amp;#39;m just completely clueless about how I should go about doing that without causing any harm. I just want the time me and my friend are gonna have together to be as much of an enjoyment as possible without any pain or even worse things involved if possible.&lt;/p&gt;
&lt;/div&gt;&lt;!-- SC_ON --&gt;","False","askgaybros","t5_2vgfw","","","How do I prepare for my first time as a bottom?","0","http://www.reddit.com/r/askgaybros/comments/2z0vv6/how_do_i_prepare_for_my_first_time_as_a_bottom/","[]","False"
"2","","","{}","http://www.reddit.com/api/info/","{}","{}","False","","","False","junkit","","","","False","1426346379.0","1426342779.0","","self.askgaybros","0","False","0","True","False","2z0qrf","True","","","","","","{}","[]","t3_2z0qrf","19","","False","http://www.reddit.com/r/askgaybros/comments/2z0qrf/need_your_thoughts_and_insight/","Unauthenticated reddit sesssion","","False","9","","{}","I have seen things on our family computer that strongly suggest my 14 y.o. son is gay.  I have read that it is best not to force someone out of closet.  He avoids being around family and doesn't have many friends.  I have made indirect comments showing my support -- and it seems to have backfired and made him distance himself even more from me.  Is he nervous that I am on to his secret and doesn't want to be found out?  Before puberty he used to be loving and talkative.  Not anymore.  Very sad situation.","&lt;!-- SC_OFF --&gt;&lt;div class=""md""&gt;&lt;p&gt;I have seen things on our family computer that strongly suggest my 14 y.o. son is gay.  I have read that it is best not to force someone out of closet.  He avoids being around family and doesn&amp;#39;t have many friends.  I have made indirect comments showing my support -- and it seems to have backfired and made him distance himself even more from me.  Is he nervous that I am on to his secret and doesn&amp;#39;t want to be found out?  Before puberty he used to be loving and talkative.  Not anymore.  Very sad situation.&lt;/p&gt;
&lt;/div&gt;&lt;!-- SC_ON --&gt;","False","askgaybros","t5_2vgfw","","","Need your thoughts and insight...","9","http://www.reddit.com/r/askgaybros/comments/2z0qrf/need_your_thoughts_and_insight/","[]","False"
"3","","","{}","http://www.reddit.com/api/info/","{}","{}","False","","","False","PhatTony7","","","","False","1426344070.0","1426340470.0","","self.askgaybros","0","False","0","True","False","2z0nao","True","","","","","","{}","[]","t3_2z0nao","11","","False","http://www.reddit.com/r/askgaybros/comments/2z0nao/anyone_hide_masturbating_from_their_bf/","Unauthenticated reddit sesssion","","False","12","","{}","BF and I live together.  I have a higher sex drive than him.  He likes to ""save up"" in between hook ups, which are roughly 3-4 times a week.  He wants me to do the same, but I get horny and jack off in between a lot of the time.  I don't think my jacking off affects my sex drive otherwise, except maybe my boners are a little less hard.  It has no effect on my willingness to hook up though.  Since he wants me to save up for the hookups, I have to sneak in my masturbation and I don't tell him about it.

Is this weird?  Should I be telling him when I masturbate?  I don't think he'd care that much, but he'd prolly be a lil disappointed.  But would he be more disappointed if he knew I was hiding something?  I know this is minor; just wanted to get you boiz advice.","&lt;!-- SC_OFF --&gt;&lt;div class=""md""&gt;&lt;p&gt;BF and I live together.  I have a higher sex drive than him.  He likes to &amp;quot;save up&amp;quot; in between hook ups, which are roughly 3-4 times a week.  He wants me to do the same, but I get horny and jack off in between a lot of the time.  I don&amp;#39;t think my jacking off affects my sex drive otherwise, except maybe my boners are a little less hard.  It has no effect on my willingness to hook up though.  Since he wants me to save up for the hookups, I have to sneak in my masturbation and I don&amp;#39;t tell him about it.&lt;/p&gt;

&lt;p&gt;Is this weird?  Should I be telling him when I masturbate?  I don&amp;#39;t think he&amp;#39;d care that much, but he&amp;#39;d prolly be a lil disappointed.  But would he be more disappointed if he knew I was hiding something?  I know this is minor; just wanted to get you boiz advice.&lt;/p&gt;
&lt;/div&gt;&lt;!-- SC_ON --&gt;","False","askgaybros","t5_2vgfw","","","Anyone hide masturbating from their bf?","12","http://www.reddit.com/r/askgaybros/comments/2z0nao/anyone_hide_masturbating_from_their_bf/","[]","False"
"4","","","{}","http://www.reddit.com/api/info/","{}","{}","False","","","False","I_haz_chicken_mix","","","","False","1426332578.0","1426328978.0","","surveymonkey.com","0","False","0","True","False","2z0an3","False","","","","","","{}","[]","t3_2z0an3","10","","False","http://www.reddit.com/r/askgaybros/comments/2z0an3/hey_guys_i_was_here_a_couple_days_ago_asking/","Unauthenticated reddit sesssion","","False","27","","{}","","","False","askgaybros","t5_2vgfw","","","Hey guys I was here a couple days ago asking people to take my survey and someone asked if they could see the results. So here they are, and again thanks to everyone who took part and helped me.","27","https://www.surveymonkey.com/results/SM-X7R2LHN7/","[]","False"
"5","","","{}","http://www.reddit.com/api/info/","{}","{}","False","","","False","throwaway_5461","","","","False","1426324061.0","1426320461.0","","self.askgaybros","0","False","0","True","False","2z031o","True","","","","","","{}","[]","t3_2z031o","7","","False","http://www.reddit.com/r/askgaybros/comments/2z031o/i_need_some_perspective_badly/","Unauthenticated reddit sesssion","","False","1","","{}","Last weekend I was really drunk and went home with a guy.... and did some drunk... stuff.

He's been texting me the last few days but I haven't responded. I can barely remember anything but I know we tried to have anal and it kinda succeeded. Fuck.

What do I do??","&lt;!-- SC_OFF --&gt;&lt;div class=""md""&gt;&lt;p&gt;Last weekend I was really drunk and went home with a guy.... and did some drunk... stuff.&lt;/p&gt;

&lt;p&gt;He&amp;#39;s been texting me the last few days but I haven&amp;#39;t responded. I can barely remember anything but I know we tried to have anal and it kinda succeeded. Fuck.&lt;/p&gt;

&lt;p&gt;What do I do??&lt;/p&gt;
&lt;/div&gt;&lt;!-- SC_ON --&gt;","False","askgaybros","t5_2vgfw","","","I need some perspective... BADLY.","1","http://www.reddit.com/r/askgaybros/comments/2z031o/i_need_some_perspective_badly/","[]","False"
"6","","","{}","http://www.reddit.com/api/info/","{}","{}","False","","","False","jonniearr","","","","False","1426320604.0","1426317004.0","","self.askgaybros","0","False","0","True","False","2yzzmh","True","","","","","","{}","[]","t3_2yzzmh","29","","False","http://www.reddit.com/r/askgaybros/comments/2yzzmh/weirdscary_experience_at_gay_club/","Unauthenticated reddit sesssion","","False","12","","{}","This isn't actually a question, I just needed a place to post it because I feel very creeped out right now.

I went to a gay club alone tonight. I've done it before, so it was whatever to me. It gives me a chance to talk to guys without using a friend as a safety net and possibly having to entertain them.

This one guy started to talk to me. We had actually talked on grindr before about fooling around.

He bought me drinks (I declined because I'm a diabetic and alcohol lowers my blood sugar, but he still bought them). After that he went to his friends, so I walked near an open area. He came to me and told me I need to tell him whenever I leave. I thought it was a mutual thing considering he went to his friends and wasn't inclusive about it.

Anyway, we talked more and kind of drifted our own ways. I pulled out my phone and texted one of my friends, and he walked to me and said he gets jealous and wants to know who I'm texting... That made me feel really weird so I went to the downstairs area of the club.

He came down shortly after and told me to go to the restroom with him, and he grabbed my hand and started to try to walk me in that direction. I told him no, and he said, ""so you're actually going to make me take you home?"" and then walked to the restroom by himself... I decided to just leave. It made me feel very uncomfortable and violated and scared","&lt;!-- SC_OFF --&gt;&lt;div class=""md""&gt;&lt;p&gt;This isn&amp;#39;t actually a question, I just needed a place to post it because I feel very creeped out right now.&lt;/p&gt;

&lt;p&gt;I went to a gay club alone tonight. I&amp;#39;ve done it before, so it was whatever to me. It gives me a chance to talk to guys without using a friend as a safety net and possibly having to entertain them.&lt;/p&gt;

&lt;p&gt;This one guy started to talk to me. We had actually talked on grindr before about fooling around.&lt;/p&gt;

&lt;p&gt;He bought me drinks (I declined because I&amp;#39;m a diabetic and alcohol lowers my blood sugar, but he still bought them). After that he went to his friends, so I walked near an open area. He came to me and told me I need to tell him whenever I leave. I thought it was a mutual thing considering he went to his friends and wasn&amp;#39;t inclusive about it.&lt;/p&gt;

&lt;p&gt;Anyway, we talked more and kind of drifted our own ways. I pulled out my phone and texted one of my friends, and he walked to me and said he gets jealous and wants to know who I&amp;#39;m texting... That made me feel really weird so I went to the downstairs area of the club.&lt;/p&gt;

&lt;p&gt;He came down shortly after and told me to go to the restroom with him, and he grabbed my hand and started to try to walk me in that direction. I told him no, and he said, &amp;quot;so you&amp;#39;re actually going to make me take you home?&amp;quot; and then walked to the restroom by himself... I decided to just leave. It made me feel very uncomfortable and violated and scared&lt;/p&gt;
&lt;/div&gt;&lt;!-- SC_ON --&gt;","False","askgaybros","t5_2vgfw","","","Weird/scary experience at gay club","12","http://www.reddit.com/r/askgaybros/comments/2yzzmh/weirdscary_experience_at_gay_club/","[]","False"
"7","","","{}","http://www.reddit.com/api/info/","{}","{}","False","","","False","Luxierio","","","","False","1426319072.0","1426315472.0","","self.askgaybros","0","False","0","True","False","2yzxzo","True","","","","","","{}","[]","t3_2yzxzo","10","","False","http://www.reddit.com/r/askgaybros/comments/2yzxzo/should_i_tell_my_step_dad_im_gay/","Unauthenticated reddit sesssion","","False","8","","{}","I'm 25 years old and I live away from my mom. My mom remarried to a wonderful guy, and both of them have a kid together. So I asked my mom if my step dad knew I was a homo,she said that he didn't need to know. I told her that if he's going to be part of this family unite and if she wants me to actually form a relationship with her husband, then he should know. Then again does he even need to know... I'm totally lost, so gaybros what should I do 

Tl:Dr mom doesn't want me telling my new step dad that I'm gay, and I don't know if he should know at all...","&lt;!-- SC_OFF --&gt;&lt;div class=""md""&gt;&lt;p&gt;I&amp;#39;m 25 years old and I live away from my mom. My mom remarried to a wonderful guy, and both of them have a kid together. So I asked my mom if my step dad knew I was a homo,she said that he didn&amp;#39;t need to know. I told her that if he&amp;#39;s going to be part of this family unite and if she wants me to actually form a relationship with her husband, then he should know. Then again does he even need to know... I&amp;#39;m totally lost, so gaybros what should I do &lt;/p&gt;

&lt;p&gt;Tl:Dr mom doesn&amp;#39;t want me telling my new step dad that I&amp;#39;m gay, and I don&amp;#39;t know if he should know at all...&lt;/p&gt;
&lt;/div&gt;&lt;!-- SC_ON --&gt;","False","askgaybros","t5_2vgfw","","","Should I tell my step dad I'm gay?","8","http://www.reddit.com/r/askgaybros/comments/2yzxzo/should_i_tell_my_step_dad_im_gay/","[]","False"
"8","","","{}","http://www.reddit.com/api/info/","{}","{}","False","","","False","joryonce","","","","False","1426318854.0","1426315254.0","","self.askgaybros","0","False","0","True","False","2yzxr9","True","","","","","","{}","[]","t3_2yzxr9","7","","False","http://www.reddit.com/r/askgaybros/comments/2yzxr9/ugheujrkjsdfjks_forgive/","Unauthenticated reddit sesssion","","False","0","","{}","So, I was/am in love with my ""straight"" friend. One time he told me was bi one night drunkenly via text... and I haven't been able to let it go. There's been so many hints, coincidences, and not to be cocky... I even think he may have accidentally fallen in love with me, his gay friend. We were emotionally connected and every since I confronted him about the not so subtleties. Our relationship has been tumultuous EVER since. I can admit, I want/wanted too much and I want him to stop pretending he doesn't remember all the moments he does something a little suggestive things. We constantly get confused for a couple in public and many people around campus think we're a couple. I maintain the same stance to him... Treat me like the rest of your ""bros"" and I'll act like one. You're leading me on and playing to my weaknesses even if it isn't your intention. I talk about him A LOT. All my chick best friends know I that I genuinely care about him as friend and that he means so much to me. Recently, he started hanging out with my best friend (we call each other brother and sister due to our similar ethnic background and complexions). I didn't like the fact that they were hanging out but what could I do? Being that I was SO close to them and I'm pretty brash.. I had no problem asking them if they were fucking. I constantly asked them and would obsess our the fact of whether they were or weren't. He adamantly denied it and she of course, did the same. She told me that he was so ""gay"", she would banter about how ""he talks too much with his hands"", ""he literally talks about YOU"", ""he likes you NOT me"". She constantly told me I nothing to worry about and that she was really JUST hanging out with him and trying to get him to confess his love for me. I recently found out that they had been sleeping together for 3 months. My heart was shattered. I expected this from him. He's a stupid, immature boy... Her? Not so much. Especially after she's lied to not only me but our other friends for MONTHS. It makes me feel stupid. It makes me feel like I'm the butt of some horrid joke. It makes me want to set things on fire. Am I allowed to be angry? I'm mad at the both of them. More her than him. I don't know what to do. I want to forgive and forget them. Of course, he still wants to be friends. She's probably scared shitless considering she did have to change her phone number because of some... things! I don't even know who I am any more! Help gay bros. 


P.S. we all go to same university.","&lt;!-- SC_OFF --&gt;&lt;div class=""md""&gt;&lt;p&gt;So, I was/am in love with my &amp;quot;straight&amp;quot; friend. One time he told me was bi one night drunkenly via text... and I haven&amp;#39;t been able to let it go. There&amp;#39;s been so many hints, coincidences, and not to be cocky... I even think he may have accidentally fallen in love with me, his gay friend. We were emotionally connected and every since I confronted him about the not so subtleties. Our relationship has been tumultuous EVER since. I can admit, I want/wanted too much and I want him to stop pretending he doesn&amp;#39;t remember all the moments he does something a little suggestive things. We constantly get confused for a couple in public and many people around campus think we&amp;#39;re a couple. I maintain the same stance to him... Treat me like the rest of your &amp;quot;bros&amp;quot; and I&amp;#39;ll act like one. You&amp;#39;re leading me on and playing to my weaknesses even if it isn&amp;#39;t your intention. I talk about him A LOT. All my chick best friends know I that I genuinely care about him as friend and that he means so much to me. Recently, he started hanging out with my best friend (we call each other brother and sister due to our similar ethnic background and complexions). I didn&amp;#39;t like the fact that they were hanging out but what could I do? Being that I was SO close to them and I&amp;#39;m pretty brash.. I had no problem asking them if they were fucking. I constantly asked them and would obsess our the fact of whether they were or weren&amp;#39;t. He adamantly denied it and she of course, did the same. She told me that he was so &amp;quot;gay&amp;quot;, she would banter about how &amp;quot;he talks too much with his hands&amp;quot;, &amp;quot;he literally talks about YOU&amp;quot;, &amp;quot;he likes you NOT me&amp;quot;. She constantly told me I nothing to worry about and that she was really JUST hanging out with him and trying to get him to confess his love for me. I recently found out that they had been sleeping together for 3 months. My heart was shattered. I expected this from him. He&amp;#39;s a stupid, immature boy... Her? Not so much. Especially after she&amp;#39;s lied to not only me but our other friends for MONTHS. It makes me feel stupid. It makes me feel like I&amp;#39;m the butt of some horrid joke. It makes me want to set things on fire. Am I allowed to be angry? I&amp;#39;m mad at the both of them. More her than him. I don&amp;#39;t know what to do. I want to forgive and forget them. Of course, he still wants to be friends. She&amp;#39;s probably scared shitless considering she did have to change her phone number because of some... things! I don&amp;#39;t even know who I am any more! Help gay bros. &lt;/p&gt;

&lt;p&gt;P.S. we all go to same university.&lt;/p&gt;
&lt;/div&gt;&lt;!-- SC_ON --&gt;","False","askgaybros","t5_2vgfw","","","Ugheujrkjsdfjks: Forgive?","0","http://www.reddit.com/r/askgaybros/comments/2yzxr9/ugheujrkjsdfjks_forgive/","[]","False"
"9","","","{}","http://www.reddit.com/api/info/","{}","{}","False","","","False","ipickedaname","","","","False","1426317843.0","1426314243.0","","self.askgaybros","0","False","0","True","False","2yzwlt","True","","","","","","{}","[]","t3_2yzwlt","6","","False","http://www.reddit.com/r/askgaybros/comments/2yzwlt/i_need_adviceon_anything_and_everything/","Unauthenticated reddit sesssion","","False","1","","{}","I'm a guy in the closet and I have been thinking about experimenting with someone.  But I've been very apprehensive about it because I am not confident about myself and I don't even know where to start looking.  I've tried Grindr and haven't gotten many results, because most people I've found are just there for sex so I've lost trust in it.  I guess to summarize, how do I find the right person to start things out with?

One other thing.  There's a girl who's been crushing on me for 2 years now and I'm not sure how to tell her that I am gay without hurting her, since she's become a pretty close friend over that time....

Advice...please -.-","&lt;!-- SC_OFF --&gt;&lt;div class=""md""&gt;&lt;p&gt;I&amp;#39;m a guy in the closet and I have been thinking about experimenting with someone.  But I&amp;#39;ve been very apprehensive about it because I am not confident about myself and I don&amp;#39;t even know where to start looking.  I&amp;#39;ve tried Grindr and haven&amp;#39;t gotten many results, because most people I&amp;#39;ve found are just there for sex so I&amp;#39;ve lost trust in it.  I guess to summarize, how do I find the right person to start things out with?&lt;/p&gt;

&lt;p&gt;One other thing.  There&amp;#39;s a girl who&amp;#39;s been crushing on me for 2 years now and I&amp;#39;m not sure how to tell her that I am gay without hurting her, since she&amp;#39;s become a pretty close friend over that time....&lt;/p&gt;

&lt;p&gt;Advice...please -.-&lt;/p&gt;
&lt;/div&gt;&lt;!-- SC_ON --&gt;","False","askgaybros","t5_2vgfw","","","I need advice...on anything and everything....","1","http://www.reddit.com/r/askgaybros/comments/2yzwlt/i_need_adviceon_anything_and_everything/","[]","False"
"10","","","{}","http://www.reddit.com/api/info/","{}","{}","False","","","False","thydevourer666","","","","False","1426317391.0","1426313791.0","","self.askgaybros","0","False","0","True","False","2yzw3q","True","","","","","","{}","[]","t3_2yzw3q","3","","False","http://www.reddit.com/r/askgaybros/comments/2yzw3q/bananacucumber_was_on_aussie_tv_for_the_first/","Unauthenticated reddit sesssion","","False","0","","{}","Does anybody know of any tv series where gay characters are perceived not as sex crazed manics?","&lt;!-- SC_OFF --&gt;&lt;div class=""md""&gt;&lt;p&gt;Does anybody know of any tv series where gay characters are perceived not as sex crazed manics?&lt;/p&gt;
&lt;/div&gt;&lt;!-- SC_ON --&gt;","False","askgaybros","t5_2vgfw","","","Banana/Cucumber was on Aussie tv for the first time last night","0","http://www.reddit.com/r/askgaybros/comments/2yzw3q/bananacucumber_was_on_aussie_tv_for_the_first/","[]","False"
