"","_comment_sort","_comments","_comments_by_id","_info_url","_orphaned","_params","_replaced_more","_underscore_names","approved_by","archived","author","author_flair_css_class","author_flair_text","banned_by","clicked","created","created_utc","distinguished","domain","downs","edited","gilded","has_fetched","hidden","id","is_self","json_dict","likes","link_flair_css_class","link_flair_text","media","media_embed","mod_reports","name","num_comments","num_reports","over_18","permalink","reddit_session","report_reasons","saved","score","secure_media","secure_media_embed","selftext","selftext_html","stickied","subreddit","subreddit_id","suggested_sort","thumbnail","title","ups","url","user_reports","visited"
"0","","","{}","http://www.reddit.com/api/info/","{}","{}","False","","","True","titanTek","","","","False","1399900876.0","1399897276.0","","self.askgaybros","0","False","0","True","False","25cql2","True","","","","","","{}","[]","t3_25cql2","6","","False","http://www.reddit.com/r/askgaybros/comments/25cql2/monogamous_friends/","Unauthenticated reddit sesssion","","False","0","","{}","Why is it so hard to find other gay bro monogamous couples to hang out with in Orange County?","&lt;!-- SC_OFF --&gt;&lt;div class=""md""&gt;&lt;p&gt;Why is it so hard to find other gay bro monogamous couples to hang out with in Orange County?&lt;/p&gt;
&lt;/div&gt;&lt;!-- SC_ON --&gt;","False","askgaybros","t5_2vgfw","","","Monogamous friends","0","http://www.reddit.com/r/askgaybros/comments/25cql2/monogamous_friends/","[]","False"
"1","","","{}","http://www.reddit.com/api/info/","{}","{}","False","","","True","Steelhedge","","","","False","1399881000.0","1399877400.0","","self.askgaybros","0","False","0","True","False","25cazn","True","","","","","","{}","[]","t3_25cazn","28","","False","http://www.reddit.com/r/askgaybros/comments/25cazn/hey_any_guys_here_ever_used_to_sleep_with_girls/","Unauthenticated reddit sesssion","","False","11","","{}","Just kinda curious if any of the guys here ever used to sleep with girls? Got a couple of questions.

If you used to sleep with girls was it before you got into guys? 

Did sleeping with a dude for the first time feel better thn with a girl or just different?
","&lt;!-- SC_OFF --&gt;&lt;div class=""md""&gt;&lt;p&gt;Just kinda curious if any of the guys here ever used to sleep with girls? Got a couple of questions.&lt;/p&gt;

&lt;p&gt;If you used to sleep with girls was it before you got into guys? &lt;/p&gt;

&lt;p&gt;Did sleeping with a dude for the first time feel better thn with a girl or just different?&lt;/p&gt;
&lt;/div&gt;&lt;!-- SC_ON --&gt;","False","askgaybros","t5_2vgfw","","","Hey, any guys here ever used to sleep with girls?","11","http://www.reddit.com/r/askgaybros/comments/25cazn/hey_any_guys_here_ever_used_to_sleep_with_girls/","[]","False"
"2","","","{}","http://www.reddit.com/api/info/","{}","{}","False","","","True","SoshiDesu","","","","False","1399880463.0","1399876863.0","","self.askgaybros","0","False","0","True","False","25cai7","True","","","","","","{}","[]","t3_25cai7","18","","False","http://www.reddit.com/r/askgaybros/comments/25cai7/so_a_romantic_dilema/","Unauthenticated reddit sesssion","","False","5","","{}","Hey guys, I just wanted to ask you:

So basically I'm not the sweetest guy on earth, most of the time I feel ridiculous calling names like sweetheart and doing stuff some people would consider ""Romantic"". But you know when a guy acts like that to you ( In my case I do like when guys act like that for me, but I hate doing it) and they  expect you to do the same, But you don't do it... I feel selfish about it and sometimes i dont know what to do, you think it can ruin my future relationships?","&lt;!-- SC_OFF --&gt;&lt;div class=""md""&gt;&lt;p&gt;Hey guys, I just wanted to ask you:&lt;/p&gt;

&lt;p&gt;So basically I&amp;#39;m not the sweetest guy on earth, most of the time I feel ridiculous calling names like sweetheart and doing stuff some people would consider &amp;quot;Romantic&amp;quot;. But you know when a guy acts like that to you ( In my case I do like when guys act like that for me, but I hate doing it) and they  expect you to do the same, But you don&amp;#39;t do it... I feel selfish about it and sometimes i dont know what to do, you think it can ruin my future relationships?&lt;/p&gt;
&lt;/div&gt;&lt;!-- SC_ON --&gt;","False","askgaybros","t5_2vgfw","","","So... A romantic Dilema","5","http://www.reddit.com/r/askgaybros/comments/25cai7/so_a_romantic_dilema/","[]","False"
"3","","","{}","http://www.reddit.com/api/info/","{}","{}","False","","","True","p0rt25","","","","False","1399876874.0","1399873274.0","","self.askgaybros","0","False","0","True","False","25c74s","True","","","","","","{}","[]","t3_25c74s","6","","False","http://www.reddit.com/r/askgaybros/comments/25c74s/gb_why_do_gays_like_disney_so_much/","Unauthenticated reddit sesssion","","False","0","","{}","I've never understood it...its not a bad thing tho","&lt;!-- SC_OFF --&gt;&lt;div class=""md""&gt;&lt;p&gt;I&amp;#39;ve never understood it...its not a bad thing tho&lt;/p&gt;
&lt;/div&gt;&lt;!-- SC_ON --&gt;","False","askgaybros","t5_2vgfw","","","GB, Why do gays like disney so much?","0","http://www.reddit.com/r/askgaybros/comments/25c74s/gb_why_do_gays_like_disney_so_much/","[]","False"
"4","","","{}","http://www.reddit.com/api/info/","{}","{}","False","","","True","YouLackOriginality","","","","False","1399876435.0","1399872835.0","","self.askgaybros","0","False","0","True","False","25c6pd","True","","","","","","{}","[]","t3_25c6pd","4","","False","http://www.reddit.com/r/askgaybros/comments/25c6pd/how_do_i_get_close_with_somebody_when_i_suffer/","Unauthenticated reddit sesssion","","False","3","","{}","I am 25. I am gay. I am a virgin. I have hidradenitis suppurativa. I am alone. I need help.

I suffer from a skin disorder that involves having cysts in places like my armpits and my groin. The problem is that these cysts grow huge in size (often to the size of golf balls and sometimes the size of a tennis ball) and when they finally are able to be ""popped,"" they take forever to heal, have a horrible odor, and leave a huge scar. As of now, there is no known-cure or treatment. The scaring to my groin is so significant that I have been terrified of ever trying past first base on my end. I've given a couple blowjobs, but I've never received anything in return. For those who are curious, just search the condition on Google and you will find pictures that are highly disturbing. 

This is what seems to be an endless cycle:

1. I see somebody I am interested in. Every single time, the person is way out of my league (I've never met a person *in* my league).
2. If I'm capable of mustering the courage, I try to talk to them.
3. But when I do, a part of my subconscious automatically pulls myself away, because I am so ashamed of my skin.
4. I end up alone.
5. So why bother?
","&lt;!-- SC_OFF --&gt;&lt;div class=""md""&gt;&lt;p&gt;I am 25. I am gay. I am a virgin. I have hidradenitis suppurativa. I am alone. I need help.&lt;/p&gt;

&lt;p&gt;I suffer from a skin disorder that involves having cysts in places like my armpits and my groin. The problem is that these cysts grow huge in size (often to the size of golf balls and sometimes the size of a tennis ball) and when they finally are able to be &amp;quot;popped,&amp;quot; they take forever to heal, have a horrible odor, and leave a huge scar. As of now, there is no known-cure or treatment. The scaring to my groin is so significant that I have been terrified of ever trying past first base on my end. I&amp;#39;ve given a couple blowjobs, but I&amp;#39;ve never received anything in return. For those who are curious, just search the condition on Google and you will find pictures that are highly disturbing. &lt;/p&gt;

&lt;p&gt;This is what seems to be an endless cycle:&lt;/p&gt;

&lt;ol&gt;
&lt;li&gt;I see somebody I am interested in. Every single time, the person is way out of my league (I&amp;#39;ve never met a person &lt;em&gt;in&lt;/em&gt; my league).&lt;/li&gt;
&lt;li&gt;If I&amp;#39;m capable of mustering the courage, I try to talk to them.&lt;/li&gt;
&lt;li&gt;But when I do, a part of my subconscious automatically pulls myself away, because I am so ashamed of my skin.&lt;/li&gt;
&lt;li&gt;I end up alone.&lt;/li&gt;
&lt;li&gt;So why bother?&lt;/li&gt;
&lt;/ol&gt;
&lt;/div&gt;&lt;!-- SC_ON --&gt;","False","askgaybros","t5_2vgfw","","","How do I get close with somebody when I suffer from a non-communicable skin disease?","3","http://www.reddit.com/r/askgaybros/comments/25c6pd/how_do_i_get_close_with_somebody_when_i_suffer/","[]","False"
"5","","","{}","http://www.reddit.com/api/info/","{}","{}","False","","","True","ThinkingBlur","","","","False","1399875940.0","1399872340.0","","self.askgaybros","0","False","0","True","False","25c689","True","","","","","","{}","[]","t3_25c689","62","","False","http://www.reddit.com/r/askgaybros/comments/25c689/whos_your_ideal_guy_with_pic/","Unauthenticated reddit sesssion","","False","10","","{}","I'm between [THIS](http://in-the-thaw.tumblr.com/post/15508815594) &amp; [THIS](http://daviekid.tumblr.com/post/74255463260) NSFW, of course these are only hopes and dreams but dreaming is free ;)

But any guy will do really, you never know who you will
Love. ","&lt;!-- SC_OFF --&gt;&lt;div class=""md""&gt;&lt;p&gt;I&amp;#39;m between &lt;a href=""http://in-the-thaw.tumblr.com/post/15508815594""&gt;THIS&lt;/a&gt; &amp;amp; &lt;a href=""http://daviekid.tumblr.com/post/74255463260""&gt;THIS&lt;/a&gt; NSFW, of course these are only hopes and dreams but dreaming is free ;)&lt;/p&gt;

&lt;p&gt;But any guy will do really, you never know who you will
Love. &lt;/p&gt;
&lt;/div&gt;&lt;!-- SC_ON --&gt;","False","askgaybros","t5_2vgfw","","","Who's your ideal guy? (With pic)","10","http://www.reddit.com/r/askgaybros/comments/25c689/whos_your_ideal_guy_with_pic/","[]","False"
"6","","","{}","http://www.reddit.com/api/info/","{}","{}","False","","","True","joemonroexxx","","","","False","1399874313.0","1399870713.0","","self.askgaybros","0","False","0","True","False","25c4h5","True","","","","","","{}","[]","t3_25c4h5","2","","False","http://www.reddit.com/r/askgaybros/comments/25c4h5/whats_the_chances_of_getting_herpes_through/","Unauthenticated reddit sesssion","","False","2","","{}","I don't really hear that much about gay guys and herpes. I'm not saying it doesn't exist but I know men have a less herpes rate than women, so I assume the transmission rate is less? 

What about things like gonorrhea and sylphalis (spelling?)

Those probably only things I'm worried about and not sure if I should give head unless I am going to be seeing them a lot or something. 

Also are there things to take to reduce the likelihood? ","&lt;!-- SC_OFF --&gt;&lt;div class=""md""&gt;&lt;p&gt;I don&amp;#39;t really hear that much about gay guys and herpes. I&amp;#39;m not saying it doesn&amp;#39;t exist but I know men have a less herpes rate than women, so I assume the transmission rate is less? &lt;/p&gt;

&lt;p&gt;What about things like gonorrhea and sylphalis (spelling?)&lt;/p&gt;

&lt;p&gt;Those probably only things I&amp;#39;m worried about and not sure if I should give head unless I am going to be seeing them a lot or something. &lt;/p&gt;

&lt;p&gt;Also are there things to take to reduce the likelihood? &lt;/p&gt;
&lt;/div&gt;&lt;!-- SC_ON --&gt;","False","askgaybros","t5_2vgfw","","","What's the chances of getting herpes through giving oral?","2","http://www.reddit.com/r/askgaybros/comments/25c4h5/whats_the_chances_of_getting_herpes_through/","[]","False"
"7","","","{}","http://www.reddit.com/api/info/","{}","{}","False","","","True","Curiousteen10192","","","","False","1399873345.0","1399869745.0","","self.askgaybros","0","False","0","True","False","25c3e3","True","","","","","","{}","[]","t3_25c3e3","19","","False","http://www.reddit.com/r/askgaybros/comments/25c3e3/should_i_sleep_with_an_older_guy_for_the_first/","Unauthenticated reddit sesssion","","False","7","","{}","Hi! I just turned 18 two months ago and have been talking with this guy (44) for a month on OkCupid. He seems pretty cool and pretty nice. We've sexted some but haven't met in person.
He knows I am a virgin and promised we would take it slow if we ever had sex but I wanted to get your thoughts on it.
I won't say we have some emotional connection. It's been small talk and sexting pretty much.

Do you have any advice for me on how to approach this situation? Thanks! :)","&lt;!-- SC_OFF --&gt;&lt;div class=""md""&gt;&lt;p&gt;Hi! I just turned 18 two months ago and have been talking with this guy (44) for a month on OkCupid. He seems pretty cool and pretty nice. We&amp;#39;ve sexted some but haven&amp;#39;t met in person.
He knows I am a virgin and promised we would take it slow if we ever had sex but I wanted to get your thoughts on it.
I won&amp;#39;t say we have some emotional connection. It&amp;#39;s been small talk and sexting pretty much.&lt;/p&gt;

&lt;p&gt;Do you have any advice for me on how to approach this situation? Thanks! :)&lt;/p&gt;
&lt;/div&gt;&lt;!-- SC_ON --&gt;","False","askgaybros","t5_2vgfw","","","Should I sleep with an older guy for the first time?","7","http://www.reddit.com/r/askgaybros/comments/25c3e3/should_i_sleep_with_an_older_guy_for_the_first/","[]","False"
"8","","","{}","http://www.reddit.com/api/info/","{}","{}","False","","","True","not_sure_if_sure","","","","False","1399872897.0","1399869297.0","","self.askgaybros","0","False","0","True","False","25c2w3","True","","","","","","{}","[]","t3_25c2w3","16","","False","http://www.reddit.com/r/askgaybros/comments/25c2w3/what_should_i_make_of_these_kinds_of_thoughts/","Unauthenticated reddit sesssion","","False","4","","{}","Hi all, hoping you could provide a little insight for me, it would be much appreciated. A little background info: I'm a 19/M and up until rather recently I had only considered myself as straight (then again, I never really thought about it much). Still a virgin, and haven't had too much experience relationship-wise. But on to what brings me here.

* I don't usually go through the process of ogling at a girl as she walks by, and I can't say that there are many, if any girls I've thought about in a sexual manner. 

* On the flip side, I caught myself mote than a few times noticing some feature on a guy in a sort of envious fashion, like ""wow, I wish that was me"" or ""I wish I looked like that"" (I don't know if this counts as being attracted to them?)

* I've been thinking a lot recently about what it'd be like to give a blowjob, imagining it quite often

* At this point I can get hard pretty easily to the thought of being with another guy sexually, or even the general idea of being gay

* Recently, I've found that I've been getting off while thinking about all of this too (I've never really been one for porn, but I've found that while most doesn't do anything for me, gay porn seems to do the trick)

I'm just genuinely confused, so I thought I'd see what you guys think. Any insight for me?","&lt;!-- SC_OFF --&gt;&lt;div class=""md""&gt;&lt;p&gt;Hi all, hoping you could provide a little insight for me, it would be much appreciated. A little background info: I&amp;#39;m a 19/M and up until rather recently I had only considered myself as straight (then again, I never really thought about it much). Still a virgin, and haven&amp;#39;t had too much experience relationship-wise. But on to what brings me here.&lt;/p&gt;

&lt;ul&gt;
&lt;li&gt;&lt;p&gt;I don&amp;#39;t usually go through the process of ogling at a girl as she walks by, and I can&amp;#39;t say that there are many, if any girls I&amp;#39;ve thought about in a sexual manner. &lt;/p&gt;&lt;/li&gt;
&lt;li&gt;&lt;p&gt;On the flip side, I caught myself mote than a few times noticing some feature on a guy in a sort of envious fashion, like &amp;quot;wow, I wish that was me&amp;quot; or &amp;quot;I wish I looked like that&amp;quot; (I don&amp;#39;t know if this counts as being attracted to them?)&lt;/p&gt;&lt;/li&gt;
&lt;li&gt;&lt;p&gt;I&amp;#39;ve been thinking a lot recently about what it&amp;#39;d be like to give a blowjob, imagining it quite often&lt;/p&gt;&lt;/li&gt;
&lt;li&gt;&lt;p&gt;At this point I can get hard pretty easily to the thought of being with another guy sexually, or even the general idea of being gay&lt;/p&gt;&lt;/li&gt;
&lt;li&gt;&lt;p&gt;Recently, I&amp;#39;ve found that I&amp;#39;ve been getting off while thinking about all of this too (I&amp;#39;ve never really been one for porn, but I&amp;#39;ve found that while most doesn&amp;#39;t do anything for me, gay porn seems to do the trick)&lt;/p&gt;&lt;/li&gt;
&lt;/ul&gt;

&lt;p&gt;I&amp;#39;m just genuinely confused, so I thought I&amp;#39;d see what you guys think. Any insight for me?&lt;/p&gt;
&lt;/div&gt;&lt;!-- SC_ON --&gt;","False","askgaybros","t5_2vgfw","","","What should I make of these kinds of thoughts?","4","http://www.reddit.com/r/askgaybros/comments/25c2w3/what_should_i_make_of_these_kinds_of_thoughts/","[]","False"
"9","","","{}","http://www.reddit.com/api/info/","{}","{}","False","","","True","theoverthinkingtype","","","","False","1399866818.0","1399863218.0","","self.askgaybros","0","False","0","True","False","25bv46","True","","","","","","{}","[]","t3_25bv46","38","","False","http://www.reddit.com/r/askgaybros/comments/25bv46/help_with_a_slowass_texterexplanation_from/","Unauthenticated reddit sesssion","","False","16","","{}","So after not finding many guys I've been super into in the city I moved to a few months ago, I met a guy at a bar recently who I was immediately smitten with. We had a first date which went very well (and went overnight), one of the best first dates I've ever been on, real heavy emotional connection and everything. I was very into him and he definitely seemed very into me. We're planning on going on a second date soon.

However, there's a little issue, which, due to my anxiety-prone nature, is kind of a bigger issue for me. He's pretty bad with the texting. After meeting at the bar, I texted him the next day asking him out, and he replies back pretty soon saying he's up for it, but the next week is out for various reasons. I text him a week later, and get no reply. Start thinking ""Oh, he's not interested,"" and get down in the dumps, but then get a reply the next day and we go out the night following. Our date ended in the morning, and the day after that I give him a casual ""Hey, how did (thing that was going on the previous day) go?"" And no reply again for a day. I definitely start thinking ""Oh crap, one of those one-and-done deals,"" and get down in the dumps about it. I figure that's it, but text the next day to make sure with a ""Hey, had a great time, would really like to see you again,"" to which he replies affirmatively an hour later, asking what my schedule is like. I reply a bit after that with my availability, and it's been more than a day since then with no reply.

I get now that he's likely just a person who is *verrrrry* slow with texting, but, if you haven't noticed, I'm a kind of neurotic guy, and it makes me start running through negative scenarios in my head, i.e. ""Well, that dating relationship is over."" I know this is probably something I should deal with myself, but in the meantime, is there perhaps a gentle way on our next date to inquire why he does this/ask him to maybe at least give me a ""let me get back to you?"" Should I inquire if there's a form of communication he prefers? I could invest in a homing pigeon if need be. Or is this all an insane thing to bring up on a second date and I should just deal with it?

Also, for slow texters, any explanation of WHY one would do this? Another friend told me he sometimes does this to play hard to get, which is maybe the most annoying thing I've ever heard.

Man, I need to start seeing a shrink again. I'm a grown-ass man and acting like a teenager.

TLDR: Why do some guys take so long to text back? Any way to nip it in the bud early in a relationship?","&lt;!-- SC_OFF --&gt;&lt;div class=""md""&gt;&lt;p&gt;So after not finding many guys I&amp;#39;ve been super into in the city I moved to a few months ago, I met a guy at a bar recently who I was immediately smitten with. We had a first date which went very well (and went overnight), one of the best first dates I&amp;#39;ve ever been on, real heavy emotional connection and everything. I was very into him and he definitely seemed very into me. We&amp;#39;re planning on going on a second date soon.&lt;/p&gt;

&lt;p&gt;However, there&amp;#39;s a little issue, which, due to my anxiety-prone nature, is kind of a bigger issue for me. He&amp;#39;s pretty bad with the texting. After meeting at the bar, I texted him the next day asking him out, and he replies back pretty soon saying he&amp;#39;s up for it, but the next week is out for various reasons. I text him a week later, and get no reply. Start thinking &amp;quot;Oh, he&amp;#39;s not interested,&amp;quot; and get down in the dumps, but then get a reply the next day and we go out the night following. Our date ended in the morning, and the day after that I give him a casual &amp;quot;Hey, how did (thing that was going on the previous day) go?&amp;quot; And no reply again for a day. I definitely start thinking &amp;quot;Oh crap, one of those one-and-done deals,&amp;quot; and get down in the dumps about it. I figure that&amp;#39;s it, but text the next day to make sure with a &amp;quot;Hey, had a great time, would really like to see you again,&amp;quot; to which he replies affirmatively an hour later, asking what my schedule is like. I reply a bit after that with my availability, and it&amp;#39;s been more than a day since then with no reply.&lt;/p&gt;

&lt;p&gt;I get now that he&amp;#39;s likely just a person who is &lt;em&gt;verrrrry&lt;/em&gt; slow with texting, but, if you haven&amp;#39;t noticed, I&amp;#39;m a kind of neurotic guy, and it makes me start running through negative scenarios in my head, i.e. &amp;quot;Well, that dating relationship is over.&amp;quot; I know this is probably something I should deal with myself, but in the meantime, is there perhaps a gentle way on our next date to inquire why he does this/ask him to maybe at least give me a &amp;quot;let me get back to you?&amp;quot; Should I inquire if there&amp;#39;s a form of communication he prefers? I could invest in a homing pigeon if need be. Or is this all an insane thing to bring up on a second date and I should just deal with it?&lt;/p&gt;

&lt;p&gt;Also, for slow texters, any explanation of WHY one would do this? Another friend told me he sometimes does this to play hard to get, which is maybe the most annoying thing I&amp;#39;ve ever heard.&lt;/p&gt;

&lt;p&gt;Man, I need to start seeing a shrink again. I&amp;#39;m a grown-ass man and acting like a teenager.&lt;/p&gt;

&lt;p&gt;TLDR: Why do some guys take so long to text back? Any way to nip it in the bud early in a relationship?&lt;/p&gt;
&lt;/div&gt;&lt;!-- SC_ON --&gt;","False","askgaybros","t5_2vgfw","","","Help with a slow-ass texter/explanation from slow-ass texters?","16","http://www.reddit.com/r/askgaybros/comments/25bv46/help_with_a_slowass_texterexplanation_from/","[]","False"
"10","","","{}","http://www.reddit.com/api/info/","{}","{}","False","","","True","jwjhjunk","","","","False","1399864827.0","1399861227.0","","self.askgaybros","0","False","0","True","False","25bsb0","True","","","","","","{}","[]","t3_25bsb0","4","","False","http://www.reddit.com/r/askgaybros/comments/25bsb0/hookups_and_stis/","Unauthenticated reddit sesssion","","False","7","","{}","I'm currently 18 and growing up in a foreign, semi-homophobic country, which means even though I know I'm gay I haven't really had the chance to explore my sexuality yet. This is probably going to change when I get back to uni in my home country, but I have a really, really strong fear about one thing - STIs.

Having worked with AIDS patients, seen all the stats, and hearing about things like super gonorrhoea, I am scared shitless. Would any of you guys be able to tell me from personal experience how you have gotten over this, whether my worries are justified and what you've done to stay safe? Is it worth not hooking up to avoid STIs? At this point I'm seriously considering abstinence until I'm in a committed relationship...","&lt;!-- SC_OFF --&gt;&lt;div class=""md""&gt;&lt;p&gt;I&amp;#39;m currently 18 and growing up in a foreign, semi-homophobic country, which means even though I know I&amp;#39;m gay I haven&amp;#39;t really had the chance to explore my sexuality yet. This is probably going to change when I get back to uni in my home country, but I have a really, really strong fear about one thing - STIs.&lt;/p&gt;

&lt;p&gt;Having worked with AIDS patients, seen all the stats, and hearing about things like super gonorrhoea, I am scared shitless. Would any of you guys be able to tell me from personal experience how you have gotten over this, whether my worries are justified and what you&amp;#39;ve done to stay safe? Is it worth not hooking up to avoid STIs? At this point I&amp;#39;m seriously considering abstinence until I&amp;#39;m in a committed relationship...&lt;/p&gt;
&lt;/div&gt;&lt;!-- SC_ON --&gt;","False","askgaybros","t5_2vgfw","","","Hookups and STIs","7","http://www.reddit.com/r/askgaybros/comments/25bsb0/hookups_and_stis/","[]","False"
