"","_comment_sort","_comments","_comments_by_id","_info_url","_orphaned","_params","_replaced_more","_underscore_names","approved_by","archived","author","author_flair_css_class","author_flair_text","banned_by","clicked","created","created_utc","distinguished","domain","downs","edited","gilded","has_fetched","hidden","id","is_self","json_dict","likes","link_flair_css_class","link_flair_text","media","media_embed","mod_reports","name","num_comments","num_reports","over_18","permalink","reddit_session","report_reasons","saved","score","secure_media","secure_media_embed","selftext","selftext_html","stickied","subreddit","subreddit_id","suggested_sort","thumbnail","title","ups","url","user_reports","visited"
"23","","","{}","http://www.reddit.com/api/info/","{}","{}","False","","","False","renerdrat","","","","False","1422322703.0","1422322703.0","","self.askgaybros","0","1422330007.0","0","True","False","2tsglg","True","","","","","","{}","[]","t3_2tsglg","32","","False","http://www.reddit.com/r/askgaybros/comments/2tsglg/how_do_cut_guys_like_to_be_jerked_off_most/","Unauthenticated reddit sesssion","","False","14","","{}","so... I've been giving guys hand jobs for a while now but, for some reason I never really thought about how you have to jerk off a dude differently if he doesn't have foreskin, I have no idea why that didn't really cross my mind, until this guy was  teaching me what feels best, most guys just don't say anything but he was really upfront and honest about everything. 

He said just rub the top down over to the shaft then start at the top again.. but that seemed really strange to me, and still felt like I was doing something wrong. Or? I dunno. Maybe it was just how he likes it or something

edit: i figured people would mention ""bj's are way better"" and there's a time for that, but that's not what I'm asking  ","&lt;!-- SC_OFF --&gt;&lt;div class=""md""&gt;&lt;p&gt;so... I&amp;#39;ve been giving guys hand jobs for a while now but, for some reason I never really thought about how you have to jerk off a dude differently if he doesn&amp;#39;t have foreskin, I have no idea why that didn&amp;#39;t really cross my mind, until this guy was  teaching me what feels best, most guys just don&amp;#39;t say anything but he was really upfront and honest about everything. &lt;/p&gt;

&lt;p&gt;He said just rub the top down over to the shaft then start at the top again.. but that seemed really strange to me, and still felt like I was doing something wrong. Or? I dunno. Maybe it was just how he likes it or something&lt;/p&gt;

&lt;p&gt;edit: i figured people would mention &amp;quot;bj&amp;#39;s are way better&amp;quot; and there&amp;#39;s a time for that, but that&amp;#39;s not what I&amp;#39;m asking  &lt;/p&gt;
&lt;/div&gt;&lt;!-- SC_ON --&gt;","False","askgaybros","t5_2vgfw","","","How do cut guys like to be jerked off most?","14","http://www.reddit.com/r/askgaybros/comments/2tsglg/how_do_cut_guys_like_to_be_jerked_off_most/","[]","False"
"24","","","{}","http://www.reddit.com/api/info/","{}","{}","False","","","False","3525j","","","","False","1422321898.0","1422321898.0","","self.askgaybros","0","False","0","True","False","2tseyl","True","","","","","","{}","[]","t3_2tseyl","8","","False","http://www.reddit.com/r/askgaybros/comments/2tseyl/having_feelings/","Unauthenticated reddit sesssion","","False","14","","{}","I'm pretty sure I'm bi.  I've never been in a relationship and only have had sex with women.  I would say that I am sexually attracted to about 80% of women and about 40% of men.  However, when I am attracted to someone, the levels of attraction can very well be equal.  I am attracted to some men more than some women.

However, the only person I have ever felt feelings for is a man.  My best friend is openly gay.  I am not.  Nobody knows that I am bi, and I have gone my whole life just hooking up with women or neglecting dating altogether.  I really feel he understands me, and I want to ask him out but I'm not sure.

I'm like 98% sure he's into me.  I'm also pretty sure he thought I was gay/bi for a while until I told him about my recent hookups with women over lunch.  He looked sad.  Looking back, I really regret doing that.  

Should I come out to him?  I've never really had feelings for women on an ""love"" level either, so could this mean I'm gay?","&lt;!-- SC_OFF --&gt;&lt;div class=""md""&gt;&lt;p&gt;I&amp;#39;m pretty sure I&amp;#39;m bi.  I&amp;#39;ve never been in a relationship and only have had sex with women.  I would say that I am sexually attracted to about 80% of women and about 40% of men.  However, when I am attracted to someone, the levels of attraction can very well be equal.  I am attracted to some men more than some women.&lt;/p&gt;

&lt;p&gt;However, the only person I have ever felt feelings for is a man.  My best friend is openly gay.  I am not.  Nobody knows that I am bi, and I have gone my whole life just hooking up with women or neglecting dating altogether.  I really feel he understands me, and I want to ask him out but I&amp;#39;m not sure.&lt;/p&gt;

&lt;p&gt;I&amp;#39;m like 98% sure he&amp;#39;s into me.  I&amp;#39;m also pretty sure he thought I was gay/bi for a while until I told him about my recent hookups with women over lunch.  He looked sad.  Looking back, I really regret doing that.  &lt;/p&gt;

&lt;p&gt;Should I come out to him?  I&amp;#39;ve never really had feelings for women on an &amp;quot;love&amp;quot; level either, so could this mean I&amp;#39;m gay?&lt;/p&gt;
&lt;/div&gt;&lt;!-- SC_ON --&gt;","False","askgaybros","t5_2vgfw","","","Having ""feelings""","14","http://www.reddit.com/r/askgaybros/comments/2tseyl/having_feelings/","[]","False"
"25","","","{}","http://www.reddit.com/api/info/","{}","{}","False","","","False","itwasjuly","","","","False","1422318905.0","1422318905.0","","self.askgaybros","0","False","0","True","False","2ts8iy","True","","","","","","{}","[]","t3_2ts8iy","8","","True","http://www.reddit.com/r/askgaybros/comments/2ts8iy/first_time_dp_nsfw/","Unauthenticated reddit sesssion","","False","0","","{}","So, last night I was double penetrated for the first time. And it was amazing. Like.... wow. To be honest yeah, it hurt a bit when we first started going at at. But it felt great afterwards. My boyfriend came pretty fast, but we were able to try again later.

Now, the thing is I was a little sore yeah, but I didn't have any major bleeding (there was a little bit on the condoms but barely noticeable). But then today when I went to the bathroom... lets just say there was a lot of red in there. For anyone thats been DP'd, is this normal? I'm gonna go get it checked out regardless, but I just wanna make sure. Plus is it gonna happen everytime? Because I really want to do it again (aside from the DP'ing, having two guys tag team me was **hot**. and seeing my boy make out with my friend was amazing). Any tips and tricks to make it less.... terrifying next time?","&lt;!-- SC_OFF --&gt;&lt;div class=""md""&gt;&lt;p&gt;So, last night I was double penetrated for the first time. And it was amazing. Like.... wow. To be honest yeah, it hurt a bit when we first started going at at. But it felt great afterwards. My boyfriend came pretty fast, but we were able to try again later.&lt;/p&gt;

&lt;p&gt;Now, the thing is I was a little sore yeah, but I didn&amp;#39;t have any major bleeding (there was a little bit on the condoms but barely noticeable). But then today when I went to the bathroom... lets just say there was a lot of red in there. For anyone thats been DP&amp;#39;d, is this normal? I&amp;#39;m gonna go get it checked out regardless, but I just wanna make sure. Plus is it gonna happen everytime? Because I really want to do it again (aside from the DP&amp;#39;ing, having two guys tag team me was &lt;strong&gt;hot&lt;/strong&gt;. and seeing my boy make out with my friend was amazing). Any tips and tricks to make it less.... terrifying next time?&lt;/p&gt;
&lt;/div&gt;&lt;!-- SC_ON --&gt;","False","askgaybros","t5_2vgfw","","","First Time DP (NSFW)","0","http://www.reddit.com/r/askgaybros/comments/2ts8iy/first_time_dp_nsfw/","[]","False"
"26","","","{}","http://www.reddit.com/api/info/","{}","{}","False","","","False","wooeee","","","","False","1422317535.0","1422317535.0","","self.askgaybros","0","False","0","True","False","2ts5l0","True","","","","","","{}","[]","t3_2ts5l0","42","","False","http://www.reddit.com/r/askgaybros/comments/2ts5l0/how_dafuq/","Unauthenticated reddit sesssion","","False","1","","{}","How does anyone meet anyone. I know gay people can go on Grindr; I have a fucking BlackBerry, getting Grindr is almost impossible.

I have BoyAhoy; what a hunk of shit, and Bender; even hunkier piecier of shit.

I'm on realjock.com, I'm on gaydar.net.

Where the fuck is everyone from the Toronto area? Preferably the suburbs.

I'm just really sick of being lonely, and just wanna go on some dates, or fucking something.

So how the hell do you guys get out there? I don't do gaybars sorry, just not my scene.

Better question, how the hell do you guys meet other gay bros?","&lt;!-- SC_OFF --&gt;&lt;div class=""md""&gt;&lt;p&gt;How does anyone meet anyone. I know gay people can go on Grindr; I have a fucking BlackBerry, getting Grindr is almost impossible.&lt;/p&gt;

&lt;p&gt;I have BoyAhoy; what a hunk of shit, and Bender; even hunkier piecier of shit.&lt;/p&gt;

&lt;p&gt;I&amp;#39;m on realjock.com, I&amp;#39;m on gaydar.net.&lt;/p&gt;

&lt;p&gt;Where the fuck is everyone from the Toronto area? Preferably the suburbs.&lt;/p&gt;

&lt;p&gt;I&amp;#39;m just really sick of being lonely, and just wanna go on some dates, or fucking something.&lt;/p&gt;

&lt;p&gt;So how the hell do you guys get out there? I don&amp;#39;t do gaybars sorry, just not my scene.&lt;/p&gt;

&lt;p&gt;Better question, how the hell do you guys meet other gay bros?&lt;/p&gt;
&lt;/div&gt;&lt;!-- SC_ON --&gt;","False","askgaybros","t5_2vgfw","","","HOW DAFUQ?","1","http://www.reddit.com/r/askgaybros/comments/2ts5l0/how_dafuq/","[]","False"
"27","","","{}","http://www.reddit.com/api/info/","{}","{}","False","","","False","secregaythrowawayyyy","","","","False","1422317061.0","1422317061.0","","self.askgaybros","0","False","0","True","False","2ts4mi","True","","","","","","{}","[]","t3_2ts4mi","5","","True","http://www.reddit.com/r/askgaybros/comments/2ts4mi/little_something_ive_been_doing_for_a_while/","Unauthenticated reddit sesssion","","False","0","","{}","Hi Guys,


This is my first post here so bear with me!


I am a 19 year old ""Twink"" that to absolutely everyone in the world is 100% straight, the thing is... I really really like sucking dick. For the past two years i've been using a gay dating app (I won't name names but it has distance based searches) Getting people to pull up near my house, let me jump in suck thier cock and let them cum on me and then I leave.


Am I normal? Does anyone else do this kind of thing at all? The thing is I don't want to stop and I absolutely love it.


Thoughts?","&lt;!-- SC_OFF --&gt;&lt;div class=""md""&gt;&lt;p&gt;Hi Guys,&lt;/p&gt;

&lt;p&gt;This is my first post here so bear with me!&lt;/p&gt;

&lt;p&gt;I am a 19 year old &amp;quot;Twink&amp;quot; that to absolutely everyone in the world is 100% straight, the thing is... I really really like sucking dick. For the past two years i&amp;#39;ve been using a gay dating app (I won&amp;#39;t name names but it has distance based searches) Getting people to pull up near my house, let me jump in suck thier cock and let them cum on me and then I leave.&lt;/p&gt;

&lt;p&gt;Am I normal? Does anyone else do this kind of thing at all? The thing is I don&amp;#39;t want to stop and I absolutely love it.&lt;/p&gt;

&lt;p&gt;Thoughts?&lt;/p&gt;
&lt;/div&gt;&lt;!-- SC_ON --&gt;","False","askgaybros","t5_2vgfw","","","Little something I've been doing for a while.","0","http://www.reddit.com/r/askgaybros/comments/2ts4mi/little_something_ive_been_doing_for_a_while/","[]","False"
"28","","","{}","http://www.reddit.com/api/info/","{}","{}","False","","","False","GodOfTitsAndWine1984","","","","False","1422309441.0","1422309441.0","","self.askgaybros","0","False","0","True","False","2trnpb","True","","","","","","{}","[]","t3_2trnpb","8","","False","http://www.reddit.com/r/askgaybros/comments/2trnpb/finally_about_to_have_my_first_time_experience/","Unauthenticated reddit sesssion","","False","13","","{}","Ok bros, after almost 18 years of suppressing my sexuality I've finally decided to take the plunge and have an experience with another man. 

After lurking in this sub for a few years now and reading countless similar stories, I'm thrilled to finally make a move. I'm still in the closet and not really sure or care about labeling myself. 

When it comes to romantic love I always see myself with a woman but I find the male body just as aesthetically pleasing. Playing with a cock other than my own has been something in the forefront of my mind for a very long time and since I was 13 I aways desired having a best male friend that would let me indulge in those fantasies.

Recently I decided to lerk on Craigslist and try to find someone in a similar situation, I'd browse the personals everyday hoping to find a guy around my age that wanted a fwb. Last week I finally came across that ad and contacted the poster, we hit it off and realized he's into the same things as me. He has a wife that's understands his extracurriculars and does not mind so long as he's safe. We are in the process of setting a meeting and getting down to business. Hopefully we can become good friends and I will finally have that special bud who enjoys naked time, jerking together, 69, and maybe a bit of fucking somewhere down the line. 

I just wanted to share my story as I'm a bit excited about this turn of events, any feed back and advise will be appreciated. Thanks again bros!","&lt;!-- SC_OFF --&gt;&lt;div class=""md""&gt;&lt;p&gt;Ok bros, after almost 18 years of suppressing my sexuality I&amp;#39;ve finally decided to take the plunge and have an experience with another man. &lt;/p&gt;

&lt;p&gt;After lurking in this sub for a few years now and reading countless similar stories, I&amp;#39;m thrilled to finally make a move. I&amp;#39;m still in the closet and not really sure or care about labeling myself. &lt;/p&gt;

&lt;p&gt;When it comes to romantic love I always see myself with a woman but I find the male body just as aesthetically pleasing. Playing with a cock other than my own has been something in the forefront of my mind for a very long time and since I was 13 I aways desired having a best male friend that would let me indulge in those fantasies.&lt;/p&gt;

&lt;p&gt;Recently I decided to lerk on Craigslist and try to find someone in a similar situation, I&amp;#39;d browse the personals everyday hoping to find a guy around my age that wanted a fwb. Last week I finally came across that ad and contacted the poster, we hit it off and realized he&amp;#39;s into the same things as me. He has a wife that&amp;#39;s understands his extracurriculars and does not mind so long as he&amp;#39;s safe. We are in the process of setting a meeting and getting down to business. Hopefully we can become good friends and I will finally have that special bud who enjoys naked time, jerking together, 69, and maybe a bit of fucking somewhere down the line. &lt;/p&gt;

&lt;p&gt;I just wanted to share my story as I&amp;#39;m a bit excited about this turn of events, any feed back and advise will be appreciated. Thanks again bros!&lt;/p&gt;
&lt;/div&gt;&lt;!-- SC_ON --&gt;","False","askgaybros","t5_2vgfw","","","Finally about to have my first time experience with another guy!","13","http://www.reddit.com/r/askgaybros/comments/2trnpb/finally_about_to_have_my_first_time_experience/","[]","False"
"29","","","{}","http://www.reddit.com/api/info/","{}","{}","False","","","False","HaiiiThere","","","","False","1422308761.0","1422308761.0","","self.askgaybros","0","False","0","True","False","2trm6s","True","","","","","","{}","[]","t3_2trm6s","9","","False","http://www.reddit.com/r/askgaybros/comments/2trm6s/bros_who_have_had_experiences_with_straight_guys/","Unauthenticated reddit sesssion","","False","0","","{}","There is this guy I've been talking to on facebook. He says he is straight and I do think so too but he is like into experimenting and is curious about how it would be like to have sex with a guy. He is my type, decent and he wants to try it out with me! I've never had sex or been in a relationship before and I just don't know if I should go along with it? I'm afraid it might be disappointing afterwards and I get into depression and feel like I never wanna have sex again or smth. I'm just confused so any of you who ever had any experience with a straight guy, any lessons learned from the experience? would you do it again?","&lt;!-- SC_OFF --&gt;&lt;div class=""md""&gt;&lt;p&gt;There is this guy I&amp;#39;ve been talking to on facebook. He says he is straight and I do think so too but he is like into experimenting and is curious about how it would be like to have sex with a guy. He is my type, decent and he wants to try it out with me! I&amp;#39;ve never had sex or been in a relationship before and I just don&amp;#39;t know if I should go along with it? I&amp;#39;m afraid it might be disappointing afterwards and I get into depression and feel like I never wanna have sex again or smth. I&amp;#39;m just confused so any of you who ever had any experience with a straight guy, any lessons learned from the experience? would you do it again?&lt;/p&gt;
&lt;/div&gt;&lt;!-- SC_ON --&gt;","False","askgaybros","t5_2vgfw","","","bros who have had experiences with straight guys or guys who claim to be straight, how was it like and did you regret it afterwards?","0","http://www.reddit.com/r/askgaybros/comments/2trm6s/bros_who_have_had_experiences_with_straight_guys/","[]","False"
"30","","","{}","http://www.reddit.com/api/info/","{}","{}","False","","","False","embarce_love","","","","False","1422304300.0","1422304300.0","","self.askgaybros","0","False","0","True","False","2trbhs","True","","","","","","{}","[]","t3_2trbhs","30","","False","http://www.reddit.com/r/askgaybros/comments/2trbhs/is_this_cheating/","Unauthenticated reddit sesssion","","False","3","","{}","So A 20 year old male who is dating a 24 year old male. 
Now let me tell my delema: 
Today while he was in the shower I was going to do something cute ,and change my name on his phone to name with a heart at the end ,but as I pick up his iPad i see some guy named Santiago on his iMessages ,and it caught my eye because it said "" come watch me stroke"" 
Him: ""where"" 
Santiago: "" my house"" 
Him: "" I was thinking FaceTime"" {SideNote he never face times me he says he does not like it} 
Santiago:"" I have to get up ,and get my iPad ,and it to much work""
Him: too bad I wanted to see
Santiago: come over I'll show you
Him: gonna give me a show?
Santiago: sure. 


To top it all off ,and make things more shady he tell me that same day he has a meeting. After work? I'm trying to find out if he went over I haven't send anything yet.... 
Please help. ","&lt;!-- SC_OFF --&gt;&lt;div class=""md""&gt;&lt;p&gt;So A 20 year old male who is dating a 24 year old male. 
Now let me tell my delema: 
Today while he was in the shower I was going to do something cute ,and change my name on his phone to name with a heart at the end ,but as I pick up his iPad i see some guy named Santiago on his iMessages ,and it caught my eye because it said &amp;quot; come watch me stroke&amp;quot; 
Him: &amp;quot;where&amp;quot; 
Santiago: &amp;quot; my house&amp;quot; 
Him: &amp;quot; I was thinking FaceTime&amp;quot; {SideNote he never face times me he says he does not like it} 
Santiago:&amp;quot; I have to get up ,and get my iPad ,and it to much work&amp;quot;
Him: too bad I wanted to see
Santiago: come over I&amp;#39;ll show you
Him: gonna give me a show?
Santiago: sure. &lt;/p&gt;

&lt;p&gt;To top it all off ,and make things more shady he tell me that same day he has a meeting. After work? I&amp;#39;m trying to find out if he went over I haven&amp;#39;t send anything yet.... 
Please help. &lt;/p&gt;
&lt;/div&gt;&lt;!-- SC_ON --&gt;","False","askgaybros","t5_2vgfw","","","Is this cheating?","3","http://www.reddit.com/r/askgaybros/comments/2trbhs/is_this_cheating/","[]","False"
"31","","","{}","http://www.reddit.com/api/info/","{}","{}","False","","","False","James_Sea","","","","False","1422303974.0","1422303974.0","","self.askgaybros","0","False","0","True","False","2trap3","True","","","","","","{}","[]","t3_2trap3","51","","False","http://www.reddit.com/r/askgaybros/comments/2trap3/would_you_reject_somebody_that_is_hiv_ive_dated/","Unauthenticated reddit sesssion","","False","15","","{}","I posted a question earlier but wanted to re-phrase it. Personally the stigma surrounding HIV concerns me, so I wanted to throw this question out there. Many people thought it was necessary to disclosure their status - so if someone does disclose and they're positive, how would you treat this?

My first boyfriend was positive and we dated for over a year. We were very safe and I'm still negative. I dated other guys since who were positive. I feel like as long as you're safe, you're safe. The stigma is far more damaging. ","&lt;!-- SC_OFF --&gt;&lt;div class=""md""&gt;&lt;p&gt;I posted a question earlier but wanted to re-phrase it. Personally the stigma surrounding HIV concerns me, so I wanted to throw this question out there. Many people thought it was necessary to disclosure their status - so if someone does disclose and they&amp;#39;re positive, how would you treat this?&lt;/p&gt;

&lt;p&gt;My first boyfriend was positive and we dated for over a year. We were very safe and I&amp;#39;m still negative. I dated other guys since who were positive. I feel like as long as you&amp;#39;re safe, you&amp;#39;re safe. The stigma is far more damaging. &lt;/p&gt;
&lt;/div&gt;&lt;!-- SC_ON --&gt;","False","askgaybros","t5_2vgfw","","","Would you reject somebody that is HIV+? I’ve dated many positive guys and have never had an issue with somebody's status, but I’m curious about you?","15","http://www.reddit.com/r/askgaybros/comments/2trap3/would_you_reject_somebody_that_is_hiv_ive_dated/","[]","False"
"32","","","{}","http://www.reddit.com/api/info/","{}","{}","False","","","False","jomosexual","","","","False","1422303222.0","1422303222.0","","self.askgaybros","0","False","0","True","False","2tr8yp","True","","","","","","{}","[]","t3_2tr8yp","18","","False","http://www.reddit.com/r/askgaybros/comments/2tr8yp/whats_a_good_valentines_gift_for_25_bucks_on/","Unauthenticated reddit sesssion","","False","1","","{}","I want to get my boyfriend something either dumb and fun or practical.  Thinking around 25 bucks. I'm blanking on this though and all my recommendations on amazon are things he's not into.

Any suggestions would be awesome.","&lt;!-- SC_OFF --&gt;&lt;div class=""md""&gt;&lt;p&gt;I want to get my boyfriend something either dumb and fun or practical.  Thinking around 25 bucks. I&amp;#39;m blanking on this though and all my recommendations on amazon are things he&amp;#39;s not into.&lt;/p&gt;

&lt;p&gt;Any suggestions would be awesome.&lt;/p&gt;
&lt;/div&gt;&lt;!-- SC_ON --&gt;","False","askgaybros","t5_2vgfw","","","What's a good valentine's gift for 25 bucks on amazon?","1","http://www.reddit.com/r/askgaybros/comments/2tr8yp/whats_a_good_valentines_gift_for_25_bucks_on/","[]","False"
"33","","","{}","http://www.reddit.com/api/info/","{}","{}","False","","","False","guyasking","","","","False","1422300459.0","1422300459.0","","self.askgaybros","0","False","0","True","False","2tr2gb","True","","","","","","{}","[]","t3_2tr2gb","15","","False","http://www.reddit.com/r/askgaybros/comments/2tr2gb/the_gay_lisp/","Unauthenticated reddit sesssion","","False","2","","{}","How many of you guys have the S slurr after a words being sad. 

Do anyone of you know how to control that sound to not sound gay?","&lt;!-- SC_OFF --&gt;&lt;div class=""md""&gt;&lt;p&gt;How many of you guys have the S slurr after a words being sad. &lt;/p&gt;

&lt;p&gt;Do anyone of you know how to control that sound to not sound gay?&lt;/p&gt;
&lt;/div&gt;&lt;!-- SC_ON --&gt;","False","askgaybros","t5_2vgfw","","","The gay lisp","2","http://www.reddit.com/r/askgaybros/comments/2tr2gb/the_gay_lisp/","[]","False"
