"","_comment_sort","_comments","_comments_by_id","_info_url","_orphaned","_params","_replaced_more","_underscore_names","approved_by","archived","author","author_flair_css_class","author_flair_text","banned_by","clicked","created","created_utc","distinguished","domain","downs","edited","gilded","has_fetched","hidden","id","is_self","json_dict","likes","link_flair_css_class","link_flair_text","media","media_embed","mod_reports","name","num_comments","num_reports","over_18","permalink","reddit_session","report_reasons","saved","score","secure_media","secure_media_embed","selftext","selftext_html","stickied","subreddit","subreddit_id","suggested_sort","thumbnail","title","ups","url","user_reports","visited"
"0","","","{}","http://www.reddit.com/api/info/","{}","{}","False","","","False","iknighty","","","","False","1418829180.0","1418829180.0","","self.askgaybros","0","False","0","True","False","2pky1l","True","","","","","","{}","[]","t3_2pky1l","76","","False","http://www.reddit.com/r/askgaybros/comments/2pky1l/gay_mutually_unaware_closeted_twins_what_to_do/","Unauthenticated reddit sesssion","","False","42","","{}","Well, this is something special. 
A few months ago this guy talked to me on Grindr with a photo from the internet. After a bit of prodding I got him to tell me who he was (he has a twin that I knew), and it was a guy I already vaguely knew. He tells me no one knows he's gay, that his brother doesn't even know etc. 
He was coming on to me and being sexual, but I wasn't interested so we quickly stopped talking (although he persisted).

Fast forward to yesterday, another guy talks to me. He asks if I'm from a certain town, I say I am. He tells me that I know him and long story short it's the other guy's brother.

Twins who don't know that each other is gay!!

What do I do? Should I illuminate them to save them possibly years of lying to each other? Should I be amused and do nothing?","&lt;!-- SC_OFF --&gt;&lt;div class=""md""&gt;&lt;p&gt;Well, this is something special. 
A few months ago this guy talked to me on Grindr with a photo from the internet. After a bit of prodding I got him to tell me who he was (he has a twin that I knew), and it was a guy I already vaguely knew. He tells me no one knows he&amp;#39;s gay, that his brother doesn&amp;#39;t even know etc. 
He was coming on to me and being sexual, but I wasn&amp;#39;t interested so we quickly stopped talking (although he persisted).&lt;/p&gt;

&lt;p&gt;Fast forward to yesterday, another guy talks to me. He asks if I&amp;#39;m from a certain town, I say I am. He tells me that I know him and long story short it&amp;#39;s the other guy&amp;#39;s brother.&lt;/p&gt;

&lt;p&gt;Twins who don&amp;#39;t know that each other is gay!!&lt;/p&gt;

&lt;p&gt;What do I do? Should I illuminate them to save them possibly years of lying to each other? Should I be amused and do nothing?&lt;/p&gt;
&lt;/div&gt;&lt;!-- SC_ON --&gt;","False","askgaybros","t5_2vgfw","","","Gay (mutually unaware) closeted twins. What to do?","42","http://www.reddit.com/r/askgaybros/comments/2pky1l/gay_mutually_unaware_closeted_twins_what_to_do/","[]","False"
"1","","","{}","http://www.reddit.com/api/info/","{}","{}","False","","","False","ifuckeduprealnice","","","","False","1418811032.0","1418811032.0","","self.askgaybros","0","False","0","True","False","2pkclg","True","","","","","","{}","[]","t3_2pkclg","34","","False","http://www.reddit.com/r/askgaybros/comments/2pkclg/should_i_come_out_of_the_closet/","Unauthenticated reddit sesssion","","False","1","","{}","I know that I'm gay but thus far no one around me knows nor expects it. Personally I'm not a huge fan of being gay and I'd just like to forget it. Nearly everything says coming out is important, but those sources tend to be superliberal and I'm on the opposite side of the political spectrum so I disagree with them a fair bit.

Should I come out or just keep it to myself? I don't want to be with anyone or hook up, so it really isn't going to limit my optipns.","&lt;!-- SC_OFF --&gt;&lt;div class=""md""&gt;&lt;p&gt;I know that I&amp;#39;m gay but thus far no one around me knows nor expects it. Personally I&amp;#39;m not a huge fan of being gay and I&amp;#39;d just like to forget it. Nearly everything says coming out is important, but those sources tend to be superliberal and I&amp;#39;m on the opposite side of the political spectrum so I disagree with them a fair bit.&lt;/p&gt;

&lt;p&gt;Should I come out or just keep it to myself? I don&amp;#39;t want to be with anyone or hook up, so it really isn&amp;#39;t going to limit my optipns.&lt;/p&gt;
&lt;/div&gt;&lt;!-- SC_ON --&gt;","False","askgaybros","t5_2vgfw","","","Should I come out of the closet?","1","http://www.reddit.com/r/askgaybros/comments/2pkclg/should_i_come_out_of_the_closet/","[]","False"
"2","","","{}","http://www.reddit.com/api/info/","{}","{}","False","","","False","renerdrat","","","","False","1418807652.0","1418807652.0","","self.askgaybros","0","False","0","True","False","2pk99m","True","","","","","","{}","[]","t3_2pk99m","28","","False","http://www.reddit.com/r/askgaybros/comments/2pk99m/people_with_blank_profiles_that_message_hi/","Unauthenticated reddit sesssion","","False","29","","{}","That's literally all they'll send.
I don't understand... why? At least start some thought provoking conversation... Hell I'd prefer at least something pretty to look at like a sunset. Even a dick pic would be a better conversation starter","&lt;!-- SC_OFF --&gt;&lt;div class=""md""&gt;&lt;p&gt;That&amp;#39;s literally all they&amp;#39;ll send.
I don&amp;#39;t understand... why? At least start some thought provoking conversation... Hell I&amp;#39;d prefer at least something pretty to look at like a sunset. Even a dick pic would be a better conversation starter&lt;/p&gt;
&lt;/div&gt;&lt;!-- SC_ON --&gt;","False","askgaybros","t5_2vgfw","","","People with blank profiles that message ""hi""","29","http://www.reddit.com/r/askgaybros/comments/2pk99m/people_with_blank_profiles_that_message_hi/","[]","False"
"3","","","{}","http://www.reddit.com/api/info/","{}","{}","False","","","False","hikuukin","","","","False","1418805390.0","1418805390.0","","self.askgaybros","0","False","0","True","False","2pk72n","True","","","","","","{}","[]","t3_2pk72n","11","","False","http://www.reddit.com/r/askgaybros/comments/2pk72n/soooo_heres_the_thing/","Unauthenticated reddit sesssion","","False","2","","{}","I have always stated that I am gay, and can see myself married to a guy in the future. A dog, a yard, house, adopted (or biological) child, etc. HOWEVER, I could also see myself settled down with the 'right woman', with everything listed above.  Yet I still identify as gay. 

I always get weird looks when I tell people this. I can say that there have been a few women that I have developed feelings for, who I can see myself getting married to. As it stands right now, one of them who left for college is coming back to town to visit.

 We've been close friends for a long time. She and I have always joked about getting married, mainly when I jokingly told her, ""I wish you had a penis,"". However, after she left, I felt really lonely. It took me a while to realize that I had developed feelings for her. 

We've kept in contact, and there have been multiple occasions where I wanted to tell her how I feel....but at the same time, I feel too scared to say anything to her. Any advise? ","&lt;!-- SC_OFF --&gt;&lt;div class=""md""&gt;&lt;p&gt;I have always stated that I am gay, and can see myself married to a guy in the future. A dog, a yard, house, adopted (or biological) child, etc. HOWEVER, I could also see myself settled down with the &amp;#39;right woman&amp;#39;, with everything listed above.  Yet I still identify as gay. &lt;/p&gt;

&lt;p&gt;I always get weird looks when I tell people this. I can say that there have been a few women that I have developed feelings for, who I can see myself getting married to. As it stands right now, one of them who left for college is coming back to town to visit.&lt;/p&gt;

&lt;p&gt;We&amp;#39;ve been close friends for a long time. She and I have always joked about getting married, mainly when I jokingly told her, &amp;quot;I wish you had a penis,&amp;quot;. However, after she left, I felt really lonely. It took me a while to realize that I had developed feelings for her. &lt;/p&gt;

&lt;p&gt;We&amp;#39;ve kept in contact, and there have been multiple occasions where I wanted to tell her how I feel....but at the same time, I feel too scared to say anything to her. Any advise? &lt;/p&gt;
&lt;/div&gt;&lt;!-- SC_ON --&gt;","False","askgaybros","t5_2vgfw","","","Soooo here's the thing.....","2","http://www.reddit.com/r/askgaybros/comments/2pk72n/soooo_heres_the_thing/","[]","False"
"4","","","{}","http://www.reddit.com/api/info/","{}","{}","False","","","False","gadget_inspecter","","","","False","1418800906.0","1418800906.0","","self.askgaybros","0","False","0","True","False","2pk2bj","True","","","","","","{}","[]","t3_2pk2bj","10","","False","http://www.reddit.com/r/askgaybros/comments/2pk2bj/any_bros_still_missingwondering_about_a_one_night/","Unauthenticated reddit sesssion","","False","4","","{}","Tell your stories here.

For me I went on a vacation last year and I'm still thinking about the guy I hooked up with while I was there. It hurts to think about him but I'm still glad it happened.","&lt;!-- SC_OFF --&gt;&lt;div class=""md""&gt;&lt;p&gt;Tell your stories here.&lt;/p&gt;

&lt;p&gt;For me I went on a vacation last year and I&amp;#39;m still thinking about the guy I hooked up with while I was there. It hurts to think about him but I&amp;#39;m still glad it happened.&lt;/p&gt;
&lt;/div&gt;&lt;!-- SC_ON --&gt;","False","askgaybros","t5_2vgfw","","","Any bros still missing/wondering about a one night stand?","4","http://www.reddit.com/r/askgaybros/comments/2pk2bj/any_bros_still_missingwondering_about_a_one_night/","[]","False"
"5","","","{}","http://www.reddit.com/api/info/","{}","{}","False","","","False","dudewithoutabeard","","","","False","1418799980.0","1418799980.0","","self.askgaybros","0","False","0","True","False","2pk14j","True","","","","","","{}","[]","t3_2pk14j","3","","False","http://www.reddit.com/r/askgaybros/comments/2pk14j/why_cant_i_do_it/","Unauthenticated reddit sesssion","","False","2","","{}","Here's another post about coming out (sorry in advance for the 10000th one on this subreddit). In May 2012, I realized I was gay, but was part of a community that I didn't felt would accept this. Now, I have different friends and am part of a far more open-minded, generous, tolerant, loving community. I had originally planned to just go from fully closeted to fully public in one fell swoop, but this changed. I first came out to a friend this past August who was totally supportive. In late October, I told another friend who acted the same. I've told about 10 or 15 more people (including my dad and his girlfriend as well as our family therapist, who were all wonderful about it) since then, and they've all acted the same as well. Our friendships have only gotten stronger, if anything, since i told them, and i feel more like myself around them than ever before.

Yet despite this, I just can't bring myself to tell everyone that I want to tell. Why can't I do it? I denied being gay to myself for so long because of my homophobic background, but the friends I've told know the people I want to tell quite well and assure me they'll be fully supportive. Not even all my housemates know because I can't muster the strength to do this. Is it because I was exposed to so much homophobia when I was young and impressionable that I can't shake the shame? Am I afraid of rejection? I know I'm worrying about something of no consequence, yet whenever a moment arises that I could potentially come out, my heartbeat accelerates and I freeze the fuck up. I imagine irrational scenarios of negative reactions, especially from my housemates. I absolutely know that all my friends would support me, but I just can't fucking do it and I need that to change. If you have anything at all to say or do that can help me, please do. But don't just tell me to man up because that isn't the issue and it's just superficial and immature - I'm confident and stoic in all other aspects of my life, just somehow this one thing has me fucking shaking. And I worry it'll affect my job search (I'm young) even though my career field is known to be very accepting, open-minded, and non-discriminatory.

I'm being vague and dodgy in the description of my situation so as not to identify myself, which is in itself a testament of how stupidly unwilling I've been to come out. I imagine better advice would be offered if I were more specific, but fuck me for not truly realizing everything about myself (not just my sexual orientation) until August 2013 (so yeah, even more revelations after admitting to myself that I'm gay). Anyway apologies for the histrionics and the blatantly pathetic nature of this post but thank you for letting me vent and I'd love to hear any advice you have for me.","&lt;!-- SC_OFF --&gt;&lt;div class=""md""&gt;&lt;p&gt;Here&amp;#39;s another post about coming out (sorry in advance for the 10000th one on this subreddit). In May 2012, I realized I was gay, but was part of a community that I didn&amp;#39;t felt would accept this. Now, I have different friends and am part of a far more open-minded, generous, tolerant, loving community. I had originally planned to just go from fully closeted to fully public in one fell swoop, but this changed. I first came out to a friend this past August who was totally supportive. In late October, I told another friend who acted the same. I&amp;#39;ve told about 10 or 15 more people (including my dad and his girlfriend as well as our family therapist, who were all wonderful about it) since then, and they&amp;#39;ve all acted the same as well. Our friendships have only gotten stronger, if anything, since i told them, and i feel more like myself around them than ever before.&lt;/p&gt;

&lt;p&gt;Yet despite this, I just can&amp;#39;t bring myself to tell everyone that I want to tell. Why can&amp;#39;t I do it? I denied being gay to myself for so long because of my homophobic background, but the friends I&amp;#39;ve told know the people I want to tell quite well and assure me they&amp;#39;ll be fully supportive. Not even all my housemates know because I can&amp;#39;t muster the strength to do this. Is it because I was exposed to so much homophobia when I was young and impressionable that I can&amp;#39;t shake the shame? Am I afraid of rejection? I know I&amp;#39;m worrying about something of no consequence, yet whenever a moment arises that I could potentially come out, my heartbeat accelerates and I freeze the fuck up. I imagine irrational scenarios of negative reactions, especially from my housemates. I absolutely know that all my friends would support me, but I just can&amp;#39;t fucking do it and I need that to change. If you have anything at all to say or do that can help me, please do. But don&amp;#39;t just tell me to man up because that isn&amp;#39;t the issue and it&amp;#39;s just superficial and immature - I&amp;#39;m confident and stoic in all other aspects of my life, just somehow this one thing has me fucking shaking. And I worry it&amp;#39;ll affect my job search (I&amp;#39;m young) even though my career field is known to be very accepting, open-minded, and non-discriminatory.&lt;/p&gt;

&lt;p&gt;I&amp;#39;m being vague and dodgy in the description of my situation so as not to identify myself, which is in itself a testament of how stupidly unwilling I&amp;#39;ve been to come out. I imagine better advice would be offered if I were more specific, but fuck me for not truly realizing everything about myself (not just my sexual orientation) until August 2013 (so yeah, even more revelations after admitting to myself that I&amp;#39;m gay). Anyway apologies for the histrionics and the blatantly pathetic nature of this post but thank you for letting me vent and I&amp;#39;d love to hear any advice you have for me.&lt;/p&gt;
&lt;/div&gt;&lt;!-- SC_ON --&gt;","False","askgaybros","t5_2vgfw","","","why can't i do it?","2","http://www.reddit.com/r/askgaybros/comments/2pk14j/why_cant_i_do_it/","[]","False"
"6","","","{}","http://www.reddit.com/api/info/","{}","{}","False","","","False","youarejustanasshole","","","","False","1418796400.0","1418796400.0","","self.askgaybros","0","False","0","True","False","2pjwev","True","","","","","","{}","[]","t3_2pjwev","19","","False","http://www.reddit.com/r/askgaybros/comments/2pjwev/am_i_doing_something_wrong_on_grindr/","Unauthenticated reddit sesssion","","False","0","","{}","Don't worry, not a cliche/ad libbed post.

[This](http://i.imgur.com/bA3Rcqs.jpg) is the picture I am trying to make as my main profile picture. It keeps getting rejected.

[This](http://i.imgur.com/g9UHfZB.png), is another dudes already approved picture.

There are also numerous profiles with copious amounts of dudes in speedos with, as grindr puts it, ""tenting"" going on. I'm not hard, wearing black underwear so contours are impossible to see... I am at a loss

Am I crazy or is there a grindr admin who hates me? I am at a loss as to what the deal is as to why I can't upload mine, unless its a hipster mod who needs a filter on it.","&lt;!-- SC_OFF --&gt;&lt;div class=""md""&gt;&lt;p&gt;Don&amp;#39;t worry, not a cliche/ad libbed post.&lt;/p&gt;

&lt;p&gt;&lt;a href=""http://i.imgur.com/bA3Rcqs.jpg""&gt;This&lt;/a&gt; is the picture I am trying to make as my main profile picture. It keeps getting rejected.&lt;/p&gt;

&lt;p&gt;&lt;a href=""http://i.imgur.com/g9UHfZB.png""&gt;This&lt;/a&gt;, is another dudes already approved picture.&lt;/p&gt;

&lt;p&gt;There are also numerous profiles with copious amounts of dudes in speedos with, as grindr puts it, &amp;quot;tenting&amp;quot; going on. I&amp;#39;m not hard, wearing black underwear so contours are impossible to see... I am at a loss&lt;/p&gt;

&lt;p&gt;Am I crazy or is there a grindr admin who hates me? I am at a loss as to what the deal is as to why I can&amp;#39;t upload mine, unless its a hipster mod who needs a filter on it.&lt;/p&gt;
&lt;/div&gt;&lt;!-- SC_ON --&gt;","False","askgaybros","t5_2vgfw","","","Am I doing something wrong (on grindr)","0","http://www.reddit.com/r/askgaybros/comments/2pjwev/am_i_doing_something_wrong_on_grindr/","[]","False"
"7","","","{}","http://www.reddit.com/api/info/","{}","{}","False","","","False","hostoc","","","","False","1418795792.0","1418795792.0","","self.askgaybros","0","False","0","True","False","2pjvk8","True","","","","","","{}","[]","t3_2pjvk8","13","","False","http://www.reddit.com/r/askgaybros/comments/2pjvk8/have_you_ever_successfully_won_back_a_guy_after/","Unauthenticated reddit sesssion","","False","5","","{}","","","False","askgaybros","t5_2vgfw","","","Have you ever successfully won back a guy after being dumped?","5","http://www.reddit.com/r/askgaybros/comments/2pjvk8/have_you_ever_successfully_won_back_a_guy_after/","[]","False"
"8","","","{}","http://www.reddit.com/api/info/","{}","{}","False","","","False","Stephen_Extrem","","","","False","1418792448.0","1418792448.0","","self.askgaybros","0","False","0","True","False","2pjqgb","True","","","","","","{}","[]","t3_2pjqgb","14","","False","http://www.reddit.com/r/askgaybros/comments/2pjqgb/good_friend_wont_take_me_seriously_when_i_try_to/","Unauthenticated reddit sesssion","","False","11","","{}","So recently I've been having this problem with my best friend. I've tried to come out to him recently by texting him and saying that I needed to tell him something really personal that I wanted him to keep secret. He replied by basically saying don't tell me. Ever since then he's started using the word gay as a way to call things dumb. More than he did before also whenever I try to just talk to him he just ignores it and acts all goofy and tries to be funny when it's just starting to get annoying what should I do?","&lt;!-- SC_OFF --&gt;&lt;div class=""md""&gt;&lt;p&gt;So recently I&amp;#39;ve been having this problem with my best friend. I&amp;#39;ve tried to come out to him recently by texting him and saying that I needed to tell him something really personal that I wanted him to keep secret. He replied by basically saying don&amp;#39;t tell me. Ever since then he&amp;#39;s started using the word gay as a way to call things dumb. More than he did before also whenever I try to just talk to him he just ignores it and acts all goofy and tries to be funny when it&amp;#39;s just starting to get annoying what should I do?&lt;/p&gt;
&lt;/div&gt;&lt;!-- SC_ON --&gt;","False","askgaybros","t5_2vgfw","","","Good friend won't take me seriously when I try to be real with him.","11","http://www.reddit.com/r/askgaybros/comments/2pjqgb/good_friend_wont_take_me_seriously_when_i_try_to/","[]","False"
"9","","","{}","http://www.reddit.com/api/info/","{}","{}","False","","","False","safab","","","","False","1418789812.0","1418789812.0","","self.askgaybros","0","False","0","True","False","2pjm5t","True","","","","","","{}","[]","t3_2pjm5t","25","","False","http://www.reddit.com/r/askgaybros/comments/2pjm5t/my_new_partner_has_a_kid/","Unauthenticated reddit sesssion","","False","16","","{}","Hi all,

I'm seeing someone new and just few hours ago he told me on the phone that he was married and he has a child. He explained why he got married and stuff, he got married because he couldn't come out as a gay man and kind of forced to marry a girl to escape his abusive father. Then he told me that he didn't like his wife and she didn't like him either, he said before they separated in the last year of their marriage he found out she was pregnant. 

All I did while he explained this on the phone is saying ""yes, ok"". Then he said he understands if I don't wanna continue the thing we have, and how sorry he is not telling me early. I said ok I'll have to go now. Then I hung up.

Now I don't know how to feel, I'm genuinely shocked. I like what's going on between us and I like the guy very much. At the same time, I don't know how to feel since now I know he has a child. He told me that even though he pays everything for the child and takes care of him, he feels like he is not his father because of how that marriage happened (kind of forced) 

Any advice? Should I even continue talking to him? ","&lt;!-- SC_OFF --&gt;&lt;div class=""md""&gt;&lt;p&gt;Hi all,&lt;/p&gt;

&lt;p&gt;I&amp;#39;m seeing someone new and just few hours ago he told me on the phone that he was married and he has a child. He explained why he got married and stuff, he got married because he couldn&amp;#39;t come out as a gay man and kind of forced to marry a girl to escape his abusive father. Then he told me that he didn&amp;#39;t like his wife and she didn&amp;#39;t like him either, he said before they separated in the last year of their marriage he found out she was pregnant. &lt;/p&gt;

&lt;p&gt;All I did while he explained this on the phone is saying &amp;quot;yes, ok&amp;quot;. Then he said he understands if I don&amp;#39;t wanna continue the thing we have, and how sorry he is not telling me early. I said ok I&amp;#39;ll have to go now. Then I hung up.&lt;/p&gt;

&lt;p&gt;Now I don&amp;#39;t know how to feel, I&amp;#39;m genuinely shocked. I like what&amp;#39;s going on between us and I like the guy very much. At the same time, I don&amp;#39;t know how to feel since now I know he has a child. He told me that even though he pays everything for the child and takes care of him, he feels like he is not his father because of how that marriage happened (kind of forced) &lt;/p&gt;

&lt;p&gt;Any advice? Should I even continue talking to him? &lt;/p&gt;
&lt;/div&gt;&lt;!-- SC_ON --&gt;","False","askgaybros","t5_2vgfw","","","My new partner has a kid!?","16","http://www.reddit.com/r/askgaybros/comments/2pjm5t/my_new_partner_has_a_kid/","[]","False"
"10","","","{}","http://www.reddit.com/api/info/","{}","{}","False","","","False","COMPUTER_FREAK","","","","False","1418781905.0","1418781905.0","","self.askgaybros","0","False","0","True","False","2pj835","True","","","","","","{}","[]","t3_2pj835","7","","False","http://www.reddit.com/r/askgaybros/comments/2pj835/what_were_some_troubles_you_faced_as_a_kid_coming/","Unauthenticated reddit sesssion","","False","1","","{}","I have heard that some kids had very unsupportive parents that kicked them out of their houses. I have also heard that many kids have bad bullying stories that ended up to suicide or self harm. Did you face any troubles as a kid? I didn't because I grew up in a LGBT friednly enviroment.","&lt;!-- SC_OFF --&gt;&lt;div class=""md""&gt;&lt;p&gt;I have heard that some kids had very unsupportive parents that kicked them out of their houses. I have also heard that many kids have bad bullying stories that ended up to suicide or self harm. Did you face any troubles as a kid? I didn&amp;#39;t because I grew up in a LGBT friednly enviroment.&lt;/p&gt;
&lt;/div&gt;&lt;!-- SC_ON --&gt;","False","askgaybros","t5_2vgfw","","","What were some troubles you faced as a kid coming out?","1","http://www.reddit.com/r/askgaybros/comments/2pj835/what_were_some_troubles_you_faced_as_a_kid_coming/","[]","False"
