"","_comment_sort","_comments","_comments_by_id","_info_url","_orphaned","_params","_replaced_more","_underscore_names","approved_by","archived","author","author_flair_css_class","author_flair_text","banned_by","clicked","created","created_utc","distinguished","domain","downs","edited","gilded","has_fetched","hidden","id","is_self","json_dict","likes","link_flair_css_class","link_flair_text","media","media_embed","mod_reports","name","num_comments","num_reports","over_18","permalink","reddit_session","report_reasons","saved","score","secure_media","secure_media_embed","selftext","selftext_html","stickied","subreddit","subreddit_id","suggested_sort","thumbnail","title","ups","url","user_reports","visited"
"8","","","{}","http://www.reddit.com/api/info/","{}","{}","False","","","True","not_a_throwaway18","","","","False","1407645239.0","1407641639.0","","self.askgaybros","0","False","0","True","False","2d4cxk","True","","","","","","{}","[]","t3_2d4cxk","10","","False","http://www.reddit.com/r/askgaybros/comments/2d4cxk/my_boyfriend_is_a_major_flirt/","Unauthenticated reddit sesssion","","False","12","","{}","So, very recently, my boyfriend has made it aware to myself (openly admitted it) that he is ""a big flirt"".  Meaning, he goes out and talks to other guys (usually instagram, facebook, snapchat, with other *gay* guys)

We've been FWB for about 4 years and dating the last 3 months (we're both going to be rooming together at university).

Back to the problem, he ""flirts with anything that moves"".  How do I deal with this/make it stop?  

The most recent example, tonight, he accidentally sent a smiling snapchat of himself to me with some message, obviously not meant for me, as he was very mad at me tonight.  He was mad because I was the only one that did not send him a sweet morning text and that mine was immediately asking him to do something.  So because he was mad at me, he was snapchatting happily with other men.

Often this flirting is a result of the two of us having a dispute of some sort and I believe he uses it as a getaway.  He absolves himself among other men, while I remain completely loyal to him.  

But in general, the flirting is non-stop.  Even when we're together he is texting/snapchatting an ex-boyfriend as well as several random men.  A few of them are local to us.  

What should I do?","&lt;!-- SC_OFF --&gt;&lt;div class=""md""&gt;&lt;p&gt;So, very recently, my boyfriend has made it aware to myself (openly admitted it) that he is &amp;quot;a big flirt&amp;quot;.  Meaning, he goes out and talks to other guys (usually instagram, facebook, snapchat, with other &lt;em&gt;gay&lt;/em&gt; guys)&lt;/p&gt;

&lt;p&gt;We&amp;#39;ve been FWB for about 4 years and dating the last 3 months (we&amp;#39;re both going to be rooming together at university).&lt;/p&gt;

&lt;p&gt;Back to the problem, he &amp;quot;flirts with anything that moves&amp;quot;.  How do I deal with this/make it stop?  &lt;/p&gt;

&lt;p&gt;The most recent example, tonight, he accidentally sent a smiling snapchat of himself to me with some message, obviously not meant for me, as he was very mad at me tonight.  He was mad because I was the only one that did not send him a sweet morning text and that mine was immediately asking him to do something.  So because he was mad at me, he was snapchatting happily with other men.&lt;/p&gt;

&lt;p&gt;Often this flirting is a result of the two of us having a dispute of some sort and I believe he uses it as a getaway.  He absolves himself among other men, while I remain completely loyal to him.  &lt;/p&gt;

&lt;p&gt;But in general, the flirting is non-stop.  Even when we&amp;#39;re together he is texting/snapchatting an ex-boyfriend as well as several random men.  A few of them are local to us.  &lt;/p&gt;

&lt;p&gt;What should I do?&lt;/p&gt;
&lt;/div&gt;&lt;!-- SC_ON --&gt;","False","askgaybros","t5_2vgfw","","","My boyfriend is a major flirt","12","http://www.reddit.com/r/askgaybros/comments/2d4cxk/my_boyfriend_is_a_major_flirt/","[]","False"
"9","","","{}","http://www.reddit.com/api/info/","{}","{}","False","","","True","tlk13","","","","False","1407644508.0","1407640908.0","","self.askgaybros","0","False","0","True","False","2d4byv","True","","","","","","{}","[]","t3_2d4byv","19","","False","http://www.reddit.com/r/askgaybros/comments/2d4byv/anyone_have_any_experience_with_hiv_rna_testing/","Unauthenticated reddit sesssion","","False","2","","{}","I guess I'm a bit anxious and don't want to wait for the few months the typical test takes. I found this site that says I can get tested close to my house for about $200. Besides price, are there any disadvantages? Wondering why more people don't do this.","&lt;!-- SC_OFF --&gt;&lt;div class=""md""&gt;&lt;p&gt;I guess I&amp;#39;m a bit anxious and don&amp;#39;t want to wait for the few months the typical test takes. I found this site that says I can get tested close to my house for about $200. Besides price, are there any disadvantages? Wondering why more people don&amp;#39;t do this.&lt;/p&gt;
&lt;/div&gt;&lt;!-- SC_ON --&gt;","False","askgaybros","t5_2vgfw","","","Anyone have any experience with HIV rna testing?","2","http://www.reddit.com/r/askgaybros/comments/2d4byv/anyone_have_any_experience_with_hiv_rna_testing/","[]","False"
"10","","","{}","http://www.reddit.com/api/info/","{}","{}","False","","","True","fluffyfatsheep","","","","False","1407644340.0","1407640740.0","","self.askgaybros","0","1407713398.0","0","True","False","2d4bqc","True","","","","","","{}","[]","t3_2d4bqc","17","","False","http://www.reddit.com/r/askgaybros/comments/2d4bqc/in_your_eyes_does_having_oral_sex_mean_youve_lost/","Unauthenticated reddit sesssion","","False","1","","{}","I started talking to two guys on a hook-up app about a week ago. Told them both I'm a virgin. Guy **A** lives farther away, Guy *B* and I met up and went out. Stuff happened. We agreed to let that be it. After talking more to him these past few days, I made a very strong connection with Guy **A**, who still holds the belief that I'm a virgin. 

My question is; am I still a virgin? I feel like one, mostly because the thing with Guy *B* wasn't what I believe to be ""full-on sex"". I intend to be honest with Guy **A** because I think it's the real deal, I just want to be prepared and have an idea as to what his reaction might be.

**EDIT**: I told him, he didn't mind at all.","&lt;!-- SC_OFF --&gt;&lt;div class=""md""&gt;&lt;p&gt;I started talking to two guys on a hook-up app about a week ago. Told them both I&amp;#39;m a virgin. Guy &lt;strong&gt;A&lt;/strong&gt; lives farther away, Guy &lt;em&gt;B&lt;/em&gt; and I met up and went out. Stuff happened. We agreed to let that be it. After talking more to him these past few days, I made a very strong connection with Guy &lt;strong&gt;A&lt;/strong&gt;, who still holds the belief that I&amp;#39;m a virgin. &lt;/p&gt;

&lt;p&gt;My question is; am I still a virgin? I feel like one, mostly because the thing with Guy &lt;em&gt;B&lt;/em&gt; wasn&amp;#39;t what I believe to be &amp;quot;full-on sex&amp;quot;. I intend to be honest with Guy &lt;strong&gt;A&lt;/strong&gt; because I think it&amp;#39;s the real deal, I just want to be prepared and have an idea as to what his reaction might be.&lt;/p&gt;

&lt;p&gt;&lt;strong&gt;EDIT&lt;/strong&gt;: I told him, he didn&amp;#39;t mind at all.&lt;/p&gt;
&lt;/div&gt;&lt;!-- SC_ON --&gt;","False","askgaybros","t5_2vgfw","","","In your eyes, does having oral sex mean you've lost your virginity?","1","http://www.reddit.com/r/askgaybros/comments/2d4bqc/in_your_eyes_does_having_oral_sex_mean_youve_lost/","[]","False"
"11","","","{}","http://www.reddit.com/api/info/","{}","{}","False","","","True","a-wild-throwaway","","","","False","1407643700.0","1407640100.0","","i.imgur.com","0","False","0","True","False","2d4awx","False","","","","","","{}","[]","t3_2d4awx","5","","False","http://www.reddit.com/r/askgaybros/comments/2d4awx/first_time_posing_on_the_web_be_gentle/","Unauthenticated reddit sesssion","","False","0","","{}","","","False","askgaybros","t5_2vgfw","","","First time posing on the web, be gentle.","0","http://i.imgur.com/ucl83Wg.jpg","[]","False"
"12","","","{}","http://www.reddit.com/api/info/","{}","{}","False","","","True","blacksheep15","","","","False","1407641176.0","1407637576.0","","self.askgaybros","0","False","0","True","False","2d47n2","True","","","","","","{}","[]","t3_2d47n2","2","","False","http://www.reddit.com/r/askgaybros/comments/2d47n2/advice_on_how_to_break_the_cycle_and_meet_other/","Unauthenticated reddit sesssion","","False","2","","{}","I just found this sub, so this may be an ignorant post that is thrown up here every few weeks. My apologies if it is.  I don't use reddit very often, but if you click on my name you'll see my only other post was a wishey washey diatribe about being in love with my straight best friend.  I reread it tonight and cringed.  Who is that sad indecisive kid?  Since then I have changed a lot and have become more confident with who I am(not completely confident though, I'll explain).   

In my last post, I still thought i was Bi.  After sleeping with several girls last year and hating it, I can confidently say that I am gay.  However, I had still never been with a man and had no gay friends (this was still in college).  So like any curious, horny gay man, I turned to Grindr.  I hooked up once.  Nothing huge, just hand and mouth stuff.  I felt so disgusting afterwords that I vowed never to use the damn thing again.  I'm too STD paranoid, and to be honest kind of a prude.  Don't get me wrong though, in the moment I was digging it. It's the sexual experience I replay in my mind all the time.

Here's the problem.  I left college, moved to a new city with a new job (woo hoo!!).  I was excited to meet new people and find a new friend group, hopefully some new gay friends that could ease me into this new world.  That didn't end up being the case.  I found myself slinking back to my old ways and hanging out with straight guys and women(mostly other new hires I worked with).  Everyone assumes I'm straight and I never feel the need to come out to them.  I feel like (especially with straight guys) it ruins the relationship to come out.  Once you do, in most of my experiences, the relationship changes in some way(usually negative).  This is especially true with friends that I have recently met, they naturally become more standoffish and the friendship suffers or is broken.  The other reason, I don't is because I hate the gay stereotype.  I don't' want to be fierce and go shopping with you.  Most flamboyant people in general, turn me off (not just gay).  That may sound ignorant and it probably is.  I like hanging out with masculine guys. I get along best with ""bros"" but at the end of the day, I want to sleep with them as well.  I keep falling into the same cycle of becoming great friends with fun guys (and gals) that I love hanging out with but never being able to take it any further.  Life is made for two and I'm tired of coming home to an empty apartment.

Any advice for meeting other gaybros?  Do you find that it's easier to come out to some of your straight friends? I know what your going to say right, ""they're not really your friends if they can't accept you the way you are"" but that's kind of bullshit.  I've always heard the saying that guys and girls cant ""just be friends."" Someone allays develops feelings.  I found that to be true with me and my straight friends (literally all my friends are straight).  But if I tell them how I feel or how I am, they will treat me differently.  These people who I love hanging out with will now feel awkward sitting next to me when we're both drunk.  I know this is a progressive world and that may not be the case with some people, but it's definitely a minority.  If you had the same situation where two straight single people were drunk and alone (a guy and girl), I feel like someone will try and make a move, especially if they know each other well.  I think this is why my relationships with straight guys gets awkward when I come out, they think i'm going to try to make a move.  They also see me differently, and I'm no longer the guy they call when they have an extra ticket to a ballgame.  Idk, maybe i'm ignorant and don't have enough trust in my relationships with people.  

I hate Grindr, I hate gay clubs/bars.  How do I break the cycle of falling in love with straight friends and then getting wildly frustrated when I know they will never be able to take a relationship to the next level.  How do I meet gaybros?

Any advice is helpful.  If you read this thank you!  It feels good just to get all my frustrations down.

TLDR;  As a bro, how do you fall out of the same cycle of meeting straight bros and not being able to take it to the next level? How do I meet gaybros?","&lt;!-- SC_OFF --&gt;&lt;div class=""md""&gt;&lt;p&gt;I just found this sub, so this may be an ignorant post that is thrown up here every few weeks. My apologies if it is.  I don&amp;#39;t use reddit very often, but if you click on my name you&amp;#39;ll see my only other post was a wishey washey diatribe about being in love with my straight best friend.  I reread it tonight and cringed.  Who is that sad indecisive kid?  Since then I have changed a lot and have become more confident with who I am(not completely confident though, I&amp;#39;ll explain).   &lt;/p&gt;

&lt;p&gt;In my last post, I still thought i was Bi.  After sleeping with several girls last year and hating it, I can confidently say that I am gay.  However, I had still never been with a man and had no gay friends (this was still in college).  So like any curious, horny gay man, I turned to Grindr.  I hooked up once.  Nothing huge, just hand and mouth stuff.  I felt so disgusting afterwords that I vowed never to use the damn thing again.  I&amp;#39;m too STD paranoid, and to be honest kind of a prude.  Don&amp;#39;t get me wrong though, in the moment I was digging it. It&amp;#39;s the sexual experience I replay in my mind all the time.&lt;/p&gt;

&lt;p&gt;Here&amp;#39;s the problem.  I left college, moved to a new city with a new job (woo hoo!!).  I was excited to meet new people and find a new friend group, hopefully some new gay friends that could ease me into this new world.  That didn&amp;#39;t end up being the case.  I found myself slinking back to my old ways and hanging out with straight guys and women(mostly other new hires I worked with).  Everyone assumes I&amp;#39;m straight and I never feel the need to come out to them.  I feel like (especially with straight guys) it ruins the relationship to come out.  Once you do, in most of my experiences, the relationship changes in some way(usually negative).  This is especially true with friends that I have recently met, they naturally become more standoffish and the friendship suffers or is broken.  The other reason, I don&amp;#39;t is because I hate the gay stereotype.  I don&amp;#39;t&amp;#39; want to be fierce and go shopping with you.  Most flamboyant people in general, turn me off (not just gay).  That may sound ignorant and it probably is.  I like hanging out with masculine guys. I get along best with &amp;quot;bros&amp;quot; but at the end of the day, I want to sleep with them as well.  I keep falling into the same cycle of becoming great friends with fun guys (and gals) that I love hanging out with but never being able to take it any further.  Life is made for two and I&amp;#39;m tired of coming home to an empty apartment.&lt;/p&gt;

&lt;p&gt;Any advice for meeting other gaybros?  Do you find that it&amp;#39;s easier to come out to some of your straight friends? I know what your going to say right, &amp;quot;they&amp;#39;re not really your friends if they can&amp;#39;t accept you the way you are&amp;quot; but that&amp;#39;s kind of bullshit.  I&amp;#39;ve always heard the saying that guys and girls cant &amp;quot;just be friends.&amp;quot; Someone allays develops feelings.  I found that to be true with me and my straight friends (literally all my friends are straight).  But if I tell them how I feel or how I am, they will treat me differently.  These people who I love hanging out with will now feel awkward sitting next to me when we&amp;#39;re both drunk.  I know this is a progressive world and that may not be the case with some people, but it&amp;#39;s definitely a minority.  If you had the same situation where two straight single people were drunk and alone (a guy and girl), I feel like someone will try and make a move, especially if they know each other well.  I think this is why my relationships with straight guys gets awkward when I come out, they think i&amp;#39;m going to try to make a move.  They also see me differently, and I&amp;#39;m no longer the guy they call when they have an extra ticket to a ballgame.  Idk, maybe i&amp;#39;m ignorant and don&amp;#39;t have enough trust in my relationships with people.  &lt;/p&gt;

&lt;p&gt;I hate Grindr, I hate gay clubs/bars.  How do I break the cycle of falling in love with straight friends and then getting wildly frustrated when I know they will never be able to take a relationship to the next level.  How do I meet gaybros?&lt;/p&gt;

&lt;p&gt;Any advice is helpful.  If you read this thank you!  It feels good just to get all my frustrations down.&lt;/p&gt;

&lt;p&gt;TLDR;  As a bro, how do you fall out of the same cycle of meeting straight bros and not being able to take it to the next level? How do I meet gaybros?&lt;/p&gt;
&lt;/div&gt;&lt;!-- SC_ON --&gt;","False","askgaybros","t5_2vgfw","","","Advice on how to break the cycle and meet other gaybros","2","http://www.reddit.com/r/askgaybros/comments/2d47n2/advice_on_how_to_break_the_cycle_and_meet_other/","[]","False"
"13","","","{}","http://www.reddit.com/api/info/","{}","{}","False","","","True","umpteenth_","","","","False","1407639920.0","1407636320.0","","self.askgaybros","0","False","0","True","False","2d460l","True","","","","","","{}","[]","t3_2d460l","9","","False","http://www.reddit.com/r/askgaybros/comments/2d460l/anyone_notice_how_sometimes_straight_men_will_do/","Unauthenticated reddit sesssion","","False","7","","{}","So I was getting groceries at Walmart today, and this beautiful man was shopping with his girlfriend. They stopped in front of the frozen dinners and his girlfriend was getting something from the freezer while he stayed with the cart. 

Anyway, he ended up leaning on the cart so that his ass was sticking out, and he *began to shake his ass.* In full view of anyone who would walk by, this guy stuck out his ass and began shaking it. He had a nice ass too. I found myself staring for too long and simply walked away.

So guys, have you ever seen a straight guy doing something that you found sexual, and he had no clue? Stories?","&lt;!-- SC_OFF --&gt;&lt;div class=""md""&gt;&lt;p&gt;So I was getting groceries at Walmart today, and this beautiful man was shopping with his girlfriend. They stopped in front of the frozen dinners and his girlfriend was getting something from the freezer while he stayed with the cart. &lt;/p&gt;

&lt;p&gt;Anyway, he ended up leaning on the cart so that his ass was sticking out, and he &lt;em&gt;began to shake his ass.&lt;/em&gt; In full view of anyone who would walk by, this guy stuck out his ass and began shaking it. He had a nice ass too. I found myself staring for too long and simply walked away.&lt;/p&gt;

&lt;p&gt;So guys, have you ever seen a straight guy doing something that you found sexual, and he had no clue? Stories?&lt;/p&gt;
&lt;/div&gt;&lt;!-- SC_ON --&gt;","False","askgaybros","t5_2vgfw","","","Anyone notice how sometimes straight men will do the most unconsciously sexual things?","7","http://www.reddit.com/r/askgaybros/comments/2d460l/anyone_notice_how_sometimes_straight_men_will_do/","[]","False"
