"","_comment_sort","_comments","_comments_by_id","_info_url","_orphaned","_params","_replaced_more","_underscore_names","approved_by","archived","author","author_flair_css_class","author_flair_text","banned_by","clicked","created","created_utc","distinguished","domain","downs","edited","gilded","has_fetched","hidden","id","is_self","json_dict","likes","link_flair_css_class","link_flair_text","media","media_embed","mod_reports","name","num_comments","num_reports","over_18","permalink","reddit_session","report_reasons","saved","score","secure_media","secure_media_embed","selftext","selftext_html","stickied","subreddit","subreddit_id","suggested_sort","thumbnail","title","ups","url","user_reports","visited"
"12","","","{}","http://www.reddit.com/api/info/","{}","{}","False","","","False","AnotherThrowawayBoi","","","","False","1415608379.0","1415608379.0","","self.askgaybros","0","1415614842.0","0","True","False","2ludlz","True","","","","","","{}","[]","t3_2ludlz","67","","False","http://www.reddit.com/r/askgaybros/comments/2ludlz/real_talk_what_does_everyone_think_of_trans_guys/","Unauthenticated reddit sesssion","","False","20","","{}","Okay, let me preface this by saying: Yes I'm being a pussy (no pun intended) by hiding behind a throwaway account. This is just an incredibly sensitive topic for trans people, and I feel like even asking this is breaking some sort of weird code. I don't need backlash.

I'm FTM. Pre-op, pre-everything but T right now because of a chronic illness. When you're worried about life threatening things, dysphoria really takes a back seat. But once I've got my life somewhat more stable, I plan on transitioning fully. However with bottom surgery right now I'm not sure how comfortable I feel seeing as how over 90% of the pictures I've seen I'm not happy with, method wise. :/

I'm rambling, sorry. I guess my question is...how do gay guys feel about FTM trans guys? Be honest with me. It's the reason I got a throwaway. I don't want to be fooling myself. I know I'm in the minority here but I'm a pretty chill guy, and I'd rather someone be honest and say ""Yeah, I'd probably be looking at you like a woman, despite the beard and chest hair."" I know it's highly subjective and that not every gay guy is of the same mind, so if you've got stories that aren't your own or things you've been witness to, please feel free to share too.

I'm fine with bottoming, topping, love anal, giving or receiving, so sexual positioning isn't an issue for me, and if I trust that the guy isn't just a ""tranny chaser"" I'm fine with PIV sex too, and I've been told by guys its different from your usual PIV sex because, well, I've got a mini dick too! ;) So...if you're being honest, does trans genitalia turn you off to the point that it doesn't matter what the trans guy is like? Or is it something that wouldn't be that big of an issue as long as you're into the guy himself? Most trans guys just look like guys, but we've got some different genitalia down there. Not exactly female, and not exactly male. (On the off chance you guys haven't seen trans male parts, check out /r/FTMPorn for some decently classy ""dick pics"".)

Note: Please try and stay classy. Ideally I'd love for this to be something questioning trans guys can stumble on and be able to read honest, unvarnished opinions. If you say ""Hey man, I really don't dig trans guys, sorry"", please give the reason why, and I'll still respect you in the morning, I promise.

Edit: Ugh I can't believe I used ""real talk"" in my title. Gag. Mentally change that to ""Be honest"" please. Also, if you're uncomfortable being brutally honest on your regular account, make a throwaway. Stay respectful please, but I'd rather someone answer than have silence. This subreddit is full of cool guys though, I'm asking you all for a reason! ;)","&lt;!-- SC_OFF --&gt;&lt;div class=""md""&gt;&lt;p&gt;Okay, let me preface this by saying: Yes I&amp;#39;m being a pussy (no pun intended) by hiding behind a throwaway account. This is just an incredibly sensitive topic for trans people, and I feel like even asking this is breaking some sort of weird code. I don&amp;#39;t need backlash.&lt;/p&gt;

&lt;p&gt;I&amp;#39;m FTM. Pre-op, pre-everything but T right now because of a chronic illness. When you&amp;#39;re worried about life threatening things, dysphoria really takes a back seat. But once I&amp;#39;ve got my life somewhat more stable, I plan on transitioning fully. However with bottom surgery right now I&amp;#39;m not sure how comfortable I feel seeing as how over 90% of the pictures I&amp;#39;ve seen I&amp;#39;m not happy with, method wise. :/&lt;/p&gt;

&lt;p&gt;I&amp;#39;m rambling, sorry. I guess my question is...how do gay guys feel about FTM trans guys? Be honest with me. It&amp;#39;s the reason I got a throwaway. I don&amp;#39;t want to be fooling myself. I know I&amp;#39;m in the minority here but I&amp;#39;m a pretty chill guy, and I&amp;#39;d rather someone be honest and say &amp;quot;Yeah, I&amp;#39;d probably be looking at you like a woman, despite the beard and chest hair.&amp;quot; I know it&amp;#39;s highly subjective and that not every gay guy is of the same mind, so if you&amp;#39;ve got stories that aren&amp;#39;t your own or things you&amp;#39;ve been witness to, please feel free to share too.&lt;/p&gt;

&lt;p&gt;I&amp;#39;m fine with bottoming, topping, love anal, giving or receiving, so sexual positioning isn&amp;#39;t an issue for me, and if I trust that the guy isn&amp;#39;t just a &amp;quot;tranny chaser&amp;quot; I&amp;#39;m fine with PIV sex too, and I&amp;#39;ve been told by guys its different from your usual PIV sex because, well, I&amp;#39;ve got a mini dick too! ;) So...if you&amp;#39;re being honest, does trans genitalia turn you off to the point that it doesn&amp;#39;t matter what the trans guy is like? Or is it something that wouldn&amp;#39;t be that big of an issue as long as you&amp;#39;re into the guy himself? Most trans guys just look like guys, but we&amp;#39;ve got some different genitalia down there. Not exactly female, and not exactly male. (On the off chance you guys haven&amp;#39;t seen trans male parts, check out &lt;a href=""/r/FTMPorn""&gt;/r/FTMPorn&lt;/a&gt; for some decently classy &amp;quot;dick pics&amp;quot;.)&lt;/p&gt;

&lt;p&gt;Note: Please try and stay classy. Ideally I&amp;#39;d love for this to be something questioning trans guys can stumble on and be able to read honest, unvarnished opinions. If you say &amp;quot;Hey man, I really don&amp;#39;t dig trans guys, sorry&amp;quot;, please give the reason why, and I&amp;#39;ll still respect you in the morning, I promise.&lt;/p&gt;

&lt;p&gt;Edit: Ugh I can&amp;#39;t believe I used &amp;quot;real talk&amp;quot; in my title. Gag. Mentally change that to &amp;quot;Be honest&amp;quot; please. Also, if you&amp;#39;re uncomfortable being brutally honest on your regular account, make a throwaway. Stay respectful please, but I&amp;#39;d rather someone answer than have silence. This subreddit is full of cool guys though, I&amp;#39;m asking you all for a reason! ;)&lt;/p&gt;
&lt;/div&gt;&lt;!-- SC_ON --&gt;","False","askgaybros","t5_2vgfw","","","Real talk, what does everyone think of trans guys?","20","http://www.reddit.com/r/askgaybros/comments/2ludlz/real_talk_what_does_everyone_think_of_trans_guys/","[]","False"
"13","","","{}","http://www.reddit.com/api/info/","{}","{}","False","","","False","foxko","","","","False","1415607062.0","1415607062.0","","self.askgaybros","0","False","0","True","False","2lucek","True","","","","","","{}","[]","t3_2lucek","10","","False","http://www.reddit.com/r/askgaybros/comments/2lucek/what_can_we_do_to_help_our_russian_brotherssisters/","Unauthenticated reddit sesssion","","False","4","","{}","Wow, I am shocked, sickened an appalled, I am also ashamed of myself. How could I have not known just how bad it really is?!
The Russian government has left gates wide open for abuse on the gay community and refuses to help those who have suffered from ""activist groups"" that shame, victimize, demonize, beat and torture other humans because of their sexuality. I want to know what I can do to help. If anyone has any information on something a single person can do to help stop this please inform me. We cannot allow this to continue! 
 ","&lt;!-- SC_OFF --&gt;&lt;div class=""md""&gt;&lt;p&gt;Wow, I am shocked, sickened an appalled, I am also ashamed of myself. How could I have not known just how bad it really is?!
The Russian government has left gates wide open for abuse on the gay community and refuses to help those who have suffered from &amp;quot;activist groups&amp;quot; that shame, victimize, demonize, beat and torture other humans because of their sexuality. I want to know what I can do to help. If anyone has any information on something a single person can do to help stop this please inform me. We cannot allow this to continue! &lt;/p&gt;
&lt;/div&gt;&lt;!-- SC_ON --&gt;","False","askgaybros","t5_2vgfw","","","What can we do to help our Russian Brothers/Sisters?","4","http://www.reddit.com/r/askgaybros/comments/2lucek/what_can_we_do_to_help_our_russian_brotherssisters/","[]","False"
"14","","","{}","http://www.reddit.com/api/info/","{}","{}","False","","","False","ryau27","","","","False","1415604831.0","1415604831.0","","self.askgaybros","0","False","0","True","False","2lua4k","True","","","","","","{}","[]","t3_2lua4k","11","","False","http://www.reddit.com/r/askgaybros/comments/2lua4k/that_moment_of_realization_when_you_havent_yet/","Unauthenticated reddit sesssion","","False","6","","{}","Question I've been contemplating: ""How will I know I've found the one for me?""

And the answer, at least for me, is that a guy will be perfect for me when I can no longer control my smiles around him. When I smile, all my nervousness and anxiety quite literally melts away. The search does not end until this happens to me, considering I am a typically reserved person around people I'm unfamiliar with.

What other ways do you realize you've found someone special?","&lt;!-- SC_OFF --&gt;&lt;div class=""md""&gt;&lt;p&gt;Question I&amp;#39;ve been contemplating: &amp;quot;How will I know I&amp;#39;ve found the one for me?&amp;quot;&lt;/p&gt;

&lt;p&gt;And the answer, at least for me, is that a guy will be perfect for me when I can no longer control my smiles around him. When I smile, all my nervousness and anxiety quite literally melts away. The search does not end until this happens to me, considering I am a typically reserved person around people I&amp;#39;m unfamiliar with.&lt;/p&gt;

&lt;p&gt;What other ways do you realize you&amp;#39;ve found someone special?&lt;/p&gt;
&lt;/div&gt;&lt;!-- SC_ON --&gt;","False","askgaybros","t5_2vgfw","","","That moment of realization when you haven't yet found the one, but know exactly what it will be like","6","http://www.reddit.com/r/askgaybros/comments/2lua4k/that_moment_of_realization_when_you_havent_yet/","[]","False"
