"","_comment_sort","_comments","_comments_by_id","_info_url","_orphaned","_params","_replaced_more","_underscore_names","approved_by","archived","author","author_flair_css_class","author_flair_text","banned_by","clicked","created","created_utc","distinguished","domain","downs","edited","gilded","has_fetched","hidden","id","is_self","json_dict","likes","link_flair_css_class","link_flair_text","media","media_embed","mod_reports","name","num_comments","num_reports","over_18","permalink","reddit_session","report_reasons","saved","score","secure_media","secure_media_embed","selftext","selftext_html","stickied","subreddit","subreddit_id","suggested_sort","thumbnail","title","ups","url","user_reports","visited"
"23","","","{}","http://www.reddit.com/api/info/","{}","{}","False","","","False","nosexzone_throwawayy","","","","False","1428103747.0","1428100147.0","","self.askgaybros","0","False","0","True","False","31d0h1","True","","","","","","{}","[]","t3_31d0h1","10","","False","http://www.reddit.com/r/askgaybros/comments/31d0h1/i_dont_like_sex_and_im_scared_that_means_ill_be/","Unauthenticated reddit sesssion","","False","22","","{}","I just needed to vent I guess. Or ask some advice I suppose. 

I'm just not interested in sex. I'm 23 years old, I've had many sexual partners and tried many *many* different things. I've tried topping and bottoming, neither of which are fun for me at all. I like sucking dick alright but I've never been able to cum from receiving oral sex. I've tried almost every kinky fetish you can think of and still, I just... don't like sex that much. It's more of a chore than a pleasure. I'd rather jerk off 1000% of the time, and even that only happens occasionally. I *know* that I'm gay, because, well, I've always known that. I find men very attractive, and get sexually aroused by them, but when it comes to doing the sex I'd rather do almost anything else. I've dated two men and my lack of sexual drive was a huge turnoff to both of them, they both accused me of cheating on them since I'd never really care to have sex, and I'd try to explain that I just don't care about sex only to be met with ""at your age? please!"" (they were both in their thirties) and it just always seems to create a problem.

I am (or at least I feel) very ready to just settle down with someone. That's all I want, is to just be able to come home after working 8-10 hour days and relax with my best friend and our dog, maybe cuddle up to a movie and have dinner, then go to bed and cuddle and that's it. And it just really bums me out because (especially in the gay community) sex is such a major thing, and I feel like I'm the only person who is like this. It's made me very depressed this past year and brought me to the brink of doing something stupid a couple times, but thankfully I have a great group of friends who have always been there to help and support me. It's just really really hard, going to sleep every night and just wanting someone to lay with and talk to, it makes me cry a lot because I just feel like it's going to always be this way.

Can anybody offer some advice about this subject? I don't even know what particular advice I'm seeking, maybe how to ramp up my sexual drive? Or how to meet a person who doesn't like sex?","&lt;!-- SC_OFF --&gt;&lt;div class=""md""&gt;&lt;p&gt;I just needed to vent I guess. Or ask some advice I suppose. &lt;/p&gt;

&lt;p&gt;I&amp;#39;m just not interested in sex. I&amp;#39;m 23 years old, I&amp;#39;ve had many sexual partners and tried many &lt;em&gt;many&lt;/em&gt; different things. I&amp;#39;ve tried topping and bottoming, neither of which are fun for me at all. I like sucking dick alright but I&amp;#39;ve never been able to cum from receiving oral sex. I&amp;#39;ve tried almost every kinky fetish you can think of and still, I just... don&amp;#39;t like sex that much. It&amp;#39;s more of a chore than a pleasure. I&amp;#39;d rather jerk off 1000% of the time, and even that only happens occasionally. I &lt;em&gt;know&lt;/em&gt; that I&amp;#39;m gay, because, well, I&amp;#39;ve always known that. I find men very attractive, and get sexually aroused by them, but when it comes to doing the sex I&amp;#39;d rather do almost anything else. I&amp;#39;ve dated two men and my lack of sexual drive was a huge turnoff to both of them, they both accused me of cheating on them since I&amp;#39;d never really care to have sex, and I&amp;#39;d try to explain that I just don&amp;#39;t care about sex only to be met with &amp;quot;at your age? please!&amp;quot; (they were both in their thirties) and it just always seems to create a problem.&lt;/p&gt;

&lt;p&gt;I am (or at least I feel) very ready to just settle down with someone. That&amp;#39;s all I want, is to just be able to come home after working 8-10 hour days and relax with my best friend and our dog, maybe cuddle up to a movie and have dinner, then go to bed and cuddle and that&amp;#39;s it. And it just really bums me out because (especially in the gay community) sex is such a major thing, and I feel like I&amp;#39;m the only person who is like this. It&amp;#39;s made me very depressed this past year and brought me to the brink of doing something stupid a couple times, but thankfully I have a great group of friends who have always been there to help and support me. It&amp;#39;s just really really hard, going to sleep every night and just wanting someone to lay with and talk to, it makes me cry a lot because I just feel like it&amp;#39;s going to always be this way.&lt;/p&gt;

&lt;p&gt;Can anybody offer some advice about this subject? I don&amp;#39;t even know what particular advice I&amp;#39;m seeking, maybe how to ramp up my sexual drive? Or how to meet a person who doesn&amp;#39;t like sex?&lt;/p&gt;
&lt;/div&gt;&lt;!-- SC_ON --&gt;","False","askgaybros","t5_2vgfw","","","I don't like sex and I'm scared that means I'll be alone forever :(","22","http://www.reddit.com/r/askgaybros/comments/31d0h1/i_dont_like_sex_and_im_scared_that_means_ill_be/","[]","False"
"24","","","{}","http://www.reddit.com/api/info/","{}","{}","False","","","False","ness1215","","","","False","1428103703.0","1428100103.0","","self.askgaybros","0","False","0","True","False","31d0ef","True","","","","","","{}","[]","t3_31d0ef","92","","False","http://www.reddit.com/r/askgaybros/comments/31d0ef/youre_not_that_gay/","Unauthenticated reddit sesssion","","False","59","","{}","So a couple of days ago I met a guy while I was working. I was on register and we kept giving each other the whole ""I think you're cute"" look. I built up the courage and asked him if I could sit while I was on my break. We talked and exchanged numbers. So...he asked me out and we hung out. Getting to know each other. Funny enough, we brought up interests and other stuff. Music, shows, etc. He was kinda a quintessential gay type from where I'm from (Miami). Talking about how much he loves ""Queen Bey""'s music and mentioned he watches Drag Race. But I saw other qualities I liked. He liked gaming and was pretty active. So when I pretty much admitted I don't care for pop music and was more interested in following college football than some drag show he seemed a bit annoyed. ""Oh you're one of 'those gays'. You're pretty much not really even gay"". I felt a bit shocked. So because I don't go clubbing and don't really care about pop culture I'm somehow ""less gay""? It really turned me off. :/

anyone have a similar experience? ","&lt;!-- SC_OFF --&gt;&lt;div class=""md""&gt;&lt;p&gt;So a couple of days ago I met a guy while I was working. I was on register and we kept giving each other the whole &amp;quot;I think you&amp;#39;re cute&amp;quot; look. I built up the courage and asked him if I could sit while I was on my break. We talked and exchanged numbers. So...he asked me out and we hung out. Getting to know each other. Funny enough, we brought up interests and other stuff. Music, shows, etc. He was kinda a quintessential gay type from where I&amp;#39;m from (Miami). Talking about how much he loves &amp;quot;Queen Bey&amp;quot;&amp;#39;s music and mentioned he watches Drag Race. But I saw other qualities I liked. He liked gaming and was pretty active. So when I pretty much admitted I don&amp;#39;t care for pop music and was more interested in following college football than some drag show he seemed a bit annoyed. &amp;quot;Oh you&amp;#39;re one of &amp;#39;those gays&amp;#39;. You&amp;#39;re pretty much not really even gay&amp;quot;. I felt a bit shocked. So because I don&amp;#39;t go clubbing and don&amp;#39;t really care about pop culture I&amp;#39;m somehow &amp;quot;less gay&amp;quot;? It really turned me off. :/&lt;/p&gt;

&lt;p&gt;anyone have a similar experience? &lt;/p&gt;
&lt;/div&gt;&lt;!-- SC_ON --&gt;","False","askgaybros","t5_2vgfw","","","""Youre not that gay""","59","http://www.reddit.com/r/askgaybros/comments/31d0ef/youre_not_that_gay/","[]","False"
"25","","","{}","http://www.reddit.com/api/info/","{}","{}","False","","","False","averroes86","","","","False","1428100726.0","1428097126.0","","self.askgaybros","0","False","0","True","False","31cueb","True","","","","","","{}","[]","t3_31cueb","2","","False","http://www.reddit.com/r/askgaybros/comments/31cueb/update_progress_in_our_relationship_but_still_not/","Unauthenticated reddit sesssion","","False","2","","{}","I am the type of person that is really rational and reasonable. I try my best to stick to logic - still of course I am an emotional person. Also, it takes me a while to listen to my instincts, yet somehow, they manage to guide me, for better or worse. Like many, I've made mistakes.

Anyway, I wanted to give an update on my relationship (note that I've posted twice, [one under this account](http://www.reddit.com/r/askgaybros/comments/2zbshf/am_i_a_younger_version_of_a_sugar_daddy/) and [another under my 'other' account](http://www.reddit.com/r/relationships/comments/2y87kp/am_i_28_m_being_coldhearted_and_harsh_with/) - I don't know if it's normal to have 2 accounts?). 

So my partner finally did manage to line up a couple of small-time gigs that are getting him some money - he is working rather hard, almost 6 days a week and up to 12 hours! So that's great. He is happy and energetic but also a bit tired because he wants to work in his field (he cannot until he gets work authorization). We agreed once he makes up to a $1,000, he can start contributing financially. He is being quite well paid. Which is great news, really.

I found a job and will start soon. I am taking a pay cut for work that I've done in my previous position but I really cannot complain. I'm just happy and grateful that I will work soon!

I don't want to be one of those people who are never content and never happy (and maybe I am becoming one of those people). But I just am not feeling it. I don't feel that things on a personal level have improved between us. Although I feel I've become a lot calmer and more chill. It's worth mentioning that now I am doing all house duties - and it made me realize two things:

A) That this is really easy. I've done so much today so far and can do far more!

B) I feel like he is purposefully not doing anything and creating more mess for me to clean up. I could be paranoid but I am beginning to sense a bit of vengefulness. This could all be in my head and maybe I need to change my perception?


I feel generally that things have improved, which is great. I feel more relieved, more at peace, more calm, etc. Hence I will not take any action and instead will just observe. I want to sort reach a level where I am a bystander in my own relationship and become totally objective. To just take it one day at a time...

What do you guys think; of this progress? Of this new 'revelation' for me? And what's your personal take on things as well, bystanders!
","&lt;!-- SC_OFF --&gt;&lt;div class=""md""&gt;&lt;p&gt;I am the type of person that is really rational and reasonable. I try my best to stick to logic - still of course I am an emotional person. Also, it takes me a while to listen to my instincts, yet somehow, they manage to guide me, for better or worse. Like many, I&amp;#39;ve made mistakes.&lt;/p&gt;

&lt;p&gt;Anyway, I wanted to give an update on my relationship (note that I&amp;#39;ve posted twice, &lt;a href=""http://www.reddit.com/r/askgaybros/comments/2zbshf/am_i_a_younger_version_of_a_sugar_daddy/""&gt;one under this account&lt;/a&gt; and &lt;a href=""http://www.reddit.com/r/relationships/comments/2y87kp/am_i_28_m_being_coldhearted_and_harsh_with/""&gt;another under my &amp;#39;other&amp;#39; account&lt;/a&gt; - I don&amp;#39;t know if it&amp;#39;s normal to have 2 accounts?). &lt;/p&gt;

&lt;p&gt;So my partner finally did manage to line up a couple of small-time gigs that are getting him some money - he is working rather hard, almost 6 days a week and up to 12 hours! So that&amp;#39;s great. He is happy and energetic but also a bit tired because he wants to work in his field (he cannot until he gets work authorization). We agreed once he makes up to a $1,000, he can start contributing financially. He is being quite well paid. Which is great news, really.&lt;/p&gt;

&lt;p&gt;I found a job and will start soon. I am taking a pay cut for work that I&amp;#39;ve done in my previous position but I really cannot complain. I&amp;#39;m just happy and grateful that I will work soon!&lt;/p&gt;

&lt;p&gt;I don&amp;#39;t want to be one of those people who are never content and never happy (and maybe I am becoming one of those people). But I just am not feeling it. I don&amp;#39;t feel that things on a personal level have improved between us. Although I feel I&amp;#39;ve become a lot calmer and more chill. It&amp;#39;s worth mentioning that now I am doing all house duties - and it made me realize two things:&lt;/p&gt;

&lt;p&gt;A) That this is really easy. I&amp;#39;ve done so much today so far and can do far more!&lt;/p&gt;

&lt;p&gt;B) I feel like he is purposefully not doing anything and creating more mess for me to clean up. I could be paranoid but I am beginning to sense a bit of vengefulness. This could all be in my head and maybe I need to change my perception?&lt;/p&gt;

&lt;p&gt;I feel generally that things have improved, which is great. I feel more relieved, more at peace, more calm, etc. Hence I will not take any action and instead will just observe. I want to sort reach a level where I am a bystander in my own relationship and become totally objective. To just take it one day at a time...&lt;/p&gt;

&lt;p&gt;What do you guys think; of this progress? Of this new &amp;#39;revelation&amp;#39; for me? And what&amp;#39;s your personal take on things as well, bystanders!&lt;/p&gt;
&lt;/div&gt;&lt;!-- SC_ON --&gt;","False","askgaybros","t5_2vgfw","","","[UPDATE] Progress in our relationship, but still not feeling it 100%...","2","http://www.reddit.com/r/askgaybros/comments/31cueb/update_progress_in_our_relationship_but_still_not/","[]","False"
"26","","","{}","http://www.reddit.com/api/info/","{}","{}","False","","","False","nutryder","","","","False","1428098326.0","1428094726.0","","self.askgaybros","0","False","0","True","False","31cpa2","True","","","","","","{}","[]","t3_31cpa2","10","","False","http://www.reddit.com/r/askgaybros/comments/31cpa2/why_am_i_not_into_being_naked_with_my_guy/","Unauthenticated reddit sesssion","","False","2","","{}","Hello gaybros! I love reading your posts everyday, I love the helping community here as well, so now (once again) I turn to you with my problem.

My guy (cannot call him my boyfriend yet I guess.) and I, we are both 20 yrs old,  have known each other for a month now. We met at PlanetRomeo (which is REALLY weird I know..I gave one last chance to that ""hooker"" site...and a miracle happened), and he is everything I have ever wanted, looks, personality...really everything. We had many meetings, romantic dinner, walks, picnic, museum, movie night, sleepover (without any sexy time), sleepover (with sexy time) and so on. I think we are over the get-to-know phase but of course I don't think we need to ""declare"" or ""officiate"" our relationships, we just click so well...we both know that. We are alike in a lot of things, but in one thing we are VERY different. I am very fast in attaching to people, developing feelings, he on the other hand is not, and he has hard time talking about feelings. He is more of a physical type..at least that is what he shows himself to be, I have doubts about that cause he seems to be an emotional person as well, just, as I have mentioned, he is still a bit afraid of showing them I guess.

Anyway, my problem is that in my whole gay life, my relationships never worked because of one thing. I was never into the naked time. I always felt it...porn-ish. I did no feel intimate when we were naked. I like sweet things, small things, kisses, even petting. but nakedness...I have tried almost everything, never had anal sex tho because I was...I guess I still am...afraid of it a little bit and looking for the right person. Still I am just not feeling comfortable being naked...yet (?). I told him about this and he thinks that it is because he was bad in sex...we did most of the stuff besides anal, it felt good physically, just...inside I felt like I am in a porn movie and it did not have that ""OMG"" factor...he is the first guy tho who made me cum with his hands on my dick....it never happened with any other guy cause I just wasn't into it, so I guess it takes time (?) ...I don't know..but I do not want to lose him because I am weird and not into naked time that much..is this really this big of a problem after month? I think he understands it just it is hard for him too. We really like each other and we really want this to work. A few days ago he said that he started feeling something he had never felt before towards any guy (I know, clich much..but still...he totally blushed so I think it was genuine). Any thoughts on my ""anti-sex"" personality? Can I change? Should I change? Could this still work out? Gimme all you've got!","&lt;!-- SC_OFF --&gt;&lt;div class=""md""&gt;&lt;p&gt;Hello gaybros! I love reading your posts everyday, I love the helping community here as well, so now (once again) I turn to you with my problem.&lt;/p&gt;

&lt;p&gt;My guy (cannot call him my boyfriend yet I guess.) and I, we are both 20 yrs old,  have known each other for a month now. We met at PlanetRomeo (which is REALLY weird I know..I gave one last chance to that &amp;quot;hooker&amp;quot; site...and a miracle happened), and he is everything I have ever wanted, looks, personality...really everything. We had many meetings, romantic dinner, walks, picnic, museum, movie night, sleepover (without any sexy time), sleepover (with sexy time) and so on. I think we are over the get-to-know phase but of course I don&amp;#39;t think we need to &amp;quot;declare&amp;quot; or &amp;quot;officiate&amp;quot; our relationships, we just click so well...we both know that. We are alike in a lot of things, but in one thing we are VERY different. I am very fast in attaching to people, developing feelings, he on the other hand is not, and he has hard time talking about feelings. He is more of a physical type..at least that is what he shows himself to be, I have doubts about that cause he seems to be an emotional person as well, just, as I have mentioned, he is still a bit afraid of showing them I guess.&lt;/p&gt;

&lt;p&gt;Anyway, my problem is that in my whole gay life, my relationships never worked because of one thing. I was never into the naked time. I always felt it...porn-ish. I did no feel intimate when we were naked. I like sweet things, small things, kisses, even petting. but nakedness...I have tried almost everything, never had anal sex tho because I was...I guess I still am...afraid of it a little bit and looking for the right person. Still I am just not feeling comfortable being naked...yet (?). I told him about this and he thinks that it is because he was bad in sex...we did most of the stuff besides anal, it felt good physically, just...inside I felt like I am in a porn movie and it did not have that &amp;quot;OMG&amp;quot; factor...he is the first guy tho who made me cum with his hands on my dick....it never happened with any other guy cause I just wasn&amp;#39;t into it, so I guess it takes time (?) ...I don&amp;#39;t know..but I do not want to lose him because I am weird and not into naked time that much..is this really this big of a problem after month? I think he understands it just it is hard for him too. We really like each other and we really want this to work. A few days ago he said that he started feeling something he had never felt before towards any guy (I know, clich much..but still...he totally blushed so I think it was genuine). Any thoughts on my &amp;quot;anti-sex&amp;quot; personality? Can I change? Should I change? Could this still work out? Gimme all you&amp;#39;ve got!&lt;/p&gt;
&lt;/div&gt;&lt;!-- SC_ON --&gt;","False","askgaybros","t5_2vgfw","","","Why am I not into being naked with my guy?","2","http://www.reddit.com/r/askgaybros/comments/31cpa2/why_am_i_not_into_being_naked_with_my_guy/","[]","False"
"27","","","{}","http://www.reddit.com/api/info/","{}","{}","False","","","False","notur_bae","","","","False","1428094575.0","1428090975.0","","self.askgaybros","0","False","0","True","False","31cgzf","True","","","","","","{}","[]","t3_31cgzf","22","","False","http://www.reddit.com/r/askgaybros/comments/31cgzf/does_this_seem_like_a_weird_first_date_to_you_guys/","Unauthenticated reddit sesssion","","False","22","","{}","*WARNING I'M KINDA JUST RAMBLING AND TRYING TO MAKE SENSE OF THIS* 

So this evening I went out on a date with a guy that I'd met on tinder. We'd been talking for about a week and had planned to go out this Saturday but the other day he text me saying that he double booked and wanted to reschedule so we decided on this evening. Met him at the restaurant at the time we agreed on and he greeted me with a hug. We then got seated at our table and ordered our drinks and our food, and proceeded to get to know one another. When the bill came he offered to pay for the entire meal, I then tried to offer to pay but he wouldn't let me but then it tuned out that he was short a couple pounds so I paid for the rest. 

Then we left the restaurant and he said something about needing to get home so I offered to drive him home. (at this point I assumed he wasn't into me as he was wanting to go so soon) 

So we pull up outside his place and say our goodbyes and then out of nowhere he full on kisses me and we're not talking a pack on the cheek. This took me completely by surprise as I was sure he wasn't into me. He then said that he'd love to go out again and he'd speak to me sometime soon. 

I guess this entire evening has left me feeling confused as he seemed like the perfect gentleman but the whole thing was over within less than 2 hours. Is this normal for a first date? Because all the first dates I've been on before have been much longer than this one.  ","&lt;!-- SC_OFF --&gt;&lt;div class=""md""&gt;&lt;p&gt;&lt;em&gt;WARNING I&amp;#39;M KINDA JUST RAMBLING AND TRYING TO MAKE SENSE OF THIS&lt;/em&gt; &lt;/p&gt;

&lt;p&gt;So this evening I went out on a date with a guy that I&amp;#39;d met on tinder. We&amp;#39;d been talking for about a week and had planned to go out this Saturday but the other day he text me saying that he double booked and wanted to reschedule so we decided on this evening. Met him at the restaurant at the time we agreed on and he greeted me with a hug. We then got seated at our table and ordered our drinks and our food, and proceeded to get to know one another. When the bill came he offered to pay for the entire meal, I then tried to offer to pay but he wouldn&amp;#39;t let me but then it tuned out that he was short a couple pounds so I paid for the rest. &lt;/p&gt;

&lt;p&gt;Then we left the restaurant and he said something about needing to get home so I offered to drive him home. (at this point I assumed he wasn&amp;#39;t into me as he was wanting to go so soon) &lt;/p&gt;

&lt;p&gt;So we pull up outside his place and say our goodbyes and then out of nowhere he full on kisses me and we&amp;#39;re not talking a pack on the cheek. This took me completely by surprise as I was sure he wasn&amp;#39;t into me. He then said that he&amp;#39;d love to go out again and he&amp;#39;d speak to me sometime soon. &lt;/p&gt;

&lt;p&gt;I guess this entire evening has left me feeling confused as he seemed like the perfect gentleman but the whole thing was over within less than 2 hours. Is this normal for a first date? Because all the first dates I&amp;#39;ve been on before have been much longer than this one.  &lt;/p&gt;
&lt;/div&gt;&lt;!-- SC_ON --&gt;","False","askgaybros","t5_2vgfw","","","Does this seem like a weird first date to you guys?","22","http://www.reddit.com/r/askgaybros/comments/31cgzf/does_this_seem_like_a_weird_first_date_to_you_guys/","[]","False"
