"","_comment_sort","_comments","_comments_by_id","_info_url","_orphaned","_params","_replaced_more","_underscore_names","approved_by","archived","author","author_flair_css_class","author_flair_text","banned_by","clicked","created","created_utc","distinguished","domain","downs","edited","gilded","has_fetched","hidden","id","is_self","json_dict","likes","link_flair_css_class","link_flair_text","media","media_embed","mod_reports","name","num_comments","num_reports","over_18","permalink","reddit_session","report_reasons","saved","score","secure_media","secure_media_embed","selftext","selftext_html","stickied","subreddit","subreddit_id","suggested_sort","thumbnail","title","ups","url","user_reports","visited"
"14","","","{}","http://www.reddit.com/api/info/","{}","{}","False","","","True","pissedbro","","","","False","1407631260.0","1407627660.0","","self.askgaybros","0","False","0","True","False","2d3uvy","True","","","","","","{}","[]","t3_2d3uvy","15","","False","http://www.reddit.com/r/askgaybros/comments/2d3uvy/is_my_fetish_weird/","Unauthenticated reddit sesssion","","False","10","","{}","And I hate to sound conceited, but my career is based on my looks. I do runway for big names (haven't done much print work yet...sadly, houses have only booked me for shows...so if anyone wants to see some shots of me and can help...PM me...). I work out 6 days a week, all of that jazz. But I'm hapa (half white and half Asian). Only on grindr will men instantly block me after sending a pic or they will make a comment (I've actually straight up been told ""no rice"" hundreds of times). So...other than grindr I can get laid simply by being seen somewhere lol. I don't even need to say anything.  
  
And, okay, we all have our ""thing"", so here's mine. Call me a weirdo, but my fetish or whatever is being the more attractive one in a pairing, preferably I will go for 4/5s. Well, what most people will call 4/5s because to me they are hot. I've dated other men in the industry and some of the guys are sweet and intelligent, but many are shallow and quite dim. And honestly most of the male models are straight despite what is believed, so I don't have many options lol. So 9 times out of 10 I'm going for unattractive men. The guys always treat me so well and actually appreciate me. They treat me like I'm a human being instead of just another model and the unhotties seem to be, on average, more interested in education and being a good person. It's a generalization, but it's based on my experience. What gets me off is showing men who don't usually get to be with a guy like me that I want him and need him...I want a guy to feel special and sexy because I know how the world can make someone feel so ugly and undesired. That gets me off.  
  
But does it mean I'm weird or conceited to think this way? I told a friend and he actually got mad at me, saying I'm conceited for believing I'm so good that I'm a godsend to men like this. But honestly even though I know I'm attractive, it's more about the fact that I'm making someone else's fantasies and dreams come true, and then add in the fact that most of the hot men I meet are douchebags...  
  
I guess the best way to describe my fetish is that I get off on making guys feel lucky...ugh, I feel conceited writing this, but that's how I feel haha. What do you think? Is my friend right?  
  
Last week I was actually at a club dancing with this guy. A little taller than me, but he's definitely nerdy looking. Glasses. Balding. Chubby/not fit. Lanky. I'm dancing with him and some muscle queen comes near us and is all over me. I go ""sorry, I'm with him"" while I point to the nerdy guy I'm dancing with. He scoffs and goes ""yeah, he's definitely paying for that shit if he's with a hottie like you...I don't want some nasty hooker anyway"" (I was drunk, so I'm paraphrasing lol). He walks away and nerdy guy is clearly looking insecure at this point. I put my mouth near his ear and tell him ""hey, he's not the one who's gonna be pounding my tight ass later tonight"". Nerdy guy looks better now...we dance...and he takes me to his place and we fuck all night. He actually was the first to make me cum hands-free. I even got his number hehe so hopefully it becomes a thing...  
  
But yeah...what do you bros think?","&lt;!-- SC_OFF --&gt;&lt;div class=""md""&gt;&lt;p&gt;And I hate to sound conceited, but my career is based on my looks. I do runway for big names (haven&amp;#39;t done much print work yet...sadly, houses have only booked me for shows...so if anyone wants to see some shots of me and can help...PM me...). I work out 6 days a week, all of that jazz. But I&amp;#39;m hapa (half white and half Asian). Only on grindr will men instantly block me after sending a pic or they will make a comment (I&amp;#39;ve actually straight up been told &amp;quot;no rice&amp;quot; hundreds of times). So...other than grindr I can get laid simply by being seen somewhere lol. I don&amp;#39;t even need to say anything.  &lt;/p&gt;

&lt;p&gt;And, okay, we all have our &amp;quot;thing&amp;quot;, so here&amp;#39;s mine. Call me a weirdo, but my fetish or whatever is being the more attractive one in a pairing, preferably I will go for 4/5s. Well, what most people will call 4/5s because to me they are hot. I&amp;#39;ve dated other men in the industry and some of the guys are sweet and intelligent, but many are shallow and quite dim. And honestly most of the male models are straight despite what is believed, so I don&amp;#39;t have many options lol. So 9 times out of 10 I&amp;#39;m going for unattractive men. The guys always treat me so well and actually appreciate me. They treat me like I&amp;#39;m a human being instead of just another model and the unhotties seem to be, on average, more interested in education and being a good person. It&amp;#39;s a generalization, but it&amp;#39;s based on my experience. What gets me off is showing men who don&amp;#39;t usually get to be with a guy like me that I want him and need him...I want a guy to feel special and sexy because I know how the world can make someone feel so ugly and undesired. That gets me off.  &lt;/p&gt;

&lt;p&gt;But does it mean I&amp;#39;m weird or conceited to think this way? I told a friend and he actually got mad at me, saying I&amp;#39;m conceited for believing I&amp;#39;m so good that I&amp;#39;m a godsend to men like this. But honestly even though I know I&amp;#39;m attractive, it&amp;#39;s more about the fact that I&amp;#39;m making someone else&amp;#39;s fantasies and dreams come true, and then add in the fact that most of the hot men I meet are douchebags...  &lt;/p&gt;

&lt;p&gt;I guess the best way to describe my fetish is that I get off on making guys feel lucky...ugh, I feel conceited writing this, but that&amp;#39;s how I feel haha. What do you think? Is my friend right?  &lt;/p&gt;

&lt;p&gt;Last week I was actually at a club dancing with this guy. A little taller than me, but he&amp;#39;s definitely nerdy looking. Glasses. Balding. Chubby/not fit. Lanky. I&amp;#39;m dancing with him and some muscle queen comes near us and is all over me. I go &amp;quot;sorry, I&amp;#39;m with him&amp;quot; while I point to the nerdy guy I&amp;#39;m dancing with. He scoffs and goes &amp;quot;yeah, he&amp;#39;s definitely paying for that shit if he&amp;#39;s with a hottie like you...I don&amp;#39;t want some nasty hooker anyway&amp;quot; (I was drunk, so I&amp;#39;m paraphrasing lol). He walks away and nerdy guy is clearly looking insecure at this point. I put my mouth near his ear and tell him &amp;quot;hey, he&amp;#39;s not the one who&amp;#39;s gonna be pounding my tight ass later tonight&amp;quot;. Nerdy guy looks better now...we dance...and he takes me to his place and we fuck all night. He actually was the first to make me cum hands-free. I even got his number hehe so hopefully it becomes a thing...  &lt;/p&gt;

&lt;p&gt;But yeah...what do you bros think?&lt;/p&gt;
&lt;/div&gt;&lt;!-- SC_ON --&gt;","False","askgaybros","t5_2vgfw","","","Is my ""fetish"" weird?","10","http://www.reddit.com/r/askgaybros/comments/2d3uvy/is_my_fetish_weird/","[]","False"
"15","","","{}","http://www.reddit.com/api/info/","{}","{}","False","","","True","virgin3554","","","","False","1407628900.0","1407625300.0","","self.askgaybros","0","False","0","True","False","2d3ro9","True","","","","","","{}","[]","t3_2d3ro9","13","","False","http://www.reddit.com/r/askgaybros/comments/2d3ro9/dont_know_if_i_want_to_lose_my_virginity_to_a_guy/","Unauthenticated reddit sesssion","","False","1","","{}","I'm bi, and I've dated women before, but I've never had sex.

I've never been with a guy but have flirted with many guys on Grindr and then chickened out of actually meeting them.

I've never been flat out asked to hook up by a girl, but many guys on Grindr have asked me.  I'm tempted, but I have this weird idea that I shouldn't lose my virginity to a guy.  Kind of like that anal sex is unnatural and I should know what vaginal sex feels like first.  I really want to go for it (and be safe of course), but am held back by the fact that I'm a virgin.  If I were not, I would have no problems hooking up with guys.

I know this sounds weird, but I'm confused about what I want.","&lt;!-- SC_OFF --&gt;&lt;div class=""md""&gt;&lt;p&gt;I&amp;#39;m bi, and I&amp;#39;ve dated women before, but I&amp;#39;ve never had sex.&lt;/p&gt;

&lt;p&gt;I&amp;#39;ve never been with a guy but have flirted with many guys on Grindr and then chickened out of actually meeting them.&lt;/p&gt;

&lt;p&gt;I&amp;#39;ve never been flat out asked to hook up by a girl, but many guys on Grindr have asked me.  I&amp;#39;m tempted, but I have this weird idea that I shouldn&amp;#39;t lose my virginity to a guy.  Kind of like that anal sex is unnatural and I should know what vaginal sex feels like first.  I really want to go for it (and be safe of course), but am held back by the fact that I&amp;#39;m a virgin.  If I were not, I would have no problems hooking up with guys.&lt;/p&gt;

&lt;p&gt;I know this sounds weird, but I&amp;#39;m confused about what I want.&lt;/p&gt;
&lt;/div&gt;&lt;!-- SC_ON --&gt;","False","askgaybros","t5_2vgfw","","","Don't know if I want to lose my virginity to a guy","1","http://www.reddit.com/r/askgaybros/comments/2d3ro9/dont_know_if_i_want_to_lose_my_virginity_to_a_guy/","[]","False"
"16","","","{}","http://www.reddit.com/api/info/","{}","{}","False","","","True","relaylif8484","","","","False","1407628537.0","1407624937.0","","self.askgaybros","0","False","0","True","False","2d3r5x","True","","","","","","{}","[]","t3_2d3r5x","5","","False","http://www.reddit.com/r/askgaybros/comments/2d3r5x/that_feeling_of_acceptance_that_your_straight/","Unauthenticated reddit sesssion","","False","0","","{}","I feel like I wasted so much time lusting after this guy, and for some reason, I suddenly had an epiphany and seeing that everything he says or does irritates me.  He doesn't even turn me on anymore because he's a tool to begin with and full of himself.  Sick of doing favors for him that he never gave back in return.  ","&lt;!-- SC_OFF --&gt;&lt;div class=""md""&gt;&lt;p&gt;I feel like I wasted so much time lusting after this guy, and for some reason, I suddenly had an epiphany and seeing that everything he says or does irritates me.  He doesn&amp;#39;t even turn me on anymore because he&amp;#39;s a tool to begin with and full of himself.  Sick of doing favors for him that he never gave back in return.  &lt;/p&gt;
&lt;/div&gt;&lt;!-- SC_ON --&gt;","False","askgaybros","t5_2vgfw","","","That feeling of acceptance that your straight friend will never love you and realize how much of a prick he is to begin with.","0","http://www.reddit.com/r/askgaybros/comments/2d3r5x/that_feeling_of_acceptance_that_your_straight/","[]","False"
"17","","","{}","http://www.reddit.com/api/info/","{}","{}","False","","","True","idkthisismythrowawy","","","","False","1407626624.0","1407623024.0","","self.askgaybros","0","False","0","True","False","2d3oii","True","","","","","","{}","[]","t3_2d3oii","9","","False","http://www.reddit.com/r/askgaybros/comments/2d3oii/help_i_need_some_advice_bros/","Unauthenticated reddit sesssion","","False","2","","{}","First all a little bit of background.  I just graduated from college in May, and moved to Atlanta after. Ive been living in Atlanta for about 2 months now.  I don't know many people here now and I guess the honest truth is I'm lonely as hell.  

So I matched with this guy on Tinder, and we'd been talking for a couple months.  Things were great. Then I drive to meet him, he gets us a hotel room for the night, we did basically have sex on our first night together which I regret more than life itself right now. Though we both enjoyed it, and he was the one who put it in(all the way at least), I can't help but feel that this was a huge mistake.  I head home the next day after an amazing night, and after then he realizes that he has feelings for this boyfriend that he has which was the first time that he mentions that he even has a boyfriend.  His boyfriend is currently studying abroad overseas for the next 3 months and has been gone for the past couple months.  They talked about taking a break before he started studying abroad.

He (the guy I met) says that he feels horrible and guilty since they've dated a couple months before he met me, and I finally asked him what he wanted with me then and if he had feelings for me anymore.  He responded that his feelings for the guy he was dating are clouding his judgment right now and that he thinks we should take things a few steps back right now, back to a platonic relationship.  

I'm depressed as hell and don't know what to say to this.  Should I stick around for this guy and just see how things go, or move on? How should I read this situation?  I do want what would be best for them and if he truly does want this guy then he should stay with him, but if only one night with me makes him seriously consider the relationship with his bf, then it seems to me like he would probably enjoy a relationship with me a bit more. 

What should I do?
","&lt;!-- SC_OFF --&gt;&lt;div class=""md""&gt;&lt;p&gt;First all a little bit of background.  I just graduated from college in May, and moved to Atlanta after. Ive been living in Atlanta for about 2 months now.  I don&amp;#39;t know many people here now and I guess the honest truth is I&amp;#39;m lonely as hell.  &lt;/p&gt;

&lt;p&gt;So I matched with this guy on Tinder, and we&amp;#39;d been talking for a couple months.  Things were great. Then I drive to meet him, he gets us a hotel room for the night, we did basically have sex on our first night together which I regret more than life itself right now. Though we both enjoyed it, and he was the one who put it in(all the way at least), I can&amp;#39;t help but feel that this was a huge mistake.  I head home the next day after an amazing night, and after then he realizes that he has feelings for this boyfriend that he has which was the first time that he mentions that he even has a boyfriend.  His boyfriend is currently studying abroad overseas for the next 3 months and has been gone for the past couple months.  They talked about taking a break before he started studying abroad.&lt;/p&gt;

&lt;p&gt;He (the guy I met) says that he feels horrible and guilty since they&amp;#39;ve dated a couple months before he met me, and I finally asked him what he wanted with me then and if he had feelings for me anymore.  He responded that his feelings for the guy he was dating are clouding his judgment right now and that he thinks we should take things a few steps back right now, back to a platonic relationship.  &lt;/p&gt;

&lt;p&gt;I&amp;#39;m depressed as hell and don&amp;#39;t know what to say to this.  Should I stick around for this guy and just see how things go, or move on? How should I read this situation?  I do want what would be best for them and if he truly does want this guy then he should stay with him, but if only one night with me makes him seriously consider the relationship with his bf, then it seems to me like he would probably enjoy a relationship with me a bit more. &lt;/p&gt;

&lt;p&gt;What should I do?&lt;/p&gt;
&lt;/div&gt;&lt;!-- SC_ON --&gt;","False","askgaybros","t5_2vgfw","","","Help, I need some advice bros..","2","http://www.reddit.com/r/askgaybros/comments/2d3oii/help_i_need_some_advice_bros/","[]","False"
"18","","","{}","http://www.reddit.com/api/info/","{}","{}","False","","","True","shyeahbro","","","","False","1407622606.0","1407619006.0","","self.askgaybros","0","False","0","True","False","2d3iw7","True","","","","","","{}","[]","t3_2d3iw7","5","","False","http://www.reddit.com/r/askgaybros/comments/2d3iw7/prep_for_a_bro_in_canada/","Unauthenticated reddit sesssion","","False","1","","{}","Hey guys, I did a search but all the results were for the US.

I know I shouldn't be and I try to keep myself safe, but I'm definitely high-risk for HIV.

Are any of you Canadian bros on PrEP?  How do I get PrEP here?","&lt;!-- SC_OFF --&gt;&lt;div class=""md""&gt;&lt;p&gt;Hey guys, I did a search but all the results were for the US.&lt;/p&gt;

&lt;p&gt;I know I shouldn&amp;#39;t be and I try to keep myself safe, but I&amp;#39;m definitely high-risk for HIV.&lt;/p&gt;

&lt;p&gt;Are any of you Canadian bros on PrEP?  How do I get PrEP here?&lt;/p&gt;
&lt;/div&gt;&lt;!-- SC_ON --&gt;","False","askgaybros","t5_2vgfw","","","PrEP for a bro in Canada?","1","http://www.reddit.com/r/askgaybros/comments/2d3iw7/prep_for_a_bro_in_canada/","[]","False"
"19","","","{}","http://www.reddit.com/api/info/","{}","{}","False","","","True","beefyliltank","","","","False","1407621210.0","1407617610.0","","self.askgaybros","0","False","0","True","False","2d3gx6","True","","","","","","{}","[]","t3_2d3gx6","11","","False","http://www.reddit.com/r/askgaybros/comments/2d3gx6/any_advice_how_to_remove_an_ex_from_their_pedestal/","Unauthenticated reddit sesssion","","False","3","","{}","About 6 weeks ago my ex called it off. Though we were never official, so I guess there was nothing to really call off per se. Nonetheless, I can't seem to remove this guy from the pedestal I put him on.  This wa the first guy whoever broke my heart

To me he was the most handsome guy I have ever met, and I felt we had an amazing connection.  The sex was something I never experienced before.  However during the time he didn't treat me right.  I can't seem to get past the positives where the negatives are overwhelming.

So far I have cut off contact with him. I blocked him on Facebook and the new guy he ran off with.  But do you gay bros have any advice to help a guy knock off my ex off his pedestal?
","&lt;!-- SC_OFF --&gt;&lt;div class=""md""&gt;&lt;p&gt;About 6 weeks ago my ex called it off. Though we were never official, so I guess there was nothing to really call off per se. Nonetheless, I can&amp;#39;t seem to remove this guy from the pedestal I put him on.  This wa the first guy whoever broke my heart&lt;/p&gt;

&lt;p&gt;To me he was the most handsome guy I have ever met, and I felt we had an amazing connection.  The sex was something I never experienced before.  However during the time he didn&amp;#39;t treat me right.  I can&amp;#39;t seem to get past the positives where the negatives are overwhelming.&lt;/p&gt;

&lt;p&gt;So far I have cut off contact with him. I blocked him on Facebook and the new guy he ran off with.  But do you gay bros have any advice to help a guy knock off my ex off his pedestal?&lt;/p&gt;
&lt;/div&gt;&lt;!-- SC_ON --&gt;","False","askgaybros","t5_2vgfw","","","Any Advice How To Remove An Ex from Their Pedestal?","3","http://www.reddit.com/r/askgaybros/comments/2d3gx6/any_advice_how_to_remove_an_ex_from_their_pedestal/","[]","False"
"20","","","{}","http://www.reddit.com/api/info/","{}","{}","False","","","True","guerito_","","","","False","1407620260.0","1407616660.0","","self.askgaybros","0","1407694431.0","0","True","False","2d3fiy","True","","","","","","{}","[]","t3_2d3fiy","51","","False","http://www.reddit.com/r/askgaybros/comments/2d3fiy/how_many_of_you_donate_blood/","Unauthenticated reddit sesssion","","False","24","","{}","I used to be an avid blood donor but ever since I started having sex with guys I stopped. In the United States at least aren't you declined if you're a guy who's had sex with a guy? Any of you still do it? I know I'm ~~clean~~ free of any STDs and HIV- so I honestly don't see what's wrong with it. Your input? :)","&lt;!-- SC_OFF --&gt;&lt;div class=""md""&gt;&lt;p&gt;I used to be an avid blood donor but ever since I started having sex with guys I stopped. In the United States at least aren&amp;#39;t you declined if you&amp;#39;re a guy who&amp;#39;s had sex with a guy? Any of you still do it? I know I&amp;#39;m &lt;del&gt;clean&lt;/del&gt; free of any STDs and HIV- so I honestly don&amp;#39;t see what&amp;#39;s wrong with it. Your input? :)&lt;/p&gt;
&lt;/div&gt;&lt;!-- SC_ON --&gt;","False","askgaybros","t5_2vgfw","","","How many of you donate blood?","24","http://www.reddit.com/r/askgaybros/comments/2d3fiy/how_many_of_you_donate_blood/","[]","False"
"21","","","{}","http://www.reddit.com/api/info/","{}","{}","False","","","True","hikerinthedark","","","","False","1407613680.0","1407610080.0","","self.askgaybros","0","False","0","True","False","2d35w0","True","","","","","","{}","[]","t3_2d35w0","13","","False","http://www.reddit.com/r/askgaybros/comments/2d35w0/what_is_it_with_some_masc_bi_guys_thinking_they/","Unauthenticated reddit sesssion","","False","7","","{}","Is this a new thing with bi guys? 

My friend is a professional Dominatrix and she's says there's been a surge of this in the last few years. Guys who identify as straight discovering they have bi urges and wanting to be feminized so they can be cock-sucking sissies. 

My Domme friend says they tend to have serious guilt over wanting men and want to be punished for it by being turned into less than men and forced to suck ""Alpha males.""

What the hell? Don't they know sucking cock doesn't make you less of a man?

*I don't have a problem with femme guys or drag queens. But this sissy fetish is built around the sissy seeing himself as less than a man cos he wants cock. Issues much?*","&lt;!-- SC_OFF --&gt;&lt;div class=""md""&gt;&lt;p&gt;Is this a new thing with bi guys? &lt;/p&gt;

&lt;p&gt;My friend is a professional Dominatrix and she&amp;#39;s says there&amp;#39;s been a surge of this in the last few years. Guys who identify as straight discovering they have bi urges and wanting to be feminized so they can be cock-sucking sissies. &lt;/p&gt;

&lt;p&gt;My Domme friend says they tend to have serious guilt over wanting men and want to be punished for it by being turned into less than men and forced to suck &amp;quot;Alpha males.&amp;quot;&lt;/p&gt;

&lt;p&gt;What the hell? Don&amp;#39;t they know sucking cock doesn&amp;#39;t make you less of a man?&lt;/p&gt;

&lt;p&gt;&lt;em&gt;I don&amp;#39;t have a problem with femme guys or drag queens. But this sissy fetish is built around the sissy seeing himself as less than a man cos he wants cock. Issues much?&lt;/em&gt;&lt;/p&gt;
&lt;/div&gt;&lt;!-- SC_ON --&gt;","False","askgaybros","t5_2vgfw","","","What is it with some ""masc"" bi guys thinking they have to be a sissy to suck cock?","7","http://www.reddit.com/r/askgaybros/comments/2d35w0/what_is_it_with_some_masc_bi_guys_thinking_they/","[]","False"
"22","","","{}","http://www.reddit.com/api/info/","{}","{}","False","","","True","Laika_Come_Home","","","","False","1407611027.0","1407607427.0","","self.askgaybros","0","False","0","True","False","2d31zv","True","","","","","","{}","[]","t3_2d31zv","7","","False","http://www.reddit.com/r/askgaybros/comments/2d31zv/guys_who_met_their_sos_on_dating_apps_howd_it/","Unauthenticated reddit sesssion","","False","3","","{}","Just curious.","&lt;!-- SC_OFF --&gt;&lt;div class=""md""&gt;&lt;p&gt;Just curious.&lt;/p&gt;
&lt;/div&gt;&lt;!-- SC_ON --&gt;","False","askgaybros","t5_2vgfw","","","Guys who met their SOs on dating apps, how'd it happen? What'd y'all talk about, and how'd you progress into dates?","3","http://www.reddit.com/r/askgaybros/comments/2d31zv/guys_who_met_their_sos_on_dating_apps_howd_it/","[]","False"
