"","_comment_sort","_comments","_comments_by_id","_info_url","_orphaned","_params","_replaced_more","_underscore_names","approved_by","archived","author","author_flair_css_class","author_flair_text","banned_by","clicked","created","created_utc","distinguished","domain","downs","edited","gilded","has_fetched","hidden","id","is_self","json_dict","likes","link_flair_css_class","link_flair_text","media","media_embed","mod_reports","name","num_comments","num_reports","over_18","permalink","reddit_session","report_reasons","saved","score","secure_media","secure_media_embed","selftext","selftext_html","stickied","subreddit","subreddit_id","suggested_sort","thumbnail","title","ups","url","user_reports","visited"
"14","","","{}","http://www.reddit.com/api/info/","{}","{}","False","","","False","ta2285930","","","","False","1425073386.0","1425073386.0","","self.askgaybros","0","False","0","True","False","2xebkh","True","","","","","","{}","[]","t3_2xebkh","18","","False","http://www.reddit.com/r/askgaybros/comments/2xebkh/good_original_gay_comedy/","Unauthenticated reddit sesssion","","False","10","","{}","Most comedies where gay people are the focus/main characters are overflowed with stereotypical up-to-eleven Bruno-ish type of guys. And not there's anything wrong with being effeminate and liking different things, but there are way too much of these movies and it's getting old.

Does anyone know about any comedy movies with gay main characters where the main source of humor isn't the fact that they like dick? For example I like dark comedies, such as Big Nothing, 11:14, Snatch, Shaun of the dead, Lock Stock and Two Smoking Barrels, What We Do In The Shadows etc. Do we have anything of this sort? I understand that this is very specific request but I wanted to ask just to be sure.","&lt;!-- SC_OFF --&gt;&lt;div class=""md""&gt;&lt;p&gt;Most comedies where gay people are the focus/main characters are overflowed with stereotypical up-to-eleven Bruno-ish type of guys. And not there&amp;#39;s anything wrong with being effeminate and liking different things, but there are way too much of these movies and it&amp;#39;s getting old.&lt;/p&gt;

&lt;p&gt;Does anyone know about any comedy movies with gay main characters where the main source of humor isn&amp;#39;t the fact that they like dick? For example I like dark comedies, such as Big Nothing, 11:14, Snatch, Shaun of the dead, Lock Stock and Two Smoking Barrels, What We Do In The Shadows etc. Do we have anything of this sort? I understand that this is very specific request but I wanted to ask just to be sure.&lt;/p&gt;
&lt;/div&gt;&lt;!-- SC_ON --&gt;","False","askgaybros","t5_2vgfw","","","Good, original gay comedy","10","http://www.reddit.com/r/askgaybros/comments/2xebkh/good_original_gay_comedy/","[]","False"
"15","","","{}","http://www.reddit.com/api/info/","{}","{}","False","","","False","InnervatedYeti","","","","False","1425069358.0","1425069358.0","","self.askgaybros","0","1425168956.0","0","True","False","2xe2kz","True","","","","","","{}","[]","t3_2xe2kz","88","","False","http://www.reddit.com/r/askgaybros/comments/2xe2kz/gaybros_who_speak_other_languages_whats_gay_slang/","Unauthenticated reddit sesssion","","False","95","","{}","What do you guys call tops, bottoms, twinks, etc.?

  

Edit: Thanks for the great replies! This has been entertaining and enlightening. My personal favorites include:

* une bouche de métro (French) ""subway entrance"" - slut
* fuerte (Chilean Spanish) ""strong"" - flaming (as I understand it)
* 小受 (Chinese) ""little receiver"" - bottom
","&lt;!-- SC_OFF --&gt;&lt;div class=""md""&gt;&lt;p&gt;What do you guys call tops, bottoms, twinks, etc.?&lt;/p&gt;

&lt;p&gt;Edit: Thanks for the great replies! This has been entertaining and enlightening. My personal favorites include:&lt;/p&gt;

&lt;ul&gt;
&lt;li&gt;une bouche de métro (French) &amp;quot;subway entrance&amp;quot; - slut&lt;/li&gt;
&lt;li&gt;fuerte (Chilean Spanish) &amp;quot;strong&amp;quot; - flaming (as I understand it)&lt;/li&gt;
&lt;li&gt;小受 (Chinese) &amp;quot;little receiver&amp;quot; - bottom&lt;/li&gt;
&lt;/ul&gt;
&lt;/div&gt;&lt;!-- SC_ON --&gt;","False","askgaybros","t5_2vgfw","","","Gaybros who speak other languages, what's gay slang like in your language?","95","http://www.reddit.com/r/askgaybros/comments/2xe2kz/gaybros_who_speak_other_languages_whats_gay_slang/","[]","False"
"16","","","{}","http://www.reddit.com/api/info/","{}","{}","False","","","False","mrpawswi","","","","False","1425067334.0","1425067334.0","","self.askgaybros","0","False","0","True","False","2xdy0g","True","","","","","","{}","[]","t3_2xdy0g","39","","False","http://www.reddit.com/r/askgaybros/comments/2xdy0g/gaybros_in_it/","Unauthenticated reddit sesssion","","False","8","","{}","Anyone out the work in IT? I work in InfoSec and it does seem like there are quite a few of us in sysadmin and other roles. Shout out to all the IT gaybros who keep infrastructure running, most days it's pretty thankless!","&lt;!-- SC_OFF --&gt;&lt;div class=""md""&gt;&lt;p&gt;Anyone out the work in IT? I work in InfoSec and it does seem like there are quite a few of us in sysadmin and other roles. Shout out to all the IT gaybros who keep infrastructure running, most days it&amp;#39;s pretty thankless!&lt;/p&gt;
&lt;/div&gt;&lt;!-- SC_ON --&gt;","False","askgaybros","t5_2vgfw","","","Gaybros in IT","8","http://www.reddit.com/r/askgaybros/comments/2xdy0g/gaybros_in_it/","[]","False"
"17","","","{}","http://www.reddit.com/api/info/","{}","{}","False","","","False","optimus_pines","","","","False","1425066003.0","1425066003.0","","self.askgaybros","0","1425066224.0","0","True","False","2xdv1n","True","","","","","","{}","[]","t3_2xdv1n","16","","False","http://www.reddit.com/r/askgaybros/comments/2xdv1n/why_is_fucking_the_only_thing_guys_wanna_do_on/","Unauthenticated reddit sesssion","","False","7","","{}","I'm pretty new to the sexual part of being gay. I've only sucked about 3 guys (on multiple occasions) and I for the time being that's about all I'm willing to do that's in my comfort zone. 

Earlier today, this guy messages me with the standard ""hey what's going on? wanna hook up? blah blah"" and, having the house to myself I said yes. While asking what we want to do I explicitly said I don't really want to fuck but I'm fine sucking. He kept trying to coerce me into fucking but I just don't feel comfortable doing that. For one, I have no idea the other guys he's been with and what diseases he may (or may not) have and that feeling of uncertainty with random hookups turns me off to the entire thing. It's not that I'm putting down people for wanting to be sexual, but the few minutes of fun in my mind don't really outweigh the future implications. I don't know if this is old fashioned but I'd rather wait for the right guy to try anal with rather than some quickie hook up that's just hook up and go. 

At the same time, I know one of the things I've struggled with is getting out of my comfort zone and just diving into the metaphorical pool. Everyone has needs and sometimes it's fun to just give in to them for a little bit but even blowjobs sometimes get me paranoid about unpleasant STDs , so how much more for anal even if it is protected? So am I being too apprehensive about it all? On one hand it would be nice to just punch out that last card of ""holes where penises have been"", but at the same time I'd much prefer taking it slow with a guy I trust and not wasting my first time on some random 10 minute hook up.  ","&lt;!-- SC_OFF --&gt;&lt;div class=""md""&gt;&lt;p&gt;I&amp;#39;m pretty new to the sexual part of being gay. I&amp;#39;ve only sucked about 3 guys (on multiple occasions) and I for the time being that&amp;#39;s about all I&amp;#39;m willing to do that&amp;#39;s in my comfort zone. &lt;/p&gt;

&lt;p&gt;Earlier today, this guy messages me with the standard &amp;quot;hey what&amp;#39;s going on? wanna hook up? blah blah&amp;quot; and, having the house to myself I said yes. While asking what we want to do I explicitly said I don&amp;#39;t really want to fuck but I&amp;#39;m fine sucking. He kept trying to coerce me into fucking but I just don&amp;#39;t feel comfortable doing that. For one, I have no idea the other guys he&amp;#39;s been with and what diseases he may (or may not) have and that feeling of uncertainty with random hookups turns me off to the entire thing. It&amp;#39;s not that I&amp;#39;m putting down people for wanting to be sexual, but the few minutes of fun in my mind don&amp;#39;t really outweigh the future implications. I don&amp;#39;t know if this is old fashioned but I&amp;#39;d rather wait for the right guy to try anal with rather than some quickie hook up that&amp;#39;s just hook up and go. &lt;/p&gt;

&lt;p&gt;At the same time, I know one of the things I&amp;#39;ve struggled with is getting out of my comfort zone and just diving into the metaphorical pool. Everyone has needs and sometimes it&amp;#39;s fun to just give in to them for a little bit but even blowjobs sometimes get me paranoid about unpleasant STDs , so how much more for anal even if it is protected? So am I being too apprehensive about it all? On one hand it would be nice to just punch out that last card of &amp;quot;holes where penises have been&amp;quot;, but at the same time I&amp;#39;d much prefer taking it slow with a guy I trust and not wasting my first time on some random 10 minute hook up.  &lt;/p&gt;
&lt;/div&gt;&lt;!-- SC_ON --&gt;","False","askgaybros","t5_2vgfw","","","why is fucking the only thing guys wanna do on grindr? it's never oral or handjobs or even friends for that matter.","7","http://www.reddit.com/r/askgaybros/comments/2xdv1n/why_is_fucking_the_only_thing_guys_wanna_do_on/","[]","False"
"18","","","{}","http://www.reddit.com/api/info/","{}","{}","False","","","False","Hhgjhhgf","","","","False","1425065077.0","1425065077.0","","self.askgaybros","0","False","0","True","False","2xdt0r","True","","","","","","{}","[]","t3_2xdt0r","22","","False","http://www.reddit.com/r/askgaybros/comments/2xdt0r/no_reason_not_to_kill_myself/","Unauthenticated reddit sesssion","","False","0","","{}","I failed out of university and will pretty much never be able to afford to move. I hate being gay and there's no gay guys anywhere near where I live. I have no friends and I've lost the only chance at an even remotely enjoyable life il ever have","&lt;!-- SC_OFF --&gt;&lt;div class=""md""&gt;&lt;p&gt;I failed out of university and will pretty much never be able to afford to move. I hate being gay and there&amp;#39;s no gay guys anywhere near where I live. I have no friends and I&amp;#39;ve lost the only chance at an even remotely enjoyable life il ever have&lt;/p&gt;
&lt;/div&gt;&lt;!-- SC_ON --&gt;","False","askgaybros","t5_2vgfw","","","No reason not to kill myself","0","http://www.reddit.com/r/askgaybros/comments/2xdt0r/no_reason_not_to_kill_myself/","[]","False"
"19","","","{}","http://www.reddit.com/api/info/","{}","{}","False","","","False","throwaway389432","","","","False","1425062428.0","1425062428.0","","self.askgaybros","0","False","0","True","False","2xdn48","True","","","","","","{}","[]","t3_2xdn48","13","","False","http://www.reddit.com/r/askgaybros/comments/2xdn48/did_anyone_else_feel_sick_while_in_the_process_of/","Unauthenticated reddit sesssion","","False","0","","{}","I'm 26 years old and I came out to myself last week. I finally realized that my desire for happiness and a relationship is greater than my fear of isolation (I live/grew up in a quite conservative area). For close to a decade I have suspected I was gay, but always assumed it was just a phase or I was just curious. Since coming out to myself, I feel a sense of relief in some respects. That being said, my physical and mental health has been terrible - I've been feeling depressed, anxious, my head feels like it's being crushed, heart is racing, body has been shaking, I'm always cold, have lost my appetite and just feel all around tense.  I have some awesome friends that I know will be beyond supportive if I come out, but every time it seems like a good moment to tell them (and there have been several perfect opportunities this week) I justify waiting a bit longer. Does anyone have any stories relating to this or any advice? I'm feeling confused and lonely right now and could use some help. Thanks","&lt;!-- SC_OFF --&gt;&lt;div class=""md""&gt;&lt;p&gt;I&amp;#39;m 26 years old and I came out to myself last week. I finally realized that my desire for happiness and a relationship is greater than my fear of isolation (I live/grew up in a quite conservative area). For close to a decade I have suspected I was gay, but always assumed it was just a phase or I was just curious. Since coming out to myself, I feel a sense of relief in some respects. That being said, my physical and mental health has been terrible - I&amp;#39;ve been feeling depressed, anxious, my head feels like it&amp;#39;s being crushed, heart is racing, body has been shaking, I&amp;#39;m always cold, have lost my appetite and just feel all around tense.  I have some awesome friends that I know will be beyond supportive if I come out, but every time it seems like a good moment to tell them (and there have been several perfect opportunities this week) I justify waiting a bit longer. Does anyone have any stories relating to this or any advice? I&amp;#39;m feeling confused and lonely right now and could use some help. Thanks&lt;/p&gt;
&lt;/div&gt;&lt;!-- SC_ON --&gt;","False","askgaybros","t5_2vgfw","","","Did anyone else feel sick while in the process of coming out?","0","http://www.reddit.com/r/askgaybros/comments/2xdn48/did_anyone_else_feel_sick_while_in_the_process_of/","[]","False"
"20","","","{}","http://www.reddit.com/api/info/","{}","{}","False","","","False","y2kiscoming","","","","False","1425057854.0","1425057854.0","","self.askgaybros","0","False","0","True","False","2xdc9o","True","","","","","","{}","[]","t3_2xdc9o","34","","False","http://www.reddit.com/r/askgaybros/comments/2xdc9o/gaybros_in_healthcare/","Unauthenticated reddit sesssion","","False","9","","{}","Just wondering what health professions gaybros work in or are interested in.. I am currently in EMT school, and I am will be working toward my dream job as a physicians assistant. Any other med students, nursing students, etc on this sub? ","&lt;!-- SC_OFF --&gt;&lt;div class=""md""&gt;&lt;p&gt;Just wondering what health professions gaybros work in or are interested in.. I am currently in EMT school, and I am will be working toward my dream job as a physicians assistant. Any other med students, nursing students, etc on this sub? &lt;/p&gt;
&lt;/div&gt;&lt;!-- SC_ON --&gt;","False","askgaybros","t5_2vgfw","","","Gaybros in healthcare?","9","http://www.reddit.com/r/askgaybros/comments/2xdc9o/gaybros_in_healthcare/","[]","False"
"21","","","{}","http://www.reddit.com/api/info/","{}","{}","False","","","False","broguy98","","","","False","1425054539.0","1425054539.0","","self.askgaybros","0","1425056309.0","0","True","False","2xd4tw","True","","","","","","{}","[]","t3_2xd4tw","15","","False","http://www.reddit.com/r/askgaybros/comments/2xd4tw/how_do_i_forget_bad_sexual_experiences/","Unauthenticated reddit sesssion","","False","5","","{}","So this guy came over after using old pics and he was way older like 48 nd im still 18 and he made me really uncomfortable and we did things, and this was my first time doing anything, and i regret it entirely, we didnt have full on sex tho i stopped him, and im just wondering how do you guys move on from bad sexual experiences? How do i forget about this? Thought i was ready, totally was not.

Update: I just took a shower and threw out the clothes i was wearing, he really made me uncomfortable.
Update 2: turns out he is married... it keeps getting worse, i feel horrible.","&lt;!-- SC_OFF --&gt;&lt;div class=""md""&gt;&lt;p&gt;So this guy came over after using old pics and he was way older like 48 nd im still 18 and he made me really uncomfortable and we did things, and this was my first time doing anything, and i regret it entirely, we didnt have full on sex tho i stopped him, and im just wondering how do you guys move on from bad sexual experiences? How do i forget about this? Thought i was ready, totally was not.&lt;/p&gt;

&lt;p&gt;Update: I just took a shower and threw out the clothes i was wearing, he really made me uncomfortable.
Update 2: turns out he is married... it keeps getting worse, i feel horrible.&lt;/p&gt;
&lt;/div&gt;&lt;!-- SC_ON --&gt;","False","askgaybros","t5_2vgfw","","","How do i forget bad sexual experiences?","5","http://www.reddit.com/r/askgaybros/comments/2xd4tw/how_do_i_forget_bad_sexual_experiences/","[]","False"
"22","","","{}","http://www.reddit.com/api/info/","{}","{}","False","","","False","LionBoner","","","","False","1425054101.0","1425054101.0","","self.askgaybros","0","False","0","True","False","2xd3y4","True","","","","","","{}","[]","t3_2xd3y4","16","","False","http://www.reddit.com/r/askgaybros/comments/2xd3y4/stepping_into_joint_finances/","Unauthenticated reddit sesssion","","False","9","","{}","My partner and I are looking into opening a joint account to help w the bill paying, etc.  Right now we split the bills, and try to alternate paying for groceries, restaurants, etc.  It would just be a lot cleaner if we had one account linked to all of our bills, plus it would make life easier with paying for meals and stuff.

Checking or Credit?  Both?  Benefit of checking would be that we could auto-deposit.  Benefit of credit would be that we wouldn't have to worry about having the funds and could just split the amount to pay off at the end of each month.

One name on account, or both?  I have better credit.  Not sure if sharing an account w him would lower my credit?

Any other input or advice appreciated!","&lt;!-- SC_OFF --&gt;&lt;div class=""md""&gt;&lt;p&gt;My partner and I are looking into opening a joint account to help w the bill paying, etc.  Right now we split the bills, and try to alternate paying for groceries, restaurants, etc.  It would just be a lot cleaner if we had one account linked to all of our bills, plus it would make life easier with paying for meals and stuff.&lt;/p&gt;

&lt;p&gt;Checking or Credit?  Both?  Benefit of checking would be that we could auto-deposit.  Benefit of credit would be that we wouldn&amp;#39;t have to worry about having the funds and could just split the amount to pay off at the end of each month.&lt;/p&gt;

&lt;p&gt;One name on account, or both?  I have better credit.  Not sure if sharing an account w him would lower my credit?&lt;/p&gt;

&lt;p&gt;Any other input or advice appreciated!&lt;/p&gt;
&lt;/div&gt;&lt;!-- SC_ON --&gt;","False","askgaybros","t5_2vgfw","","","Stepping into Joint Finances","9","http://www.reddit.com/r/askgaybros/comments/2xd3y4/stepping_into_joint_finances/","[]","False"
