"","_comment_sort","_comments","_comments_by_id","_info_url","_orphaned","_params","_replaced_more","_underscore_names","approved_by","archived","author","author_flair_css_class","author_flair_text","banned_by","clicked","created","created_utc","distinguished","domain","downs","edited","gilded","has_fetched","hidden","id","is_self","json_dict","likes","link_flair_css_class","link_flair_text","media","media_embed","mod_reports","name","num_comments","num_reports","over_18","permalink","reddit_session","report_reasons","saved","score","secure_media","secure_media_embed","selftext","selftext_html","stickied","subreddit","subreddit_id","suggested_sort","thumbnail","title","ups","url","user_reports","visited"
"0","","","{}","http://www.reddit.com/api/info/","{}","{}","False","","","False","ih8beinggay","","","","False","1422803826.0","1422803826.0","","self.askgaybros","0","False","0","True","False","2ueu7e","True","","","","","","{}","[]","t3_2ueu7e","39","","False","http://www.reddit.com/r/askgaybros/comments/2ueu7e/am_i_being_an_idiot_for_staying_w_my_fiancee/","Unauthenticated reddit sesssion","","False","5","","{}","Long story short. We have been together for almost 3 years. He has been on hornet, scruff and grinder sending cock pics and ass pics. He has been asking for them too. He lives with me and hasn't had a job for 4 months. I've been paying all bills, food, and rent. I'm 29 and he is 23. When confronted he says he is looking for friends for us. We live in an area with few gay guys. Anyhow, I feel awful I get the proof from looking at his phone when he isnt around. And thats not an ideal way to get friends anyhow if one planks to get married, right?  Sorry for errors, I'm on my tablet while hes in bed. He was up until 5:30am. At least thats when his last message was sent. Bummer, eh?","&lt;!-- SC_OFF --&gt;&lt;div class=""md""&gt;&lt;p&gt;Long story short. We have been together for almost 3 years. He has been on hornet, scruff and grinder sending cock pics and ass pics. He has been asking for them too. He lives with me and hasn&amp;#39;t had a job for 4 months. I&amp;#39;ve been paying all bills, food, and rent. I&amp;#39;m 29 and he is 23. When confronted he says he is looking for friends for us. We live in an area with few gay guys. Anyhow, I feel awful I get the proof from looking at his phone when he isnt around. And thats not an ideal way to get friends anyhow if one planks to get married, right?  Sorry for errors, I&amp;#39;m on my tablet while hes in bed. He was up until 5:30am. At least thats when his last message was sent. Bummer, eh?&lt;/p&gt;
&lt;/div&gt;&lt;!-- SC_ON --&gt;","False","askgaybros","t5_2vgfw","","","Am I being an idiot for staying w my fiancee?","5","http://www.reddit.com/r/askgaybros/comments/2ueu7e/am_i_being_an_idiot_for_staying_w_my_fiancee/","[]","False"
"1","","","{}","http://www.reddit.com/api/info/","{}","{}","False","","","False","ThatGuyYouArent","","","","False","1422801207.0","1422801207.0","","self.askgaybros","0","False","0","True","False","2ueqd6","True","","","","","","{}","[]","t3_2ueqd6","50","","False","http://www.reddit.com/r/askgaybros/comments/2ueqd6/why_do_some_gay_guys_refer_to_their_butt_holes_as/","Unauthenticated reddit sesssion","","False","31","","{}","It's a complete turn-off for me. The last thing I want to be reminded of when I'm looking at/playing with a guy's wonderful ass hole is a woman's vagina. As a gay guy, that's kinda my thing. Not liking vagina.

I'm seriously struggling to understand why other gay guys would want to characterise the butt hole as a vagina.","&lt;!-- SC_OFF --&gt;&lt;div class=""md""&gt;&lt;p&gt;It&amp;#39;s a complete turn-off for me. The last thing I want to be reminded of when I&amp;#39;m looking at/playing with a guy&amp;#39;s wonderful ass hole is a woman&amp;#39;s vagina. As a gay guy, that&amp;#39;s kinda my thing. Not liking vagina.&lt;/p&gt;

&lt;p&gt;I&amp;#39;m seriously struggling to understand why other gay guys would want to characterise the butt hole as a vagina.&lt;/p&gt;
&lt;/div&gt;&lt;!-- SC_ON --&gt;","False","askgaybros","t5_2vgfw","","","Why do some gay guys refer to their butt holes as 'pussies,' 'cunts,' etc?","31","http://www.reddit.com/r/askgaybros/comments/2ueqd6/why_do_some_gay_guys_refer_to_their_butt_holes_as/","[]","False"
"2","","","{}","http://www.reddit.com/api/info/","{}","{}","False","","","False","dirtydrag","","","","False","1422796234.0","1422796234.0","","self.askgaybros","0","False","0","True","False","2uek51","True","","","","","","{}","[]","t3_2uek51","29","","False","http://www.reddit.com/r/askgaybros/comments/2uek51/dae_have_armpit_fetish_this_way/","Unauthenticated reddit sesssion","","False","57","","{}","Love the musty sweaty smell from the pits after a work out.
Can't resist and I keep sniffing my bf's unwashed shirt when he's not around.
Tell me how do you feel?","&lt;!-- SC_OFF --&gt;&lt;div class=""md""&gt;&lt;p&gt;Love the musty sweaty smell from the pits after a work out.
Can&amp;#39;t resist and I keep sniffing my bf&amp;#39;s unwashed shirt when he&amp;#39;s not around.
Tell me how do you feel?&lt;/p&gt;
&lt;/div&gt;&lt;!-- SC_ON --&gt;","False","askgaybros","t5_2vgfw","","","DAE have armpit fetish this way?","57","http://www.reddit.com/r/askgaybros/comments/2uek51/dae_have_armpit_fetish_this_way/","[]","False"
"3","","","{}","http://www.reddit.com/api/info/","{}","{}","False","","","False","WonderfulJustWonderf","","","","False","1422782481.0","1422782481.0","","self.askgaybros","0","False","0","True","False","2ue7ll","True","","","","","","{}","[]","t3_2ue7ll","8","","False","http://www.reddit.com/r/askgaybros/comments/2ue7ll/whats_with_shitting_on_my_dick/","Unauthenticated reddit sesssion","","False","0","","{}","The last few times I've fucked, the guy always manages to shit on my dick. Control yourself people.","&lt;!-- SC_OFF --&gt;&lt;div class=""md""&gt;&lt;p&gt;The last few times I&amp;#39;ve fucked, the guy always manages to shit on my dick. Control yourself people.&lt;/p&gt;
&lt;/div&gt;&lt;!-- SC_ON --&gt;","False","askgaybros","t5_2vgfw","","","What's with shitting on my dick?","0","http://www.reddit.com/r/askgaybros/comments/2ue7ll/whats_with_shitting_on_my_dick/","[]","False"
"4","","","{}","http://www.reddit.com/api/info/","{}","{}","False","","","False","Gaybrofisties","","","","False","1422778095.0","1422778095.0","","self.askgaybros","0","False","0","True","False","2ue3cs","True","","","","","","{}","[]","t3_2ue3cs","45","","False","http://www.reddit.com/r/askgaybros/comments/2ue3cs/whats_the_thing_that_usually_gives_away_your/","Unauthenticated reddit sesssion","","False","14","","{}","Made some college friends and I was proud cus i thought no one knew I was gay. Decided to come out to them around 3-4 months, they said they already knew..... they still wont tell me how. ","&lt;!-- SC_OFF --&gt;&lt;div class=""md""&gt;&lt;p&gt;Made some college friends and I was proud cus i thought no one knew I was gay. Decided to come out to them around 3-4 months, they said they already knew..... they still wont tell me how. &lt;/p&gt;
&lt;/div&gt;&lt;!-- SC_ON --&gt;","False","askgaybros","t5_2vgfw","","","whats the thing that usually gives away your sexuality?","14","http://www.reddit.com/r/askgaybros/comments/2ue3cs/whats_the_thing_that_usually_gives_away_your/","[]","False"
"5","","","{}","http://www.reddit.com/api/info/","{}","{}","False","","","False","ThrowawayDicks4Me","","","","False","1422777146.0","1422777146.0","","self.askgaybros","0","False","0","True","False","2ue2e3","True","","","","","","{}","[]","t3_2ue2e3","2","","False","http://www.reddit.com/r/askgaybros/comments/2ue2e3/where_do_you_all_find_boyfriends_with_huge_dicks/","Unauthenticated reddit sesssion","","False","0","","{}","So often I see whiney little posts saying ""Help! My boyfriend has a huge dick and I don't know how to take it!""

Where does half of this subreddit find these men with massive dicks, and how is this your first encounter of the kind?

Not a total size queen here, but as someone who knows how to take a big dick, man I would love to be in a serious relationship with a guy who has one...","&lt;!-- SC_OFF --&gt;&lt;div class=""md""&gt;&lt;p&gt;So often I see whiney little posts saying &amp;quot;Help! My boyfriend has a huge dick and I don&amp;#39;t know how to take it!&amp;quot;&lt;/p&gt;

&lt;p&gt;Where does half of this subreddit find these men with massive dicks, and how is this your first encounter of the kind?&lt;/p&gt;

&lt;p&gt;Not a total size queen here, but as someone who knows how to take a big dick, man I would love to be in a serious relationship with a guy who has one...&lt;/p&gt;
&lt;/div&gt;&lt;!-- SC_ON --&gt;","False","askgaybros","t5_2vgfw","","","Where do you all find boyfriends with huge dicks?!?","0","http://www.reddit.com/r/askgaybros/comments/2ue2e3/where_do_you_all_find_boyfriends_with_huge_dicks/","[]","False"
"6","","","{}","http://www.reddit.com/api/info/","{}","{}","False","","","False","linkedtwo","","","","False","1422772725.0","1422772725.0","","self.askgaybros","0","1422806302.0","0","True","False","2udx8g","True","","","","","","{}","[]","t3_2udx8g","62","","False","http://www.reddit.com/r/askgaybros/comments/2udx8g/huge_fight_boyfriend_would_not_install_find_my/","Unauthenticated reddit sesssion","","False","0","","{}","My boyfriend and I have been together for three months and get along great.  He is out of town and I thought it would be cool to be able to check where he was on the road tomorrow so I asked if he would install Find My Friends so I could track him. I actually had previously asked if he would install it and he said ""sure.""  Today when I asked, he refused to do it and we got into a huge argument. He told me that it was a trust issue and it means that I don't trust him.  I told him it was just something cool to have so I could check in and see where he was at without calling. He told me that he doesn't believe in things like that because it decreases real communication and I should just call to ask where he is at. I told him that he doesn't trust me because he doesn't believe me when I am telling him that I don't want it to try to catch him doing something and that we would still have to trust each other regardless of whether or not the app is installed. I didn't expect him to say no so I started thinking that maybe he really is hiding something because his reasons didn't make sense to me. Why would you not install an app on your phone for me? We have talked about moving in together and I told him that he should keep his apartment until he can trust me that the reason I don't want the app is just so I can try to catch him doing something. We even both mentioned breaking up if the other wouldn't give in. He FINALLY agreed to do it and after he did I told him that we could delete it if he wants to when he gets home  because now I know that he is being honest and that I really just wanted the app because it was cool and not to spy on him every day so I will delete it if it makes you think I don't trust you. We both said we were sorry and talked about how much we love each other.  

Am I crazy here? Should I really agree to delete it tomorrow? Do you believe his reasoning for not wanting the app? I really love this guy and want to be with him but this raised a red flag for me. Thanks for any advice you can give. 






**UPDATE:**  We just talked and he is not breaking up with me. He gets my side and I get his now.  It was more of a privacy issue for him that made him feel uneasy.  I just wish he would have communicated that better last night instead of giving the reason that it is solely because I don't trust him. I'm thinking he thought that reason would make me think he was hiding something so he didn't explain himself fully. You guys have made me realize how sensitive this issue is for most people. Apparently, I see it differently than most and had a hard time understanding. I have been dishonest in past relationships and have given the same reasons all of you gave below for not wanting to be tracked. This relationship is special and I feel like I could marry this guy.  Something I have never said before. Anyway, I told him to delete it and all is good. Thanks for all of the advice.","&lt;!-- SC_OFF --&gt;&lt;div class=""md""&gt;&lt;p&gt;My boyfriend and I have been together for three months and get along great.  He is out of town and I thought it would be cool to be able to check where he was on the road tomorrow so I asked if he would install Find My Friends so I could track him. I actually had previously asked if he would install it and he said &amp;quot;sure.&amp;quot;  Today when I asked, he refused to do it and we got into a huge argument. He told me that it was a trust issue and it means that I don&amp;#39;t trust him.  I told him it was just something cool to have so I could check in and see where he was at without calling. He told me that he doesn&amp;#39;t believe in things like that because it decreases real communication and I should just call to ask where he is at. I told him that he doesn&amp;#39;t trust me because he doesn&amp;#39;t believe me when I am telling him that I don&amp;#39;t want it to try to catch him doing something and that we would still have to trust each other regardless of whether or not the app is installed. I didn&amp;#39;t expect him to say no so I started thinking that maybe he really is hiding something because his reasons didn&amp;#39;t make sense to me. Why would you not install an app on your phone for me? We have talked about moving in together and I told him that he should keep his apartment until he can trust me that the reason I don&amp;#39;t want the app is just so I can try to catch him doing something. We even both mentioned breaking up if the other wouldn&amp;#39;t give in. He FINALLY agreed to do it and after he did I told him that we could delete it if he wants to when he gets home  because now I know that he is being honest and that I really just wanted the app because it was cool and not to spy on him every day so I will delete it if it makes you think I don&amp;#39;t trust you. We both said we were sorry and talked about how much we love each other.  &lt;/p&gt;

&lt;p&gt;Am I crazy here? Should I really agree to delete it tomorrow? Do you believe his reasoning for not wanting the app? I really love this guy and want to be with him but this raised a red flag for me. Thanks for any advice you can give. &lt;/p&gt;

&lt;p&gt;&lt;strong&gt;UPDATE:&lt;/strong&gt;  We just talked and he is not breaking up with me. He gets my side and I get his now.  It was more of a privacy issue for him that made him feel uneasy.  I just wish he would have communicated that better last night instead of giving the reason that it is solely because I don&amp;#39;t trust him. I&amp;#39;m thinking he thought that reason would make me think he was hiding something so he didn&amp;#39;t explain himself fully. You guys have made me realize how sensitive this issue is for most people. Apparently, I see it differently than most and had a hard time understanding. I have been dishonest in past relationships and have given the same reasons all of you gave below for not wanting to be tracked. This relationship is special and I feel like I could marry this guy.  Something I have never said before. Anyway, I told him to delete it and all is good. Thanks for all of the advice.&lt;/p&gt;
&lt;/div&gt;&lt;!-- SC_ON --&gt;","False","askgaybros","t5_2vgfw","","","Huge Fight: Boyfriend would not install Find My Friends","0","http://www.reddit.com/r/askgaybros/comments/2udx8g/huge_fight_boyfriend_would_not_install_find_my/","[]","False"
"7","","","{}","http://www.reddit.com/api/info/","{}","{}","False","","","False","ThealtenHeinder","","","","False","1422771623.0","1422771623.0","","self.askgaybros","0","False","0","True","False","2udvte","True","","","","","","{}","[]","t3_2udvte","14","","False","http://www.reddit.com/r/askgaybros/comments/2udvte/straight_friends_birthday/","Unauthenticated reddit sesssion","","False","3","","{}","Hey, so my straight guy friend's birthday is coming up, and I wanted to make a themed cake for him.  He works about a few hours drive from where I am.  I'm gay, and he knows that I am.  We're pretty close friends, but I'm not sure if making the cake and bringing it to him on his birthday is a bit much (crossing the line?)  Can I get some opinions on whether or not this is a good idea?","&lt;!-- SC_OFF --&gt;&lt;div class=""md""&gt;&lt;p&gt;Hey, so my straight guy friend&amp;#39;s birthday is coming up, and I wanted to make a themed cake for him.  He works about a few hours drive from where I am.  I&amp;#39;m gay, and he knows that I am.  We&amp;#39;re pretty close friends, but I&amp;#39;m not sure if making the cake and bringing it to him on his birthday is a bit much (crossing the line?)  Can I get some opinions on whether or not this is a good idea?&lt;/p&gt;
&lt;/div&gt;&lt;!-- SC_ON --&gt;","False","askgaybros","t5_2vgfw","","","Straight Friend's Birthday","3","http://www.reddit.com/r/askgaybros/comments/2udvte/straight_friends_birthday/","[]","False"
"8","","","{}","http://www.reddit.com/api/info/","{}","{}","False","","","False","throwaway43894389","","","","False","1422765580.0","1422765580.0","","self.askgaybros","0","False","0","True","False","2udmom","True","","","","","","{}","[]","t3_2udmom","17","","False","http://www.reddit.com/r/askgaybros/comments/2udmom/why_do_a_lot_of_gay_men_marry_women/","Unauthenticated reddit sesssion","","False","0","","{}","Why choose an easy(but unhappy) life over a happy one?","&lt;!-- SC_OFF --&gt;&lt;div class=""md""&gt;&lt;p&gt;Why choose an easy(but unhappy) life over a happy one?&lt;/p&gt;
&lt;/div&gt;&lt;!-- SC_ON --&gt;","False","askgaybros","t5_2vgfw","","","Why do a lot of gay men marry women?","0","http://www.reddit.com/r/askgaybros/comments/2udmom/why_do_a_lot_of_gay_men_marry_women/","[]","False"
"9","","","{}","http://www.reddit.com/api/info/","{}","{}","False","","","False","saitouthesnowprince","","","","False","1422758798.0","1422758798.0","","self.askgaybros","0","False","0","True","False","2udbjn","True","","","","","","{}","[]","t3_2udbjn","24","","False","http://www.reddit.com/r/askgaybros/comments/2udbjn/how_to_subtly_avoid_talking_about_my_orientation/","Unauthenticated reddit sesssion","","False","5","","{}","I work for a large corporation in a state in the Southern United States. While the company itself is not necessarily conservative, many of my coworkers and the management team are deeply devout neocons. I am afraid if they found out I was gay they would treat me differently and possibly reduce opportunities for me.

So far I have been able to avoid talking about my personal life, but it is getting more difficult. Now that I am getting more social my coworkers and more and more are starting to make their lives and get married and what not, the questions are starting to pour in. With my graduation coming up, there is only so much time left where I can respond to the ""When are you going to get a girlfriend?"" question by saying I'm too busy with school.

Any advice on how to subtly avoid discussing my personal life at work without coming off as secretive or snooty?","&lt;!-- SC_OFF --&gt;&lt;div class=""md""&gt;&lt;p&gt;I work for a large corporation in a state in the Southern United States. While the company itself is not necessarily conservative, many of my coworkers and the management team are deeply devout neocons. I am afraid if they found out I was gay they would treat me differently and possibly reduce opportunities for me.&lt;/p&gt;

&lt;p&gt;So far I have been able to avoid talking about my personal life, but it is getting more difficult. Now that I am getting more social my coworkers and more and more are starting to make their lives and get married and what not, the questions are starting to pour in. With my graduation coming up, there is only so much time left where I can respond to the &amp;quot;When are you going to get a girlfriend?&amp;quot; question by saying I&amp;#39;m too busy with school.&lt;/p&gt;

&lt;p&gt;Any advice on how to subtly avoid discussing my personal life at work without coming off as secretive or snooty?&lt;/p&gt;
&lt;/div&gt;&lt;!-- SC_ON --&gt;","False","askgaybros","t5_2vgfw","","","How to Subtly Avoid Talking about my Orientation at Work","5","http://www.reddit.com/r/askgaybros/comments/2udbjn/how_to_subtly_avoid_talking_about_my_orientation/","[]","False"
"10","","","{}","http://www.reddit.com/api/info/","{}","{}","False","","","False","Invisible96","","","","False","1422750317.0","1422750317.0","","self.askgaybros","0","False","0","True","False","2ucwgu","True","","","","","","{}","[]","t3_2ucwgu","49","","False","http://www.reddit.com/r/askgaybros/comments/2ucwgu/if_you_find_that_conversations_lead_nowhere_with/","Unauthenticated reddit sesssion","","False","63","","{}","Maybe the problem isn't everyone else, it's YOU! If you never ask questions or make an effort to get to know the other person, or expect them to carry the whole conversation, of COURSE people are going to not talk to you!

The amount of times where people who claim to be lonely and want to meet new people will only respond to messages with ""yeah haha"" or ""lol"" fucking infuriates me. It makes the person talking to you feel like they are wasting your time and you're only talking for the sake of it. 

This has been a frustrated outburst by Invisible96. Thank you.","&lt;!-- SC_OFF --&gt;&lt;div class=""md""&gt;&lt;p&gt;Maybe the problem isn&amp;#39;t everyone else, it&amp;#39;s YOU! If you never ask questions or make an effort to get to know the other person, or expect them to carry the whole conversation, of COURSE people are going to not talk to you!&lt;/p&gt;

&lt;p&gt;The amount of times where people who claim to be lonely and want to meet new people will only respond to messages with &amp;quot;yeah haha&amp;quot; or &amp;quot;lol&amp;quot; fucking infuriates me. It makes the person talking to you feel like they are wasting your time and you&amp;#39;re only talking for the sake of it. &lt;/p&gt;

&lt;p&gt;This has been a frustrated outburst by Invisible96. Thank you.&lt;/p&gt;
&lt;/div&gt;&lt;!-- SC_ON --&gt;","False","askgaybros","t5_2vgfw","","","If you find that conversations lead nowhere with new people...","63","http://www.reddit.com/r/askgaybros/comments/2ucwgu/if_you_find_that_conversations_lead_nowhere_with/","[]","False"
"11","","","{}","http://www.reddit.com/api/info/","{}","{}","False","","","False","Sinistew","","","","False","1422749819.0","1422749819.0","","self.askgaybros","0","False","0","True","False","2ucvmt","True","","","","","","{}","[]","t3_2ucvmt","10","","False","http://www.reddit.com/r/askgaybros/comments/2ucvmt/is_getting_straight_to_the_point_in_terms_of/","Unauthenticated reddit sesssion","","False","6","","{}","I personally think beating around the bush about it can get really annoying, specially if you're hot and steamy. But what do you guys think on the matter?","&lt;!-- SC_OFF --&gt;&lt;div class=""md""&gt;&lt;p&gt;I personally think beating around the bush about it can get really annoying, specially if you&amp;#39;re hot and steamy. But what do you guys think on the matter?&lt;/p&gt;
&lt;/div&gt;&lt;!-- SC_ON --&gt;","False","askgaybros","t5_2vgfw","","","Is getting straight to the point in terms of sexting good or bad?","6","http://www.reddit.com/r/askgaybros/comments/2ucvmt/is_getting_straight_to_the_point_in_terms_of/","[]","False"
