"","_comment_sort","_comments","_comments_by_id","_info_url","_orphaned","_params","_replaced_more","_underscore_names","approved_by","archived","author","author_flair_css_class","author_flair_text","banned_by","clicked","created","created_utc","distinguished","domain","downs","edited","gilded","has_fetched","hidden","id","is_self","json_dict","likes","link_flair_css_class","link_flair_text","media","media_embed","mod_reports","name","num_comments","num_reports","over_18","permalink","reddit_session","report_reasons","saved","score","secure_media","secure_media_embed","selftext","selftext_html","stickied","subreddit","subreddit_id","suggested_sort","thumbnail","title","ups","url","user_reports","visited"
"0","","","{}","http://www.reddit.com/api/info/","{}","{}","False","","","False","UjjuDaBroju","","","","False","1421596373.0","1421596373.0","","self.askgaybros","0","1421599841.0","0","True","False","2su59p","True","","","","","","{}","[]","t3_2su59p","23","","False","http://www.reddit.com/r/askgaybros/comments/2su59p/mini_rant_keeping_a_conversation_going/","Unauthenticated reddit sesssion","","False","6","","{}","I've recently moved a couple hours away from my old home, and since I do not know anyone at this location, I've been talking to guys on and off through Grindr and Tinder.  Mostly all of them do not know how to keep a conversation going.  They usually answer questions with one or two word answers, and do not bother to ask a simple ""hbu"".

So tell me bros, am I doing something wrong?

This happens 98% of the time I try to talk to guys.  I understand that they might not be interested, but if you put ""love to meet new people"" in your profile, you should know how to respond in a common conversation or just simply state that you do not want to talk.

By the way, if you're near Poughkeepsie NY, feel free to contact me to hang, drink, play pool, or game!","&lt;!-- SC_OFF --&gt;&lt;div class=""md""&gt;&lt;p&gt;I&amp;#39;ve recently moved a couple hours away from my old home, and since I do not know anyone at this location, I&amp;#39;ve been talking to guys on and off through Grindr and Tinder.  Mostly all of them do not know how to keep a conversation going.  They usually answer questions with one or two word answers, and do not bother to ask a simple &amp;quot;hbu&amp;quot;.&lt;/p&gt;

&lt;p&gt;So tell me bros, am I doing something wrong?&lt;/p&gt;

&lt;p&gt;This happens 98% of the time I try to talk to guys.  I understand that they might not be interested, but if you put &amp;quot;love to meet new people&amp;quot; in your profile, you should know how to respond in a common conversation or just simply state that you do not want to talk.&lt;/p&gt;

&lt;p&gt;By the way, if you&amp;#39;re near Poughkeepsie NY, feel free to contact me to hang, drink, play pool, or game!&lt;/p&gt;
&lt;/div&gt;&lt;!-- SC_ON --&gt;","False","askgaybros","t5_2vgfw","","","(Mini rant) Keeping a conversation going","6","http://www.reddit.com/r/askgaybros/comments/2su59p/mini_rant_keeping_a_conversation_going/","[]","False"
"1","","","{}","http://www.reddit.com/api/info/","{}","{}","False","","","False","Quanster","","","","False","1421596230.0","1421596230.0","","self.askgaybros","0","False","0","True","False","2su52l","True","","","","","","{}","[]","t3_2su52l","45","","False","http://www.reddit.com/r/askgaybros/comments/2su52l/would_you_get_a_prenuptial_if_you_get_married_and/","Unauthenticated reddit sesssion","","False","14","","{}","Prenuptial agreements seem to be the in-thing these days. I wonder if it ever come cross across your mind and in your discussion with you partners.


","&lt;!-- SC_OFF --&gt;&lt;div class=""md""&gt;&lt;p&gt;Prenuptial agreements seem to be the in-thing these days. I wonder if it ever come cross across your mind and in your discussion with you partners.&lt;/p&gt;
&lt;/div&gt;&lt;!-- SC_ON --&gt;","False","askgaybros","t5_2vgfw","","","Would you get a prenuptial if you get married? And why so?","14","http://www.reddit.com/r/askgaybros/comments/2su52l/would_you_get_a_prenuptial_if_you_get_married_and/","[]","False"
"2","","","{}","http://www.reddit.com/api/info/","{}","{}","False","","","False","analogbunny","","","","False","1421595390.0","1421595390.0","","self.askgaybros","0","False","0","True","False","2su3rv","True","","","","","","{}","[]","t3_2su3rv","14","","False","http://www.reddit.com/r/askgaybros/comments/2su3rv/wtf_does_loving_life_mean/","Unauthenticated reddit sesssion","","False","0","","{}","I see this in profiles all the time, but the meaning eludes me. It's just so damn vague. Are you anti-abortion? Are you in recovery after surviving suicide; are you a survivor of a loved one's suicide? Or are you just at a place of contentment?

It's just not a very seductive statement. I'm not sure what it means (I can guess what it *could* mean, but I specifically want to know what it *does* mean to *you*), and whatever it means, where would I or any other potential suitor fit in? ","&lt;!-- SC_OFF --&gt;&lt;div class=""md""&gt;&lt;p&gt;I see this in profiles all the time, but the meaning eludes me. It&amp;#39;s just so damn vague. Are you anti-abortion? Are you in recovery after surviving suicide; are you a survivor of a loved one&amp;#39;s suicide? Or are you just at a place of contentment?&lt;/p&gt;

&lt;p&gt;It&amp;#39;s just not a very seductive statement. I&amp;#39;m not sure what it means (I can guess what it &lt;em&gt;could&lt;/em&gt; mean, but I specifically want to know what it &lt;em&gt;does&lt;/em&gt; mean to &lt;em&gt;you&lt;/em&gt;), and whatever it means, where would I or any other potential suitor fit in? &lt;/p&gt;
&lt;/div&gt;&lt;!-- SC_ON --&gt;","False","askgaybros","t5_2vgfw","","","wtf does ""loving life"" mean?!","0","http://www.reddit.com/r/askgaybros/comments/2su3rv/wtf_does_loving_life_mean/","[]","False"
"3","","","{}","http://www.reddit.com/api/info/","{}","{}","False","","","False","notahitandrun","","","","False","1421590626.0","1421590626.0","","self.askgaybros","0","1421591298.0","0","True","False","2stxh7","True","","","","","","{}","[]","t3_2stxh7","9","","False","http://www.reddit.com/r/askgaybros/comments/2stxh7/is_it_ok_to_use_the_topbottom_preference_in/","Unauthenticated reddit sesssion","","False","7","","{}","Had incompatibility dating other Tops or those wanting fully Vers. I got sick of assumptions and being asked (I look younger than my age - boyish face)... 

I'm into dating/intimacy/something ongoing. I realize apps like Jack'd, Scruff, Grindr are more sexually based... 
But if your a gay bro in the burbs and not into the bar scene this is how you meet potentials and they are what you make of them, I'm 35 and grew up here in the SF Bay Area Suburbs (not fresh meat).

Profile(s): looking for a coffee date or a hike, that I'm a grad student and some interests. Even my tribes or whatever say Dating &amp; Relationship. My pic(s) are face pics. I've had some guys mention they use it as a matching tool, others take it sexually. 

At the bottom of my profile(s):

""LTR-Oriented-Top &lt;Grindr&gt; 

""Top for compatibility (LTR / Intimacy Oriented) ; &lt;Scruff, Jack'd, Tinder, OKcupid - answered those related questions&gt;."" 

I've asked these app developers to meet IOS strict TOS w/ up down and sideways arrows for a app filter. 
Do you feel its ok or does it send the wrong message and should I simply remove it? How would a dating minded guy look at that in someones profile. Is that the wrong thing to put on OKcupid?","&lt;!-- SC_OFF --&gt;&lt;div class=""md""&gt;&lt;p&gt;Had incompatibility dating other Tops or those wanting fully Vers. I got sick of assumptions and being asked (I look younger than my age - boyish face)... &lt;/p&gt;

&lt;p&gt;I&amp;#39;m into dating/intimacy/something ongoing. I realize apps like Jack&amp;#39;d, Scruff, Grindr are more sexually based... 
But if your a gay bro in the burbs and not into the bar scene this is how you meet potentials and they are what you make of them, I&amp;#39;m 35 and grew up here in the SF Bay Area Suburbs (not fresh meat).&lt;/p&gt;

&lt;p&gt;Profile(s): looking for a coffee date or a hike, that I&amp;#39;m a grad student and some interests. Even my tribes or whatever say Dating &amp;amp; Relationship. My pic(s) are face pics. I&amp;#39;ve had some guys mention they use it as a matching tool, others take it sexually. &lt;/p&gt;

&lt;p&gt;At the bottom of my profile(s):&lt;/p&gt;

&lt;p&gt;&amp;quot;LTR-Oriented-Top &amp;lt;Grindr&amp;gt; &lt;/p&gt;

&lt;p&gt;&amp;quot;Top for compatibility (LTR / Intimacy Oriented) ; &amp;lt;Scruff, Jack&amp;#39;d, Tinder, OKcupid - answered those related questions&amp;gt;.&amp;quot; &lt;/p&gt;

&lt;p&gt;I&amp;#39;ve asked these app developers to meet IOS strict TOS w/ up down and sideways arrows for a app filter. 
Do you feel its ok or does it send the wrong message and should I simply remove it? How would a dating minded guy look at that in someones profile. Is that the wrong thing to put on OKcupid?&lt;/p&gt;
&lt;/div&gt;&lt;!-- SC_ON --&gt;","False","askgaybros","t5_2vgfw","","","Is It OK to Use the Top/Bottom Preference in Dating Profiles and Apps?","7","http://www.reddit.com/r/askgaybros/comments/2stxh7/is_it_ok_to_use_the_topbottom_preference_in/","[]","False"
"4","","","{}","http://www.reddit.com/api/info/","{}","{}","False","","","False","Beginners_lucky","","","","False","1421588570.0","1421588570.0","","self.askgaybros","0","False","0","True","False","2stv78","True","","","","","","{}","[]","t3_2stv78","21","","False","http://www.reddit.com/r/askgaybros/comments/2stv78/askgaybros_convince_me_on_why_i_should_have_gay/","Unauthenticated reddit sesssion","","False","0","","{}","I met a guy on Craigslist he's 24 and I'm 19. After sending emails to each other we decided to skype. We talked, showed dicks, wank etc you know guy stuff. He invited me to come have sex with him and we live quit close to each other. After dicussing the crazy nasty shit we can do I called it a night and told him we can talk about it another day. I'm a straight dude who's still a Virgin but always been a fantasy to bang a guy. Convince me gaybros! Sounds like a lot of fun but im chicken!","&lt;!-- SC_OFF --&gt;&lt;div class=""md""&gt;&lt;p&gt;I met a guy on Craigslist he&amp;#39;s 24 and I&amp;#39;m 19. After sending emails to each other we decided to skype. We talked, showed dicks, wank etc you know guy stuff. He invited me to come have sex with him and we live quit close to each other. After dicussing the crazy nasty shit we can do I called it a night and told him we can talk about it another day. I&amp;#39;m a straight dude who&amp;#39;s still a Virgin but always been a fantasy to bang a guy. Convince me gaybros! Sounds like a lot of fun but im chicken!&lt;/p&gt;
&lt;/div&gt;&lt;!-- SC_ON --&gt;","False","askgaybros","t5_2vgfw","","","Askgaybros convince me on why I should have gay sex for the first time.","0","http://www.reddit.com/r/askgaybros/comments/2stv78/askgaybros_convince_me_on_why_i_should_have_gay/","[]","False"
"5","","","{}","http://www.reddit.com/api/info/","{}","{}","False","","","False","danielwhack","","","","False","1421587986.0","1421587986.0","","self.askgaybros","0","False","0","True","False","2stujx","True","","","","","","{}","[]","t3_2stujx","17","","False","http://www.reddit.com/r/askgaybros/comments/2stujx/going_through_a_phase/","Unauthenticated reddit sesssion","","False","4","","{}","I came out too late to be accused of going through a teenage 'phase' so I cheerfully avoided that cliche accusation that, to me anyway, seemed to be a ubiquitous stock response whenever homosexuality was mentioned on TV. The setup would always include distressed father or instructive religious leader who would console with the faithful reassurance that straight boys are known to go through 'phases' that they eventually grow out of before pulling their socks up and growing into fully heterosexual men.
Is this true for any of you growing up? Did anybody ever know of a now throughly heterosexual guy who in their formative years genuinely believed they were gay? I'm not talking here about the bi-curious or the simply sexually awkward, I mean full on gaybros, erections and all, who just grew out of it?  ","&lt;!-- SC_OFF --&gt;&lt;div class=""md""&gt;&lt;p&gt;I came out too late to be accused of going through a teenage &amp;#39;phase&amp;#39; so I cheerfully avoided that cliche accusation that, to me anyway, seemed to be a ubiquitous stock response whenever homosexuality was mentioned on TV. The setup would always include distressed father or instructive religious leader who would console with the faithful reassurance that straight boys are known to go through &amp;#39;phases&amp;#39; that they eventually grow out of before pulling their socks up and growing into fully heterosexual men.
Is this true for any of you growing up? Did anybody ever know of a now throughly heterosexual guy who in their formative years genuinely believed they were gay? I&amp;#39;m not talking here about the bi-curious or the simply sexually awkward, I mean full on gaybros, erections and all, who just grew out of it?  &lt;/p&gt;
&lt;/div&gt;&lt;!-- SC_ON --&gt;","False","askgaybros","t5_2vgfw","","","""Going through a phase""","4","http://www.reddit.com/r/askgaybros/comments/2stujx/going_through_a_phase/","[]","False"
"6","","","{}","http://www.reddit.com/api/info/","{}","{}","False","","","False","TrialByOrdeal","","","","False","1421571331.0","1421571331.0","","self.askgaybros","0","False","0","True","False","2stg5h","True","","","","","","{}","[]","t3_2stg5h","22","","False","http://www.reddit.com/r/askgaybros/comments/2stg5h/help_with_butt_practice_tips_and_advice_needed/","Unauthenticated reddit sesssion","","False","1","","{}","Hi my fellow gayBros, 

I am in need of a bit of advice regarding anal sex. So I am somewhat new to the world of bottoming and basically, I am having trouble with taking longer dicks. I start to get a jabbing pain when it's so far in and have to get them to slow down.  I have wondered if this is just a problem with practice? Girth doesn't seem to be too much of a problem (or atleast in my experience so far) its the length which is getting problematic. 

With respect to practicing myself, I have slowly moved from fingers &gt; multiples of them &gt; small toys and I'm onto a medium size toy now. And the same problem has arisen - I get so far and it starts to pain like the sensation of jabbing.

I really need some social support on this one. Have other people dealt with something similar or experienced it themselves? What might be some tips or things I should try? Also, I have to say it's pretty frustrating at the moment, the will is there but the body is saying otherwise...for now anyway.  

Cheers guys! 

  ","&lt;!-- SC_OFF --&gt;&lt;div class=""md""&gt;&lt;p&gt;Hi my fellow gayBros, &lt;/p&gt;

&lt;p&gt;I am in need of a bit of advice regarding anal sex. So I am somewhat new to the world of bottoming and basically, I am having trouble with taking longer dicks. I start to get a jabbing pain when it&amp;#39;s so far in and have to get them to slow down.  I have wondered if this is just a problem with practice? Girth doesn&amp;#39;t seem to be too much of a problem (or atleast in my experience so far) its the length which is getting problematic. &lt;/p&gt;

&lt;p&gt;With respect to practicing myself, I have slowly moved from fingers &amp;gt; multiples of them &amp;gt; small toys and I&amp;#39;m onto a medium size toy now. And the same problem has arisen - I get so far and it starts to pain like the sensation of jabbing.&lt;/p&gt;

&lt;p&gt;I really need some social support on this one. Have other people dealt with something similar or experienced it themselves? What might be some tips or things I should try? Also, I have to say it&amp;#39;s pretty frustrating at the moment, the will is there but the body is saying otherwise...for now anyway.  &lt;/p&gt;

&lt;p&gt;Cheers guys! &lt;/p&gt;
&lt;/div&gt;&lt;!-- SC_ON --&gt;","False","askgaybros","t5_2vgfw","","","Help with Butt Practice (tips and advice needed)","1","http://www.reddit.com/r/askgaybros/comments/2stg5h/help_with_butt_practice_tips_and_advice_needed/","[]","False"
"7","","","{}","http://www.reddit.com/api/info/","{}","{}","False","","","False","henrytheIXth","","","","False","1421561201.0","1421561201.0","","self.askgaybros","0","False","0","True","False","2st52g","True","","","","","","{}","[]","t3_2st52g","5","","False","http://www.reddit.com/r/askgaybros/comments/2st52g/how_many_gays_are_flamboyant_and_super_fabulous/","Unauthenticated reddit sesssion","","False","0","","{}","","","False","askgaybros","t5_2vgfw","","","How many gays are flamboyant and super fabulous and how many (percentage wise, I guess) are quiet and chill about it?","0","http://www.reddit.com/r/askgaybros/comments/2st52g/how_many_gays_are_flamboyant_and_super_fabulous/","[]","False"
