"","_comment_sort","_comments","_comments_by_id","_info_url","_orphaned","_params","_replaced_more","_underscore_names","approved_by","archived","author","author_flair_css_class","author_flair_text","banned_by","clicked","created","created_utc","distinguished","domain","downs","edited","gilded","has_fetched","hidden","id","is_self","json_dict","likes","link_flair_css_class","link_flair_text","media","media_embed","mod_reports","name","num_comments","num_reports","over_18","permalink","reddit_session","report_reasons","saved","score","secure_media","secure_media_embed","selftext","selftext_html","stickied","subreddit","subreddit_id","suggested_sort","thumbnail","title","ups","url","user_reports","visited"
"8","","","{}","http://www.reddit.com/api/info/","{}","{}","False","","","False","Reallycute-Dragon","","","","False","1425190032.0","1425190032.0","","self.askgaybros","0","False","0","True","False","2xjey8","True","","","","","","{}","[]","t3_2xjey8","7","","False","http://www.reddit.com/r/askgaybros/comments/2xjey8/getting_rid_of_friends/","Unauthenticated reddit sesssion","","False","5","","{}","I'm on the brink of ditch my two only friends. I've know them since mid high school and we kept in touch. However nothing of much good ever seems to come of it. Once in a while we meet up or play games on line but it always seems very one sided. When ever I suggest playing a game on a Friday might I seem to be largely ignored. On the flip side when ever one of them wants to do something I'm expected to respond instantly. Often they call up late at night when I have class the next day and get prissy at me when I need to sleep. On the flip side some times this is my only chance to play with them for weeks and relive some of the stress that is messing with me. 

When we do play I always end up feeling like a third wheel....... All this ends up doing is making me fell  really shity and some times like it's all my fault. All I want is to play video games with good friends to relive stress..... I mean that's not too much to ask of friends right? I'm not sure where to start making new friends and my worst fear is that this is as good as it's going to get....    I'm on the edge of ditching them but some how I feel S of I'm the one in the wrong. 

I'm just not sure what to do at this point and my feelings are a mess and I just had a break down...... Thanks to any Bros that read that wall of text.","&lt;!-- SC_OFF --&gt;&lt;div class=""md""&gt;&lt;p&gt;I&amp;#39;m on the brink of ditch my two only friends. I&amp;#39;ve know them since mid high school and we kept in touch. However nothing of much good ever seems to come of it. Once in a while we meet up or play games on line but it always seems very one sided. When ever I suggest playing a game on a Friday might I seem to be largely ignored. On the flip side when ever one of them wants to do something I&amp;#39;m expected to respond instantly. Often they call up late at night when I have class the next day and get prissy at me when I need to sleep. On the flip side some times this is my only chance to play with them for weeks and relive some of the stress that is messing with me. &lt;/p&gt;

&lt;p&gt;When we do play I always end up feeling like a third wheel....... All this ends up doing is making me fell  really shity and some times like it&amp;#39;s all my fault. All I want is to play video games with good friends to relive stress..... I mean that&amp;#39;s not too much to ask of friends right? I&amp;#39;m not sure where to start making new friends and my worst fear is that this is as good as it&amp;#39;s going to get....    I&amp;#39;m on the edge of ditching them but some how I feel S of I&amp;#39;m the one in the wrong. &lt;/p&gt;

&lt;p&gt;I&amp;#39;m just not sure what to do at this point and my feelings are a mess and I just had a break down...... Thanks to any Bros that read that wall of text.&lt;/p&gt;
&lt;/div&gt;&lt;!-- SC_ON --&gt;","False","askgaybros","t5_2vgfw","","","Getting rid of ""friends""","5","http://www.reddit.com/r/askgaybros/comments/2xjey8/getting_rid_of_friends/","[]","False"
"9","","","{}","http://www.reddit.com/api/info/","{}","{}","False","","","False","doublejack00","","","","False","1425187624.0","1425187624.0","","self.askgaybros","0","False","0","True","False","2xjbhh","True","","","","","","{}","[]","t3_2xjbhh","9","","False","http://www.reddit.com/r/askgaybros/comments/2xjbhh/what_do_you_do_when_your_partner_has_anxiety/","Unauthenticated reddit sesssion","","False","6","","{}","I'm just curious what you do with or to your partner? I want to be supportive, but not sure how. I do not want to overstep my boundaries.","&lt;!-- SC_OFF --&gt;&lt;div class=""md""&gt;&lt;p&gt;I&amp;#39;m just curious what you do with or to your partner? I want to be supportive, but not sure how. I do not want to overstep my boundaries.&lt;/p&gt;
&lt;/div&gt;&lt;!-- SC_ON --&gt;","False","askgaybros","t5_2vgfw","","","what do you do when your partner has anxiety?","6","http://www.reddit.com/r/askgaybros/comments/2xjbhh/what_do_you_do_when_your_partner_has_anxiety/","[]","False"
"10","","","{}","http://www.reddit.com/api/info/","{}","{}","False","","","False","TimeToBeRelevant","","","","False","1425185388.0","1425185388.0","","self.askgaybros","0","False","0","True","False","2xj7wr","True","","","","","","{}","[]","t3_2xj7wr","7","","False","http://www.reddit.com/r/askgaybros/comments/2xj7wr/does_this_count/","Unauthenticated reddit sesssion","","False","2","","{}","Hi /r/AskGayBros. I had a quick question that some may consider lame.

First some background. I am in the closet and 16. OK onto the question:

I was at a party tonight and like 5 of us went to a separate room to play Truth or Dare. Another guy (straight (or in the closet) was dared to kiss me and we did. It was just a second long, and it wasn't meaningful, but does it count as a kiss?

If it does, it was my first kiss and I'm pretty torn up about it. I wanted my first kiss to be meaningful, and with someone that shares mutual feelings with me. While I do have feelings for this particular person, the kiss was not meaningful and (as far as I know) he doesn't have mutual feelings for me.

Words of advice/ comments?","&lt;!-- SC_OFF --&gt;&lt;div class=""md""&gt;&lt;p&gt;Hi &lt;a href=""/r/AskGayBros""&gt;/r/AskGayBros&lt;/a&gt;. I had a quick question that some may consider lame.&lt;/p&gt;

&lt;p&gt;First some background. I am in the closet and 16. OK onto the question:&lt;/p&gt;

&lt;p&gt;I was at a party tonight and like 5 of us went to a separate room to play Truth or Dare. Another guy (straight (or in the closet) was dared to kiss me and we did. It was just a second long, and it wasn&amp;#39;t meaningful, but does it count as a kiss?&lt;/p&gt;

&lt;p&gt;If it does, it was my first kiss and I&amp;#39;m pretty torn up about it. I wanted my first kiss to be meaningful, and with someone that shares mutual feelings with me. While I do have feelings for this particular person, the kiss was not meaningful and (as far as I know) he doesn&amp;#39;t have mutual feelings for me.&lt;/p&gt;

&lt;p&gt;Words of advice/ comments?&lt;/p&gt;
&lt;/div&gt;&lt;!-- SC_ON --&gt;","False","askgaybros","t5_2vgfw","","","Does this count?","2","http://www.reddit.com/r/askgaybros/comments/2xj7wr/does_this_count/","[]","False"
"11","","","{}","http://www.reddit.com/api/info/","{}","{}","False","","","False","thedoubleedge","","","","False","1425181848.0","1425181848.0","","self.askgaybros","0","False","0","True","False","2xj26s","True","","","","","","{}","[]","t3_2xj26s","38","","False","http://www.reddit.com/r/askgaybros/comments/2xj26s/guy_im_kind_of_seeing_is_hiv_i_really_like_him/","Unauthenticated reddit sesssion","","False","34","","{}","So I was playing around with this guy, before I reach for a condom I ask him if he has anything I should know about and he tells me he has HIV. I freak out initially (a lot), it kills the mood and I eventually leave, but now that I've relaxed I realize that was an assholish thing to do. At the same time, it bothers me that I had to ask so I don't trust him, but I recognize that it was harder for him to say anything during the moment so I feel bad for him- so many conflicting mixed feelings.

After heavily thinking about it, I realize that if all things were equal and he was HIV- I would be dating him. He's really cool, but I don't know if anybody is worth the risk. But then I realized that I don't even know what the risk REALLY is for me specifically (how about when I get a sore, what about just rubbing my dick on him etc etc. Every imaginable question that could occur in a relationship). I know you can't get it from saliva etc. and my reaction was entirely due to stigma and I hate myself for how awfully I handled the scenario. But I don't know what to do right now. I don't want unnecessary risks. I don't want to live with that. 

About the scenario: I'm a top, I only ever have safe sex, he's medicated and his viral load is below detection (so he says). 

After reading a lot about this, it seems like I really have close to nothing to worry about. Would that be a fair statement to make? Do guys who fall in my category (safe tops dating HIV+ guys) really qualify as 'at risk'? I am considering dating him, so please help me: What do I need to know? ","&lt;!-- SC_OFF --&gt;&lt;div class=""md""&gt;&lt;p&gt;So I was playing around with this guy, before I reach for a condom I ask him if he has anything I should know about and he tells me he has HIV. I freak out initially (a lot), it kills the mood and I eventually leave, but now that I&amp;#39;ve relaxed I realize that was an assholish thing to do. At the same time, it bothers me that I had to ask so I don&amp;#39;t trust him, but I recognize that it was harder for him to say anything during the moment so I feel bad for him- so many conflicting mixed feelings.&lt;/p&gt;

&lt;p&gt;After heavily thinking about it, I realize that if all things were equal and he was HIV- I would be dating him. He&amp;#39;s really cool, but I don&amp;#39;t know if anybody is worth the risk. But then I realized that I don&amp;#39;t even know what the risk REALLY is for me specifically (how about when I get a sore, what about just rubbing my dick on him etc etc. Every imaginable question that could occur in a relationship). I know you can&amp;#39;t get it from saliva etc. and my reaction was entirely due to stigma and I hate myself for how awfully I handled the scenario. But I don&amp;#39;t know what to do right now. I don&amp;#39;t want unnecessary risks. I don&amp;#39;t want to live with that. &lt;/p&gt;

&lt;p&gt;About the scenario: I&amp;#39;m a top, I only ever have safe sex, he&amp;#39;s medicated and his viral load is below detection (so he says). &lt;/p&gt;

&lt;p&gt;After reading a lot about this, it seems like I really have close to nothing to worry about. Would that be a fair statement to make? Do guys who fall in my category (safe tops dating HIV+ guys) really qualify as &amp;#39;at risk&amp;#39;? I am considering dating him, so please help me: What do I need to know? &lt;/p&gt;
&lt;/div&gt;&lt;!-- SC_ON --&gt;","False","askgaybros","t5_2vgfw","","","Guy I'm kind of seeing is HIV+. I really like him, but how safe am I supposed to be?","34","http://www.reddit.com/r/askgaybros/comments/2xj26s/guy_im_kind_of_seeing_is_hiv_i_really_like_him/","[]","False"
"12","","","{}","http://www.reddit.com/api/info/","{}","{}","False","","","False","1positionmaverk","","","","False","1425179387.0","1425179387.0","","self.askgaybros","0","False","0","True","False","2xiy3d","True","","","","","","{}","[]","t3_2xiy3d","1","","False","http://www.reddit.com/r/askgaybros/comments/2xiy3d/how_to_make_certain_positions_not_hurt_while/","Unauthenticated reddit sesssion","","False","1","","{}","most positions kind of hurt for me. i can only seem to take a dick when im on my stomach. like its no pain when im lying on my stomach. but then i try going on top or doggy or missionary and it hurts. 

is it just in my head? Idk
I feel like its not gonna be very interesting sex if I literally just stay in one position the entire time 
Ive considered practicing other positions with a dildo but i have literally zero privacy at home :(
","&lt;!-- SC_OFF --&gt;&lt;div class=""md""&gt;&lt;p&gt;most positions kind of hurt for me. i can only seem to take a dick when im on my stomach. like its no pain when im lying on my stomach. but then i try going on top or doggy or missionary and it hurts. &lt;/p&gt;

&lt;p&gt;is it just in my head? Idk
I feel like its not gonna be very interesting sex if I literally just stay in one position the entire time 
Ive considered practicing other positions with a dildo but i have literally zero privacy at home :(&lt;/p&gt;
&lt;/div&gt;&lt;!-- SC_ON --&gt;","False","askgaybros","t5_2vgfw","","","how to make certain positions not hurt while bottoming?","1","http://www.reddit.com/r/askgaybros/comments/2xiy3d/how_to_make_certain_positions_not_hurt_while/","[]","False"
"13","","","{}","http://www.reddit.com/api/info/","{}","{}","False","","","False","crisbio94","","","","False","1425176863.0","1425176863.0","","self.askgaybros","0","1425177318.0","0","True","False","2xiu0b","True","","","","","","{}","[]","t3_2xiu0b","6","","False","http://www.reddit.com/r/askgaybros/comments/2xiu0b/relaxing_before_and_during_sex/","Unauthenticated reddit sesssion","","False","3","","{}","So I recently started a relationship with a guy I really like. Last night we really started going at it while watching TV and made out for god knows how long. My problem? I couldn't get an erection during the entire time. The solution I came up with was giving him oral until he orgasmed but he couldn't return the favor for obvious reasons. I was still satisfied myself but I'm afraid he thinks I wasn't.

I was a virgin, i don't know what happened. Performance anxiety, ED, something else? I don't know. I've never had an issue with getting an erection in the past but masturbation and intercourse are two different things. All i know is I don't want this to get in the way, it hasn't for now, but I'm afraid it may in the future. Any tips or ideas? Should I consult a doctor? I'm only 20.","&lt;!-- SC_OFF --&gt;&lt;div class=""md""&gt;&lt;p&gt;So I recently started a relationship with a guy I really like. Last night we really started going at it while watching TV and made out for god knows how long. My problem? I couldn&amp;#39;t get an erection during the entire time. The solution I came up with was giving him oral until he orgasmed but he couldn&amp;#39;t return the favor for obvious reasons. I was still satisfied myself but I&amp;#39;m afraid he thinks I wasn&amp;#39;t.&lt;/p&gt;

&lt;p&gt;I was a virgin, i don&amp;#39;t know what happened. Performance anxiety, ED, something else? I don&amp;#39;t know. I&amp;#39;ve never had an issue with getting an erection in the past but masturbation and intercourse are two different things. All i know is I don&amp;#39;t want this to get in the way, it hasn&amp;#39;t for now, but I&amp;#39;m afraid it may in the future. Any tips or ideas? Should I consult a doctor? I&amp;#39;m only 20.&lt;/p&gt;
&lt;/div&gt;&lt;!-- SC_ON --&gt;","False","askgaybros","t5_2vgfw","","","Relaxing before and during sex.","3","http://www.reddit.com/r/askgaybros/comments/2xiu0b/relaxing_before_and_during_sex/","[]","False"
"14","","","{}","http://www.reddit.com/api/info/","{}","{}","False","","","False","iwannatop","","","","False","1425175663.0","1425175663.0","","self.askgaybros","0","1425231356.0","0","True","False","2xis1h","True","","","","","","{}","[]","t3_2xis1h","11","","False","http://www.reddit.com/r/askgaybros/comments/2xis1h/how_many_chances_to_give_for_someone_who_flakes/","Unauthenticated reddit sesssion","","False","3","","{}","I've been talking to this guy on grindr and we set up a day to meet couple weeks ago, but then he didn't get back to me to finalize a time until the day after. He said he tried texting me but guessed it didn't go through 😒. So then this past week we set another date and a time (for coffee lunch break) to meet and the morning before I texted him to confirm. He never responded so I didn't leave to go.  A couple hours after we were supposed to meet he finally said he forgot he had jury duty and forgot to bring his phone. I told him I don't play games and to find someone else who does. But he insists he is not, and is sorry and that it won't happen again. Now he won't stop bugging me to still meet. Constantly saying how sorry he is.  Should I give him another chance? A partial saving grace stopping me from blocking him is how cute/hot his pics are I will admit hahhh

-
edit
Ok, well I got him to admit he was nervous and that's why he flaked. Still wants another chance real bad. hmm hmm.

final edit i guess...
Well.. Thanks for all the advice, I should have listened to most of you, but I break down easily. Gave him one last chance and yet another excuse rolls in an hour before the new time to meet. GOODBYE.  Do some people get off on wasting the time of others??! I haven’t encountered many flakes so maybe I’m not used to it. 

","&lt;!-- SC_OFF --&gt;&lt;div class=""md""&gt;&lt;p&gt;I&amp;#39;ve been talking to this guy on grindr and we set up a day to meet couple weeks ago, but then he didn&amp;#39;t get back to me to finalize a time until the day after. He said he tried texting me but guessed it didn&amp;#39;t go through 😒. So then this past week we set another date and a time (for coffee lunch break) to meet and the morning before I texted him to confirm. He never responded so I didn&amp;#39;t leave to go.  A couple hours after we were supposed to meet he finally said he forgot he had jury duty and forgot to bring his phone. I told him I don&amp;#39;t play games and to find someone else who does. But he insists he is not, and is sorry and that it won&amp;#39;t happen again. Now he won&amp;#39;t stop bugging me to still meet. Constantly saying how sorry he is.  Should I give him another chance? A partial saving grace stopping me from blocking him is how cute/hot his pics are I will admit hahhh&lt;/p&gt;

&lt;h2&gt;&lt;/h2&gt;

&lt;p&gt;edit
Ok, well I got him to admit he was nervous and that&amp;#39;s why he flaked. Still wants another chance real bad. hmm hmm.&lt;/p&gt;

&lt;p&gt;final edit i guess...
Well.. Thanks for all the advice, I should have listened to most of you, but I break down easily. Gave him one last chance and yet another excuse rolls in an hour before the new time to meet. GOODBYE.  Do some people get off on wasting the time of others??! I haven’t encountered many flakes so maybe I’m not used to it. &lt;/p&gt;
&lt;/div&gt;&lt;!-- SC_ON --&gt;","False","askgaybros","t5_2vgfw","","","How many chances to give for someone who flakes?","3","http://www.reddit.com/r/askgaybros/comments/2xis1h/how_many_chances_to_give_for_someone_who_flakes/","[]","False"
"15","","","{}","http://www.reddit.com/api/info/","{}","{}","False","","","False","BrokehnGlass","","","","False","1425175543.0","1425175543.0","","self.askgaybros","0","1425177027.0","0","True","False","2xiru7","True","","","","","","{}","[]","t3_2xiru7","32","","False","http://www.reddit.com/r/askgaybros/comments/2xiru7/i_absolutely_hate_being_gay_why_am_i_this_way/","Unauthenticated reddit sesssion","","False","4","","{}","This is going to be a long and very homophobic rant, but it truly is how I feel. I am sorry if I offend anyone, but I just need to let this all out.

I absolutely hate being gay, I hate it more than anything in the world. I feel like I'm in a bubble of my own looking out at everyone living happy straight lives. My god how I envy straight people. I look at them with such adoration, how they were born the way Mother Nature intended it to be. I feel so miserable watching how perfect it looks to me, a man and woman together, the way it's always been through time, the way we all came to be.

Nobody knows that I am gay. I live in a very homophobic family and I doubt my friends would accept me. Just so god tortures me more  I live in the most gay friendly city on the planet, New York City. 

All I think about is how dreadful the future will be when I start to see my friends getting married and having children while I'm left out on my own like I always am. How will I continue to keep this secret in the future? Every single happy moment of my life, in the back of my head, I remember that I am gay and instantly I know this happiness won't ever last. 

My parents, my friends, everyone in my life, it's all just fake. If they ever knew I was gay they would treat me differently. I would always be that ""gay"" friend. I envy them so much, how normal they are. They don't need to carry this kind of burden. Hell, I've built such a straight life around me that nobody would even believe me if I came out.

I feel like if I were straight, I would be a whole person. I never function as well as I can. I never truly smile like I mean it. 

The worst part is that I've entered into relationships with girls, they would start off strong, but after awhile I would be so consumed with guilt about secretly lying to them I would put less and less effort into the relationship because I figured it's all fake anyway, and Im not normal no matter how normal I seem when I have a girlfriend. In the beginning though, it feels SO perfect.

I hate your sex obsessed culture, I hate your ""sassy gay"" way of talking, I hate your vanity, I don't want to be part of it! I'm not a twink! Or a bottom! Or a top!

I hate that I don't see men as romantic partners, only sexual ones. I hate anal sex, I hate how I feel after masturbating to gay porn. I hate that there is no light at the end of the tunnel. I'm 21 years old, I want to be out meeting girls, having fun, living life. Gay people are such a small percentage of the population, WHY the hell did I have to end up this way? ","&lt;!-- SC_OFF --&gt;&lt;div class=""md""&gt;&lt;p&gt;This is going to be a long and very homophobic rant, but it truly is how I feel. I am sorry if I offend anyone, but I just need to let this all out.&lt;/p&gt;

&lt;p&gt;I absolutely hate being gay, I hate it more than anything in the world. I feel like I&amp;#39;m in a bubble of my own looking out at everyone living happy straight lives. My god how I envy straight people. I look at them with such adoration, how they were born the way Mother Nature intended it to be. I feel so miserable watching how perfect it looks to me, a man and woman together, the way it&amp;#39;s always been through time, the way we all came to be.&lt;/p&gt;

&lt;p&gt;Nobody knows that I am gay. I live in a very homophobic family and I doubt my friends would accept me. Just so god tortures me more  I live in the most gay friendly city on the planet, New York City. &lt;/p&gt;

&lt;p&gt;All I think about is how dreadful the future will be when I start to see my friends getting married and having children while I&amp;#39;m left out on my own like I always am. How will I continue to keep this secret in the future? Every single happy moment of my life, in the back of my head, I remember that I am gay and instantly I know this happiness won&amp;#39;t ever last. &lt;/p&gt;

&lt;p&gt;My parents, my friends, everyone in my life, it&amp;#39;s all just fake. If they ever knew I was gay they would treat me differently. I would always be that &amp;quot;gay&amp;quot; friend. I envy them so much, how normal they are. They don&amp;#39;t need to carry this kind of burden. Hell, I&amp;#39;ve built such a straight life around me that nobody would even believe me if I came out.&lt;/p&gt;

&lt;p&gt;I feel like if I were straight, I would be a whole person. I never function as well as I can. I never truly smile like I mean it. &lt;/p&gt;

&lt;p&gt;The worst part is that I&amp;#39;ve entered into relationships with girls, they would start off strong, but after awhile I would be so consumed with guilt about secretly lying to them I would put less and less effort into the relationship because I figured it&amp;#39;s all fake anyway, and Im not normal no matter how normal I seem when I have a girlfriend. In the beginning though, it feels SO perfect.&lt;/p&gt;

&lt;p&gt;I hate your sex obsessed culture, I hate your &amp;quot;sassy gay&amp;quot; way of talking, I hate your vanity, I don&amp;#39;t want to be part of it! I&amp;#39;m not a twink! Or a bottom! Or a top!&lt;/p&gt;

&lt;p&gt;I hate that I don&amp;#39;t see men as romantic partners, only sexual ones. I hate anal sex, I hate how I feel after masturbating to gay porn. I hate that there is no light at the end of the tunnel. I&amp;#39;m 21 years old, I want to be out meeting girls, having fun, living life. Gay people are such a small percentage of the population, WHY the hell did I have to end up this way? &lt;/p&gt;
&lt;/div&gt;&lt;!-- SC_ON --&gt;","False","askgaybros","t5_2vgfw","","","I absolutely hate being gay. Why am I this way?","4","http://www.reddit.com/r/askgaybros/comments/2xiru7/i_absolutely_hate_being_gay_why_am_i_this_way/","[]","False"
"16","","","{}","http://www.reddit.com/api/info/","{}","{}","False","","","False","TrentonDucati","","","","False","1425174472.0","1425174472.0","","i.imgur.com","0","False","0","True","False","2xiq1f","False","","","","","","{}","[]","t3_2xiq1f","5","","False","http://www.reddit.com/r/askgaybros/comments/2xiq1f/whats_up_guys_wwwducatiporncom/","Unauthenticated reddit sesssion","","False","0","","{}","","","False","askgaybros","t5_2vgfw","","","What's up guys. Www.Ducatiporn.com","0","http://i.imgur.com/acpF62f.png","[]","False"
