"","_comment_sort","_comments","_comments_by_id","_info_url","_orphaned","_params","_replaced_more","_underscore_names","approved_by","archived","author","author_flair_css_class","author_flair_text","banned_by","clicked","created","created_utc","distinguished","domain","downs","edited","gilded","has_fetched","hidden","id","is_self","json_dict","likes","link_flair_css_class","link_flair_text","media","media_embed","mod_reports","name","num_comments","num_reports","over_18","permalink","reddit_session","report_reasons","saved","score","secure_media","secure_media_embed","selftext","selftext_html","stickied","subreddit","subreddit_id","suggested_sort","thumbnail","title","ups","url","user_reports","visited"
"20","","","{}","http://www.reddit.com/api/info/","{}","{}","False","","","False","youtbuddcody","","","","False","1418755186.0","1418755186.0","","self.askgaybros","0","1418755405.0","0","True","False","2phqx9","True","","","","","","{}","[]","t3_2phqx9","82","","False","http://www.reddit.com/r/askgaybros/comments/2phqx9/gay_christians_of_gaybros_someone_i_love_is_using/","Unauthenticated reddit sesssion","","False","39","","{}","Hi. I find comfort in this subreddit so I hope it's okay to take this here.

**Where I'm at religiously:** 

I consider myself a gay Christian. I believe in God, more especially in Jesus, and believe in the word in Jesus. Belivening in Jesus gives me a great deal of confort, especially since I suffer from depression and anxiety. I try and pray every night, and I believe that God has helped me stay alive up to this point (especially when I was contemplating suicide earlier in my life). I know this can sound like BS at times, but I feel like God has answered my prayers. When I first came out, I prayed to him to guide me in any direction to help me out. I stumbled upon this subreddit the next day. I'm lonely and I used to pray to God to give me a friend, especially one that I can connect with. Well, I just made a friend and we click, and have a lot of the same interests. I'm completely aware that this sounds like BS, but I believe it.

**Coming out is my mother:**

It's just my mom and I. Other family has either died (like my dad) or lives too far away. 
When I told her I like guys, she took it very hard. She cried, stated she has no family, and said I was going to hell. I tried to ignore it, and I've distanced myself from her a lot this past week. I can't be open to her. And financially, I'm unable to move out at the time.

So today, she sat by me on the couch, and asked me if I saw the music video to 'Take me to Church'. I havent, but she told me what it always about. I told her I thought it was sad, and it's wrong that happened in it. We then got into how society views gay people, and she said, ""Why do you think gays have their own community? Oh, it's becaue society has distanced their self from gay people? Well, what does that tell you? It's wrong and unnatural. It's wrong.""

She then mentioned the bible, and I reminded her that Jesus was the law and he didn't talk about any of that kind of stuff. She then said, ""it's still wrong and you know it. I bet you can't resite the 10 commandments, so quit trying to act like you know so much about the subject."" 

After having a small argument with her by telling her she was rude and she ws wrong for judging me, she said, ""I'm not judging you. It's just my view point. And if it's not such a big deal, then why don't you tell your grandparents? Why don't you tell other family?"" I told her it was none of their business, and then she said that I'm evil. 

I went to my room and I'm now in tears. This is the first time she's insulted me or my sexuality, and I don't know what to do. She doesn't want to be logical about anything. The only person I have left in my life is using God against me, and it's killing me. I feel worthless, and I've been thinking about suicide. No one would miss me, and it seems a lot easier.
","&lt;!-- SC_OFF --&gt;&lt;div class=""md""&gt;&lt;p&gt;Hi. I find comfort in this subreddit so I hope it&amp;#39;s okay to take this here.&lt;/p&gt;

&lt;p&gt;&lt;strong&gt;Where I&amp;#39;m at religiously:&lt;/strong&gt; &lt;/p&gt;

&lt;p&gt;I consider myself a gay Christian. I believe in God, more especially in Jesus, and believe in the word in Jesus. Belivening in Jesus gives me a great deal of confort, especially since I suffer from depression and anxiety. I try and pray every night, and I believe that God has helped me stay alive up to this point (especially when I was contemplating suicide earlier in my life). I know this can sound like BS at times, but I feel like God has answered my prayers. When I first came out, I prayed to him to guide me in any direction to help me out. I stumbled upon this subreddit the next day. I&amp;#39;m lonely and I used to pray to God to give me a friend, especially one that I can connect with. Well, I just made a friend and we click, and have a lot of the same interests. I&amp;#39;m completely aware that this sounds like BS, but I believe it.&lt;/p&gt;

&lt;p&gt;&lt;strong&gt;Coming out is my mother:&lt;/strong&gt;&lt;/p&gt;

&lt;p&gt;It&amp;#39;s just my mom and I. Other family has either died (like my dad) or lives too far away. 
When I told her I like guys, she took it very hard. She cried, stated she has no family, and said I was going to hell. I tried to ignore it, and I&amp;#39;ve distanced myself from her a lot this past week. I can&amp;#39;t be open to her. And financially, I&amp;#39;m unable to move out at the time.&lt;/p&gt;

&lt;p&gt;So today, she sat by me on the couch, and asked me if I saw the music video to &amp;#39;Take me to Church&amp;#39;. I havent, but she told me what it always about. I told her I thought it was sad, and it&amp;#39;s wrong that happened in it. We then got into how society views gay people, and she said, &amp;quot;Why do you think gays have their own community? Oh, it&amp;#39;s becaue society has distanced their self from gay people? Well, what does that tell you? It&amp;#39;s wrong and unnatural. It&amp;#39;s wrong.&amp;quot;&lt;/p&gt;

&lt;p&gt;She then mentioned the bible, and I reminded her that Jesus was the law and he didn&amp;#39;t talk about any of that kind of stuff. She then said, &amp;quot;it&amp;#39;s still wrong and you know it. I bet you can&amp;#39;t resite the 10 commandments, so quit trying to act like you know so much about the subject.&amp;quot; &lt;/p&gt;

&lt;p&gt;After having a small argument with her by telling her she was rude and she ws wrong for judging me, she said, &amp;quot;I&amp;#39;m not judging you. It&amp;#39;s just my view point. And if it&amp;#39;s not such a big deal, then why don&amp;#39;t you tell your grandparents? Why don&amp;#39;t you tell other family?&amp;quot; I told her it was none of their business, and then she said that I&amp;#39;m evil. &lt;/p&gt;

&lt;p&gt;I went to my room and I&amp;#39;m now in tears. This is the first time she&amp;#39;s insulted me or my sexuality, and I don&amp;#39;t know what to do. She doesn&amp;#39;t want to be logical about anything. The only person I have left in my life is using God against me, and it&amp;#39;s killing me. I feel worthless, and I&amp;#39;ve been thinking about suicide. No one would miss me, and it seems a lot easier.&lt;/p&gt;
&lt;/div&gt;&lt;!-- SC_ON --&gt;","False","askgaybros","t5_2vgfw","","","Gay Christians of Gaybros, someone I love is using God against me and I could really use some advice.","39","http://www.reddit.com/r/askgaybros/comments/2phqx9/gay_christians_of_gaybros_someone_i_love_is_using/","[]","False"
"21","","","{}","http://www.reddit.com/api/info/","{}","{}","False","","","False","123space_go","","","","False","1418753968.0","1418753968.0","","self.askgaybros","0","False","0","True","False","2phod7","True","","","","","","{}","[]","t3_2phod7","21","","False","http://www.reddit.com/r/askgaybros/comments/2phod7/meeting_guys_in_public/","Unauthenticated reddit sesssion","","False","18","","{}","So I'm usually pretty outgoing and like meeting new people but I've realized I don't know how to hit on guys in public. (I've also recently started being more open with my sexuality) On grindr and other apps I'm pretty chatty and when I decide to meet whomever I was chatting with I'm equally as chatty. But when I see someone that I think is cute in public, I dont know how to approach them. I'd like to start meeting people without the aid of the internet. Any thoughts or advice? I appreciate it, guys!

(On an unrelated note this is my first original post [besides a couple of comments], if you guys care).","&lt;!-- SC_OFF --&gt;&lt;div class=""md""&gt;&lt;p&gt;So I&amp;#39;m usually pretty outgoing and like meeting new people but I&amp;#39;ve realized I don&amp;#39;t know how to hit on guys in public. (I&amp;#39;ve also recently started being more open with my sexuality) On grindr and other apps I&amp;#39;m pretty chatty and when I decide to meet whomever I was chatting with I&amp;#39;m equally as chatty. But when I see someone that I think is cute in public, I dont know how to approach them. I&amp;#39;d like to start meeting people without the aid of the internet. Any thoughts or advice? I appreciate it, guys!&lt;/p&gt;

&lt;p&gt;(On an unrelated note this is my first original post [besides a couple of comments], if you guys care).&lt;/p&gt;
&lt;/div&gt;&lt;!-- SC_ON --&gt;","False","askgaybros","t5_2vgfw","","","Meeting guys in public","18","http://www.reddit.com/r/askgaybros/comments/2phod7/meeting_guys_in_public/","[]","False"
"22","","","{}","http://www.reddit.com/api/info/","{}","{}","False","","","False","QYLLMM","","","","False","1418747785.0","1418747785.0","","self.askgaybros","0","1418748158.0","0","True","False","2phbk7","True","","","","","","{}","[]","t3_2phbk7","7","","False","http://www.reddit.com/r/askgaybros/comments/2phbk7/just_found_out_a_guy_cheated_on_his_boyfriend/","Unauthenticated reddit sesssion","","False","7","","{}","Sorry if this post is messy / not relevant for this subreddit, but I'm a bit confused and don't really know what to do.

So, some months ago I hooked up with a guy. He wasn't a stranger, he works in a bar that my friends and I often go to, and we'd had more than a few chats. Anyway, at one point he asks me if I'd like to meet one day and fool around a bit. He's hot and a nice guy, so I say yes. He says he's got a boyfriend but they're in an open relationship. Cool. So we meet a few times until I have to leave for college.

Now, since I'm going back home in a few days, he asks me if I'd like to meet again and he also says it'd be fun to have a threesome with his boyfriend, and I reply I'm up for it. After a few minutes, he casually slips into the conversation: ""And, by the way, my boyfriend mustn't know we had sex.""

So, right now I don't feel great. I'm angry at him for not telling me what I was getting into, I'm angry at myself for possibly being a bit naive and I feel really bad for being ""the other guy"".

What should I do now? Should I confront him? Should I tell his boyfriend, whom I've never met? Is it, at least partially, my fault? Is this even cheating? Am I overreacting? I've never been in this kind of situation before and I'm really quite confused...","&lt;!-- SC_OFF --&gt;&lt;div class=""md""&gt;&lt;p&gt;Sorry if this post is messy / not relevant for this subreddit, but I&amp;#39;m a bit confused and don&amp;#39;t really know what to do.&lt;/p&gt;

&lt;p&gt;So, some months ago I hooked up with a guy. He wasn&amp;#39;t a stranger, he works in a bar that my friends and I often go to, and we&amp;#39;d had more than a few chats. Anyway, at one point he asks me if I&amp;#39;d like to meet one day and fool around a bit. He&amp;#39;s hot and a nice guy, so I say yes. He says he&amp;#39;s got a boyfriend but they&amp;#39;re in an open relationship. Cool. So we meet a few times until I have to leave for college.&lt;/p&gt;

&lt;p&gt;Now, since I&amp;#39;m going back home in a few days, he asks me if I&amp;#39;d like to meet again and he also says it&amp;#39;d be fun to have a threesome with his boyfriend, and I reply I&amp;#39;m up for it. After a few minutes, he casually slips into the conversation: &amp;quot;And, by the way, my boyfriend mustn&amp;#39;t know we had sex.&amp;quot;&lt;/p&gt;

&lt;p&gt;So, right now I don&amp;#39;t feel great. I&amp;#39;m angry at him for not telling me what I was getting into, I&amp;#39;m angry at myself for possibly being a bit naive and I feel really bad for being &amp;quot;the other guy&amp;quot;.&lt;/p&gt;

&lt;p&gt;What should I do now? Should I confront him? Should I tell his boyfriend, whom I&amp;#39;ve never met? Is it, at least partially, my fault? Is this even cheating? Am I overreacting? I&amp;#39;ve never been in this kind of situation before and I&amp;#39;m really quite confused...&lt;/p&gt;
&lt;/div&gt;&lt;!-- SC_ON --&gt;","False","askgaybros","t5_2vgfw","","","Just found out a guy cheated (?) on his boyfriend with me","7","http://www.reddit.com/r/askgaybros/comments/2phbk7/just_found_out_a_guy_cheated_on_his_boyfriend/","[]","False"
"23","","","{}","http://www.reddit.com/api/info/","{}","{}","False","","","False","ManWhoLikesMen","","","","False","1418746268.0","1418746268.0","","self.askgaybros","0","False","0","True","False","2ph8qe","True","","","","","","{}","[]","t3_2ph8qe","91","","False","http://www.reddit.com/r/askgaybros/comments/2ph8qe/gaybros_finish_the_sentence_i_love_when_my/","Unauthenticated reddit sesssion","","False","26","","{}","","","False","askgaybros","t5_2vgfw","","","GayBros - Finish the sentence: I love when my boyfriend ______________ .","26","http://www.reddit.com/r/askgaybros/comments/2ph8qe/gaybros_finish_the_sentence_i_love_when_my/","[]","False"
