"","_comment_sort","_comments","_comments_by_id","_info_url","_orphaned","_params","_replaced_more","_underscore_names","approved_by","archived","author","author_flair_css_class","author_flair_text","banned_by","clicked","created","created_utc","distinguished","domain","downs","edited","gilded","has_fetched","hidden","id","is_self","json_dict","likes","link_flair_css_class","link_flair_text","media","media_embed","mod_reports","name","num_comments","num_reports","over_18","permalink","reddit_session","report_reasons","saved","score","secure_media","secure_media_embed","selftext","selftext_html","stickied","subreddit","subreddit_id","suggested_sort","thumbnail","title","ups","url","user_reports","visited"
"15","","","{}","http://www.reddit.com/api/info/","{}","{}","False","","","False","Catozzim","","","","False","1415604632.0","1415604632.0","","self.askgaybros","0","False","0","True","False","2lu9xd","True","","","","","","{}","[]","t3_2lu9xd","12","","False","http://www.reddit.com/r/askgaybros/comments/2lu9xd/was_my_boyfriends_reason_for_dumping_me_justified/","Unauthenticated reddit sesssion","","False","2","","{}","Okay so I'm coming out of lurking on Reddit for this post. I'm really sorry for it being extremely long, so there's a tl;dr at the end for your reading pleasure.  I'm not entirely sure if this is the right sub to post to, but I'll give it a shot.  
So this post is about the relationship I was in and how it just ended.  I'm just wondering if his reasoning for breaking it off is justified or if it’s an overreaction on his part and I'm asking you guys for your opinion.

Some background info before the actual stuff about my break-up.  I have a friend, let’s call him Nick. Nick is 21.  We became friends a couple months ago when I moved to university.  Nick's gay and our friendship quickly became something beyond just friends.  The thing is, I soon realized I didn't like Nick like that and would rather just be friends, which he totally understood and said he felt the same way.  This was a good three months ago.  We've been great friends ever since.  

Now, the guy I was seeing, let’s call him Alex, and I went out on Saturday.  We hung out at my dorm, watched some TV, and talked.  During this time, I got two texts from Nick asking if I was on campus (cause I sometimes go home on the weekends seeing that I live not too far from the uni) and then if I wanted to hang out.  I didn't answer his texts cause I didn't want to seem rude by texting while being with Alex. He then sent me a third text saying how he forgot I had told him I was on a date tonight and he apologized.  Alex saw me read the texts and asked who it was.  I, not thinking it would be of any problem what-so-ever, said it was my friend Nick and then proceeded to explain how I met him and basically everything I just explained above pertaining to my history with Nick.  In hindsight, it was probably not my best move bringing up past hookups, but Alex had done the same on an earlier date, so I didn't think twice of it.  We then left for dinner.  We had a great time at dinner and Alex dropped me back off at my dorm because he had to get to one of his friend’s birthday parties, which I politely declined going to and which he understood.  Back to the break-up.
I started seeing Alex two weeks ago.  He's the first guy that I would say I have been in a true ""relationship"", granted only for two weeks.  It was great.  He liked the same things as me, we texted each other constantly, we talked on the phone for hours, and he even surprised me by coming to my dorm after I got back from my late night chem exam.  One thing he did not like was Nick, but I didn't know that until it was too late.  

Fast forward to the next day. I wake up and text Alex.  We talk for a bit, until I get a text from Nick asking if I wanted to hang out.  I said sure and he said he'd be over in in 10 minutes.  I told Alex I was going to go take a shower because I was going to hang out with a friend.  I take a shower, I hang out with Nick, and now, after Nick has left, I text Alex back.  This is where things start to go downhill.  He asks what I've been up to and I say I hung out with Nick. I asked him how the party was, which then got me a rather simple, and obviously passive-aggressive remark.  He sounded annoyed so I ask him if he was mad about something.  He then goes on to say how he “doesn't get why I hang out with him [Nick]”. He asks why I would text him when with my other friend, let’s call her Rebecca, but when I was with Nick I ""couldn't even text once"".  So the conversation has now jumped back to Nick and I'm kind of blind-sided by it. I didn't really know how to respond.  I go on to explain that because I've known Rebecca for a long time, us hanging out usually consisted of sitting around and doing whatever, while periodically on our phones and what not.  But with Nick, I'm usually talking about something like some show he likes and the actors in it, or I'm showing him some video on YouTube, what-have-you. Plus, on this occasion, I had gone out to lunch at an on-campus cafe with Nick because I was hungry.  Alex goes on to say that he “does not like that.”, that I'm entitled to talk to whoever I want, and that he needed some time to think about things.  I had no clue why he was saying this cause he never showed any displeasure in Nick when I mentioned him the previous evening. I knew what he was talking about and where he was coming from, but I still asked him what he ""didn't like"".  He states that he doesn't like it when I hang out with Nick because it makes him feel uncomfortable.  He then mentions how Nick was ""blowing up"" my phone during our date.  He goes on to say that it makes him uncomfortable because he feels that ""anything could happen.” I've now fully grasped what the issue was and I thought I was going to be able to fix it right then and there.  I didn't think the situation was a huge problem, just needed to reassure him that Nick and I were just friends, and we'd be on our way.  But that's not exactly what happened.
Alex goes on to say that nothing will make him not feel uncomfortable with the situation.  I said I still didn’t understand, but I was willing to do anything to make it better, and how I wish he trusted me a little bit more after I had already explained to him twice that Nick and I were strictly friends on completely mutual terms.  Alex then drilled me on what Nick and I did together when we first met, sexual stuff was specified because I knew that's what he meant.  He then told me that he was ""not going to deal with that."" He said he wasn't going to give me an ultimatum, but instead just leave.  

I'm now just staring at my phone trying to process what the hell just happened within like a 10 minute period.  I thought I had complete control of the situation. But instead, it came crashing down around me.  I'm now freaking out a little on the inside.  Not knowing what to say, I ask him what he meant by ""leave"" and he responded with ""Whatever we have is now over."" He then restates his reason being that I still talk and hang out with a guy I hooked up with.  I, being the mature person I am, tried to call him, which resulted in me being sent to voice mail early, twice.   I then sent a rather long and apologetic text finishing with a goodbye and that I'd miss him.  I thought that would be it, but I then got a very nasty and hurt-filled text about how ""Nick will be there for me... [and how] everything will be just perfect for me with him"".  I'm now an emotional wreck because I have no clue why this is happening.  It was just so out of the blue that I couldn't comprehend it.  I knew that responding back hurtfully wouldn't help the situation, but I didn't want to just leave it at that.  I responded back asking why this was a problem all of a sudden and explained, once again, how Nick and I are just friends and we hadn't done anything in months.  Alex asked me if there were things I talked about with Nick that I wouldn’t tell him, which I denied and went on to say I would never keep anything from him and that I'd tell him anything.  At this point I was just trying to hold together the remaining scraps of our relationship because I thought for some reason I could somehow make it better.  He then stated “If you can talk about the same things with me, why do you even have to be friends with him?”  I’m appalled that he would even ask that.  It would be like if one of my friends told me why I had any other friends other than them because that’s all I would need. I explain, for a final time, that Nick and I were just friends and we had met through mutual friends, back when I had first moved to uni and was looking for some new friends, seeing as most of mine had moved away to their respected universities.  I ask him if there was anything I could do to make this better, granted I knew everything was already over.  He responded very hurtfully by saying, “I think that you should start talking to Nick more.  He can see you pretty often now, which would be good for you.  You two seem to have actual conversations, so that’s a plus.  Eventually that might lead to something else.”

I'm awe struck.  I couldn’t understand how someone I thought liked me so much would just change their attitude so drastically and to then hurt me when I’m already down.  I picked up whatever was left of my dignity and pride, restated all the great things we did over the course of our short, but amazing, two weeks, and how much I liked him and how I wish I got to know him better to “have actual conversations”.  I gave a couple of minutes, and to no sign of a response from him, I said, “Goodbye, Alex.”  It was plain and simple.  I sat back for a while trying to take it all in and I surprisingly didn’t cry…too much.

Now, on to the actual question.  Do you guys think his reasoning for the break-up was justified?  If so, why? Thanks.

tl;dr – Boyfriend of two weeks dumps me solely because I still talk and hang out with a guy I hooked up with, but are now strictly friends with.  Was his reasoning for the break-up justified?
","&lt;!-- SC_OFF --&gt;&lt;div class=""md""&gt;&lt;p&gt;Okay so I&amp;#39;m coming out of lurking on Reddit for this post. I&amp;#39;m really sorry for it being extremely long, so there&amp;#39;s a tl;dr at the end for your reading pleasure.  I&amp;#39;m not entirely sure if this is the right sub to post to, but I&amp;#39;ll give it a shot.&lt;br/&gt;
So this post is about the relationship I was in and how it just ended.  I&amp;#39;m just wondering if his reasoning for breaking it off is justified or if it’s an overreaction on his part and I&amp;#39;m asking you guys for your opinion.&lt;/p&gt;

&lt;p&gt;Some background info before the actual stuff about my break-up.  I have a friend, let’s call him Nick. Nick is 21.  We became friends a couple months ago when I moved to university.  Nick&amp;#39;s gay and our friendship quickly became something beyond just friends.  The thing is, I soon realized I didn&amp;#39;t like Nick like that and would rather just be friends, which he totally understood and said he felt the same way.  This was a good three months ago.  We&amp;#39;ve been great friends ever since.  &lt;/p&gt;

&lt;p&gt;Now, the guy I was seeing, let’s call him Alex, and I went out on Saturday.  We hung out at my dorm, watched some TV, and talked.  During this time, I got two texts from Nick asking if I was on campus (cause I sometimes go home on the weekends seeing that I live not too far from the uni) and then if I wanted to hang out.  I didn&amp;#39;t answer his texts cause I didn&amp;#39;t want to seem rude by texting while being with Alex. He then sent me a third text saying how he forgot I had told him I was on a date tonight and he apologized.  Alex saw me read the texts and asked who it was.  I, not thinking it would be of any problem what-so-ever, said it was my friend Nick and then proceeded to explain how I met him and basically everything I just explained above pertaining to my history with Nick.  In hindsight, it was probably not my best move bringing up past hookups, but Alex had done the same on an earlier date, so I didn&amp;#39;t think twice of it.  We then left for dinner.  We had a great time at dinner and Alex dropped me back off at my dorm because he had to get to one of his friend’s birthday parties, which I politely declined going to and which he understood.  Back to the break-up.
I started seeing Alex two weeks ago.  He&amp;#39;s the first guy that I would say I have been in a true &amp;quot;relationship&amp;quot;, granted only for two weeks.  It was great.  He liked the same things as me, we texted each other constantly, we talked on the phone for hours, and he even surprised me by coming to my dorm after I got back from my late night chem exam.  One thing he did not like was Nick, but I didn&amp;#39;t know that until it was too late.  &lt;/p&gt;

&lt;p&gt;Fast forward to the next day. I wake up and text Alex.  We talk for a bit, until I get a text from Nick asking if I wanted to hang out.  I said sure and he said he&amp;#39;d be over in in 10 minutes.  I told Alex I was going to go take a shower because I was going to hang out with a friend.  I take a shower, I hang out with Nick, and now, after Nick has left, I text Alex back.  This is where things start to go downhill.  He asks what I&amp;#39;ve been up to and I say I hung out with Nick. I asked him how the party was, which then got me a rather simple, and obviously passive-aggressive remark.  He sounded annoyed so I ask him if he was mad about something.  He then goes on to say how he “doesn&amp;#39;t get why I hang out with him [Nick]”. He asks why I would text him when with my other friend, let’s call her Rebecca, but when I was with Nick I &amp;quot;couldn&amp;#39;t even text once&amp;quot;.  So the conversation has now jumped back to Nick and I&amp;#39;m kind of blind-sided by it. I didn&amp;#39;t really know how to respond.  I go on to explain that because I&amp;#39;ve known Rebecca for a long time, us hanging out usually consisted of sitting around and doing whatever, while periodically on our phones and what not.  But with Nick, I&amp;#39;m usually talking about something like some show he likes and the actors in it, or I&amp;#39;m showing him some video on YouTube, what-have-you. Plus, on this occasion, I had gone out to lunch at an on-campus cafe with Nick because I was hungry.  Alex goes on to say that he “does not like that.”, that I&amp;#39;m entitled to talk to whoever I want, and that he needed some time to think about things.  I had no clue why he was saying this cause he never showed any displeasure in Nick when I mentioned him the previous evening. I knew what he was talking about and where he was coming from, but I still asked him what he &amp;quot;didn&amp;#39;t like&amp;quot;.  He states that he doesn&amp;#39;t like it when I hang out with Nick because it makes him feel uncomfortable.  He then mentions how Nick was &amp;quot;blowing up&amp;quot; my phone during our date.  He goes on to say that it makes him uncomfortable because he feels that &amp;quot;anything could happen.” I&amp;#39;ve now fully grasped what the issue was and I thought I was going to be able to fix it right then and there.  I didn&amp;#39;t think the situation was a huge problem, just needed to reassure him that Nick and I were just friends, and we&amp;#39;d be on our way.  But that&amp;#39;s not exactly what happened.
Alex goes on to say that nothing will make him not feel uncomfortable with the situation.  I said I still didn’t understand, but I was willing to do anything to make it better, and how I wish he trusted me a little bit more after I had already explained to him twice that Nick and I were strictly friends on completely mutual terms.  Alex then drilled me on what Nick and I did together when we first met, sexual stuff was specified because I knew that&amp;#39;s what he meant.  He then told me that he was &amp;quot;not going to deal with that.&amp;quot; He said he wasn&amp;#39;t going to give me an ultimatum, but instead just leave.  &lt;/p&gt;

&lt;p&gt;I&amp;#39;m now just staring at my phone trying to process what the hell just happened within like a 10 minute period.  I thought I had complete control of the situation. But instead, it came crashing down around me.  I&amp;#39;m now freaking out a little on the inside.  Not knowing what to say, I ask him what he meant by &amp;quot;leave&amp;quot; and he responded with &amp;quot;Whatever we have is now over.&amp;quot; He then restates his reason being that I still talk and hang out with a guy I hooked up with.  I, being the mature person I am, tried to call him, which resulted in me being sent to voice mail early, twice.   I then sent a rather long and apologetic text finishing with a goodbye and that I&amp;#39;d miss him.  I thought that would be it, but I then got a very nasty and hurt-filled text about how &amp;quot;Nick will be there for me... [and how] everything will be just perfect for me with him&amp;quot;.  I&amp;#39;m now an emotional wreck because I have no clue why this is happening.  It was just so out of the blue that I couldn&amp;#39;t comprehend it.  I knew that responding back hurtfully wouldn&amp;#39;t help the situation, but I didn&amp;#39;t want to just leave it at that.  I responded back asking why this was a problem all of a sudden and explained, once again, how Nick and I are just friends and we hadn&amp;#39;t done anything in months.  Alex asked me if there were things I talked about with Nick that I wouldn’t tell him, which I denied and went on to say I would never keep anything from him and that I&amp;#39;d tell him anything.  At this point I was just trying to hold together the remaining scraps of our relationship because I thought for some reason I could somehow make it better.  He then stated “If you can talk about the same things with me, why do you even have to be friends with him?”  I’m appalled that he would even ask that.  It would be like if one of my friends told me why I had any other friends other than them because that’s all I would need. I explain, for a final time, that Nick and I were just friends and we had met through mutual friends, back when I had first moved to uni and was looking for some new friends, seeing as most of mine had moved away to their respected universities.  I ask him if there was anything I could do to make this better, granted I knew everything was already over.  He responded very hurtfully by saying, “I think that you should start talking to Nick more.  He can see you pretty often now, which would be good for you.  You two seem to have actual conversations, so that’s a plus.  Eventually that might lead to something else.”&lt;/p&gt;

&lt;p&gt;I&amp;#39;m awe struck.  I couldn’t understand how someone I thought liked me so much would just change their attitude so drastically and to then hurt me when I’m already down.  I picked up whatever was left of my dignity and pride, restated all the great things we did over the course of our short, but amazing, two weeks, and how much I liked him and how I wish I got to know him better to “have actual conversations”.  I gave a couple of minutes, and to no sign of a response from him, I said, “Goodbye, Alex.”  It was plain and simple.  I sat back for a while trying to take it all in and I surprisingly didn’t cry…too much.&lt;/p&gt;

&lt;p&gt;Now, on to the actual question.  Do you guys think his reasoning for the break-up was justified?  If so, why? Thanks.&lt;/p&gt;

&lt;p&gt;tl;dr – Boyfriend of two weeks dumps me solely because I still talk and hang out with a guy I hooked up with, but are now strictly friends with.  Was his reasoning for the break-up justified?&lt;/p&gt;
&lt;/div&gt;&lt;!-- SC_ON --&gt;","False","askgaybros","t5_2vgfw","","","Was my boyfriend's reason for dumping me justified?","2","http://www.reddit.com/r/askgaybros/comments/2lu9xd/was_my_boyfriends_reason_for_dumping_me_justified/","[]","False"
"16","","","{}","http://www.reddit.com/api/info/","{}","{}","False","","","False","Drdrdear","","","","False","1415602559.0","1415602559.0","","self.askgaybros","0","False","0","True","False","2lu7mx","True","","","","","","{}","[]","t3_2lu7mx","17","","False","http://www.reddit.com/r/askgaybros/comments/2lu7mx/first_time_going_to_a_gay_bar_tips_and_advice/","Unauthenticated reddit sesssion","","False","9","","{}","Okay I just turned 21 a couple of weeks ago but have yet to go to a gay bar. I really want to but I am nervous because I plan on going alone. This bar is more causal drinks and cocktails than the clubs and dancing kind. I'm just curious if you had any advice on meeting guys (friends/dates) some does and don't for this complete novice like what's the best way to approach people should I steer clear of groups? Don't want to end up sitting at the bar the whole time and not talking to anyone I'm pretty shy so this is a concern of mine.","&lt;!-- SC_OFF --&gt;&lt;div class=""md""&gt;&lt;p&gt;Okay I just turned 21 a couple of weeks ago but have yet to go to a gay bar. I really want to but I am nervous because I plan on going alone. This bar is more causal drinks and cocktails than the clubs and dancing kind. I&amp;#39;m just curious if you had any advice on meeting guys (friends/dates) some does and don&amp;#39;t for this complete novice like what&amp;#39;s the best way to approach people should I steer clear of groups? Don&amp;#39;t want to end up sitting at the bar the whole time and not talking to anyone I&amp;#39;m pretty shy so this is a concern of mine.&lt;/p&gt;
&lt;/div&gt;&lt;!-- SC_ON --&gt;","False","askgaybros","t5_2vgfw","","","First time going to a gay bar. Tips and advice?","9","http://www.reddit.com/r/askgaybros/comments/2lu7mx/first_time_going_to_a_gay_bar_tips_and_advice/","[]","False"
"17","","","{}","http://www.reddit.com/api/info/","{}","{}","False","","","False","I-WILL-KILL-YOU","","","","False","1415599688.0","1415599688.0","","self.askgaybros","0","False","0","True","False","2lu470","True","","","","","","{}","[]","t3_2lu470","5","","False","http://www.reddit.com/r/askgaybros/comments/2lu470/what_item_would_you_most_want_to_buy_just_after/","Unauthenticated reddit sesssion","","False","0","","{}","","","False","askgaybros","t5_2vgfw","","","What item would you most want to buy just after leaving the bar?","0","http://www.reddit.com/r/askgaybros/comments/2lu470/what_item_would_you_most_want_to_buy_just_after/","[]","False"
"18","","","{}","http://www.reddit.com/api/info/","{}","{}","False","","","False","AdelaideStevenson","","","","False","1415599243.0","1415599243.0","","self.askgaybros","0","False","0","True","False","2lu3lf","True","","","","","","{}","[]","t3_2lu3lf","14","","False","http://www.reddit.com/r/askgaybros/comments/2lu3lf/finally_experimenting_with_dudes_but_having/","Unauthenticated reddit sesssion","","False","6","","{}","I'm 29.  I've had hetero relationships my entire life, but have always known at least a part of me was gay.  Knowing this has been a huge inhibition on these straight relationships.  

Reading this subreddit has encouraged me to go and explore the gay side of my sexuality.  I'm using Grindr and I've enjoyed the brilliance of seeing so many open dudes on the app, but when the time for sex arrives I am having some trouble.  I mean, I get aroused but can't stay aroused.  It's a jumble of nerves and anxiety, probably about this pent-up wanting for the last near thirty years finally reaching some kind of affirmation.  

Have any formerly straight bros turned gay had this problem?  Do any of you have any ideas what I am doing wrong or any suggestions about what I could be doing to help my situation?","&lt;!-- SC_OFF --&gt;&lt;div class=""md""&gt;&lt;p&gt;I&amp;#39;m 29.  I&amp;#39;ve had hetero relationships my entire life, but have always known at least a part of me was gay.  Knowing this has been a huge inhibition on these straight relationships.  &lt;/p&gt;

&lt;p&gt;Reading this subreddit has encouraged me to go and explore the gay side of my sexuality.  I&amp;#39;m using Grindr and I&amp;#39;ve enjoyed the brilliance of seeing so many open dudes on the app, but when the time for sex arrives I am having some trouble.  I mean, I get aroused but can&amp;#39;t stay aroused.  It&amp;#39;s a jumble of nerves and anxiety, probably about this pent-up wanting for the last near thirty years finally reaching some kind of affirmation.  &lt;/p&gt;

&lt;p&gt;Have any formerly straight bros turned gay had this problem?  Do any of you have any ideas what I am doing wrong or any suggestions about what I could be doing to help my situation?&lt;/p&gt;
&lt;/div&gt;&lt;!-- SC_ON --&gt;","False","askgaybros","t5_2vgfw","","","Finally experimenting with dudes, but having trouble staying aroused. Any insights?","6","http://www.reddit.com/r/askgaybros/comments/2lu3lf/finally_experimenting_with_dudes_but_having/","[]","False"
