"","_comment_sort","_comments","_comments_by_id","_info_url","_orphaned","_params","_replaced_more","_underscore_names","approved_by","archived","author","author_flair_css_class","author_flair_text","banned_by","clicked","created","created_utc","distinguished","domain","downs","edited","gilded","has_fetched","hidden","id","is_self","json_dict","likes","link_flair_css_class","link_flair_text","media","media_embed","mod_reports","name","num_comments","num_reports","over_18","permalink","reddit_session","report_reasons","saved","score","secure_media","secure_media_embed","selftext","selftext_html","stickied","subreddit","subreddit_id","suggested_sort","thumbnail","title","ups","url","user_reports","visited"
"5","","","{}","http://www.reddit.com/api/info/","{}","{}","False","","","True","Glostsed","","","","False","1410244687.0","1410241087.0","","self.askgaybros","0","1410241895.0","0","True","False","2fvscx","True","","","","","","{}","[]","t3_2fvscx","8","","False","http://www.reddit.com/r/askgaybros/comments/2fvscx/graduated_college_my_relationship_that_was/","Unauthenticated reddit sesssion","","False","8","","{}","I graduated from college last May. About two months prior to that, me and this guy, who is still a student at the college started hanging out and deciding we really liked each other. My plan was to get hired somewhere at/near the college, so we weren't too worried about our relationship. We parted in May with a ""see ya in the fall.""

We communicated all summer. Things were fine all summer. I worked a summer job. I got a little bit too busy with that job to look for work in the fall as actively as I probably should've. The end result: The semester started at the school a week ago, and I'm not local yet because I don't have work in the area. I'm still looking for work in the area. Not because of this guy--the area makes a lot of sense for me for about 100 different reasons, I have additional physical limitations that I know how to navigate in the area, and I'd be looking there no matter what.

However, since I'm not there, and since college campuses can be a bit of a bubble, my relationship partner feels like we're in separate worlds right now, and I agree with him whole-heartedly. He said he's uncomfortable committing to a relationship when it feels like there's so much effort necessary in bridging the gap right now, and we talked for a couple of hours, and basically just reached the conclusion that if our lives realign, the relationship talk is a very real conversation to revisit, because we had a great thing starting up, but it's not practical right now, especially since we were still in the honeymoon phase when we split up in May. If I get work near the campus, I will be on campus regularly, and then we'll go from there, see what feels... correct. There's a lot of liking on both sides, but to say we're dating now... It would be in name only.

I'm already feeling a ton of anxiety because finding work is hard. I can't drive, so I'm limited to basically the downtown area of the city, where I can get to work/groceries/ect. I have people willing to rent an apartment with me when I find employment, but nothing solid yet.... because I'm not employed. One thing that was keeping me optimistic was the thought of reuniting with this guy, because no matter how rough things were, I was starting to feel SUPER comfortable with him... but now that's on hold indefinitely/for now/who knows.

I just feel like everything is riding on my ability to find work. I'm confident I will work something out, but I feel like I'm losing control of everything in the meantime. I'm going to campus to visit this week, and I'm just sitting here terrified that things are going to be awkward because we have a simultaneous desire to be close and to cool things down for a bit. I don't even know if I ask him to specifically come hang out with me or not. I'm just taking longer to get things sorted out than I should've and things are coming undone.

**TL;DR: I'm basically depressed, and relationship uncertainty stacked on top of job uncertainty didn't make things better.**","&lt;!-- SC_OFF --&gt;&lt;div class=""md""&gt;&lt;p&gt;I graduated from college last May. About two months prior to that, me and this guy, who is still a student at the college started hanging out and deciding we really liked each other. My plan was to get hired somewhere at/near the college, so we weren&amp;#39;t too worried about our relationship. We parted in May with a &amp;quot;see ya in the fall.&amp;quot;&lt;/p&gt;

&lt;p&gt;We communicated all summer. Things were fine all summer. I worked a summer job. I got a little bit too busy with that job to look for work in the fall as actively as I probably should&amp;#39;ve. The end result: The semester started at the school a week ago, and I&amp;#39;m not local yet because I don&amp;#39;t have work in the area. I&amp;#39;m still looking for work in the area. Not because of this guy--the area makes a lot of sense for me for about 100 different reasons, I have additional physical limitations that I know how to navigate in the area, and I&amp;#39;d be looking there no matter what.&lt;/p&gt;

&lt;p&gt;However, since I&amp;#39;m not there, and since college campuses can be a bit of a bubble, my relationship partner feels like we&amp;#39;re in separate worlds right now, and I agree with him whole-heartedly. He said he&amp;#39;s uncomfortable committing to a relationship when it feels like there&amp;#39;s so much effort necessary in bridging the gap right now, and we talked for a couple of hours, and basically just reached the conclusion that if our lives realign, the relationship talk is a very real conversation to revisit, because we had a great thing starting up, but it&amp;#39;s not practical right now, especially since we were still in the honeymoon phase when we split up in May. If I get work near the campus, I will be on campus regularly, and then we&amp;#39;ll go from there, see what feels... correct. There&amp;#39;s a lot of liking on both sides, but to say we&amp;#39;re dating now... It would be in name only.&lt;/p&gt;

&lt;p&gt;I&amp;#39;m already feeling a ton of anxiety because finding work is hard. I can&amp;#39;t drive, so I&amp;#39;m limited to basically the downtown area of the city, where I can get to work/groceries/ect. I have people willing to rent an apartment with me when I find employment, but nothing solid yet.... because I&amp;#39;m not employed. One thing that was keeping me optimistic was the thought of reuniting with this guy, because no matter how rough things were, I was starting to feel SUPER comfortable with him... but now that&amp;#39;s on hold indefinitely/for now/who knows.&lt;/p&gt;

&lt;p&gt;I just feel like everything is riding on my ability to find work. I&amp;#39;m confident I will work something out, but I feel like I&amp;#39;m losing control of everything in the meantime. I&amp;#39;m going to campus to visit this week, and I&amp;#39;m just sitting here terrified that things are going to be awkward because we have a simultaneous desire to be close and to cool things down for a bit. I don&amp;#39;t even know if I ask him to specifically come hang out with me or not. I&amp;#39;m just taking longer to get things sorted out than I should&amp;#39;ve and things are coming undone.&lt;/p&gt;

&lt;p&gt;&lt;strong&gt;TL;DR: I&amp;#39;m basically depressed, and relationship uncertainty stacked on top of job uncertainty didn&amp;#39;t make things better.&lt;/strong&gt;&lt;/p&gt;
&lt;/div&gt;&lt;!-- SC_ON --&gt;","False","askgaybros","t5_2vgfw","","","Graduated college... My relationship that was starting up has been put on hold... Things all around just kind of suck.","8","http://www.reddit.com/r/askgaybros/comments/2fvscx/graduated_college_my_relationship_that_was/","[]","False"
"6","","","{}","http://www.reddit.com/api/info/","{}","{}","False","","","True","qqlolo45","","","","False","1410244394.0","1410240794.0","","self.askgaybros","0","1410241081.0","0","True","False","2fvrzk","True","","","","","","{}","[]","t3_2fvrzk","11","","False","http://www.reddit.com/r/askgaybros/comments/2fvrzk/for_guys_who_like_smooth_guys/","Unauthenticated reddit sesssion","","False","8","","{}","do you care if the guy is naturally smooth vs artificially smooth (i.e smooth via shaving/waxing)? super weird question hence the throwaway but yea. if you're into smooth guys, does it matter to you?

edit: i thought this might as well have a bit of context. my leg hair is really long like I think its kinda gross...its literally an inch...inch and a half long. Its not particularly dense its just the hairs are long. So Im kind of self conscious about it. will hookups judge me if its obvious that I shaved it (i.e theres stubble or something)? Idk ","&lt;!-- SC_OFF --&gt;&lt;div class=""md""&gt;&lt;p&gt;do you care if the guy is naturally smooth vs artificially smooth (i.e smooth via shaving/waxing)? super weird question hence the throwaway but yea. if you&amp;#39;re into smooth guys, does it matter to you?&lt;/p&gt;

&lt;p&gt;edit: i thought this might as well have a bit of context. my leg hair is really long like I think its kinda gross...its literally an inch...inch and a half long. Its not particularly dense its just the hairs are long. So Im kind of self conscious about it. will hookups judge me if its obvious that I shaved it (i.e theres stubble or something)? Idk &lt;/p&gt;
&lt;/div&gt;&lt;!-- SC_ON --&gt;","False","askgaybros","t5_2vgfw","","","for guys who like smooth guys","8","http://www.reddit.com/r/askgaybros/comments/2fvrzk/for_guys_who_like_smooth_guys/","[]","False"
"7","","","{}","http://www.reddit.com/api/info/","{}","{}","False","","","True","bromeaway","","","","False","1410243958.0","1410240358.0","","self.askgaybros","0","False","0","True","False","2fvrht","True","","","","","","{}","[]","t3_2fvrht","4","","False","http://www.reddit.com/r/askgaybros/comments/2fvrht/crush_is_on_grindr/","Unauthenticated reddit sesssion","","False","7","","{}","I know it's him and I'm 99% sure he knows that it's me on there too. How can I get him to actually bite the lure and text me? I've said the normal intro once or twice and we've talked before on there but it's been a while. I'd like to give him my number and just say ""Here's my number. Text me."" and put the ball in his court. Any advice on how I should do this, like phrasing? Not really sure the best way to be passive aggressive and say ""here it is, now do something with it"". Any advice appreciated.","&lt;!-- SC_OFF --&gt;&lt;div class=""md""&gt;&lt;p&gt;I know it&amp;#39;s him and I&amp;#39;m 99% sure he knows that it&amp;#39;s me on there too. How can I get him to actually bite the lure and text me? I&amp;#39;ve said the normal intro once or twice and we&amp;#39;ve talked before on there but it&amp;#39;s been a while. I&amp;#39;d like to give him my number and just say &amp;quot;Here&amp;#39;s my number. Text me.&amp;quot; and put the ball in his court. Any advice on how I should do this, like phrasing? Not really sure the best way to be passive aggressive and say &amp;quot;here it is, now do something with it&amp;quot;. Any advice appreciated.&lt;/p&gt;
&lt;/div&gt;&lt;!-- SC_ON --&gt;","False","askgaybros","t5_2vgfw","","","Crush is on Grindr.","7","http://www.reddit.com/r/askgaybros/comments/2fvrht/crush_is_on_grindr/","[]","False"
"8","","","{}","http://www.reddit.com/api/info/","{}","{}","False","","","True","4564891","","","","False","1410241173.0","1410237573.0","","self.askgaybros","0","1410288918.0","0","True","False","2fvntw","True","","","","","","{}","[]","t3_2fvntw","34","","False","http://www.reddit.com/r/askgaybros/comments/2fvntw/living_with_a_republican_not_out_to_him_advice/","Unauthenticated reddit sesssion","","False","5","","{}","I pretty much randomly chose someone from my graduate program to share an apartment with, and he's a Republican. We mostly mind our own business and barely interact. I've started seeing a guy, and I've had him over three times in the last two weeks, and while I'm sure he's suspicious, I don't see enough reason to be straightforward about our relationship to him. I had a very negative experience having to come out to my parents in high school, and I'm not interested in potentially having to deal with bigotry in my home again. I recognize that's prejudiced (literally, pre-judging) of me. Does anyone have any advice or similar experiences in a living situation that may become hostile if you were open about your sexuality?

EDIT 1: I am aware that there are Republicans who are okay with gay people, so please stop asking. If he is fine with gay people, we're cool. My concern is that that is neither a sentiment espoused by the Republican party officially or by the majority of Republicans. Please stop pointing that some Republicans are not anti-gay as if that solves my problem.","&lt;!-- SC_OFF --&gt;&lt;div class=""md""&gt;&lt;p&gt;I pretty much randomly chose someone from my graduate program to share an apartment with, and he&amp;#39;s a Republican. We mostly mind our own business and barely interact. I&amp;#39;ve started seeing a guy, and I&amp;#39;ve had him over three times in the last two weeks, and while I&amp;#39;m sure he&amp;#39;s suspicious, I don&amp;#39;t see enough reason to be straightforward about our relationship to him. I had a very negative experience having to come out to my parents in high school, and I&amp;#39;m not interested in potentially having to deal with bigotry in my home again. I recognize that&amp;#39;s prejudiced (literally, pre-judging) of me. Does anyone have any advice or similar experiences in a living situation that may become hostile if you were open about your sexuality?&lt;/p&gt;

&lt;p&gt;EDIT 1: I am aware that there are Republicans who are okay with gay people, so please stop asking. If he is fine with gay people, we&amp;#39;re cool. My concern is that that is neither a sentiment espoused by the Republican party officially or by the majority of Republicans. Please stop pointing that some Republicans are not anti-gay as if that solves my problem.&lt;/p&gt;
&lt;/div&gt;&lt;!-- SC_ON --&gt;","False","askgaybros","t5_2vgfw","","","Living with a Republican. Not out to him. Advice?","5","http://www.reddit.com/r/askgaybros/comments/2fvntw/living_with_a_republican_not_out_to_him_advice/","[]","False"
"9","","","{}","http://www.reddit.com/api/info/","{}","{}","False","","","True","Hyper_Threaded","","","","False","1410236011.0","1410232411.0","","self.askgaybros","0","False","0","True","False","2fvg7c","True","","","","","","{}","[]","t3_2fvg7c","5","","False","http://www.reddit.com/r/askgaybros/comments/2fvg7c/my_anniversary_is_coming_up_soon_bros_what_sorts/","Unauthenticated reddit sesssion","","False","3","","{}","","","False","askgaybros","t5_2vgfw","","","My anniversary is coming up soon. Bros, what sorts of gifts do you get your s/o for a 6y anniversary?","3","http://www.reddit.com/r/askgaybros/comments/2fvg7c/my_anniversary_is_coming_up_soon_bros_what_sorts/","[]","False"
"10","","","{}","http://www.reddit.com/api/info/","{}","{}","False","","","True","Vaaf","","","","False","1410231137.0","1410227537.0","","self.askgaybros","0","False","0","True","False","2fv88z","True","","","","","","{}","[]","t3_2fv88z","51","","False","http://www.reddit.com/r/askgaybros/comments/2fv88z/ive_been_dating_a_married_man_with_his_wifes/","Unauthenticated reddit sesssion","","False","32","","{}","Story; I met him eight months ago at a gay bar and we hit it of, we cuddled but before things got went too far he told me he had been married for 17 years to a women, that he had come out five years ago and that he had been given permission to start a sexual relationship with another man. 

I know what you're thinking, why didn't I run away. He was hot and I was horny, we hooked up and it was great. We continued seeing each other and I've met his wife three times over that period. He's funny and incredibly generous. 

Problem; his son 16 year old son apparently found out, he messaged me yesterday, calling me a faggot and to leave his family alone. I have 75% decided to end the relationship because I don't want to ruin his family if I haven't already. 

..but I was wondering what you guys though I should do.","&lt;!-- SC_OFF --&gt;&lt;div class=""md""&gt;&lt;p&gt;Story; I met him eight months ago at a gay bar and we hit it of, we cuddled but before things got went too far he told me he had been married for 17 years to a women, that he had come out five years ago and that he had been given permission to start a sexual relationship with another man. &lt;/p&gt;

&lt;p&gt;I know what you&amp;#39;re thinking, why didn&amp;#39;t I run away. He was hot and I was horny, we hooked up and it was great. We continued seeing each other and I&amp;#39;ve met his wife three times over that period. He&amp;#39;s funny and incredibly generous. &lt;/p&gt;

&lt;p&gt;Problem; his son 16 year old son apparently found out, he messaged me yesterday, calling me a faggot and to leave his family alone. I have 75% decided to end the relationship because I don&amp;#39;t want to ruin his family if I haven&amp;#39;t already. &lt;/p&gt;

&lt;p&gt;..but I was wondering what you guys though I should do.&lt;/p&gt;
&lt;/div&gt;&lt;!-- SC_ON --&gt;","False","askgaybros","t5_2vgfw","","","I've been ""dating"" a married man with his wife's consent for 8 months, something happened and I don't know what to do.","32","http://www.reddit.com/r/askgaybros/comments/2fv88z/ive_been_dating_a_married_man_with_his_wifes/","[]","False"
"11","","","{}","http://www.reddit.com/api/info/","{}","{}","False","","","True","ghettofabdelicious","","","","False","1410229025.0","1410225425.0","","self.askgaybros","0","False","0","True","False","2fv4nu","True","","","","","","{}","[]","t3_2fv4nu","17","","True","http://www.reddit.com/r/askgaybros/comments/2fv4nu/whats_wrong/","Unauthenticated reddit sesssion","","False","3","","{}","What is the matter with handjobs? I love them and I think they're really hot. Why does everyone think they're so bad?","&lt;!-- SC_OFF --&gt;&lt;div class=""md""&gt;&lt;p&gt;What is the matter with handjobs? I love them and I think they&amp;#39;re really hot. Why does everyone think they&amp;#39;re so bad?&lt;/p&gt;
&lt;/div&gt;&lt;!-- SC_ON --&gt;","False","askgaybros","t5_2vgfw","","","What's wrong??","3","http://www.reddit.com/r/askgaybros/comments/2fv4nu/whats_wrong/","[]","False"
"12","","","{}","http://www.reddit.com/api/info/","{}","{}","False","","","True","DreadfulDread","","","","False","1410228498.0","1410224898.0","","self.askgaybros","0","False","0","True","False","2fv3qk","True","","","","","","{}","[]","t3_2fv3qk","6","","False","http://www.reddit.com/r/askgaybros/comments/2fv3qk/would_you_get_a_handjob_if_my_hand_looks_like_this/","Unauthenticated reddit sesssion","","False","0","","{}","[Like this](http://media0.giphy.com/media/11HV5AKyj5gijK/200.gif)

It's been like that since birth :/","&lt;!-- SC_OFF --&gt;&lt;div class=""md""&gt;&lt;p&gt;&lt;a href=""http://media0.giphy.com/media/11HV5AKyj5gijK/200.gif""&gt;Like this&lt;/a&gt;&lt;/p&gt;

&lt;p&gt;It&amp;#39;s been like that since birth :/&lt;/p&gt;
&lt;/div&gt;&lt;!-- SC_ON --&gt;","False","askgaybros","t5_2vgfw","","","Would you get a handjob if my hand looks like this?","0","http://www.reddit.com/r/askgaybros/comments/2fv3qk/would_you_get_a_handjob_if_my_hand_looks_like_this/","[]","False"
"13","","","{}","http://www.reddit.com/api/info/","{}","{}","False","","","True","GodDamnRidiculous","","","","False","1410227800.0","1410224200.0","","self.askgaybros","0","1410286159.0","0","True","False","2fv2hr","True","","","","","","{}","[]","t3_2fv2hr","45","","False","http://www.reddit.com/r/askgaybros/comments/2fv2hr/so_my_bf_is_assuming_im_cheating/","Unauthenticated reddit sesssion","","False","8","","{}","As the title says my boyfriend is upset and thinks i cheated on him. His reasoning? 1. My breath smelled like cum (I did a breath check in my shirt and he was kinda right about that :/), and 2. I had the shits after we ate dinner. Thats it. In reality all i did was work out, go to class and come home. What would you do in this situation?

edit: I'm pretty sure the real reason for all this is that the milk I had in my protein shake earlier today is about 4 days past its expiration date. (it smelt fine though, I swear!)

edit 2: I forgot to add that another reason he thinks I cheated was because he had some dream about it a few nights ago. (he's convinced he is a psychic/prophet of some sort because he predicted his friend would win an ipad once and she did) 

Update: If anyone is checking back on this, I sent him a text this morning saying how this is all bullshit and will tear us apart. His response when he came back from class, was basically, ""I'm over it now, lets not bring it up. But you have to admit that it was a perfectly valid assumption"" apparently my breath smelled literally like I had sucked a dick and the fact that I had the shits MUST hint that I bottomed at some point while i was gone (funny thing is he knows I've never bottomed before) IDK what to think on one hand he's not going to make a big deal about this anymore, but on the other hand it seems to set a precedence that i dont like. What will happen if i get toothpaste on myself one day?! Also he probably still thinks I cheated but has decided to just bottle it up instead.","&lt;!-- SC_OFF --&gt;&lt;div class=""md""&gt;&lt;p&gt;As the title says my boyfriend is upset and thinks i cheated on him. His reasoning? 1. My breath smelled like cum (I did a breath check in my shirt and he was kinda right about that :/), and 2. I had the shits after we ate dinner. Thats it. In reality all i did was work out, go to class and come home. What would you do in this situation?&lt;/p&gt;

&lt;p&gt;edit: I&amp;#39;m pretty sure the real reason for all this is that the milk I had in my protein shake earlier today is about 4 days past its expiration date. (it smelt fine though, I swear!)&lt;/p&gt;

&lt;p&gt;edit 2: I forgot to add that another reason he thinks I cheated was because he had some dream about it a few nights ago. (he&amp;#39;s convinced he is a psychic/prophet of some sort because he predicted his friend would win an ipad once and she did) &lt;/p&gt;

&lt;p&gt;Update: If anyone is checking back on this, I sent him a text this morning saying how this is all bullshit and will tear us apart. His response when he came back from class, was basically, &amp;quot;I&amp;#39;m over it now, lets not bring it up. But you have to admit that it was a perfectly valid assumption&amp;quot; apparently my breath smelled literally like I had sucked a dick and the fact that I had the shits MUST hint that I bottomed at some point while i was gone (funny thing is he knows I&amp;#39;ve never bottomed before) IDK what to think on one hand he&amp;#39;s not going to make a big deal about this anymore, but on the other hand it seems to set a precedence that i dont like. What will happen if i get toothpaste on myself one day?! Also he probably still thinks I cheated but has decided to just bottle it up instead.&lt;/p&gt;
&lt;/div&gt;&lt;!-- SC_ON --&gt;","False","askgaybros","t5_2vgfw","","","So my bf is assuming I'm cheating....","8","http://www.reddit.com/r/askgaybros/comments/2fv2hr/so_my_bf_is_assuming_im_cheating/","[]","False"
"14","","","{}","http://www.reddit.com/api/info/","{}","{}","False","","","True","anewlifeee","","","","False","1410224248.0","1410220648.0","","self.askgaybros","0","1410220871.0","0","True","False","2fuw4l","True","","","","","","{}","[]","t3_2fuw4l","18","","False","http://www.reddit.com/r/askgaybros/comments/2fuw4l/graduating_this_yearis_it_even_worth_making_an/","Unauthenticated reddit sesssion","","False","2","","{}","I just feel that it's too late at this point. That everyone has an established circle of friends I won't belong with and that I'll be an outsider...I'm afraid it's just too late to even try getting involved .  
  
Part of me really wants to because it's actually attached to my dorm building, but it feels pointless at the moment, not to mention that even if I haven't hidden that I'm gay or lied about it, I have no gay friends besides one guy I'm very close to ( and discussed in another thread ) and I feel so out of place in the straight world, especially when clubbing. I get to see my girl friends get picked up or flirted with or dance with guys and...then I just feel alone. I'm afraid I would go to a gay club ( dancing or just a general interest club) and it will just be the same old same old.","&lt;!-- SC_OFF --&gt;&lt;div class=""md""&gt;&lt;p&gt;I just feel that it&amp;#39;s too late at this point. That everyone has an established circle of friends I won&amp;#39;t belong with and that I&amp;#39;ll be an outsider...I&amp;#39;m afraid it&amp;#39;s just too late to even try getting involved .  &lt;/p&gt;

&lt;p&gt;Part of me really wants to because it&amp;#39;s actually attached to my dorm building, but it feels pointless at the moment, not to mention that even if I haven&amp;#39;t hidden that I&amp;#39;m gay or lied about it, I have no gay friends besides one guy I&amp;#39;m very close to ( and discussed in another thread ) and I feel so out of place in the straight world, especially when clubbing. I get to see my girl friends get picked up or flirted with or dance with guys and...then I just feel alone. I&amp;#39;m afraid I would go to a gay club ( dancing or just a general interest club) and it will just be the same old same old.&lt;/p&gt;
&lt;/div&gt;&lt;!-- SC_ON --&gt;","False","askgaybros","t5_2vgfw","","","Graduating this year...is it even worth making an effort trying to meet other gay guys at LGBT center events and clubs?","2","http://www.reddit.com/r/askgaybros/comments/2fuw4l/graduating_this_yearis_it_even_worth_making_an/","[]","False"
