"","_comment_sort","_comments","_comments_by_id","_info_url","_orphaned","_params","_replaced_more","_underscore_names","approved_by","archived","author","author_flair_css_class","author_flair_text","banned_by","clicked","created","created_utc","distinguished","domain","downs","edited","gilded","has_fetched","hidden","id","is_self","json_dict","likes","link_flair_css_class","link_flair_text","media","media_embed","mod_reports","name","num_comments","num_reports","over_18","permalink","reddit_session","report_reasons","saved","score","secure_media","secure_media_embed","selftext","selftext_html","stickied","subreddit","subreddit_id","suggested_sort","thumbnail","title","ups","url","user_reports","visited"
"11","","","{}","http://www.reddit.com/api/info/","{}","{}","False","","","True","daytime_dreamer","","","","False","1399858668.0","1399855068.0","","self.askgaybros","0","False","0","True","False","25bjqd","True","","","","","","{}","[]","t3_25bjqd","12","","False","http://www.reddit.com/r/askgaybros/comments/25bjqd/found_out_my_friend_is_bi/","Unauthenticated reddit sesssion","","False","11","","{}","This is my first time posting but I don't know who else to ask. I was on Facebook the other day and out of curiosity, I used it to see which of my friends was interested in guys. I didn't expect to see anyone show up but then I recognized someone who I used to see frequently around campus, but haven't kept in touch with. I later messaged him to confirm and he said he was but wasn't really open about it. I subtly suggested that we should hang out sometime but he didn't respond so I assume he's not interested in going out. TBH I feel a little bad because I never hit him up to hang out until I found out he was bi, partially because he's a bro and I'm ...not. Ever since then, I find myself thinking about him a lot and I'm feeling a little hung up. I was wondering if anyone had any tips on how I could get over him?","&lt;!-- SC_OFF --&gt;&lt;div class=""md""&gt;&lt;p&gt;This is my first time posting but I don&amp;#39;t know who else to ask. I was on Facebook the other day and out of curiosity, I used it to see which of my friends was interested in guys. I didn&amp;#39;t expect to see anyone show up but then I recognized someone who I used to see frequently around campus, but haven&amp;#39;t kept in touch with. I later messaged him to confirm and he said he was but wasn&amp;#39;t really open about it. I subtly suggested that we should hang out sometime but he didn&amp;#39;t respond so I assume he&amp;#39;s not interested in going out. TBH I feel a little bad because I never hit him up to hang out until I found out he was bi, partially because he&amp;#39;s a bro and I&amp;#39;m ...not. Ever since then, I find myself thinking about him a lot and I&amp;#39;m feeling a little hung up. I was wondering if anyone had any tips on how I could get over him?&lt;/p&gt;
&lt;/div&gt;&lt;!-- SC_ON --&gt;","False","askgaybros","t5_2vgfw","","","Found out my friend is bi","11","http://www.reddit.com/r/askgaybros/comments/25bjqd/found_out_my_friend_is_bi/","[]","False"
"12","","","{}","http://www.reddit.com/api/info/","{}","{}","False","","","True","Gaybritishteen","","","","False","1399856277.0","1399852677.0","","self.askgaybros","0","False","0","True","False","25bg89","True","","","","","","{}","[]","t3_25bg89","15","","False","http://www.reddit.com/r/askgaybros/comments/25bg89/are_penile_bends_natural_at_age_16/","Unauthenticated reddit sesssion","","False","0","","{}","I ask because some times I sit in a really weird position face down reading the iPad off the bed and this could be natural but my bell end has gone about 30 degrees to the left in the past month causing my dick which was the only good thing about my skinnyfat body to move slightly  and I am freaking out I've ruined my only attractive feature :( ","&lt;!-- SC_OFF --&gt;&lt;div class=""md""&gt;&lt;p&gt;I ask because some times I sit in a really weird position face down reading the iPad off the bed and this could be natural but my bell end has gone about 30 degrees to the left in the past month causing my dick which was the only good thing about my skinnyfat body to move slightly  and I am freaking out I&amp;#39;ve ruined my only attractive feature :( &lt;/p&gt;
&lt;/div&gt;&lt;!-- SC_ON --&gt;","False","askgaybros","t5_2vgfw","","","Are penile bends natural at age 16....","0","http://www.reddit.com/r/askgaybros/comments/25bg89/are_penile_bends_natural_at_age_16/","[]","False"
"13","","","{}","http://www.reddit.com/api/info/","{}","{}","False","","","True","dankwank","","","","False","1399854845.0","1399851245.0","","self.askgaybros","0","False","0","True","False","25be8q","True","","","","","","{}","[]","t3_25be8q","4","","False","http://www.reddit.com/r/askgaybros/comments/25be8q/how_long_do_your_orgasms_last/","Unauthenticated reddit sesssion","","False","5","","{}","So yeah, how about it?

Recently I've noticed I can get my orgasms to double/extend if I keep going after I shoot, whether its masturbating or sex. Its just repeating waves of awesome, haha. I know I'm wording this terribly, bare with me here. Basically I kept going even after the head of penis got ultra-sensitive, and it wasn't the typical overload of sensation that I normally don't enjoy. It felt like it started all over...its never happened before.

Thought it was kinda cool, wondering if this happens to anyone else.","&lt;!-- SC_OFF --&gt;&lt;div class=""md""&gt;&lt;p&gt;So yeah, how about it?&lt;/p&gt;

&lt;p&gt;Recently I&amp;#39;ve noticed I can get my orgasms to double/extend if I keep going after I shoot, whether its masturbating or sex. Its just repeating waves of awesome, haha. I know I&amp;#39;m wording this terribly, bare with me here. Basically I kept going even after the head of penis got ultra-sensitive, and it wasn&amp;#39;t the typical overload of sensation that I normally don&amp;#39;t enjoy. It felt like it started all over...its never happened before.&lt;/p&gt;

&lt;p&gt;Thought it was kinda cool, wondering if this happens to anyone else.&lt;/p&gt;
&lt;/div&gt;&lt;!-- SC_ON --&gt;","False","askgaybros","t5_2vgfw","","","How long do your orgasms last?","5","http://www.reddit.com/r/askgaybros/comments/25be8q/how_long_do_your_orgasms_last/","[]","False"
"14","","","{}","http://www.reddit.com/api/info/","{}","{}","False","","","True","BrobearBerbil","","","","False","1399853337.0","1399849737.0","","self.askgaybros","0","False","0","True","False","25bc5y","True","","","","","","{}","[]","t3_25bc5y","14","","False","http://www.reddit.com/r/askgaybros/comments/25bc5y/whats_the_most_regretful_or_embarrassing_thing/","Unauthenticated reddit sesssion","","False","4","","{}","What desperate attempts to see some skin do you facepalm over in retrospect?","&lt;!-- SC_OFF --&gt;&lt;div class=""md""&gt;&lt;p&gt;What desperate attempts to see some skin do you facepalm over in retrospect?&lt;/p&gt;
&lt;/div&gt;&lt;!-- SC_ON --&gt;","False","askgaybros","t5_2vgfw","","","What's the most regretful or embarrassing thing you did just to see a guy naked?","4","http://www.reddit.com/r/askgaybros/comments/25bc5y/whats_the_most_regretful_or_embarrassing_thing/","[]","False"
"15","","","{}","http://www.reddit.com/api/info/","{}","{}","False","","","True","bruinbobcat","","","","False","1399845769.0","1399842169.0","","self.askgaybros","0","False","0","True","False","25b1ms","True","","","","","","{}","[]","t3_25b1ms","22","","False","http://www.reddit.com/r/askgaybros/comments/25b1ms/getting_started_with_dating_and_sex_for_a_30_yr/","Unauthenticated reddit sesssion","","False","18","","{}","So, Ive never tried to go out with any one before so I hit the net looking for guys. I explained I'd never dated, was a complete virgin..and found a guy that said he was ok with it. We chatted/texted for about a month before meeting and going on a few dates. We kissed several times and he always followed it with comments like ""wow you really never kiss"" but then we'd laugh it off.  Finally, we tried something sexual a few nights ago, and I tried to go down on a guy for the first time. I had no idea what I was doing and I felt him lose his boner. He didn't really give me any instructions, and I had no idea since I'm not very into porn so I strained to remember what to do. Anyway, this guy has stopped responding to me and I think it was because I was just THAT bad. So how do I figure this out at 30? Other guys I chat with also cut me off when they find out I have no experience...","&lt;!-- SC_OFF --&gt;&lt;div class=""md""&gt;&lt;p&gt;So, Ive never tried to go out with any one before so I hit the net looking for guys. I explained I&amp;#39;d never dated, was a complete virgin..and found a guy that said he was ok with it. We chatted/texted for about a month before meeting and going on a few dates. We kissed several times and he always followed it with comments like &amp;quot;wow you really never kiss&amp;quot; but then we&amp;#39;d laugh it off.  Finally, we tried something sexual a few nights ago, and I tried to go down on a guy for the first time. I had no idea what I was doing and I felt him lose his boner. He didn&amp;#39;t really give me any instructions, and I had no idea since I&amp;#39;m not very into porn so I strained to remember what to do. Anyway, this guy has stopped responding to me and I think it was because I was just THAT bad. So how do I figure this out at 30? Other guys I chat with also cut me off when they find out I have no experience...&lt;/p&gt;
&lt;/div&gt;&lt;!-- SC_ON --&gt;","False","askgaybros","t5_2vgfw","","","Getting started with dating (and sex) for a 30 yr old newbie","18","http://www.reddit.com/r/askgaybros/comments/25b1ms/getting_started_with_dating_and_sex_for_a_30_yr/","[]","False"
"16","","","{}","http://www.reddit.com/api/info/","{}","{}","False","","","True","stupidbro","","","","False","1399841288.0","1399837688.0","","self.askgaybros","0","1399861659.0","0","True","False","25auw1","True","","","","","","{}","[]","t3_25auw1","27","","False","http://www.reddit.com/r/askgaybros/comments/25auw1/hooked_up_with_my_best_friendneed_advice/","Unauthenticated reddit sesssion","","False","3","","{}","Long story short, for the past two years I've been in love with my best friend of 10 years. I have set my feelings aside because I value our friendship.

We have a very strong emotional connection as most best friends do and we constantly flirt. Most people think we are boyfriends. We got drunk last weekend, hooked up and almost had sex. It has been a week and we haven't talked about it, but we speak almost everyday.

I love and care about him, but I do not want to go down this road.

How do I go about bringing up last weekend?

I need to end our friendship because its toxic and dysfunctional
","&lt;!-- SC_OFF --&gt;&lt;div class=""md""&gt;&lt;p&gt;Long story short, for the past two years I&amp;#39;ve been in love with my best friend of 10 years. I have set my feelings aside because I value our friendship.&lt;/p&gt;

&lt;p&gt;We have a very strong emotional connection as most best friends do and we constantly flirt. Most people think we are boyfriends. We got drunk last weekend, hooked up and almost had sex. It has been a week and we haven&amp;#39;t talked about it, but we speak almost everyday.&lt;/p&gt;

&lt;p&gt;I love and care about him, but I do not want to go down this road.&lt;/p&gt;

&lt;p&gt;How do I go about bringing up last weekend?&lt;/p&gt;

&lt;p&gt;I need to end our friendship because its toxic and dysfunctional&lt;/p&gt;
&lt;/div&gt;&lt;!-- SC_ON --&gt;","False","askgaybros","t5_2vgfw","","","Hooked up with my best friend...need advice?","3","http://www.reddit.com/r/askgaybros/comments/25auw1/hooked_up_with_my_best_friendneed_advice/","[]","False"
"17","","","{}","http://www.reddit.com/api/info/","{}","{}","False","","","True","smirn0ff","","","","False","1399839613.0","1399836013.0","","self.askgaybros","0","False","0","True","False","25as9o","True","","","","","","{}","[]","t3_25as9o","10","","False","http://www.reddit.com/r/askgaybros/comments/25as9o/relationship_question_is_swapping_pictures_and/","Unauthenticated reddit sesssion","","False","2","","{}","I have been with my bf for the last 5 years. We meet when we were 18 and really fell in love. I am very much still in love, but feel very distrusting and lied to. Yesterday night I found several conversations on his Reddit account with others in which they swapped pictures and in one his email. I can't tell if he has used any other services but he was flirting and sent some videos out of us having sex. I understand the need for attention from other people and wanting to feel that.. but is this cheating? I am so angry and sad. When I asked him about it he tried to say it was a one time thing(but there are interations from 2 months ago and 7), he said he felt lonely because I was always working opposite shifts as him(At night). So who knows if anyone came here while I was at work.. I don't know if there is anymore to it.. Should I end it? After 5 years with him it would be starting over, our lives are so meshed together.

Is this common in gay relationships?! Should it be a red flag or nothing to get worked up about. Please help me. I don't know how to handle this.
","&lt;!-- SC_OFF --&gt;&lt;div class=""md""&gt;&lt;p&gt;I have been with my bf for the last 5 years. We meet when we were 18 and really fell in love. I am very much still in love, but feel very distrusting and lied to. Yesterday night I found several conversations on his Reddit account with others in which they swapped pictures and in one his email. I can&amp;#39;t tell if he has used any other services but he was flirting and sent some videos out of us having sex. I understand the need for attention from other people and wanting to feel that.. but is this cheating? I am so angry and sad. When I asked him about it he tried to say it was a one time thing(but there are interations from 2 months ago and 7), he said he felt lonely because I was always working opposite shifts as him(At night). So who knows if anyone came here while I was at work.. I don&amp;#39;t know if there is anymore to it.. Should I end it? After 5 years with him it would be starting over, our lives are so meshed together.&lt;/p&gt;

&lt;p&gt;Is this common in gay relationships?! Should it be a red flag or nothing to get worked up about. Please help me. I don&amp;#39;t know how to handle this.&lt;/p&gt;
&lt;/div&gt;&lt;!-- SC_ON --&gt;","False","askgaybros","t5_2vgfw","","","Relationship question.. Is swapping pictures and chat on Reddit cheating? What should I do?","2","http://www.reddit.com/r/askgaybros/comments/25as9o/relationship_question_is_swapping_pictures_and/","[]","False"
"18","","","{}","http://www.reddit.com/api/info/","{}","{}","False","","","True","R3PO_","","","","False","1399829120.0","1399825520.0","","self.askgaybros","0","False","0","True","False","25ad92","True","","","","","","{}","[]","t3_25ad92","9","","False","http://www.reddit.com/r/askgaybros/comments/25ad92/is_the_closet_case_worth_it/","Unauthenticated reddit sesssion","","False","10","","{}","So this guy - the coset case - is a great guy. He's funny, smart, attractive, a gay bro catch if I ever saw one. Except he's apparently closeted or maybe more than that? As in I'm not even sure what his personal take is on the matter. Many of the initial signs of interest are there - he flirts with me whether or not he realizes it (but really, he *must* realize it); there's usually excessive eye contact; we make an effort to try to coordinate our schedules to catch each other (at the gym, go figure).

If he's interested in actually doing this, then I'd be game. We were all closeted once and if he's ready to at least come to terms with some of this, I'm cool with it. Not expecting life long love, but maybe something fun for awhile. And who knows? Maybe life long love! I'm open to possibilities. I tried to take it casually to the next level with an invite for some one on one time. Nothing huge, just an invite to a casual, semi-public hangout. Radio silence. (Maybe it was the semi-public bit? Not wanting to be seen with an out gay man alone... )

I'm going to play it cool. See him again and just play it off. Because I do get that this might be REALLY scary depending on his situation and mindset. Besides him being a mostly great catch (not counting the closeted part... ), my thought is if I can help him at least organize his thoughts on the matter, that would be helpful. But he has to bring something to the table, right?

Guess I'm looking for insight, maybe similar stories and their outcomes, or thoughts on the matter. Am I being too romantic, optimistic, or caring toward this project? Was asking him to hang out too forward?! It seemed like the next appropriate move.","&lt;!-- SC_OFF --&gt;&lt;div class=""md""&gt;&lt;p&gt;So this guy - the coset case - is a great guy. He&amp;#39;s funny, smart, attractive, a gay bro catch if I ever saw one. Except he&amp;#39;s apparently closeted or maybe more than that? As in I&amp;#39;m not even sure what his personal take is on the matter. Many of the initial signs of interest are there - he flirts with me whether or not he realizes it (but really, he &lt;em&gt;must&lt;/em&gt; realize it); there&amp;#39;s usually excessive eye contact; we make an effort to try to coordinate our schedules to catch each other (at the gym, go figure).&lt;/p&gt;

&lt;p&gt;If he&amp;#39;s interested in actually doing this, then I&amp;#39;d be game. We were all closeted once and if he&amp;#39;s ready to at least come to terms with some of this, I&amp;#39;m cool with it. Not expecting life long love, but maybe something fun for awhile. And who knows? Maybe life long love! I&amp;#39;m open to possibilities. I tried to take it casually to the next level with an invite for some one on one time. Nothing huge, just an invite to a casual, semi-public hangout. Radio silence. (Maybe it was the semi-public bit? Not wanting to be seen with an out gay man alone... )&lt;/p&gt;

&lt;p&gt;I&amp;#39;m going to play it cool. See him again and just play it off. Because I do get that this might be REALLY scary depending on his situation and mindset. Besides him being a mostly great catch (not counting the closeted part... ), my thought is if I can help him at least organize his thoughts on the matter, that would be helpful. But he has to bring something to the table, right?&lt;/p&gt;

&lt;p&gt;Guess I&amp;#39;m looking for insight, maybe similar stories and their outcomes, or thoughts on the matter. Am I being too romantic, optimistic, or caring toward this project? Was asking him to hang out too forward?! It seemed like the next appropriate move.&lt;/p&gt;
&lt;/div&gt;&lt;!-- SC_ON --&gt;","False","askgaybros","t5_2vgfw","","","Is the Closet Case Worth It?","10","http://www.reddit.com/r/askgaybros/comments/25ad92/is_the_closet_case_worth_it/","[]","False"
"19","","","{}","http://www.reddit.com/api/info/","{}","{}","False","","","True","swampratz","","","","False","1399829019.0","1399825419.0","","self.askgaybros","0","False","0","True","False","25ad3z","True","","","","","","{}","[]","t3_25ad3z","5","","False","http://www.reddit.com/r/askgaybros/comments/25ad3z/struggling_with_my_sexuality_thought_id_ask_you/","Unauthenticated reddit sesssion","","False","3","","{}","Hi guys, hope you can provide some insight and thanks for taking the time!

In normal life when I see a really good looking woman, that's what goes through my head, like wow, she's beautiful. But that's it. If I see a good looking guy, there is an attraction, but it's more like a wow, I envy you and want to talk to you type. I don't get turned on by the sight of a guy. 

Things that turn me on usually surround BDSM kinds of things where there's loads of discipline happening. My ultimate fantasy would be like a  marine boot camp where there is no limit to what the drill instructor could do. But even though that gets me incredibly excited, and always only involves other men, the thought of actually having sex of any kind turns me off. Just like looking at bondage porn, see the dick, turned off. But also, seeing a woman in bondage = nothing at all. 

So, was hoping you guys might be able to shine some light for me. Are any of you similar? Or do you know anyone else like this? Is this normal for a gay person? Would you say that I'm even gay? Thanks for any help!","&lt;!-- SC_OFF --&gt;&lt;div class=""md""&gt;&lt;p&gt;Hi guys, hope you can provide some insight and thanks for taking the time!&lt;/p&gt;

&lt;p&gt;In normal life when I see a really good looking woman, that&amp;#39;s what goes through my head, like wow, she&amp;#39;s beautiful. But that&amp;#39;s it. If I see a good looking guy, there is an attraction, but it&amp;#39;s more like a wow, I envy you and want to talk to you type. I don&amp;#39;t get turned on by the sight of a guy. &lt;/p&gt;

&lt;p&gt;Things that turn me on usually surround BDSM kinds of things where there&amp;#39;s loads of discipline happening. My ultimate fantasy would be like a  marine boot camp where there is no limit to what the drill instructor could do. But even though that gets me incredibly excited, and always only involves other men, the thought of actually having sex of any kind turns me off. Just like looking at bondage porn, see the dick, turned off. But also, seeing a woman in bondage = nothing at all. &lt;/p&gt;

&lt;p&gt;So, was hoping you guys might be able to shine some light for me. Are any of you similar? Or do you know anyone else like this? Is this normal for a gay person? Would you say that I&amp;#39;m even gay? Thanks for any help!&lt;/p&gt;
&lt;/div&gt;&lt;!-- SC_ON --&gt;","False","askgaybros","t5_2vgfw","","","Struggling with my sexuality, thought I'd ask you guys","3","http://www.reddit.com/r/askgaybros/comments/25ad3z/struggling_with_my_sexuality_thought_id_ask_you/","[]","False"
