"","_comment_sort","_comments","_comments_by_id","_info_url","_orphaned","_params","_replaced_more","_underscore_names","approved_by","archived","author","author_flair_css_class","author_flair_text","banned_by","clicked","created","created_utc","distinguished","domain","downs","edited","gilded","has_fetched","hidden","id","is_self","json_dict","likes","link_flair_css_class","link_flair_text","media","media_embed","mod_reports","name","num_comments","num_reports","over_18","permalink","reddit_session","report_reasons","saved","score","secure_media","secure_media_embed","selftext","selftext_html","stickied","subreddit","subreddit_id","suggested_sort","thumbnail","title","ups","url","user_reports","visited"
"16","","","{}","http://www.reddit.com/api/info/","{}","{}","False","","","False","Wereyoucheatingonme","","","","False","1422840441.0","1422840441.0","","self.askgaybros","0","False","0","True","False","2ugt8d","True","","","","","","{}","[]","t3_2ugt8d","31","","False","http://www.reddit.com/r/askgaybros/comments/2ugt8d/update_someone_knocked_on_my_door/","Unauthenticated reddit sesssion","","False","39","","{}","http://www.reddit.com/r/askgaybros/comments/2tyu6m/someone_knocked_on_my_door/

Alright. Thanks guys for the PM's and the messages. I understand some think this is total bullshit, and trust me it is until it happens to you personally. But regardless, I'm gonna tell you the rest of it anyway.

After days of ignoring John (not a real name), I told him to see me at a restaurant with his wife. At 3 in the afternoon, three of use were around the table, trying to figure things out. They started talking and yes, they were married. John admitted he told his parents him and I broke up, and told Anne (the ""wife"") I was his brother. I told Anne who I really am, and she couldn't believe it either. In all honesty, Anne is beautiful and seemed like a nice girl. After almost an hour of crying and confessing, John and Anne argued. Anne walked out. John told me in time he's gonna file a divorce so we could be together. I asked him if he loves his son, and he shut up and nodded his head. I didn't say a word and just walked away as well.

11 in the evening I was drinking. I peaked at my phone and there were walls of texts from John saying sorry and wanting to get back together etc when an unknown text came up who apparently was Anne asking me if we could see each other the day after.

5 in the afternoon the following day I was at Anne's place and saw John playing with his kid. John wanted to talk to me, again, but Anne insisted we should be alone. Anne broke down and told me he loves John and how she wanted a picture perfect family for their son, but on top of that she said sorry to me like a million times. She told me should she had known John had a boyfriend, she never should have been with him in the first place. She told me even though she felt betrayed as much as I do, she still wanted to keep John.

I see now that the problem isn't with me, I thought I was supposed to be blame for being away for work most of the time. I thought it's time for John to make up his mind. I asked Anne if I could talk to John, and we did. I asked him if he loved Anne, he said not as much as he loves me. I asked him again if he loves the kid, said he does. Well, I thought the kid deserved the white-fenced picture perfect family, not to mention something I never had, so I broke up with John.

I just saw the kid needs John more than I do. John knelt and cried asking not to break up with him. Said he has a lot of plans stored for us. I told him it's obvious that he couldn't make up what he wants. And clearly, I'm not convinced I'm one of those people he wants in his life. So I just told him we could be friends. I told him I want him to make up his mind. Idealistic as it may sound, no matter how things are lost, they will always fall on their right places.

I moved to my mom's in NYC. I also filed my resignation, maybe a less demanding job would help me recover faster. My sister is currently taking over my business because I feel too shitty to do so. After emptying my condo unit, I had one real estate agent process all the papers to sell the unit. Maybe I had to get rid of that place.

I also refused to talk to John and Anne. I asked my phone company to block them from contacting me. I also removed all my virtual accounts temporarily. I know the three of us are hurt, but I know John wouldn't neglect his kid. He might not be a good lover but I know he would make a great father. For now, I'm just hitting the gym with more exercise intensity. I'm also going back to swimming laps. I'm also thinking of launching a startup company, I heard it's a great business opportunity depending on the startup.

I just need time for myself. And I just want the kid to get the undivided attention everyone deserves.

Thanks for listening guys.","&lt;!-- SC_OFF --&gt;&lt;div class=""md""&gt;&lt;p&gt;&lt;a href=""http://www.reddit.com/r/askgaybros/comments/2tyu6m/someone_knocked_on_my_door/""&gt;http://www.reddit.com/r/askgaybros/comments/2tyu6m/someone_knocked_on_my_door/&lt;/a&gt;&lt;/p&gt;

&lt;p&gt;Alright. Thanks guys for the PM&amp;#39;s and the messages. I understand some think this is total bullshit, and trust me it is until it happens to you personally. But regardless, I&amp;#39;m gonna tell you the rest of it anyway.&lt;/p&gt;

&lt;p&gt;After days of ignoring John (not a real name), I told him to see me at a restaurant with his wife. At 3 in the afternoon, three of use were around the table, trying to figure things out. They started talking and yes, they were married. John admitted he told his parents him and I broke up, and told Anne (the &amp;quot;wife&amp;quot;) I was his brother. I told Anne who I really am, and she couldn&amp;#39;t believe it either. In all honesty, Anne is beautiful and seemed like a nice girl. After almost an hour of crying and confessing, John and Anne argued. Anne walked out. John told me in time he&amp;#39;s gonna file a divorce so we could be together. I asked him if he loves his son, and he shut up and nodded his head. I didn&amp;#39;t say a word and just walked away as well.&lt;/p&gt;

&lt;p&gt;11 in the evening I was drinking. I peaked at my phone and there were walls of texts from John saying sorry and wanting to get back together etc when an unknown text came up who apparently was Anne asking me if we could see each other the day after.&lt;/p&gt;

&lt;p&gt;5 in the afternoon the following day I was at Anne&amp;#39;s place and saw John playing with his kid. John wanted to talk to me, again, but Anne insisted we should be alone. Anne broke down and told me he loves John and how she wanted a picture perfect family for their son, but on top of that she said sorry to me like a million times. She told me should she had known John had a boyfriend, she never should have been with him in the first place. She told me even though she felt betrayed as much as I do, she still wanted to keep John.&lt;/p&gt;

&lt;p&gt;I see now that the problem isn&amp;#39;t with me, I thought I was supposed to be blame for being away for work most of the time. I thought it&amp;#39;s time for John to make up his mind. I asked Anne if I could talk to John, and we did. I asked him if he loved Anne, he said not as much as he loves me. I asked him again if he loves the kid, said he does. Well, I thought the kid deserved the white-fenced picture perfect family, not to mention something I never had, so I broke up with John.&lt;/p&gt;

&lt;p&gt;I just saw the kid needs John more than I do. John knelt and cried asking not to break up with him. Said he has a lot of plans stored for us. I told him it&amp;#39;s obvious that he couldn&amp;#39;t make up what he wants. And clearly, I&amp;#39;m not convinced I&amp;#39;m one of those people he wants in his life. So I just told him we could be friends. I told him I want him to make up his mind. Idealistic as it may sound, no matter how things are lost, they will always fall on their right places.&lt;/p&gt;

&lt;p&gt;I moved to my mom&amp;#39;s in NYC. I also filed my resignation, maybe a less demanding job would help me recover faster. My sister is currently taking over my business because I feel too shitty to do so. After emptying my condo unit, I had one real estate agent process all the papers to sell the unit. Maybe I had to get rid of that place.&lt;/p&gt;

&lt;p&gt;I also refused to talk to John and Anne. I asked my phone company to block them from contacting me. I also removed all my virtual accounts temporarily. I know the three of us are hurt, but I know John wouldn&amp;#39;t neglect his kid. He might not be a good lover but I know he would make a great father. For now, I&amp;#39;m just hitting the gym with more exercise intensity. I&amp;#39;m also going back to swimming laps. I&amp;#39;m also thinking of launching a startup company, I heard it&amp;#39;s a great business opportunity depending on the startup.&lt;/p&gt;

&lt;p&gt;I just need time for myself. And I just want the kid to get the undivided attention everyone deserves.&lt;/p&gt;

&lt;p&gt;Thanks for listening guys.&lt;/p&gt;
&lt;/div&gt;&lt;!-- SC_ON --&gt;","False","askgaybros","t5_2vgfw","","","[UPDATE] Someone knocked on my door","39","http://www.reddit.com/r/askgaybros/comments/2ugt8d/update_someone_knocked_on_my_door/","[]","False"
"17","","","{}","http://www.reddit.com/api/info/","{}","{}","False","","","False","whattodooe","","","","False","1422839519.0","1422839519.0","","self.askgaybros","0","False","0","True","False","2ugrqb","True","","","","","","{}","[]","t3_2ugrqb","16","","False","http://www.reddit.com/r/askgaybros/comments/2ugrqb/bf_wants_to_try_kinky_fetishes/","Unauthenticated reddit sesssion","","False","9","","{}","I've been in a relationship for a little over a year. Last week my bf said he wants to try some kinky stuff. We tried leather play which I wasn't into but did it for him. Now he says he really wants to try watersports... Idk what to I definitely don't want to pee on him or even worse get peed on. I told him I didn't want to do it, but he keeps bringing it up and I can tell he wants to try. 

Anyone else have a similar problem? How did you handle it? What if he ends up wanting to do something even more extreme like scat? That probably won't happen lol but I'm just worried of like a snowball effect with fetishes ","&lt;!-- SC_OFF --&gt;&lt;div class=""md""&gt;&lt;p&gt;I&amp;#39;ve been in a relationship for a little over a year. Last week my bf said he wants to try some kinky stuff. We tried leather play which I wasn&amp;#39;t into but did it for him. Now he says he really wants to try watersports... Idk what to I definitely don&amp;#39;t want to pee on him or even worse get peed on. I told him I didn&amp;#39;t want to do it, but he keeps bringing it up and I can tell he wants to try. &lt;/p&gt;

&lt;p&gt;Anyone else have a similar problem? How did you handle it? What if he ends up wanting to do something even more extreme like scat? That probably won&amp;#39;t happen lol but I&amp;#39;m just worried of like a snowball effect with fetishes &lt;/p&gt;
&lt;/div&gt;&lt;!-- SC_ON --&gt;","False","askgaybros","t5_2vgfw","","","BF wants to try kinky fetishes","9","http://www.reddit.com/r/askgaybros/comments/2ugrqb/bf_wants_to_try_kinky_fetishes/","[]","False"
