"","_comment_sort","_comments","_comments_by_id","_info_url","_orphaned","_params","_replaced_more","_underscore_names","approved_by","archived","author","author_flair_css_class","author_flair_text","banned_by","clicked","created","created_utc","distinguished","domain","downs","edited","gilded","has_fetched","hidden","id","is_self","json_dict","likes","link_flair_css_class","link_flair_text","media","media_embed","mod_reports","name","num_comments","num_reports","over_18","permalink","reddit_session","report_reasons","saved","score","secure_media","secure_media_embed","selftext","selftext_html","stickied","subreddit","subreddit_id","suggested_sort","thumbnail","title","ups","url","user_reports","visited"
"0","","","{}","http://www.reddit.com/api/info/","{}","{}","False","","","False","TrentonDucati","","","","False","1425135742.0","1425135742.0","","i.imgur.com","0","False","0","True","False","2xgqfv","False","","","","","","{}","[]","t3_2xgqfv","1","","False","http://www.reddit.com/r/askgaybros/comments/2xgqfv/after_gym_pics/","Unauthenticated reddit sesssion","","False","0","","{}","","","False","askgaybros","t5_2vgfw","","","After gym pics","0","http://i.imgur.com/3veCmvf.jpg","[]","False"
"1","","","{}","http://www.reddit.com/api/info/","{}","{}","False","","","False","MoxMe","","","","False","1425120000.0","1425120000.0","","self.askgaybros","0","False","0","True","False","2xg9p0","True","","","","","","{}","[]","t3_2xg9p0","7","","False","http://www.reddit.com/r/askgaybros/comments/2xg9p0/be_my_valentine_what_does_that_mean/","Unauthenticated reddit sesssion","","False","0","","{}","On Valentine's day, a friend asked me if I would be his Valentine. I accepted, we went to dinner and had a great night chatting and enjoying each other's company. We are not romantically involved nor has he shown interest in anything physical.

I wonder, what does being a Valentine mean these days? Why did he ask me? Did I miss something?","&lt;!-- SC_OFF --&gt;&lt;div class=""md""&gt;&lt;p&gt;On Valentine&amp;#39;s day, a friend asked me if I would be his Valentine. I accepted, we went to dinner and had a great night chatting and enjoying each other&amp;#39;s company. We are not romantically involved nor has he shown interest in anything physical.&lt;/p&gt;

&lt;p&gt;I wonder, what does being a Valentine mean these days? Why did he ask me? Did I miss something?&lt;/p&gt;
&lt;/div&gt;&lt;!-- SC_ON --&gt;","False","askgaybros","t5_2vgfw","","","Be my Valentine.. What does that mean","0","http://www.reddit.com/r/askgaybros/comments/2xg9p0/be_my_valentine_what_does_that_mean/","[]","False"
"2","","","{}","http://www.reddit.com/api/info/","{}","{}","False","","","False","adonistyler","","","","False","1425119318.0","1425119318.0","","self.askgaybros","0","False","0","True","False","2xg94l","True","","","","","","{}","[]","t3_2xg94l","12","","False","http://www.reddit.com/r/askgaybros/comments/2xg94l/update_confused_straight_maybe_guy/","Unauthenticated reddit sesssion","","False","108","","{}","Hey gaybros,
I just wanted to send an update your way to my post a few months ago: http://www.reddit.com/r/askgaybros/comments/2nvnha/confused_straight_maybe_guy/

After a couple months of experimenting with guys, I actually discovered that I am indeed gay, I just needed to let those feelings come out and accept them. Once I did everything became clear. Dating is now fun for me and flirting doesn't seem like this rocket science that I don't understand. Everything is so clear for me now, I just passed my first hurdle and came out to my best friend/roommate. I completely underestimated how freeing and liberating this would be and fell 100% on top of the moon and so good about myself! 

Its a bit of a road ahead, but I feel less lost, and I want to thank this subreddit for the advise and support to help me find a map for this road. Thank you all! :)","&lt;!-- SC_OFF --&gt;&lt;div class=""md""&gt;&lt;p&gt;Hey gaybros,
I just wanted to send an update your way to my post a few months ago: &lt;a href=""http://www.reddit.com/r/askgaybros/comments/2nvnha/confused_straight_maybe_guy/""&gt;http://www.reddit.com/r/askgaybros/comments/2nvnha/confused_straight_maybe_guy/&lt;/a&gt;&lt;/p&gt;

&lt;p&gt;After a couple months of experimenting with guys, I actually discovered that I am indeed gay, I just needed to let those feelings come out and accept them. Once I did everything became clear. Dating is now fun for me and flirting doesn&amp;#39;t seem like this rocket science that I don&amp;#39;t understand. Everything is so clear for me now, I just passed my first hurdle and came out to my best friend/roommate. I completely underestimated how freeing and liberating this would be and fell 100% on top of the moon and so good about myself! &lt;/p&gt;

&lt;p&gt;Its a bit of a road ahead, but I feel less lost, and I want to thank this subreddit for the advise and support to help me find a map for this road. Thank you all! :)&lt;/p&gt;
&lt;/div&gt;&lt;!-- SC_ON --&gt;","False","askgaybros","t5_2vgfw","","","UPDATE: Confused Straight (maybe?) Guy","108","http://www.reddit.com/r/askgaybros/comments/2xg94l/update_confused_straight_maybe_guy/","[]","False"
"3","","","{}","http://www.reddit.com/api/info/","{}","{}","False","","","False","millionoillim","","","","False","1425114160.0","1425114160.0","","self.askgaybros","0","False","0","True","False","2xg4o3","True","","","","","","{}","[]","t3_2xg4o3","14","","False","http://www.reddit.com/r/askgaybros/comments/2xg4o3/boyfriends_and_politics/","Unauthenticated reddit sesssion","","False","3","","{}","Hi guys,     
      
My boyfriend, let's call him Bill, and I have polar-opposite political beliefs. Tonight, I was criticising our Prime Minister for being sexist and Bill said, 'I don't think he's sexist, I just think he says silly things.' I disagreed and read a few cringe-worthy quotes from our Prime Minister. I asked Bill how they weren't sexist and he lost it. He raised his voice, got incredibly defensive and wouldn't let me speak. This isn't the first time this has happened.     
       
If I'm honest, my disappointment with his political beliefs may make me come across as arrogant, but, at the same time, I want to talk about these things and Bill gets angry, shuts down and tells me I put him down for his beliefs. I feel like he gets the benefit of disagreeing with my opinion, but then won't explain why or discuss it with me.     
        
What should I do? Should I shut my mouth and accept that it's something we can't talk about?      
         
Confused,        
Million.","&lt;!-- SC_OFF --&gt;&lt;div class=""md""&gt;&lt;p&gt;Hi guys,     &lt;/p&gt;

&lt;p&gt;My boyfriend, let&amp;#39;s call him Bill, and I have polar-opposite political beliefs. Tonight, I was criticising our Prime Minister for being sexist and Bill said, &amp;#39;I don&amp;#39;t think he&amp;#39;s sexist, I just think he says silly things.&amp;#39; I disagreed and read a few cringe-worthy quotes from our Prime Minister. I asked Bill how they weren&amp;#39;t sexist and he lost it. He raised his voice, got incredibly defensive and wouldn&amp;#39;t let me speak. This isn&amp;#39;t the first time this has happened.     &lt;/p&gt;

&lt;p&gt;If I&amp;#39;m honest, my disappointment with his political beliefs may make me come across as arrogant, but, at the same time, I want to talk about these things and Bill gets angry, shuts down and tells me I put him down for his beliefs. I feel like he gets the benefit of disagreeing with my opinion, but then won&amp;#39;t explain why or discuss it with me.     &lt;/p&gt;

&lt;p&gt;What should I do? Should I shut my mouth and accept that it&amp;#39;s something we can&amp;#39;t talk about?      &lt;/p&gt;

&lt;p&gt;Confused,&lt;br/&gt;
Million.&lt;/p&gt;
&lt;/div&gt;&lt;!-- SC_ON --&gt;","False","askgaybros","t5_2vgfw","","","Boyfriends and Politics","3","http://www.reddit.com/r/askgaybros/comments/2xg4o3/boyfriends_and_politics/","[]","False"
"4","","","{}","http://www.reddit.com/api/info/","{}","{}","False","","","False","m3t35","","","","False","1425108825.0","1425108825.0","","self.askgaybros","0","False","0","True","False","2xfzl7","True","","","","","","{}","[]","t3_2xfzl7","3","","False","http://www.reddit.com/r/askgaybros/comments/2xfzl7/accuracy_of_naat/","Unauthenticated reddit sesssion","","False","0","","{}","So I made out with a guy about a week after I had viral pharyngitis.  Stupid, I know.  I'm worried that there may be the off chance that HIV got into an open sore in my mouth.

I got a free NAAT test from my university which apparently is a rapid antibody test.  I took it about 15 days after the kiss.  It came back negative.

Am I ok?","&lt;!-- SC_OFF --&gt;&lt;div class=""md""&gt;&lt;p&gt;So I made out with a guy about a week after I had viral pharyngitis.  Stupid, I know.  I&amp;#39;m worried that there may be the off chance that HIV got into an open sore in my mouth.&lt;/p&gt;

&lt;p&gt;I got a free NAAT test from my university which apparently is a rapid antibody test.  I took it about 15 days after the kiss.  It came back negative.&lt;/p&gt;

&lt;p&gt;Am I ok?&lt;/p&gt;
&lt;/div&gt;&lt;!-- SC_ON --&gt;","False","askgaybros","t5_2vgfw","","","Accuracy of NAAT","0","http://www.reddit.com/r/askgaybros/comments/2xfzl7/accuracy_of_naat/","[]","False"
"5","","","{}","http://www.reddit.com/api/info/","{}","{}","False","","","False","CelestialBeekeeper","","","","False","1425108529.0","1425108529.0","","self.askgaybros","0","False","0","True","False","2xfzaf","True","","","","","","{}","[]","t3_2xfzaf","16","","False","http://www.reddit.com/r/askgaybros/comments/2xfzaf/doing_the_whole_gay_bar_thing/","Unauthenticated reddit sesssion","","False","4","","{}","Alrighty, I've been feeling kind of conflicted. I'm 22, I'm gay, and I drink, but I've never really gone to a gay bar. It seems like it could be fun, and I'm curious, but I also feel kind of anxious and uneasy about the whole notion.

I don't have any gay friends I could ask to join me (and even my straight friends don't like bars) so I'd pretty much have to go by myself. These are also the kinds of situations that I get shy about--I do like getting to know other people, but when I'm in a large social environment and I don't know anyone, I get uncomfortable, and make myself feel self-conscious and unwelcome. 

I live in New York City, and I know we've got at least one or two gay bars around here (though none in my neighborhood) and I don't want to avoid an experience I might enjoy. But at the same time, I don't want to go, end up feeling shy and out of place, and leave feeling worse.

Does anyone have any advice or insight into how I might make sure my experience is a good one?","&lt;!-- SC_OFF --&gt;&lt;div class=""md""&gt;&lt;p&gt;Alrighty, I&amp;#39;ve been feeling kind of conflicted. I&amp;#39;m 22, I&amp;#39;m gay, and I drink, but I&amp;#39;ve never really gone to a gay bar. It seems like it could be fun, and I&amp;#39;m curious, but I also feel kind of anxious and uneasy about the whole notion.&lt;/p&gt;

&lt;p&gt;I don&amp;#39;t have any gay friends I could ask to join me (and even my straight friends don&amp;#39;t like bars) so I&amp;#39;d pretty much have to go by myself. These are also the kinds of situations that I get shy about--I do like getting to know other people, but when I&amp;#39;m in a large social environment and I don&amp;#39;t know anyone, I get uncomfortable, and make myself feel self-conscious and unwelcome. &lt;/p&gt;

&lt;p&gt;I live in New York City, and I know we&amp;#39;ve got at least one or two gay bars around here (though none in my neighborhood) and I don&amp;#39;t want to avoid an experience I might enjoy. But at the same time, I don&amp;#39;t want to go, end up feeling shy and out of place, and leave feeling worse.&lt;/p&gt;

&lt;p&gt;Does anyone have any advice or insight into how I might make sure my experience is a good one?&lt;/p&gt;
&lt;/div&gt;&lt;!-- SC_ON --&gt;","False","askgaybros","t5_2vgfw","","","Doing the Whole Gay Bar Thing","4","http://www.reddit.com/r/askgaybros/comments/2xfzaf/doing_the_whole_gay_bar_thing/","[]","False"
"6","","","{}","http://www.reddit.com/api/info/","{}","{}","False","","","False","TrentonDucati","","","","False","1425098936.0","1425098936.0","","self.askgaybros","0","False","0","True","False","2xfml6","True","","","","","","{}","[]","t3_2xfml6","7","","False","http://www.reddit.com/r/askgaybros/comments/2xfml6/help_a_pornstar_learn_how_to_reddit_please/","Unauthenticated reddit sesssion","","False","0","","{}","
After years of being a porn model, I'm actually producing my own stuff now.  It's not easy competing with the huge productions, so I want to interact with fans and shoot what they want.  I'm new to reddit.  What subreddits would it be appropriate for me to link to free previews and gifs of my vids to my [blog](http://trentonducati.com/blog/), which also have links to my [paysite](http://www.ducatiporn.com/) on my blog in case someone wants to buy the full vid?

I want people to tell me what they want to see more of :)

Thanks!
","&lt;!-- SC_OFF --&gt;&lt;div class=""md""&gt;&lt;p&gt;After years of being a porn model, I&amp;#39;m actually producing my own stuff now.  It&amp;#39;s not easy competing with the huge productions, so I want to interact with fans and shoot what they want.  I&amp;#39;m new to reddit.  What subreddits would it be appropriate for me to link to free previews and gifs of my vids to my &lt;a href=""http://trentonducati.com/blog/""&gt;blog&lt;/a&gt;, which also have links to my &lt;a href=""http://www.ducatiporn.com/""&gt;paysite&lt;/a&gt; on my blog in case someone wants to buy the full vid?&lt;/p&gt;

&lt;p&gt;I want people to tell me what they want to see more of :)&lt;/p&gt;

&lt;p&gt;Thanks!&lt;/p&gt;
&lt;/div&gt;&lt;!-- SC_ON --&gt;","False","askgaybros","t5_2vgfw","","","Help a pornstar learn how to reddit please :)","0","http://www.reddit.com/r/askgaybros/comments/2xfml6/help_a_pornstar_learn_how_to_reddit_please/","[]","False"
"7","","","{}","http://www.reddit.com/api/info/","{}","{}","False","","","False","TrentonDucati","","","","False","1425094454.0","1425094454.0","","self.askgaybros","0","False","0","True","False","2xfffs","True","","","","","","{}","[]","t3_2xfffs","4","","False","http://www.reddit.com/r/askgaybros/comments/2xfffs/ducatiporncom/","Unauthenticated reddit sesssion","","False","0","","{}"," Hi guys this is Trenton Ducati I am a model turned producer . I want to submit clips of my new videos here . Can someone tell me how to do that . Thanks everyone ","&lt;!-- SC_OFF --&gt;&lt;div class=""md""&gt;&lt;p&gt;Hi guys this is Trenton Ducati I am a model turned producer . I want to submit clips of my new videos here . Can someone tell me how to do that . Thanks everyone &lt;/p&gt;
&lt;/div&gt;&lt;!-- SC_ON --&gt;","False","askgaybros","t5_2vgfw","","","DucatiPorn.com","0","http://www.reddit.com/r/askgaybros/comments/2xfffs/ducatiporncom/","[]","False"
"8","","","{}","http://www.reddit.com/api/info/","{}","{}","False","","","False","vicigviv","","","","False","1425093495.0","1425093495.0","","self.askgaybros","0","False","0","True","False","2xfdsy","True","","","","","","{}","[]","t3_2xfdsy","17","","False","http://www.reddit.com/r/askgaybros/comments/2xfdsy/where_does_homosexuality_comes_from/","Unauthenticated reddit sesssion","","False","0","","{}","**PLEASE! I do not want to raise a debate filled with prejudice disguised as ""opinion"" neither offend anyone! And if I do, I apologize in advance and I'll take the post down.**

It's just that, from a biological POV, everything that happens in nature is a part of evolutionary processes, being ""governed"" by a higher power or not, towards perpetuation of the species.

So, why would homosexuality be necessary - from a biological POV, again, not negating of being affirmative on religion.

My guess is that it could work as a population control mechanism, since it happens in most of the species found on earth.

Once again, don't mean to offend anyone neither deny any kind of belief, just wanted to know what you guys think!

I love this thing and you all have helped me so much!

 ","&lt;!-- SC_OFF --&gt;&lt;div class=""md""&gt;&lt;p&gt;&lt;strong&gt;PLEASE! I do not want to raise a debate filled with prejudice disguised as &amp;quot;opinion&amp;quot; neither offend anyone! And if I do, I apologize in advance and I&amp;#39;ll take the post down.&lt;/strong&gt;&lt;/p&gt;

&lt;p&gt;It&amp;#39;s just that, from a biological POV, everything that happens in nature is a part of evolutionary processes, being &amp;quot;governed&amp;quot; by a higher power or not, towards perpetuation of the species.&lt;/p&gt;

&lt;p&gt;So, why would homosexuality be necessary - from a biological POV, again, not negating of being affirmative on religion.&lt;/p&gt;

&lt;p&gt;My guess is that it could work as a population control mechanism, since it happens in most of the species found on earth.&lt;/p&gt;

&lt;p&gt;Once again, don&amp;#39;t mean to offend anyone neither deny any kind of belief, just wanted to know what you guys think!&lt;/p&gt;

&lt;p&gt;I love this thing and you all have helped me so much!&lt;/p&gt;
&lt;/div&gt;&lt;!-- SC_ON --&gt;","False","askgaybros","t5_2vgfw","","","Where does homosexuality comes from?","0","http://www.reddit.com/r/askgaybros/comments/2xfdsy/where_does_homosexuality_comes_from/","[]","False"
"9","","","{}","http://www.reddit.com/api/info/","{}","{}","False","","","False","Gayguygeek","","","","False","1425091201.0","1425091201.0","","self.askgaybros","0","False","0","True","False","2xf9vl","True","","","","","","{}","[]","t3_2xf9vl","29","","False","http://www.reddit.com/r/askgaybros/comments/2xf9vl/no_sex_drive_am_i_becoming_asexual/","Unauthenticated reddit sesssion","","False","2","","{}","So, lately I seem to be losing interest in everything. This also includes guys, I never feel aroused and I have lost all desire to seek out guys. Has anyone have any idea why this would be happening all the sudden? I'm only 21 and I have no idea what happened to me. ","&lt;!-- SC_OFF --&gt;&lt;div class=""md""&gt;&lt;p&gt;So, lately I seem to be losing interest in everything. This also includes guys, I never feel aroused and I have lost all desire to seek out guys. Has anyone have any idea why this would be happening all the sudden? I&amp;#39;m only 21 and I have no idea what happened to me. &lt;/p&gt;
&lt;/div&gt;&lt;!-- SC_ON --&gt;","False","askgaybros","t5_2vgfw","","","No sex drive. Am I becoming asexual?","2","http://www.reddit.com/r/askgaybros/comments/2xf9vl/no_sex_drive_am_i_becoming_asexual/","[]","False"
"10","","","{}","http://www.reddit.com/api/info/","{}","{}","False","","","False","RadiationNeon","","","","False","1425089128.0","1425089128.0","","self.askgaybros","0","False","0","True","False","2xf6ad","True","","","","","","{}","[]","t3_2xf6ad","11","","False","http://www.reddit.com/r/askgaybros/comments/2xf6ad/help_me/","Unauthenticated reddit sesssion","","False","3","","{}","I'm nick?","&lt;!-- SC_OFF --&gt;&lt;div class=""md""&gt;&lt;p&gt;I&amp;#39;m nick?&lt;/p&gt;
&lt;/div&gt;&lt;!-- SC_ON --&gt;","False","askgaybros","t5_2vgfw","","","Help me","3","http://www.reddit.com/r/askgaybros/comments/2xf6ad/help_me/","[]","False"
"11","","","{}","http://www.reddit.com/api/info/","{}","{}","False","","","False","dsgdjsg","","","","False","1425086463.0","1425086463.0","","self.askgaybros","0","False","0","True","False","2xf1kp","True","","","","","","{}","[]","t3_2xf1kp","6","","False","http://www.reddit.com/r/askgaybros/comments/2xf1kp/weird_red_mark/","Unauthenticated reddit sesssion","","False","3","","{}","Sorry if this is the wrong place to ask, but I've seen people get help for things like this on this subreddit.

So this guy was making out with me about seven weeks ago and sucked and bit my neck pretty aggressively.  I got a hickey and thought it would fade away, but I still have a mark on my neck.  It's a mix between a brownish hickey and it also sometimes gets red and itchy.

I sometimes get red patches on my skin due to eczema and it looks really similar.

Could I potentially have contracted a disease there, or is it just a hickey and some irritation?  Is it unheard of for hickeys to last this long?  It is not symptomatic of anything I've read for herpes... it is spread out redness with no blisters and no pain.

If he had a cold sore, could he have given me herpes on my neck?  I'm really frustrated about this.","&lt;!-- SC_OFF --&gt;&lt;div class=""md""&gt;&lt;p&gt;Sorry if this is the wrong place to ask, but I&amp;#39;ve seen people get help for things like this on this subreddit.&lt;/p&gt;

&lt;p&gt;So this guy was making out with me about seven weeks ago and sucked and bit my neck pretty aggressively.  I got a hickey and thought it would fade away, but I still have a mark on my neck.  It&amp;#39;s a mix between a brownish hickey and it also sometimes gets red and itchy.&lt;/p&gt;

&lt;p&gt;I sometimes get red patches on my skin due to eczema and it looks really similar.&lt;/p&gt;

&lt;p&gt;Could I potentially have contracted a disease there, or is it just a hickey and some irritation?  Is it unheard of for hickeys to last this long?  It is not symptomatic of anything I&amp;#39;ve read for herpes... it is spread out redness with no blisters and no pain.&lt;/p&gt;

&lt;p&gt;If he had a cold sore, could he have given me herpes on my neck?  I&amp;#39;m really frustrated about this.&lt;/p&gt;
&lt;/div&gt;&lt;!-- SC_ON --&gt;","False","askgaybros","t5_2vgfw","","","Weird red mark","3","http://www.reddit.com/r/askgaybros/comments/2xf1kp/weird_red_mark/","[]","False"
"12","","","{}","http://www.reddit.com/api/info/","{}","{}","False","","","False","WonderfulJustWonderf","","","","False","1425081980.0","1425081980.0","","self.askgaybros","0","False","0","True","False","2xetf5","True","","","","","","{}","[]","t3_2xetf5","7","","False","http://www.reddit.com/r/askgaybros/comments/2xetf5/please_do_not_blame_me_for_losing_my_boner_if/","Unauthenticated reddit sesssion","","False","0","","{}","shortly after I stick my dick in your ass, there is an awful stench in the air. 

Guys, *prepare* yourself better! The last few guys I've hooked up with, I've had this problem. Is there something in the Los Angeles water? Guys, I beg of you: prepare yourself.","&lt;!-- SC_OFF --&gt;&lt;div class=""md""&gt;&lt;p&gt;shortly after I stick my dick in your ass, there is an awful stench in the air. &lt;/p&gt;

&lt;p&gt;Guys, &lt;em&gt;prepare&lt;/em&gt; yourself better! The last few guys I&amp;#39;ve hooked up with, I&amp;#39;ve had this problem. Is there something in the Los Angeles water? Guys, I beg of you: prepare yourself.&lt;/p&gt;
&lt;/div&gt;&lt;!-- SC_ON --&gt;","False","askgaybros","t5_2vgfw","","","Please do not blame me for losing my boner if...","0","http://www.reddit.com/r/askgaybros/comments/2xetf5/please_do_not_blame_me_for_losing_my_boner_if/","[]","False"
"13","","","{}","http://www.reddit.com/api/info/","{}","{}","False","","","False","sunscreenlube","","","","False","1425078935.0","1425078935.0","","self.askgaybros","0","False","0","True","False","2xency","True","","","","","","{}","[]","t3_2xency","6","","False","http://www.reddit.com/r/askgaybros/comments/2xency/bottoms_how_do_you_feel_about_morning_or/","Unauthenticated reddit sesssion","","False","2","","{}","So I've been dating this guy for a while and morning sex is bound to happen eventually. I usually douche with water before sexy time, but I won't have time to do that in the morning. Just go with it because shit happens? Or is there a way around this?","&lt;!-- SC_OFF --&gt;&lt;div class=""md""&gt;&lt;p&gt;So I&amp;#39;ve been dating this guy for a while and morning sex is bound to happen eventually. I usually douche with water before sexy time, but I won&amp;#39;t have time to do that in the morning. Just go with it because shit happens? Or is there a way around this?&lt;/p&gt;
&lt;/div&gt;&lt;!-- SC_ON --&gt;","False","askgaybros","t5_2vgfw","","","Bottoms: how do you feel about morning or spontaneous sex?","2","http://www.reddit.com/r/askgaybros/comments/2xency/bottoms_how_do_you_feel_about_morning_or/","[]","False"
