"","_comment_sort","_comments","_comments_by_id","_info_url","_orphaned","_params","_replaced_more","_underscore_names","approved_by","archived","author","author_flair_css_class","author_flair_text","banned_by","clicked","created","created_utc","distinguished","domain","downs","edited","gilded","has_fetched","hidden","id","is_self","json_dict","likes","link_flair_css_class","link_flair_text","media","media_embed","mod_reports","name","num_comments","num_reports","over_18","permalink","reddit_session","report_reasons","saved","score","secure_media","secure_media_embed","selftext","selftext_html","stickied","subreddit","subreddit_id","suggested_sort","thumbnail","title","ups","url","user_reports","visited"
"0","","","{}","http://www.reddit.com/api/info/","{}","{}","False","","","False","kickhisassSEBAS","","","","False","1419952920.0","1419952920.0","","self.askgaybros","0","False","0","True","False","2qtj65","True","","","","","","{}","[]","t3_2qtj65","35","","False","http://www.reddit.com/r/askgaybros/comments/2qtj65/knowing_what_you_know_now_what_is_something_that/","Unauthenticated reddit sesssion","","False","12","","{}","I've been out for three years now and this is something I've always been curious to hear about from other people. I guess I could provide my own examples.

Before coming out I never had any connection to the gay community so it was pretty overwhelming when I began to surround myself with it. As immature and naive as I may have been I thought that the gay community consisted of effiminte guys, Lady Gaga, and glitter. Noone told me about the apps and the hook up culture that is associated with it, how small the gay community truly can be and the trials and tribulations of anal sex. 

That's only a brief snippet of what I've learned but I'm curious to know about your thoughts. 

Gaybros, enlighten me! ","&lt;!-- SC_OFF --&gt;&lt;div class=""md""&gt;&lt;p&gt;I&amp;#39;ve been out for three years now and this is something I&amp;#39;ve always been curious to hear about from other people. I guess I could provide my own examples.&lt;/p&gt;

&lt;p&gt;Before coming out I never had any connection to the gay community so it was pretty overwhelming when I began to surround myself with it. As immature and naive as I may have been I thought that the gay community consisted of effiminte guys, Lady Gaga, and glitter. Noone told me about the apps and the hook up culture that is associated with it, how small the gay community truly can be and the trials and tribulations of anal sex. &lt;/p&gt;

&lt;p&gt;That&amp;#39;s only a brief snippet of what I&amp;#39;ve learned but I&amp;#39;m curious to know about your thoughts. &lt;/p&gt;

&lt;p&gt;Gaybros, enlighten me! &lt;/p&gt;
&lt;/div&gt;&lt;!-- SC_ON --&gt;","False","askgaybros","t5_2vgfw","","","Knowing what you know now what is something that you wish you could tell yourself before coming out?","12","http://www.reddit.com/r/askgaybros/comments/2qtj65/knowing_what_you_know_now_what_is_something_that/","[]","False"
"1","","","{}","http://www.reddit.com/api/info/","{}","{}","False","","","False","MindOfVoid","","","","False","1419951542.0","1419951542.0","","self.askgaybros","0","1419973665.0","0","True","False","2qth19","True","","","","","","{}","[]","t3_2qth19","21","","False","http://www.reddit.com/r/askgaybros/comments/2qth19/uncomfortable_in_my_mind_right_now_rantish/","Unauthenticated reddit sesssion","","False","17","","{}","It's been 7 months since I realised, it's been about 5 months since I've accepted it and supposedly 1 month since I've gained someone I can be happy about.

Coming out seemed somewhat easy, at least compared to what other people go through in terms of unaccepting family and/or friends. I just had the internal battle, everyone else seemed cool with it.

Now I'm uncomfortable again and I'm supposed to be happy. I've been with what seems like the most amazing guy for 1 month, but now something is bothering me. He recently told me that he's only let 3 other guys top him and it was uncomfortable enough for him to not want to try it again. So yeah, he will probably never bottom for me.

I consider myself somewhat versatile and will probably mostly adjust to my partners preference. I have no desire of being in a dom/sub relationship, I want to be with someone who considers me as their equal. I'm ok with sexual preferences and could probably do 1 thing more depending on what my partner wants, but the thought of never being able to top this guy is killing me. I might be younger, but I'm a man with a penis too so why shouldn't I get to use it once in a while?

I wouldn't want to change someones prefered sexual position, but is it so wrong that I want a compromise once in a while so I can feel equal? In my mind it's ridiculous that he would expose me to something he doesn't want done to himself at all, it just doesn't seem fair. I know topping shouldn't necessarily make one feel superior to the other, but let's be real, it's kind of a dominant position especially if you claim to strictly top. You see how that goes against my wish for an equal relationship?

You could tell me how bottoming can be dominant or how it's totally okay to strictly bottom, but I already know this, it just doesn't fit me (which is why this is more of a rant than a shout out for advice). I'd like to do both and the feeling of predicting an end to what seems like the perfect relationship is killing me. I can live with this for a while, but eventually It'll be too much for me to bottom everytime and I'll have to say bye and hunt for someone who's more versatile... AND THAT'S FUCKING SCARY BECAUSE I'VE REALLY FALLEN FOR THIS GUY!

It makes me sick to my stomach, I can't believe I've even been considering ending it, because ending such a great emotional bond over something as superficial as sex seems ridiculous, but in reality I know it will be an issue worth ending it over. I have little hope of him wanting to bottom for me, but I also know that some guys change this over time (I usually lurk here on another account), so it doesn't seem completely hopeless, yet... it kind fo feels hopeless.

I'm happy when I'm with him and time flies, but then when I have alone time I'm stuck in a stream of negative thoughts (I'm an introvert, dont' tell me to stop overthinking it, I can't) like this. I'm not sure where I'm going with this, please help?

Edit: thanks to everyone who has taken the time to give input on my rant and thanks in advance to anyone who might give more input, truly appreciated!","&lt;!-- SC_OFF --&gt;&lt;div class=""md""&gt;&lt;p&gt;It&amp;#39;s been 7 months since I realised, it&amp;#39;s been about 5 months since I&amp;#39;ve accepted it and supposedly 1 month since I&amp;#39;ve gained someone I can be happy about.&lt;/p&gt;

&lt;p&gt;Coming out seemed somewhat easy, at least compared to what other people go through in terms of unaccepting family and/or friends. I just had the internal battle, everyone else seemed cool with it.&lt;/p&gt;

&lt;p&gt;Now I&amp;#39;m uncomfortable again and I&amp;#39;m supposed to be happy. I&amp;#39;ve been with what seems like the most amazing guy for 1 month, but now something is bothering me. He recently told me that he&amp;#39;s only let 3 other guys top him and it was uncomfortable enough for him to not want to try it again. So yeah, he will probably never bottom for me.&lt;/p&gt;

&lt;p&gt;I consider myself somewhat versatile and will probably mostly adjust to my partners preference. I have no desire of being in a dom/sub relationship, I want to be with someone who considers me as their equal. I&amp;#39;m ok with sexual preferences and could probably do 1 thing more depending on what my partner wants, but the thought of never being able to top this guy is killing me. I might be younger, but I&amp;#39;m a man with a penis too so why shouldn&amp;#39;t I get to use it once in a while?&lt;/p&gt;

&lt;p&gt;I wouldn&amp;#39;t want to change someones prefered sexual position, but is it so wrong that I want a compromise once in a while so I can feel equal? In my mind it&amp;#39;s ridiculous that he would expose me to something he doesn&amp;#39;t want done to himself at all, it just doesn&amp;#39;t seem fair. I know topping shouldn&amp;#39;t necessarily make one feel superior to the other, but let&amp;#39;s be real, it&amp;#39;s kind of a dominant position especially if you claim to strictly top. You see how that goes against my wish for an equal relationship?&lt;/p&gt;

&lt;p&gt;You could tell me how bottoming can be dominant or how it&amp;#39;s totally okay to strictly bottom, but I already know this, it just doesn&amp;#39;t fit me (which is why this is more of a rant than a shout out for advice). I&amp;#39;d like to do both and the feeling of predicting an end to what seems like the perfect relationship is killing me. I can live with this for a while, but eventually It&amp;#39;ll be too much for me to bottom everytime and I&amp;#39;ll have to say bye and hunt for someone who&amp;#39;s more versatile... AND THAT&amp;#39;S FUCKING SCARY BECAUSE I&amp;#39;VE REALLY FALLEN FOR THIS GUY!&lt;/p&gt;

&lt;p&gt;It makes me sick to my stomach, I can&amp;#39;t believe I&amp;#39;ve even been considering ending it, because ending such a great emotional bond over something as superficial as sex seems ridiculous, but in reality I know it will be an issue worth ending it over. I have little hope of him wanting to bottom for me, but I also know that some guys change this over time (I usually lurk here on another account), so it doesn&amp;#39;t seem completely hopeless, yet... it kind fo feels hopeless.&lt;/p&gt;

&lt;p&gt;I&amp;#39;m happy when I&amp;#39;m with him and time flies, but then when I have alone time I&amp;#39;m stuck in a stream of negative thoughts (I&amp;#39;m an introvert, dont&amp;#39; tell me to stop overthinking it, I can&amp;#39;t) like this. I&amp;#39;m not sure where I&amp;#39;m going with this, please help?&lt;/p&gt;

&lt;p&gt;Edit: thanks to everyone who has taken the time to give input on my rant and thanks in advance to anyone who might give more input, truly appreciated!&lt;/p&gt;
&lt;/div&gt;&lt;!-- SC_ON --&gt;","False","askgaybros","t5_2vgfw","","","Uncomfortable in my mind right now (rant'ish)","17","http://www.reddit.com/r/askgaybros/comments/2qth19/uncomfortable_in_my_mind_right_now_rantish/","[]","False"
"2","","","{}","http://www.reddit.com/api/info/","{}","{}","False","","","False","briannoil","","","","False","1419945287.0","1419945287.0","","self.askgaybros","0","False","0","True","False","2qt952","True","","","","","","{}","[]","t3_2qt952","20","","False","http://www.reddit.com/r/askgaybros/comments/2qt952/need_input_on_guys_names_for_a_writing_project/","Unauthenticated reddit sesssion","","False","2","","{}","I'm working on a writing project and I'm doing a survey on some names and what personality traits those names conjure. I've got some responses from folks at my usual online haunts, but someone else suggested I might ask redditt for input.

Since this writing project is directed at gay male audiences, well... I wound up here. But before I signed up for an account first thing and simply posted a link to my survey, I wanted to check and see if it would be OK to ask this group for input on that? If not, that's cool - I completely understand raising an eyebrow at the new guy swooping in and asking for feedback right away.

I did post it in another community here, too (one specifically for surveys). But I'd very much like some more focused input, too - if that's allowed. Just didn't want to start out on the wrong foot in a new community.","&lt;!-- SC_OFF --&gt;&lt;div class=""md""&gt;&lt;p&gt;I&amp;#39;m working on a writing project and I&amp;#39;m doing a survey on some names and what personality traits those names conjure. I&amp;#39;ve got some responses from folks at my usual online haunts, but someone else suggested I might ask redditt for input.&lt;/p&gt;

&lt;p&gt;Since this writing project is directed at gay male audiences, well... I wound up here. But before I signed up for an account first thing and simply posted a link to my survey, I wanted to check and see if it would be OK to ask this group for input on that? If not, that&amp;#39;s cool - I completely understand raising an eyebrow at the new guy swooping in and asking for feedback right away.&lt;/p&gt;

&lt;p&gt;I did post it in another community here, too (one specifically for surveys). But I&amp;#39;d very much like some more focused input, too - if that&amp;#39;s allowed. Just didn&amp;#39;t want to start out on the wrong foot in a new community.&lt;/p&gt;
&lt;/div&gt;&lt;!-- SC_ON --&gt;","False","askgaybros","t5_2vgfw","","","Need Input on Guy's Names For a Writing Project","2","http://www.reddit.com/r/askgaybros/comments/2qt952/need_input_on_guys_names_for_a_writing_project/","[]","False"
"3","","","{}","http://www.reddit.com/api/info/","{}","{}","False","","","False","Puibmka23","","","","False","1419937562.0","1419937562.0","","self.askgaybros","0","False","0","True","False","2qt1jo","True","","","","","","{}","[]","t3_2qt1jo","7","","False","http://www.reddit.com/r/askgaybros/comments/2qt1jo/how_do_you_move_on_from_a_what_could_have_been/","Unauthenticated reddit sesssion","","False","6","","{}","Here's the situation, I've been crushing hard on this guy for over a year and a half now. He has an idea that I'm interested but all I've been getting are mixed signals on whether the feeling's mutual or not. 

Well, whether he's interested or not, I've decided over the Christmas break that I won't be wasting my time waiting for a confirmation as I have held off for him for over a year now with no sign of progress.

I've since realized that old habits are hard to break as I still think of the ""What ifs"" every now and then and it's been really toxic for me as I feel like it's turned somewhat into an obsession (one of the reasons why I've decided to ""stop"" it).

Do you guys have any advice on how I could go about this? Christmas break is ending soon and I want to start the new year on a healthy note.","&lt;!-- SC_OFF --&gt;&lt;div class=""md""&gt;&lt;p&gt;Here&amp;#39;s the situation, I&amp;#39;ve been crushing hard on this guy for over a year and a half now. He has an idea that I&amp;#39;m interested but all I&amp;#39;ve been getting are mixed signals on whether the feeling&amp;#39;s mutual or not. &lt;/p&gt;

&lt;p&gt;Well, whether he&amp;#39;s interested or not, I&amp;#39;ve decided over the Christmas break that I won&amp;#39;t be wasting my time waiting for a confirmation as I have held off for him for over a year now with no sign of progress.&lt;/p&gt;

&lt;p&gt;I&amp;#39;ve since realized that old habits are hard to break as I still think of the &amp;quot;What ifs&amp;quot; every now and then and it&amp;#39;s been really toxic for me as I feel like it&amp;#39;s turned somewhat into an obsession (one of the reasons why I&amp;#39;ve decided to &amp;quot;stop&amp;quot; it).&lt;/p&gt;

&lt;p&gt;Do you guys have any advice on how I could go about this? Christmas break is ending soon and I want to start the new year on a healthy note.&lt;/p&gt;
&lt;/div&gt;&lt;!-- SC_ON --&gt;","False","askgaybros","t5_2vgfw","","","How do you move on from a ""What could have been"" that you see on a daily basis?","6","http://www.reddit.com/r/askgaybros/comments/2qt1jo/how_do_you_move_on_from_a_what_could_have_been/","[]","False"
"4","","","{}","http://www.reddit.com/api/info/","{}","{}","False","","","False","Im_not_wrong","","","","False","1419932519.0","1419932519.0","","self.askgaybros","0","False","0","True","False","2qswtg","True","","","","","","{}","[]","t3_2qswtg","5","","False","http://www.reddit.com/r/askgaybros/comments/2qswtg/i_dont_know_what_to_do/","Unauthenticated reddit sesssion","","False","2","","{}","I am gay, I found out my friend is gay, and I like him, but I am really shy and find it extremely difficult to make a move.  I have told him my feelings and he seemed surprised but was willing to see if something was there, and we have hung out a few times.  The problem is I always think myself out of making an actual advance towards him.  I keep thinking things like ""what if he isn't interested"", or ""what if it makes things weird"".  If someone has been in a similar situation, or someone can shed some light on what they think I should do, it would be highly appreciated.","&lt;!-- SC_OFF --&gt;&lt;div class=""md""&gt;&lt;p&gt;I am gay, I found out my friend is gay, and I like him, but I am really shy and find it extremely difficult to make a move.  I have told him my feelings and he seemed surprised but was willing to see if something was there, and we have hung out a few times.  The problem is I always think myself out of making an actual advance towards him.  I keep thinking things like &amp;quot;what if he isn&amp;#39;t interested&amp;quot;, or &amp;quot;what if it makes things weird&amp;quot;.  If someone has been in a similar situation, or someone can shed some light on what they think I should do, it would be highly appreciated.&lt;/p&gt;
&lt;/div&gt;&lt;!-- SC_ON --&gt;","False","askgaybros","t5_2vgfw","","","I don't know what to do","2","http://www.reddit.com/r/askgaybros/comments/2qswtg/i_dont_know_what_to_do/","[]","False"
"5","","","{}","http://www.reddit.com/api/info/","{}","{}","False","","","False","ricewaffle","","","","False","1419931301.0","1419931301.0","","self.askgaybros","0","False","0","True","False","2qsvju","True","","","","","","{}","[]","t3_2qsvju","13","","False","http://www.reddit.com/r/askgaybros/comments/2qsvju/first_time_going_to_a_gay_bar_on_new_years_eve/","Unauthenticated reddit sesssion","","False","9","","{}","I am still in the closet and have never been to a gay bar before. I haven't told anyone yet and I don't know any gay people so I can only go for myself. Is this a good idea? Are there any important things I should know before going to a gay bar on new years on my own? I should also say that I'm only 17 but I live in Germany.","&lt;!-- SC_OFF --&gt;&lt;div class=""md""&gt;&lt;p&gt;I am still in the closet and have never been to a gay bar before. I haven&amp;#39;t told anyone yet and I don&amp;#39;t know any gay people so I can only go for myself. Is this a good idea? Are there any important things I should know before going to a gay bar on new years on my own? I should also say that I&amp;#39;m only 17 but I live in Germany.&lt;/p&gt;
&lt;/div&gt;&lt;!-- SC_ON --&gt;","False","askgaybros","t5_2vgfw","","","First time going to a gay bar on new years eve?","9","http://www.reddit.com/r/askgaybros/comments/2qsvju/first_time_going_to_a_gay_bar_on_new_years_eve/","[]","False"
"6","","","{}","http://www.reddit.com/api/info/","{}","{}","False","","","False","myagbthrowaway","","","","False","1419923833.0","1419923833.0","","self.askgaybros","0","False","0","True","False","2qsnbb","True","","","","","","{}","[]","t3_2qsnbb","9","","False","http://www.reddit.com/r/askgaybros/comments/2qsnbb/i_dont_know_what_i_am/","Unauthenticated reddit sesssion","","False","4","","{}","Hey guys, I need some advice. I'm a 18yo college student and I can't seem to figure out what the hell I am. So over the past 2 years I have been trying to date girls and I can't seem to really fully connect with them. There has only been one girl who I have truly ever yearned for and would say that I love her. The last two years of hs we had been good friends and prom dates junior and senior year and last year she gave tons of signals that she wanted to have sex but I just couldn't find the sexual attraction and I think it ruined our relationship. Now in college I have been hit on a couple times (I'm a slim and fit runner who still looks like a boy and told I have a nice smile) and have been told I was cute by some really good looking girls but again I can only emotionally connect with them I never can find the sexual desire for them and by not moving forward with them I lose them. My friends think I'm just awkward and bad with girls and give me hell for always screwing up chances they would never get. Now at home family and friends ask if there are any girls in my life and I always say no. Most people just assume I still yearn for my HS sweet heart (though I do think my sister may be catching on). But really I find myself sexually lusting for this beefy lumberjack thrower on our track team and other bearish guys. But I can't see myself in a relationship with a guy. Maybe it's because I have never dated or attempted to date a guy. I can still see myself dating women but I never imagine sex as a part of that. Idk if I'm gay, bi, or just an awkward guy. I don't know how to go about really figuring out what the hell I am while still staying under the radar of my friends and family. 

TL;DR I'm emotionally attracted to women but not sexually. On the other hand I'm sexually attracted to guys but not really emotionally and don't know what to do to be happy.

Any and all help is appreciated.","&lt;!-- SC_OFF --&gt;&lt;div class=""md""&gt;&lt;p&gt;Hey guys, I need some advice. I&amp;#39;m a 18yo college student and I can&amp;#39;t seem to figure out what the hell I am. So over the past 2 years I have been trying to date girls and I can&amp;#39;t seem to really fully connect with them. There has only been one girl who I have truly ever yearned for and would say that I love her. The last two years of hs we had been good friends and prom dates junior and senior year and last year she gave tons of signals that she wanted to have sex but I just couldn&amp;#39;t find the sexual attraction and I think it ruined our relationship. Now in college I have been hit on a couple times (I&amp;#39;m a slim and fit runner who still looks like a boy and told I have a nice smile) and have been told I was cute by some really good looking girls but again I can only emotionally connect with them I never can find the sexual desire for them and by not moving forward with them I lose them. My friends think I&amp;#39;m just awkward and bad with girls and give me hell for always screwing up chances they would never get. Now at home family and friends ask if there are any girls in my life and I always say no. Most people just assume I still yearn for my HS sweet heart (though I do think my sister may be catching on). But really I find myself sexually lusting for this beefy lumberjack thrower on our track team and other bearish guys. But I can&amp;#39;t see myself in a relationship with a guy. Maybe it&amp;#39;s because I have never dated or attempted to date a guy. I can still see myself dating women but I never imagine sex as a part of that. Idk if I&amp;#39;m gay, bi, or just an awkward guy. I don&amp;#39;t know how to go about really figuring out what the hell I am while still staying under the radar of my friends and family. &lt;/p&gt;

&lt;p&gt;TL;DR I&amp;#39;m emotionally attracted to women but not sexually. On the other hand I&amp;#39;m sexually attracted to guys but not really emotionally and don&amp;#39;t know what to do to be happy.&lt;/p&gt;

&lt;p&gt;Any and all help is appreciated.&lt;/p&gt;
&lt;/div&gt;&lt;!-- SC_ON --&gt;","False","askgaybros","t5_2vgfw","","","I don't know what I am","4","http://www.reddit.com/r/askgaybros/comments/2qsnbb/i_dont_know_what_i_am/","[]","False"
