"","_comment_sort","_comments","_comments_by_id","_info_url","_orphaned","_params","_replaced_more","_underscore_names","approved_by","archived","author","author_flair_css_class","author_flair_text","banned_by","clicked","created","created_utc","distinguished","domain","downs","edited","gilded","has_fetched","hidden","id","is_self","json_dict","likes","link_flair_css_class","link_flair_text","media","media_embed","mod_reports","name","num_comments","num_reports","over_18","permalink","reddit_session","report_reasons","saved","score","secure_media","secure_media_embed","selftext","selftext_html","stickied","subreddit","subreddit_id","suggested_sort","thumbnail","title","ups","url","user_reports","visited"
"10","","","{}","http://www.reddit.com/api/info/","{}","{}","False","","","False","HopelessSubmantic","","","","False","1422858659.0","1422858659.0","","self.askgaybros","0","False","0","True","False","2uhqwn","True","","","","","","{}","[]","t3_2uhqwn","2","","False","http://www.reddit.com/r/askgaybros/comments/2uhqwn/i_dont_know_where_else_to_post_this_but_id_love/","Unauthenticated reddit sesssion","","False","2","","{}","So I am a 23 year old guy, and I've been involved with kink for about 6 months now. Which is not a lot of time, but I started pretty far in the deep end. I have a Master and Sir, who are a married couple (in their 30s). We live very far away from each other, but I recently went to serve them as their live-in slave for a two week period, and that was really my first serious kink experience. 

I loved absolutely everything about it. Everything clicked. The three of us had amazing chemistry. When things got rough, I was dedicated to taking it for them. When they showed me affection, I was ridiculously happy. Ridiculously happy doesn't begin to describe it adequately... But it was amazing, and I was where I was meant to be. They feel similarly about me. Everything was just so right.

So I am still obviously serving them, albeit, remotely. I've another trip to see them in about 2 months. They've talked to me about the possibility of collaring me, and how I feel about that. What it means... the commitment involved. It sounds GREAT to me. I feel that connected to them already.

However. They are a married couple. I'm a single, recent college grad. Neither of these men are playing the role of boyfriend or husband for me. They are my Doms. They might eventually be my Owners/Handlers. But they're not my boyfriends. They also want to completely avoid any kind of discussion about making this a full time thing until A) I get some more experience with BDSM with them and B) I finish grad school, and get a start with what I'm interested in career-wise. We all agreed, this relationship should compliment my life, not derail it. 

So I'm sort of at a loss with how romantic relationships work in these situations. I love these guys so much. But they aren't romantic relationships. They are tender, affectionate and loving at times, but they're not my boyfriends. But I feel like it's going to be VERRRRY hard to date, and maintain this relationship. 

**QUESTIONS:**Does EVERY potential bf need to know right out of the gate that I'm super committed (and maybe collared) by two doms? I've dated before, and never even told guys about my interest in kink... This seems to make it unavoidable. Is it even POSSIBLE to date and be owned at the same? Do I need to put a love life on the back burner if I'm committed to these men? They offer a definite, committed, fulfilling relationship. I'm getting so much from them, and really have NO interest in losing it to go back to dating around... But I don't want to be released in my 30s and realize that now I have no one, either.

If anyone is involved with this stuff... I'd really just like to talk a bit about how this sort of stuff at least... can work out. I've discussed it with my Master a bit.. and he assured me that if I ever find a guy I want to date, he will support me and not get jealous.. But that's not really my concern, but I don't want to push it too hard and make it seem that I'm antsy to get out. I'm not, I'm just new at this, and predisposed to looking way too far ahead. 

**TL;DR: I serve two men. I like them very, very, very, VERY much, but they're not boyfriends. Can I date and have a BDSM relationship at the same time, and if so how? And if anyone is active in this stuff, I'd love to talk....**","&lt;!-- SC_OFF --&gt;&lt;div class=""md""&gt;&lt;p&gt;So I am a 23 year old guy, and I&amp;#39;ve been involved with kink for about 6 months now. Which is not a lot of time, but I started pretty far in the deep end. I have a Master and Sir, who are a married couple (in their 30s). We live very far away from each other, but I recently went to serve them as their live-in slave for a two week period, and that was really my first serious kink experience. &lt;/p&gt;

&lt;p&gt;I loved absolutely everything about it. Everything clicked. The three of us had amazing chemistry. When things got rough, I was dedicated to taking it for them. When they showed me affection, I was ridiculously happy. Ridiculously happy doesn&amp;#39;t begin to describe it adequately... But it was amazing, and I was where I was meant to be. They feel similarly about me. Everything was just so right.&lt;/p&gt;

&lt;p&gt;So I am still obviously serving them, albeit, remotely. I&amp;#39;ve another trip to see them in about 2 months. They&amp;#39;ve talked to me about the possibility of collaring me, and how I feel about that. What it means... the commitment involved. It sounds GREAT to me. I feel that connected to them already.&lt;/p&gt;

&lt;p&gt;However. They are a married couple. I&amp;#39;m a single, recent college grad. Neither of these men are playing the role of boyfriend or husband for me. They are my Doms. They might eventually be my Owners/Handlers. But they&amp;#39;re not my boyfriends. They also want to completely avoid any kind of discussion about making this a full time thing until A) I get some more experience with BDSM with them and B) I finish grad school, and get a start with what I&amp;#39;m interested in career-wise. We all agreed, this relationship should compliment my life, not derail it. &lt;/p&gt;

&lt;p&gt;So I&amp;#39;m sort of at a loss with how romantic relationships work in these situations. I love these guys so much. But they aren&amp;#39;t romantic relationships. They are tender, affectionate and loving at times, but they&amp;#39;re not my boyfriends. But I feel like it&amp;#39;s going to be VERRRRY hard to date, and maintain this relationship. &lt;/p&gt;

&lt;p&gt;&lt;strong&gt;QUESTIONS:&lt;/strong&gt;Does EVERY potential bf need to know right out of the gate that I&amp;#39;m super committed (and maybe collared) by two doms? I&amp;#39;ve dated before, and never even told guys about my interest in kink... This seems to make it unavoidable. Is it even POSSIBLE to date and be owned at the same? Do I need to put a love life on the back burner if I&amp;#39;m committed to these men? They offer a definite, committed, fulfilling relationship. I&amp;#39;m getting so much from them, and really have NO interest in losing it to go back to dating around... But I don&amp;#39;t want to be released in my 30s and realize that now I have no one, either.&lt;/p&gt;

&lt;p&gt;If anyone is involved with this stuff... I&amp;#39;d really just like to talk a bit about how this sort of stuff at least... can work out. I&amp;#39;ve discussed it with my Master a bit.. and he assured me that if I ever find a guy I want to date, he will support me and not get jealous.. But that&amp;#39;s not really my concern, but I don&amp;#39;t want to push it too hard and make it seem that I&amp;#39;m antsy to get out. I&amp;#39;m not, I&amp;#39;m just new at this, and predisposed to looking way too far ahead. &lt;/p&gt;

&lt;p&gt;&lt;strong&gt;TL;DR: I serve two men. I like them very, very, very, VERY much, but they&amp;#39;re not boyfriends. Can I date and have a BDSM relationship at the same time, and if so how? And if anyone is active in this stuff, I&amp;#39;d love to talk....&lt;/strong&gt;&lt;/p&gt;
&lt;/div&gt;&lt;!-- SC_ON --&gt;","False","askgaybros","t5_2vgfw","","","I don't know where else to post this... But I'd love to talk to someone about having a BDSM relationship and separate romantic pursuits...","2","http://www.reddit.com/r/askgaybros/comments/2uhqwn/i_dont_know_where_else_to_post_this_but_id_love/","[]","False"
"11","","","{}","http://www.reddit.com/api/info/","{}","{}","False","","","False","throwagayawaygay","","","","False","1422855893.0","1422855893.0","","self.askgaybros","0","False","0","True","False","2uhmh1","True","","","","","","{}","[]","t3_2uhmh1","15","","False","http://www.reddit.com/r/askgaybros/comments/2uhmh1/help_my_sex_life_is_in_shambles_because_nobody/","Unauthenticated reddit sesssion","","False","0","","{}","Hey bros. I'm having this recurring problem that's driving me mad. I frequently have encounters on grindr or elsewhere that go nicely, and when we talk about getting together, it often comes down to neither of us being able to host. So we effectively have no where to bang, like we're sex orphans. Everybody is a broke millennial who either has a hundred roommates packed up their asses at all times or are living with their parents who would not take kindly to the sound of earthshaking buttfuckery emanating through their house as they watch the news. 

This shit sucks bros. I feel completely crammed and unable to breathe. Of course there is the prospect of Hotels, but for one thing people are stingy--if they had money to toss out this wouldn't be the problem in the first place--and for another I live in a city where the hotel prices are jacked up. 

The last alternative is of course the ole' kinky public sex route. It's equally hot and gross, and I don't think I would be opposed to it if it was one of those ""if a tree falls in the woods and nobody is around to hear it?"" situations. It's always been a fantasy of mine to bang in the woods or in nature, but right now it is too cold for that.  

Does anybody have an experience with this kind of situation? I'm not going to be able to afford my own place for quite some time, so the prospect of just moving on up is not in the cards. I would feel like a wretched whore banging in bathroom stalls, and I'm not sure I want to associate with the kind of dudes who would eagerly assent to such activities. But a man needs to have his needs met. What to do?","&lt;!-- SC_OFF --&gt;&lt;div class=""md""&gt;&lt;p&gt;Hey bros. I&amp;#39;m having this recurring problem that&amp;#39;s driving me mad. I frequently have encounters on grindr or elsewhere that go nicely, and when we talk about getting together, it often comes down to neither of us being able to host. So we effectively have no where to bang, like we&amp;#39;re sex orphans. Everybody is a broke millennial who either has a hundred roommates packed up their asses at all times or are living with their parents who would not take kindly to the sound of earthshaking buttfuckery emanating through their house as they watch the news. &lt;/p&gt;

&lt;p&gt;This shit sucks bros. I feel completely crammed and unable to breathe. Of course there is the prospect of Hotels, but for one thing people are stingy--if they had money to toss out this wouldn&amp;#39;t be the problem in the first place--and for another I live in a city where the hotel prices are jacked up. &lt;/p&gt;

&lt;p&gt;The last alternative is of course the ole&amp;#39; kinky public sex route. It&amp;#39;s equally hot and gross, and I don&amp;#39;t think I would be opposed to it if it was one of those &amp;quot;if a tree falls in the woods and nobody is around to hear it?&amp;quot; situations. It&amp;#39;s always been a fantasy of mine to bang in the woods or in nature, but right now it is too cold for that.  &lt;/p&gt;

&lt;p&gt;Does anybody have an experience with this kind of situation? I&amp;#39;m not going to be able to afford my own place for quite some time, so the prospect of just moving on up is not in the cards. I would feel like a wretched whore banging in bathroom stalls, and I&amp;#39;m not sure I want to associate with the kind of dudes who would eagerly assent to such activities. But a man needs to have his needs met. What to do?&lt;/p&gt;
&lt;/div&gt;&lt;!-- SC_ON --&gt;","False","askgaybros","t5_2vgfw","","","Help: my sex life is in shambles because nobody can host","0","http://www.reddit.com/r/askgaybros/comments/2uhmh1/help_my_sex_life_is_in_shambles_because_nobody/","[]","False"
"12","","","{}","http://www.reddit.com/api/info/","{}","{}","False","","","False","gtathrowaway27","","","","False","1422850654.0","1422850654.0","","self.askgaybros","0","False","0","True","False","2uhcmr","True","","","","","","{}","[]","t3_2uhcmr","33","","False","http://www.reddit.com/r/askgaybros/comments/2uhcmr/impossible_for_me_to_have_a_relationship_or_gay/","Unauthenticated reddit sesssion","","False","1","","{}","Hey guys, using a throwaway for this since it's pretty personal.  Anyway, I'm feeling pretty shitty after another lonely weekend.  It seems like it'll be impossible for me to ever get into a relationship or even have gay friends because of the following:

* I'm a virgin to the extreme...I've never even held hands with a guy
* I'm not out of the closet to my parents and couldn't ever imagine bringing a guy home
* I don't have any social life to speak of
* I hate the taste of alcohol, so I feel uncomfortable in social situations where I'm pressured to drink
* I have trouble talking to people and have self-diagnosed myself with social anxiety
* I don't think I'm very good looking, and most gay gays think that's pretty important (understandably)

I feel like any guy I'd ever date or even try to befriend would think I'm pretty weird if I told him these things.  I guess I'm just feeling really negative right now...stagnant and hopeless.  All of these issues seem too overwhelming and I have no idea how to get out of this rut.  I'm 27 now and feel like I'm running out of time :(.","&lt;!-- SC_OFF --&gt;&lt;div class=""md""&gt;&lt;p&gt;Hey guys, using a throwaway for this since it&amp;#39;s pretty personal.  Anyway, I&amp;#39;m feeling pretty shitty after another lonely weekend.  It seems like it&amp;#39;ll be impossible for me to ever get into a relationship or even have gay friends because of the following:&lt;/p&gt;

&lt;ul&gt;
&lt;li&gt;I&amp;#39;m a virgin to the extreme...I&amp;#39;ve never even held hands with a guy&lt;/li&gt;
&lt;li&gt;I&amp;#39;m not out of the closet to my parents and couldn&amp;#39;t ever imagine bringing a guy home&lt;/li&gt;
&lt;li&gt;I don&amp;#39;t have any social life to speak of&lt;/li&gt;
&lt;li&gt;I hate the taste of alcohol, so I feel uncomfortable in social situations where I&amp;#39;m pressured to drink&lt;/li&gt;
&lt;li&gt;I have trouble talking to people and have self-diagnosed myself with social anxiety&lt;/li&gt;
&lt;li&gt;I don&amp;#39;t think I&amp;#39;m very good looking, and most gay gays think that&amp;#39;s pretty important (understandably)&lt;/li&gt;
&lt;/ul&gt;

&lt;p&gt;I feel like any guy I&amp;#39;d ever date or even try to befriend would think I&amp;#39;m pretty weird if I told him these things.  I guess I&amp;#39;m just feeling really negative right now...stagnant and hopeless.  All of these issues seem too overwhelming and I have no idea how to get out of this rut.  I&amp;#39;m 27 now and feel like I&amp;#39;m running out of time :(.&lt;/p&gt;
&lt;/div&gt;&lt;!-- SC_ON --&gt;","False","askgaybros","t5_2vgfw","","","Impossible for me to have a relationship (or gay friends)","1","http://www.reddit.com/r/askgaybros/comments/2uhcmr/impossible_for_me_to_have_a_relationship_or_gay/","[]","False"
"13","","","{}","http://www.reddit.com/api/info/","{}","{}","False","","","False","8tofeel","","","","False","1422850275.0","1422850275.0","","self.askgaybros","0","False","0","True","False","2uhbun","True","","","","","","{}","[]","t3_2uhbun","14","","False","http://www.reddit.com/r/askgaybros/comments/2uhbun/hi_everyone/","Unauthenticated reddit sesssion","","False","0","","{}","Looking for a friend to talk to. Looking for an intimate relationship.","&lt;!-- SC_OFF --&gt;&lt;div class=""md""&gt;&lt;p&gt;Looking for a friend to talk to. Looking for an intimate relationship.&lt;/p&gt;
&lt;/div&gt;&lt;!-- SC_ON --&gt;","False","askgaybros","t5_2vgfw","","","Hi everyone...","0","http://www.reddit.com/r/askgaybros/comments/2uhbun/hi_everyone/","[]","False"
"14","","","{}","http://www.reddit.com/api/info/","{}","{}","False","","","False","statmarker","","","","False","1422849236.0","1422849236.0","","self.askgaybros","0","1422851032.0","0","True","False","2uh9rm","True","","","","","","{}","[]","t3_2uh9rm","5","","False","http://www.reddit.com/r/askgaybros/comments/2uh9rm/trouble_dating_while_living_at_home/","Unauthenticated reddit sesssion","","False","12","","{}","Hey guys,

Still living at home and I'm feeling kinda lonely. I'd really like to start dating but I'm suuuper introverted and between school from 8-5 most days and a part time job I'm pretty exhausted most of the time and find it really difficult to go out and be social. Not to mention that when I go home my parents are always there, meaning I can't even get a moment to myself with a guy if I meet someone.

Guess I just want to know if anyone else is in a similar situation? I could definitely make the effort to go out and meet guys but its exhausting and I have so little time or personal space that I don't think it'd be fair to someone else.","&lt;!-- SC_OFF --&gt;&lt;div class=""md""&gt;&lt;p&gt;Hey guys,&lt;/p&gt;

&lt;p&gt;Still living at home and I&amp;#39;m feeling kinda lonely. I&amp;#39;d really like to start dating but I&amp;#39;m suuuper introverted and between school from 8-5 most days and a part time job I&amp;#39;m pretty exhausted most of the time and find it really difficult to go out and be social. Not to mention that when I go home my parents are always there, meaning I can&amp;#39;t even get a moment to myself with a guy if I meet someone.&lt;/p&gt;

&lt;p&gt;Guess I just want to know if anyone else is in a similar situation? I could definitely make the effort to go out and meet guys but its exhausting and I have so little time or personal space that I don&amp;#39;t think it&amp;#39;d be fair to someone else.&lt;/p&gt;
&lt;/div&gt;&lt;!-- SC_ON --&gt;","False","askgaybros","t5_2vgfw","","","Trouble Dating While Living at Home?","12","http://www.reddit.com/r/askgaybros/comments/2uh9rm/trouble_dating_while_living_at_home/","[]","False"
"15","","","{}","http://www.reddit.com/api/info/","{}","{}","False","","","False","saucykraut","","","","False","1422845200.0","1422845200.0","","self.askgaybros","0","1422847155.0","0","True","False","2uh1vc","True","","","","","","{}","[]","t3_2uh1vc","6","","False","http://www.reddit.com/r/askgaybros/comments/2uh1vc/help/","Unauthenticated reddit sesssion","","False","3","","{}","He and I have been seeing each other for about 2 months now. For the first month or so we took it slow, had dinner together or hung out about once a week and when we had sex for the first time it was great. Yet, as we've gotten to know each other more, I'm starting to realize how little we have in common. How do I end it since I've never broken things off with anyone before? *EDIT: got rid of a bunch of useless ranting*","&lt;!-- SC_OFF --&gt;&lt;div class=""md""&gt;&lt;p&gt;He and I have been seeing each other for about 2 months now. For the first month or so we took it slow, had dinner together or hung out about once a week and when we had sex for the first time it was great. Yet, as we&amp;#39;ve gotten to know each other more, I&amp;#39;m starting to realize how little we have in common. How do I end it since I&amp;#39;ve never broken things off with anyone before? &lt;em&gt;EDIT: got rid of a bunch of useless ranting&lt;/em&gt;&lt;/p&gt;
&lt;/div&gt;&lt;!-- SC_ON --&gt;","False","askgaybros","t5_2vgfw","","","Help!","3","http://www.reddit.com/r/askgaybros/comments/2uh1vc/help/","[]","False"
