"","_comment_sort","_comments","_comments_by_id","_info_url","_orphaned","_params","_replaced_more","_underscore_names","approved_by","archived","author","author_flair_css_class","author_flair_text","banned_by","clicked","created","created_utc","distinguished","domain","downs","edited","gilded","has_fetched","hidden","id","is_self","json_dict","likes","link_flair_css_class","link_flair_text","media","media_embed","mod_reports","name","num_comments","num_reports","over_18","permalink","reddit_session","report_reasons","saved","score","secure_media","secure_media_embed","selftext","selftext_html","stickied","subreddit","subreddit_id","suggested_sort","thumbnail","title","ups","url","user_reports","visited"
"17","","","{}","http://www.reddit.com/api/info/","{}","{}","False","","","False","Spader623","","","","False","1425173173.0","1425173173.0","","self.askgaybros","0","False","0","True","False","2xinvi","True","","","","","","{}","[]","t3_2xinvi","7","","False","http://www.reddit.com/r/askgaybros/comments/2xinvi/i_have_no_idea_of_how_to_meet_guys_besides_hookup/","Unauthenticated reddit sesssion","","False","2","","{}","For a bit of background info, i'm 18, live with my parents and actually just came out today to my mom (she kinda sorta knew and i dunno about my dad but whatever)

Anyway, for me, its hard to meet people in general through social events and stuff because i'm shy. I mean, sure i can talk to people (if they talk to me first) but how do i get their number or keep in contact? And more importantly, i dont know of any social events or things around me besides some gay club. 

Any advice bros? (This is kind of choppy, sorry about that. If you need clarification please say so)","&lt;!-- SC_OFF --&gt;&lt;div class=""md""&gt;&lt;p&gt;For a bit of background info, i&amp;#39;m 18, live with my parents and actually just came out today to my mom (she kinda sorta knew and i dunno about my dad but whatever)&lt;/p&gt;

&lt;p&gt;Anyway, for me, its hard to meet people in general through social events and stuff because i&amp;#39;m shy. I mean, sure i can talk to people (if they talk to me first) but how do i get their number or keep in contact? And more importantly, i dont know of any social events or things around me besides some gay club. &lt;/p&gt;

&lt;p&gt;Any advice bros? (This is kind of choppy, sorry about that. If you need clarification please say so)&lt;/p&gt;
&lt;/div&gt;&lt;!-- SC_ON --&gt;","False","askgaybros","t5_2vgfw","","","I have no idea of how to meet guys besides hookup apps/websites","2","http://www.reddit.com/r/askgaybros/comments/2xinvi/i_have_no_idea_of_how_to_meet_guys_besides_hookup/","[]","False"
"18","","","{}","http://www.reddit.com/api/info/","{}","{}","False","","","False","daysofma","","","","False","1425161709.0","1425161709.0","","self.askgaybros","0","False","0","True","False","2xi31b","True","","","","","","{}","[]","t3_2xi31b","22","","False","http://www.reddit.com/r/askgaybros/comments/2xi31b/pencil_dick_and_sex/","Unauthenticated reddit sesssion","","False","20","","{}","So I have a pretty thin dick (around 4 inches in thickness)
and I was wondering if you could have enjoyable sex with this?
Has anyone ever had sex with a dude with a really thin dick how was it? 

Ive had about 3 one night stands and they didnt complain but they also werent going crazy. So i was just wondering if there was any hope for me","&lt;!-- SC_OFF --&gt;&lt;div class=""md""&gt;&lt;p&gt;So I have a pretty thin dick (around 4 inches in thickness)
and I was wondering if you could have enjoyable sex with this?
Has anyone ever had sex with a dude with a really thin dick how was it? &lt;/p&gt;

&lt;p&gt;Ive had about 3 one night stands and they didnt complain but they also werent going crazy. So i was just wondering if there was any hope for me&lt;/p&gt;
&lt;/div&gt;&lt;!-- SC_ON --&gt;","False","askgaybros","t5_2vgfw","","","Pencil dick and sex","20","http://www.reddit.com/r/askgaybros/comments/2xi31b/pencil_dick_and_sex/","[]","False"
"19","","","{}","http://www.reddit.com/api/info/","{}","{}","False","","","False","MisfitWeirdo","","","","False","1425160980.0","1425160980.0","","self.askgaybros","0","False","0","True","False","2xi1m3","True","","","","","","{}","[]","t3_2xi1m3","10","","False","http://www.reddit.com/r/askgaybros/comments/2xi1m3/aroused_by_woman_in_porn/","Unauthenticated reddit sesssion","","False","5","","{}","So, I was browsing through efukt and stumbled across a video titled ""Balls deep or gtfo"". In said video, a woman is doing reverse cowgirl with a big dicked man and constantly moans and complaint about the guy's overly sized anatomy. The thing is that I really get aroused by the video (I've faped to it more than a few times) and it isn't like those other straight videos that turn me on because of the guy, no. The guy in question is never seen, just his penis, and is a very ugly penis IMO (It's to wide at the bottom and to thin at the head, it doesn't even get totally hard) I like the girl's vagina, I love to see her anus and her moaning in pain and discomfort are completely sexy. I've never got this turned on by a girl since I was 12, and now, at 25, I always thought I was 100% homosexual since I realized at 14, but this is really confusing.

Am I bisexual, or just a perv that likes to see someone being pwned by big dicks. ","&lt;!-- SC_OFF --&gt;&lt;div class=""md""&gt;&lt;p&gt;So, I was browsing through efukt and stumbled across a video titled &amp;quot;Balls deep or gtfo&amp;quot;. In said video, a woman is doing reverse cowgirl with a big dicked man and constantly moans and complaint about the guy&amp;#39;s overly sized anatomy. The thing is that I really get aroused by the video (I&amp;#39;ve faped to it more than a few times) and it isn&amp;#39;t like those other straight videos that turn me on because of the guy, no. The guy in question is never seen, just his penis, and is a very ugly penis IMO (It&amp;#39;s to wide at the bottom and to thin at the head, it doesn&amp;#39;t even get totally hard) I like the girl&amp;#39;s vagina, I love to see her anus and her moaning in pain and discomfort are completely sexy. I&amp;#39;ve never got this turned on by a girl since I was 12, and now, at 25, I always thought I was 100% homosexual since I realized at 14, but this is really confusing.&lt;/p&gt;

&lt;p&gt;Am I bisexual, or just a perv that likes to see someone being pwned by big dicks. &lt;/p&gt;
&lt;/div&gt;&lt;!-- SC_ON --&gt;","False","askgaybros","t5_2vgfw","","","Aroused by woman in porn","5","http://www.reddit.com/r/askgaybros/comments/2xi1m3/aroused_by_woman_in_porn/","[]","False"
"20","","","{}","http://www.reddit.com/api/info/","{}","{}","False","","","False","Throawaypsycho","","","","False","1425160482.0","1425160482.0","","self.askgaybros","0","False","0","True","False","2xi0q5","True","","","","","","{}","[]","t3_2xi0q5","33","","False","http://www.reddit.com/r/askgaybros/comments/2xi0q5/whats_up_with_all_the_random_rejections_in_the/","Unauthenticated reddit sesssion","","False","13","","{}","Guys seriously , I'm fed up with this. I'm a good looking guy and I always try to be myself when I meet a guy but being myself seems like it's never good enough for more than 3 dates. The worst part is I always feel like it's cool , like I'm having a good time with the guy and he's enjoying his time too.

I'm usually a pro when it comes to first dates, I go there confident, and usually give a good impression, the guy usually texts me right away to tell me he wants to see me again. I keep seeing the guy and all of a sudden he just gets distant and I get dumped.

I was just seeing this guy, he'd text me handsome everyday and ask me for another date. All the dates we went on were awesome, snowboarding, bowling, movies, cuddling, ranchy sex, and then boom , nothing!! Today I find out he met someone else while seeing me . Wtf? I didnt see this one coming

How the hell do u deal with constant rejection without it affecting your self esteem? Now I keep thinking there's something wrong with me, and can't trust a dude when he tells me he's into me, I get so fuckin insecure. I think I'm not good enough for no one. And this constant rejection doesn't give me the drive to wanna work on myself and keep believing that I'm a better person! I have no idea what the hell I'm looking for on here, maybe reassurance,  someone that can relate, or tricks to stop taking rejection so personally. I've been single for 3 years and dated about 20 guys since then that all dumped me! ","&lt;!-- SC_OFF --&gt;&lt;div class=""md""&gt;&lt;p&gt;Guys seriously , I&amp;#39;m fed up with this. I&amp;#39;m a good looking guy and I always try to be myself when I meet a guy but being myself seems like it&amp;#39;s never good enough for more than 3 dates. The worst part is I always feel like it&amp;#39;s cool , like I&amp;#39;m having a good time with the guy and he&amp;#39;s enjoying his time too.&lt;/p&gt;

&lt;p&gt;I&amp;#39;m usually a pro when it comes to first dates, I go there confident, and usually give a good impression, the guy usually texts me right away to tell me he wants to see me again. I keep seeing the guy and all of a sudden he just gets distant and I get dumped.&lt;/p&gt;

&lt;p&gt;I was just seeing this guy, he&amp;#39;d text me handsome everyday and ask me for another date. All the dates we went on were awesome, snowboarding, bowling, movies, cuddling, ranchy sex, and then boom , nothing!! Today I find out he met someone else while seeing me . Wtf? I didnt see this one coming&lt;/p&gt;

&lt;p&gt;How the hell do u deal with constant rejection without it affecting your self esteem? Now I keep thinking there&amp;#39;s something wrong with me, and can&amp;#39;t trust a dude when he tells me he&amp;#39;s into me, I get so fuckin insecure. I think I&amp;#39;m not good enough for no one. And this constant rejection doesn&amp;#39;t give me the drive to wanna work on myself and keep believing that I&amp;#39;m a better person! I have no idea what the hell I&amp;#39;m looking for on here, maybe reassurance,  someone that can relate, or tricks to stop taking rejection so personally. I&amp;#39;ve been single for 3 years and dated about 20 guys since then that all dumped me! &lt;/p&gt;
&lt;/div&gt;&lt;!-- SC_ON --&gt;","False","askgaybros","t5_2vgfw","","","What's up with all the random rejections in the gay dating world and how to deal with it?","13","http://www.reddit.com/r/askgaybros/comments/2xi0q5/whats_up_with_all_the_random_rejections_in_the/","[]","False"
"21","","","{}","http://www.reddit.com/api/info/","{}","{}","False","","","False","hatessw","","","","False","1425158256.0","1425158256.0","","self.askgaybros","0","False","0","True","False","2xhwir","True","","","","","","{}","[]","t3_2xhwir","18","","False","http://www.reddit.com/r/askgaybros/comments/2xhwir/serious_have_you_ever_hadbeen_a_sugar_daddy/","Unauthenticated reddit sesssion","","False","17","","{}","What is it like? What are your experiences?

(For the purpose of clarity, I'm primarily talking about those who are/were in an honest medium or long term relationship that someone would not have entered otherwise, if not for material compensation from one of the partners. Both partners should be aware of that tradeoff.)","&lt;!-- SC_OFF --&gt;&lt;div class=""md""&gt;&lt;p&gt;What is it like? What are your experiences?&lt;/p&gt;

&lt;p&gt;(For the purpose of clarity, I&amp;#39;m primarily talking about those who are/were in an honest medium or long term relationship that someone would not have entered otherwise, if not for material compensation from one of the partners. Both partners should be aware of that tradeoff.)&lt;/p&gt;
&lt;/div&gt;&lt;!-- SC_ON --&gt;","False","askgaybros","t5_2vgfw","","","[Serious] Have you ever had/been a sugar daddy?","17","http://www.reddit.com/r/askgaybros/comments/2xhwir/serious_have_you_ever_hadbeen_a_sugar_daddy/","[]","False"
"22","","","{}","http://www.reddit.com/api/info/","{}","{}","False","","","False","blissed_out_cossack","","","","False","1425157863.0","1425157863.0","","self.askgaybros","0","False","0","True","False","2xhvq9","True","","","","","","{}","[]","t3_2xhvq9","27","","False","http://www.reddit.com/r/askgaybros/comments/2xhvq9/whats_up_with_guys_using_a_sauna_fully_clothed/","Unauthenticated reddit sesssion","","False","4","","{}","For some context I'm originally a Brit now living in LA. Something thats been really confusing me is dudes in full work out gear or even regular clothes, sneakers, track suits etc in the sauna.

So anywhere in Europe you're either naked, got a towel on, or at most wearing trunks in a Sauna. Footwear is most positively banned and you'd get thrown out (and in some countries wearing anything would too).
But I've been going to a local Fitness 24 in Hollywood and dudes in the sauna are pretty often in full work out gear, sneakers, socks t-shirts, sweatshirts etc.

This may be naive, but is this like part of a work out program, is it a cultural thing (all of the guys seem Latin).. I've never come across this before.","&lt;!-- SC_OFF --&gt;&lt;div class=""md""&gt;&lt;p&gt;For some context I&amp;#39;m originally a Brit now living in LA. Something thats been really confusing me is dudes in full work out gear or even regular clothes, sneakers, track suits etc in the sauna.&lt;/p&gt;

&lt;p&gt;So anywhere in Europe you&amp;#39;re either naked, got a towel on, or at most wearing trunks in a Sauna. Footwear is most positively banned and you&amp;#39;d get thrown out (and in some countries wearing anything would too).
But I&amp;#39;ve been going to a local Fitness 24 in Hollywood and dudes in the sauna are pretty often in full work out gear, sneakers, socks t-shirts, sweatshirts etc.&lt;/p&gt;

&lt;p&gt;This may be naive, but is this like part of a work out program, is it a cultural thing (all of the guys seem Latin).. I&amp;#39;ve never come across this before.&lt;/p&gt;
&lt;/div&gt;&lt;!-- SC_ON --&gt;","False","askgaybros","t5_2vgfw","","","What's up with guys using a sauna fully clothed?","4","http://www.reddit.com/r/askgaybros/comments/2xhvq9/whats_up_with_guys_using_a_sauna_fully_clothed/","[]","False"
"23","","","{}","http://www.reddit.com/api/info/","{}","{}","False","","","False","LosAngelesCounty","","","","False","1425157403.0","1425157403.0","","self.askgaybros","0","False","0","True","False","2xhusv","True","","","","","","{}","[]","t3_2xhusv","31","","False","http://www.reddit.com/r/askgaybros/comments/2xhusv/im_a_prude_and_i_dont_fit_in/","Unauthenticated reddit sesssion","","False","45","","{}","I don't feel comfortable with the in your face sexuality of the gay community and I feel like this automatically makes me BORING to most guys. I WONT have sex with a guy I just meet after 1 date or even a couple. I WILL only have sex with a guy I am in a relationship with, I don't feel like I am wasting my youth as some guy told me. I'm 20 years old and I am a virgin. I know guys talk about me behind my back, I'm pretty well known at my local bars as a PRUDE or a NUN... I just wish there was someone else like me. 

Where can I met guys like me? Don't say church LOL ","&lt;!-- SC_OFF --&gt;&lt;div class=""md""&gt;&lt;p&gt;I don&amp;#39;t feel comfortable with the in your face sexuality of the gay community and I feel like this automatically makes me BORING to most guys. I WONT have sex with a guy I just meet after 1 date or even a couple. I WILL only have sex with a guy I am in a relationship with, I don&amp;#39;t feel like I am wasting my youth as some guy told me. I&amp;#39;m 20 years old and I am a virgin. I know guys talk about me behind my back, I&amp;#39;m pretty well known at my local bars as a PRUDE or a NUN... I just wish there was someone else like me. &lt;/p&gt;

&lt;p&gt;Where can I met guys like me? Don&amp;#39;t say church LOL &lt;/p&gt;
&lt;/div&gt;&lt;!-- SC_ON --&gt;","False","askgaybros","t5_2vgfw","","","I'm a PRUDE... and I don't fit in","45","http://www.reddit.com/r/askgaybros/comments/2xhusv/im_a_prude_and_i_dont_fit_in/","[]","False"
"24","","","{}","http://www.reddit.com/api/info/","{}","{}","False","","","False","lazygerm","","","","False","1425156067.0","1425156067.0","","self.askgaybros","0","False","0","True","False","2xhs48","True","","","","","","{}","[]","t3_2xhs48","3","","False","http://www.reddit.com/r/askgaybros/comments/2xhs48/how_to_keep_chin_up/","Unauthenticated reddit sesssion","","False","4","","{}","So,  I've posted several times. I'm going though a down period.

I feel comfortable with myself, and I  much less anxiety when meeting guys and what turns me on. Which is good, because if I imagine a date with the opposite it would be difficult unless she was perfect. 

So, I have several unpleasant experiences recently...

1) I had been chatting with an older man, who was very pleasant, upbeat and respectful in our chats. I needed to take a day for a late appt, so we decided to meet at my place. This the first time I've ever invited a stranger to meet for a hookup, male or female. So, I was a little nervous. He gets here, we kiss move to the bed to start to fool around. He is a pleasant but an insistent guy. LTDR; I am GGG, but I end up peeing in his mouth a little, thinking he was going to blow me after I repeatedly and politely declined golden showers. Earlier he also wanted me to fuck him with my dildo. So, I put a condom on it and he objects and wonders why I want to put a towel under his bum as well. All very pleasantly though. Then,  unexpectedly, my property manager shows up. I want to conclude because of that and the totality of what I mentioned. I tell a gay friend this and that I blew him. He chided me for completing that action. He told me the guy was a user and couldn't respect boundaries. 

2) Another older man too, is very pleasant and respectful to talk to. We meet after a lull in the snow. I meet him a subway terminal near him, not near me. I get in his car, he complains that it was difficult to get here and we should have met near me. I apologized, and told I thought I was doing him a favor by not making to drive him into town. He then asks what we should do... I tell him, I don't know maybe get something to eat. I figured he'd have this covered since he owns a restaurant and would know where to  go. I tell him I did not want to insult by suggesting Chili's or BK. The dude is way surly, complains about where we met and then remarks how it works only for me? Then he says his blood pressure is rising and asks me to leave. So, I do. 

3) I was chatting with a younger guy and he wanted to meet up at my place. I don't pay for any sites, so in the past I've told this dude to get a throwaway email address so we can chat. He does not.  He also blew me off once. But I figure, stuff happens., whatever.  We chat again, he wants to meet at my place. I tell him I need a face pic because I don't want a stranger coming to my house. He never replies back. 

Now, perhaps, I've done some things you may not agree with; but I am feeling my way along. I'm older, so I don't have the easier environment of college or going to bars every night. 

Am I an idiot for thinking people over 30, 40 or 50...should be more responsible...? Am I wrong to meet someone 'age-appropriate'? I'm 47. Maybe I should meet younger guys, could they be more mature? 

I'm just disheartened and feeling alone.","&lt;!-- SC_OFF --&gt;&lt;div class=""md""&gt;&lt;p&gt;So,  I&amp;#39;ve posted several times. I&amp;#39;m going though a down period.&lt;/p&gt;

&lt;p&gt;I feel comfortable with myself, and I  much less anxiety when meeting guys and what turns me on. Which is good, because if I imagine a date with the opposite it would be difficult unless she was perfect. &lt;/p&gt;

&lt;p&gt;So, I have several unpleasant experiences recently...&lt;/p&gt;

&lt;p&gt;1) I had been chatting with an older man, who was very pleasant, upbeat and respectful in our chats. I needed to take a day for a late appt, so we decided to meet at my place. This the first time I&amp;#39;ve ever invited a stranger to meet for a hookup, male or female. So, I was a little nervous. He gets here, we kiss move to the bed to start to fool around. He is a pleasant but an insistent guy. LTDR; I am GGG, but I end up peeing in his mouth a little, thinking he was going to blow me after I repeatedly and politely declined golden showers. Earlier he also wanted me to fuck him with my dildo. So, I put a condom on it and he objects and wonders why I want to put a towel under his bum as well. All very pleasantly though. Then,  unexpectedly, my property manager shows up. I want to conclude because of that and the totality of what I mentioned. I tell a gay friend this and that I blew him. He chided me for completing that action. He told me the guy was a user and couldn&amp;#39;t respect boundaries. &lt;/p&gt;

&lt;p&gt;2) Another older man too, is very pleasant and respectful to talk to. We meet after a lull in the snow. I meet him a subway terminal near him, not near me. I get in his car, he complains that it was difficult to get here and we should have met near me. I apologized, and told I thought I was doing him a favor by not making to drive him into town. He then asks what we should do... I tell him, I don&amp;#39;t know maybe get something to eat. I figured he&amp;#39;d have this covered since he owns a restaurant and would know where to  go. I tell him I did not want to insult by suggesting Chili&amp;#39;s or BK. The dude is way surly, complains about where we met and then remarks how it works only for me? Then he says his blood pressure is rising and asks me to leave. So, I do. &lt;/p&gt;

&lt;p&gt;3) I was chatting with a younger guy and he wanted to meet up at my place. I don&amp;#39;t pay for any sites, so in the past I&amp;#39;ve told this dude to get a throwaway email address so we can chat. He does not.  He also blew me off once. But I figure, stuff happens., whatever.  We chat again, he wants to meet at my place. I tell him I need a face pic because I don&amp;#39;t want a stranger coming to my house. He never replies back. &lt;/p&gt;

&lt;p&gt;Now, perhaps, I&amp;#39;ve done some things you may not agree with; but I am feeling my way along. I&amp;#39;m older, so I don&amp;#39;t have the easier environment of college or going to bars every night. &lt;/p&gt;

&lt;p&gt;Am I an idiot for thinking people over 30, 40 or 50...should be more responsible...? Am I wrong to meet someone &amp;#39;age-appropriate&amp;#39;? I&amp;#39;m 47. Maybe I should meet younger guys, could they be more mature? &lt;/p&gt;

&lt;p&gt;I&amp;#39;m just disheartened and feeling alone.&lt;/p&gt;
&lt;/div&gt;&lt;!-- SC_ON --&gt;","False","askgaybros","t5_2vgfw","","","How to keep chin up?","4","http://www.reddit.com/r/askgaybros/comments/2xhs48/how_to_keep_chin_up/","[]","False"
"25","","","{}","http://www.reddit.com/api/info/","{}","{}","False","","","False","aussie_dude93","","","","False","1425155909.0","1425155909.0","","self.askgaybros","0","False","0","True","False","2xhrua","True","","","","","","{}","[]","t3_2xhrua","20","","False","http://www.reddit.com/r/askgaybros/comments/2xhrua/any_tips_for_taking_a_9_inch_cock_lol/","Unauthenticated reddit sesssion","","False","4","","{}","I'm not a bot I promise. Sydney Mardi Gras is coming up on Saturday, and I want to bottom for my boyfriend. Any tips would be great. Thanks bros","&lt;!-- SC_OFF --&gt;&lt;div class=""md""&gt;&lt;p&gt;I&amp;#39;m not a bot I promise. Sydney Mardi Gras is coming up on Saturday, and I want to bottom for my boyfriend. Any tips would be great. Thanks bros&lt;/p&gt;
&lt;/div&gt;&lt;!-- SC_ON --&gt;","False","askgaybros","t5_2vgfw","","","Any tips for taking a 9 inch cock? lol","4","http://www.reddit.com/r/askgaybros/comments/2xhrua/any_tips_for_taking_a_9_inch_cock_lol/","[]","False"
