"","_comment_sort","_comments","_comments_by_id","_info_url","_orphaned","_params","_replaced_more","_underscore_names","approved_by","archived","author","author_flair_css_class","author_flair_text","banned_by","clicked","created","created_utc","distinguished","domain","downs","edited","gilded","has_fetched","hidden","id","is_self","json_dict","likes","link_flair_css_class","link_flair_text","media","media_embed","mod_reports","name","num_comments","num_reports","over_18","permalink","reddit_session","report_reasons","saved","score","secure_media","secure_media_embed","selftext","selftext_html","stickied","subreddit","subreddit_id","suggested_sort","thumbnail","title","ups","url","user_reports","visited"
"0","","","{}","http://www.reddit.com/api/info/","{}","{}","False","","","True","gary1995","","","","False","1404579463.0","1404575863.0","","self.askgaybros","0","False","0","True","False","29wjfe","True","","","","","","{}","[]","t3_29wjfe","19","","False","http://www.reddit.com/r/askgaybros/comments/29wjfe/what_does_it_mean_to_be_fishhooked/","Unauthenticated reddit sesssion","","False","13","","{}","Like if someone says ""I want to fish-hook you""?","&lt;!-- SC_OFF --&gt;&lt;div class=""md""&gt;&lt;p&gt;Like if someone says &amp;quot;I want to fish-hook you&amp;quot;?&lt;/p&gt;
&lt;/div&gt;&lt;!-- SC_ON --&gt;","False","askgaybros","t5_2vgfw","","","What does it mean to be ""fish-hooked""?","13","http://www.reddit.com/r/askgaybros/comments/29wjfe/what_does_it_mean_to_be_fishhooked/","[]","False"
"1","","","{}","http://www.reddit.com/api/info/","{}","{}","False","","","True","dipaolo","","","","False","1404577840.0","1404574240.0","","self.askgaybros","0","False","0","True","False","29whim","True","","","","","","{}","[]","t3_29whim","26","","False","http://www.reddit.com/r/askgaybros/comments/29whim/lets_talk_vacations_when_where_company/","Unauthenticated reddit sesssion","","False","12","","{}","Me and the bf just booked our vacation, we're doing a 2-week road trip in Croatia.

I love traveling and I'm always curious to hear about people's holiday destinations, they can be a great inspiration!

Do you prefer to go with your bf/husband, or do you opt for a singles vacation? 

","&lt;!-- SC_OFF --&gt;&lt;div class=""md""&gt;&lt;p&gt;Me and the bf just booked our vacation, we&amp;#39;re doing a 2-week road trip in Croatia.&lt;/p&gt;

&lt;p&gt;I love traveling and I&amp;#39;m always curious to hear about people&amp;#39;s holiday destinations, they can be a great inspiration!&lt;/p&gt;

&lt;p&gt;Do you prefer to go with your bf/husband, or do you opt for a singles vacation? &lt;/p&gt;
&lt;/div&gt;&lt;!-- SC_ON --&gt;","False","askgaybros","t5_2vgfw","","","Let's talk vacations: when, where, company...?","12","http://www.reddit.com/r/askgaybros/comments/29whim/lets_talk_vacations_when_where_company/","[]","False"
"2","","","{}","http://www.reddit.com/api/info/","{}","{}","False","","","True","lengthyounarther","","","","False","1404576031.0","1404572431.0","","self.askgaybros","0","False","0","True","False","29wffr","True","","","","","","{}","[]","t3_29wffr","24","","False","http://www.reddit.com/r/askgaybros/comments/29wffr/honesty_in_bed_is_lying_about_sexual_pleasure/","Unauthenticated reddit sesssion","","False","6","","{}","Greetings everyone.  To premise this post I think I should lay out a bit of background.  I posted on this forum about a year ago about my inability to meet or date other gay men.  For those curious you can read these posts in my history.  This post is not intended as an update, though I suppose it is in a sense.  Since last year I have managed to achieve interactions and dates.  This has come with many pleasures but also many frustrations, most especially the fact that all my interactions have all either fizzled out (anticlimactically if not acrimoniously) or blown up in my face.  As yet none has blossomed into anything close to a relationship, though I feel I have made some friends.  That frustration is a different, though perhaps not unrelated issue to what I want to ask about here.  Namely what do you guys think is acceptable in terms of misleading people about the level of sexual pleasure you feel in bed.  I am not talking about honestly regarding STD’s or  other partners, but more specifically about levels of sexual pleasure and arousal.

The best way I can illustrate it to relate an experience.  After I became sexually active, the large majority of the guys I met explicitly asserted that they really enjoyed the experience.  Indeed most spoke in terms of our time in bed being the most intense and pleasurable experience they had had.  Although I am aware this may just be courtesy (or even worse manipulation of some sort) the refrain seemed to uniform from to many different guys to be explained away.  Explicitly saying they had an amazing time was ever only a tiny part of the indication they had a good time, their non verbal moans, muscle spasms, trembling and repeated ejaculations seemed to corroborate these claims.

I don’t know what term is used but I am very much turned on by the idea of giving the other guy pleasure.  Not that I neglect my own physical needs or anything, just that I really enjoy it when the other guy is beside himself in ecstasy.  Every guy is different and I tend to take a very analytical approach, surveying the body with my hands and finding out where their pleasure and erogenous zones are and how best to stimulate them with as much eye contact and situation appropriate sex talk as possible.   Although one can never be 100% certain of how other people feel, I am as confident as I can reasonably be that by and large the guys I have been with had a rewarding experience.  This isn’t to suggest everyone reacted this way, because some certainly did not.  I’ll be the first to admit my relative lack of experience, and perhaps my ability to judge people’s reactions is not developed enough to be very certain about how people actually feel.  However the large majority seemed to have a very positive experience.  

However a few months ago I met a guy where I had to question this.  In bed he began moaning in a loud over the top fashion, before I had really learned anything about his preferences.  I found this extremely patronizing and asked him to stop which he did.  As the evening progressed I thought we had a good time.  The next day he was polite by much more tepid than the night in bed had led me to expect.  It was a shock because I had thought things went very well and he said things were only so so and that he misrepresented his degree of sexual pleasure, “for my benefit”.  As somebody who wants the other guy to have a good time this was upsetting.  I don’t have some magic ability to please guys.  In order to do so I have to have honest reactions to what’s going on.  If something isn’t working I want to know so that I can try something else.  If something IS working I also want to know so that I can develop that action more.  By being disingenuous about his level of pleasure he completely thwarted my attempts to please him (well not completely since he came twice, but honestly a guy can do that on his own with no help so it doesn’t prove all that much).  He very candidly defended being dishonest, since to his mind it was for my benefit.  I have had other guys who did not have a great time, but they were up front about it.  I didn’t leave thinking “wow, that was amazing”.   It was a shock to hear the next day that he was not satisfied.  He even chided me for not interpreted some of his subtle reactions.   I was curious how I was supposed to pick up on such subtle hints when he admits to purposely misleading me (again for my own good).  

So my questions are, how accepted is this type of coddling?  Are there good ways to detect it?   Doesn’t it interfere with trying to actually have a good time?  I found it patronizing and insulting, but perhaps others do not view it so negatively as me.  I doubt it could be tested empirically, but does anyone have any anecdotal evidence how common this is and under what circumstances people do it?  I cannot imagine that anyone ALWAYS fakes pleasure so I am curious in what circumstances they do and in which circumstances are they more honest?    

Thanks        
","&lt;!-- SC_OFF --&gt;&lt;div class=""md""&gt;&lt;p&gt;Greetings everyone.  To premise this post I think I should lay out a bit of background.  I posted on this forum about a year ago about my inability to meet or date other gay men.  For those curious you can read these posts in my history.  This post is not intended as an update, though I suppose it is in a sense.  Since last year I have managed to achieve interactions and dates.  This has come with many pleasures but also many frustrations, most especially the fact that all my interactions have all either fizzled out (anticlimactically if not acrimoniously) or blown up in my face.  As yet none has blossomed into anything close to a relationship, though I feel I have made some friends.  That frustration is a different, though perhaps not unrelated issue to what I want to ask about here.  Namely what do you guys think is acceptable in terms of misleading people about the level of sexual pleasure you feel in bed.  I am not talking about honestly regarding STD’s or  other partners, but more specifically about levels of sexual pleasure and arousal.&lt;/p&gt;

&lt;p&gt;The best way I can illustrate it to relate an experience.  After I became sexually active, the large majority of the guys I met explicitly asserted that they really enjoyed the experience.  Indeed most spoke in terms of our time in bed being the most intense and pleasurable experience they had had.  Although I am aware this may just be courtesy (or even worse manipulation of some sort) the refrain seemed to uniform from to many different guys to be explained away.  Explicitly saying they had an amazing time was ever only a tiny part of the indication they had a good time, their non verbal moans, muscle spasms, trembling and repeated ejaculations seemed to corroborate these claims.&lt;/p&gt;

&lt;p&gt;I don’t know what term is used but I am very much turned on by the idea of giving the other guy pleasure.  Not that I neglect my own physical needs or anything, just that I really enjoy it when the other guy is beside himself in ecstasy.  Every guy is different and I tend to take a very analytical approach, surveying the body with my hands and finding out where their pleasure and erogenous zones are and how best to stimulate them with as much eye contact and situation appropriate sex talk as possible.   Although one can never be 100% certain of how other people feel, I am as confident as I can reasonably be that by and large the guys I have been with had a rewarding experience.  This isn’t to suggest everyone reacted this way, because some certainly did not.  I’ll be the first to admit my relative lack of experience, and perhaps my ability to judge people’s reactions is not developed enough to be very certain about how people actually feel.  However the large majority seemed to have a very positive experience.  &lt;/p&gt;

&lt;p&gt;However a few months ago I met a guy where I had to question this.  In bed he began moaning in a loud over the top fashion, before I had really learned anything about his preferences.  I found this extremely patronizing and asked him to stop which he did.  As the evening progressed I thought we had a good time.  The next day he was polite by much more tepid than the night in bed had led me to expect.  It was a shock because I had thought things went very well and he said things were only so so and that he misrepresented his degree of sexual pleasure, “for my benefit”.  As somebody who wants the other guy to have a good time this was upsetting.  I don’t have some magic ability to please guys.  In order to do so I have to have honest reactions to what’s going on.  If something isn’t working I want to know so that I can try something else.  If something IS working I also want to know so that I can develop that action more.  By being disingenuous about his level of pleasure he completely thwarted my attempts to please him (well not completely since he came twice, but honestly a guy can do that on his own with no help so it doesn’t prove all that much).  He very candidly defended being dishonest, since to his mind it was for my benefit.  I have had other guys who did not have a great time, but they were up front about it.  I didn’t leave thinking “wow, that was amazing”.   It was a shock to hear the next day that he was not satisfied.  He even chided me for not interpreted some of his subtle reactions.   I was curious how I was supposed to pick up on such subtle hints when he admits to purposely misleading me (again for my own good).  &lt;/p&gt;

&lt;p&gt;So my questions are, how accepted is this type of coddling?  Are there good ways to detect it?   Doesn’t it interfere with trying to actually have a good time?  I found it patronizing and insulting, but perhaps others do not view it so negatively as me.  I doubt it could be tested empirically, but does anyone have any anecdotal evidence how common this is and under what circumstances people do it?  I cannot imagine that anyone ALWAYS fakes pleasure so I am curious in what circumstances they do and in which circumstances are they more honest?    &lt;/p&gt;

&lt;p&gt;Thanks        &lt;/p&gt;
&lt;/div&gt;&lt;!-- SC_ON --&gt;","False","askgaybros","t5_2vgfw","","","Honesty in Bed, Is lying about sexual pleasure acceptable?","6","http://www.reddit.com/r/askgaybros/comments/29wffr/honesty_in_bed_is_lying_about_sexual_pleasure/","[]","False"
"3","","","{}","http://www.reddit.com/api/info/","{}","{}","False","","","True","askers","","","","False","1404574385.0","1404570785.0","","self.askgaybros","0","False","0","True","False","29wdnc","True","","","","","","{}","[]","t3_29wdnc","2","","False","http://www.reddit.com/r/askgaybros/comments/29wdnc/long_post_weird_signals/","Unauthenticated reddit sesssion","","False","7","","{}","Ok... So I met a guy on Grindr, he is half in and half out the closet... He is nice, sympathetic and I feel good and comfortable hanging out with him... He define himself as gay.He told me that he likes things slow, something that isn't a problem at all because I end my relationship a month ago so I'm into slow things too.The problem is that we have go out mostly with his friends (some of them straight and don't know about him)so we don't do anything and I'm ok with that... The first time we went out alone we found my roommate and she end up turning back home with us so we didn't do anything.I'm starting to think that he isn't interested because if he were he would find a way to go out with me... But... If I don't text him he start texting back and I told him to have dinner next week and he told me ""I'll be glad but at your place and you cook ;)"" I'm not sure if I should take this as flirting because after that comment everything get back as before... I think I'm going to wait until next week to see how it goes... But I'm going mad, I like the guy and even if he doesn't want to date also friendship would work for me but I need to know what he want because I'm gettin mad! I don't know if he is repressed for being in the closet and having mostly straight friends of this is what he meant with slow things... But is driving me nuts...","&lt;!-- SC_OFF --&gt;&lt;div class=""md""&gt;&lt;p&gt;Ok... So I met a guy on Grindr, he is half in and half out the closet... He is nice, sympathetic and I feel good and comfortable hanging out with him... He define himself as gay.&lt;/p&gt;

&lt;p&gt;He told me that he likes things slow, something that isn&amp;#39;t a problem at all because I end my relationship a month ago so I&amp;#39;m into slow things too.&lt;/p&gt;

&lt;p&gt;The problem is that we have go out mostly with his friends (some of them straight and don&amp;#39;t know about him)so we don&amp;#39;t do anything and I&amp;#39;m ok with that... The first time we went out alone we found my roommate and she end up turning back home with us so we didn&amp;#39;t do anything.&lt;/p&gt;

&lt;p&gt;I&amp;#39;m starting to think that he isn&amp;#39;t interested because if he were he would find a way to go out with me... But... If I don&amp;#39;t text him he start texting back and I told him to have dinner next week and he told me &amp;quot;I&amp;#39;ll be glad but at your place and you cook ;)&amp;quot; I&amp;#39;m not sure if I should take this as flirting because after that comment everything get back as before... I think I&amp;#39;m going to wait until next week to see how it goes... But I&amp;#39;m going mad, I like the guy and even if he doesn&amp;#39;t want to date also friendship would work for me but I need to know what he want because I&amp;#39;m gettin mad! I don&amp;#39;t know if he is repressed for being in the closet and having mostly straight friends of this is what he meant with slow things... But is driving me nuts...&lt;/p&gt;
&lt;/div&gt;&lt;!-- SC_ON --&gt;","False","askgaybros","t5_2vgfw","","","Long Post - Weird Signals","7","http://www.reddit.com/r/askgaybros/comments/29wdnc/long_post_weird_signals/","[]","False"
"4","","","{}","http://www.reddit.com/api/info/","{}","{}","False","","","True","koosha12","","","","False","1404564853.0","1404561253.0","","self.askgaybros","0","False","0","True","False","29w5h6","True","","","","","","{}","[]","t3_29w5h6","5","","False","http://www.reddit.com/r/askgaybros/comments/29w5h6/closeted_and_confused/","Unauthenticated reddit sesssion","","False","10","","{}","Hi, 
I'm in closet but I know I like guys, I even fell in love with one of my straight classmates and had hard time telling no body, only imagining us together. I've had sexual experiences with guys, giving head and bjs and watch gay porn. 

The problem is that I am not sure of my role as they say, top or bottom or whatever, is it natural? I have not experienced it and have no feeling of these things being attractive for me. And because of these I cannot date or see someone on the Internet as this is the first question everybody asks. What should I do? How should I start? Is it OK feeling like this? It makes me think that am I really gay? 

Thanks bros for being here.","&lt;!-- SC_OFF --&gt;&lt;div class=""md""&gt;&lt;p&gt;Hi, 
I&amp;#39;m in closet but I know I like guys, I even fell in love with one of my straight classmates and had hard time telling no body, only imagining us together. I&amp;#39;ve had sexual experiences with guys, giving head and bjs and watch gay porn. &lt;/p&gt;

&lt;p&gt;The problem is that I am not sure of my role as they say, top or bottom or whatever, is it natural? I have not experienced it and have no feeling of these things being attractive for me. And because of these I cannot date or see someone on the Internet as this is the first question everybody asks. What should I do? How should I start? Is it OK feeling like this? It makes me think that am I really gay? &lt;/p&gt;

&lt;p&gt;Thanks bros for being here.&lt;/p&gt;
&lt;/div&gt;&lt;!-- SC_ON --&gt;","False","askgaybros","t5_2vgfw","","","Closeted and confused","10","http://www.reddit.com/r/askgaybros/comments/29w5h6/closeted_and_confused/","[]","False"
