"","_comment_sort","_comments","_comments_by_id","_info_url","_orphaned","_params","_replaced_more","_underscore_names","approved_by","archived","author","author_flair_css_class","author_flair_text","banned_by","clicked","created","created_utc","distinguished","domain","downs","edited","gilded","has_fetched","hidden","id","is_self","json_dict","likes","link_flair_css_class","link_flair_text","media","media_embed","mod_reports","name","num_comments","num_reports","over_18","permalink","reddit_session","report_reasons","saved","score","secure_media","secure_media_embed","selftext","selftext_html","stickied","subreddit","subreddit_id","suggested_sort","thumbnail","title","ups","url","user_reports","visited"
"26","","","{}","http://www.reddit.com/api/info/","{}","{}","False","","","False","myagbthrowaway","","","","False","1425153609.0","1425153609.0","","self.askgaybros","0","False","0","True","False","2xhnb1","True","","","","","","{}","[]","t3_2xhnb1","5","","False","http://www.reddit.com/r/askgaybros/comments/2xhnb1/should_i_at_least_come_out_to_my_coach/","Unauthenticated reddit sesssion","","False","23","","{}","Hey bros, I'm a college athlete and I I'm gay (obviously why I'm here). But I run cross country and track at a D3 school and I'm not out to any of my teammates. Being a freshman I don't feel 100% comfortable telling them yet. But I kind of want to at least tell my coach because being gay has affected my running on occasion. Recently I ran my worst race in a few years because the only thing I was thinking about was how I was going to tell my parents that night after the meet (my parents would be supportive of me but it's still a stressful thing). After racing so poorly I didn't end up coming out to my parents, and my coach was asking what was up since he noticed that I wasn't on point all week. I ended up lying to him just saying I was a little sick, but I hate lying about it. So I was wondering if any of you have had a similar situation. I have my post indoor season meeting with him later this week and was wondering if I should at least disclose that information to him but not the rest of the team yet. Any help would be greatly appreciated.","&lt;!-- SC_OFF --&gt;&lt;div class=""md""&gt;&lt;p&gt;Hey bros, I&amp;#39;m a college athlete and I I&amp;#39;m gay (obviously why I&amp;#39;m here). But I run cross country and track at a D3 school and I&amp;#39;m not out to any of my teammates. Being a freshman I don&amp;#39;t feel 100% comfortable telling them yet. But I kind of want to at least tell my coach because being gay has affected my running on occasion. Recently I ran my worst race in a few years because the only thing I was thinking about was how I was going to tell my parents that night after the meet (my parents would be supportive of me but it&amp;#39;s still a stressful thing). After racing so poorly I didn&amp;#39;t end up coming out to my parents, and my coach was asking what was up since he noticed that I wasn&amp;#39;t on point all week. I ended up lying to him just saying I was a little sick, but I hate lying about it. So I was wondering if any of you have had a similar situation. I have my post indoor season meeting with him later this week and was wondering if I should at least disclose that information to him but not the rest of the team yet. Any help would be greatly appreciated.&lt;/p&gt;
&lt;/div&gt;&lt;!-- SC_ON --&gt;","False","askgaybros","t5_2vgfw","","","Should I at least come out to my coach?","23","http://www.reddit.com/r/askgaybros/comments/2xhnb1/should_i_at_least_come_out_to_my_coach/","[]","False"
"27","","","{}","http://www.reddit.com/api/info/","{}","{}","False","","","False","srfchf","","","","False","1425153348.0","1425153348.0","","self.askgaybros","0","False","0","True","False","2xhmqv","True","","","","","","{}","[]","t3_2xhmqv","4","","False","http://www.reddit.com/r/askgaybros/comments/2xhmqv/going_through_a_shift_in_life/","Unauthenticated reddit sesssion","","False","11","","{}","I'm not sure how to put this but here goes. 

Growing up I was always the dominant top. Even as late as last year I was in that role. But I have found that I really prefer the role of submissive bottom. Not submissive in a BDSM way but more of I enjoy making people happy. Has anyone else made a similar change?

My tastes in men hasn't changed. I do still like the same type just now I want them to be the leader. After reading other posts here I know that it is possible to find someone so I'm not freaking out about that. 

I'm looking forward to reading some of your replies. ","&lt;!-- SC_OFF --&gt;&lt;div class=""md""&gt;&lt;p&gt;I&amp;#39;m not sure how to put this but here goes. &lt;/p&gt;

&lt;p&gt;Growing up I was always the dominant top. Even as late as last year I was in that role. But I have found that I really prefer the role of submissive bottom. Not submissive in a BDSM way but more of I enjoy making people happy. Has anyone else made a similar change?&lt;/p&gt;

&lt;p&gt;My tastes in men hasn&amp;#39;t changed. I do still like the same type just now I want them to be the leader. After reading other posts here I know that it is possible to find someone so I&amp;#39;m not freaking out about that. &lt;/p&gt;

&lt;p&gt;I&amp;#39;m looking forward to reading some of your replies. &lt;/p&gt;
&lt;/div&gt;&lt;!-- SC_ON --&gt;","False","askgaybros","t5_2vgfw","","","Going through a shift in life.","11","http://www.reddit.com/r/askgaybros/comments/2xhmqv/going_through_a_shift_in_life/","[]","False"
"28","","","{}","http://www.reddit.com/api/info/","{}","{}","False","","","False","sneakygingertroll","","","","False","1425150661.0","1425150661.0","","self.askgaybros","0","False","0","True","False","2xhhf2","True","","","","","","{}","[]","t3_2xhhf2","8","","False","http://www.reddit.com/r/askgaybros/comments/2xhhf2/i_go_through_periods_of_questioning_my_sexuality/","Unauthenticated reddit sesssion","","False","15","","{}","this might end up being pretty long, also sorry about the grammar, i'm just writing this up and not really trying to be proper. 

Backstory:

In elementary school i never felt anything for girls, never had a crush, i had to pull a name out of my ass when someone asked me if i had a crush/liked any girl.

middle school/puberty: 7th grade, wham, huge crush on a guy. I went through this period of confusion and strange emotion. For example i remember thinking that i could just act straight and get a wife and die a closet case or something. I continued to deny it. One night it all boiled over and i flat out admitted it to myself, that i was gay. I remember crying (because for some reason this was the worst thing that could happen to me) and then going to bed. 

The next day i thought that it was just a phase and that i might straighten out when i was 15 or 16, so i decided to put it off until then.

so i just didn't think about it until the very end of 10th grade, when the notion occurred to me that i might not even be attracted to girls. 

heres the thing: Up to that point, i'd been interested in pretty much all types of porn (straight, lesbian, gay, shemale). I would usually flip flop my porn habits, i would watch lesbian or straight (which was almost exclusively anal) porn for a while, then watch gay for a period of time. 

after this realization it seemed like my desire for straight porn dropped off, almost artificially as if my mind somehow forced it.

Anyways, i thought that there was a very real possibility i didn't really find women attractive. For whatever reason i fully accepted this notion. It felt like i was ""free"". But there always was (and is) this nagging feeling that im wrong in my self assesment, and that its just a ""phase"" or a kink or something.

TL;DR: There's a part of me that says/thinks i'm gay, and another part that tells me i'm a faker or that i *want* to be gay for attention or something. This has been going on for like 3 or 4 years now.

Usually the thought that i'm not gay coincides with periods when i feel depressed or lack motivation.

helppp","&lt;!-- SC_OFF --&gt;&lt;div class=""md""&gt;&lt;p&gt;this might end up being pretty long, also sorry about the grammar, i&amp;#39;m just writing this up and not really trying to be proper. &lt;/p&gt;

&lt;p&gt;Backstory:&lt;/p&gt;

&lt;p&gt;In elementary school i never felt anything for girls, never had a crush, i had to pull a name out of my ass when someone asked me if i had a crush/liked any girl.&lt;/p&gt;

&lt;p&gt;middle school/puberty: 7th grade, wham, huge crush on a guy. I went through this period of confusion and strange emotion. For example i remember thinking that i could just act straight and get a wife and die a closet case or something. I continued to deny it. One night it all boiled over and i flat out admitted it to myself, that i was gay. I remember crying (because for some reason this was the worst thing that could happen to me) and then going to bed. &lt;/p&gt;

&lt;p&gt;The next day i thought that it was just a phase and that i might straighten out when i was 15 or 16, so i decided to put it off until then.&lt;/p&gt;

&lt;p&gt;so i just didn&amp;#39;t think about it until the very end of 10th grade, when the notion occurred to me that i might not even be attracted to girls. &lt;/p&gt;

&lt;p&gt;heres the thing: Up to that point, i&amp;#39;d been interested in pretty much all types of porn (straight, lesbian, gay, shemale). I would usually flip flop my porn habits, i would watch lesbian or straight (which was almost exclusively anal) porn for a while, then watch gay for a period of time. &lt;/p&gt;

&lt;p&gt;after this realization it seemed like my desire for straight porn dropped off, almost artificially as if my mind somehow forced it.&lt;/p&gt;

&lt;p&gt;Anyways, i thought that there was a very real possibility i didn&amp;#39;t really find women attractive. For whatever reason i fully accepted this notion. It felt like i was &amp;quot;free&amp;quot;. But there always was (and is) this nagging feeling that im wrong in my self assesment, and that its just a &amp;quot;phase&amp;quot; or a kink or something.&lt;/p&gt;

&lt;p&gt;TL;DR: There&amp;#39;s a part of me that says/thinks i&amp;#39;m gay, and another part that tells me i&amp;#39;m a faker or that i &lt;em&gt;want&lt;/em&gt; to be gay for attention or something. This has been going on for like 3 or 4 years now.&lt;/p&gt;

&lt;p&gt;Usually the thought that i&amp;#39;m not gay coincides with periods when i feel depressed or lack motivation.&lt;/p&gt;

&lt;p&gt;helppp&lt;/p&gt;
&lt;/div&gt;&lt;!-- SC_ON --&gt;","False","askgaybros","t5_2vgfw","","","I go through periods of questioning my sexuality.","15","http://www.reddit.com/r/askgaybros/comments/2xhhf2/i_go_through_periods_of_questioning_my_sexuality/","[]","False"
"29","","","{}","http://www.reddit.com/api/info/","{}","{}","False","","","False","doublejack00","","","","False","1425149717.0","1425149717.0","","self.askgaybros","0","False","0","True","False","2xhfjp","True","","","","","","{}","[]","t3_2xhfjp","3","","False","http://www.reddit.com/r/askgaybros/comments/2xhfjp/eli5_doma/","Unauthenticated reddit sesssion","","False","4","","{}","So, now that DOMA is struck down... if I were to get married with another man, do I get the same marriage rights? (aka citizenship/green card) I'm asking this because I am not an American citizen, but I live in a state where gay marriage is legal. ","&lt;!-- SC_OFF --&gt;&lt;div class=""md""&gt;&lt;p&gt;So, now that DOMA is struck down... if I were to get married with another man, do I get the same marriage rights? (aka citizenship/green card) I&amp;#39;m asking this because I am not an American citizen, but I live in a state where gay marriage is legal. &lt;/p&gt;
&lt;/div&gt;&lt;!-- SC_ON --&gt;","False","askgaybros","t5_2vgfw","","","ELI5: DOMA","4","http://www.reddit.com/r/askgaybros/comments/2xhfjp/eli5_doma/","[]","False"
"30","","","{}","http://www.reddit.com/api/info/","{}","{}","False","","","False","ta2285930","","","","False","1425146627.0","1425146627.0","","self.askgaybros","0","False","0","True","False","2xh9hz","True","","","","","","{}","[]","t3_2xh9hz","6","","False","http://www.reddit.com/r/askgaybros/comments/2xh9hz/sensitive_nipples_after_wearing_shirts/","Unauthenticated reddit sesssion","","False","2","","{}","Who doesn't love shirts? Get a decent shirt, a belt and jeans and you WILL look hot! Unfortunately, after wearing shirts all day, I find my nipples all red and very sensitive (and not in a good way). These aren't shitty, non-quality shirts (eh, okay, some of them are, but it also happens with the normal shirts). I found out that this goes away if I wear an undershirt, but I get very hot in those (again, not in a good way). I know that there are some kind of ""bandaids"" for your nips for runners and such but I really don't want to look like I had been making love to a sandpaper if I, god forbid!, bring someone home and take my shirt off.

Anyone else having this problem?","&lt;!-- SC_OFF --&gt;&lt;div class=""md""&gt;&lt;p&gt;Who doesn&amp;#39;t love shirts? Get a decent shirt, a belt and jeans and you WILL look hot! Unfortunately, after wearing shirts all day, I find my nipples all red and very sensitive (and not in a good way). These aren&amp;#39;t shitty, non-quality shirts (eh, okay, some of them are, but it also happens with the normal shirts). I found out that this goes away if I wear an undershirt, but I get very hot in those (again, not in a good way). I know that there are some kind of &amp;quot;bandaids&amp;quot; for your nips for runners and such but I really don&amp;#39;t want to look like I had been making love to a sandpaper if I, god forbid!, bring someone home and take my shirt off.&lt;/p&gt;

&lt;p&gt;Anyone else having this problem?&lt;/p&gt;
&lt;/div&gt;&lt;!-- SC_ON --&gt;","False","askgaybros","t5_2vgfw","","","Sensitive nipples after wearing shirts","2","http://www.reddit.com/r/askgaybros/comments/2xh9hz/sensitive_nipples_after_wearing_shirts/","[]","False"
"31","","","{}","http://www.reddit.com/api/info/","{}","{}","False","","","False","dathrowawaydoe03","","","","False","1425140761.0","1425140761.0","","self.askgaybros","0","False","0","True","False","2xgylr","True","","","","","","{}","[]","t3_2xgylr","28","","False","http://www.reddit.com/r/askgaybros/comments/2xgylr/dick_pics/","Unauthenticated reddit sesssion","","False","22","","{}","Hey folks. So I only just recently joined the 21st century and got a smart phone. Previously I'd used online dating a couple of times, but access to apps means that I'm getting into all kinds of dating apps I didn't have access to before. 

I'm a bit of an old fashioned guy. Not like Log Cabin Republican old fashioned but I've never been the kind of sleep around a lot. On these apps I've said in my profile that I'm looking for long term relationships (not that anyone reads the profiles though, right?). 

Anyway, I've started talking to this guy on Tindr who I really hit it off with and we messaged each other back and forth for a day or two. We scheduled a date for tonight several days ago, and then exchanged phone numbers. I told him I was going to a friend's for a couple of drinks and movie, and low and behold half way through the movie he sent me a pic of his boner. Now, he still had it in the underwear, so it was relatively tasteful, haha. 

I didn't respond because there were two people sitting next to me that I didn't know too well, and I think pulling up a picture of another guy's bulge thirty minutes after you've been introduced to someone is a bit of a faux pas. Also, it was a little aggressive and I wanted more time to respond. Later that night he texted me ""No?"" and I explained the situation, but thanked him for the pic. 

The next morning he started sending me some innocent selfies, and then things escalated from there. He sent another underwear pic, and I kind of laughed it out. Then he sent a picture of him naked in the mirror, but with a lot of steam. I told him to hold his horses because we still hadn't been on a first date, but I tried to do it in a flirtatious way. So granted, I was sending mixed signals, but I explained that I preferred to not rush things. 

Later that day he sent me a picture of his ass. I said, ""So, now I've seen your ass and ballsack before we've even met. Calm down Speedy Gonzales, let's take it slow. As much as I'm enjoying these let's not put the horse before the cart."" He seemed apologetic, but I think having to tell someone three times to pull it back is a little much. 

But, I don't have a lot of dating app experience. It's not like I haven't been sent dick pics before, but usually its either the first thing that gets sent, or you wait until things are a little more serious. He says he's not looking for a hookup either, but the flood of pics makes me apprehensive. 

Am I just out of touch? Am I being too prudish? Should this be a deal breaker if I'm looking for a relationship? I mean, it's obviously a bit soon to tell, but clearly we seem to have different priorities. 


TL;DR: Talking to a dude I really like. Looking for a LTR. He keeps sending me explicit pics even though I have kind of told him I'm not interested in rushing things. ","&lt;!-- SC_OFF --&gt;&lt;div class=""md""&gt;&lt;p&gt;Hey folks. So I only just recently joined the 21st century and got a smart phone. Previously I&amp;#39;d used online dating a couple of times, but access to apps means that I&amp;#39;m getting into all kinds of dating apps I didn&amp;#39;t have access to before. &lt;/p&gt;

&lt;p&gt;I&amp;#39;m a bit of an old fashioned guy. Not like Log Cabin Republican old fashioned but I&amp;#39;ve never been the kind of sleep around a lot. On these apps I&amp;#39;ve said in my profile that I&amp;#39;m looking for long term relationships (not that anyone reads the profiles though, right?). &lt;/p&gt;

&lt;p&gt;Anyway, I&amp;#39;ve started talking to this guy on Tindr who I really hit it off with and we messaged each other back and forth for a day or two. We scheduled a date for tonight several days ago, and then exchanged phone numbers. I told him I was going to a friend&amp;#39;s for a couple of drinks and movie, and low and behold half way through the movie he sent me a pic of his boner. Now, he still had it in the underwear, so it was relatively tasteful, haha. &lt;/p&gt;

&lt;p&gt;I didn&amp;#39;t respond because there were two people sitting next to me that I didn&amp;#39;t know too well, and I think pulling up a picture of another guy&amp;#39;s bulge thirty minutes after you&amp;#39;ve been introduced to someone is a bit of a faux pas. Also, it was a little aggressive and I wanted more time to respond. Later that night he texted me &amp;quot;No?&amp;quot; and I explained the situation, but thanked him for the pic. &lt;/p&gt;

&lt;p&gt;The next morning he started sending me some innocent selfies, and then things escalated from there. He sent another underwear pic, and I kind of laughed it out. Then he sent a picture of him naked in the mirror, but with a lot of steam. I told him to hold his horses because we still hadn&amp;#39;t been on a first date, but I tried to do it in a flirtatious way. So granted, I was sending mixed signals, but I explained that I preferred to not rush things. &lt;/p&gt;

&lt;p&gt;Later that day he sent me a picture of his ass. I said, &amp;quot;So, now I&amp;#39;ve seen your ass and ballsack before we&amp;#39;ve even met. Calm down Speedy Gonzales, let&amp;#39;s take it slow. As much as I&amp;#39;m enjoying these let&amp;#39;s not put the horse before the cart.&amp;quot; He seemed apologetic, but I think having to tell someone three times to pull it back is a little much. &lt;/p&gt;

&lt;p&gt;But, I don&amp;#39;t have a lot of dating app experience. It&amp;#39;s not like I haven&amp;#39;t been sent dick pics before, but usually its either the first thing that gets sent, or you wait until things are a little more serious. He says he&amp;#39;s not looking for a hookup either, but the flood of pics makes me apprehensive. &lt;/p&gt;

&lt;p&gt;Am I just out of touch? Am I being too prudish? Should this be a deal breaker if I&amp;#39;m looking for a relationship? I mean, it&amp;#39;s obviously a bit soon to tell, but clearly we seem to have different priorities. &lt;/p&gt;

&lt;p&gt;TL;DR: Talking to a dude I really like. Looking for a LTR. He keeps sending me explicit pics even though I have kind of told him I&amp;#39;m not interested in rushing things. &lt;/p&gt;
&lt;/div&gt;&lt;!-- SC_ON --&gt;","False","askgaybros","t5_2vgfw","","","Dick Pics.","22","http://www.reddit.com/r/askgaybros/comments/2xgylr/dick_pics/","[]","False"
