"","_comment_sort","_comments","_comments_by_id","_info_url","_orphaned","_params","_replaced_more","_underscore_names","approved_by","archived","author","author_flair_css_class","author_flair_text","banned_by","clicked","created","created_utc","distinguished","domain","downs","edited","gilded","has_fetched","hidden","id","is_self","json_dict","likes","link_flair_css_class","link_flair_text","media","media_embed","mod_reports","name","num_comments","num_reports","over_18","permalink","reddit_session","report_reasons","saved","score","secure_media","secure_media_embed","selftext","selftext_html","stickied","subreddit","subreddit_id","suggested_sort","thumbnail","title","ups","url","user_reports","visited"
"18","","","{}","http://www.reddit.com/api/info/","{}","{}","False","","","False","seatalk","","","","False","1416933553.0","1416933553.0","","self.askgaybros","0","False","0","True","False","2ndukt","True","","","","","","{}","[]","t3_2ndukt","31","","False","http://www.reddit.com/r/askgaybros/comments/2ndukt/sick_of_disappointment_wanna_make_a_change_but_how/","Unauthenticated reddit sesssion","","False","5","","{}","I'm just so fed up with the current dating environment. Potentially great guys never show enough interest to make me think that I have a chance and should pursue them, and instead remain ""cool"" and ""aloof"" (ie. a bit distant and emotionally unavailable, because that's what's ""cool"" right now...). Guys that later turn out to be crazy/manipulative/abusive are the only ones who ever seem interested enough in me, so I usually end up wasting my time with them. 

I realize that dating requires effort, and fostering great connections takes time, but I'm sick of feeling like I'm always chasing guys that don't want me, or like I'm always having to try and prove myself so that they'll maybe see me as worthy of getting involved with. I'm tired of all the ""good"" guys being so closed-off and distant, so as to seem uninterested, and having to be suspicious of anyone who seems genuinely interested in me, because they always turn out to be really toxic people. And I hate saying it like that, because I know it sounds like I'm being dramatic or that I'm victimizing myself, even though that's not what's going on (well, I might be a tad dramatic, but it's no exaggeration when I say that every guy that I've been on more than one date with has mistreated me, and the ones who didn't get that far just lost interest or never had it in the first place, or never called back, etc. etc.).

I don't wanna have to try so hard to get people to like me, because I know it doesn't work that way, but at the same time I also realize that some effort is necessary. I'm just fucking tired of wanting something I can't have, of waiting for someone that clearly doesn't fucking exist.

I just wish all the good guys didn't either hide from me, or simply weren't interested in me. I'm tired of feeling like I'm the only one ever putting in any effort. I'm done with wasting time and being let down. But what the fuck can I even do about it?","&lt;!-- SC_OFF --&gt;&lt;div class=""md""&gt;&lt;p&gt;I&amp;#39;m just so fed up with the current dating environment. Potentially great guys never show enough interest to make me think that I have a chance and should pursue them, and instead remain &amp;quot;cool&amp;quot; and &amp;quot;aloof&amp;quot; (ie. a bit distant and emotionally unavailable, because that&amp;#39;s what&amp;#39;s &amp;quot;cool&amp;quot; right now...). Guys that later turn out to be crazy/manipulative/abusive are the only ones who ever seem interested enough in me, so I usually end up wasting my time with them. &lt;/p&gt;

&lt;p&gt;I realize that dating requires effort, and fostering great connections takes time, but I&amp;#39;m sick of feeling like I&amp;#39;m always chasing guys that don&amp;#39;t want me, or like I&amp;#39;m always having to try and prove myself so that they&amp;#39;ll maybe see me as worthy of getting involved with. I&amp;#39;m tired of all the &amp;quot;good&amp;quot; guys being so closed-off and distant, so as to seem uninterested, and having to be suspicious of anyone who seems genuinely interested in me, because they always turn out to be really toxic people. And I hate saying it like that, because I know it sounds like I&amp;#39;m being dramatic or that I&amp;#39;m victimizing myself, even though that&amp;#39;s not what&amp;#39;s going on (well, I might be a tad dramatic, but it&amp;#39;s no exaggeration when I say that every guy that I&amp;#39;ve been on more than one date with has mistreated me, and the ones who didn&amp;#39;t get that far just lost interest or never had it in the first place, or never called back, etc. etc.).&lt;/p&gt;

&lt;p&gt;I don&amp;#39;t wanna have to try so hard to get people to like me, because I know it doesn&amp;#39;t work that way, but at the same time I also realize that some effort is necessary. I&amp;#39;m just fucking tired of wanting something I can&amp;#39;t have, of waiting for someone that clearly doesn&amp;#39;t fucking exist.&lt;/p&gt;

&lt;p&gt;I just wish all the good guys didn&amp;#39;t either hide from me, or simply weren&amp;#39;t interested in me. I&amp;#39;m tired of feeling like I&amp;#39;m the only one ever putting in any effort. I&amp;#39;m done with wasting time and being let down. But what the fuck can I even do about it?&lt;/p&gt;
&lt;/div&gt;&lt;!-- SC_ON --&gt;","False","askgaybros","t5_2vgfw","","","Sick of disappointment, wanna make a change, but how?","5","http://www.reddit.com/r/askgaybros/comments/2ndukt/sick_of_disappointment_wanna_make_a_change_but_how/","[]","False"
