"","_comment_sort","_comments","_comments_by_id","_info_url","_orphaned","_params","_replaced_more","_underscore_names","approved_by","archived","author","author_flair_css_class","author_flair_text","banned_by","clicked","created","created_utc","distinguished","domain","downs","edited","gilded","has_fetched","hidden","id","is_self","json_dict","likes","link_flair_css_class","link_flair_text","media","media_embed","mod_reports","name","num_comments","num_reports","over_18","permalink","reddit_session","report_reasons","saved","score","secure_media","secure_media_embed","selftext","selftext_html","stickied","subreddit","subreddit_id","suggested_sort","thumbnail","title","ups","url","user_reports","visited"
"15","","","{}","http://www.reddit.com/api/info/","{}","{}","False","","","True","Grindrquestion1","","","","False","1407272463.0","1407268863.0","","self.askgaybros","0","False","0","True","False","2cpwgn","True","","","","","","{}","[]","t3_2cpwgn","12","","False","http://www.reddit.com/r/askgaybros/comments/2cpwgn/is_there_a_blog_for_grinder_xtra_users/","Unauthenticated reddit sesssion","","False","16","","{}","So something weird happened to me and a friend. Last week my friend texted me really upset because this guy (we'll call him WUG) had sent him a message saying that there was a post about him on the Grindr Xtra blog and it included his nudes. He asked for details about the blog and WUG explained that Xtra guys post about other users and warn each other away from guys. My friend and I did some research but couldn't find any mention of a Grindr blog. It isn't listed as a feature of Xtra and people don't talk about it on reddit or tumblr or anywhere. I downloaded the Xtra app and started a free trial, but WUG told us it was only for the people that pay $60 for the year membership. We tried asking WUG for a picture of the blog but he wouldn't send it. We were ready to write this whole thing off when another guy (I'll call this one Military) messaged my friend and told him the same thing. This guy also wouldn't send a picture of the blog but sent my friend his own nudes. I've messed around with Military before and I messaged him again to ask for more details about the blog. Which he wouldn't give. He was more interested in fucking again.

I stopped chatting with military but he was being really insistent. I kind of blew him off and then ended up blocking him. The day after I blocked him WUG sent me a message saying someone posted about me on the blog. I got pissed, unblocked military, and confronted him about it. He basically tried to blackmail me for sex in order to see the blog. I called him out on what he was doing and he sent me a pretty long message about how ugly I was and how I was a pity fuck. WUG was offline at this moment. I had asked him for details from the blog the night before but he hadn't replied yet. Almost immediately after military sent his message, WUG got on and sent me what had been said and one of my old nudes I had sent to military forever ago. I reported military and deleted Grindr. 

Things aren't adding up. It's odd that the two guys that messaged my friend messaged me. Also, my friend didn't know either of these guys (and as far as he knew) never sent them any nudes (assuming they don't have multiple accounts). He knew which guy he had sent the pics to, but had blocked him before this all happened. I honestly don't believe the blog is real and I think we're being fucked with. I was curious if anyone knew of it was real and if they could give me advice on how to deal with this. 

Tl;dr Friend is told that his nudes were posted on a blog for Grindr Xtra users by a guy. A second guy I knew messaged him shortly after and said the same thing. I messaged guy 2 asking for details, he wouldn't send them, tried to fuck me, and was ignored then blocked by me. The day after blocking guy 2, guy 1 messages me telling me that i am on the blog. Shit goes down. Am I being fucked with, does the blog exist, and can you give me advice on how to fix it?","&lt;!-- SC_OFF --&gt;&lt;div class=""md""&gt;&lt;p&gt;So something weird happened to me and a friend. Last week my friend texted me really upset because this guy (we&amp;#39;ll call him WUG) had sent him a message saying that there was a post about him on the Grindr Xtra blog and it included his nudes. He asked for details about the blog and WUG explained that Xtra guys post about other users and warn each other away from guys. My friend and I did some research but couldn&amp;#39;t find any mention of a Grindr blog. It isn&amp;#39;t listed as a feature of Xtra and people don&amp;#39;t talk about it on reddit or tumblr or anywhere. I downloaded the Xtra app and started a free trial, but WUG told us it was only for the people that pay $60 for the year membership. We tried asking WUG for a picture of the blog but he wouldn&amp;#39;t send it. We were ready to write this whole thing off when another guy (I&amp;#39;ll call this one Military) messaged my friend and told him the same thing. This guy also wouldn&amp;#39;t send a picture of the blog but sent my friend his own nudes. I&amp;#39;ve messed around with Military before and I messaged him again to ask for more details about the blog. Which he wouldn&amp;#39;t give. He was more interested in fucking again.&lt;/p&gt;

&lt;p&gt;I stopped chatting with military but he was being really insistent. I kind of blew him off and then ended up blocking him. The day after I blocked him WUG sent me a message saying someone posted about me on the blog. I got pissed, unblocked military, and confronted him about it. He basically tried to blackmail me for sex in order to see the blog. I called him out on what he was doing and he sent me a pretty long message about how ugly I was and how I was a pity fuck. WUG was offline at this moment. I had asked him for details from the blog the night before but he hadn&amp;#39;t replied yet. Almost immediately after military sent his message, WUG got on and sent me what had been said and one of my old nudes I had sent to military forever ago. I reported military and deleted Grindr. &lt;/p&gt;

&lt;p&gt;Things aren&amp;#39;t adding up. It&amp;#39;s odd that the two guys that messaged my friend messaged me. Also, my friend didn&amp;#39;t know either of these guys (and as far as he knew) never sent them any nudes (assuming they don&amp;#39;t have multiple accounts). He knew which guy he had sent the pics to, but had blocked him before this all happened. I honestly don&amp;#39;t believe the blog is real and I think we&amp;#39;re being fucked with. I was curious if anyone knew of it was real and if they could give me advice on how to deal with this. &lt;/p&gt;

&lt;p&gt;Tl;dr Friend is told that his nudes were posted on a blog for Grindr Xtra users by a guy. A second guy I knew messaged him shortly after and said the same thing. I messaged guy 2 asking for details, he wouldn&amp;#39;t send them, tried to fuck me, and was ignored then blocked by me. The day after blocking guy 2, guy 1 messages me telling me that i am on the blog. Shit goes down. Am I being fucked with, does the blog exist, and can you give me advice on how to fix it?&lt;/p&gt;
&lt;/div&gt;&lt;!-- SC_ON --&gt;","False","askgaybros","t5_2vgfw","","","Is there a blog for grinder xtra users?","16","http://www.reddit.com/r/askgaybros/comments/2cpwgn/is_there_a_blog_for_grinder_xtra_users/","[]","False"
"16","","","{}","http://www.reddit.com/api/info/","{}","{}","False","","","True","tlk13","","","","False","1407264844.0","1407261244.0","","self.askgaybros","0","False","0","True","False","2cpid6","True","","","","","","{}","[]","t3_2cpid6","10","","False","http://www.reddit.com/r/askgaybros/comments/2cpid6/texted_guy_that_he_gave_me_gonorrhea_he_hasnt/","Unauthenticated reddit sesssion","","False","6","","{}","I said that I claim part of the blame but he shouldn't let people bareback him (I know, I""m stupid, first time I have/will do that. I was stupid, depressed, stupid, lonely, dumb as fuck etc.), cuz he gave me gonorrhea. I told him to get tested too. He hasn't responded though. Should I message him on Facebook or Grindr to make sure he gives me an affirmative ""Okay, I will."" Or do I drop it?","&lt;!-- SC_OFF --&gt;&lt;div class=""md""&gt;&lt;p&gt;I said that I claim part of the blame but he shouldn&amp;#39;t let people bareback him (I know, I&amp;quot;m stupid, first time I have/will do that. I was stupid, depressed, stupid, lonely, dumb as fuck etc.), cuz he gave me gonorrhea. I told him to get tested too. He hasn&amp;#39;t responded though. Should I message him on Facebook or Grindr to make sure he gives me an affirmative &amp;quot;Okay, I will.&amp;quot; Or do I drop it?&lt;/p&gt;
&lt;/div&gt;&lt;!-- SC_ON --&gt;","False","askgaybros","t5_2vgfw","","","Texted guy that he gave me gonorrhea, he hasn't responded. Do I push him further?","6","http://www.reddit.com/r/askgaybros/comments/2cpid6/texted_guy_that_he_gave_me_gonorrhea_he_hasnt/","[]","False"
"17","","","{}","http://www.reddit.com/api/info/","{}","{}","False","","","True","Crackerjacksppp","","","","False","1407264781.0","1407261181.0","","self.askgaybros","0","False","0","True","False","2cpi8d","True","","","","","","{}","[]","t3_2cpi8d","7","","False","http://www.reddit.com/r/askgaybros/comments/2cpi8d/porn_effects/","Unauthenticated reddit sesssion","","False","2","","{}","Any gay guys like guys in real life romantic setting but don't get off to gay porn. Alternatively do any other gay men like straight porn.p.s I just can't seem to get an erection to gay porn.","&lt;!-- SC_OFF --&gt;&lt;div class=""md""&gt;&lt;p&gt;Any gay guys like guys in real life romantic setting but don&amp;#39;t get off to gay porn. Alternatively do any other gay men like straight porn.p.s I just can&amp;#39;t seem to get an erection to gay porn.&lt;/p&gt;
&lt;/div&gt;&lt;!-- SC_ON --&gt;","False","askgaybros","t5_2vgfw","","","Porn effects.","2","http://www.reddit.com/r/askgaybros/comments/2cpi8d/porn_effects/","[]","False"
