"","_comment_sort","_comments","_comments_by_id","_info_url","_orphaned","_params","_replaced_more","_underscore_names","approved_by","archived","author","author_flair_css_class","author_flair_text","banned_by","clicked","created","created_utc","distinguished","domain","downs","edited","gilded","has_fetched","hidden","id","is_self","json_dict","likes","link_flair_css_class","link_flair_text","media","media_embed","mod_reports","name","num_comments","num_reports","over_18","permalink","reddit_session","report_reasons","saved","score","secure_media","secure_media_embed","selftext","selftext_html","stickied","subreddit","subreddit_id","suggested_sort","thumbnail","title","ups","url","user_reports","visited"
"25","","","{}","http://www.reddit.com/api/info/","{}","{}","False","","","False","bearily","","","","False","1419881080.0","1419881080.0","","self.askgaybros","0","1419970739.0","0","True","False","2qqj42","True","","","","","","{}","[]","t3_2qqj42","19","","False","http://www.reddit.com/r/askgaybros/comments/2qqj42/cant_read_intentions_of_a_stranger_who_reached/","Unauthenticated reddit sesssion","","False","6","","{}","Hey guys,

I have a weird question, and I guess you can't really answer it for me, but I'm hoping to get another perspective.  Sorry for the long story:

A guy who I've seen and interacted with on a limited basis sporadically over the past couple of years (he's a bus driver on one of my routes), always very friendly and cheerful to everyone, one day out of nowhere handed me a slip of paper with his number and said to please call or text, right as I got off the bus.  Keep in mind that he's middle aged, maybe 50s early 60s (though I'm a poor judge), and I'm 28 but look considerably younger than that, pocket-sized, young face.

I saw him again the next week and he brought it up, said something about how he was hoping I would call, and I mumbled something about no thanks, I'm not interested and have a monogamous partner, whatever.  As I left the bus, he reiterated that he hoped I would call or text, that he just wanted ""to talk about something,"" ""just talk,"" etc. etc., 

I ddin't call or text; it felt like he just wanted to pick up a young guy, and I couldn't think of another reason why he would give me his number.  It seemed weird and unexpected and kinda pushy, especially from someone who always came off as very nonthreatening and friendly to *all* of his passengers.

So the next time I saw him a couple of weeks later, I was prepared to get more firm and suggest he was being inappropriate (I just want to get home, dammit), but he handed me a folded up piece of paper and said to read it, it was an explanation.

I read the note.  It basically detailed that he had been in the closet his whole life due to fear of beatings, that he was scared try to meet guys at bars or online, and that he felt like he didn't know how to ""be gay,"" how to meet guys, or what things mean in gay culture.  He wrote that I seemed so nice and that he'd wanted to talk to me for the past couple of years, that he'd appreciate it if he could get lunch or coffee with my partner and me to talk, answer questions, help guide him, that he respected I was in a relationship and he just wanted some help.  He said if I wasn't willing, to please give his number to another nice person who might be willing to help.

So maybe I'm overthinking, but what's your instinct?  Does this seem sincere?  If you were in that position, would you reach out to some random gay guy half, less than half your age?  Or do you think it's just somebody looking for a hookup with a young dude?  If he's being genuine I'd like to try to point him somewhere that could help, but it just feels strange, and I don't want to encourage anything else or get into a weird situation.  Am I being paranoid?

**TL;DR - Much older, more-or-less stranger reaches out to me strongly on the premise of feeling scared to come out as gay late in life and wanting help; is he likely to be genuine or a creeper?**

EDIT:  Thanks all.  Sounds like the consensus is that I'm being paranoid.  I've been in some bad situations before, so that might make me a little overly cautious.  I just shot the guy a text, hopefully I can be helpful to him.  Thanks for the advice!","&lt;!-- SC_OFF --&gt;&lt;div class=""md""&gt;&lt;p&gt;Hey guys,&lt;/p&gt;

&lt;p&gt;I have a weird question, and I guess you can&amp;#39;t really answer it for me, but I&amp;#39;m hoping to get another perspective.  Sorry for the long story:&lt;/p&gt;

&lt;p&gt;A guy who I&amp;#39;ve seen and interacted with on a limited basis sporadically over the past couple of years (he&amp;#39;s a bus driver on one of my routes), always very friendly and cheerful to everyone, one day out of nowhere handed me a slip of paper with his number and said to please call or text, right as I got off the bus.  Keep in mind that he&amp;#39;s middle aged, maybe 50s early 60s (though I&amp;#39;m a poor judge), and I&amp;#39;m 28 but look considerably younger than that, pocket-sized, young face.&lt;/p&gt;

&lt;p&gt;I saw him again the next week and he brought it up, said something about how he was hoping I would call, and I mumbled something about no thanks, I&amp;#39;m not interested and have a monogamous partner, whatever.  As I left the bus, he reiterated that he hoped I would call or text, that he just wanted &amp;quot;to talk about something,&amp;quot; &amp;quot;just talk,&amp;quot; etc. etc., &lt;/p&gt;

&lt;p&gt;I ddin&amp;#39;t call or text; it felt like he just wanted to pick up a young guy, and I couldn&amp;#39;t think of another reason why he would give me his number.  It seemed weird and unexpected and kinda pushy, especially from someone who always came off as very nonthreatening and friendly to &lt;em&gt;all&lt;/em&gt; of his passengers.&lt;/p&gt;

&lt;p&gt;So the next time I saw him a couple of weeks later, I was prepared to get more firm and suggest he was being inappropriate (I just want to get home, dammit), but he handed me a folded up piece of paper and said to read it, it was an explanation.&lt;/p&gt;

&lt;p&gt;I read the note.  It basically detailed that he had been in the closet his whole life due to fear of beatings, that he was scared try to meet guys at bars or online, and that he felt like he didn&amp;#39;t know how to &amp;quot;be gay,&amp;quot; how to meet guys, or what things mean in gay culture.  He wrote that I seemed so nice and that he&amp;#39;d wanted to talk to me for the past couple of years, that he&amp;#39;d appreciate it if he could get lunch or coffee with my partner and me to talk, answer questions, help guide him, that he respected I was in a relationship and he just wanted some help.  He said if I wasn&amp;#39;t willing, to please give his number to another nice person who might be willing to help.&lt;/p&gt;

&lt;p&gt;So maybe I&amp;#39;m overthinking, but what&amp;#39;s your instinct?  Does this seem sincere?  If you were in that position, would you reach out to some random gay guy half, less than half your age?  Or do you think it&amp;#39;s just somebody looking for a hookup with a young dude?  If he&amp;#39;s being genuine I&amp;#39;d like to try to point him somewhere that could help, but it just feels strange, and I don&amp;#39;t want to encourage anything else or get into a weird situation.  Am I being paranoid?&lt;/p&gt;

&lt;p&gt;&lt;strong&gt;TL;DR - Much older, more-or-less stranger reaches out to me strongly on the premise of feeling scared to come out as gay late in life and wanting help; is he likely to be genuine or a creeper?&lt;/strong&gt;&lt;/p&gt;

&lt;p&gt;EDIT:  Thanks all.  Sounds like the consensus is that I&amp;#39;m being paranoid.  I&amp;#39;ve been in some bad situations before, so that might make me a little overly cautious.  I just shot the guy a text, hopefully I can be helpful to him.  Thanks for the advice!&lt;/p&gt;
&lt;/div&gt;&lt;!-- SC_ON --&gt;","False","askgaybros","t5_2vgfw","","","Can't read intentions of a stranger who reached out - input?","6","http://www.reddit.com/r/askgaybros/comments/2qqj42/cant_read_intentions_of_a_stranger_who_reached/","[]","False"
"26","","","{}","http://www.reddit.com/api/info/","{}","{}","False","","","False","gbthrowaway939391818","","","","False","1419880934.0","1419880934.0","","self.askgaybros","0","1419881224.0","0","True","False","2qqit8","True","","","","","","{}","[]","t3_2qqit8","23","","False","http://www.reddit.com/r/askgaybros/comments/2qqit8/i_trust_that_my_boyfriend_isnt_cheating_but_his/","Unauthenticated reddit sesssion","","False","6","","{}","I've been dating this guy for about 6 months now. It's going great for the most part, but the most annoying thorn in my side about the relationship is his friendships with other gay men. 

Basically, he has two ex-boyfriends, both of which he's still good friends with. He also has a very close best friend, also gay. That's all well and good in and of itself, but his behavior with them often crosses the line into romantic in a way that makes me uncomfortable.

With one ex-boyfriend, he's shown me a couple of texts between them, and the way they talk to each other is just quite romantic to my ears. Sentimental banter, pet names, etc. They've hung out twice since my boyfriend and I have been together - the first time, the guy came onto him and my boyfriend had to reject him. The second time, my boyfriend said that they had a bit of a moment of sexual tension, but that they just laughed it off and left it at that.

My boyfriend and his best friend will also often share a bed - my boyfriend will take a night away from me once every couple of weeks to stay the night at his best friend's house. They even cuddle a bit. And it just really hits me a bit hard when my boyfriend decides to go spend the night in another man's bed instead of mine. Taking a guy's night out is more than okay, but making a point of spending the night in his bed (and not just he was too drunk to make it back home or something) bothers me. 

I could go on, but suffice it to say that it's stuff like this that is the issue. 

I've brought this all up with him a couple times, but he doesn't seem to understand why this all becomes bothersome. He seems to think that I'm just worried about him cheating, and he assures me that he's loyal and that he tells me about all of this so that we don't have any secrets and so on. But the way he behaves with other gay men just bothers me in and of itself, even though I do trust him not to cheat, and that's what he doesn't seem to understand. 

He has said that he will stop doing anything that makes me uncomfortable if I want, but I'm reluctant to just bark out orders at him - I'd rather that he understand why this stuff bothers me. Basically, I want to start a dialogue with him to make it clear that my concerns aren't coming from a lack of trust, but that this just isn't stuff someone in a committed relationship should be doing. But it's hard for me to explain why that is. 

Can someone who is better with feelings and words than I am help me articulate this? Or if you think I'm being insecure and over-possessive, feel free to tell me why.","&lt;!-- SC_OFF --&gt;&lt;div class=""md""&gt;&lt;p&gt;I&amp;#39;ve been dating this guy for about 6 months now. It&amp;#39;s going great for the most part, but the most annoying thorn in my side about the relationship is his friendships with other gay men. &lt;/p&gt;

&lt;p&gt;Basically, he has two ex-boyfriends, both of which he&amp;#39;s still good friends with. He also has a very close best friend, also gay. That&amp;#39;s all well and good in and of itself, but his behavior with them often crosses the line into romantic in a way that makes me uncomfortable.&lt;/p&gt;

&lt;p&gt;With one ex-boyfriend, he&amp;#39;s shown me a couple of texts between them, and the way they talk to each other is just quite romantic to my ears. Sentimental banter, pet names, etc. They&amp;#39;ve hung out twice since my boyfriend and I have been together - the first time, the guy came onto him and my boyfriend had to reject him. The second time, my boyfriend said that they had a bit of a moment of sexual tension, but that they just laughed it off and left it at that.&lt;/p&gt;

&lt;p&gt;My boyfriend and his best friend will also often share a bed - my boyfriend will take a night away from me once every couple of weeks to stay the night at his best friend&amp;#39;s house. They even cuddle a bit. And it just really hits me a bit hard when my boyfriend decides to go spend the night in another man&amp;#39;s bed instead of mine. Taking a guy&amp;#39;s night out is more than okay, but making a point of spending the night in his bed (and not just he was too drunk to make it back home or something) bothers me. &lt;/p&gt;

&lt;p&gt;I could go on, but suffice it to say that it&amp;#39;s stuff like this that is the issue. &lt;/p&gt;

&lt;p&gt;I&amp;#39;ve brought this all up with him a couple times, but he doesn&amp;#39;t seem to understand why this all becomes bothersome. He seems to think that I&amp;#39;m just worried about him cheating, and he assures me that he&amp;#39;s loyal and that he tells me about all of this so that we don&amp;#39;t have any secrets and so on. But the way he behaves with other gay men just bothers me in and of itself, even though I do trust him not to cheat, and that&amp;#39;s what he doesn&amp;#39;t seem to understand. &lt;/p&gt;

&lt;p&gt;He has said that he will stop doing anything that makes me uncomfortable if I want, but I&amp;#39;m reluctant to just bark out orders at him - I&amp;#39;d rather that he understand why this stuff bothers me. Basically, I want to start a dialogue with him to make it clear that my concerns aren&amp;#39;t coming from a lack of trust, but that this just isn&amp;#39;t stuff someone in a committed relationship should be doing. But it&amp;#39;s hard for me to explain why that is. &lt;/p&gt;

&lt;p&gt;Can someone who is better with feelings and words than I am help me articulate this? Or if you think I&amp;#39;m being insecure and over-possessive, feel free to tell me why.&lt;/p&gt;
&lt;/div&gt;&lt;!-- SC_ON --&gt;","False","askgaybros","t5_2vgfw","","","I trust that my boyfriend isn't cheating, but his interactions with his gay friends is still making me uncomfortable. How to explain this?","6","http://www.reddit.com/r/askgaybros/comments/2qqit8/i_trust_that_my_boyfriend_isnt_cheating_but_his/","[]","False"
"27","","","{}","http://www.reddit.com/api/info/","{}","{}","False","","","False","Fill-inTheBlank","","","","False","1419879214.0","1419879214.0","","self.askgaybros","0","False","0","True","False","2qqfeb","True","","","","","","{}","[]","t3_2qqfeb","21","","False","http://www.reddit.com/r/askgaybros/comments/2qqfeb/are_these_red_flags_or_am_i_just_being_a_worry/","Unauthenticated reddit sesssion","","False","2","","{}","Hello fellow bros.  My boyfriend and I have only been together for 3 months but I'm a bit worried about a couple of things. I wanted you guys' expertise on whether or not I'm over thinking these.

First, he plans everything. So much planning that it feels like there is never any spontaneity.  I understand taking an educated approach to things but there's never any real surprise or wonder. 

There's this guy I work with that I have hooked up with before my bf and I got together. We were friends before the hookup but now we always 'argue' whenever anything related to him comes up. I want to be friends with the guy, like close friends, but he finds it an issue.  All I want is a gay best friend but I feel like I wouldn't be able to have one because he wouldn't feel comfortable... granted I understand it's different being that I hooked up with the guy.

So what do you bros think?","&lt;!-- SC_OFF --&gt;&lt;div class=""md""&gt;&lt;p&gt;Hello fellow bros.  My boyfriend and I have only been together for 3 months but I&amp;#39;m a bit worried about a couple of things. I wanted you guys&amp;#39; expertise on whether or not I&amp;#39;m over thinking these.&lt;/p&gt;

&lt;p&gt;First, he plans everything. So much planning that it feels like there is never any spontaneity.  I understand taking an educated approach to things but there&amp;#39;s never any real surprise or wonder. &lt;/p&gt;

&lt;p&gt;There&amp;#39;s this guy I work with that I have hooked up with before my bf and I got together. We were friends before the hookup but now we always &amp;#39;argue&amp;#39; whenever anything related to him comes up. I want to be friends with the guy, like close friends, but he finds it an issue.  All I want is a gay best friend but I feel like I wouldn&amp;#39;t be able to have one because he wouldn&amp;#39;t feel comfortable... granted I understand it&amp;#39;s different being that I hooked up with the guy.&lt;/p&gt;

&lt;p&gt;So what do you bros think?&lt;/p&gt;
&lt;/div&gt;&lt;!-- SC_ON --&gt;","False","askgaybros","t5_2vgfw","","","Are these red flags or am I just being a worry wart?","2","http://www.reddit.com/r/askgaybros/comments/2qqfeb/are_these_red_flags_or_am_i_just_being_a_worry/","[]","False"
"28","","","{}","http://www.reddit.com/api/info/","{}","{}","False","","","False","jbwncster","","","","False","1419877740.0","1419877740.0","","self.askgaybros","0","1419943964.0","0","True","False","2qqchg","True","","","","","","{}","[]","t3_2qqchg","55","","False","http://www.reddit.com/r/askgaybros/comments/2qqchg/why_does_height_matter/","Unauthenticated reddit sesssion","","False","23","","{}","I'm 5ft 4, 25 and a top and I've been told for years I'm too short by a lot of guys and when guys say height doesn't matter they obviously mean ""Yes height matters"".","&lt;!-- SC_OFF --&gt;&lt;div class=""md""&gt;&lt;p&gt;I&amp;#39;m 5ft 4, 25 and a top and I&amp;#39;ve been told for years I&amp;#39;m too short by a lot of guys and when guys say height doesn&amp;#39;t matter they obviously mean &amp;quot;Yes height matters&amp;quot;.&lt;/p&gt;
&lt;/div&gt;&lt;!-- SC_ON --&gt;","False","askgaybros","t5_2vgfw","","","Why does height matter?","23","http://www.reddit.com/r/askgaybros/comments/2qqchg/why_does_height_matter/","[]","False"
"29","","","{}","http://www.reddit.com/api/info/","{}","{}","False","","","False","drewdidthis","","","","False","1419873013.0","1419873013.0","","self.askgaybros","0","False","0","True","False","2qq3ez","True","","","","","","{}","[]","t3_2qq3ez","73","","False","http://www.reddit.com/r/askgaybros/comments/2qq3ez/nonbears_would_you_date_a_bear_if_you_guys_had/","Unauthenticated reddit sesssion","","False","15","","{}","For the sake of not having an argument, let's let Bear represent the whole spectrum of subcategories of hairer or bulkier guys.","&lt;!-- SC_OFF --&gt;&lt;div class=""md""&gt;&lt;p&gt;For the sake of not having an argument, let&amp;#39;s let Bear represent the whole spectrum of subcategories of hairer or bulkier guys.&lt;/p&gt;
&lt;/div&gt;&lt;!-- SC_ON --&gt;","False","askgaybros","t5_2vgfw","","","Non-bears, would you date a bear if you guys had chemistry? Bears, same questions but reversed.","15","http://www.reddit.com/r/askgaybros/comments/2qq3ez/nonbears_would_you_date_a_bear_if_you_guys_had/","[]","False"
"30","","","{}","http://www.reddit.com/api/info/","{}","{}","False","","","False","look_an_underscore","","","","False","1419871657.0","1419871657.0","","self.askgaybros","0","False","0","True","False","2qq0tp","True","","","","","","{}","[]","t3_2qq0tp","7","","False","http://www.reddit.com/r/askgaybros/comments/2qq0tp/so_i_finally_bit_the_bullet_and_downloaded_grindr/","Unauthenticated reddit sesssion","","False","0","","{}","I'm not sure whether I should post this here, since it's not a question, but I think it's not really relevant the main Gaybros. So please let me know if I should move it elsewhere. Anyhow, it's been an interesting week so far.

I was on OkCupid for like a year and a half. A lot of the same guys in the area that claim to be ""into relationships"" are also on Grindr with mixed desires (some, but not all of them, are looking for ""right now."")

I'm glad I have no qualms about ignoring messages. I've received eight so far. Four of them were obviously fishing for my phone number (non-local phone numbers.) Another didn't have a pic, another guy kept bugging me and didn't use proper language, and another was a ""right now discreet no relationship"" guy. The last guy seemed normal and I've had decent conversations with him.

I've only messaged one other guy because I recognized where he took his pic (it was obscure, and very close to where I live.) He thought that was cool, but I didn't really continue further.

Most of the guys messaging me seem to be the 300+ pound guys. I guess that if you don't fit the traditionally attractive mold, you have to try harder. Also, things seem relatively clean so far - no commenting on body parts, asking for more than face pics (or pics at all), or anything that could potentially make me uncomfortable.

In summary, I plan on keeping Grindr for now, as long as I don't take it too seriously or care that much about whether I'm meeting other guys on it.","&lt;!-- SC_OFF --&gt;&lt;div class=""md""&gt;&lt;p&gt;I&amp;#39;m not sure whether I should post this here, since it&amp;#39;s not a question, but I think it&amp;#39;s not really relevant the main Gaybros. So please let me know if I should move it elsewhere. Anyhow, it&amp;#39;s been an interesting week so far.&lt;/p&gt;

&lt;p&gt;I was on OkCupid for like a year and a half. A lot of the same guys in the area that claim to be &amp;quot;into relationships&amp;quot; are also on Grindr with mixed desires (some, but not all of them, are looking for &amp;quot;right now.&amp;quot;)&lt;/p&gt;

&lt;p&gt;I&amp;#39;m glad I have no qualms about ignoring messages. I&amp;#39;ve received eight so far. Four of them were obviously fishing for my phone number (non-local phone numbers.) Another didn&amp;#39;t have a pic, another guy kept bugging me and didn&amp;#39;t use proper language, and another was a &amp;quot;right now discreet no relationship&amp;quot; guy. The last guy seemed normal and I&amp;#39;ve had decent conversations with him.&lt;/p&gt;

&lt;p&gt;I&amp;#39;ve only messaged one other guy because I recognized where he took his pic (it was obscure, and very close to where I live.) He thought that was cool, but I didn&amp;#39;t really continue further.&lt;/p&gt;

&lt;p&gt;Most of the guys messaging me seem to be the 300+ pound guys. I guess that if you don&amp;#39;t fit the traditionally attractive mold, you have to try harder. Also, things seem relatively clean so far - no commenting on body parts, asking for more than face pics (or pics at all), or anything that could potentially make me uncomfortable.&lt;/p&gt;

&lt;p&gt;In summary, I plan on keeping Grindr for now, as long as I don&amp;#39;t take it too seriously or care that much about whether I&amp;#39;m meeting other guys on it.&lt;/p&gt;
&lt;/div&gt;&lt;!-- SC_ON --&gt;","False","askgaybros","t5_2vgfw","","","So I finally bit the bullet and downloaded Grindr.","0","http://www.reddit.com/r/askgaybros/comments/2qq0tp/so_i_finally_bit_the_bullet_and_downloaded_grindr/","[]","False"
"31","","","{}","http://www.reddit.com/api/info/","{}","{}","False","","","False","fgntjlsa","","","","False","1419871365.0","1419871365.0","","self.askgaybros","0","False","0","True","False","2qq0bn","True","","","","","","{}","[]","t3_2qq0bn","40","","False","http://www.reddit.com/r/askgaybros/comments/2qq0bn/lower_pitched_voices/","Unauthenticated reddit sesssion","","False","30","","{}","I met up with a dude from Grindr for a date. Tall, dark, and handsome. My kind of bro. I hate using the word 'masc' but that's just the kind of guy I'm into. 

Anyway, we went on a date, it all went very well, he's handsome, funny. Everything I could ask for but he had a high-pitched voice.

I really don't get it, but as soon as I hear a high-pitched voice, I instantly get turned off. I was so attracted to this guy until he said Hi when he got into my car. Everything about my attraction went to shit.
I've tried fixing this by going on dates with other dudes that have a higher-pitched voice. I sometimes even date 'fem' guys for this same reason. But every single time I hear their voice, I lost all attraction. 

Any other bros with this same issue? Or am I just being shallow? 





TLDR: I am not attracted to guys with ""fem"" voices. ","&lt;!-- SC_OFF --&gt;&lt;div class=""md""&gt;&lt;p&gt;I met up with a dude from Grindr for a date. Tall, dark, and handsome. My kind of bro. I hate using the word &amp;#39;masc&amp;#39; but that&amp;#39;s just the kind of guy I&amp;#39;m into. &lt;/p&gt;

&lt;p&gt;Anyway, we went on a date, it all went very well, he&amp;#39;s handsome, funny. Everything I could ask for but he had a high-pitched voice.&lt;/p&gt;

&lt;p&gt;I really don&amp;#39;t get it, but as soon as I hear a high-pitched voice, I instantly get turned off. I was so attracted to this guy until he said Hi when he got into my car. Everything about my attraction went to shit.
I&amp;#39;ve tried fixing this by going on dates with other dudes that have a higher-pitched voice. I sometimes even date &amp;#39;fem&amp;#39; guys for this same reason. But every single time I hear their voice, I lost all attraction. &lt;/p&gt;

&lt;p&gt;Any other bros with this same issue? Or am I just being shallow? &lt;/p&gt;

&lt;p&gt;TLDR: I am not attracted to guys with &amp;quot;fem&amp;quot; voices. &lt;/p&gt;
&lt;/div&gt;&lt;!-- SC_ON --&gt;","False","askgaybros","t5_2vgfw","","","Lower pitched voices","30","http://www.reddit.com/r/askgaybros/comments/2qq0bn/lower_pitched_voices/","[]","False"
