"","_comment_sort","_comments","_comments_by_id","_info_url","_orphaned","_params","_replaced_more","_underscore_names","approved_by","archived","author","author_flair_css_class","author_flair_text","banned_by","clicked","created","created_utc","distinguished","domain","downs","edited","gilded","has_fetched","hidden","id","is_self","json_dict","likes","link_flair_css_class","link_flair_text","media","media_embed","mod_reports","name","num_comments","num_reports","over_18","permalink","reddit_session","report_reasons","saved","score","secure_media","secure_media_embed","selftext","selftext_html","stickied","subreddit","subreddit_id","suggested_sort","thumbnail","title","ups","url","user_reports","visited"
"7","","","{}","http://www.reddit.com/api/info/","{}","{}","False","","","False","Trollolz12345","","","","False","1419921954.0","1419921954.0","","self.askgaybros","0","1419985656.0","0","True","False","2qskyj","True","","","","","","{}","[]","t3_2qskyj","8","","False","http://www.reddit.com/r/askgaybros/comments/2qskyj/help_me_bros/","Unauthenticated reddit sesssion","","False","1","","{}","Hey bros. So I consider myself 100% gay. I feel complete attraction to men, watch gay porn, view girls strictly as friends, fantasize about men, and I feel as if you all get the point. Now here's my issue. I have extreme issues getting and staying hard. Now I know I don't have an issue getting erections in general. I wake up with hard on's, get random erections, get hard when seeing and thinking about attractive men, and I get hard when I'm hanging out with a guy and I think about having sex with him or when he touches my leg or we kiss or have physical contact. But when the time comes down to it, and somebody is about to go down on me in any way I lose my erection and can't get it up. This also happens when I'm about to top, and by the time I'm able to find the hole (which is incredibly difficult) I lose my hard on and can't get it up. Now I've gotten blowjobs before and finished, I've topped before and stayed hard throughout the whole thing, but recently I have been sexually frustrated, can't get it up, and usually just end up blowing the guy and he doesn't put the effort to help me and I won't finish. If any of you bros have some advice for a younger inexperienced bro (19) your words of wisdom.


P.S. I also have a pretty big dick so I don't know if that plays a factor. I also feel as if I have an insensitive dick because while getting head or topping feels good, its not the amazing feeling I always thought it would be.


*Edit* Thanks for all your help guys! I've come to the conclusion that I have huge performance anxiety issues, and just need to take a breather and relax when it's time. Also I'm much more of a bottom. Much, much more of a bottom. ","&lt;!-- SC_OFF --&gt;&lt;div class=""md""&gt;&lt;p&gt;Hey bros. So I consider myself 100% gay. I feel complete attraction to men, watch gay porn, view girls strictly as friends, fantasize about men, and I feel as if you all get the point. Now here&amp;#39;s my issue. I have extreme issues getting and staying hard. Now I know I don&amp;#39;t have an issue getting erections in general. I wake up with hard on&amp;#39;s, get random erections, get hard when seeing and thinking about attractive men, and I get hard when I&amp;#39;m hanging out with a guy and I think about having sex with him or when he touches my leg or we kiss or have physical contact. But when the time comes down to it, and somebody is about to go down on me in any way I lose my erection and can&amp;#39;t get it up. This also happens when I&amp;#39;m about to top, and by the time I&amp;#39;m able to find the hole (which is incredibly difficult) I lose my hard on and can&amp;#39;t get it up. Now I&amp;#39;ve gotten blowjobs before and finished, I&amp;#39;ve topped before and stayed hard throughout the whole thing, but recently I have been sexually frustrated, can&amp;#39;t get it up, and usually just end up blowing the guy and he doesn&amp;#39;t put the effort to help me and I won&amp;#39;t finish. If any of you bros have some advice for a younger inexperienced bro (19) your words of wisdom.&lt;/p&gt;

&lt;p&gt;P.S. I also have a pretty big dick so I don&amp;#39;t know if that plays a factor. I also feel as if I have an insensitive dick because while getting head or topping feels good, its not the amazing feeling I always thought it would be.&lt;/p&gt;

&lt;p&gt;&lt;em&gt;Edit&lt;/em&gt; Thanks for all your help guys! I&amp;#39;ve come to the conclusion that I have huge performance anxiety issues, and just need to take a breather and relax when it&amp;#39;s time. Also I&amp;#39;m much more of a bottom. Much, much more of a bottom. &lt;/p&gt;
&lt;/div&gt;&lt;!-- SC_ON --&gt;","False","askgaybros","t5_2vgfw","","","Help me bros!!!","1","http://www.reddit.com/r/askgaybros/comments/2qskyj/help_me_bros/","[]","False"
"8","","","{}","http://www.reddit.com/api/info/","{}","{}","False","","","False","shiverrrmitimber","","","","False","1419919865.0","1419919865.0","","self.askgaybros","0","False","0","True","False","2qshxb","True","","","","","","{}","[]","t3_2qshxb","7","","False","http://www.reddit.com/r/askgaybros/comments/2qshxb/struggling_to_stay_positive/","Unauthenticated reddit sesssion","","False","12","","{}","I'm back home for break from college and I'm going to be here for a month. I'm generally a very positive guy and when things aren't fantastic I don't let it get me down too much. Last week  my dad had a relapse, he is an alcoholic and I finally got him to go to rehab this past summer, so it feels like my hard work to help him has gone to shit. Also, I get a little down around the holidays as I've never has a special someone to spend them with. I have been trying and I know that I've only been out for a year so I can't expect immediate results, but nonetheless it's still lonely. Also, I have court tomorrow for a law suit about a car accident that I was in from 2 years ago. 

Do you guys have any tips for when shitty things start piling up?","&lt;!-- SC_OFF --&gt;&lt;div class=""md""&gt;&lt;p&gt;I&amp;#39;m back home for break from college and I&amp;#39;m going to be here for a month. I&amp;#39;m generally a very positive guy and when things aren&amp;#39;t fantastic I don&amp;#39;t let it get me down too much. Last week  my dad had a relapse, he is an alcoholic and I finally got him to go to rehab this past summer, so it feels like my hard work to help him has gone to shit. Also, I get a little down around the holidays as I&amp;#39;ve never has a special someone to spend them with. I have been trying and I know that I&amp;#39;ve only been out for a year so I can&amp;#39;t expect immediate results, but nonetheless it&amp;#39;s still lonely. Also, I have court tomorrow for a law suit about a car accident that I was in from 2 years ago. &lt;/p&gt;

&lt;p&gt;Do you guys have any tips for when shitty things start piling up?&lt;/p&gt;
&lt;/div&gt;&lt;!-- SC_ON --&gt;","False","askgaybros","t5_2vgfw","","","Struggling to stay positive","12","http://www.reddit.com/r/askgaybros/comments/2qshxb/struggling_to_stay_positive/","[]","False"
"9","","","{}","http://www.reddit.com/api/info/","{}","{}","False","","","False","CluelessGay","","","","False","1419918974.0","1419918974.0","","self.askgaybros","0","False","0","True","False","2qsgjz","True","","","","","","{}","[]","t3_2qsgjz","24","","False","http://www.reddit.com/r/askgaybros/comments/2qsgjz/brittish_accents/","Unauthenticated reddit sesssion","","False","2","","{}","As an American, I find British accents incredibly attractive. Like, a decent looking guy suddenly gets waaaay more attractive with an accent. It's probably the novelty of it. 

Do Brits feel the same way about American accents or no? A few of my European friends say they find American accents lazy. Not sure exactly what that means. ","&lt;!-- SC_OFF --&gt;&lt;div class=""md""&gt;&lt;p&gt;As an American, I find British accents incredibly attractive. Like, a decent looking guy suddenly gets waaaay more attractive with an accent. It&amp;#39;s probably the novelty of it. &lt;/p&gt;

&lt;p&gt;Do Brits feel the same way about American accents or no? A few of my European friends say they find American accents lazy. Not sure exactly what that means. &lt;/p&gt;
&lt;/div&gt;&lt;!-- SC_ON --&gt;","False","askgaybros","t5_2vgfw","","","Brittish Accents","2","http://www.reddit.com/r/askgaybros/comments/2qsgjz/brittish_accents/","[]","False"
"10","","","{}","http://www.reddit.com/api/info/","{}","{}","False","","","False","dbrox32","","","","False","1419911523.0","1419911523.0","","self.askgaybros","0","False","0","True","False","2qs43c","True","","","","","","{}","[]","t3_2qs43c","5","","False","http://www.reddit.com/r/askgaybros/comments/2qs43c/need_tips_for_coming_out_to_straight_bros/","Unauthenticated reddit sesssion","","False","4","","{}","It's been about a year since I've really accepted the fact that I was gay and am now feeling pretty confident about myself as a person. I think I'm ready to go public.

*Background info:* I'm a junior in college, have told some close girl friends and obviously the few guys that I've hooked up with. I live with and am very close friends with a lot of straight guys. None of them know. Part of the reason I want to come out now (besides being fed up with having to hide everything) is that I'm turning 21 soon and think it will be easier for me to start meeting gay guys out at bars. 

I'm looking to hear some personal experiences and concrete tips on how to come out to my straight, very bro-y friends. I want to be able to tell them in a way that isn't too weird and emotional, but also gets the point across that this is a huge deal for me and I need them to have my back on this. One of my main fears in telling them is dealing with that discomfort some straight guys have when around gay guys - wondering if I'm going to hit on them, feeling awkward and uncomfortable about what I say and do, and all that other BS.

Thanks in advance for the advice, guys.

**P.S.** I'm also down to hear stories about navigating life the first couple months after coming out publicly. What changed, what didn't?
 ","&lt;!-- SC_OFF --&gt;&lt;div class=""md""&gt;&lt;p&gt;It&amp;#39;s been about a year since I&amp;#39;ve really accepted the fact that I was gay and am now feeling pretty confident about myself as a person. I think I&amp;#39;m ready to go public.&lt;/p&gt;

&lt;p&gt;&lt;em&gt;Background info:&lt;/em&gt; I&amp;#39;m a junior in college, have told some close girl friends and obviously the few guys that I&amp;#39;ve hooked up with. I live with and am very close friends with a lot of straight guys. None of them know. Part of the reason I want to come out now (besides being fed up with having to hide everything) is that I&amp;#39;m turning 21 soon and think it will be easier for me to start meeting gay guys out at bars. &lt;/p&gt;

&lt;p&gt;I&amp;#39;m looking to hear some personal experiences and concrete tips on how to come out to my straight, very bro-y friends. I want to be able to tell them in a way that isn&amp;#39;t too weird and emotional, but also gets the point across that this is a huge deal for me and I need them to have my back on this. One of my main fears in telling them is dealing with that discomfort some straight guys have when around gay guys - wondering if I&amp;#39;m going to hit on them, feeling awkward and uncomfortable about what I say and do, and all that other BS.&lt;/p&gt;

&lt;p&gt;Thanks in advance for the advice, guys.&lt;/p&gt;

&lt;p&gt;&lt;strong&gt;P.S.&lt;/strong&gt; I&amp;#39;m also down to hear stories about navigating life the first couple months after coming out publicly. What changed, what didn&amp;#39;t?&lt;/p&gt;
&lt;/div&gt;&lt;!-- SC_ON --&gt;","False","askgaybros","t5_2vgfw","","","Need Tips For Coming Out to Straight Bros","4","http://www.reddit.com/r/askgaybros/comments/2qs43c/need_tips_for_coming_out_to_straight_bros/","[]","False"
"11","","","{}","http://www.reddit.com/api/info/","{}","{}","False","","","False","rhfan_67","","","","False","1419910719.0","1419910719.0","","self.askgaybros","0","False","0","True","False","2qs2vd","True","","","","","","{}","[]","t3_2qs2vd","4","","False","http://www.reddit.com/r/askgaybros/comments/2qs2vd/thought_i_was_over_that_crap/","Unauthenticated reddit sesssion","","False","1","","{}","This is more of a rant really. There's this guy I was best friends with like 6 years ago, we did EVERYTHING together and would just sit and talk for hours. We flirted often with each other and made hints that we wanted each other. This was before I was comfortable with my sexuality so I never got the nerve to come out and say it. While it never turned sexual, it definitely turned emotional. We started to look for apartments so we could move in together and we were about to book a cruise too and planned to consummate what we had. Then bam he gets this chick pregnant and everything is literally thrown out the window. We tried to be friends but the sexual tension between us just got too strong and it eventually turned into repressed anger that we took out on each other. It blew up badly, we beat the shit out of each other, talked shit on each other through facebook statuses, etc. the whole nine. We just stopped talking and it took me a few years and a bad depression to get over it. Now for the last three nights all of the sudden I'm having dreams of him texting me that he wants me and then we meet up and screw each others cum out like mad. And I wake up PISSED! Cause all the memories and feelings just came flooding back. This happened to me once last year and this same thing happened and for the next three weeks he was all I thought of.  I thought I was over him. I really want nothing to do with him anymore. I've seen a picture of what he looks like now and he aged badly so the attraction is gone. I know I can't really help what I dream of but seriously this is getting me mad now! END RANT.","&lt;!-- SC_OFF --&gt;&lt;div class=""md""&gt;&lt;p&gt;This is more of a rant really. There&amp;#39;s this guy I was best friends with like 6 years ago, we did EVERYTHING together and would just sit and talk for hours. We flirted often with each other and made hints that we wanted each other. This was before I was comfortable with my sexuality so I never got the nerve to come out and say it. While it never turned sexual, it definitely turned emotional. We started to look for apartments so we could move in together and we were about to book a cruise too and planned to consummate what we had. Then bam he gets this chick pregnant and everything is literally thrown out the window. We tried to be friends but the sexual tension between us just got too strong and it eventually turned into repressed anger that we took out on each other. It blew up badly, we beat the shit out of each other, talked shit on each other through facebook statuses, etc. the whole nine. We just stopped talking and it took me a few years and a bad depression to get over it. Now for the last three nights all of the sudden I&amp;#39;m having dreams of him texting me that he wants me and then we meet up and screw each others cum out like mad. And I wake up PISSED! Cause all the memories and feelings just came flooding back. This happened to me once last year and this same thing happened and for the next three weeks he was all I thought of.  I thought I was over him. I really want nothing to do with him anymore. I&amp;#39;ve seen a picture of what he looks like now and he aged badly so the attraction is gone. I know I can&amp;#39;t really help what I dream of but seriously this is getting me mad now! END RANT.&lt;/p&gt;
&lt;/div&gt;&lt;!-- SC_ON --&gt;","False","askgaybros","t5_2vgfw","","","Thought I was over that crap","1","http://www.reddit.com/r/askgaybros/comments/2qs2vd/thought_i_was_over_that_crap/","[]","False"
"12","","","{}","http://www.reddit.com/api/info/","{}","{}","False","","","False","NanaShark","","","","False","1419907769.0","1419907769.0","","self.askgaybros","0","False","0","True","False","2qry0e","True","","","","","","{}","[]","t3_2qry0e","8","","False","http://www.reddit.com/r/askgaybros/comments/2qry0e/in_a_situation_i_really_dont_know_how_to_handle/","Unauthenticated reddit sesssion","","False","1","","{}","Me and my boyfriend (Tom) have been together for ~4 months and already we have had our fair share of dramas recently we added another episode. He had told me about this guy (Ben) in a club that he goes to that has been interested in him for a very long time but he has no interest in him. He had also told me that Ben groped him which he explain to Ben was unacceptable he has a boyfriend etc.

Fast forwards a few days...I get a text from Tom saying that Ben had given him an ultimatum. If Tom were to send Ben a naked picture he would leave him alone and in his infinite wisdom he complied and sent the picture. You can imagine my reaction.

This is the third time he has hurt me and though he has never betrayed me I was angry and I wanted to hurt him. I decided in my own infinite wisdom to turn to grindr it was easy enough to find a guy to talk to we sent some pictures and that was that. I instantly regretted it. When he found out he got upset and I felt like an absolute asshole though it did bring him down to my level.  

He came over the following day and we had a long talk during which we discussed a lot of things. As a sign of faith he showed me texts between a few guys who had sent him pictures. He had replied saying he has a boyfriend etc which did give me a sense of security. He also admitted that he had a curiosity about how this guys dick looked which helped motivate his decision no doubt. We argued even more gained some common ground but ultimately I told him that I wanted to break up with him. There is only so much you can pull a relationship back from and with so much drama in such a short time I couldn't see a happy future with him. He told me that he forgave me for what I had done (which is a worse act than he committed) and that he really didn't want to break up but I still found it hard to move on. 

Now comes the complicated part I've been friends with a guy which we will call James for a while now we had spoken on grindr but he never showed any interest and so we remained friend. We went out for coffee every now and then and he would often advice me when it came to issue in my relationship. After telling him about my possible breakup he admitted that he had feelings for me. This guy really is incredible, intelligent, successful and, handsome. We get along really well I would say better than me and Tom do and I can imagine having a happy relationship with him. 

I still have a lot of feelings for Tom he was my first and we have shared some nice moment but I don't know if there is any future between us. 

I just don't know what to do...
","&lt;!-- SC_OFF --&gt;&lt;div class=""md""&gt;&lt;p&gt;Me and my boyfriend (Tom) have been together for ~4 months and already we have had our fair share of dramas recently we added another episode. He had told me about this guy (Ben) in a club that he goes to that has been interested in him for a very long time but he has no interest in him. He had also told me that Ben groped him which he explain to Ben was unacceptable he has a boyfriend etc.&lt;/p&gt;

&lt;p&gt;Fast forwards a few days...I get a text from Tom saying that Ben had given him an ultimatum. If Tom were to send Ben a naked picture he would leave him alone and in his infinite wisdom he complied and sent the picture. You can imagine my reaction.&lt;/p&gt;

&lt;p&gt;This is the third time he has hurt me and though he has never betrayed me I was angry and I wanted to hurt him. I decided in my own infinite wisdom to turn to grindr it was easy enough to find a guy to talk to we sent some pictures and that was that. I instantly regretted it. When he found out he got upset and I felt like an absolute asshole though it did bring him down to my level.  &lt;/p&gt;

&lt;p&gt;He came over the following day and we had a long talk during which we discussed a lot of things. As a sign of faith he showed me texts between a few guys who had sent him pictures. He had replied saying he has a boyfriend etc which did give me a sense of security. He also admitted that he had a curiosity about how this guys dick looked which helped motivate his decision no doubt. We argued even more gained some common ground but ultimately I told him that I wanted to break up with him. There is only so much you can pull a relationship back from and with so much drama in such a short time I couldn&amp;#39;t see a happy future with him. He told me that he forgave me for what I had done (which is a worse act than he committed) and that he really didn&amp;#39;t want to break up but I still found it hard to move on. &lt;/p&gt;

&lt;p&gt;Now comes the complicated part I&amp;#39;ve been friends with a guy which we will call James for a while now we had spoken on grindr but he never showed any interest and so we remained friend. We went out for coffee every now and then and he would often advice me when it came to issue in my relationship. After telling him about my possible breakup he admitted that he had feelings for me. This guy really is incredible, intelligent, successful and, handsome. We get along really well I would say better than me and Tom do and I can imagine having a happy relationship with him. &lt;/p&gt;

&lt;p&gt;I still have a lot of feelings for Tom he was my first and we have shared some nice moment but I don&amp;#39;t know if there is any future between us. &lt;/p&gt;

&lt;p&gt;I just don&amp;#39;t know what to do...&lt;/p&gt;
&lt;/div&gt;&lt;!-- SC_ON --&gt;","False","askgaybros","t5_2vgfw","","","In a Situation I Really Don't Know How To Handle","1","http://www.reddit.com/r/askgaybros/comments/2qry0e/in_a_situation_i_really_dont_know_how_to_handle/","[]","False"
"13","","","{}","http://www.reddit.com/api/info/","{}","{}","False","","","False","thorn9898","","","","False","1419906451.0","1419906451.0","","self.askgaybros","0","False","0","True","False","2qrvot","True","","","","","","{}","[]","t3_2qrvot","15","","False","http://www.reddit.com/r/askgaybros/comments/2qrvot/gay_friend_i_had_a_falling_out_with_got_into_a/","Unauthenticated reddit sesssion","","False","2","","{}","This is a follow up from the thread I posted.

http://www.reddit.com/r/askgaybros/comments/2qesw1/why_does_this_gay_exfriend_keep_trying_to_restore/

I saw statuses on FB about his car accident and found out it happened a couple days ago and he's been in critical condition.  I'm going through a lot of mixed emotions about this because I was close with him, but our friendship ended badly.  How would you cope with this situation?  ","&lt;!-- SC_OFF --&gt;&lt;div class=""md""&gt;&lt;p&gt;This is a follow up from the thread I posted.&lt;/p&gt;

&lt;p&gt;&lt;a href=""http://www.reddit.com/r/askgaybros/comments/2qesw1/why_does_this_gay_exfriend_keep_trying_to_restore/""&gt;http://www.reddit.com/r/askgaybros/comments/2qesw1/why_does_this_gay_exfriend_keep_trying_to_restore/&lt;/a&gt;&lt;/p&gt;

&lt;p&gt;I saw statuses on FB about his car accident and found out it happened a couple days ago and he&amp;#39;s been in critical condition.  I&amp;#39;m going through a lot of mixed emotions about this because I was close with him, but our friendship ended badly.  How would you cope with this situation?  &lt;/p&gt;
&lt;/div&gt;&lt;!-- SC_ON --&gt;","False","askgaybros","t5_2vgfw","","","Gay friend I had a falling out with got into a bad accident and is in critical condition. What he tried to do to me was disgusting, but I wouldn't wished this happened to him. Feeling like crap...","2","http://www.reddit.com/r/askgaybros/comments/2qrvot/gay_friend_i_had_a_falling_out_with_got_into_a/","[]","False"
"14","","","{}","http://www.reddit.com/api/info/","{}","{}","False","","","False","The_Colour_Blurple","","","","False","1419904572.0","1419904572.0","","self.askgaybros","0","False","0","True","False","2qrsb7","True","","","","","","{}","[]","t3_2qrsb7","37","","False","http://www.reddit.com/r/askgaybros/comments/2qrsb7/how_do_you_deal_with_your_familys_religious_views/","Unauthenticated reddit sesssion","","False","21","","{}","I recently had to sit through a sermon explaining why homosexuals should not be allowed to marry.

I was with my family, who I am not out to yet, and at first I was furious, but eventually I just felt shame. I'm no longer a religious person, but I had been raised very well by my church and family, and I fear that they might actually agree with the blatant bigotry that was preached to them.

How do you bros deal with that?","&lt;!-- SC_OFF --&gt;&lt;div class=""md""&gt;&lt;p&gt;I recently had to sit through a sermon explaining why homosexuals should not be allowed to marry.&lt;/p&gt;

&lt;p&gt;I was with my family, who I am not out to yet, and at first I was furious, but eventually I just felt shame. I&amp;#39;m no longer a religious person, but I had been raised very well by my church and family, and I fear that they might actually agree with the blatant bigotry that was preached to them.&lt;/p&gt;

&lt;p&gt;How do you bros deal with that?&lt;/p&gt;
&lt;/div&gt;&lt;!-- SC_ON --&gt;","False","askgaybros","t5_2vgfw","","","How do you deal with your family's religious views?","21","http://www.reddit.com/r/askgaybros/comments/2qrsb7/how_do_you_deal_with_your_familys_religious_views/","[]","False"
