"","_comment_sort","_comments","_comments_by_id","_info_url","_orphaned","_params","_replaced_more","_underscore_names","approved_by","archived","author","author_flair_css_class","author_flair_text","banned_by","clicked","created","created_utc","distinguished","domain","downs","edited","gilded","has_fetched","hidden","id","is_self","json_dict","likes","link_flair_css_class","link_flair_text","media","media_embed","mod_reports","name","num_comments","num_reports","over_18","permalink","reddit_session","report_reasons","saved","score","secure_media","secure_media_embed","selftext","selftext_html","stickied","subreddit","subreddit_id","suggested_sort","thumbnail","title","ups","url","user_reports","visited"
"11","","","{}","http://www.reddit.com/api/info/","{}","{}","False","","","False","DiscoCunts","","","","False","1415523116.0","1415523116.0","","self.askgaybros","0","False","0","True","False","2lqzpb","True","","","","","","{}","[]","t3_2lqzpb","4","","False","http://www.reddit.com/r/askgaybros/comments/2lqzpb/should_i_just_go_with_the_flow/","Unauthenticated reddit sesssion","","False","2","","{}","So I've been talking to this dude recently. He's pretty darn sweet, funny, and seems like an all around great guy. The problem is that he always manages to mention the fact that he's ""super into Asians"". I understand people have preferences, but I can't help but feel like he's only talking to me because of me being Asian. I don't particularly enjoy being fetishized and wouldn't want to stick around if that's the sole reason he's talking to me. 

I'm not sure if I'm looking too deeply into this. I don't want to bring this up to him if it's not a big deal. ","&lt;!-- SC_OFF --&gt;&lt;div class=""md""&gt;&lt;p&gt;So I&amp;#39;ve been talking to this dude recently. He&amp;#39;s pretty darn sweet, funny, and seems like an all around great guy. The problem is that he always manages to mention the fact that he&amp;#39;s &amp;quot;super into Asians&amp;quot;. I understand people have preferences, but I can&amp;#39;t help but feel like he&amp;#39;s only talking to me because of me being Asian. I don&amp;#39;t particularly enjoy being fetishized and wouldn&amp;#39;t want to stick around if that&amp;#39;s the sole reason he&amp;#39;s talking to me. &lt;/p&gt;

&lt;p&gt;I&amp;#39;m not sure if I&amp;#39;m looking too deeply into this. I don&amp;#39;t want to bring this up to him if it&amp;#39;s not a big deal. &lt;/p&gt;
&lt;/div&gt;&lt;!-- SC_ON --&gt;","False","askgaybros","t5_2vgfw","","","Should I just go with the flow?","2","http://www.reddit.com/r/askgaybros/comments/2lqzpb/should_i_just_go_with_the_flow/","[]","False"
"12","","","{}","http://www.reddit.com/api/info/","{}","{}","False","","","False","MagiciteKefka","","","","False","1415522095.0","1415522095.0","","self.askgaybros","0","False","0","True","False","2lqyus","True","","","","","","{}","[]","t3_2lqyus","17","","False","http://www.reddit.com/r/askgaybros/comments/2lqyus/boyfriends_family_doesnt_know_about_me_after_2/","Unauthenticated reddit sesssion","","False","5","","{}","So yeah, title is pretty self explanatory. I'm a 21 year old guy from Sweden, never been in a relationship before this one. Always knew I was gay, and actually told my mom about it a number of year ago. She's always been very open minded and cool so she was more than fine it. Rest of the family... well that's a different story.

Anyway, I met my boyfriend, who's an American, online on a gay forum and we instantly fell in love. We skyped every day for one and a half years before I finally moved over here. I go to school over here now and we are insanely happy. There's just one issue nagging me all the time, and that's that his family doesn't know about me at all, heck, they don't even know he's gay! My entire family knows about him, and the sane ones think he's wonderful.

I ask him about this from to time, and I get a nod and a curt response. He basically doesn't wanna know about. Also, as a sidenote, I once brought up the notion of eventual marriage,seeing as how Arizona now has gay marriage, and it would a great way to ensure that I get to stay in the country when my student visa runs out. Once again, he just replies that he doesn't wanna talk about it. At all. Ever.

Basically, I dunno, I guess I'm not asking for advice but basic pointers I guess. Should I be worried?","&lt;!-- SC_OFF --&gt;&lt;div class=""md""&gt;&lt;p&gt;So yeah, title is pretty self explanatory. I&amp;#39;m a 21 year old guy from Sweden, never been in a relationship before this one. Always knew I was gay, and actually told my mom about it a number of year ago. She&amp;#39;s always been very open minded and cool so she was more than fine it. Rest of the family... well that&amp;#39;s a different story.&lt;/p&gt;

&lt;p&gt;Anyway, I met my boyfriend, who&amp;#39;s an American, online on a gay forum and we instantly fell in love. We skyped every day for one and a half years before I finally moved over here. I go to school over here now and we are insanely happy. There&amp;#39;s just one issue nagging me all the time, and that&amp;#39;s that his family doesn&amp;#39;t know about me at all, heck, they don&amp;#39;t even know he&amp;#39;s gay! My entire family knows about him, and the sane ones think he&amp;#39;s wonderful.&lt;/p&gt;

&lt;p&gt;I ask him about this from to time, and I get a nod and a curt response. He basically doesn&amp;#39;t wanna know about. Also, as a sidenote, I once brought up the notion of eventual marriage,seeing as how Arizona now has gay marriage, and it would a great way to ensure that I get to stay in the country when my student visa runs out. Once again, he just replies that he doesn&amp;#39;t wanna talk about it. At all. Ever.&lt;/p&gt;

&lt;p&gt;Basically, I dunno, I guess I&amp;#39;m not asking for advice but basic pointers I guess. Should I be worried?&lt;/p&gt;
&lt;/div&gt;&lt;!-- SC_ON --&gt;","False","askgaybros","t5_2vgfw","","","Boyfriends family doesn't know about me after 2 years","5","http://www.reddit.com/r/askgaybros/comments/2lqyus/boyfriends_family_doesnt_know_about_me_after_2/","[]","False"
"13","","","{}","http://www.reddit.com/api/info/","{}","{}","False","","","False","shiverrrmitimber","","","","False","1415518385.0","1415518385.0","","self.askgaybros","0","False","0","True","False","2lqvng","True","","","","","","{}","[]","t3_2lqvng","5","","False","http://www.reddit.com/r/askgaybros/comments/2lqvng/i_really_need_to_stop_doing_this_to_myself/","Unauthenticated reddit sesssion","","False","0","","{}","I was bored the other day so I re-downloaded tinder as I was bored. I probably shouldn't have done this as i'm not someone who really flourishes in the whole app scene as I don't photograph particularly well (I've been frequently told that I look much better in person) and that I feel like my personality is better at winning people over and it's hard to convey that in a natural manner via text.  

Anyways, to the point of this post. So I was on it and I matched with a guy that I met at the men's group at my university's LGBTQ center. We chatted throughout the day and I decided to ask him for coffee, and he hasn't responded since. Being the neurotic person I am I just messaged (6 hours later) him saying that I just wanted to meet up in a friendly way (which I am) and that texting makes me uncomfortable.

 He still hasn't responded and it's making me uncomfortable and I dont know what to do. Should I just take a hint and walk away? From our very limited conversation I really wanted to get to know him better. 

Any words from the wise to help a newbie stop being a neurotic idiot? ","&lt;!-- SC_OFF --&gt;&lt;div class=""md""&gt;&lt;p&gt;I was bored the other day so I re-downloaded tinder as I was bored. I probably shouldn&amp;#39;t have done this as i&amp;#39;m not someone who really flourishes in the whole app scene as I don&amp;#39;t photograph particularly well (I&amp;#39;ve been frequently told that I look much better in person) and that I feel like my personality is better at winning people over and it&amp;#39;s hard to convey that in a natural manner via text.  &lt;/p&gt;

&lt;p&gt;Anyways, to the point of this post. So I was on it and I matched with a guy that I met at the men&amp;#39;s group at my university&amp;#39;s LGBTQ center. We chatted throughout the day and I decided to ask him for coffee, and he hasn&amp;#39;t responded since. Being the neurotic person I am I just messaged (6 hours later) him saying that I just wanted to meet up in a friendly way (which I am) and that texting makes me uncomfortable.&lt;/p&gt;

&lt;p&gt;He still hasn&amp;#39;t responded and it&amp;#39;s making me uncomfortable and I dont know what to do. Should I just take a hint and walk away? From our very limited conversation I really wanted to get to know him better. &lt;/p&gt;

&lt;p&gt;Any words from the wise to help a newbie stop being a neurotic idiot? &lt;/p&gt;
&lt;/div&gt;&lt;!-- SC_ON --&gt;","False","askgaybros","t5_2vgfw","","","I really need to stop doing this to myself.","0","http://www.reddit.com/r/askgaybros/comments/2lqvng/i_really_need_to_stop_doing_this_to_myself/","[]","False"
