"","_comment_sort","_comments","_comments_by_id","_info_url","_orphaned","_params","_replaced_more","_underscore_names","approved_by","archived","author","author_flair_css_class","author_flair_text","banned_by","clicked","created","created_utc","distinguished","domain","downs","edited","gilded","has_fetched","hidden","id","is_self","json_dict","likes","link_flair_css_class","link_flair_text","media","media_embed","mod_reports","name","num_comments","num_reports","over_18","permalink","reddit_session","report_reasons","saved","score","secure_media","secure_media_embed","selftext","selftext_html","stickied","subreddit","subreddit_id","suggested_sort","thumbnail","title","ups","url","user_reports","visited"
"15","","","{}","http://www.reddit.com/api/info/","{}","{}","False","","","False","yoolanda","","","","False","1419903555.0","1419903555.0","","self.askgaybros","0","False","0","True","False","2qrqi8","True","","","","","","{}","[]","t3_2qrqi8","23","","False","http://www.reddit.com/r/askgaybros/comments/2qrqi8/lady_with_gay_crush/","Unauthenticated reddit sesssion","","False","0","","{}","I fell in to a ""crush"" with a gay guy!! But I am a woman. He is extremely handsome (in my opinion), has ginger hair (YES), face stubble, So cute!! from England totally my type, but is unfortunatley in relationship with another man of the same sex. I know all this becuase I resaerched his reddit page and found picture of him and weblink to his instagram, which I start to follow now but no more updates since Marzh.. No GW pics of him, his boyfriend, or both. Despite my effort to talk to him here on reddit, he ignores me always. It is ""creepy"" but I am so hot recently, it is my hormones. I want to lick his stomach, chest, neck, biceps and taste his spicy ginger snap LOL. In general, I am attracted to men but unfortunately all the good ones are GAY. So Unfair!!!!!! It happens to me all the time ::: I find a handsome man, very sexworthy, but he is incompatible with me. I wish its possible to convert him to bisexual AT LEAST. Make him say something sweet to me, make him say it slowly until he believes J//k But He is Perfect!! How to get over a gay crush?? It's wrong I know, but I can't let go. In genreal, Straight males are not attractive or compassionate as gay men I do not understand why the gays always fall for the straights. Excuse my English, not a native speaker.","&lt;!-- SC_OFF --&gt;&lt;div class=""md""&gt;&lt;p&gt;I fell in to a &amp;quot;crush&amp;quot; with a gay guy!! But I am a woman. He is extremely handsome (in my opinion), has ginger hair (YES), face stubble, So cute!! from England totally my type, but is unfortunatley in relationship with another man of the same sex. I know all this becuase I resaerched his reddit page and found picture of him and weblink to his instagram, which I start to follow now but no more updates since Marzh.. No GW pics of him, his boyfriend, or both. Despite my effort to talk to him here on reddit, he ignores me always. It is &amp;quot;creepy&amp;quot; but I am so hot recently, it is my hormones. I want to lick his stomach, chest, neck, biceps and taste his spicy ginger snap LOL. In general, I am attracted to men but unfortunately all the good ones are GAY. So Unfair!!!!!! It happens to me all the time ::: I find a handsome man, very sexworthy, but he is incompatible with me. I wish its possible to convert him to bisexual AT LEAST. Make him say something sweet to me, make him say it slowly until he believes J//k But He is Perfect!! How to get over a gay crush?? It&amp;#39;s wrong I know, but I can&amp;#39;t let go. In genreal, Straight males are not attractive or compassionate as gay men I do not understand why the gays always fall for the straights. Excuse my English, not a native speaker.&lt;/p&gt;
&lt;/div&gt;&lt;!-- SC_ON --&gt;","False","askgaybros","t5_2vgfw","","","Lady with gay crush","0","http://www.reddit.com/r/askgaybros/comments/2qrqi8/lady_with_gay_crush/","[]","False"
"16","","","{}","http://www.reddit.com/api/info/","{}","{}","False","","","False","stagesnages","","","","False","1419901181.0","1419901181.0","","self.askgaybros","0","False","0","True","False","2qrm73","True","","","","","","{}","[]","t3_2qrm73","8","","True","http://www.reddit.com/r/askgaybros/comments/2qrm73/ever_had_this_happen_with_a_cock_ring/","Unauthenticated reddit sesssion","","False","1","","{}","So I just recently bought my first coc ring. I decided to go with one that is stretchy. The only thing is I out it on and it made my penis start to turn purple. Is that normal or is it too small? I figured since it was stretchy it would adjust to fit.

http://perfectfitbrand.com/product/ribbed-ring

That's the one I got. Also is it better to put around just the shaft or does around the sack also work better?","&lt;!-- SC_OFF --&gt;&lt;div class=""md""&gt;&lt;p&gt;So I just recently bought my first coc ring. I decided to go with one that is stretchy. The only thing is I out it on and it made my penis start to turn purple. Is that normal or is it too small? I figured since it was stretchy it would adjust to fit.&lt;/p&gt;

&lt;p&gt;&lt;a href=""http://perfectfitbrand.com/product/ribbed-ring""&gt;http://perfectfitbrand.com/product/ribbed-ring&lt;/a&gt;&lt;/p&gt;

&lt;p&gt;That&amp;#39;s the one I got. Also is it better to put around just the shaft or does around the sack also work better?&lt;/p&gt;
&lt;/div&gt;&lt;!-- SC_ON --&gt;","False","askgaybros","t5_2vgfw","","","Ever had this happen with a cock ring?","1","http://www.reddit.com/r/askgaybros/comments/2qrm73/ever_had_this_happen_with_a_cock_ring/","[]","False"
"17","","","{}","http://www.reddit.com/api/info/","{}","{}","False","","","False","flex44035","","","","False","1419897873.0","1419897873.0","","self.askgaybros","0","False","0","True","False","2qrg9r","True","","","","","","{}","[]","t3_2qrg9r","7","","False","http://www.reddit.com/r/askgaybros/comments/2qrg9r/lets_talk_about_bathhouses_ive_visited_a_few/","Unauthenticated reddit sesssion","","False","0","","{}","I'm 21, for starters.  This is an obvious throwaway account, due to wanting to remain anonymous.  I've visited the one by me a few times now, and am absolutely hooked.  I always use a condom as well.  I havn't done anything too crazy but sucked quite a few guys off at once (3) and absolutely loved being a little cocksucking slut!  But anywho, i'm wondering what are your wildest and dirtiest stories involving bathhouses?  I'm contemplating getting my first room this weekend instead of a locker as well.  Thanks all!fzevlk","&lt;!-- SC_OFF --&gt;&lt;div class=""md""&gt;&lt;p&gt;I&amp;#39;m 21, for starters.  This is an obvious throwaway account, due to wanting to remain anonymous.  I&amp;#39;ve visited the one by me a few times now, and am absolutely hooked.  I always use a condom as well.  I havn&amp;#39;t done anything too crazy but sucked quite a few guys off at once (3) and absolutely loved being a little cocksucking slut!  But anywho, i&amp;#39;m wondering what are your wildest and dirtiest stories involving bathhouses?  I&amp;#39;m contemplating getting my first room this weekend instead of a locker as well.  Thanks all!fzevlk&lt;/p&gt;
&lt;/div&gt;&lt;!-- SC_ON --&gt;","False","askgaybros","t5_2vgfw","","","Let's talk about bathhouses, I've visited a few times, but would LOVE to hear all your dirty stories, experiences, and everything else that involves them, I'm wanting to learn more!","0","http://www.reddit.com/r/askgaybros/comments/2qrg9r/lets_talk_about_bathhouses_ive_visited_a_few/","[]","False"
"18","","","{}","http://www.reddit.com/api/info/","{}","{}","False","","","False","tristain_shandy","","","","False","1419895896.0","1419895896.0","","self.askgaybros","0","False","0","True","False","2qrcpg","True","","","","","","{}","[]","t3_2qrcpg","14","","False","http://www.reddit.com/r/askgaybros/comments/2qrcpg/trying_to_bulk_up_on_a_fast_metabolism/","Unauthenticated reddit sesssion","","False","1","","{}","Hey bros,

I hope some of you fitness-minded bros can help me out.

So I'm a pretty skinny guy--about 5'11"" and 133-ish pounds--and I've been hitting the gym pretty hard over the past year and a half or so, but I've had a really hard time putting on muscle. It's not for lack of working out--I'm doing every machine I can get my hands on, as well as bodyweight exercises--but I have a stupid ridiculously fast metabolism and I find it extremely difficult to eat enough to keep my caloric intake at a point where I would start gaining mass. I'd also like to maybe use a protein supplement, but--surprise!--I'm allergic to milk and can't use any whey-based (or generally any animal-based) protein supplements (because most of them contain milk byproducts, even if they aren't whey).

Do any of you guys who have dealt with this sort of thing before have any tips for how I might modify my diet / vegan protein supplements I might look into / some other tips I've overlooking? I've already stopped running thanks to my friend's advice, so that should help me out a little, but I really want to put on some muscle and I'm finding it really, really, REALLY difficult.

Thanks in advance, guys. I appreciate any help you might give.","&lt;!-- SC_OFF --&gt;&lt;div class=""md""&gt;&lt;p&gt;Hey bros,&lt;/p&gt;

&lt;p&gt;I hope some of you fitness-minded bros can help me out.&lt;/p&gt;

&lt;p&gt;So I&amp;#39;m a pretty skinny guy--about 5&amp;#39;11&amp;quot; and 133-ish pounds--and I&amp;#39;ve been hitting the gym pretty hard over the past year and a half or so, but I&amp;#39;ve had a really hard time putting on muscle. It&amp;#39;s not for lack of working out--I&amp;#39;m doing every machine I can get my hands on, as well as bodyweight exercises--but I have a stupid ridiculously fast metabolism and I find it extremely difficult to eat enough to keep my caloric intake at a point where I would start gaining mass. I&amp;#39;d also like to maybe use a protein supplement, but--surprise!--I&amp;#39;m allergic to milk and can&amp;#39;t use any whey-based (or generally any animal-based) protein supplements (because most of them contain milk byproducts, even if they aren&amp;#39;t whey).&lt;/p&gt;

&lt;p&gt;Do any of you guys who have dealt with this sort of thing before have any tips for how I might modify my diet / vegan protein supplements I might look into / some other tips I&amp;#39;ve overlooking? I&amp;#39;ve already stopped running thanks to my friend&amp;#39;s advice, so that should help me out a little, but I really want to put on some muscle and I&amp;#39;m finding it really, really, REALLY difficult.&lt;/p&gt;

&lt;p&gt;Thanks in advance, guys. I appreciate any help you might give.&lt;/p&gt;
&lt;/div&gt;&lt;!-- SC_ON --&gt;","False","askgaybros","t5_2vgfw","","","Trying to Bulk Up on a Fast Metabolism","1","http://www.reddit.com/r/askgaybros/comments/2qrcpg/trying_to_bulk_up_on_a_fast_metabolism/","[]","False"
"19","","","{}","http://www.reddit.com/api/info/","{}","{}","False","","","False","squeeeeenis","","","","False","1419895403.0","1419895403.0","","self.askgaybros","0","False","0","True","False","2qrbr3","True","","","","","","{}","[]","t3_2qrbr3","42","","False","http://www.reddit.com/r/askgaybros/comments/2qrbr3/some_girl_who_didnt_know_i_was_gay_is_accusing_me/","Unauthenticated reddit sesssion","","False","50","","{}","Basically it goes like this, I was having a cigarette with this one girl at a party, and we had been alone waiting for the others to get back with pizza. Me and her had been drinking, talking about some bullshit. 

The next day, everyone is telling me how she said I was hitting on her and showed her my twigs and berry's. This most certainly did not happen, but for some reason everyone who knows I'm gay 100% believes it. She did not know I was gay and she said she was  ""Grossly offended."" 

Now Im just sitting her thinking that I am going to be labed a sex offender for the rest of my life, and im really stressed out. I know I did no such thing, but the gossip is grand in that group. 

What should I do to stop all this chaos? ","&lt;!-- SC_OFF --&gt;&lt;div class=""md""&gt;&lt;p&gt;Basically it goes like this, I was having a cigarette with this one girl at a party, and we had been alone waiting for the others to get back with pizza. Me and her had been drinking, talking about some bullshit. &lt;/p&gt;

&lt;p&gt;The next day, everyone is telling me how she said I was hitting on her and showed her my twigs and berry&amp;#39;s. This most certainly did not happen, but for some reason everyone who knows I&amp;#39;m gay 100% believes it. She did not know I was gay and she said she was  &amp;quot;Grossly offended.&amp;quot; &lt;/p&gt;

&lt;p&gt;Now Im just sitting her thinking that I am going to be labed a sex offender for the rest of my life, and im really stressed out. I know I did no such thing, but the gossip is grand in that group. &lt;/p&gt;

&lt;p&gt;What should I do to stop all this chaos? &lt;/p&gt;
&lt;/div&gt;&lt;!-- SC_ON --&gt;","False","askgaybros","t5_2vgfw","","","Some Girl who didn't know I was gay is accusing me of hitting on her and flashing her my junk. What do?","50","http://www.reddit.com/r/askgaybros/comments/2qrbr3/some_girl_who_didnt_know_i_was_gay_is_accusing_me/","[]","False"
"20","","","{}","http://www.reddit.com/api/info/","{}","{}","False","","","False","uglydumb","","","","False","1419890721.0","1419890721.0","","self.askgaybros","0","False","0","True","False","2qr2ic","True","","","","","","{}","[]","t3_2qr2ic","18","","False","http://www.reddit.com/r/askgaybros/comments/2qr2ic/i_just_dont_know_anymore/","Unauthenticated reddit sesssion","","False","2","","{}","Ok, so. I feel really depressed, because it seems like I'm doomed to live my life lonely. I'm really, really unattractive (I'm just going to leave out what exactly bothers me since it would take too long) and I guess this is the main reason why I get ignored by everyone. I made accounts on the common apps but got no respones on my messages. I thought about surgeries and I also started saving money for it but I just don't know, I just think I'm a hopeless case. 

I also started seeing a psychologist but it only helps for the day and then the effect vanishes away. My friends can't help me either. I'm just sad and wish I'd had another life, other parents with better genes or whatsoever, haha. I can't be happy anymore, actually I don't remember ever being and I'm too tired to go on with my life.

I know you guys can't really help me, you can't make me beautiful but I just needed to get this off.","&lt;!-- SC_OFF --&gt;&lt;div class=""md""&gt;&lt;p&gt;Ok, so. I feel really depressed, because it seems like I&amp;#39;m doomed to live my life lonely. I&amp;#39;m really, really unattractive (I&amp;#39;m just going to leave out what exactly bothers me since it would take too long) and I guess this is the main reason why I get ignored by everyone. I made accounts on the common apps but got no respones on my messages. I thought about surgeries and I also started saving money for it but I just don&amp;#39;t know, I just think I&amp;#39;m a hopeless case. &lt;/p&gt;

&lt;p&gt;I also started seeing a psychologist but it only helps for the day and then the effect vanishes away. My friends can&amp;#39;t help me either. I&amp;#39;m just sad and wish I&amp;#39;d had another life, other parents with better genes or whatsoever, haha. I can&amp;#39;t be happy anymore, actually I don&amp;#39;t remember ever being and I&amp;#39;m too tired to go on with my life.&lt;/p&gt;

&lt;p&gt;I know you guys can&amp;#39;t really help me, you can&amp;#39;t make me beautiful but I just needed to get this off.&lt;/p&gt;
&lt;/div&gt;&lt;!-- SC_ON --&gt;","False","askgaybros","t5_2vgfw","","","I just don't know anymore","2","http://www.reddit.com/r/askgaybros/comments/2qr2ic/i_just_dont_know_anymore/","[]","False"
"21","","","{}","http://www.reddit.com/api/info/","{}","{}","False","","","False","northeast757","","","","False","1419888761.0","1419888761.0","","self.askgaybros","0","False","0","True","False","2qqyq4","True","","","","","","{}","[]","t3_2qqyq4","10","","False","http://www.reddit.com/r/askgaybros/comments/2qqyq4/spanish_sexcapades/","Unauthenticated reddit sesssion","","False","8","","{}","Hey, so I just came out to my friend and she is the only person who knows I'm questioning my sexuality.  I'll be going to Spain this spring for a study abroad thing figured this was the perfect opportunity to really explore my sex life (which has been nonexistent to this point...never even kissed anyone).  I was wondering if any gaybros know anything about the gay scene in Spain.  I'm purposefully leaving this kind of open ended because seriously any input would be appreciated.  Also, a just-turned (pun intended?) 20 year old college student, so that will play into where I'll probably gravitate in terms of night life.  Muchas gracias!!!!","&lt;!-- SC_OFF --&gt;&lt;div class=""md""&gt;&lt;p&gt;Hey, so I just came out to my friend and she is the only person who knows I&amp;#39;m questioning my sexuality.  I&amp;#39;ll be going to Spain this spring for a study abroad thing figured this was the perfect opportunity to really explore my sex life (which has been nonexistent to this point...never even kissed anyone).  I was wondering if any gaybros know anything about the gay scene in Spain.  I&amp;#39;m purposefully leaving this kind of open ended because seriously any input would be appreciated.  Also, a just-turned (pun intended?) 20 year old college student, so that will play into where I&amp;#39;ll probably gravitate in terms of night life.  Muchas gracias!!!!&lt;/p&gt;
&lt;/div&gt;&lt;!-- SC_ON --&gt;","False","askgaybros","t5_2vgfw","","","Spanish Sexcapades","8","http://www.reddit.com/r/askgaybros/comments/2qqyq4/spanish_sexcapades/","[]","False"
"22","","","{}","http://www.reddit.com/api/info/","{}","{}","False","","","False","S5S5S","","","","False","1419888759.0","1419888759.0","","self.askgaybros","0","False","0","True","False","2qqyq1","True","","","","","","{}","[]","t3_2qqyq1","43","","False","http://www.reddit.com/r/askgaybros/comments/2qqyq1/how_are_you_going_to_have_children/","Unauthenticated reddit sesssion","","False","16","","{}","I would like to think I'll have my own child some day, but I was wondering how likely this actually is. How did you have children or how do you plan to have one?","&lt;!-- SC_OFF --&gt;&lt;div class=""md""&gt;&lt;p&gt;I would like to think I&amp;#39;ll have my own child some day, but I was wondering how likely this actually is. How did you have children or how do you plan to have one?&lt;/p&gt;
&lt;/div&gt;&lt;!-- SC_ON --&gt;","False","askgaybros","t5_2vgfw","","","How are you going to have children?","16","http://www.reddit.com/r/askgaybros/comments/2qqyq1/how_are_you_going_to_have_children/","[]","False"
"23","","","{}","http://www.reddit.com/api/info/","{}","{}","False","","","False","gthrowaway9","","","","False","1419884439.0","1419884439.0","","self.askgaybros","0","False","0","True","False","2qqpyc","True","","","","","","{}","[]","t3_2qqpyc","24","","False","http://www.reddit.com/r/askgaybros/comments/2qqpyc/judgementfree_chill_ass_waxing_for_guys/","Unauthenticated reddit sesssion","","False","36","","{}","Alright I know this is weird but the guy I'm seeing has a thing for the completely smooth look and asked if I would consider getting my ass waxed for him. I'm ok with the pain aspect I just don't if there's anywhere a 6'3 fairly big guy could get that done with no judgment or weirdness. Has anyone had experience with getting this done before? What do you do? I live near Atlanta if it helps. Thanks","&lt;!-- SC_OFF --&gt;&lt;div class=""md""&gt;&lt;p&gt;Alright I know this is weird but the guy I&amp;#39;m seeing has a thing for the completely smooth look and asked if I would consider getting my ass waxed for him. I&amp;#39;m ok with the pain aspect I just don&amp;#39;t if there&amp;#39;s anywhere a 6&amp;#39;3 fairly big guy could get that done with no judgment or weirdness. Has anyone had experience with getting this done before? What do you do? I live near Atlanta if it helps. Thanks&lt;/p&gt;
&lt;/div&gt;&lt;!-- SC_ON --&gt;","False","askgaybros","t5_2vgfw","","","Judgement-free chill ass waxing for guys","36","http://www.reddit.com/r/askgaybros/comments/2qqpyc/judgementfree_chill_ass_waxing_for_guys/","[]","False"
"24","","","{}","http://www.reddit.com/api/info/","{}","{}","False","","","False","Y6Y1Y9","","","","False","1419883136.0","1419883136.0","","self.askgaybros","0","1419883338.0","0","True","False","2qqnbs","True","","","","","","{}","[]","t3_2qqnbs","9","","False","http://www.reddit.com/r/askgaybros/comments/2qqnbs/gaybros_in_los_angeles_i_need_new_years_eve/","Unauthenticated reddit sesssion","","False","7","","{}","Sorry if this isn't the right place for this post, /r/LosAngelesGayBros is pretty dead in comparison. I figured i'd get more/better answers if i posted here. Myself (early 20's year old gay dude) and my good friend (early 20's year old straightbro) are going to be spending New Years together. We live in Los Angeles and i was planning on going to the designated gay part of town, West Hollywood (for the first time), by myself. Then i found out he was going to be by himself with no plans for New Years at home alone cause his best friend went to Vegas without him. So i offered him to come hang with me. He's down to do whatever. Initially when it was going to be just me, i was just going to go to West Hollywood and wander around and see what i saw and go where ever seemed appealing. 

However, now that i have someone coming with me, i want to have a bit more of a plan/specific destination. I want to have a good time and i want him to have as good a time as possible considering this is a backup plan for him. Even though he's straight, he's more than ok with us LGBT people. Most of his family is LGBT. His dad's gay, his brother is gay, his sister is bisexual and two of his cousins are gay. Funny enough, admittedly, i have a small crush on the dude. Figures i'd be into the one straight guy in the family haha, it's pretty hilarious to me. Anyway, that's a whole other post. 

But yeah, so i'm just wondering if any L.A. bros have any suggestions on where we can go or what New Years events are going on in WeHo that are fun but won't be too much for him (or me honestly). I don't want to take him to some bondage/fetish focused bar/club or bar/club in WeHo where the guys tend to be too forward or the types to make inappropriate moves on any straight guys in attendance for example. He's a hot dude. I want him to have fun and not have to worry about shooting guys down all night. Some place kinda vanilla/chill with a good party vibe but not too over the top/too much for a gay dude going to WeHo for the first time and a straightbro. Thanks in advanced for any suggestions guys.","&lt;!-- SC_OFF --&gt;&lt;div class=""md""&gt;&lt;p&gt;Sorry if this isn&amp;#39;t the right place for this post, &lt;a href=""/r/LosAngelesGayBros""&gt;/r/LosAngelesGayBros&lt;/a&gt; is pretty dead in comparison. I figured i&amp;#39;d get more/better answers if i posted here. Myself (early 20&amp;#39;s year old gay dude) and my good friend (early 20&amp;#39;s year old straightbro) are going to be spending New Years together. We live in Los Angeles and i was planning on going to the designated gay part of town, West Hollywood (for the first time), by myself. Then i found out he was going to be by himself with no plans for New Years at home alone cause his best friend went to Vegas without him. So i offered him to come hang with me. He&amp;#39;s down to do whatever. Initially when it was going to be just me, i was just going to go to West Hollywood and wander around and see what i saw and go where ever seemed appealing. &lt;/p&gt;

&lt;p&gt;However, now that i have someone coming with me, i want to have a bit more of a plan/specific destination. I want to have a good time and i want him to have as good a time as possible considering this is a backup plan for him. Even though he&amp;#39;s straight, he&amp;#39;s more than ok with us LGBT people. Most of his family is LGBT. His dad&amp;#39;s gay, his brother is gay, his sister is bisexual and two of his cousins are gay. Funny enough, admittedly, i have a small crush on the dude. Figures i&amp;#39;d be into the one straight guy in the family haha, it&amp;#39;s pretty hilarious to me. Anyway, that&amp;#39;s a whole other post. &lt;/p&gt;

&lt;p&gt;But yeah, so i&amp;#39;m just wondering if any L.A. bros have any suggestions on where we can go or what New Years events are going on in WeHo that are fun but won&amp;#39;t be too much for him (or me honestly). I don&amp;#39;t want to take him to some bondage/fetish focused bar/club or bar/club in WeHo where the guys tend to be too forward or the types to make inappropriate moves on any straight guys in attendance for example. He&amp;#39;s a hot dude. I want him to have fun and not have to worry about shooting guys down all night. Some place kinda vanilla/chill with a good party vibe but not too over the top/too much for a gay dude going to WeHo for the first time and a straightbro. Thanks in advanced for any suggestions guys.&lt;/p&gt;
&lt;/div&gt;&lt;!-- SC_ON --&gt;","False","askgaybros","t5_2vgfw","","","Gaybros in Los Angeles. I Need New Years Eve Suggestions.","7","http://www.reddit.com/r/askgaybros/comments/2qqnbs/gaybros_in_los_angeles_i_need_new_years_eve/","[]","False"
