"","_comment_sort","_comments","_comments_by_id","_info_url","_orphaned","_params","_replaced_more","_underscore_names","approved_by","archived","author","author_flair_css_class","author_flair_text","banned_by","clicked","created","created_utc","distinguished","domain","downs","edited","gilded","has_fetched","hidden","id","is_self","json_dict","likes","link_flair_css_class","link_flair_text","media","media_embed","mod_reports","name","num_comments","num_reports","over_18","permalink","reddit_session","report_reasons","saved","score","secure_media","secure_media_embed","selftext","selftext_html","stickied","subreddit","subreddit_id","suggested_sort","thumbnail","title","ups","url","user_reports","visited"
"0","","","{}","http://www.reddit.com/api/info/","{}","{}","False","","","False","heybroaway","","","","False","1415633707.0","1415633707.0","","self.askgaybros","0","1415640025.0","0","True","False","2lv6a2","True","","","","","","{}","[]","t3_2lv6a2","9","","False","http://www.reddit.com/r/askgaybros/comments/2lv6a2/i_want_to_be_able_to_talk_to_guys/","Unauthenticated reddit sesssion","","False","6","","{}","I have no problem talking via text, grindr, or during a planned date, but if it's on the spot I'm horrible. I freeze up when I have to talk to a cute guy, and it only gets worse if I know he's gay. I got sick and had to leave one time just talking to a cute straight guy. I always immediately blush like it's nobody's business too, which makes it obvious if I think a guy is cute. Sometimes I try my best to ignore them or act like I'm not interested just so I won't feel so vulnerable. I'm pretty comfortable with how I look, but the anxiety makes it impossible for me to be able to talk to guys.","&lt;!-- SC_OFF --&gt;&lt;div class=""md""&gt;&lt;p&gt;I have no problem talking via text, grindr, or during a planned date, but if it&amp;#39;s on the spot I&amp;#39;m horrible. I freeze up when I have to talk to a cute guy, and it only gets worse if I know he&amp;#39;s gay. I got sick and had to leave one time just talking to a cute straight guy. I always immediately blush like it&amp;#39;s nobody&amp;#39;s business too, which makes it obvious if I think a guy is cute. Sometimes I try my best to ignore them or act like I&amp;#39;m not interested just so I won&amp;#39;t feel so vulnerable. I&amp;#39;m pretty comfortable with how I look, but the anxiety makes it impossible for me to be able to talk to guys.&lt;/p&gt;
&lt;/div&gt;&lt;!-- SC_ON --&gt;","False","askgaybros","t5_2vgfw","","","I want to be able to talk to guys","6","http://www.reddit.com/r/askgaybros/comments/2lv6a2/i_want_to_be_able_to_talk_to_guys/","[]","False"
"1","","","{}","http://www.reddit.com/api/info/","{}","{}","False","","","False","CalebUT","","","","False","1415633416.0","1415633416.0","","self.askgaybros","0","False","0","True","False","2lv5rk","True","","","","","","{}","[]","t3_2lv5rk","26","","False","http://www.reddit.com/r/askgaybros/comments/2lv5rk/i_told_my_grandma_i_am_gay_its_ok_now_she_will/","Unauthenticated reddit sesssion","","False","128","","{}","I just want to say thank you to all you guys once more. I never knew there was so many kind people in the world. I’ve had lots of e-mails offering me help. If humanity had a scale in precious minerals you guys would be gold or unobtainium if this was avatar. If I could give each of you a hug I would, I really can’t put into words how much love I have for you guys. I had an end of the world scenario in my head which sort of blinded me to the obvious answer thank you again. ","&lt;!-- SC_OFF --&gt;&lt;div class=""md""&gt;&lt;p&gt;I just want to say thank you to all you guys once more. I never knew there was so many kind people in the world. I’ve had lots of e-mails offering me help. If humanity had a scale in precious minerals you guys would be gold or unobtainium if this was avatar. If I could give each of you a hug I would, I really can’t put into words how much love I have for you guys. I had an end of the world scenario in my head which sort of blinded me to the obvious answer thank you again. &lt;/p&gt;
&lt;/div&gt;&lt;!-- SC_ON --&gt;","False","askgaybros","t5_2vgfw","","","I told my grandma I am gay, it’s ok now she will speak to my dad","128","http://www.reddit.com/r/askgaybros/comments/2lv5rk/i_told_my_grandma_i_am_gay_its_ok_now_she_will/","[]","False"
"2","","","{}","http://www.reddit.com/api/info/","{}","{}","False","","","False","EwanWhoseArmy","","","","False","1415632989.0","1415632989.0","","self.askgaybros","0","False","0","True","False","2lv50y","True","","","","","","{}","[]","t3_2lv50y","13","","False","http://www.reddit.com/r/askgaybros/comments/2lv50y/should_i_respond_to_one_of_my_old_friends_who/","Unauthenticated reddit sesssion","","False","3","","{}","So this guy sent me an email wanting to get back in touch, but when I came out he was a complete horrible jerk to me, hurt me and stuff and I don't know if I want to respond back to him or not. 

I think I am acting a bit immature but I don't know ","&lt;!-- SC_OFF --&gt;&lt;div class=""md""&gt;&lt;p&gt;So this guy sent me an email wanting to get back in touch, but when I came out he was a complete horrible jerk to me, hurt me and stuff and I don&amp;#39;t know if I want to respond back to him or not. &lt;/p&gt;

&lt;p&gt;I think I am acting a bit immature but I don&amp;#39;t know &lt;/p&gt;
&lt;/div&gt;&lt;!-- SC_ON --&gt;","False","askgaybros","t5_2vgfw","","","Should I respond to one of my old ""friends"" who stopped speaking to me when I came out ?","3","http://www.reddit.com/r/askgaybros/comments/2lv50y/should_i_respond_to_one_of_my_old_friends_who/","[]","False"
"3","","","{}","http://www.reddit.com/api/info/","{}","{}","False","","","False","GloriousSunrise","","","","False","1415632637.0","1415632637.0","","1.bp.blogspot.com","0","False","0","True","False","2lv4ec","False","","","","","","{}","[]","t3_2lv4ec","12","","False","http://www.reddit.com/r/askgaybros/comments/2lv4ec/women_go_on_about_the_1950s_projecting_a_more/","Unauthenticated reddit sesssion","","False","23","","{}","","","False","askgaybros","t5_2vgfw","","","Women go on about the 1950s projecting a more healthy body image. I noticed 1950s MEN dont have six packs","23","http://1.bp.blogspot.com/-CrmCbljMWEE/T1Y6lXPXGaI/AAAAAAAAJ18/zQlqrcDqIUU/s1600/BoLA+Kip+Behar+003.jpg","[]","False"
"4","","","{}","http://www.reddit.com/api/info/","{}","{}","False","","","False","TIDOUBLEGUHER","","","","False","1415632192.0","1415632192.0","","self.askgaybros","0","1415634356.0","0","True","False","2lv3nh","True","","","","","","{}","[]","t3_2lv3nh","101","","False","http://www.reddit.com/r/askgaybros/comments/2lv3nh/straight_guy_here_what_do_you_wish_i_knewdid/","Unauthenticated reddit sesssion","","False","26","","{}","I am, unfortunately, quite ignorant to the gay experience. But I've always had an insatiable curiosity for the unknown. Especially when it comes to people, family, and friends want to be able to understand as best I can.

So, treating me as the ubiquitous straight guy you run into on the day to day. What information do you wish I had or didn't have? What ways of things do you wish I would do or not do?

EDIT: I've got a tonne of questions so if anything I say or ask offends anyone. Please let me know so I can learn.","&lt;!-- SC_OFF --&gt;&lt;div class=""md""&gt;&lt;p&gt;I am, unfortunately, quite ignorant to the gay experience. But I&amp;#39;ve always had an insatiable curiosity for the unknown. Especially when it comes to people, family, and friends want to be able to understand as best I can.&lt;/p&gt;

&lt;p&gt;So, treating me as the ubiquitous straight guy you run into on the day to day. What information do you wish I had or didn&amp;#39;t have? What ways of things do you wish I would do or not do?&lt;/p&gt;

&lt;p&gt;EDIT: I&amp;#39;ve got a tonne of questions so if anything I say or ask offends anyone. Please let me know so I can learn.&lt;/p&gt;
&lt;/div&gt;&lt;!-- SC_ON --&gt;","False","askgaybros","t5_2vgfw","","","Straight guy here. What do you wish I knew/did differently.","26","http://www.reddit.com/r/askgaybros/comments/2lv3nh/straight_guy_here_what_do_you_wish_i_knewdid/","[]","False"
"5","","","{}","http://www.reddit.com/api/info/","{}","{}","False","","","False","teenagediplomat","","","","False","1415629261.0","1415629261.0","","self.askgaybros","0","1415630129.0","0","True","False","2luz2b","True","","","","","","{}","[]","t3_2luz2b","26","","False","http://www.reddit.com/r/askgaybros/comments/2luz2b/what_is_the_most_cringeworthy_gay_character_on_tv/","Unauthenticated reddit sesssion","","False","3","","{}","This spawned from me watching CBS's new sitcom, ""The McCarthy's"" last night. The show revolves around a tough Boston family who's all about sports and bad attitudes! ...but wait! they have a gaaay son? what a world.","&lt;!-- SC_OFF --&gt;&lt;div class=""md""&gt;&lt;p&gt;This spawned from me watching CBS&amp;#39;s new sitcom, &amp;quot;The McCarthy&amp;#39;s&amp;quot; last night. The show revolves around a tough Boston family who&amp;#39;s all about sports and bad attitudes! ...but wait! they have a gaaay son? what a world.&lt;/p&gt;
&lt;/div&gt;&lt;!-- SC_ON --&gt;","False","askgaybros","t5_2vgfw","","","What is the most cringeworthy gay character on TV?","3","http://www.reddit.com/r/askgaybros/comments/2luz2b/what_is_the_most_cringeworthy_gay_character_on_tv/","[]","False"
"6","","","{}","http://www.reddit.com/api/info/","{}","{}","False","","","False","lalalalala12453525","","","","False","1415628734.0","1415628734.0","","self.askgaybros","0","1415630435.0","0","True","False","2luy9i","True","","","","","","{}","[]","t3_2luy9i","6","","False","http://www.reddit.com/r/askgaybros/comments/2luy9i/would_you_dislike_someone_if_they_acted_like_this/","Unauthenticated reddit sesssion","","False","2","","{}","I'm asking about this person and what people who read this would think of this person. I'm just very curious what other people think because I think I'm judgemental. 

There's this person who's in my school and on twitter his bio is "" Age || Bisexual || iamfuckingfabs"".... He's constantly saying ""my ass hurts"" or really inappropriate stuff. He's like a stereotype. I said hi to him once and he told me to go away. And for some reason, he has a lot of friends even though he is a horrible person. They are mostly girls, but I really don't understand. I haven't come out as gay yet, but I'm worried when I do, people will expect me to act like a stereotype. I'm not very effeminate, but rather shy. And for some reason, I kinda resent the person I am talking about because while he acts like a terrible person, he is popular and actually has friends and I'm the complete opposite? ","&lt;!-- SC_OFF --&gt;&lt;div class=""md""&gt;&lt;p&gt;I&amp;#39;m asking about this person and what people who read this would think of this person. I&amp;#39;m just very curious what other people think because I think I&amp;#39;m judgemental. &lt;/p&gt;

&lt;p&gt;There&amp;#39;s this person who&amp;#39;s in my school and on twitter his bio is &amp;quot; Age || Bisexual || iamfuckingfabs&amp;quot;.... He&amp;#39;s constantly saying &amp;quot;my ass hurts&amp;quot; or really inappropriate stuff. He&amp;#39;s like a stereotype. I said hi to him once and he told me to go away. And for some reason, he has a lot of friends even though he is a horrible person. They are mostly girls, but I really don&amp;#39;t understand. I haven&amp;#39;t come out as gay yet, but I&amp;#39;m worried when I do, people will expect me to act like a stereotype. I&amp;#39;m not very effeminate, but rather shy. And for some reason, I kinda resent the person I am talking about because while he acts like a terrible person, he is popular and actually has friends and I&amp;#39;m the complete opposite? &lt;/p&gt;
&lt;/div&gt;&lt;!-- SC_ON --&gt;","False","askgaybros","t5_2vgfw","","","Would you dislike someone if they acted like this or am I being judgemental?","2","http://www.reddit.com/r/askgaybros/comments/2luy9i/would_you_dislike_someone_if_they_acted_like_this/","[]","False"
"7","","","{}","http://www.reddit.com/api/info/","{}","{}","False","","","False","Laika_Come_Home","","","","False","1415627962.0","1415627962.0","","self.askgaybros","0","False","0","True","False","2lux69","True","","","","","","{}","[]","t3_2lux69","5","","False","http://www.reddit.com/r/askgaybros/comments/2lux69/guys_who_had_a_lot_to_lose_by_coming_out_what/","Unauthenticated reddit sesssion","","False","2","","{}","","","False","askgaybros","t5_2vgfw","","","Guys who had a lot to lose by coming out, what convinced you to finally do it? And, would you say it was a good idea at the time?","2","http://www.reddit.com/r/askgaybros/comments/2lux69/guys_who_had_a_lot_to_lose_by_coming_out_what/","[]","False"
"8","","","{}","http://www.reddit.com/api/info/","{}","{}","False","","","False","jwtennant","","","","False","1415626823.0","1415626823.0","","self.askgaybros","0","1415628750.0","0","True","False","2luvop","True","","","","","","{}","[]","t3_2luvop","7","","False","http://www.reddit.com/r/askgaybros/comments/2luvop/never_had_sex/","Unauthenticated reddit sesssion","","False","2","","{}","I've never topped or well, fully bottomed, I've tried a few times but it hurt too much. I haven't felt like topping but I feel like trying? I've always been too nervous/drunk, is there any tips to either help me relax or just how to top in general? 

Thanks in advance, guys.

Edit: I'm 21 for anyone who's wondering.","&lt;!-- SC_OFF --&gt;&lt;div class=""md""&gt;&lt;p&gt;I&amp;#39;ve never topped or well, fully bottomed, I&amp;#39;ve tried a few times but it hurt too much. I haven&amp;#39;t felt like topping but I feel like trying? I&amp;#39;ve always been too nervous/drunk, is there any tips to either help me relax or just how to top in general? &lt;/p&gt;

&lt;p&gt;Thanks in advance, guys.&lt;/p&gt;

&lt;p&gt;Edit: I&amp;#39;m 21 for anyone who&amp;#39;s wondering.&lt;/p&gt;
&lt;/div&gt;&lt;!-- SC_ON --&gt;","False","askgaybros","t5_2vgfw","","","Never had sex.","2","http://www.reddit.com/r/askgaybros/comments/2luvop/never_had_sex/","[]","False"
"9","","","{}","http://www.reddit.com/api/info/","{}","{}","False","","","False","SemirOmar101","","","","False","1415615758.0","1415615758.0","","self.askgaybros","0","False","0","True","False","2luke5","True","","","","","","{}","[]","t3_2luke5","12","","False","http://www.reddit.com/r/askgaybros/comments/2luke5/is_it_safe_to_have_sex_with_strangers/","Unauthenticated reddit sesssion","","False","0","","{}","Hey, I want to know if its safe to have sex with strangers. I don't think its safe though","&lt;!-- SC_OFF --&gt;&lt;div class=""md""&gt;&lt;p&gt;Hey, I want to know if its safe to have sex with strangers. I don&amp;#39;t think its safe though&lt;/p&gt;
&lt;/div&gt;&lt;!-- SC_ON --&gt;","False","askgaybros","t5_2vgfw","","","Is It Safe To Have Sex With Strangers","0","http://www.reddit.com/r/askgaybros/comments/2luke5/is_it_safe_to_have_sex_with_strangers/","[]","False"
"10","","","{}","http://www.reddit.com/api/info/","{}","{}","False","","","False","armadillo55","","","","False","1415612726.0","1415612726.0","","self.askgaybros","0","1415656288.0","0","True","False","2luhkm","True","","","","","","{}","[]","t3_2luhkm","9","","False","http://www.reddit.com/r/askgaybros/comments/2luhkm/yesterday_i_got_high_for_the_first_time_in_my/","Unauthenticated reddit sesssion","","False","1","","{}","We had all smoked a little bit, but I was the only one that was noticeably high. At some point a friend played some porn and we all started watching. When it came to a scene where the guy was penetrating the girl, I apparently started to cringe and made weird faces. My friends made a couple jokes about me imagining I was taking it in myself and I'm not sure if I passed out from embarrassment or a panic attack but I pretty much just went pale and passed out for a good 30 minutes. I've always had social anxiety when I get put in the spotlight and am really insecure when it comes to the gay topic for some reason. I know I'm straight but other people thinking I'm gay really makes me paranoid. I'm not homophobic either. What excuse can I give my friends for what happened? I can't get it out of my mind and it's really getting to me.

edit: thanks everyone, this really helped a lot, good to know I am overreacting :)
","&lt;!-- SC_OFF --&gt;&lt;div class=""md""&gt;&lt;p&gt;We had all smoked a little bit, but I was the only one that was noticeably high. At some point a friend played some porn and we all started watching. When it came to a scene where the guy was penetrating the girl, I apparently started to cringe and made weird faces. My friends made a couple jokes about me imagining I was taking it in myself and I&amp;#39;m not sure if I passed out from embarrassment or a panic attack but I pretty much just went pale and passed out for a good 30 minutes. I&amp;#39;ve always had social anxiety when I get put in the spotlight and am really insecure when it comes to the gay topic for some reason. I know I&amp;#39;m straight but other people thinking I&amp;#39;m gay really makes me paranoid. I&amp;#39;m not homophobic either. What excuse can I give my friends for what happened? I can&amp;#39;t get it out of my mind and it&amp;#39;s really getting to me.&lt;/p&gt;

&lt;p&gt;edit: thanks everyone, this really helped a lot, good to know I am overreacting :)&lt;/p&gt;
&lt;/div&gt;&lt;!-- SC_ON --&gt;","False","askgaybros","t5_2vgfw","","","Yesterday I got high for the first time in my life. Things got awkward, I passed out, now my friends think I'm gay. What should I do?","1","http://www.reddit.com/r/askgaybros/comments/2luhkm/yesterday_i_got_high_for_the_first_time_in_my/","[]","False"
"11","","","{}","http://www.reddit.com/api/info/","{}","{}","False","","","False","VirginityCalculator","","","","False","1415609672.0","1415609672.0","","self.askgaybros","0","1415609897.0","0","True","False","2lueu3","True","","","","","","{}","[]","t3_2lueu3","12","","False","http://www.reddit.com/r/askgaybros/comments/2lueu3/did_i_lose_my_best_friend/","Unauthenticated reddit sesssion","","False","8","","{}","So my straight best friend fell in love with me but i kinda just didnt pay attention to him because you guys always say that never to act on a straight guy advances i just ignored it and always acted like i wasnt paying attention when he would say things like we would make a cute couple, You are cute, etc. Now the problem is that he stopped talking to me and being my best friend and i'm so lost. I miss him so much but i don't know if i could ever return the feelings he has right now. 

1. I dont think hes gay per se hes just in love with me because we have good synergy
2. I see him as a brother. Thinking of him sexualy weirds me out and its not like hes not attractive. Most gay guys would swoon over him but after 8 years of friendship i seriously see him as a brother more than anything.

How could i go and fix all of this? I dont want to lose my friends of 8 years after everything was going so well. He means the world to me and i was hoping our friendship would last the test of time but then this happen. It also breaks my heart to know that hes sad, in pain because of me. Thats the last thing i want to see him in. What would you bros recommend i should do. Do i have any options? ","&lt;!-- SC_OFF --&gt;&lt;div class=""md""&gt;&lt;p&gt;So my straight best friend fell in love with me but i kinda just didnt pay attention to him because you guys always say that never to act on a straight guy advances i just ignored it and always acted like i wasnt paying attention when he would say things like we would make a cute couple, You are cute, etc. Now the problem is that he stopped talking to me and being my best friend and i&amp;#39;m so lost. I miss him so much but i don&amp;#39;t know if i could ever return the feelings he has right now. &lt;/p&gt;

&lt;ol&gt;
&lt;li&gt;I dont think hes gay per se hes just in love with me because we have good synergy&lt;/li&gt;
&lt;li&gt;I see him as a brother. Thinking of him sexualy weirds me out and its not like hes not attractive. Most gay guys would swoon over him but after 8 years of friendship i seriously see him as a brother more than anything.&lt;/li&gt;
&lt;/ol&gt;

&lt;p&gt;How could i go and fix all of this? I dont want to lose my friends of 8 years after everything was going so well. He means the world to me and i was hoping our friendship would last the test of time but then this happen. It also breaks my heart to know that hes sad, in pain because of me. Thats the last thing i want to see him in. What would you bros recommend i should do. Do i have any options? &lt;/p&gt;
&lt;/div&gt;&lt;!-- SC_ON --&gt;","False","askgaybros","t5_2vgfw","","","Did i lose my best friend? : (","8","http://www.reddit.com/r/askgaybros/comments/2lueu3/did_i_lose_my_best_friend/","[]","False"
