"","_comment_sort","_comments","_comments_by_id","_info_url","_orphaned","_params","_replaced_more","_underscore_names","approved_by","archived","author","author_flair_css_class","author_flair_text","banned_by","clicked","created","created_utc","distinguished","domain","downs","edited","gilded","has_fetched","hidden","id","is_self","json_dict","likes","link_flair_css_class","link_flair_text","media","media_embed","mod_reports","name","num_comments","num_reports","over_18","permalink","reddit_session","report_reasons","saved","score","secure_media","secure_media_embed","selftext","selftext_html","stickied","subreddit","subreddit_id","suggested_sort","thumbnail","title","ups","url","user_reports","visited"
"6","","","{}","http://www.reddit.com/api/info/","{}","{}","False","","","True","ef_few2","","","","False","1402795737.0","1402792137.0","","self.askgaybros","0","False","0","True","False","28629v","True","","","","","","{}","[]","t3_28629v","3","","False","http://www.reddit.com/r/askgaybros/comments/28629v/spy_videos_understall_public_gloryhole_videos/","Unauthenticated reddit sesssion","","False","0","","{}","Do you guys know of any websites that offer spy videos, understall, or public gloryhole videos?  I'm not talking about the staged ones, but amateur in nature.   I get so turned on by them.  I can't figure out how to get decent results from a web search.      ","&lt;!-- SC_OFF --&gt;&lt;div class=""md""&gt;&lt;p&gt;Do you guys know of any websites that offer spy videos, understall, or public gloryhole videos?  I&amp;#39;m not talking about the staged ones, but amateur in nature.   I get so turned on by them.  I can&amp;#39;t figure out how to get decent results from a web search.      &lt;/p&gt;
&lt;/div&gt;&lt;!-- SC_ON --&gt;","False","askgaybros","t5_2vgfw","","","Spy videos, understall, public gloryhole videos?","0","http://www.reddit.com/r/askgaybros/comments/28629v/spy_videos_understall_public_gloryhole_videos/","[]","False"
"7","","","{}","http://www.reddit.com/api/info/","{}","{}","False","","","True","PhillyDude302","","","","False","1402778591.0","1402774991.0","","self.askgaybros","0","False","0","True","False","285gl6","True","","","","","","{}","[]","t3_285gl6","18","","False","http://www.reddit.com/r/askgaybros/comments/285gl6/married_and_coming_out/","Unauthenticated reddit sesssion","","False","18","","{}","Looking for advice from dudes that have been in the same situation as me.  I'm in my early 30's, no kids, and been married for four years, but realizing that I'm gay.  I met up with a dude and hooked up to confirm that it wasn't just in my head - it isn't, I like dudes and can't wait to hook up again.  I know I need to come clean and tell my wife, but obviously it isn't the easiest conversation.  

Any good advice from guys who have already done this?","&lt;!-- SC_OFF --&gt;&lt;div class=""md""&gt;&lt;p&gt;Looking for advice from dudes that have been in the same situation as me.  I&amp;#39;m in my early 30&amp;#39;s, no kids, and been married for four years, but realizing that I&amp;#39;m gay.  I met up with a dude and hooked up to confirm that it wasn&amp;#39;t just in my head - it isn&amp;#39;t, I like dudes and can&amp;#39;t wait to hook up again.  I know I need to come clean and tell my wife, but obviously it isn&amp;#39;t the easiest conversation.  &lt;/p&gt;

&lt;p&gt;Any good advice from guys who have already done this?&lt;/p&gt;
&lt;/div&gt;&lt;!-- SC_ON --&gt;","False","askgaybros","t5_2vgfw","","","Married and Coming Out","18","http://www.reddit.com/r/askgaybros/comments/285gl6/married_and_coming_out/","[]","False"
"8","","","{}","http://www.reddit.com/api/info/","{}","{}","False","","","True","kitler","","","","False","1402768377.0","1402764777.0","","self.askgaybros","0","False","0","True","False","2852ox","True","","","","","","{}","[]","t3_2852ox","4","","False","http://www.reddit.com/r/askgaybros/comments/2852ox/finding_gay_interest_groups/","Unauthenticated reddit sesssion","","False","1","","{}","Is there a place to find such groups?","&lt;!-- SC_OFF --&gt;&lt;div class=""md""&gt;&lt;p&gt;Is there a place to find such groups?&lt;/p&gt;
&lt;/div&gt;&lt;!-- SC_ON --&gt;","False","askgaybros","t5_2vgfw","","","Finding gay interest groups?","1","http://www.reddit.com/r/askgaybros/comments/2852ox/finding_gay_interest_groups/","[]","False"
"9","","","{}","http://www.reddit.com/api/info/","{}","{}","False","","","True","firsttimethrowingawa","","","","False","1402768370.0","1402764770.0","","self.askgaybros","0","False","0","True","False","2852ok","True","","","","","","{}","[]","t3_2852ok","4","","True","http://www.reddit.com/r/askgaybros/comments/2852ok/first_hook_up_exerience_with_a_few/","Unauthenticated reddit sesssion","","False","4","","{}","So a little back story. Away with my friends all week at the beach, everyones hooking up except me (because im gay and they are not) and so I was on grindr a lot during the week looking for guys or whatever. So I was talking to this one guy over the week and it didnt work out and then I got a message from another guy seeing what was up. It turned out he was our neighbor, like right next door and I really wanted to do something. So within like 15 minutes of talking I go next door and have some coffee with him. I'm really nervous at this point because I've never hooked up with someone like at all before. Another important thing is that I'm 18 and he was around 40.....which honestly I dont mind at all because he was hot and safe and open. So we go upstairs and starting kissing and everything, and then were naked and I'm sucking his dick (it was amazing) but because I was so nervous and new to that type of thing I had a hard time actually getting hard, but he sucked me off despite me being not completely hard. He finished on my ass and I came in his mouth, and then I left. 

So questions: When you first hooked up with someone were you nervous and shy about getting hard?

Also is there any risk if he just came on my ass, and not in it? IK that may sound dumb but I'm new to this kind of stuff.

And finally is that age difference weird? It really didnt bother me at all especially since he was attractive.
","&lt;!-- SC_OFF --&gt;&lt;div class=""md""&gt;&lt;p&gt;So a little back story. Away with my friends all week at the beach, everyones hooking up except me (because im gay and they are not) and so I was on grindr a lot during the week looking for guys or whatever. So I was talking to this one guy over the week and it didnt work out and then I got a message from another guy seeing what was up. It turned out he was our neighbor, like right next door and I really wanted to do something. So within like 15 minutes of talking I go next door and have some coffee with him. I&amp;#39;m really nervous at this point because I&amp;#39;ve never hooked up with someone like at all before. Another important thing is that I&amp;#39;m 18 and he was around 40.....which honestly I dont mind at all because he was hot and safe and open. So we go upstairs and starting kissing and everything, and then were naked and I&amp;#39;m sucking his dick (it was amazing) but because I was so nervous and new to that type of thing I had a hard time actually getting hard, but he sucked me off despite me being not completely hard. He finished on my ass and I came in his mouth, and then I left. &lt;/p&gt;

&lt;p&gt;So questions: When you first hooked up with someone were you nervous and shy about getting hard?&lt;/p&gt;

&lt;p&gt;Also is there any risk if he just came on my ass, and not in it? IK that may sound dumb but I&amp;#39;m new to this kind of stuff.&lt;/p&gt;

&lt;p&gt;And finally is that age difference weird? It really didnt bother me at all especially since he was attractive.&lt;/p&gt;
&lt;/div&gt;&lt;!-- SC_ON --&gt;","False","askgaybros","t5_2vgfw","","","First hook up exerience with a few questions....(definitely nsfw)","4","http://www.reddit.com/r/askgaybros/comments/2852ok/first_hook_up_exerience_with_a_few/","[]","False"
"10","","","{}","http://www.reddit.com/api/info/","{}","{}","False","","","True","myohmytimeflies","","","","False","1402765608.0","1402762008.0","","self.askgaybros","0","False","0","True","False","284z54","True","","","","","","{}","[]","t3_284z54","19","","False","http://www.reddit.com/r/askgaybros/comments/284z54/i_hate_how_young_i_look/","Unauthenticated reddit sesssion","","False","2","","{}","I understand that everyone will have their own dose of body dysmorphia.

I am 21, I look young and I hate it. I have always found people in their 30s-40s more attractive. Every time I look into the mirror I feel like a little boy and I don't find it attractive at all.

I hated how young I look last time, so some friends told me I should probably hit the gym and fill in some mass so that I would look older. So I did that. And yeah, now I am in good shape. But there is no gym for the face; I still look disgustingly young.

A good comparison would be Justin Bieber. He is 20, also relatively in shape, but his face looks just like a child.

I have been rejected in gay bars, apps and OKCupid just because I look young, and it's a big blow on my self confidence. They would usually go ""you have a hot body, but you look like you just finished high school"". And those who are attracted to me would be the weird creeps who are exclusively into young boys.

I know this ""I can't wait to be old"" mentality is childish and stupid but sometimes I can't help but think that maybe if I look 5 years older I'll be more attractive that what I am now.","&lt;!-- SC_OFF --&gt;&lt;div class=""md""&gt;&lt;p&gt;I understand that everyone will have their own dose of body dysmorphia.&lt;/p&gt;

&lt;p&gt;I am 21, I look young and I hate it. I have always found people in their 30s-40s more attractive. Every time I look into the mirror I feel like a little boy and I don&amp;#39;t find it attractive at all.&lt;/p&gt;

&lt;p&gt;I hated how young I look last time, so some friends told me I should probably hit the gym and fill in some mass so that I would look older. So I did that. And yeah, now I am in good shape. But there is no gym for the face; I still look disgustingly young.&lt;/p&gt;

&lt;p&gt;A good comparison would be Justin Bieber. He is 20, also relatively in shape, but his face looks just like a child.&lt;/p&gt;

&lt;p&gt;I have been rejected in gay bars, apps and OKCupid just because I look young, and it&amp;#39;s a big blow on my self confidence. They would usually go &amp;quot;you have a hot body, but you look like you just finished high school&amp;quot;. And those who are attracted to me would be the weird creeps who are exclusively into young boys.&lt;/p&gt;

&lt;p&gt;I know this &amp;quot;I can&amp;#39;t wait to be old&amp;quot; mentality is childish and stupid but sometimes I can&amp;#39;t help but think that maybe if I look 5 years older I&amp;#39;ll be more attractive that what I am now.&lt;/p&gt;
&lt;/div&gt;&lt;!-- SC_ON --&gt;","False","askgaybros","t5_2vgfw","","","I hate how young I look","2","http://www.reddit.com/r/askgaybros/comments/284z54/i_hate_how_young_i_look/","[]","False"
