"","_comment_sort","_comments","_comments_by_id","_info_url","_orphaned","_params","_replaced_more","_underscore_names","approved_by","archived","author","author_flair_css_class","author_flair_text","banned_by","clicked","created","created_utc","distinguished","domain","downs","edited","gilded","has_fetched","hidden","id","is_self","json_dict","likes","link_flair_css_class","link_flair_text","media","media_embed","mod_reports","name","num_comments","num_reports","over_18","permalink","reddit_session","report_reasons","saved","score","secure_media","secure_media_embed","selftext","selftext_html","stickied","subreddit","subreddit_id","suggested_sort","thumbnail","title","ups","url","user_reports","visited"
"16","","","{}","http://www.reddit.com/api/info/","{}","{}","False","","","False","TwistInThePlot","","","","False","1428111975.0","1428108375.0","","self.askgaybros","0","False","0","True","False","31dfqq","True","","","","","","{}","[]","t3_31dfqq","14","","False","http://www.reddit.com/r/askgaybros/comments/31dfqq/i_like_a_really_religious_guy_and_he_likes_me_but/","Unauthenticated reddit sesssion","","False","0","","{}","So I started talking with this guy recently and thought it would just be a passing fling. He had never been with a man but knew he had attractions toward them. We hung out and cuddled and it was amazing, I felt a really strong connection to him and him to me. But he can't get over the belief that if he does date me, it would mean that he was actively defying God's will and living in sin. 

I went through a similar dilemma when I first came out and I know how tough it can be on a person. I've been trying to help him and give him my story. I let him borrow the film ""The Bible Tells Me So"" because I think it will help him. I want to lay out to him all the research I did on the subject back when I came out to allow him to change his beliefs but I don't want to keep pushing it and sound desperate. I really like this guy though. He has a heart of gold and we have so much in common. I don't know what to do. Any advice?","&lt;!-- SC_OFF --&gt;&lt;div class=""md""&gt;&lt;p&gt;So I started talking with this guy recently and thought it would just be a passing fling. He had never been with a man but knew he had attractions toward them. We hung out and cuddled and it was amazing, I felt a really strong connection to him and him to me. But he can&amp;#39;t get over the belief that if he does date me, it would mean that he was actively defying God&amp;#39;s will and living in sin. &lt;/p&gt;

&lt;p&gt;I went through a similar dilemma when I first came out and I know how tough it can be on a person. I&amp;#39;ve been trying to help him and give him my story. I let him borrow the film &amp;quot;The Bible Tells Me So&amp;quot; because I think it will help him. I want to lay out to him all the research I did on the subject back when I came out to allow him to change his beliefs but I don&amp;#39;t want to keep pushing it and sound desperate. I really like this guy though. He has a heart of gold and we have so much in common. I don&amp;#39;t know what to do. Any advice?&lt;/p&gt;
&lt;/div&gt;&lt;!-- SC_ON --&gt;","False","askgaybros","t5_2vgfw","","","I like a really religious guy, and he likes me, but he can't reconcile his desire with his beliefs.","0","http://www.reddit.com/r/askgaybros/comments/31dfqq/i_like_a_really_religious_guy_and_he_likes_me_but/","[]","False"
"17","","","{}","http://www.reddit.com/api/info/","{}","{}","False","","","False","Holdinitdownn","","","","False","1428111220.0","1428107620.0","","self.askgaybros","0","False","0","True","False","31deh7","True","","","","","","{}","[]","t3_31deh7","8","","False","http://www.reddit.com/r/askgaybros/comments/31deh7/care_to_give_your_opinion/","Unauthenticated reddit sesssion","","False","0","","{}","So a gay friend whom I was under the impression was attracted to me (Due to the odd/flirty behavior and body language) rejected me when I told him I was starting to like him. His response was ""oh well thanks."" After this he still made an effort to be alone around me. He even asked me ""so did you have anything else to tell me?"" I'm very confused and even have made an effort to distance myself but he will still try to engage me. 









","&lt;!-- SC_OFF --&gt;&lt;div class=""md""&gt;&lt;p&gt;So a gay friend whom I was under the impression was attracted to me (Due to the odd/flirty behavior and body language) rejected me when I told him I was starting to like him. His response was &amp;quot;oh well thanks.&amp;quot; After this he still made an effort to be alone around me. He even asked me &amp;quot;so did you have anything else to tell me?&amp;quot; I&amp;#39;m very confused and even have made an effort to distance myself but he will still try to engage me. &lt;/p&gt;
&lt;/div&gt;&lt;!-- SC_ON --&gt;","False","askgaybros","t5_2vgfw","","","Care to give your opinion?","0","http://www.reddit.com/r/askgaybros/comments/31deh7/care_to_give_your_opinion/","[]","False"
"18","","","{}","http://www.reddit.com/api/info/","{}","{}","False","","","False","Asabragr","","","","False","1428110124.0","1428106524.0","","self.askgaybros","0","False","0","True","False","31dchf","True","","","","","","{}","[]","t3_31dchf","16","","False","http://www.reddit.com/r/askgaybros/comments/31dchf/new_bro_wondering_how_you_got_through_the_rough/","Unauthenticated reddit sesssion","","False","8","","{}","Hey guys! Been following this subreddit for the past 10 or so months, but havent been bothered to create an account of my own, but now its time. Im struggling right now, and have seen how you guys have helped each other out in the past, including myself from reading it all. So this is a New to gaybros/coming out/letting of some steam post. I hope i dont break of the posting rules.

My question to you all are; How did you get through a really rough time in your life? Any advices for younger bro on how to make it through to the bright side?
I need some help to cope right now. Finished high school in june -14, and now i just feel lost and helpless. Been long distance dating (Sweden - UK) an amazing guy for 9 months now which is amazing but since i returned from the UK last time ive just been restless and anxious. Im stuck with a night time job in a field i dont really want, about to move into an apartment that is a quite expensive, in a city where i feel quite alone since almost all my classmates moved after school. Dont have time to work out, or meet the few people i know. All i want is to move over, or to travel/do something fun in my life.

I dont talk to my family anymore, since they're not really happy about me dating a guy, even though they met him before they knew we were dating, and really liked him. I told them a few days after he had left, and i was still visiting them. Nothing i had planned on doing, but i just felt like i couldnt keep it in anymore. I sat down at the table, and was like; ""There is something i have to tell you. Me and X are not just friends, we are actually dating since a few months back."" The reaction wasnt really positive, which i was prepared for but at least Im still welcome home - unless i have my BF with me. They have made it very clear that they are not supporting this in any way, and that they will not give me any money, or lend me any money to help me afford seeing him. Their main worry is that someone in church, or in the village will find out. What will they say, how will we be treated, what will your sisters friend say to her? Mom texts me sporadically, and sometimes tries to call. I try to avoid talking to them as much as possible though. Mom and my sister just cries, dad is trying to tell me how hes not happy about it in a really passively agressive way, and i know talking to them just makes me sad, annoyed, and feeling alone. Missed my sisters 18th birthday, and her getting her drivers licence. I feel shit about it!

I dont know what i want to do with my life, and i feel like im just wasting the years in my life when im meant to be young, happy, and do crazy stuff.

tl;dr New bro here, having a hard time. How did you make it through the rough times in your life?","&lt;!-- SC_OFF --&gt;&lt;div class=""md""&gt;&lt;p&gt;Hey guys! Been following this subreddit for the past 10 or so months, but havent been bothered to create an account of my own, but now its time. Im struggling right now, and have seen how you guys have helped each other out in the past, including myself from reading it all. So this is a New to gaybros/coming out/letting of some steam post. I hope i dont break of the posting rules.&lt;/p&gt;

&lt;p&gt;My question to you all are; How did you get through a really rough time in your life? Any advices for younger bro on how to make it through to the bright side?
I need some help to cope right now. Finished high school in june -14, and now i just feel lost and helpless. Been long distance dating (Sweden - UK) an amazing guy for 9 months now which is amazing but since i returned from the UK last time ive just been restless and anxious. Im stuck with a night time job in a field i dont really want, about to move into an apartment that is a quite expensive, in a city where i feel quite alone since almost all my classmates moved after school. Dont have time to work out, or meet the few people i know. All i want is to move over, or to travel/do something fun in my life.&lt;/p&gt;

&lt;p&gt;I dont talk to my family anymore, since they&amp;#39;re not really happy about me dating a guy, even though they met him before they knew we were dating, and really liked him. I told them a few days after he had left, and i was still visiting them. Nothing i had planned on doing, but i just felt like i couldnt keep it in anymore. I sat down at the table, and was like; &amp;quot;There is something i have to tell you. Me and X are not just friends, we are actually dating since a few months back.&amp;quot; The reaction wasnt really positive, which i was prepared for but at least Im still welcome home - unless i have my BF with me. They have made it very clear that they are not supporting this in any way, and that they will not give me any money, or lend me any money to help me afford seeing him. Their main worry is that someone in church, or in the village will find out. What will they say, how will we be treated, what will your sisters friend say to her? Mom texts me sporadically, and sometimes tries to call. I try to avoid talking to them as much as possible though. Mom and my sister just cries, dad is trying to tell me how hes not happy about it in a really passively agressive way, and i know talking to them just makes me sad, annoyed, and feeling alone. Missed my sisters 18th birthday, and her getting her drivers licence. I feel shit about it!&lt;/p&gt;

&lt;p&gt;I dont know what i want to do with my life, and i feel like im just wasting the years in my life when im meant to be young, happy, and do crazy stuff.&lt;/p&gt;

&lt;p&gt;tl;dr New bro here, having a hard time. How did you make it through the rough times in your life?&lt;/p&gt;
&lt;/div&gt;&lt;!-- SC_ON --&gt;","False","askgaybros","t5_2vgfw","","","New bro wondering how you got through the rough times in your life?","8","http://www.reddit.com/r/askgaybros/comments/31dchf/new_bro_wondering_how_you_got_through_the_rough/","[]","False"
"19","","","{}","http://www.reddit.com/api/info/","{}","{}","False","","","False","toothforatooth","","","","False","1428109225.0","1428105625.0","","self.askgaybros","0","False","0","True","False","31datx","True","","","","","","{}","[]","t3_31datx","5","","False","http://www.reddit.com/r/askgaybros/comments/31datx/slight_fear/","Unauthenticated reddit sesssion","","False","1","","{}","So, I recently came out of the closet. Currently trying to get to know myself etc etc. So I have a few questions that I'd like to ask.

FIRST: I was in a relationship with a woman for about 7 years. I was never able to enjoy oral sex, or handjobs. I always attributed it as a preference, but I would really hope to enjoy it. So my question is. Any bros out there had a similar experience? I hope its the fact that I just didn't get the right type of stimulation since it was a woman. Though I was able to have regular intercourse.

Second: Is this whole top/bottom submissive/dominant thing like super important? In my head I think I'm more attracted to just enjoying a sharing a sexual experience equally. Is that a problem for most guys or is there a sufficient base of people that feel this way. I just don't want to find a hard time with this whole defined roles thing.  

Third: Did everyone have this general insecurity about looks when they came out? Dear god everyone on tinder has super abs or rippling biceps. I feel like they'll meet me and be utterly disappointed lol.","&lt;!-- SC_OFF --&gt;&lt;div class=""md""&gt;&lt;p&gt;So, I recently came out of the closet. Currently trying to get to know myself etc etc. So I have a few questions that I&amp;#39;d like to ask.&lt;/p&gt;

&lt;p&gt;FIRST: I was in a relationship with a woman for about 7 years. I was never able to enjoy oral sex, or handjobs. I always attributed it as a preference, but I would really hope to enjoy it. So my question is. Any bros out there had a similar experience? I hope its the fact that I just didn&amp;#39;t get the right type of stimulation since it was a woman. Though I was able to have regular intercourse.&lt;/p&gt;

&lt;p&gt;Second: Is this whole top/bottom submissive/dominant thing like super important? In my head I think I&amp;#39;m more attracted to just enjoying a sharing a sexual experience equally. Is that a problem for most guys or is there a sufficient base of people that feel this way. I just don&amp;#39;t want to find a hard time with this whole defined roles thing.  &lt;/p&gt;

&lt;p&gt;Third: Did everyone have this general insecurity about looks when they came out? Dear god everyone on tinder has super abs or rippling biceps. I feel like they&amp;#39;ll meet me and be utterly disappointed lol.&lt;/p&gt;
&lt;/div&gt;&lt;!-- SC_ON --&gt;","False","askgaybros","t5_2vgfw","","","Slight fear.","1","http://www.reddit.com/r/askgaybros/comments/31datx/slight_fear/","[]","False"
"20","","","{}","http://www.reddit.com/api/info/","{}","{}","False","","","False","Panderonomio","","","","False","1428108975.0","1428105375.0","","self.askgaybros","0","1428106384.0","0","True","False","31dadi","True","","","","","","{}","[]","t3_31dadi","13","","False","http://www.reddit.com/r/askgaybros/comments/31dadi/is_it_rude_to_that_im_not_into_fems_or_something/","Unauthenticated reddit sesssion","","False","0","","{}","*to indicate","&lt;!-- SC_OFF --&gt;&lt;div class=""md""&gt;&lt;p&gt;*to indicate&lt;/p&gt;
&lt;/div&gt;&lt;!-- SC_ON --&gt;","False","askgaybros","t5_2vgfw","","","Is it rude to that I'm ""not into fems"" or something like that on dating sites/apps?","0","http://www.reddit.com/r/askgaybros/comments/31dadi/is_it_rude_to_that_im_not_into_fems_or_something/","[]","False"
"21","","","{}","http://www.reddit.com/api/info/","{}","{}","False","","","False","adalej","","","","False","1428106239.0","1428102639.0","","self.askgaybros","0","False","0","True","False","31d5co","True","","","","","","{}","[]","t3_31d5co","3","","False","http://www.reddit.com/r/askgaybros/comments/31d5co/help_me_plan_my_unplanned_life/","Unauthenticated reddit sesssion","","False","3","","{}","This might be a bit of a different flavored post for this thread but something tells me you guys will have some quality input. 

So here's the story: In about a month, just like every other college senior out there right now, I'll be graduating with my Bachelor's degree. I'm way behind the 8-ball in terms of the job search and I have perhaps the most unclear idea of what I want from my life post-graduation. 

I know that eventually I want to go to Graduate school so originally I was planning on taking a gap year to figure that out and work. The more that I personally reflect though, I realize that for me the gap year is more of a chance to see if I can find a full-time job that I like enough so that I can either put grad school off for a couple more years until I get on my own two feet or decide that I can make a satisfying living without going to grad school. 

Either way, I know that I want to use this period of my life which is so unplanned and available to get away, get out there, and find myself. I've lived in the center of the Midwest for nearly my entire life and if I'm being honest, my heart yearns to live somewhere where I feel unconstrained. I really hope to use my search for a job as a stepping stone to finding that place. 

So I've got a couple of questions for you guys: First of all, what are your guys' best tips when searching for a full-time, entry level position and secondly, where are some of the most gay-friendly, stimulating places that I should be including in my job search? Seriously, I'm not even sure what tools or sites to start using when looking for a job so even the most basic, baby's-first-step advice is appreciate. :)

Edit: Deleted/Added some words","&lt;!-- SC_OFF --&gt;&lt;div class=""md""&gt;&lt;p&gt;This might be a bit of a different flavored post for this thread but something tells me you guys will have some quality input. &lt;/p&gt;

&lt;p&gt;So here&amp;#39;s the story: In about a month, just like every other college senior out there right now, I&amp;#39;ll be graduating with my Bachelor&amp;#39;s degree. I&amp;#39;m way behind the 8-ball in terms of the job search and I have perhaps the most unclear idea of what I want from my life post-graduation. &lt;/p&gt;

&lt;p&gt;I know that eventually I want to go to Graduate school so originally I was planning on taking a gap year to figure that out and work. The more that I personally reflect though, I realize that for me the gap year is more of a chance to see if I can find a full-time job that I like enough so that I can either put grad school off for a couple more years until I get on my own two feet or decide that I can make a satisfying living without going to grad school. &lt;/p&gt;

&lt;p&gt;Either way, I know that I want to use this period of my life which is so unplanned and available to get away, get out there, and find myself. I&amp;#39;ve lived in the center of the Midwest for nearly my entire life and if I&amp;#39;m being honest, my heart yearns to live somewhere where I feel unconstrained. I really hope to use my search for a job as a stepping stone to finding that place. &lt;/p&gt;

&lt;p&gt;So I&amp;#39;ve got a couple of questions for you guys: First of all, what are your guys&amp;#39; best tips when searching for a full-time, entry level position and secondly, where are some of the most gay-friendly, stimulating places that I should be including in my job search? Seriously, I&amp;#39;m not even sure what tools or sites to start using when looking for a job so even the most basic, baby&amp;#39;s-first-step advice is appreciate. :)&lt;/p&gt;

&lt;p&gt;Edit: Deleted/Added some words&lt;/p&gt;
&lt;/div&gt;&lt;!-- SC_ON --&gt;","False","askgaybros","t5_2vgfw","","","Help me plan my unplanned life","3","http://www.reddit.com/r/askgaybros/comments/31d5co/help_me_plan_my_unplanned_life/","[]","False"
"22","","","{}","http://www.reddit.com/api/info/","{}","{}","False","","","False","ihaveafriendlikethat","","","","False","1428105919.0","1428102319.0","","self.askgaybros","0","False","0","True","False","31d4pa","True","","","","","","{}","[]","t3_31d4pa","5","","False","http://www.reddit.com/r/askgaybros/comments/31d4pa/hair_removal_from_the_shaft_possible/","Unauthenticated reddit sesssion","","False","2","","{}","From what I understand, hair on the shaft of the penis is a common ""side-effect"" of circumcision. Still, the idea of my boyfriend inadvertently flossing during oral sex is enough to distract me from the mission. 

Is there anything that can be done? Trimming doesn't help much, it just changes flossing to brushing. And I don't want to do anything that's going to result in ingrown hairs or other speed bumps.","&lt;!-- SC_OFF --&gt;&lt;div class=""md""&gt;&lt;p&gt;From what I understand, hair on the shaft of the penis is a common &amp;quot;side-effect&amp;quot; of circumcision. Still, the idea of my boyfriend inadvertently flossing during oral sex is enough to distract me from the mission. &lt;/p&gt;

&lt;p&gt;Is there anything that can be done? Trimming doesn&amp;#39;t help much, it just changes flossing to brushing. And I don&amp;#39;t want to do anything that&amp;#39;s going to result in ingrown hairs or other speed bumps.&lt;/p&gt;
&lt;/div&gt;&lt;!-- SC_ON --&gt;","False","askgaybros","t5_2vgfw","","","Hair removal from the shaft - Possible?","2","http://www.reddit.com/r/askgaybros/comments/31d4pa/hair_removal_from_the_shaft_possible/","[]","False"
