"","_comment_sort","_comments","_comments_by_id","_info_url","_orphaned","_params","_replaced_more","_underscore_names","approved_by","archived","author","author_flair_css_class","author_flair_text","banned_by","clicked","created","created_utc","distinguished","domain","downs","edited","gilded","has_fetched","hidden","id","is_self","json_dict","likes","link_flair_css_class","link_flair_text","media","media_embed","mod_reports","name","num_comments","num_reports","over_18","permalink","reddit_session","report_reasons","saved","score","secure_media","secure_media_embed","selftext","selftext_html","stickied","subreddit","subreddit_id","suggested_sort","thumbnail","title","ups","url","user_reports","visited"
"0","","","{}","http://www.reddit.com/api/info/","{}","{}","False","","","False","username11342","","","","False","1425225223.0","1425225223.0","","self.askgaybros","0","False","0","True","False","2xkgse","True","","","","","","{}","[]","t3_2xkgse","6","","False","http://www.reddit.com/r/askgaybros/comments/2xkgse/i_can_only_get_off_thinking_about_my_ex_cheating/","Unauthenticated reddit sesssion","","False","4","","{}","This is pretty embarrassing. I met my first boyfriend when I was 19 and four years into the relationship I broke it off because I caught him trying to hook up with other guys 4 or 5 different times (reading his texts, emails). Eventually I started to get turned on by reading the correspondences because he would talk really dirty to these guys in a way that he never did to me, and also send x pics. He was actually blowing a roommate that we had when I was away.

Its been several years since and I still have to think about him with other guys, or think about the way he talked dirty to them, to get off. He always denied everything and even to this day he says that he still loves me, but I think he's just a huge player.

I still talk to him sometimes but I'm thinking of breaking off all contact immediately.","&lt;!-- SC_OFF --&gt;&lt;div class=""md""&gt;&lt;p&gt;This is pretty embarrassing. I met my first boyfriend when I was 19 and four years into the relationship I broke it off because I caught him trying to hook up with other guys 4 or 5 different times (reading his texts, emails). Eventually I started to get turned on by reading the correspondences because he would talk really dirty to these guys in a way that he never did to me, and also send x pics. He was actually blowing a roommate that we had when I was away.&lt;/p&gt;

&lt;p&gt;Its been several years since and I still have to think about him with other guys, or think about the way he talked dirty to them, to get off. He always denied everything and even to this day he says that he still loves me, but I think he&amp;#39;s just a huge player.&lt;/p&gt;

&lt;p&gt;I still talk to him sometimes but I&amp;#39;m thinking of breaking off all contact immediately.&lt;/p&gt;
&lt;/div&gt;&lt;!-- SC_ON --&gt;","False","askgaybros","t5_2vgfw","","","I can only get off thinking about my ex cheating on me.","4","http://www.reddit.com/r/askgaybros/comments/2xkgse/i_can_only_get_off_thinking_about_my_ex_cheating/","[]","False"
"1","","","{}","http://www.reddit.com/api/info/","{}","{}","False","","","False","LoveWithInUs","","","","False","1425221158.0","1425221158.0","","self.askgaybros","0","False","0","True","False","2xkaem","True","","","","","","{}","[]","t3_2xkaem","17","","False","http://www.reddit.com/r/askgaybros/comments/2xkaem/lost_and_could_use_some_help/","Unauthenticated reddit sesssion","","False","5","","{}","No matter how many times I've thought this through, it still seems crazy. But hey life is crazy no? Or perhaps what you make it. Anyways first time poster here, and I have been presented an opportunity like no other. 

A bit of back story, I met my currently first boyfriend about a month and a half ago, and have been dating for a month. That being said I am completely head over heels for this man. He's everything I've wanted and have been looking for..

Now here's where the opportunity comes into play, my bf races formula three over in Europe. Unfortunately he will be staying there for the next 6 months starting in May. He wants to bring me with him. Now this sounds like a fantasy, I've never been outside of the country and now my Prince Charming is offering to take me. My first answer was clearly yes, but the more I think about it, the more I can tell my parents are going to call me crazy.

I am currently a college sophomore, and I'm planning on taking online classes If I were to move for the 6 months. However, I have not a clue how to bring this up to my parents. They live a few hours away from my college town, and I've got a bad feeling they won't even indulge in the idea of me leaving the country for 6 months. So I guess my question is, how do I bring such a crazy idea up to my parents?","&lt;!-- SC_OFF --&gt;&lt;div class=""md""&gt;&lt;p&gt;No matter how many times I&amp;#39;ve thought this through, it still seems crazy. But hey life is crazy no? Or perhaps what you make it. Anyways first time poster here, and I have been presented an opportunity like no other. &lt;/p&gt;

&lt;p&gt;A bit of back story, I met my currently first boyfriend about a month and a half ago, and have been dating for a month. That being said I am completely head over heels for this man. He&amp;#39;s everything I&amp;#39;ve wanted and have been looking for..&lt;/p&gt;

&lt;p&gt;Now here&amp;#39;s where the opportunity comes into play, my bf races formula three over in Europe. Unfortunately he will be staying there for the next 6 months starting in May. He wants to bring me with him. Now this sounds like a fantasy, I&amp;#39;ve never been outside of the country and now my Prince Charming is offering to take me. My first answer was clearly yes, but the more I think about it, the more I can tell my parents are going to call me crazy.&lt;/p&gt;

&lt;p&gt;I am currently a college sophomore, and I&amp;#39;m planning on taking online classes If I were to move for the 6 months. However, I have not a clue how to bring this up to my parents. They live a few hours away from my college town, and I&amp;#39;ve got a bad feeling they won&amp;#39;t even indulge in the idea of me leaving the country for 6 months. So I guess my question is, how do I bring such a crazy idea up to my parents?&lt;/p&gt;
&lt;/div&gt;&lt;!-- SC_ON --&gt;","False","askgaybros","t5_2vgfw","","","lost and could use some help","5","http://www.reddit.com/r/askgaybros/comments/2xkaem/lost_and_could_use_some_help/","[]","False"
"2","","","{}","http://www.reddit.com/api/info/","{}","{}","False","","","False","tlk13","","","","False","1425218677.0","1425218677.0","","self.askgaybros","0","False","0","True","False","2xk74q","True","","","","","","{}","[]","t3_2xk74q","10","","False","http://www.reddit.com/r/askgaybros/comments/2xk74q/seeing_long_distance_bf_first_time_in_long_time/","Unauthenticated reddit sesssion","","False","9","","{}","I know its not mono beasuse I've had that before.but it's super painful to swallow and I'm dealing with bucketloads of phlegm. What would help slow down the irritation. Mucinex? Plz help!! :(","&lt;!-- SC_OFF --&gt;&lt;div class=""md""&gt;&lt;p&gt;I know its not mono beasuse I&amp;#39;ve had that before.but it&amp;#39;s super painful to swallow and I&amp;#39;m dealing with bucketloads of phlegm. What would help slow down the irritation. Mucinex? Plz help!! :(&lt;/p&gt;
&lt;/div&gt;&lt;!-- SC_ON --&gt;","False","askgaybros","t5_2vgfw","","","Seeing long distance bf first time in long time in few days.. I have sore Af throat. Help.","9","http://www.reddit.com/r/askgaybros/comments/2xk74q/seeing_long_distance_bf_first_time_in_long_time/","[]","False"
"3","","","{}","http://www.reddit.com/api/info/","{}","{}","False","","","False","Takkenn","","","","False","1425216445.0","1425216445.0","","self.askgaybros","0","False","0","True","False","2xk4g9","True","","","","","","{}","[]","t3_2xk4g9","6","","False","http://www.reddit.com/r/askgaybros/comments/2xk4g9/need_advice_closet_guy_and_relationships/","Unauthenticated reddit sesssion","","False","4","","{}","I've been seeing this guy for the last 3 weeks and I'm falling pretty hard. We spend about 3 nights of the week together, always get really drunk and we end out doing sexual stuff. We go to the same uni and have a heap of mutual friends that we hang out in so I see him a lot. I'm only the second guy he's been with (sexually) and he is really new to the whole thing. He is massively in the closet and doesn't want anyone to know.
Last night (whilst drunk) he kept calling me and telling please come and stay over, I think this is freaking him out because today he messaged me saying we shouldn't see each other anymore, because we've started doing sexual things when we aren't drunk and it's becoming to 'coupley'
What is your experience with this and what do you recon I should do? ","&lt;!-- SC_OFF --&gt;&lt;div class=""md""&gt;&lt;p&gt;I&amp;#39;ve been seeing this guy for the last 3 weeks and I&amp;#39;m falling pretty hard. We spend about 3 nights of the week together, always get really drunk and we end out doing sexual stuff. We go to the same uni and have a heap of mutual friends that we hang out in so I see him a lot. I&amp;#39;m only the second guy he&amp;#39;s been with (sexually) and he is really new to the whole thing. He is massively in the closet and doesn&amp;#39;t want anyone to know.
Last night (whilst drunk) he kept calling me and telling please come and stay over, I think this is freaking him out because today he messaged me saying we shouldn&amp;#39;t see each other anymore, because we&amp;#39;ve started doing sexual things when we aren&amp;#39;t drunk and it&amp;#39;s becoming to &amp;#39;coupley&amp;#39;
What is your experience with this and what do you recon I should do? &lt;/p&gt;
&lt;/div&gt;&lt;!-- SC_ON --&gt;","False","askgaybros","t5_2vgfw","","","Need advice, closet guy and relationships","4","http://www.reddit.com/r/askgaybros/comments/2xk4g9/need_advice_closet_guy_and_relationships/","[]","False"
"4","","","{}","http://www.reddit.com/api/info/","{}","{}","False","","","False","throwaway___crasy11","","","","False","1425208398.0","1425208398.0","","self.askgaybros","0","False","0","True","False","2xjwyl","True","","","","","","{}","[]","t3_2xjwyl","21","","False","http://www.reddit.com/r/askgaybros/comments/2xjwyl/i_had_my_first_experience_two_weeks_ago_and_i/","Unauthenticated reddit sesssion","","False","1","","{}","So I put an ad up on craigslist looking to 'experiment for the first time' with another guy with a list of conditions. He had to be uncut, able to host, and is willing to be patient with a first timer.

I exchanged emails with a dude who wasn't far from me and I went over. At first his dick didn't seem so bad but then it grew.... and grew... and grew..... until it was MASSIVE.  I was trying to talk to him while this happened ('whoa you're pretty big eh?!) but he didn't answer.

...then he asked if I wanted to 69, but I said no at first... then relented. I'm such an idiot. 

I shouldn't have done half the things that happened but I can't forget it.","&lt;!-- SC_OFF --&gt;&lt;div class=""md""&gt;&lt;p&gt;So I put an ad up on craigslist looking to &amp;#39;experiment for the first time&amp;#39; with another guy with a list of conditions. He had to be uncut, able to host, and is willing to be patient with a first timer.&lt;/p&gt;

&lt;p&gt;I exchanged emails with a dude who wasn&amp;#39;t far from me and I went over. At first his dick didn&amp;#39;t seem so bad but then it grew.... and grew... and grew..... until it was MASSIVE.  I was trying to talk to him while this happened (&amp;#39;whoa you&amp;#39;re pretty big eh?!) but he didn&amp;#39;t answer.&lt;/p&gt;

&lt;p&gt;...then he asked if I wanted to 69, but I said no at first... then relented. I&amp;#39;m such an idiot. &lt;/p&gt;

&lt;p&gt;I shouldn&amp;#39;t have done half the things that happened but I can&amp;#39;t forget it.&lt;/p&gt;
&lt;/div&gt;&lt;!-- SC_ON --&gt;","False","askgaybros","t5_2vgfw","","","I had my first 'experience' two weeks ago and I need to talk about it.... it changed me","1","http://www.reddit.com/r/askgaybros/comments/2xjwyl/i_had_my_first_experience_two_weeks_ago_and_i/","[]","False"
"5","","","{}","http://www.reddit.com/api/info/","{}","{}","False","","","False","lonelyindianguy","","","","False","1425195159.0","1425195159.0","","self.askgaybros","0","1425196528.0","0","True","False","2xjl49","True","","","","","","{}","[]","t3_2xjl49","16","","False","http://www.reddit.com/r/askgaybros/comments/2xjl49/got_ignored_by_my_crush_and_our_friends/","Unauthenticated reddit sesssion","","False","0","","{}","I'm a twenty-four year old gay Indian guy living in the UK. I've never had a boyfriend. Until one month ago I was even a virgin.

I don't have many friends either, but I do have some. A few days ago I was at an event with my crush and some friends. I really didn't have a nice time. Somehow everyone talked to each other but no one paid me any attention. So I stood by myself, hoping that they would notice but they didn't. I felt really excluded. 

What hurt especially was that my crush was happily talking to our middle-aged female friends. They all seemed happy. My crush doesn't even know I'm gay, though I've told my female friends. I'm too scared to tell him. I'm not sure about what his sexual orientation is. He's my age, so I'm obviously not worried about him talking to our married, middle-aged female friends. Still, I felt quite rejected by him, and also socially rejected in general.

They could clearly see that I stood there on my own. Therefore they should have made an effort to talk to me. I think their behaviour was just plain rude.

Does anyone else ever feel ignored or excluded in social situations? How do you handle this? Any tips would be really appreciated.","&lt;!-- SC_OFF --&gt;&lt;div class=""md""&gt;&lt;p&gt;I&amp;#39;m a twenty-four year old gay Indian guy living in the UK. I&amp;#39;ve never had a boyfriend. Until one month ago I was even a virgin.&lt;/p&gt;

&lt;p&gt;I don&amp;#39;t have many friends either, but I do have some. A few days ago I was at an event with my crush and some friends. I really didn&amp;#39;t have a nice time. Somehow everyone talked to each other but no one paid me any attention. So I stood by myself, hoping that they would notice but they didn&amp;#39;t. I felt really excluded. &lt;/p&gt;

&lt;p&gt;What hurt especially was that my crush was happily talking to our middle-aged female friends. They all seemed happy. My crush doesn&amp;#39;t even know I&amp;#39;m gay, though I&amp;#39;ve told my female friends. I&amp;#39;m too scared to tell him. I&amp;#39;m not sure about what his sexual orientation is. He&amp;#39;s my age, so I&amp;#39;m obviously not worried about him talking to our married, middle-aged female friends. Still, I felt quite rejected by him, and also socially rejected in general.&lt;/p&gt;

&lt;p&gt;They could clearly see that I stood there on my own. Therefore they should have made an effort to talk to me. I think their behaviour was just plain rude.&lt;/p&gt;

&lt;p&gt;Does anyone else ever feel ignored or excluded in social situations? How do you handle this? Any tips would be really appreciated.&lt;/p&gt;
&lt;/div&gt;&lt;!-- SC_ON --&gt;","False","askgaybros","t5_2vgfw","","","Got ignored by my crush and our friends","0","http://www.reddit.com/r/askgaybros/comments/2xjl49/got_ignored_by_my_crush_and_our_friends/","[]","False"
"6","","","{}","http://www.reddit.com/api/info/","{}","{}","False","","","False","Agro93","","","","False","1425194023.0","1425194023.0","","self.askgaybros","0","1425281904.0","0","True","False","2xjjwg","True","","","","","","{}","[]","t3_2xjjwg","6","","False","http://www.reddit.com/r/askgaybros/comments/2xjjwg/travelling_through_europe_on_my_ownwhich_areas/","Unauthenticated reddit sesssion","","False","2","","{}","Yo! Gaybro from Melbourne, Australia here.

I'm going to be travelling through Europe by myself from June 26-August 13 more or less and was looking for some travel tips/suggestions.

I'm booking everything myself, but I barely know anything about the places I'm going so I need some help! I'll be Eurailing it through for the most part, and be in the following cities with the approximate timeframes:

London: 4-5 days
Paris: 3-4 days
Italy (Florence, Rome Venice): I imagine this will take the better part of 2 weeks.

This leaves me with around 4-5 days during which I hope to fly to Amsterdam, and then train my way to Frankfurt, Germany towards the end of August, where I'll be meeting my parents to travel with them for another 2 weeks.

I know it's peak season but it's literally the only time I've got to travel between graduation and work as I'm going to be starting work (optometrist) in Perth, WA in August.

I have a fair bit of money saved up but I'm obviously not rolling in cash and would like to avoid excess expenditure wherever possible. Backpacking isn't really part of the plan.

I haven't actually booked anything yet unfortunately :( I only just got the OK for dates a little over a week ago so it's been a bit of a mad rush to try and get things organised.

I'm pretty big on nightlife and I really enjoy quiet hipster-y bars/cafes/restaurants and all that shit but also like cool landscapes and sightseeing tourist stuff so I'm basically open to anything in terms of stuff to do. What I really wanted help with was the kinds of areas to stay!

Help me gaybros! And ask away for more details, I'm happy to elaborate.

Edit: I'll add that I'm an optometry student and I'll be starting work in August. As part of my new job I get a sizeable sign-on bonus and, as previously mentioned, I've a lot of money saved up from slaving away during my school/uni years.","&lt;!-- SC_OFF --&gt;&lt;div class=""md""&gt;&lt;p&gt;Yo! Gaybro from Melbourne, Australia here.&lt;/p&gt;

&lt;p&gt;I&amp;#39;m going to be travelling through Europe by myself from June 26-August 13 more or less and was looking for some travel tips/suggestions.&lt;/p&gt;

&lt;p&gt;I&amp;#39;m booking everything myself, but I barely know anything about the places I&amp;#39;m going so I need some help! I&amp;#39;ll be Eurailing it through for the most part, and be in the following cities with the approximate timeframes:&lt;/p&gt;

&lt;p&gt;London: 4-5 days
Paris: 3-4 days
Italy (Florence, Rome Venice): I imagine this will take the better part of 2 weeks.&lt;/p&gt;

&lt;p&gt;This leaves me with around 4-5 days during which I hope to fly to Amsterdam, and then train my way to Frankfurt, Germany towards the end of August, where I&amp;#39;ll be meeting my parents to travel with them for another 2 weeks.&lt;/p&gt;

&lt;p&gt;I know it&amp;#39;s peak season but it&amp;#39;s literally the only time I&amp;#39;ve got to travel between graduation and work as I&amp;#39;m going to be starting work (optometrist) in Perth, WA in August.&lt;/p&gt;

&lt;p&gt;I have a fair bit of money saved up but I&amp;#39;m obviously not rolling in cash and would like to avoid excess expenditure wherever possible. Backpacking isn&amp;#39;t really part of the plan.&lt;/p&gt;

&lt;p&gt;I haven&amp;#39;t actually booked anything yet unfortunately :( I only just got the OK for dates a little over a week ago so it&amp;#39;s been a bit of a mad rush to try and get things organised.&lt;/p&gt;

&lt;p&gt;I&amp;#39;m pretty big on nightlife and I really enjoy quiet hipster-y bars/cafes/restaurants and all that shit but also like cool landscapes and sightseeing tourist stuff so I&amp;#39;m basically open to anything in terms of stuff to do. What I really wanted help with was the kinds of areas to stay!&lt;/p&gt;

&lt;p&gt;Help me gaybros! And ask away for more details, I&amp;#39;m happy to elaborate.&lt;/p&gt;

&lt;p&gt;Edit: I&amp;#39;ll add that I&amp;#39;m an optometry student and I&amp;#39;ll be starting work in August. As part of my new job I get a sizeable sign-on bonus and, as previously mentioned, I&amp;#39;ve a lot of money saved up from slaving away during my school/uni years.&lt;/p&gt;
&lt;/div&gt;&lt;!-- SC_ON --&gt;","False","askgaybros","t5_2vgfw","","","Travelling through Europe on my own--which areas should I stay?","2","http://www.reddit.com/r/askgaybros/comments/2xjjwg/travelling_through_europe_on_my_ownwhich_areas/","[]","False"
"7","","","{}","http://www.reddit.com/api/info/","{}","{}","False","","","False","5355m","","","","False","1425190251.0","1425190251.0","","self.askgaybros","0","False","0","True","False","2xjf9p","True","","","","","","{}","[]","t3_2xjf9p","9","","False","http://www.reddit.com/r/askgaybros/comments/2xjf9p/i_dont_like_dating_women/","Unauthenticated reddit sesssion","","False","16","","{}","This is not meant to be misogynistic at all, but I just don't like the idea of dating women.  I think I'm bi, but I am not really emotionally attracted to women and the process men do to attract women.

I don't like being forward and having to ask to go out first, to kiss first, to try to impress a woman by ""being manly.""  I don't want to make someone feel like they need me in their life.

I want to take care of myself and date someone who takes care of themselves.  I want to date because we like each other, not because we rely on each other for anything.  I know this is not exclusive to gay relationships, but the whole process of attracting women seems so foreign to me.

Furthermore, I connect much better with men emotionally.  I just feel I can be more open with them and ""not put on a show.""  I'm still in the process of figuring out whether or not I'm bi or gay, but could any of you relate to what I mean?","&lt;!-- SC_OFF --&gt;&lt;div class=""md""&gt;&lt;p&gt;This is not meant to be misogynistic at all, but I just don&amp;#39;t like the idea of dating women.  I think I&amp;#39;m bi, but I am not really emotionally attracted to women and the process men do to attract women.&lt;/p&gt;

&lt;p&gt;I don&amp;#39;t like being forward and having to ask to go out first, to kiss first, to try to impress a woman by &amp;quot;being manly.&amp;quot;  I don&amp;#39;t want to make someone feel like they need me in their life.&lt;/p&gt;

&lt;p&gt;I want to take care of myself and date someone who takes care of themselves.  I want to date because we like each other, not because we rely on each other for anything.  I know this is not exclusive to gay relationships, but the whole process of attracting women seems so foreign to me.&lt;/p&gt;

&lt;p&gt;Furthermore, I connect much better with men emotionally.  I just feel I can be more open with them and &amp;quot;not put on a show.&amp;quot;  I&amp;#39;m still in the process of figuring out whether or not I&amp;#39;m bi or gay, but could any of you relate to what I mean?&lt;/p&gt;
&lt;/div&gt;&lt;!-- SC_ON --&gt;","False","askgaybros","t5_2vgfw","","","I don't like dating women","16","http://www.reddit.com/r/askgaybros/comments/2xjf9p/i_dont_like_dating_women/","[]","False"
