"","_comment_sort","_comments","_comments_by_id","_info_url","_orphaned","_params","_replaced_more","_underscore_names","approved_by","archived","author","author_flair_css_class","author_flair_text","banned_by","clicked","created","created_utc","distinguished","domain","downs","edited","gilded","has_fetched","hidden","id","is_self","json_dict","likes","link_flair_css_class","link_flair_text","media","media_embed","mod_reports","name","num_comments","num_reports","over_18","permalink","reddit_session","report_reasons","saved","score","secure_media","secure_media_embed","selftext","selftext_html","stickied","subreddit","subreddit_id","suggested_sort","thumbnail","title","ups","url","user_reports","visited"
"0","","","{}","http://www.reddit.com/api/info/","{}","{}","False","","","True","esotericignominy","","","","False","1413044856.0","1413041256.0","","self.askgaybros","0","False","0","True","False","2iy7xe","True","","","","","","{}","[]","t3_2iy7xe","2","","False","http://www.reddit.com/r/askgaybros/comments/2iy7xe/hey_boys_i_bes_having_love_problems/","Unauthenticated reddit sesssion","","False","6","","{}","I come here so often when im really, just totally wallowing in a pool of self-pity or am on the verge of emotional collapse but i dont know why today is different.  I just was kind of paging through links and i realized how fun it would be if i actually knew this many boys!  So i was wondering how normal it is to be a part of a group of gay guy friends versus my position which is where i dont even have one gay guy friend.  

I feel kind of jealous when i see other guys in groups at the bar or something and i cant figure out why im never a part of something like that.  i think in general im a little sensitive when it comes to feelings and i really have high standards of how much sharing there is between friends.  I dont really think of myself as a ladies man, inside i really see myself as someone who would be complete if i could end up being one of the guys.  i wanna work out in the sun, and listen to music all throughout the house, beer bottles everywhere, no one wears shirts, playing ping pong and wearing sunglasses inside, smokin weed and maybe even a few hug-it-out moments between horseplay.  

Oh i dont know though!  I really want to have some kind of dynamic with guys for once without any girls involved.  i love my girls and sometimes i hang out with my guy friends but im always just being passive cause i dont want to make anyone uncomfortable.  that kind of makes me upset too that i frame my interactions with boys based on how i think my being gay will make them uncomfortable.

Its only rare times like when i got to spend time with a guy last night that show me that i actually do have a lot of love in me and its just suspended and hung up until i have some kind of genuine interaction.  I am long passed being able to take part in things like grindr.  i just feel soulless on there.

Last night i was hanging with my bestest girl friend and her new guy and it was so amazing when i started having a connection with the guy.  Idk what it was but i felt compelled the whole time, like i couldnt stop myself.  Hes so gorgeous and i know its pointless to think like that but its just the truth.  He likes all the same stuff as me and is so fun and likes all my jokes and we have the same refinement to our taste in movies.  I got a chance to pull away with only him for a short while by making a run to the liquor store.  We talked about my girl friend for a bit until we got into the ""i love you mans"" and it was so shocking to be received with so much complementarity.  I put my arm around him and he looked at me with his big eyes and i just felt like my whole body became flush with heat.  I was so happy, he just wanted to get to know me a little and give me some attention.  

When we got back i made some more rounds of drinks only this time he and i were next to each other and i sat on the bed with them.  He scooted over and made sure our arms were touching.  and i just was as still as when i cant disturb my sleeping kitty cat.  And i melted, i stretched out and got on his foot with my foot and snuggled my face up on him.  I guess i was probably crossing the line in being overly affectionate but i cant help myself.

And maybe when i cant help myself i cant find a way to properly channel my feelings into something constructive.  I mean, case in point even though he and i were having guy-bonding affection he was still leaning over to occasionally kiss her, or whisper something cute to her.  I know i cant wish for it, but i cant help but imagine what it would be like if there was actually a biological response for *wanting* a gay person to be there for you.  I feel like if reception of the love of a gay person in addition to the love of the person they desire were the way of things, and relationship dynamics had to include a gay person, i would have died and gone to heaven.  I just want to be a part of the love that gets shared.

And im a nice enough person!  I think people are very complimentary of me because i really try hard to be brave and put on my best and strongest face and be a tough boy who doesnt crack under the weight of his own isolation from the humanity he craves.  But sometimes i wish, instead of it always being me that lights up the room and is everyones wild-card for good times, that i was a real functional part of some kind of relationship with a real guy!  I dont like the way gay people treat each other, i want the experience my girl friend is having, where a guy is all out to prove his honesty and worth and demonstrate the extent of his cuteness and depth of love.  

I feel like so much of my cognition is dedicated to the appreciation of boys that I cant imagine what it would be like when i actually fulfill that void in my heart.  If that day even comes, will I have the strength to take the world in my hands and forge my identity at last?  I cant be all that i am or accept myself until i see a reflection of myself in another, i feel too alien and strange.  I need brotherhood, and love, and friendship, and kindly tempered strength and masculinity.  I need a boy to love.","&lt;!-- SC_OFF --&gt;&lt;div class=""md""&gt;&lt;p&gt;I come here so often when im really, just totally wallowing in a pool of self-pity or am on the verge of emotional collapse but i dont know why today is different.  I just was kind of paging through links and i realized how fun it would be if i actually knew this many boys!  So i was wondering how normal it is to be a part of a group of gay guy friends versus my position which is where i dont even have one gay guy friend.  &lt;/p&gt;

&lt;p&gt;I feel kind of jealous when i see other guys in groups at the bar or something and i cant figure out why im never a part of something like that.  i think in general im a little sensitive when it comes to feelings and i really have high standards of how much sharing there is between friends.  I dont really think of myself as a ladies man, inside i really see myself as someone who would be complete if i could end up being one of the guys.  i wanna work out in the sun, and listen to music all throughout the house, beer bottles everywhere, no one wears shirts, playing ping pong and wearing sunglasses inside, smokin weed and maybe even a few hug-it-out moments between horseplay.  &lt;/p&gt;

&lt;p&gt;Oh i dont know though!  I really want to have some kind of dynamic with guys for once without any girls involved.  i love my girls and sometimes i hang out with my guy friends but im always just being passive cause i dont want to make anyone uncomfortable.  that kind of makes me upset too that i frame my interactions with boys based on how i think my being gay will make them uncomfortable.&lt;/p&gt;

&lt;p&gt;Its only rare times like when i got to spend time with a guy last night that show me that i actually do have a lot of love in me and its just suspended and hung up until i have some kind of genuine interaction.  I am long passed being able to take part in things like grindr.  i just feel soulless on there.&lt;/p&gt;

&lt;p&gt;Last night i was hanging with my bestest girl friend and her new guy and it was so amazing when i started having a connection with the guy.  Idk what it was but i felt compelled the whole time, like i couldnt stop myself.  Hes so gorgeous and i know its pointless to think like that but its just the truth.  He likes all the same stuff as me and is so fun and likes all my jokes and we have the same refinement to our taste in movies.  I got a chance to pull away with only him for a short while by making a run to the liquor store.  We talked about my girl friend for a bit until we got into the &amp;quot;i love you mans&amp;quot; and it was so shocking to be received with so much complementarity.  I put my arm around him and he looked at me with his big eyes and i just felt like my whole body became flush with heat.  I was so happy, he just wanted to get to know me a little and give me some attention.  &lt;/p&gt;

&lt;p&gt;When we got back i made some more rounds of drinks only this time he and i were next to each other and i sat on the bed with them.  He scooted over and made sure our arms were touching.  and i just was as still as when i cant disturb my sleeping kitty cat.  And i melted, i stretched out and got on his foot with my foot and snuggled my face up on him.  I guess i was probably crossing the line in being overly affectionate but i cant help myself.&lt;/p&gt;

&lt;p&gt;And maybe when i cant help myself i cant find a way to properly channel my feelings into something constructive.  I mean, case in point even though he and i were having guy-bonding affection he was still leaning over to occasionally kiss her, or whisper something cute to her.  I know i cant wish for it, but i cant help but imagine what it would be like if there was actually a biological response for &lt;em&gt;wanting&lt;/em&gt; a gay person to be there for you.  I feel like if reception of the love of a gay person in addition to the love of the person they desire were the way of things, and relationship dynamics had to include a gay person, i would have died and gone to heaven.  I just want to be a part of the love that gets shared.&lt;/p&gt;

&lt;p&gt;And im a nice enough person!  I think people are very complimentary of me because i really try hard to be brave and put on my best and strongest face and be a tough boy who doesnt crack under the weight of his own isolation from the humanity he craves.  But sometimes i wish, instead of it always being me that lights up the room and is everyones wild-card for good times, that i was a real functional part of some kind of relationship with a real guy!  I dont like the way gay people treat each other, i want the experience my girl friend is having, where a guy is all out to prove his honesty and worth and demonstrate the extent of his cuteness and depth of love.  &lt;/p&gt;

&lt;p&gt;I feel like so much of my cognition is dedicated to the appreciation of boys that I cant imagine what it would be like when i actually fulfill that void in my heart.  If that day even comes, will I have the strength to take the world in my hands and forge my identity at last?  I cant be all that i am or accept myself until i see a reflection of myself in another, i feel too alien and strange.  I need brotherhood, and love, and friendship, and kindly tempered strength and masculinity.  I need a boy to love.&lt;/p&gt;
&lt;/div&gt;&lt;!-- SC_ON --&gt;","False","askgaybros","t5_2vgfw","","","Hey boys! I bes having love problems","6","http://www.reddit.com/r/askgaybros/comments/2iy7xe/hey_boys_i_bes_having_love_problems/","[]","False"
"1","","","{}","http://www.reddit.com/api/info/","{}","{}","False","","","True","umpteenth_","","","","False","1413042641.0","1413039041.0","","self.askgaybros","0","False","0","True","False","2iy4w6","True","","","","","","{}","[]","t3_2iy4w6","22","","False","http://www.reddit.com/r/askgaybros/comments/2iy4w6/how_did_you_find_selfacceptance/","Unauthenticated reddit sesssion","","False","14","","{}","So I saw the ""self-acceptance song"" thread, and it got me thinking. I didn't turn to music for self-acceptance, which is why I did not contribute. However I was brought up Christian, and struggled for a long while with feeling that it was wrong for me to be gay. If you look at my diary when I finally admitted to myself that I'm gay, I also wrote that I was going to fight it, because it was ""forbidden by the Bible."" For a while, I thought I would remain celibate. Then I began thinking that if I got married to a woman, she would have to be a very special woman so I would no longer look at men. 

I think for me, it was losing my faith that was the first step. Also, hooking up with men and discovering that I was actually desirable. But it's this subreddit and /r/gaybros that have done the most for me in terms of becoming comfortable with being gay, and that happened in just the past 6 months. So my question is, how did you guys finally accept and become comfortable with being gay? Did this subreddit help? If it didn't, what did?","&lt;!-- SC_OFF --&gt;&lt;div class=""md""&gt;&lt;p&gt;So I saw the &amp;quot;self-acceptance song&amp;quot; thread, and it got me thinking. I didn&amp;#39;t turn to music for self-acceptance, which is why I did not contribute. However I was brought up Christian, and struggled for a long while with feeling that it was wrong for me to be gay. If you look at my diary when I finally admitted to myself that I&amp;#39;m gay, I also wrote that I was going to fight it, because it was &amp;quot;forbidden by the Bible.&amp;quot; For a while, I thought I would remain celibate. Then I began thinking that if I got married to a woman, she would have to be a very special woman so I would no longer look at men. &lt;/p&gt;

&lt;p&gt;I think for me, it was losing my faith that was the first step. Also, hooking up with men and discovering that I was actually desirable. But it&amp;#39;s this subreddit and &lt;a href=""/r/gaybros""&gt;/r/gaybros&lt;/a&gt; that have done the most for me in terms of becoming comfortable with being gay, and that happened in just the past 6 months. So my question is, how did you guys finally accept and become comfortable with being gay? Did this subreddit help? If it didn&amp;#39;t, what did?&lt;/p&gt;
&lt;/div&gt;&lt;!-- SC_ON --&gt;","False","askgaybros","t5_2vgfw","","","How did you find self-acceptance?","14","http://www.reddit.com/r/askgaybros/comments/2iy4w6/how_did_you_find_selfacceptance/","[]","False"
"2","","","{}","http://www.reddit.com/api/info/","{}","{}","False","","","True","whatamidoingwrong123","","","","False","1413030965.0","1413027365.0","","self.askgaybros","0","False","0","True","False","2ixssc","True","","","","","","{}","[]","t3_2ixssc","27","","False","http://www.reddit.com/r/askgaybros/comments/2ixssc/no_interest/","Unauthenticated reddit sesssion","","False","10","","{}","So I'm 25, been out since June, and I've been trying to find someone, anyone, to connect with, but I can't.

Everyone decent I talk to disappears. Then there are the other guys who I'll talk to for a bit, then they'll just stop replying, but I can see they are online, but I don't want to be one of those guys who can't take a hint.

Then there's the old guys who throw compliments/offers at me left, right and centre but they're just not what I'm looking for.

Doesn't matter what kind of picture I use, face or torso, as soon as I think, hmm maybe I could meet this guy in the real world, they disappear.

I'm nice, I talk, I reply to literally everyone in the hopes that someone might turn out to be someone I can meet but as soon as I think hmmm, maybe I could meet them, they disappear or stop talking.

I also only ever see the same guys over and over again. For a city of 1mill+ surely there is more than 20 gay guys out there around my age? I'm literally on Tinder, Grindr, Jack'd and Hornet. Typing that (and this) makes me sound desperate but honestly I don't know what I'm doing wrong.

I'm fit, I'm toned, I'm pretty good looking. I don't 'talk gay' or 'act gay' or whatever it is people seem to be interested but I don't go advertising that around because it's dumb? The only thing I can think of about myself 'physically' that might be putting people off is my height. I'm only 5'4"" and I have it on my profiles because I figure people should know rather than turn up and see me in person and be disappointed but I feel like it's what might be stopping anyone from maintaining contact with me.

Gah, I don't know. I guess I'm just lonely and tired of waiting to find someone after all these years of being alone and wondering why nothing is happening for me and I just needed to vent.

Life is pretty shitty sometimes.","&lt;!-- SC_OFF --&gt;&lt;div class=""md""&gt;&lt;p&gt;So I&amp;#39;m 25, been out since June, and I&amp;#39;ve been trying to find someone, anyone, to connect with, but I can&amp;#39;t.&lt;/p&gt;

&lt;p&gt;Everyone decent I talk to disappears. Then there are the other guys who I&amp;#39;ll talk to for a bit, then they&amp;#39;ll just stop replying, but I can see they are online, but I don&amp;#39;t want to be one of those guys who can&amp;#39;t take a hint.&lt;/p&gt;

&lt;p&gt;Then there&amp;#39;s the old guys who throw compliments/offers at me left, right and centre but they&amp;#39;re just not what I&amp;#39;m looking for.&lt;/p&gt;

&lt;p&gt;Doesn&amp;#39;t matter what kind of picture I use, face or torso, as soon as I think, hmm maybe I could meet this guy in the real world, they disappear.&lt;/p&gt;

&lt;p&gt;I&amp;#39;m nice, I talk, I reply to literally everyone in the hopes that someone might turn out to be someone I can meet but as soon as I think hmmm, maybe I could meet them, they disappear or stop talking.&lt;/p&gt;

&lt;p&gt;I also only ever see the same guys over and over again. For a city of 1mill+ surely there is more than 20 gay guys out there around my age? I&amp;#39;m literally on Tinder, Grindr, Jack&amp;#39;d and Hornet. Typing that (and this) makes me sound desperate but honestly I don&amp;#39;t know what I&amp;#39;m doing wrong.&lt;/p&gt;

&lt;p&gt;I&amp;#39;m fit, I&amp;#39;m toned, I&amp;#39;m pretty good looking. I don&amp;#39;t &amp;#39;talk gay&amp;#39; or &amp;#39;act gay&amp;#39; or whatever it is people seem to be interested but I don&amp;#39;t go advertising that around because it&amp;#39;s dumb? The only thing I can think of about myself &amp;#39;physically&amp;#39; that might be putting people off is my height. I&amp;#39;m only 5&amp;#39;4&amp;quot; and I have it on my profiles because I figure people should know rather than turn up and see me in person and be disappointed but I feel like it&amp;#39;s what might be stopping anyone from maintaining contact with me.&lt;/p&gt;

&lt;p&gt;Gah, I don&amp;#39;t know. I guess I&amp;#39;m just lonely and tired of waiting to find someone after all these years of being alone and wondering why nothing is happening for me and I just needed to vent.&lt;/p&gt;

&lt;p&gt;Life is pretty shitty sometimes.&lt;/p&gt;
&lt;/div&gt;&lt;!-- SC_ON --&gt;","False","askgaybros","t5_2vgfw","","","No interest?","10","http://www.reddit.com/r/askgaybros/comments/2ixssc/no_interest/","[]","False"
"3","","","{}","http://www.reddit.com/api/info/","{}","{}","False","","","True","shione93","","","","False","1413024837.0","1413021237.0","","self.askgaybros","0","False","0","True","False","2ixnxu","True","","","","","","{}","[]","t3_2ixnxu","35","","False","http://www.reddit.com/r/askgaybros/comments/2ixnxu/swallowing_yes_no/","Unauthenticated reddit sesssion","","False","8","","{}","I always get so turn on watching porn especially when I watch guys snowballing. I would really like to try my own cum but then again I'm not sure if I should do that because I'm afraid it might affect my health or something.","&lt;!-- SC_OFF --&gt;&lt;div class=""md""&gt;&lt;p&gt;I always get so turn on watching porn especially when I watch guys snowballing. I would really like to try my own cum but then again I&amp;#39;m not sure if I should do that because I&amp;#39;m afraid it might affect my health or something.&lt;/p&gt;
&lt;/div&gt;&lt;!-- SC_ON --&gt;","False","askgaybros","t5_2vgfw","","","Swallowing : Yes / No","8","http://www.reddit.com/r/askgaybros/comments/2ixnxu/swallowing_yes_no/","[]","False"
"4","","","{}","http://www.reddit.com/api/info/","{}","{}","False","","","True","1Lc3Rnthrowaway","","","","False","1413019074.0","1413015474.0","","self.askgaybros","0","False","0","True","False","2ixjs1","True","","","","","","{}","[]","t3_2ixjs1","20","","False","http://www.reddit.com/r/askgaybros/comments/2ixjs1/i_feel_like_this_guy_is_too_good_for_me_what/","Unauthenticated reddit sesssion","","False","10","","{}","My insecurity is killing me. There's this guy. He's 26, 6'2"", 8.5"", muscled as fuck, from an ivy league university. Here I am. 24, 5'8, 5"" potato making just above minimum wage. We've been on 2 dates. It's like our story is straight out of a movie. So far, I feel like I'm wasting his time. There's probably someone out there who could make him a lot happier but he's settled for me. I don't think we'll last. What should I do?","&lt;!-- SC_OFF --&gt;&lt;div class=""md""&gt;&lt;p&gt;My insecurity is killing me. There&amp;#39;s this guy. He&amp;#39;s 26, 6&amp;#39;2&amp;quot;, 8.5&amp;quot;, muscled as fuck, from an ivy league university. Here I am. 24, 5&amp;#39;8, 5&amp;quot; potato making just above minimum wage. We&amp;#39;ve been on 2 dates. It&amp;#39;s like our story is straight out of a movie. So far, I feel like I&amp;#39;m wasting his time. There&amp;#39;s probably someone out there who could make him a lot happier but he&amp;#39;s settled for me. I don&amp;#39;t think we&amp;#39;ll last. What should I do?&lt;/p&gt;
&lt;/div&gt;&lt;!-- SC_ON --&gt;","False","askgaybros","t5_2vgfw","","","I feel like this guy is too good for me. What should I do?","10","http://www.reddit.com/r/askgaybros/comments/2ixjs1/i_feel_like_this_guy_is_too_good_for_me_what/","[]","False"
