"","_comment_sort","_comments","_comments_by_id","_info_url","_orphaned","_params","_replaced_more","_underscore_names","approved_by","archived","author","author_flair_css_class","author_flair_text","banned_by","clicked","created","created_utc","distinguished","domain","downs","edited","gilded","has_fetched","hidden","id","is_self","json_dict","likes","link_flair_css_class","link_flair_text","media","media_embed","mod_reports","name","num_comments","num_reports","over_18","permalink","reddit_session","report_reasons","saved","score","secure_media","secure_media_embed","selftext","selftext_html","stickied","subreddit","subreddit_id","suggested_sort","thumbnail","title","ups","url","user_reports","visited"
"20","","","{}","http://www.reddit.com/api/info/","{}","{}","False","","","True","FunLegends","","","","False","1414376916.0","1414373316.0","","self.askgaybros","0","1414380943.0","0","True","False","2kf85e","True","","","","","","{}","[]","t3_2kf85e","16","","False","http://www.reddit.com/r/askgaybros/comments/2kf85e/i_want_to_know_if_my_friend_is_gay_and_if_he/","Unauthenticated reddit sesssion","","False","3","","{}","Ok so I'm a junior in high school and I'm gay. I haven't come out to anyone, so no one knows I'm gay. I have a friend, I've known him since 6th grade and he is in my history class. Since the year started (around late August) he has been making prolonged eye contact with me and doing things like touching my foot with his and unnecessarily touching me in other ways (i.e., after turning in a paper he walked past and purposely grazed his butt on my arm). As he has been doing this I have started liking him more and more. He always wants to be my partner for projects and I am the first one he asks when he forgets a book or the homework. He sits one seat to the right and one forward, but we do a lot of group work so I am always interacting with him. The person who sits behind me is consistently absent and when that person is gone he always jumps on the opportunity to sit there. He will touch my back with his hand and my legs with his feet. I am really starting to like him and I get butterflies whenever i think of him. One day we were in the library and we were working on a project sitting at a table alone across from each other. I had to go get something and when i got back his legs were under the table where mine would be, so when i sat down we had a lot of contact and touching between our legs. This continued throughout the period and we kept making obvious movements so that each other would notice, neither of us ever pulled away. These signs lead me to believe there is something there. He is constantly on my mind and I am really scared to ask him since we are in high school and people can be hostile or spread that I am gay (which I don't want people to know yet). I am also unsure because he is Mormon. I feel like I can't stop being anxious till I know if there is something between us. Any advice would be much appreciated. Please excuse any grammar errors :) and thank you to anyone who helps.

Edit: Since I would get really nervous in person, would it be too impersonal to ask him through text? Or is this something that needs to be face to face?","&lt;!-- SC_OFF --&gt;&lt;div class=""md""&gt;&lt;p&gt;Ok so I&amp;#39;m a junior in high school and I&amp;#39;m gay. I haven&amp;#39;t come out to anyone, so no one knows I&amp;#39;m gay. I have a friend, I&amp;#39;ve known him since 6th grade and he is in my history class. Since the year started (around late August) he has been making prolonged eye contact with me and doing things like touching my foot with his and unnecessarily touching me in other ways (i.e., after turning in a paper he walked past and purposely grazed his butt on my arm). As he has been doing this I have started liking him more and more. He always wants to be my partner for projects and I am the first one he asks when he forgets a book or the homework. He sits one seat to the right and one forward, but we do a lot of group work so I am always interacting with him. The person who sits behind me is consistently absent and when that person is gone he always jumps on the opportunity to sit there. He will touch my back with his hand and my legs with his feet. I am really starting to like him and I get butterflies whenever i think of him. One day we were in the library and we were working on a project sitting at a table alone across from each other. I had to go get something and when i got back his legs were under the table where mine would be, so when i sat down we had a lot of contact and touching between our legs. This continued throughout the period and we kept making obvious movements so that each other would notice, neither of us ever pulled away. These signs lead me to believe there is something there. He is constantly on my mind and I am really scared to ask him since we are in high school and people can be hostile or spread that I am gay (which I don&amp;#39;t want people to know yet). I am also unsure because he is Mormon. I feel like I can&amp;#39;t stop being anxious till I know if there is something between us. Any advice would be much appreciated. Please excuse any grammar errors :) and thank you to anyone who helps.&lt;/p&gt;

&lt;p&gt;Edit: Since I would get really nervous in person, would it be too impersonal to ask him through text? Or is this something that needs to be face to face?&lt;/p&gt;
&lt;/div&gt;&lt;!-- SC_ON --&gt;","False","askgaybros","t5_2vgfw","","","I want to know if my friend is gay and if he likes me. All advice is welcome and appreciated.","3","http://www.reddit.com/r/askgaybros/comments/2kf85e/i_want_to_know_if_my_friend_is_gay_and_if_he/","[]","False"
"21","","","{}","http://www.reddit.com/api/info/","{}","{}","False","","","True","GoldenTimeHero","","","","False","1414376324.0","1414372724.0","","self.askgaybros","0","False","0","True","False","2kf74f","True","","","","","","{}","[]","t3_2kf74f","16","","False","http://www.reddit.com/r/askgaybros/comments/2kf74f/whats_weirdest_erotic_dream_youve_had/","Unauthenticated reddit sesssion","","False","4","","{}","I ask this because last night I had a rather sexual dream about Peyton Manning. I have no clue where it came from. I've never though of him in that way until that dream.","&lt;!-- SC_OFF --&gt;&lt;div class=""md""&gt;&lt;p&gt;I ask this because last night I had a rather sexual dream about Peyton Manning. I have no clue where it came from. I&amp;#39;ve never though of him in that way until that dream.&lt;/p&gt;
&lt;/div&gt;&lt;!-- SC_ON --&gt;","False","askgaybros","t5_2vgfw","","","What's weirdest erotic dream you've had","4","http://www.reddit.com/r/askgaybros/comments/2kf74f/whats_weirdest_erotic_dream_youve_had/","[]","False"
"22","","","{}","http://www.reddit.com/api/info/","{}","{}","False","","","True","columnity","","","","False","1414373874.0","1414370274.0","","self.askgaybros","0","False","0","True","False","2kf2xz","True","","","","","","{}","[]","t3_2kf2xz","69","","False","http://www.reddit.com/r/askgaybros/comments/2kf2xz/why_do_some_people_feel_the_need_to_say_im_not_gay/","Unauthenticated reddit sesssion","","False","27","","{}","Some people seem to say ""I like X, but im not gay"" ""I like Y, but im not gay"" and not just homophobes. Why?","&lt;!-- SC_OFF --&gt;&lt;div class=""md""&gt;&lt;p&gt;Some people seem to say &amp;quot;I like X, but im not gay&amp;quot; &amp;quot;I like Y, but im not gay&amp;quot; and not just homophobes. Why?&lt;/p&gt;
&lt;/div&gt;&lt;!-- SC_ON --&gt;","False","askgaybros","t5_2vgfw","","","Why do some people feel the need to say ""I'm not gay""","27","http://www.reddit.com/r/askgaybros/comments/2kf2xz/why_do_some_people_feel_the_need_to_say_im_not_gay/","[]","False"
"23","","","{}","http://www.reddit.com/api/info/","{}","{}","False","","","True","ThAw729","","","","False","1414373498.0","1414369898.0","","self.askgaybros","0","1414371106.0","0","True","False","2kf29u","True","","","","","","{}","[]","t3_2kf29u","15","","False","http://www.reddit.com/r/askgaybros/comments/2kf29u/am_i_stuck_in_some_sort_of_gay_stigma/","Unauthenticated reddit sesssion","","False","5","","{}","Hey guys! Kinda new to this reddit thing so bare with me. I just need a little outside perspective.

So I'm 22 years old, a male, and I've been out of the closet for almost 4 years now. I didn't get any extreme negative reactions when I came out and all of my friends were accepting and if anything it brought me even closer to them. I can't say my family was thrilled by the idea of me being gay but they still love me and have made a ton of progress in becoming more accepting. My issue here is that I seem to always fall for the wrong guy... The ones I can't have... The straight ones. It is crazy to me because for much of my life, I always looked at fellow gay men who chased straight guys with a bit of disdain. Like if you know they're straight then why bother, right? Maybe this is karma coming for my ass for being a judge-y bitch and now I'm just destined to be attracted to men that I can't have, or maybe Iâ€™m just doing something wrong. Iâ€™m not attracted to fem guys at all. I am 100% bottom but I myself and not fem and people usually have a hard time telling Iâ€™m gay.


 I've only been in one relationship with someone I met on twitter. It was long distance though we did meet a few times and while he looked the way he said he looked, I have since been given reason to believe that he lied about everything else (personal history and such). As the case always is with me, he identified as straight, though now he is starting to come to better terms with his true sexuality since the guy he dated after me (despite the fact that I was the â€˜one exceptionâ€ -_-) tragically thought it would be suitable to out him. I'm not here to talk about him though.  


I want to know why I can't seem to fall for gay men the way that i fall for straight men. Is this some sort of shit stigma I've fallen into? Even in high school when there were other gay men in my class I never had eyes for them, and instead fell head over heels for my unavailable, straight best friend which eventually led me to abandon the friendship all-together (this is before I was out btw) because I felt that if I ever confessed, the friendship would have ended anyway. I mean I spent every waking moment with this guy and his gf, and every now and then in privacy he would jokingly say something about how he could be bi. I never put much weight behind it but there was a time when he and his SO were in a bad place and he was considering leaving her (just want to mention that they had been renting rooms and living on their own since they were about 16 and at the time I'm speaking of we were 18 and they'd already put a few years into the relationship). When I heard he was thinking about breaking up it took every fiber of my being to not encourage him to leave her and start a life with me, but at this point I was just as close to her as I was to him so that seemed kinda grimy to me. In the end they stayed together and some time later I just pulled away from both of them because being a third wheel in that situation just fucking sucks. But it doesn't even end with him. That was just the first and worst case so far. Since then I have fallen for countless straight friends of mine, half of which aren't even good guys.   


After the ordeal with the guy mentioned above though, and because I never wanted to have to give up such a good friend again, I vowed to never abandon a friendship just because I was crushing on someone. I figure I should just be straight-forward and see what happens. So that is what I've been doing. Mostly I do this and the friendships end anyway, but a few times I have maintained the friendship afterwards. What has never happened, however, is a reciprocation of my feelings, EVER! Aside from twitter man, but he doesn't really count since the whole reason it didn't work is because he identified, at the time, as straight and refused to consider, even after a year and a half, moving into any semblance of a serious relationship. Iâ€™m beginning to think somethings wrong with me. I even confronted feelings that I had for another gay guy recently and he politely said to me â€œThrowaway, I just want to be friends.â€ And we still are but.. what gives? I struck out on my own 2 years ago to SF Bay area thinking, hey there's a pretty big gay population there, things will definitely look up!â€ and they havenâ€™t. Itâ€™s the same shit. Me falling mostly for straight men. Me getting rejected. Me losing friends. Iâ€™m pretty sure Iâ€™m not bad looking, but maybe I should see the AmIUgly subred for that answer. I just donâ€™t know what to do anymore. Iâ€™ve been single for years, I only have a hand full of friends out here, no family, so Iâ€™m pretty fucking alone. How do I break this habit and find men that I actually stand a chance with? What am I doing wrong. Help? Anyone?  





TL;DR: Why is it that I only seem to be attracted to straight, unattainable men?","&lt;!-- SC_OFF --&gt;&lt;div class=""md""&gt;&lt;p&gt;Hey guys! Kinda new to this reddit thing so bare with me. I just need a little outside perspective.&lt;/p&gt;

&lt;p&gt;So I&amp;#39;m 22 years old, a male, and I&amp;#39;ve been out of the closet for almost 4 years now. I didn&amp;#39;t get any extreme negative reactions when I came out and all of my friends were accepting and if anything it brought me even closer to them. I can&amp;#39;t say my family was thrilled by the idea of me being gay but they still love me and have made a ton of progress in becoming more accepting. My issue here is that I seem to always fall for the wrong guy... The ones I can&amp;#39;t have... The straight ones. It is crazy to me because for much of my life, I always looked at fellow gay men who chased straight guys with a bit of disdain. Like if you know they&amp;#39;re straight then why bother, right? Maybe this is karma coming for my ass for being a judge-y bitch and now I&amp;#39;m just destined to be attracted to men that I can&amp;#39;t have, or maybe Iâ€™m just doing something wrong. Iâ€™m not attracted to fem guys at all. I am 100% bottom but I myself and not fem and people usually have a hard time telling Iâ€™m gay.&lt;/p&gt;

&lt;p&gt;I&amp;#39;ve only been in one relationship with someone I met on twitter. It was long distance though we did meet a few times and while he looked the way he said he looked, I have since been given reason to believe that he lied about everything else (personal history and such). As the case always is with me, he identified as straight, though now he is starting to come to better terms with his true sexuality since the guy he dated after me (despite the fact that I was the â€˜one exceptionâ€ -_-) tragically thought it would be suitable to out him. I&amp;#39;m not here to talk about him though.  &lt;/p&gt;

&lt;p&gt;I want to know why I can&amp;#39;t seem to fall for gay men the way that i fall for straight men. Is this some sort of shit stigma I&amp;#39;ve fallen into? Even in high school when there were other gay men in my class I never had eyes for them, and instead fell head over heels for my unavailable, straight best friend which eventually led me to abandon the friendship all-together (this is before I was out btw) because I felt that if I ever confessed, the friendship would have ended anyway. I mean I spent every waking moment with this guy and his gf, and every now and then in privacy he would jokingly say something about how he could be bi. I never put much weight behind it but there was a time when he and his SO were in a bad place and he was considering leaving her (just want to mention that they had been renting rooms and living on their own since they were about 16 and at the time I&amp;#39;m speaking of we were 18 and they&amp;#39;d already put a few years into the relationship). When I heard he was thinking about breaking up it took every fiber of my being to not encourage him to leave her and start a life with me, but at this point I was just as close to her as I was to him so that seemed kinda grimy to me. In the end they stayed together and some time later I just pulled away from both of them because being a third wheel in that situation just fucking sucks. But it doesn&amp;#39;t even end with him. That was just the first and worst case so far. Since then I have fallen for countless straight friends of mine, half of which aren&amp;#39;t even good guys.   &lt;/p&gt;

&lt;p&gt;After the ordeal with the guy mentioned above though, and because I never wanted to have to give up such a good friend again, I vowed to never abandon a friendship just because I was crushing on someone. I figure I should just be straight-forward and see what happens. So that is what I&amp;#39;ve been doing. Mostly I do this and the friendships end anyway, but a few times I have maintained the friendship afterwards. What has never happened, however, is a reciprocation of my feelings, EVER! Aside from twitter man, but he doesn&amp;#39;t really count since the whole reason it didn&amp;#39;t work is because he identified, at the time, as straight and refused to consider, even after a year and a half, moving into any semblance of a serious relationship. Iâ€™m beginning to think somethings wrong with me. I even confronted feelings that I had for another gay guy recently and he politely said to me â€œThrowaway, I just want to be friends.â€ And we still are but.. what gives? I struck out on my own 2 years ago to SF Bay area thinking, hey there&amp;#39;s a pretty big gay population there, things will definitely look up!â€ and they havenâ€™t. Itâ€™s the same shit. Me falling mostly for straight men. Me getting rejected. Me losing friends. Iâ€™m pretty sure Iâ€™m not bad looking, but maybe I should see the AmIUgly subred for that answer. I just donâ€™t know what to do anymore. Iâ€™ve been single for years, I only have a hand full of friends out here, no family, so Iâ€™m pretty fucking alone. How do I break this habit and find men that I actually stand a chance with? What am I doing wrong. Help? Anyone?  &lt;/p&gt;

&lt;p&gt;TL;DR: Why is it that I only seem to be attracted to straight, unattainable men?&lt;/p&gt;
&lt;/div&gt;&lt;!-- SC_ON --&gt;","False","askgaybros","t5_2vgfw","","","Am I stuck in some sort of Gay stigma?","5","http://www.reddit.com/r/askgaybros/comments/2kf29u/am_i_stuck_in_some_sort_of_gay_stigma/","[]","False"
"24","","","{}","http://www.reddit.com/api/info/","{}","{}","False","","","True","scardycat92","","","","False","1414369821.0","1414366221.0","","self.askgaybros","0","False","0","True","False","2kew0a","True","","","","","","{}","[]","t3_2kew0a","17","","True","http://www.reddit.com/r/askgaybros/comments/2kew0a/anyone_else_ever_date_a_guy_with_a_unique_looking/","Unauthenticated reddit sesssion","","False","7","","{}","Hey all, so to make a long story short, me and the guy I've been seeing got intimate the other night. When I saw his dick I was kind of taken aback. Now, personally, I think dicks are pretty ugly to begin with, but this guy had a pretty severe curvature to his equipment, and I have just never seen that in person. 

I know that this is pretty common, and I really like the guy, so it's not like I want to abandon ship because of something so minor. Anyway, as wrong as this may sound it made me a little uncomfortable, and I think the guy realized this. 

My question is: has anyone else been surprised to find that their partner had a unique dick. If you were uncomfortable, how did you push your comfort zone. I really like this guy, and I want to let him see that it doesn't bother me. ","&lt;!-- SC_OFF --&gt;&lt;div class=""md""&gt;&lt;p&gt;Hey all, so to make a long story short, me and the guy I&amp;#39;ve been seeing got intimate the other night. When I saw his dick I was kind of taken aback. Now, personally, I think dicks are pretty ugly to begin with, but this guy had a pretty severe curvature to his equipment, and I have just never seen that in person. &lt;/p&gt;

&lt;p&gt;I know that this is pretty common, and I really like the guy, so it&amp;#39;s not like I want to abandon ship because of something so minor. Anyway, as wrong as this may sound it made me a little uncomfortable, and I think the guy realized this. &lt;/p&gt;

&lt;p&gt;My question is: has anyone else been surprised to find that their partner had a unique dick. If you were uncomfortable, how did you push your comfort zone. I really like this guy, and I want to let him see that it doesn&amp;#39;t bother me. &lt;/p&gt;
&lt;/div&gt;&lt;!-- SC_ON --&gt;","False","askgaybros","t5_2vgfw","","","Anyone else ever date a guy with a ""unique"" looking dick (potentially NSFW)","7","http://www.reddit.com/r/askgaybros/comments/2kew0a/anyone_else_ever_date_a_guy_with_a_unique_looking/","[]","False"
"25","","","{}","http://www.reddit.com/api/info/","{}","{}","False","","","True","throwaway1352359","","","","False","1414365370.0","1414361770.0","","self.askgaybros","0","False","0","True","False","2keo8g","True","","","","","","{}","[]","t3_2keo8g","10","","False","http://www.reddit.com/r/askgaybros/comments/2keo8g/how_does_the_real_thing_compare_to_toys/","Unauthenticated reddit sesssion","","False","1","","{}","To make a long story short, I'm a bi-curious straight guy who's always been really curious about bottoming. It's something I want to try somewhere down the road.

I've done some anal play in the past with three different plugs. Two were normal, one was a vibrating plug. I'm not sure if my technique was wrong or if it's just the way I'm wired, but I got no pleasure out of any of them by themselves. Sensations during sex were amplified, but I never actually finished with a toy inserted to find out just how much feeling I got from it.

I guess I'm worried that if I ever decide to go through with bottoming for someone, I won't enjoy it much as I haven't enjoyed anal play with toys. I've heard the stories of how great anal play can be and I'd love more than anything to be able to feel the same things, but so far I can't.

So for those of you who have had both, how do they compare? Is it possible to get way more out of an actual penis than you could with a plug? How do the feelings and sensations differ?","&lt;!-- SC_OFF --&gt;&lt;div class=""md""&gt;&lt;p&gt;To make a long story short, I&amp;#39;m a bi-curious straight guy who&amp;#39;s always been really curious about bottoming. It&amp;#39;s something I want to try somewhere down the road.&lt;/p&gt;

&lt;p&gt;I&amp;#39;ve done some anal play in the past with three different plugs. Two were normal, one was a vibrating plug. I&amp;#39;m not sure if my technique was wrong or if it&amp;#39;s just the way I&amp;#39;m wired, but I got no pleasure out of any of them by themselves. Sensations during sex were amplified, but I never actually finished with a toy inserted to find out just how much feeling I got from it.&lt;/p&gt;

&lt;p&gt;I guess I&amp;#39;m worried that if I ever decide to go through with bottoming for someone, I won&amp;#39;t enjoy it much as I haven&amp;#39;t enjoyed anal play with toys. I&amp;#39;ve heard the stories of how great anal play can be and I&amp;#39;d love more than anything to be able to feel the same things, but so far I can&amp;#39;t.&lt;/p&gt;

&lt;p&gt;So for those of you who have had both, how do they compare? Is it possible to get way more out of an actual penis than you could with a plug? How do the feelings and sensations differ?&lt;/p&gt;
&lt;/div&gt;&lt;!-- SC_ON --&gt;","False","askgaybros","t5_2vgfw","","","How does the real thing compare to toys?","1","http://www.reddit.com/r/askgaybros/comments/2keo8g/how_does_the_real_thing_compare_to_toys/","[]","False"
"26","","","{}","http://www.reddit.com/api/info/","{}","{}","False","","","True","grybaos","","","","False","1414364172.0","1414360572.0","","self.askgaybros","0","False","0","True","False","2kem4x","True","","","","","","{}","[]","t3_2kem4x","8","","True","http://www.reddit.com/r/askgaybros/comments/2kem4x/question_about_buying_adult_supplies_from_amazon/","Unauthenticated reddit sesssion","","False","1","","{}","Hey there,

I'm a 19 year old semi-out of the closet kind of gay guy in college looking to now, since I'm out of my parents house for a bit in the dorms, to experiment more with anal masturbation...but had a question.  

Does buying off Amazon ship discreetly? I bought a proper anal dildo off another site that does, but the lubricant and condoms were expensive there versus Amazon with Amazon Prime. Does Amazon ship these things discreetly so I don't have to walk into the university post office to pick up a box labeled ""Bills Adult Toy Extravaganza!""?  

TL;DR: Does Amazon ship discreetly? 
","&lt;!-- SC_OFF --&gt;&lt;div class=""md""&gt;&lt;p&gt;Hey there,&lt;/p&gt;

&lt;p&gt;I&amp;#39;m a 19 year old semi-out of the closet kind of gay guy in college looking to now, since I&amp;#39;m out of my parents house for a bit in the dorms, to experiment more with anal masturbation...but had a question.  &lt;/p&gt;

&lt;p&gt;Does buying off Amazon ship discreetly? I bought a proper anal dildo off another site that does, but the lubricant and condoms were expensive there versus Amazon with Amazon Prime. Does Amazon ship these things discreetly so I don&amp;#39;t have to walk into the university post office to pick up a box labeled &amp;quot;Bills Adult Toy Extravaganza!&amp;quot;?  &lt;/p&gt;

&lt;p&gt;TL;DR: Does Amazon ship discreetly? &lt;/p&gt;
&lt;/div&gt;&lt;!-- SC_ON --&gt;","False","askgaybros","t5_2vgfw","","","Question about buying adult supplies from Amazon","1","http://www.reddit.com/r/askgaybros/comments/2kem4x/question_about_buying_adult_supplies_from_amazon/","[]","False"
