"","_comment_sort","_comments","_comments_by_id","_info_url","_orphaned","_params","_replaced_more","_underscore_names","approved_by","archived","author","author_flair_css_class","author_flair_text","banned_by","clicked","created","created_utc","distinguished","domain","downs","edited","gilded","has_fetched","hidden","id","is_self","json_dict","likes","link_flair_css_class","link_flair_text","media","media_embed","mod_reports","name","num_comments","num_reports","over_18","permalink","reddit_session","report_reasons","saved","score","secure_media","secure_media_embed","selftext","selftext_html","stickied","subreddit","subreddit_id","suggested_sort","thumbnail","title","ups","url","user_reports","visited"
"19","","","{}","http://www.reddit.com/api/info/","{}","{}","False","","","False","Throwaway1234346","","","","False","1422725947.0","1422725947.0","","self.askgaybros","0","False","0","True","False","2ubkk9","True","","","","","","{}","[]","t3_2ubkk9","2","","False","http://www.reddit.com/r/askgaybros/comments/2ubkk9/just_finish_it/","Unauthenticated reddit sesssion","","False","0","","{}","I hate my life. I do not think I have ever had a truly happy moment in it. Nothing but more and more regrets and I just can't run anymore. I just don't know what to do. I hated school, I felt I just walked through it as if it was a bad dream, I was so fed up with people that I pulled a knife on a kid in 8th grade. I never had any friends in school, anyone I tried to be with always put me down. I always found it ironic that I worked at a call center, they said I was talented at talking with people and begged me to stay more than the 6 months I had already, and yet the moment I talk with someone and give them my number no one talks to me. I feel like I always have to be there for someone else when no one is here for me. I have a job now, but I would have never took it if I knew what kind of person my boss was. He doesn't know, but he says people like us should have a gun to their head. Being a in a small town, with my boss being the only person I work with, I feel trapped having to hear what he has to say all day. I don't have much money, I would leave if I could, but I dont know where to go. My dad and step mom know about my situation and I haven't told them everything, but they are not much help. My father says there are worse things that I could be as if it's a bad thing to begin with. I don't know what keeps me going, I'm just too stubborn to die or I act like I have a debt to humanity to pay off. I know that I'm pretty much stuck in a pit too deep and too weak to climb out. All it would take is something too much for me to handle and I wouldn't make it. Yet I still keep trying and I don't see why.","&lt;!-- SC_OFF --&gt;&lt;div class=""md""&gt;&lt;p&gt;I hate my life. I do not think I have ever had a truly happy moment in it. Nothing but more and more regrets and I just can&amp;#39;t run anymore. I just don&amp;#39;t know what to do. I hated school, I felt I just walked through it as if it was a bad dream, I was so fed up with people that I pulled a knife on a kid in 8th grade. I never had any friends in school, anyone I tried to be with always put me down. I always found it ironic that I worked at a call center, they said I was talented at talking with people and begged me to stay more than the 6 months I had already, and yet the moment I talk with someone and give them my number no one talks to me. I feel like I always have to be there for someone else when no one is here for me. I have a job now, but I would have never took it if I knew what kind of person my boss was. He doesn&amp;#39;t know, but he says people like us should have a gun to their head. Being a in a small town, with my boss being the only person I work with, I feel trapped having to hear what he has to say all day. I don&amp;#39;t have much money, I would leave if I could, but I dont know where to go. My dad and step mom know about my situation and I haven&amp;#39;t told them everything, but they are not much help. My father says there are worse things that I could be as if it&amp;#39;s a bad thing to begin with. I don&amp;#39;t know what keeps me going, I&amp;#39;m just too stubborn to die or I act like I have a debt to humanity to pay off. I know that I&amp;#39;m pretty much stuck in a pit too deep and too weak to climb out. All it would take is something too much for me to handle and I wouldn&amp;#39;t make it. Yet I still keep trying and I don&amp;#39;t see why.&lt;/p&gt;
&lt;/div&gt;&lt;!-- SC_ON --&gt;","False","askgaybros","t5_2vgfw","","","Just Finish It","0","http://www.reddit.com/r/askgaybros/comments/2ubkk9/just_finish_it/","[]","False"
"20","","","{}","http://www.reddit.com/api/info/","{}","{}","False","","","False","DesignPortfolio","","","","False","1422725390.0","1422725390.0","","self.askgaybros","0","1422785568.0","0","True","False","2ubjgv","True","","","","","","{}","[]","t3_2ubjgv","17","","False","http://www.reddit.com/r/askgaybros/comments/2ubjgv/i_am_so_alone_and_have_no_social_interaction/","Unauthenticated reddit sesssion","","False","7","","{}","Hello AskGayBros, I came out to my group of friends (all of them) before I left for college in 2011, and not a single person took it well. I met all these friends through a church, and since returning in March 2014 to my small local village not a single one is still speaking to me or acknowledges me. If matters could not get worse I was involved in a car accident which means at the moment I am not fit to get a job, and meet friends through work. I currently have no one, and I know I have friends on facebook, but they live hundreds of miles away and have their own lives to get on with. I am left completely isolated, and my only social interaction is my mum and her friends. I am twenty-four years old, and so alone in the world. I started to cry at the realisation of how truly alone I was in this village. I am not sure how to make friends outside of a educational/work setting and since I am unable to drive it's that extra bit difficult to get to local bars, and attempt to make friends that way although I do not think I would be comfortable doing that.

Feel free to add me on kik nino4me or send me a private message on here if anyone wants to talk. I live in England just to take note of time difference.","&lt;!-- SC_OFF --&gt;&lt;div class=""md""&gt;&lt;p&gt;Hello AskGayBros, I came out to my group of friends (all of them) before I left for college in 2011, and not a single person took it well. I met all these friends through a church, and since returning in March 2014 to my small local village not a single one is still speaking to me or acknowledges me. If matters could not get worse I was involved in a car accident which means at the moment I am not fit to get a job, and meet friends through work. I currently have no one, and I know I have friends on facebook, but they live hundreds of miles away and have their own lives to get on with. I am left completely isolated, and my only social interaction is my mum and her friends. I am twenty-four years old, and so alone in the world. I started to cry at the realisation of how truly alone I was in this village. I am not sure how to make friends outside of a educational/work setting and since I am unable to drive it&amp;#39;s that extra bit difficult to get to local bars, and attempt to make friends that way although I do not think I would be comfortable doing that.&lt;/p&gt;

&lt;p&gt;Feel free to add me on kik nino4me or send me a private message on here if anyone wants to talk. I live in England just to take note of time difference.&lt;/p&gt;
&lt;/div&gt;&lt;!-- SC_ON --&gt;","False","askgaybros","t5_2vgfw","","","I am so alone and have no social interaction.","7","http://www.reddit.com/r/askgaybros/comments/2ubjgv/i_am_so_alone_and_have_no_social_interaction/","[]","False"
"21","","","{}","http://www.reddit.com/api/info/","{}","{}","False","","","False","sayidOH","","","","False","1422724665.0","1422724665.0","","self.askgaybros","0","False","0","True","False","2ubi39","True","","","","","","{}","[]","t3_2ubi39","64","","True","http://www.reddit.com/r/askgaybros/comments/2ubi39/its_10_inches/","Unauthenticated reddit sesssion","","False","33","","{}","Hey guys! I have some learning to do and was hoping to get some advice here. I started talking to a boy, for about a month now. We have decided not to have sex until we are official. Which I'm OK with for the following reason: he has a 10 inch baby anaconda in his pants.

While I'm a vers bottom, I'm no power bottom by any means. How the actual fuck will it get in there? A girl friend of mine told me to try numbing lube. She gave her boyfriend the backdoor entrance for his birthday recently, and that was her preperation. Until then I never knew such a thing existed.

I anticipate him and I to be official and I want him to...well...fuck my brains out, and me to survive another day. Any advice??? Thanks!!","&lt;!-- SC_OFF --&gt;&lt;div class=""md""&gt;&lt;p&gt;Hey guys! I have some learning to do and was hoping to get some advice here. I started talking to a boy, for about a month now. We have decided not to have sex until we are official. Which I&amp;#39;m OK with for the following reason: he has a 10 inch baby anaconda in his pants.&lt;/p&gt;

&lt;p&gt;While I&amp;#39;m a vers bottom, I&amp;#39;m no power bottom by any means. How the actual fuck will it get in there? A girl friend of mine told me to try numbing lube. She gave her boyfriend the backdoor entrance for his birthday recently, and that was her preperation. Until then I never knew such a thing existed.&lt;/p&gt;

&lt;p&gt;I anticipate him and I to be official and I want him to...well...fuck my brains out, and me to survive another day. Any advice??? Thanks!!&lt;/p&gt;
&lt;/div&gt;&lt;!-- SC_ON --&gt;","False","askgaybros","t5_2vgfw","","","It's 10 inches...","33","http://www.reddit.com/r/askgaybros/comments/2ubi39/its_10_inches/","[]","False"
