"","_comment_sort","_comments","_comments_by_id","_info_url","_orphaned","_params","_replaced_more","_underscore_names","approved_by","archived","author","author_flair_css_class","author_flair_text","banned_by","clicked","created","created_utc","distinguished","domain","downs","edited","gilded","has_fetched","hidden","id","is_self","json_dict","likes","link_flair_css_class","link_flair_text","media","media_embed","mod_reports","name","num_comments","num_reports","over_18","permalink","reddit_session","report_reasons","saved","score","secure_media","secure_media_embed","selftext","selftext_html","stickied","subreddit","subreddit_id","suggested_sort","thumbnail","title","ups","url","user_reports","visited"
"32","","","{}","http://www.reddit.com/api/info/","{}","{}","False","","","False","DrMcIntire","","","","False","1421172553.0","1421172553.0","","self.askgaybros","0","1421173243.0","0","True","False","2say94","True","","","","","","{}","[]","t3_2say94","19","","False","http://www.reddit.com/r/askgaybros/comments/2say94/anyone_ever_been_in_love_with_your_best_gaybro/","Unauthenticated reddit sesssion","","False","17","","{}","Just happened to me today. I was cool with him knowing I loved him. We tried dating, and it didn't work. But, he just ""made it official"" with someone this morning and I feel incredibly sad about it. I think my worries are stupid - that this guy will be jealous of me and try to hurt our relationship, that my best friend won't have as much time for/with me and that he'll talk incessantly about this new guy and text him the whole time we are together, etc. What if I don't like the guy and can't hide it no matter how hard I try? 

Sorry - just looking for any advice, thoughts, etc from anyone who has been there.

The ""best friend zone"" I guess. ","&lt;!-- SC_OFF --&gt;&lt;div class=""md""&gt;&lt;p&gt;Just happened to me today. I was cool with him knowing I loved him. We tried dating, and it didn&amp;#39;t work. But, he just &amp;quot;made it official&amp;quot; with someone this morning and I feel incredibly sad about it. I think my worries are stupid - that this guy will be jealous of me and try to hurt our relationship, that my best friend won&amp;#39;t have as much time for/with me and that he&amp;#39;ll talk incessantly about this new guy and text him the whole time we are together, etc. What if I don&amp;#39;t like the guy and can&amp;#39;t hide it no matter how hard I try? &lt;/p&gt;

&lt;p&gt;Sorry - just looking for any advice, thoughts, etc from anyone who has been there.&lt;/p&gt;

&lt;p&gt;The &amp;quot;best friend zone&amp;quot; I guess. &lt;/p&gt;
&lt;/div&gt;&lt;!-- SC_ON --&gt;","False","askgaybros","t5_2vgfw","","","Anyone ever been in love with your best gaybro, not had it reciprocated, and felt depressed when he started dating someone seriously?","17","http://www.reddit.com/r/askgaybros/comments/2say94/anyone_ever_been_in_love_with_your_best_gaybro/","[]","False"
"33","","","{}","http://www.reddit.com/api/info/","{}","{}","False","","","False","parabalo","","","","False","1421168142.0","1421168142.0","","self.askgaybros","0","False","0","True","False","2saoi8","True","","","","","","{}","[]","t3_2saoi8","34","","False","http://www.reddit.com/r/askgaybros/comments/2saoi8/ways_to_meet_other_gaybros/","Unauthenticated reddit sesssion","","False","1","","{}","Lately, I've been looking for other gaybros to hang around with since all of the straight guys in my life are completely useless to talk about gay things with :P Any advice on how to meet other gaybros for a college student? ","&lt;!-- SC_OFF --&gt;&lt;div class=""md""&gt;&lt;p&gt;Lately, I&amp;#39;ve been looking for other gaybros to hang around with since all of the straight guys in my life are completely useless to talk about gay things with :P Any advice on how to meet other gaybros for a college student? &lt;/p&gt;
&lt;/div&gt;&lt;!-- SC_ON --&gt;","False","askgaybros","t5_2vgfw","","","Ways to meet other gaybros?","1","http://www.reddit.com/r/askgaybros/comments/2saoi8/ways_to_meet_other_gaybros/","[]","False"
"34","","","{}","http://www.reddit.com/api/info/","{}","{}","False","","","False","Laika_Come_Home","","","","False","1421167437.0","1421167437.0","","self.askgaybros","0","False","0","True","False","2samy9","True","","","","","","{}","[]","t3_2samy9","107","","False","http://www.reddit.com/r/askgaybros/comments/2samy9/realistically_how_do_i_get_over_being_jaded_as_a/","Unauthenticated reddit sesssion","","False","26","","{}","I get it, a lot of people have their preferences or assumptions about me, and won't give me the time of day,  because of the amount of melanin in my skin. I can't change that, and I realize that it makes dating for me an uphill battle. It's depressing.

But, how do I get over it?","&lt;!-- SC_OFF --&gt;&lt;div class=""md""&gt;&lt;p&gt;I get it, a lot of people have their preferences or assumptions about me, and won&amp;#39;t give me the time of day,  because of the amount of melanin in my skin. I can&amp;#39;t change that, and I realize that it makes dating for me an uphill battle. It&amp;#39;s depressing.&lt;/p&gt;

&lt;p&gt;But, how do I get over it?&lt;/p&gt;
&lt;/div&gt;&lt;!-- SC_ON --&gt;","False","askgaybros","t5_2vgfw","","","Realistically, how do I get over being jaded as a black guy in the gay dating world?","26","http://www.reddit.com/r/askgaybros/comments/2samy9/realistically_how_do_i_get_over_being_jaded_as_a/","[]","False"
"35","","","{}","http://www.reddit.com/api/info/","{}","{}","False","","","False","_wildstrawberries","","","","False","1421167205.0","1421167205.0","","self.askgaybros","0","False","0","True","False","2samfe","True","","","","","","{}","[]","t3_2samfe","10","","False","http://www.reddit.com/r/askgaybros/comments/2samfe/i_dont_know_how_to_be_a_person/","Unauthenticated reddit sesssion","","False","7","","{}","Sorry about the ambiguous and existential question but it's how I feel.
What makes you a person? Your interests? Your friends? I feel like I don't have any, that I only steal from and imitate people. And friends I don't have because I never learned how to talk to people because I was shy and awkward. Now I have social phobia and it's even harder, to the point where I've almost given up. Why would people be interested in me? My ex boyfriend once told me he felt like I was imitating him and that he didn't like it, that he wasn't a good role model for me and cut contact. But I've always added things I like in other people to myself before but if that isn't okay and makes people mad what is? What are things that I can call my own then? The only thing that I can think of that makes me a person are my anxieties, my depression, my low self esteem and self hate. I hate it when people tell me to be myself because I have no idea who I am. It feels like with every person I meet I try to be like them. It's so very confusing. I don't know how to be a person and I don't understand life. I really hope this was coherent enough for you to understand, I'm not good at expressing myself at all. Please help !","&lt;!-- SC_OFF --&gt;&lt;div class=""md""&gt;&lt;p&gt;Sorry about the ambiguous and existential question but it&amp;#39;s how I feel.
What makes you a person? Your interests? Your friends? I feel like I don&amp;#39;t have any, that I only steal from and imitate people. And friends I don&amp;#39;t have because I never learned how to talk to people because I was shy and awkward. Now I have social phobia and it&amp;#39;s even harder, to the point where I&amp;#39;ve almost given up. Why would people be interested in me? My ex boyfriend once told me he felt like I was imitating him and that he didn&amp;#39;t like it, that he wasn&amp;#39;t a good role model for me and cut contact. But I&amp;#39;ve always added things I like in other people to myself before but if that isn&amp;#39;t okay and makes people mad what is? What are things that I can call my own then? The only thing that I can think of that makes me a person are my anxieties, my depression, my low self esteem and self hate. I hate it when people tell me to be myself because I have no idea who I am. It feels like with every person I meet I try to be like them. It&amp;#39;s so very confusing. I don&amp;#39;t know how to be a person and I don&amp;#39;t understand life. I really hope this was coherent enough for you to understand, I&amp;#39;m not good at expressing myself at all. Please help !&lt;/p&gt;
&lt;/div&gt;&lt;!-- SC_ON --&gt;","False","askgaybros","t5_2vgfw","","","I don't know how to be a person","7","http://www.reddit.com/r/askgaybros/comments/2samfe/i_dont_know_how_to_be_a_person/","[]","False"
"36","","","{}","http://www.reddit.com/api/info/","{}","{}","False","","","False","ringrill","","","","False","1421167123.0","1421167123.0","","self.askgaybros","0","False","0","True","False","2sam9a","True","","","","","","{}","[]","t3_2sam9a","5","","False","http://www.reddit.com/r/askgaybros/comments/2sam9a/advice_on_how_to_proceed/","Unauthenticated reddit sesssion","","False","6","","{}","Hey guys, so story time: when i was 20 I fell madly in love with a straight guy, the way you do when you are young. He was everything to me, I felt so close to him - he was the only person that i ever felt truly comfortable around; nothing ever happened between us and he moved away and we lost contact. 

He popped up a few times in the next thirteen years, always when i least expected it and always managed to mess my head for a while. Throughout all my experiences since he has always been in the background of my mind. Even through some emotionally turbulent and intense relationships, his memory still lingered.

So last Monday (eight days ago) i had an email saying he would be in town for the weekend and wanted to know if i fancied dinner. My logical side said 'stay away' but the heart took over and i agreed to meet him, accepting the inevitably head fuck that would surly follow. I won't bore you with details of the dinner, but essentially, he came out to me. After a rather surreal chat, long story short, we went back to mine and had the best sex i have ever had for about six hours (that is a long time for me!). It was fun, it was natural, there was no embarrassment; at times tender, intense and funny!

And now he has left again and I am feeling like a love-sick teenager. I am so terrified of getting hurt, and with the strength of my feelings it is a definite possibility - but i think part of my problem is I don't pursue guys. Not wanting to sound boo-hoo and all that shit, but I can't see why someone would want me, and i don't want to turn into some psycho stalker. 

Bros, don't want to lose something because i am scared, but i don't want to fuck my head up.

Sorry for the long winded story!
","&lt;!-- SC_OFF --&gt;&lt;div class=""md""&gt;&lt;p&gt;Hey guys, so story time: when i was 20 I fell madly in love with a straight guy, the way you do when you are young. He was everything to me, I felt so close to him - he was the only person that i ever felt truly comfortable around; nothing ever happened between us and he moved away and we lost contact. &lt;/p&gt;

&lt;p&gt;He popped up a few times in the next thirteen years, always when i least expected it and always managed to mess my head for a while. Throughout all my experiences since he has always been in the background of my mind. Even through some emotionally turbulent and intense relationships, his memory still lingered.&lt;/p&gt;

&lt;p&gt;So last Monday (eight days ago) i had an email saying he would be in town for the weekend and wanted to know if i fancied dinner. My logical side said &amp;#39;stay away&amp;#39; but the heart took over and i agreed to meet him, accepting the inevitably head fuck that would surly follow. I won&amp;#39;t bore you with details of the dinner, but essentially, he came out to me. After a rather surreal chat, long story short, we went back to mine and had the best sex i have ever had for about six hours (that is a long time for me!). It was fun, it was natural, there was no embarrassment; at times tender, intense and funny!&lt;/p&gt;

&lt;p&gt;And now he has left again and I am feeling like a love-sick teenager. I am so terrified of getting hurt, and with the strength of my feelings it is a definite possibility - but i think part of my problem is I don&amp;#39;t pursue guys. Not wanting to sound boo-hoo and all that shit, but I can&amp;#39;t see why someone would want me, and i don&amp;#39;t want to turn into some psycho stalker. &lt;/p&gt;

&lt;p&gt;Bros, don&amp;#39;t want to lose something because i am scared, but i don&amp;#39;t want to fuck my head up.&lt;/p&gt;

&lt;p&gt;Sorry for the long winded story!&lt;/p&gt;
&lt;/div&gt;&lt;!-- SC_ON --&gt;","False","askgaybros","t5_2vgfw","","","Advice on how to proceed.","6","http://www.reddit.com/r/askgaybros/comments/2sam9a/advice_on_how_to_proceed/","[]","False"
"37","","","{}","http://www.reddit.com/api/info/","{}","{}","False","","","False","WlTCH","","","","False","1421166162.0","1421166162.0","","self.askgaybros","0","False","0","True","False","2sak5m","True","","","","","","{}","[]","t3_2sak5m","16","","False","http://www.reddit.com/r/askgaybros/comments/2sak5m/i_find_sex_too_boring/","Unauthenticated reddit sesssion","","False","17","","{}","I enjoy fooling around with my boyfriend, kissing, touching, even just cuddling. But sex is sooo boring... I don't think it's just him, I just feel like I'm wasting too much time. Does it happen to anybody else? How can I make it less boring? For example, blowjobs take too fucking long.","&lt;!-- SC_OFF --&gt;&lt;div class=""md""&gt;&lt;p&gt;I enjoy fooling around with my boyfriend, kissing, touching, even just cuddling. But sex is sooo boring... I don&amp;#39;t think it&amp;#39;s just him, I just feel like I&amp;#39;m wasting too much time. Does it happen to anybody else? How can I make it less boring? For example, blowjobs take too fucking long.&lt;/p&gt;
&lt;/div&gt;&lt;!-- SC_ON --&gt;","False","askgaybros","t5_2vgfw","","","I find sex too boring...","17","http://www.reddit.com/r/askgaybros/comments/2sak5m/i_find_sex_too_boring/","[]","False"
