"","_comment_sort","_comments","_comments_by_id","_info_url","_orphaned","_params","_replaced_more","_underscore_names","approved_by","archived","author","author_flair_css_class","author_flair_text","banned_by","clicked","created","created_utc","distinguished","domain","downs","edited","gilded","has_fetched","hidden","id","is_self","json_dict","likes","link_flair_css_class","link_flair_text","media","media_embed","mod_reports","name","num_comments","num_reports","over_18","permalink","reddit_session","report_reasons","saved","score","secure_media","secure_media_embed","selftext","selftext_html","stickied","subreddit","subreddit_id","suggested_sort","thumbnail","title","ups","url","user_reports","visited"
"28","","","{}","http://www.reddit.com/api/info/","{}","{}","False","","","False","ihatebrucejackson","","","","False","1428093932.0","1428090332.0","","self.askgaybros","0","False","0","True","False","31cfpa","True","","","","","","{}","[]","t3_31cfpa","48","","False","http://www.reddit.com/r/askgaybros/comments/31cfpa/anyone_else_into_public_sex/","Unauthenticated reddit sesssion","","False","51","","{}","I think the biggest turn on for me is dropping to my knees in public and blowing off a hot guy. Nothing hotter then blowing them off in public and having them slide right in you.

I DO IT ALMOST ALL THE TIME. Is anyone else turned on ?","&lt;!-- SC_OFF --&gt;&lt;div class=""md""&gt;&lt;p&gt;I think the biggest turn on for me is dropping to my knees in public and blowing off a hot guy. Nothing hotter then blowing them off in public and having them slide right in you.&lt;/p&gt;

&lt;p&gt;I DO IT ALMOST ALL THE TIME. Is anyone else turned on ?&lt;/p&gt;
&lt;/div&gt;&lt;!-- SC_ON --&gt;","False","askgaybros","t5_2vgfw","","","Anyone else into Public Sex?","51","http://www.reddit.com/r/askgaybros/comments/31cfpa/anyone_else_into_public_sex/","[]","False"
"29","","","{}","http://www.reddit.com/api/info/","{}","{}","False","","","False","ColdestWintersChill","","","","False","1428093852.0","1428090252.0","","self.askgaybros","0","False","0","True","False","31cfiq","True","","","","","","{}","[]","t3_31cfiq","25","","False","http://www.reddit.com/r/askgaybros/comments/31cfiq/should_i_shave_my_backshoulder_hairdoes_it_matter/","Unauthenticated reddit sesssion","","False","5","","{}","I'm just curious. It's bothered me forever, it's not super bad but I still find it repulsive","&lt;!-- SC_OFF --&gt;&lt;div class=""md""&gt;&lt;p&gt;I&amp;#39;m just curious. It&amp;#39;s bothered me forever, it&amp;#39;s not super bad but I still find it repulsive&lt;/p&gt;
&lt;/div&gt;&lt;!-- SC_ON --&gt;","False","askgaybros","t5_2vgfw","","","Should I shave my back/shoulder hair/does it matter to gaybros in general?","5","http://www.reddit.com/r/askgaybros/comments/31cfiq/should_i_shave_my_backshoulder_hairdoes_it_matter/","[]","False"
"30","","","{}","http://www.reddit.com/api/info/","{}","{}","False","","","False","thrwawaynewadvce","","","","False","1428089962.0","1428086362.0","","self.askgaybros","0","1428088121.0","0","True","False","31c6q5","True","","","","","","{}","[]","t3_31c6q5","18","","False","http://www.reddit.com/r/askgaybros/comments/31c6q5/looking_for_advice_on_topping_staying_hard/","Unauthenticated reddit sesssion","","False","6","","{}","I don't have a lot of experience topping, and I've read a lot of the threads on here. They've helped a lot so far. So thanks for that. But I guess I'm still struggling. Aside from continuing to practice and mess around, I was hoping there was something more I could do. 

1. I tend to lose my erection whenever I put a condom on. Or I can only keep it for like a minute or two before I get soft again. I've tried different condoms. I've tried masturbating with condoms, but I'm just having trouble getting used to it. I think part of it is that I tend to be pretty sensitive and get off pretty easily to slight touches. But when I put a condom on, I don't feel anything. (I'm very average, so I don't think it's a size issue.) Probably just due to what I'm used to feeling. Would a cock ring help?

2. I have trouble getting it in. I'm sure I'll get better with experience, and the guy I'm seeing now is great at communicating which is fucking awesome. But just in the moment, I feel like I can't enjoy myself because I'm just so focused on the mechanics of it. Trying to stay hard. I feel awkward, like I can't really take control or get into it. Can't get off or enjoy myself. (Which is all he wants from me really.)

 Any advice on how to stay in the moment? My last relationship fizzled out due to bad sex. So I'm a little sensitive to this. I've done a good job keeping it light and having fun so far... 

3. How do you guys feel about rubbing the tip of your dick against a guy's anus? Kind of like using the tip to massage the anus a bit. I like it, but if I'm honest, it also scares me because it feels like it could very easily lead into unprotected anal sex if you just take things a bit too far. I've read some things online saying it's [relatively safe](http://www.thebody.com/Forums/AIDS/SafeSex/Q201699.html), but I'm still thinking maybe I shouldn't be doing it. I have this anxiety about it. Figured I'd get some /r/askgaybros opinions before I talk with him about it again.  ","&lt;!-- SC_OFF --&gt;&lt;div class=""md""&gt;&lt;p&gt;I don&amp;#39;t have a lot of experience topping, and I&amp;#39;ve read a lot of the threads on here. They&amp;#39;ve helped a lot so far. So thanks for that. But I guess I&amp;#39;m still struggling. Aside from continuing to practice and mess around, I was hoping there was something more I could do. &lt;/p&gt;

&lt;ol&gt;
&lt;li&gt;&lt;p&gt;I tend to lose my erection whenever I put a condom on. Or I can only keep it for like a minute or two before I get soft again. I&amp;#39;ve tried different condoms. I&amp;#39;ve tried masturbating with condoms, but I&amp;#39;m just having trouble getting used to it. I think part of it is that I tend to be pretty sensitive and get off pretty easily to slight touches. But when I put a condom on, I don&amp;#39;t feel anything. (I&amp;#39;m very average, so I don&amp;#39;t think it&amp;#39;s a size issue.) Probably just due to what I&amp;#39;m used to feeling. Would a cock ring help?&lt;/p&gt;&lt;/li&gt;
&lt;li&gt;&lt;p&gt;I have trouble getting it in. I&amp;#39;m sure I&amp;#39;ll get better with experience, and the guy I&amp;#39;m seeing now is great at communicating which is fucking awesome. But just in the moment, I feel like I can&amp;#39;t enjoy myself because I&amp;#39;m just so focused on the mechanics of it. Trying to stay hard. I feel awkward, like I can&amp;#39;t really take control or get into it. Can&amp;#39;t get off or enjoy myself. (Which is all he wants from me really.)&lt;/p&gt;

&lt;p&gt;Any advice on how to stay in the moment? My last relationship fizzled out due to bad sex. So I&amp;#39;m a little sensitive to this. I&amp;#39;ve done a good job keeping it light and having fun so far... &lt;/p&gt;&lt;/li&gt;
&lt;li&gt;&lt;p&gt;How do you guys feel about rubbing the tip of your dick against a guy&amp;#39;s anus? Kind of like using the tip to massage the anus a bit. I like it, but if I&amp;#39;m honest, it also scares me because it feels like it could very easily lead into unprotected anal sex if you just take things a bit too far. I&amp;#39;ve read some things online saying it&amp;#39;s &lt;a href=""http://www.thebody.com/Forums/AIDS/SafeSex/Q201699.html""&gt;relatively safe&lt;/a&gt;, but I&amp;#39;m still thinking maybe I shouldn&amp;#39;t be doing it. I have this anxiety about it. Figured I&amp;#39;d get some &lt;a href=""/r/askgaybros""&gt;/r/askgaybros&lt;/a&gt; opinions before I talk with him about it again.  &lt;/p&gt;&lt;/li&gt;
&lt;/ol&gt;
&lt;/div&gt;&lt;!-- SC_ON --&gt;","False","askgaybros","t5_2vgfw","","","Looking for advice on topping, staying hard, condoms and learning to get off to different sensations","6","http://www.reddit.com/r/askgaybros/comments/31c6q5/looking_for_advice_on_topping_staying_hard/","[]","False"
"31","","","{}","http://www.reddit.com/api/info/","{}","{}","False","","","False","haolebrah","","","","False","1428088260.0","1428084660.0","","self.askgaybros","0","False","0","True","False","31c2so","True","","","","","","{}","[]","t3_31c2so","11","","False","http://www.reddit.com/r/askgaybros/comments/31c2so/two_dates_in_when_and_how_should_i_bring_up_my/","Unauthenticated reddit sesssion","","False","18","","{}","TL;DR the title.

I'm 23, and have been out for less than a year. I finally gathered the confidence to try OKC a few months ago. Went on a few dates that didn't go anywhere. Struggled to find anyone I was that into and was just about ready to give up for a while, when suddenly ""G"" likes me. 

He's super handsome and more importantly seems like a great match personality-wise so I like him back and start a conversation. We hit it off, chat over the weekend, and start texting daily. We go on a drunken/stoned whirlwind of a date the following weekend and have a great time (from what we can each remember lol). The texting continues and gets quite flirty, and we go on another date the following Thursday (last night). We smoke but stay much more sober this time, and still make good conversation and have a really enjoyable night. We've had nothing but a couple of warm hugs at this point, but I like this guy a lot--really the first time I've felt this way about anyone. G also tipsily admitted over text that he had a crush on me a couple nights ago, which totally made me smile. I responded honestly, telling him the same.

Here's the rub: At dinner last night G casually mentioned a couple exes, Grindr, Scruff, gay bars, etc. Which are obviously totally cool, normal conversation topics. He didn't ask me anything about that stuff directly so all I really said is I never went the app route and only tried OKC. Otherwise I kinda clammed up, and I haven't been able to stop thinking about it since. I've never hooked up, never been to a gay bar, never had a relationship (other than an extremely awkward two weeks with a female friend years ago), and haven't even done so much as hold a guy's hand, at 23 years old. Whereas G clearly has been out a lot longer and has had a lot more experience, being only a year older. Which if anything, makes me even more attracted to him--his confidence and the idea that he knows what he's doing and could kinda show me the ropes, if he's up for that.

We've made plans to hang out again, and I'd really appreciate my gaybros' take: when and how should I bring up the fact that even though I initiated things, I actually have NO idea what I'm doing?","&lt;!-- SC_OFF --&gt;&lt;div class=""md""&gt;&lt;p&gt;TL;DR the title.&lt;/p&gt;

&lt;p&gt;I&amp;#39;m 23, and have been out for less than a year. I finally gathered the confidence to try OKC a few months ago. Went on a few dates that didn&amp;#39;t go anywhere. Struggled to find anyone I was that into and was just about ready to give up for a while, when suddenly &amp;quot;G&amp;quot; likes me. &lt;/p&gt;

&lt;p&gt;He&amp;#39;s super handsome and more importantly seems like a great match personality-wise so I like him back and start a conversation. We hit it off, chat over the weekend, and start texting daily. We go on a drunken/stoned whirlwind of a date the following weekend and have a great time (from what we can each remember lol). The texting continues and gets quite flirty, and we go on another date the following Thursday (last night). We smoke but stay much more sober this time, and still make good conversation and have a really enjoyable night. We&amp;#39;ve had nothing but a couple of warm hugs at this point, but I like this guy a lot--really the first time I&amp;#39;ve felt this way about anyone. G also tipsily admitted over text that he had a crush on me a couple nights ago, which totally made me smile. I responded honestly, telling him the same.&lt;/p&gt;

&lt;p&gt;Here&amp;#39;s the rub: At dinner last night G casually mentioned a couple exes, Grindr, Scruff, gay bars, etc. Which are obviously totally cool, normal conversation topics. He didn&amp;#39;t ask me anything about that stuff directly so all I really said is I never went the app route and only tried OKC. Otherwise I kinda clammed up, and I haven&amp;#39;t been able to stop thinking about it since. I&amp;#39;ve never hooked up, never been to a gay bar, never had a relationship (other than an extremely awkward two weeks with a female friend years ago), and haven&amp;#39;t even done so much as hold a guy&amp;#39;s hand, at 23 years old. Whereas G clearly has been out a lot longer and has had a lot more experience, being only a year older. Which if anything, makes me even more attracted to him--his confidence and the idea that he knows what he&amp;#39;s doing and could kinda show me the ropes, if he&amp;#39;s up for that.&lt;/p&gt;

&lt;p&gt;We&amp;#39;ve made plans to hang out again, and I&amp;#39;d really appreciate my gaybros&amp;#39; take: when and how should I bring up the fact that even though I initiated things, I actually have NO idea what I&amp;#39;m doing?&lt;/p&gt;
&lt;/div&gt;&lt;!-- SC_ON --&gt;","False","askgaybros","t5_2vgfw","","","Two dates in... when and how should I bring up my complete lack of experience?","18","http://www.reddit.com/r/askgaybros/comments/31c2so/two_dates_in_when_and_how_should_i_bring_up_my/","[]","False"
"32","","","{}","http://www.reddit.com/api/info/","{}","{}","False","","","False","987guy","","","","False","1428087599.0","1428083999.0","","self.askgaybros","0","1428085407.0","0","True","False","31c190","True","","","","","","{}","[]","t3_31c190","16","","False","http://www.reddit.com/r/askgaybros/comments/31c190/need_some_advice_or_good_vibes_man/","Unauthenticated reddit sesssion","","False","3","","{}","Recently I've addressed my sexuality as Bi-sexual after a long period of confusion. At times I actually feel as if I'm gay. It's just been really fucking my head up. In school (im 18) everyone sees me as like an alpha tough guy and admittedly I am. Not even like a pseudo masculinity, I just am an overtly masculine guy by nature. 

I really just don't know what to do, girls and guys alike have shown interest in me and I just feel so lonely and fucked all the time. I've always have had issues with depression and at a certain point drugs and this gay thing just seems like another issue. I'm also leaving for the Marine Corp as well soon and I'm just so paranoid about someone I 
know reading this. 

Well I don't even know what to say but I hope you guys can read this since I wrote this on my iPhone. Ahh fuck my life, but any advice?.....","&lt;!-- SC_OFF --&gt;&lt;div class=""md""&gt;&lt;p&gt;Recently I&amp;#39;ve addressed my sexuality as Bi-sexual after a long period of confusion. At times I actually feel as if I&amp;#39;m gay. It&amp;#39;s just been really fucking my head up. In school (im 18) everyone sees me as like an alpha tough guy and admittedly I am. Not even like a pseudo masculinity, I just am an overtly masculine guy by nature. &lt;/p&gt;

&lt;p&gt;I really just don&amp;#39;t know what to do, girls and guys alike have shown interest in me and I just feel so lonely and fucked all the time. I&amp;#39;ve always have had issues with depression and at a certain point drugs and this gay thing just seems like another issue. I&amp;#39;m also leaving for the Marine Corp as well soon and I&amp;#39;m just so paranoid about someone I 
know reading this. &lt;/p&gt;

&lt;p&gt;Well I don&amp;#39;t even know what to say but I hope you guys can read this since I wrote this on my iPhone. Ahh fuck my life, but any advice?.....&lt;/p&gt;
&lt;/div&gt;&lt;!-- SC_ON --&gt;","False","askgaybros","t5_2vgfw","","","Need some advice or good vibes man....","3","http://www.reddit.com/r/askgaybros/comments/31c190/need_some_advice_or_good_vibes_man/","[]","False"
"33","","","{}","http://www.reddit.com/api/info/","{}","{}","False","","","False","shing93","","","","False","1428086455.0","1428082855.0","","self.askgaybros","0","False","0","True","False","31bygi","True","","","","","","{}","[]","t3_31bygi","46","","False","http://www.reddit.com/r/askgaybros/comments/31bygi/if_your_a_top_what_do_you_like_best_about_topping/","Unauthenticated reddit sesssion","","False","23","","{}","","","False","askgaybros","t5_2vgfw","","","If your a top, what do you like best about topping &amp; if you a bottom what do you like best about bottoming?","23","http://www.reddit.com/r/askgaybros/comments/31bygi/if_your_a_top_what_do_you_like_best_about_topping/","[]","False"
"34","","","{}","http://www.reddit.com/api/info/","{}","{}","False","","","False","gary1995","","","","False","1428084601.0","1428081001.0","","self.askgaybros","0","False","0","True","False","31bu4b","True","","","","","","{}","[]","t3_31bu4b","10","","False","http://www.reddit.com/r/askgaybros/comments/31bu4b/best_gay_clubs_in_london/","Unauthenticated reddit sesssion","","False","2","","{}","I'm horny as hell not had sex in about 3 months lol ","&lt;!-- SC_OFF --&gt;&lt;div class=""md""&gt;&lt;p&gt;I&amp;#39;m horny as hell not had sex in about 3 months lol &lt;/p&gt;
&lt;/div&gt;&lt;!-- SC_ON --&gt;","False","askgaybros","t5_2vgfw","","","Best gay clubs in London?","2","http://www.reddit.com/r/askgaybros/comments/31bu4b/best_gay_clubs_in_london/","[]","False"
"35","","","{}","http://www.reddit.com/api/info/","{}","{}","False","","","False","digital-wolf","","","","False","1428083883.0","1428080283.0","","self.askgaybros","0","False","0","True","False","31bsg9","True","","","","","","{}","[]","t3_31bsg9","25","","False","http://www.reddit.com/r/askgaybros/comments/31bsg9/update_it_was_me/","Unauthenticated reddit sesssion","","False","5","","{}","Update to the previous
http://www.reddit.com/r/askgaybros/comments/30qf1b/is_it_me/.compact

Thanks so much for all of the suggestions and different viewpoints. We've talked it through a little bit more. 

In his opinion everything comes back to me - I'm constantly down and depressed and it's making him frustrated and unhappy leading to the violence. 

We are clearly not both giving it 100% but at this point I may be the only one trying or willing to get help and accept blame. 

I can empathise and being with some one like me with mental health issues and a physical disability (deaf) can be a struggle. 

Still going to give it my best shot. 

Has anyone got any tips for bringing up difficult topics ofconversation? ","&lt;!-- SC_OFF --&gt;&lt;div class=""md""&gt;&lt;p&gt;Update to the previous
&lt;a href=""http://www.reddit.com/r/askgaybros/comments/30qf1b/is_it_me/.compact""&gt;http://www.reddit.com/r/askgaybros/comments/30qf1b/is_it_me/.compact&lt;/a&gt;&lt;/p&gt;

&lt;p&gt;Thanks so much for all of the suggestions and different viewpoints. We&amp;#39;ve talked it through a little bit more. &lt;/p&gt;

&lt;p&gt;In his opinion everything comes back to me - I&amp;#39;m constantly down and depressed and it&amp;#39;s making him frustrated and unhappy leading to the violence. &lt;/p&gt;

&lt;p&gt;We are clearly not both giving it 100% but at this point I may be the only one trying or willing to get help and accept blame. &lt;/p&gt;

&lt;p&gt;I can empathise and being with some one like me with mental health issues and a physical disability (deaf) can be a struggle. &lt;/p&gt;

&lt;p&gt;Still going to give it my best shot. &lt;/p&gt;

&lt;p&gt;Has anyone got any tips for bringing up difficult topics ofconversation? &lt;/p&gt;
&lt;/div&gt;&lt;!-- SC_ON --&gt;","False","askgaybros","t5_2vgfw","","","Update. It was me.","5","http://www.reddit.com/r/askgaybros/comments/31bsg9/update_it_was_me/","[]","False"
"36","","","{}","http://www.reddit.com/api/info/","{}","{}","False","","","False","guy3052","","","","False","1428081368.0","1428077768.0","","self.askgaybros","0","1428077960.0","0","True","False","31bml1","True","","","","","","{}","[]","t3_31bml1","7","","False","http://www.reddit.com/r/askgaybros/comments/31bml1/whats_wrong_with_me/","Unauthenticated reddit sesssion","","False","3","","{}","I am a 27-year-old guy. Professional job, educated, good family, and (from what others say) pretty decent looking. A bit concerned because for the past year or more I have had little to no interest in making friends, going on dates or initiating hang outs. In general, the idea of it all seems a bit boring. 

My concerns thickens, because what I am in fact ALWAYS interested in is having sexual encounters. I'm on Grindr constantly trying to find hook ups. Lots of guys have asked to go on a date. My mind just kinda says, ""waste of time"".
I seem to never want to let myself invest in people because I feel like somehow I'll end up getting hurt (I'm a very sensitive guy). 

I've always been one to want instant gratification. I really dislike that about myself. While I'm a very amicable and caring person face to face, friendships have never been my strong point. While I'm upbeat and friendly I'm also very sarcastic and have dry humor. People often think I'm a bitch. I have over 1,000 Facebook friends and hang out with none of them.

I never had a true super ""slutty period"" in life. I've always fooled around with guys, but never aggressively went seeking it like I'm doing now. Is there something wrong with me that I need to address promptly? Am I just a sign of the times? Is this just a phase that will pass? Hormones perhaps?","&lt;!-- SC_OFF --&gt;&lt;div class=""md""&gt;&lt;p&gt;I am a 27-year-old guy. Professional job, educated, good family, and (from what others say) pretty decent looking. A bit concerned because for the past year or more I have had little to no interest in making friends, going on dates or initiating hang outs. In general, the idea of it all seems a bit boring. &lt;/p&gt;

&lt;p&gt;My concerns thickens, because what I am in fact ALWAYS interested in is having sexual encounters. I&amp;#39;m on Grindr constantly trying to find hook ups. Lots of guys have asked to go on a date. My mind just kinda says, &amp;quot;waste of time&amp;quot;.
I seem to never want to let myself invest in people because I feel like somehow I&amp;#39;ll end up getting hurt (I&amp;#39;m a very sensitive guy). &lt;/p&gt;

&lt;p&gt;I&amp;#39;ve always been one to want instant gratification. I really dislike that about myself. While I&amp;#39;m a very amicable and caring person face to face, friendships have never been my strong point. While I&amp;#39;m upbeat and friendly I&amp;#39;m also very sarcastic and have dry humor. People often think I&amp;#39;m a bitch. I have over 1,000 Facebook friends and hang out with none of them.&lt;/p&gt;

&lt;p&gt;I never had a true super &amp;quot;slutty period&amp;quot; in life. I&amp;#39;ve always fooled around with guys, but never aggressively went seeking it like I&amp;#39;m doing now. Is there something wrong with me that I need to address promptly? Am I just a sign of the times? Is this just a phase that will pass? Hormones perhaps?&lt;/p&gt;
&lt;/div&gt;&lt;!-- SC_ON --&gt;","False","askgaybros","t5_2vgfw","","","Whats Wrong With Me?","3","http://www.reddit.com/r/askgaybros/comments/31bml1/whats_wrong_with_me/","[]","False"
