"","_comment_sort","_comments","_comments_by_id","_info_url","_orphaned","_params","_replaced_more","_underscore_names","approved_by","archived","author","author_flair_css_class","author_flair_text","banned_by","clicked","created","created_utc","distinguished","domain","downs","edited","gilded","has_fetched","hidden","id","is_self","json_dict","likes","link_flair_css_class","link_flair_text","media","media_embed","mod_reports","name","num_comments","num_reports","over_18","permalink","reddit_session","report_reasons","saved","score","secure_media","secure_media_embed","selftext","selftext_html","stickied","subreddit","subreddit_id","suggested_sort","thumbnail","title","ups","url","user_reports","visited"
"5","","","{}","http://www.reddit.com/api/info/","{}","{}","False","","","False","Drunkenscot","","","","False","1415538329.0","1415538329.0","","self.askgaybros","0","False","0","True","False","2lrbs3","True","","","","","","{}","[]","t3_2lrbs3","12","","False","http://www.reddit.com/r/askgaybros/comments/2lrbs3/online_dating_is_there_a_24_hour_rule/","Unauthenticated reddit sesssion","","False","12","","{}","I keep running into the same problem again and again and it's starting to make me really paranoid. Basically I'll start talking to someone on an app (grindr, Tindr etc) and we both make it clear we are there for more than just casual sex (yes grindr is the wrong place to look for relationships, I know). 

With a few guys we've really hit it off, talk for hours straight, exchange numbers and text. There's very clear talk about meeting up for a date but nothing is specifically arranged.

Now for the problem, it gets late and we go to bed and by the time I wake up again I get nothing back from them. Consistently they will suddenly just send one word answers or ignore my texts altogether with no explanation. 

I'm at the stage of wanting to give up altogether because this is getting ridiculous. Have you guys experienced this or know what I'm doing wrong?","&lt;!-- SC_OFF --&gt;&lt;div class=""md""&gt;&lt;p&gt;I keep running into the same problem again and again and it&amp;#39;s starting to make me really paranoid. Basically I&amp;#39;ll start talking to someone on an app (grindr, Tindr etc) and we both make it clear we are there for more than just casual sex (yes grindr is the wrong place to look for relationships, I know). &lt;/p&gt;

&lt;p&gt;With a few guys we&amp;#39;ve really hit it off, talk for hours straight, exchange numbers and text. There&amp;#39;s very clear talk about meeting up for a date but nothing is specifically arranged.&lt;/p&gt;

&lt;p&gt;Now for the problem, it gets late and we go to bed and by the time I wake up again I get nothing back from them. Consistently they will suddenly just send one word answers or ignore my texts altogether with no explanation. &lt;/p&gt;

&lt;p&gt;I&amp;#39;m at the stage of wanting to give up altogether because this is getting ridiculous. Have you guys experienced this or know what I&amp;#39;m doing wrong?&lt;/p&gt;
&lt;/div&gt;&lt;!-- SC_ON --&gt;","False","askgaybros","t5_2vgfw","","","Online dating, is there a 24 hour rule?","12","http://www.reddit.com/r/askgaybros/comments/2lrbs3/online_dating_is_there_a_24_hour_rule/","[]","False"
"6","","","{}","http://www.reddit.com/api/info/","{}","{}","False","","","False","I_R_NOT_BEOWULF","","","","False","1415534001.0","1415534001.0","","self.askgaybros","0","1415557160.0","0","True","False","2lr7x7","True","","","","","","{}","[]","t3_2lr7x7","9","","False","http://www.reddit.com/r/askgaybros/comments/2lr7x7/coming_out_straight/","Unauthenticated reddit sesssion","","False","4","","{}","So, I came out of the closet as a teenager. I've dated guys for years and overall family and friends have been very accepting. I never questioned it much. I even had really awful sex with a girl once and that kinda cemented the feeling that I was in fact gay. In the last five years though I haven't had any serious relationships and I only have sex less than once a year. I just don't find guys attractive anymore. I guess what I'm trying to say is that I've never considered that I may be straight, or at least more straight than gay. So I've started to shop the idea around to friends. No one seems to accept it. They still refer to me as gay, try to introduce me to guys, etc. These are mostly straight friends too.

I very straight acting. I feel like I'm at least moderately attractive. But women never give me the time of day. And I don't know how to talk to them. Not that I haven't tried. So this is all speculation without having even dated a woman.

When I came out the first time everyone either accepted me or told me I would burn in hell. But they all believed me. Now I try and say that maybe I was wrong and they think it's a phase. I feel like I'm in some weird twilight zone episode.

Has anyone here gone through this or the opposite while coming out in their 30's?

TLDR: thought I was gay for a long time. Now I'm not so sure and i'm getting a lot of resistance from friends about it. Wtf?

Edit: Thank you for the thoughtful responses. This has been very stressful for me. It's nice to see that some people are still capable of listening. I'm going to keep putting myself out there and trying to meet someone that doesn't see me as just ""the gay guy"". Thanks again. Sorry for not replying individually. ","&lt;!-- SC_OFF --&gt;&lt;div class=""md""&gt;&lt;p&gt;So, I came out of the closet as a teenager. I&amp;#39;ve dated guys for years and overall family and friends have been very accepting. I never questioned it much. I even had really awful sex with a girl once and that kinda cemented the feeling that I was in fact gay. In the last five years though I haven&amp;#39;t had any serious relationships and I only have sex less than once a year. I just don&amp;#39;t find guys attractive anymore. I guess what I&amp;#39;m trying to say is that I&amp;#39;ve never considered that I may be straight, or at least more straight than gay. So I&amp;#39;ve started to shop the idea around to friends. No one seems to accept it. They still refer to me as gay, try to introduce me to guys, etc. These are mostly straight friends too.&lt;/p&gt;

&lt;p&gt;I very straight acting. I feel like I&amp;#39;m at least moderately attractive. But women never give me the time of day. And I don&amp;#39;t know how to talk to them. Not that I haven&amp;#39;t tried. So this is all speculation without having even dated a woman.&lt;/p&gt;

&lt;p&gt;When I came out the first time everyone either accepted me or told me I would burn in hell. But they all believed me. Now I try and say that maybe I was wrong and they think it&amp;#39;s a phase. I feel like I&amp;#39;m in some weird twilight zone episode.&lt;/p&gt;

&lt;p&gt;Has anyone here gone through this or the opposite while coming out in their 30&amp;#39;s?&lt;/p&gt;

&lt;p&gt;TLDR: thought I was gay for a long time. Now I&amp;#39;m not so sure and i&amp;#39;m getting a lot of resistance from friends about it. Wtf?&lt;/p&gt;

&lt;p&gt;Edit: Thank you for the thoughtful responses. This has been very stressful for me. It&amp;#39;s nice to see that some people are still capable of listening. I&amp;#39;m going to keep putting myself out there and trying to meet someone that doesn&amp;#39;t see me as just &amp;quot;the gay guy&amp;quot;. Thanks again. Sorry for not replying individually. &lt;/p&gt;
&lt;/div&gt;&lt;!-- SC_ON --&gt;","False","askgaybros","t5_2vgfw","","","Coming out straight???","4","http://www.reddit.com/r/askgaybros/comments/2lr7x7/coming_out_straight/","[]","False"
"7","","","{}","http://www.reddit.com/api/info/","{}","{}","False","","","False","wasd-gamer","","","","False","1415531973.0","1415531973.0","","self.askgaybros","0","False","0","True","False","2lr6ax","True","","","","","","{}","[]","t3_2lr6ax","63","","False","http://www.reddit.com/r/askgaybros/comments/2lr6ax/what_age_and_when_did_you_guys_come_out/","Unauthenticated reddit sesssion","","False","19","","{}","I'm just wondering as I have known I've been gay for a while and don't know how or when I should come out. ","&lt;!-- SC_OFF --&gt;&lt;div class=""md""&gt;&lt;p&gt;I&amp;#39;m just wondering as I have known I&amp;#39;ve been gay for a while and don&amp;#39;t know how or when I should come out. &lt;/p&gt;
&lt;/div&gt;&lt;!-- SC_ON --&gt;","False","askgaybros","t5_2vgfw","","","What age and when did you guys come out??","19","http://www.reddit.com/r/askgaybros/comments/2lr6ax/what_age_and_when_did_you_guys_come_out/","[]","False"
"8","","","{}","http://www.reddit.com/api/info/","{}","{}","False","","","False","throwaway3030a3","","","","False","1415531152.0","1415531152.0","","self.askgaybros","0","1415531369.0","0","True","False","2lr5p8","True","","","","","","{}","[]","t3_2lr5p8","15","","False","http://www.reddit.com/r/askgaybros/comments/2lr5p8/update_on_im_dating_a_guy_who_is_planning_to/","Unauthenticated reddit sesssion","","False","0","","{}","First of all, please get out of here with the 'omg he's creepy' comments if you've brought any.  It's not that far fetched to think a master being created the universe; if one did, and you genuinely thought it wrote a handbook on how to conduct your life, would you really question it?  Life is fucking weird as shit and super trippy.  Incomprehensibly strange.  Electrons teleport.  Think about that.  Electrons teleport but god being real is far fetched?  

Stephen Colbert is religious.  Gandhi was religious.  MLK Jr was religious.  Finally hey religion can be used in bad ways but science can be used by some to justify eugenics.  You'd say ""no those eugenics people are nuts.""  So would the well adjusted religious person about the religious equivalent.

Please keep your comments about that to yourself.  It's what makes him happy and he really believes in it and it isn't hurting anybody and I'm not about to try to mess with that.  He's not self hating.  He's not anti-gay.  People are complicated.

Anyways, I texted him because I was 'bummed out that it didn't seem like he cared enough to be in regular contact.'  In reality he's super busy and he does genuinely get back to me, but sometimes has to wait a day or two when things get hectic.

So in reality I think I was bothered by something else.

Anyways he didn't get mad at me at all, just was very kind and explained (like he always does :] ), then I called him and we talked.

What I basically told him is that although we've probably only spent maybe 50-60 hours talking over the course of 5-ish weeks, as well as being very physically attracted to him (we're both into kink in very matching ways), I've fallen for him pretty quickly for very valid reasons

+ he's super interesting and very different from me in ways that I find enriching (absolutely loathe the 'find your clone!' Ok Cupid-esque model of dating)

+ he's really kind and friendly

+ he shares a lot of my academic interests

+ he's intelligent

+ he's very supportive

+ he's funny

+ etc

and I don't want to lose him, but it bothers me a lot that our budding relationship basically has an expiration date.  Also, as he explained to me on the phone, if I meet somebody without an expiration date, and we get in a serious relationship that lasts a few years, we could plan our next steps in a way that would allow us to still be together without compromising anything major.

He said he feels the same way about me as I feel about him - really liking me in many different ways - and agreed about the conflict.  

When we're together physically there's a real emotional connection. But it would be super rough to adjust from being his lover to him flying off to another continent to do the priest thing.  Also I don't want to give up time I could've spent potentially finding someone who could be a life partner.  Finally, a lot of the love and support we give eachother 

1. is totally translatable into a close friendship

2. can be done from anywhere (I moved timezones early this year and am still in regular contact with my close friends; doesn't feel different)

So the conclusion is that we're going to become close friends.

I feel good about this right now.

Maybe not completely stoked.

But okay.

I feel okay.

Overall I'm standing by this decision regardless of whatever comments flood in, and am just sharing in case anybody else finds it useful.

Thanks for the various input and thanks for reading.
","&lt;!-- SC_OFF --&gt;&lt;div class=""md""&gt;&lt;p&gt;First of all, please get out of here with the &amp;#39;omg he&amp;#39;s creepy&amp;#39; comments if you&amp;#39;ve brought any.  It&amp;#39;s not that far fetched to think a master being created the universe; if one did, and you genuinely thought it wrote a handbook on how to conduct your life, would you really question it?  Life is fucking weird as shit and super trippy.  Incomprehensibly strange.  Electrons teleport.  Think about that.  Electrons teleport but god being real is far fetched?  &lt;/p&gt;

&lt;p&gt;Stephen Colbert is religious.  Gandhi was religious.  MLK Jr was religious.  Finally hey religion can be used in bad ways but science can be used by some to justify eugenics.  You&amp;#39;d say &amp;quot;no those eugenics people are nuts.&amp;quot;  So would the well adjusted religious person about the religious equivalent.&lt;/p&gt;

&lt;p&gt;Please keep your comments about that to yourself.  It&amp;#39;s what makes him happy and he really believes in it and it isn&amp;#39;t hurting anybody and I&amp;#39;m not about to try to mess with that.  He&amp;#39;s not self hating.  He&amp;#39;s not anti-gay.  People are complicated.&lt;/p&gt;

&lt;p&gt;Anyways, I texted him because I was &amp;#39;bummed out that it didn&amp;#39;t seem like he cared enough to be in regular contact.&amp;#39;  In reality he&amp;#39;s super busy and he does genuinely get back to me, but sometimes has to wait a day or two when things get hectic.&lt;/p&gt;

&lt;p&gt;So in reality I think I was bothered by something else.&lt;/p&gt;

&lt;p&gt;Anyways he didn&amp;#39;t get mad at me at all, just was very kind and explained (like he always does :] ), then I called him and we talked.&lt;/p&gt;

&lt;p&gt;What I basically told him is that although we&amp;#39;ve probably only spent maybe 50-60 hours talking over the course of 5-ish weeks, as well as being very physically attracted to him (we&amp;#39;re both into kink in very matching ways), I&amp;#39;ve fallen for him pretty quickly for very valid reasons&lt;/p&gt;

&lt;ul&gt;
&lt;li&gt;&lt;p&gt;he&amp;#39;s super interesting and very different from me in ways that I find enriching (absolutely loathe the &amp;#39;find your clone!&amp;#39; Ok Cupid-esque model of dating)&lt;/p&gt;&lt;/li&gt;
&lt;li&gt;&lt;p&gt;he&amp;#39;s really kind and friendly&lt;/p&gt;&lt;/li&gt;
&lt;li&gt;&lt;p&gt;he shares a lot of my academic interests&lt;/p&gt;&lt;/li&gt;
&lt;li&gt;&lt;p&gt;he&amp;#39;s intelligent&lt;/p&gt;&lt;/li&gt;
&lt;li&gt;&lt;p&gt;he&amp;#39;s very supportive&lt;/p&gt;&lt;/li&gt;
&lt;li&gt;&lt;p&gt;he&amp;#39;s funny&lt;/p&gt;&lt;/li&gt;
&lt;li&gt;&lt;p&gt;etc&lt;/p&gt;&lt;/li&gt;
&lt;/ul&gt;

&lt;p&gt;and I don&amp;#39;t want to lose him, but it bothers me a lot that our budding relationship basically has an expiration date.  Also, as he explained to me on the phone, if I meet somebody without an expiration date, and we get in a serious relationship that lasts a few years, we could plan our next steps in a way that would allow us to still be together without compromising anything major.&lt;/p&gt;

&lt;p&gt;He said he feels the same way about me as I feel about him - really liking me in many different ways - and agreed about the conflict.  &lt;/p&gt;

&lt;p&gt;When we&amp;#39;re together physically there&amp;#39;s a real emotional connection. But it would be super rough to adjust from being his lover to him flying off to another continent to do the priest thing.  Also I don&amp;#39;t want to give up time I could&amp;#39;ve spent potentially finding someone who could be a life partner.  Finally, a lot of the love and support we give eachother &lt;/p&gt;

&lt;ol&gt;
&lt;li&gt;&lt;p&gt;is totally translatable into a close friendship&lt;/p&gt;&lt;/li&gt;
&lt;li&gt;&lt;p&gt;can be done from anywhere (I moved timezones early this year and am still in regular contact with my close friends; doesn&amp;#39;t feel different)&lt;/p&gt;&lt;/li&gt;
&lt;/ol&gt;

&lt;p&gt;So the conclusion is that we&amp;#39;re going to become close friends.&lt;/p&gt;

&lt;p&gt;I feel good about this right now.&lt;/p&gt;

&lt;p&gt;Maybe not completely stoked.&lt;/p&gt;

&lt;p&gt;But okay.&lt;/p&gt;

&lt;p&gt;I feel okay.&lt;/p&gt;

&lt;p&gt;Overall I&amp;#39;m standing by this decision regardless of whatever comments flood in, and am just sharing in case anybody else finds it useful.&lt;/p&gt;

&lt;p&gt;Thanks for the various input and thanks for reading.&lt;/p&gt;
&lt;/div&gt;&lt;!-- SC_ON --&gt;","False","askgaybros","t5_2vgfw","","","Update on ""I'm dating a guy who is planning to become a religious priest""","0","http://www.reddit.com/r/askgaybros/comments/2lr5p8/update_on_im_dating_a_guy_who_is_planning_to/","[]","False"
"9","","","{}","http://www.reddit.com/api/info/","{}","{}","False","","","False","Laika_Come_Home","","","","False","1415526068.0","1415526068.0","","self.askgaybros","0","False","0","True","False","2lr1wd","True","","","","","","{}","[]","t3_2lr1wd","13","","False","http://www.reddit.com/r/askgaybros/comments/2lr1wd/jaded_with_everything/","Unauthenticated reddit sesssion","","False","0","","{}","This is more of a vent than anything else, but throughout my life, I've grown jaded; my family can't know my sexuality, I'm still only out to a handful of friends (only since college. No one from childhood). Never been in a relationship, and just plain burnt out from dating; it would seem a good man truly is hard to find.

I want to know how to solve all my problems. But, often times, I'm at a complete loss for what to do.

Thanks for listening regardless.","&lt;!-- SC_OFF --&gt;&lt;div class=""md""&gt;&lt;p&gt;This is more of a vent than anything else, but throughout my life, I&amp;#39;ve grown jaded; my family can&amp;#39;t know my sexuality, I&amp;#39;m still only out to a handful of friends (only since college. No one from childhood). Never been in a relationship, and just plain burnt out from dating; it would seem a good man truly is hard to find.&lt;/p&gt;

&lt;p&gt;I want to know how to solve all my problems. But, often times, I&amp;#39;m at a complete loss for what to do.&lt;/p&gt;

&lt;p&gt;Thanks for listening regardless.&lt;/p&gt;
&lt;/div&gt;&lt;!-- SC_ON --&gt;","False","askgaybros","t5_2vgfw","","","Jaded... With everything.","0","http://www.reddit.com/r/askgaybros/comments/2lr1wd/jaded_with_everything/","[]","False"
"10","","","{}","http://www.reddit.com/api/info/","{}","{}","False","","","False","stryknine","","","","False","1415524404.0","1415524404.0","","self.askgaybros","0","False","0","True","False","2lr0ny","True","","","","","","{}","[]","t3_2lr0ny","9","","False","http://www.reddit.com/r/askgaybros/comments/2lr0ny/want_to_be_an_educated_ally_please_help/","Unauthenticated reddit sesssion","","False","8","","{}","Ok, I had a conversation wish my aunt and uncle tonight that I felt unprepared for. It went something like this...

A&amp;U: Being gay is wrong, you know that, right?

Me: Actually, it's that opinion that is, in fact, wrong.

A&amp;U: The bible says a man shall not lay with another man as...etc...

Me: it also says pork is unclean and you should kill people who work on sunday.

A&amp;U: it's a waste that two beautiful women can't be with men, they are biologically incompatible.

Me: Isn't Christianity about love? If two people love each other, how can that be wrong?

A&amp;U: We have seven friends who've died of AIDS.

Me: AIDS isn't a homosexually transmitted disease, it's a sexually transmitted disease...it affects straight people too.

A&amp;U: What if you had a son that was gay?

Me: I would love him regardless of who he was attracted to. His choice of partner does not affect my connection to him. Same with a daughter.

A&amp;U: Well you don't have a son so you couldn't possibly know that's how you'd react. How do your parents feel about this?

Me: Not that it matters, because I'm an adult and have my own opinions, but I think they're in agreement.

A&amp;U: We don't think so.

Me: Once again, irrelevant. Persecuting someone for their inherent nature is wrong. It's no different from persecution of minorities (we're a multi racial family, this just throws them into a frenzy)

A&amp;U: (Upset) It's completely different. There's no groups that are organized that persecute them actively!

Me: You mean like, Christians? Homosexuality occurs in nature.

A&amp;U: Well those animals are diseased and wrong also. (stretching for facts, rationalizing, circular logic, bible verses)

Me: It's obvious that we aren't going to come to consensus on this, just know that although I love you both, I think you're completely wrong about this.

(Conversation continues, details foggy, but eventually turns gradually towards other topics)

I feel like I should have said different things, stated more facts, something! I feel like I should've tried harder.

Please post arguments you've heard and the best way you can imagine to handle them in an educated way. Please help me to be a better ally.

Tl;dr - My religious relatives don't like homosexuality, I want to know how I can help them see they're mistaken.","&lt;!-- SC_OFF --&gt;&lt;div class=""md""&gt;&lt;p&gt;Ok, I had a conversation wish my aunt and uncle tonight that I felt unprepared for. It went something like this...&lt;/p&gt;

&lt;p&gt;A&amp;amp;U: Being gay is wrong, you know that, right?&lt;/p&gt;

&lt;p&gt;Me: Actually, it&amp;#39;s that opinion that is, in fact, wrong.&lt;/p&gt;

&lt;p&gt;A&amp;amp;U: The bible says a man shall not lay with another man as...etc...&lt;/p&gt;

&lt;p&gt;Me: it also says pork is unclean and you should kill people who work on sunday.&lt;/p&gt;

&lt;p&gt;A&amp;amp;U: it&amp;#39;s a waste that two beautiful women can&amp;#39;t be with men, they are biologically incompatible.&lt;/p&gt;

&lt;p&gt;Me: Isn&amp;#39;t Christianity about love? If two people love each other, how can that be wrong?&lt;/p&gt;

&lt;p&gt;A&amp;amp;U: We have seven friends who&amp;#39;ve died of AIDS.&lt;/p&gt;

&lt;p&gt;Me: AIDS isn&amp;#39;t a homosexually transmitted disease, it&amp;#39;s a sexually transmitted disease...it affects straight people too.&lt;/p&gt;

&lt;p&gt;A&amp;amp;U: What if you had a son that was gay?&lt;/p&gt;

&lt;p&gt;Me: I would love him regardless of who he was attracted to. His choice of partner does not affect my connection to him. Same with a daughter.&lt;/p&gt;

&lt;p&gt;A&amp;amp;U: Well you don&amp;#39;t have a son so you couldn&amp;#39;t possibly know that&amp;#39;s how you&amp;#39;d react. How do your parents feel about this?&lt;/p&gt;

&lt;p&gt;Me: Not that it matters, because I&amp;#39;m an adult and have my own opinions, but I think they&amp;#39;re in agreement.&lt;/p&gt;

&lt;p&gt;A&amp;amp;U: We don&amp;#39;t think so.&lt;/p&gt;

&lt;p&gt;Me: Once again, irrelevant. Persecuting someone for their inherent nature is wrong. It&amp;#39;s no different from persecution of minorities (we&amp;#39;re a multi racial family, this just throws them into a frenzy)&lt;/p&gt;

&lt;p&gt;A&amp;amp;U: (Upset) It&amp;#39;s completely different. There&amp;#39;s no groups that are organized that persecute them actively!&lt;/p&gt;

&lt;p&gt;Me: You mean like, Christians? Homosexuality occurs in nature.&lt;/p&gt;

&lt;p&gt;A&amp;amp;U: Well those animals are diseased and wrong also. (stretching for facts, rationalizing, circular logic, bible verses)&lt;/p&gt;

&lt;p&gt;Me: It&amp;#39;s obvious that we aren&amp;#39;t going to come to consensus on this, just know that although I love you both, I think you&amp;#39;re completely wrong about this.&lt;/p&gt;

&lt;p&gt;(Conversation continues, details foggy, but eventually turns gradually towards other topics)&lt;/p&gt;

&lt;p&gt;I feel like I should have said different things, stated more facts, something! I feel like I should&amp;#39;ve tried harder.&lt;/p&gt;

&lt;p&gt;Please post arguments you&amp;#39;ve heard and the best way you can imagine to handle them in an educated way. Please help me to be a better ally.&lt;/p&gt;

&lt;p&gt;Tl;dr - My religious relatives don&amp;#39;t like homosexuality, I want to know how I can help them see they&amp;#39;re mistaken.&lt;/p&gt;
&lt;/div&gt;&lt;!-- SC_ON --&gt;","False","askgaybros","t5_2vgfw","","","Want to be an educated ally please help.","8","http://www.reddit.com/r/askgaybros/comments/2lr0ny/want_to_be_an_educated_ally_please_help/","[]","False"
