"","_comment_sort","_comments","_comments_by_id","_info_url","_orphaned","_params","_replaced_more","_underscore_names","approved_by","archived","author","author_flair_css_class","author_flair_text","banned_by","clicked","created","created_utc","distinguished","domain","downs","edited","gilded","has_fetched","hidden","id","is_self","json_dict","likes","link_flair_css_class","link_flair_text","media","media_embed","mod_reports","name","num_comments","num_reports","over_18","permalink","reddit_session","report_reasons","saved","score","secure_media","secure_media_embed","selftext","selftext_html","stickied","subreddit","subreddit_id","suggested_sort","thumbnail","title","ups","url","user_reports","visited"
"9","","","{}","http://www.reddit.com/api/info/","{}","{}","False","","","True","MoreBroThanYo","","","","False","1399935012.0","1399931412.0","","youtube.com","0","False","0","True","False","25e8vr","False","","","","","{u'type': u'youtube.com', u'oembed': {u'provider_url': u'http://www.youtube.com/', u'description': u'As with every year, the same few folks raise their same complaints that there's ""too much nudity"" or ""too much overt sexuality"" in the annual Pride Parades and Pride celebrations. So, I decided to ask my (straight) parents their thoughts on this whole issue are - my parents who march with me every year, and have attended Pride parades since before I was born, or even conceived.', u'title': u'Talking to my Parents - PRIDE PARADES: Too Sexual? Too Much Nudity? Much Ado About Nothing?', u'url': u'http://www.youtube.com/watch?v=JMV1HyVk2wA', u'author_name': u'LittleKiwiLovesBauhaus', u'height': 338, u'width': 600, u'html': u'&lt;iframe class=""embedly-embed"" src=""//cdn.embedly.com/widgets/media.html?src=http%3A%2F%2Fwww.youtube.com%2Fembed%2FJMV1HyVk2wA%3Ffeature%3Doembed&amp;url=http%3A%2F%2Fwww.youtube.com%2Fwatch%3Fv%3DJMV1HyVk2wA&amp;image=http%3A%2F%2Fi1.ytimg.com%2Fvi%2FJMV1HyVk2wA%2Fhqdefault.jpg&amp;key=2aa3c4d5f3de4f5b9120b660ad850dc9&amp;type=text%2Fhtml&amp;schema=youtube"" width=""600"" height=""338"" scrolling=""no"" frameborder=""0"" allowfullscreen&gt;&lt;/iframe&gt;', u'thumbnail_width': 480, u'version': u'1.0', u'provider_name': u'YouTube', u'thumbnail_url': u'http://i1.ytimg.com/vi/JMV1HyVk2wA/hqdefault.jpg', u'type': u'video', u'thumbnail_height': 360, u'author_url': u'http://www.youtube.com/user/MOKandRIFF'}}","{u'content': u'&lt;iframe class=""embedly-embed"" src=""//cdn.embedly.com/widgets/media.html?src=http%3A%2F%2Fwww.youtube.com%2Fembed%2FJMV1HyVk2wA%3Ffeature%3Doembed&amp;url=http%3A%2F%2Fwww.youtube.com%2Fwatch%3Fv%3DJMV1HyVk2wA&amp;image=http%3A%2F%2Fi1.ytimg.com%2Fvi%2FJMV1HyVk2wA%2Fhqdefault.jpg&amp;key=2aa3c4d5f3de4f5b9120b660ad850dc9&amp;type=text%2Fhtml&amp;schema=youtube"" width=""600"" height=""338"" scrolling=""no"" frameborder=""0"" allowfullscreen&gt;&lt;/iframe&gt;', u'width': 600, u'scrolling': False, u'height': 338}","[]","t3_25e8vr","28","","False","http://www.reddit.com/r/askgaybros/comments/25e8vr/a_man_makes_history_kisses_the_man_he_loves_and/","Unauthenticated reddit sesssion","","False","0","{u'type': u'youtube.com', u'oembed': {u'provider_url': u'http://www.youtube.com/', u'description': u'As with every year, the same few folks raise their same complaints that there's ""too much nudity"" or ""too much overt sexuality"" in the annual Pride Parades and Pride celebrations. So, I decided to ask my (straight) parents their thoughts on this whole issue are - my parents who march with me every year, and have attended Pride parades since before I was born, or even conceived.', u'title': u'Talking to my Parents - PRIDE PARADES: Too Sexual? Too Much Nudity? Much Ado About Nothing?', u'url': u'http://www.youtube.com/watch?v=JMV1HyVk2wA', u'author_name': u'LittleKiwiLovesBauhaus', u'height': 338, u'width': 600, u'html': u'&lt;iframe class=""embedly-embed"" src=""https://cdn.embedly.com/widgets/media.html?src=https%3A%2F%2Fwww.youtube.com%2Fembed%2FJMV1HyVk2wA%3Ffeature%3Doembed&amp;url=http%3A%2F%2Fwww.youtube.com%2Fwatch%3Fv%3DJMV1HyVk2wA&amp;image=http%3A%2F%2Fi1.ytimg.com%2Fvi%2FJMV1HyVk2wA%2Fhqdefault.jpg&amp;key=2aa3c4d5f3de4f5b9120b660ad850dc9&amp;type=text%2Fhtml&amp;schema=youtube"" width=""600"" height=""338"" scrolling=""no"" frameborder=""0"" allowfullscreen&gt;&lt;/iframe&gt;', u'thumbnail_width': 480, u'version': u'1.0', u'provider_name': u'YouTube', u'thumbnail_url': u'https://i.embed.ly/1/image?url=http%3A%2F%2Fi1.ytimg.com%2Fvi%2FJMV1HyVk2wA%2Fhqdefault.jpg&amp;key=b1e305db91cf4aa5a86b732cc9fffceb', u'type': u'video', u'thumbnail_height': 360, u'author_url': u'http://www.youtube.com/user/MOKandRIFF'}}","{u'content': u'&lt;iframe class=""embedly-embed"" src=""https://cdn.embedly.com/widgets/media.html?src=https%3A%2F%2Fwww.youtube.com%2Fembed%2FJMV1HyVk2wA%3Ffeature%3Doembed&amp;url=http%3A%2F%2Fwww.youtube.com%2Fwatch%3Fv%3DJMV1HyVk2wA&amp;image=http%3A%2F%2Fi1.ytimg.com%2Fvi%2FJMV1HyVk2wA%2Fhqdefault.jpg&amp;key=2aa3c4d5f3de4f5b9120b660ad850dc9&amp;type=text%2Fhtml&amp;schema=youtube"" width=""600"" height=""338"" scrolling=""no"" frameborder=""0"" allowfullscreen&gt;&lt;/iframe&gt;', u'width': 600, u'scrolling': False, u'height': 338}","","","False","askgaybros","t5_2vgfw","","","A man makes history, kisses the man he loves, and haters (as expected) freak the f**k out.","0","http://www.youtube.com/watch?v=JMV1HyVk2wA","[]","False"
"10","","","{}","http://www.reddit.com/api/info/","{}","{}","False","","","True","TheTurtle05","","","","False","1399927025.0","1399923425.0","","self.askgaybros","0","False","0","True","False","25durr","True","","","","","","{}","[]","t3_25durr","14","","False","http://www.reddit.com/r/askgaybros/comments/25durr/fallen_for_my_straight_best_friend_who_shows/","Unauthenticated reddit sesssion","","False","7","","{}","Jesus, this is becoming the story of my life. 

Firstly, we started off slow and got to know each other about 7/8 months ago. He found out I was gay and he had no problems with it what so ever. Since then, we've got closer and closer and we text virtually all the time now and when we're together in with our friendship circle we're normally together. 

Right so, despite having a really good friendship with him about two months ago, I didn't have no real attraction to him. I loved him and thought he was a brilliant person, but as a friend. But since then, we've got closer but literally and physically at times and he has shown signs he could be into guys. A few weeks ago he went through a stage where he literally couldn't stop talking about this one guy (a celeb) and saying things like 'He'd get it' and said that even out of both sexes, this one male celeb was his ultimate crush. In additon this, he rates guys loads and is constantly talking about hot guys lately and sending me pics via text of other celebs and people who he thinks our hots.

Following on from this, he has agreed he'd go to a gay bar with me (we were joking) and I said I'd totally hit you up with a guy, to which he responded 'haha please do', then I was like 'Would you actually?' then he said 'possibly but unlikely'. In addition to this, when I told him about my gay friend, he took immense interest and added him on Facebook and called him 'fucking gorgeous' and I should get with him, which I found totally bizarre as I only know this guy on the internet. 

The other day was the final straw for me. We went out and I asked him how things he is with girl he obsesses over and whether he likes her still. He became really awkward and just said 'I'm confused', I was like 'You can trust me', then he said 'I know but I can't trust the others', to which the others came over and the convo died. He was drunk at this point and later that night we shared a quilt and got very close, admittedly I was the one getting closer to him and putting my head on him, but he didn't make any effort to move away. Its common knowledge in our friendship group he really likes this girl, so for him to say that confused me. He has said other things to me like 'You're the only one I can open to' etc etc

Other things are like, he has had one girlfriend and always says things like 'guys are more fun to talk about'. He kisses me a lot on the cheek when he gets drunk and says 'There is more chance of me getting into a relationship with a guy than there is a girl', because he 'sucks with girls'. I've also heard a story of where he got off with a guy when he was drunk.

So many signs and collectively its given me hope. But deep down, I really do think he is straight. He plays football and he is (quite) macho. 

Its really, really, tormenting me. I seriously like him and I hate myself for it. Its getting to that point where I'm starting to get down if he hasn't texted me or if he starts talking about girls.  ","&lt;!-- SC_OFF --&gt;&lt;div class=""md""&gt;&lt;p&gt;Jesus, this is becoming the story of my life. &lt;/p&gt;

&lt;p&gt;Firstly, we started off slow and got to know each other about 7/8 months ago. He found out I was gay and he had no problems with it what so ever. Since then, we&amp;#39;ve got closer and closer and we text virtually all the time now and when we&amp;#39;re together in with our friendship circle we&amp;#39;re normally together. &lt;/p&gt;

&lt;p&gt;Right so, despite having a really good friendship with him about two months ago, I didn&amp;#39;t have no real attraction to him. I loved him and thought he was a brilliant person, but as a friend. But since then, we&amp;#39;ve got closer but literally and physically at times and he has shown signs he could be into guys. A few weeks ago he went through a stage where he literally couldn&amp;#39;t stop talking about this one guy (a celeb) and saying things like &amp;#39;He&amp;#39;d get it&amp;#39; and said that even out of both sexes, this one male celeb was his ultimate crush. In additon this, he rates guys loads and is constantly talking about hot guys lately and sending me pics via text of other celebs and people who he thinks our hots.&lt;/p&gt;

&lt;p&gt;Following on from this, he has agreed he&amp;#39;d go to a gay bar with me (we were joking) and I said I&amp;#39;d totally hit you up with a guy, to which he responded &amp;#39;haha please do&amp;#39;, then I was like &amp;#39;Would you actually?&amp;#39; then he said &amp;#39;possibly but unlikely&amp;#39;. In addition to this, when I told him about my gay friend, he took immense interest and added him on Facebook and called him &amp;#39;fucking gorgeous&amp;#39; and I should get with him, which I found totally bizarre as I only know this guy on the internet. &lt;/p&gt;

&lt;p&gt;The other day was the final straw for me. We went out and I asked him how things he is with girl he obsesses over and whether he likes her still. He became really awkward and just said &amp;#39;I&amp;#39;m confused&amp;#39;, I was like &amp;#39;You can trust me&amp;#39;, then he said &amp;#39;I know but I can&amp;#39;t trust the others&amp;#39;, to which the others came over and the convo died. He was drunk at this point and later that night we shared a quilt and got very close, admittedly I was the one getting closer to him and putting my head on him, but he didn&amp;#39;t make any effort to move away. Its common knowledge in our friendship group he really likes this girl, so for him to say that confused me. He has said other things to me like &amp;#39;You&amp;#39;re the only one I can open to&amp;#39; etc etc&lt;/p&gt;

&lt;p&gt;Other things are like, he has had one girlfriend and always says things like &amp;#39;guys are more fun to talk about&amp;#39;. He kisses me a lot on the cheek when he gets drunk and says &amp;#39;There is more chance of me getting into a relationship with a guy than there is a girl&amp;#39;, because he &amp;#39;sucks with girls&amp;#39;. I&amp;#39;ve also heard a story of where he got off with a guy when he was drunk.&lt;/p&gt;

&lt;p&gt;So many signs and collectively its given me hope. But deep down, I really do think he is straight. He plays football and he is (quite) macho. &lt;/p&gt;

&lt;p&gt;Its really, really, tormenting me. I seriously like him and I hate myself for it. Its getting to that point where I&amp;#39;m starting to get down if he hasn&amp;#39;t texted me or if he starts talking about girls.  &lt;/p&gt;
&lt;/div&gt;&lt;!-- SC_ON --&gt;","False","askgaybros","t5_2vgfw","","","Fallen for my straight best friend who shows signs he could be gay, and I hate myself for it","7","http://www.reddit.com/r/askgaybros/comments/25durr/fallen_for_my_straight_best_friend_who_shows/","[]","False"
"11","","","{}","http://www.reddit.com/api/info/","{}","{}","False","","","True","CosmicExistence","","","","False","1399926662.0","1399923062.0","","self.askgaybros","0","1399948714.0","0","True","False","25du46","True","","","","","","{}","[]","t3_25du46","41","","False","http://www.reddit.com/r/askgaybros/comments/25du46/told_my_parents/","Unauthenticated reddit sesssion","","False","39","","{}","It was pretty miserable. They're both really religious and I've been preparing myself for the fallout for quite some time. They're exact words were ""we love you but we believe in the bible and you know what it says about that."" That's a contradictory statement. They told me ""sure you can stick around but we definitely don't think you're enough of a person to get married."" I would have much them flat out tell me to leave instead of being patronized like that. I don't think I want to have any contact with them anymore. My parents don't see me as a whole person anymore and I'm better than that. Am I wrong in thinking like this? 

Edit- By ""stick around"" I mean ""make an appearance at family functions"" Im out of their house and hundreds of miles away. 

Edit 2- Thank you guys for the encouragement and advice, it's greatly appreciated.","&lt;!-- SC_OFF --&gt;&lt;div class=""md""&gt;&lt;p&gt;It was pretty miserable. They&amp;#39;re both really religious and I&amp;#39;ve been preparing myself for the fallout for quite some time. They&amp;#39;re exact words were &amp;quot;we love you but we believe in the bible and you know what it says about that.&amp;quot; That&amp;#39;s a contradictory statement. They told me &amp;quot;sure you can stick around but we definitely don&amp;#39;t think you&amp;#39;re enough of a person to get married.&amp;quot; I would have much them flat out tell me to leave instead of being patronized like that. I don&amp;#39;t think I want to have any contact with them anymore. My parents don&amp;#39;t see me as a whole person anymore and I&amp;#39;m better than that. Am I wrong in thinking like this? &lt;/p&gt;

&lt;p&gt;Edit- By &amp;quot;stick around&amp;quot; I mean &amp;quot;make an appearance at family functions&amp;quot; Im out of their house and hundreds of miles away. &lt;/p&gt;

&lt;p&gt;Edit 2- Thank you guys for the encouragement and advice, it&amp;#39;s greatly appreciated.&lt;/p&gt;
&lt;/div&gt;&lt;!-- SC_ON --&gt;","False","askgaybros","t5_2vgfw","","","Told my parents.","39","http://www.reddit.com/r/askgaybros/comments/25du46/told_my_parents/","[]","False"
