"","_comment_sort","_comments","_comments_by_id","_info_url","_orphaned","_params","_replaced_more","_underscore_names","approved_by","archived","author","author_flair_css_class","author_flair_text","banned_by","clicked","created","created_utc","distinguished","domain","downs","edited","gilded","has_fetched","hidden","id","is_self","json_dict","likes","link_flair_css_class","link_flair_text","media","media_embed","mod_reports","name","num_comments","num_reports","over_18","permalink","reddit_session","report_reasons","saved","score","secure_media","secure_media_embed","selftext","selftext_html","stickied","subreddit","subreddit_id","suggested_sort","thumbnail","title","ups","url","user_reports","visited"
"21","","","{}","http://www.reddit.com/api/info/","{}","{}","False","","","False","Looking4PornGayStar","","","","False","1421191850.0","1421191850.0","","self.askgaybros","0","False","0","True","False","2sc6u7","True","","","","","","{}","[]","t3_2sc6u7","11","","True","http://www.reddit.com/r/askgaybros/comments/2sc6u7/looking_for_nerdy_twitter_verified_gay_porn_star/","Unauthenticated reddit sesssion","","False","0","","{}","I am in a contest against some friends to make fan art with a theme consisting of Bayonetta, My Little Pony, and Pizza for a gay porn star within a weeks time. I personally can not speak to them unless it is in quotes from their films. The art must be re tweeted. They also have to be twitter verified. I am not as well versed in the land of gay porn, as I am straight. With that being said I am here asking you gaybros for help. 

I have found a lot of really cool sounding dudes who would enjoy the art I have to make, but apparently being verified is tough. My gay friend has had a bit more luck as it seems female porn stars are a bit more likely to be verified. Hopefully they aren't as cool.","&lt;!-- SC_OFF --&gt;&lt;div class=""md""&gt;&lt;p&gt;I am in a contest against some friends to make fan art with a theme consisting of Bayonetta, My Little Pony, and Pizza for a gay porn star within a weeks time. I personally can not speak to them unless it is in quotes from their films. The art must be re tweeted. They also have to be twitter verified. I am not as well versed in the land of gay porn, as I am straight. With that being said I am here asking you gaybros for help. &lt;/p&gt;

&lt;p&gt;I have found a lot of really cool sounding dudes who would enjoy the art I have to make, but apparently being verified is tough. My gay friend has had a bit more luck as it seems female porn stars are a bit more likely to be verified. Hopefully they aren&amp;#39;t as cool.&lt;/p&gt;
&lt;/div&gt;&lt;!-- SC_ON --&gt;","False","askgaybros","t5_2vgfw","","","Looking For Nerdy Twitter Verified Gay Porn Star.","0","http://www.reddit.com/r/askgaybros/comments/2sc6u7/looking_for_nerdy_twitter_verified_gay_porn_star/","[]","False"
"22","","","{}","http://www.reddit.com/api/info/","{}","{}","False","","","False","gibo616","","","","False","1421189964.0","1421189964.0","","self.askgaybros","0","False","0","True","False","2sc2mj","True","","","","","","{}","[]","t3_2sc2mj","1","","False","http://www.reddit.com/r/askgaybros/comments/2sc2mj/northern_ireland_scene/","Unauthenticated reddit sesssion","","False","0","","{}","im a chubby bi virgin and am from near belfast and would love to be fucked. i was just hoping to hear what the scene is like and if anyone's been to either gay saunas","&lt;!-- SC_OFF --&gt;&lt;div class=""md""&gt;&lt;p&gt;im a chubby bi virgin and am from near belfast and would love to be fucked. i was just hoping to hear what the scene is like and if anyone&amp;#39;s been to either gay saunas&lt;/p&gt;
&lt;/div&gt;&lt;!-- SC_ON --&gt;","False","askgaybros","t5_2vgfw","","","Northern Ireland scene","0","http://www.reddit.com/r/askgaybros/comments/2sc2mj/northern_ireland_scene/","[]","False"
"23","","","{}","http://www.reddit.com/api/info/","{}","{}","False","","","False","cccviper653","","","","False","1421188150.0","1421188150.0","","self.askgaybros","0","1421190606.0","0","True","False","2sbykl","True","","","","","","{}","[]","t3_2sbykl","12","","False","http://www.reddit.com/r/askgaybros/comments/2sbykl/have_you_ever_engineered_a_romantic_situation/","Unauthenticated reddit sesssion","","False","39","","{}","I'm talking about making a story book hookup by meticulously planning a series of events to make your target fall for you. I find it to be a little backhanded and manipulative myself but i'm interested in your experiences with it. What did you think about it? Did it strengthen or crumble your relationship in the end?

Edit: don't downvote the stories where someone has been wronged. Instead, offer constructive criticism to encourage them to rely on true feelings instead of forcing something that wasn't meant to be.","&lt;!-- SC_OFF --&gt;&lt;div class=""md""&gt;&lt;p&gt;I&amp;#39;m talking about making a story book hookup by meticulously planning a series of events to make your target fall for you. I find it to be a little backhanded and manipulative myself but i&amp;#39;m interested in your experiences with it. What did you think about it? Did it strengthen or crumble your relationship in the end?&lt;/p&gt;

&lt;p&gt;Edit: don&amp;#39;t downvote the stories where someone has been wronged. Instead, offer constructive criticism to encourage them to rely on true feelings instead of forcing something that wasn&amp;#39;t meant to be.&lt;/p&gt;
&lt;/div&gt;&lt;!-- SC_ON --&gt;","False","askgaybros","t5_2vgfw","","","Have you ever engineered a romantic situation?","39","http://www.reddit.com/r/askgaybros/comments/2sbykl/have_you_ever_engineered_a_romantic_situation/","[]","False"
"24","","","{}","http://www.reddit.com/api/info/","{}","{}","False","","","False","EwanWhoseArmy","","","","False","1421186887.0","1421186887.0","","self.askgaybros","0","1421187601.0","0","True","False","2sbvoe","True","","","","","","{}","[]","t3_2sbvoe","35","","False","http://www.reddit.com/r/askgaybros/comments/2sbvoe/do_you_think_an_incredibly_promiscuous_phase_is/","Unauthenticated reddit sesssion","","False","7","","{}","So I repressed my sexuality alot as a teen, it was only when I was 20/21 that I started to accept it and I didn't come out to family until I was 22. 

Anyway for a while before I came out (and a little after) I was a bit of a slut and I slept with a lot of guys in random hookups and crap. I then had a bit of a breakdown (having to live in a less gay friendly place in the middle of nowhere for a year after being ""free"" hurt me) and for a short while I didn't have any sex out of silly ashamed feelings and blaming my gayness for my loneliness

I now have a proper relationship and I am pretty monogamous in it (we are semi-open however) but looking back I wonder what I was playing at sometimes  ","&lt;!-- SC_OFF --&gt;&lt;div class=""md""&gt;&lt;p&gt;So I repressed my sexuality alot as a teen, it was only when I was 20/21 that I started to accept it and I didn&amp;#39;t come out to family until I was 22. &lt;/p&gt;

&lt;p&gt;Anyway for a while before I came out (and a little after) I was a bit of a slut and I slept with a lot of guys in random hookups and crap. I then had a bit of a breakdown (having to live in a less gay friendly place in the middle of nowhere for a year after being &amp;quot;free&amp;quot; hurt me) and for a short while I didn&amp;#39;t have any sex out of silly ashamed feelings and blaming my gayness for my loneliness&lt;/p&gt;

&lt;p&gt;I now have a proper relationship and I am pretty monogamous in it (we are semi-open however) but looking back I wonder what I was playing at sometimes  &lt;/p&gt;
&lt;/div&gt;&lt;!-- SC_ON --&gt;","False","askgaybros","t5_2vgfw","","","Do you think an incredibly promiscuous phase is something to be ashamed of?","7","http://www.reddit.com/r/askgaybros/comments/2sbvoe/do_you_think_an_incredibly_promiscuous_phase_is/","[]","False"
"25","","","{}","http://www.reddit.com/api/info/","{}","{}","False","","","False","FurryNavel","","","","False","1421186033.0","1421186033.0","","self.askgaybros","0","False","0","True","False","2sbtm0","True","","","","","","{}","[]","t3_2sbtm0","13","","False","http://www.reddit.com/r/askgaybros/comments/2sbtm0/does_anyone_still_deal_with_internalized/","Unauthenticated reddit sesssion","","False","8","","{}","Before I came to terms with being gay, I had really bad internalized homophobia. I have accepted myself for being gay, and I actually enjoy being gay. But sometimes I'll have episodes of internalized homophobia. I don't really know why. I was raised in a very conservative Pentecostal church for 16 years of my life(I'm 18). Where like every other service there was some type of homophobic message in the sermon. Do you think that may have something to do with it?","&lt;!-- SC_OFF --&gt;&lt;div class=""md""&gt;&lt;p&gt;Before I came to terms with being gay, I had really bad internalized homophobia. I have accepted myself for being gay, and I actually enjoy being gay. But sometimes I&amp;#39;ll have episodes of internalized homophobia. I don&amp;#39;t really know why. I was raised in a very conservative Pentecostal church for 16 years of my life(I&amp;#39;m 18). Where like every other service there was some type of homophobic message in the sermon. Do you think that may have something to do with it?&lt;/p&gt;
&lt;/div&gt;&lt;!-- SC_ON --&gt;","False","askgaybros","t5_2vgfw","","","Does anyone still deal with internalized homophobia from time to time?","8","http://www.reddit.com/r/askgaybros/comments/2sbtm0/does_anyone_still_deal_with_internalized/","[]","False"
"26","","","{}","http://www.reddit.com/api/info/","{}","{}","False","","","False","jken11","","","","False","1421183399.0","1421183399.0","","self.askgaybros","0","False","0","True","False","2sbnhb","True","","","","","","{}","[]","t3_2sbnhb","9","","False","http://www.reddit.com/r/askgaybros/comments/2sbnhb/gaybros_that_have_either_been_to_or_that_are_from/","Unauthenticated reddit sesssion","","False","7","","{}","all right guys my partner and i are thinking about heading to Sweden in February and i was wondering if any of you might have some advice regarding places to go, things to see, places to avoid, and whether or not we can expect any problems over us being gay ","&lt;!-- SC_OFF --&gt;&lt;div class=""md""&gt;&lt;p&gt;all right guys my partner and i are thinking about heading to Sweden in February and i was wondering if any of you might have some advice regarding places to go, things to see, places to avoid, and whether or not we can expect any problems over us being gay &lt;/p&gt;
&lt;/div&gt;&lt;!-- SC_ON --&gt;","False","askgaybros","t5_2vgfw","","","gaybros that have either been to or that are from Sweden i am hoping to pick your brains","7","http://www.reddit.com/r/askgaybros/comments/2sbnhb/gaybros_that_have_either_been_to_or_that_are_from/","[]","False"
"27","","","{}","http://www.reddit.com/api/info/","{}","{}","False","","","False","dbrowm","","","","False","1421179771.0","1421179771.0","","self.askgaybros","0","False","0","True","False","2sben6","True","","","","","","{}","[]","t3_2sben6","39","","False","http://www.reddit.com/r/askgaybros/comments/2sben6/black_guys_of_gaybros_do_you_guys_date_other/","Unauthenticated reddit sesssion","","False","3","","{}","I am from Ireland myself and black and around here there isn't many black gay/bi guys to date and I see in the UK and USA there is plenty and after seeing all the post about white men not being in to black guys i just wondered are you guys into your own race because I know I am and i guess when I get rejected by guys who are from a different race i just see it as I wasn't his type thing instead of race anyways I was just wondering","&lt;!-- SC_OFF --&gt;&lt;div class=""md""&gt;&lt;p&gt;I am from Ireland myself and black and around here there isn&amp;#39;t many black gay/bi guys to date and I see in the UK and USA there is plenty and after seeing all the post about white men not being in to black guys i just wondered are you guys into your own race because I know I am and i guess when I get rejected by guys who are from a different race i just see it as I wasn&amp;#39;t his type thing instead of race anyways I was just wondering&lt;/p&gt;
&lt;/div&gt;&lt;!-- SC_ON --&gt;","False","askgaybros","t5_2vgfw","","","black guys of gaybros do you guys date other black men?","3","http://www.reddit.com/r/askgaybros/comments/2sben6/black_guys_of_gaybros_do_you_guys_date_other/","[]","False"
"28","","","{}","http://www.reddit.com/api/info/","{}","{}","False","","","False","rimagana","","","","False","1421178263.0","1421178263.0","","self.askgaybros","0","False","0","True","False","2sbb5z","True","","","","","","{}","[]","t3_2sbb5z","7","","False","http://www.reddit.com/r/askgaybros/comments/2sbb5z/anyone_been_ip_banned_on_a4a/","Unauthenticated reddit sesssion","","False","6","","{}","Wasn't sure this was possible because I've reported a few profiles that were obviously just spammers and I have never seen them do anything about it, and then I tried to log in earlier and it said my IP had been banned? ","&lt;!-- SC_OFF --&gt;&lt;div class=""md""&gt;&lt;p&gt;Wasn&amp;#39;t sure this was possible because I&amp;#39;ve reported a few profiles that were obviously just spammers and I have never seen them do anything about it, and then I tried to log in earlier and it said my IP had been banned? &lt;/p&gt;
&lt;/div&gt;&lt;!-- SC_ON --&gt;","False","askgaybros","t5_2vgfw","","","Anyone been IP banned on A4A?","6","http://www.reddit.com/r/askgaybros/comments/2sbb5z/anyone_been_ip_banned_on_a4a/","[]","False"
"29","","","{}","http://www.reddit.com/api/info/","{}","{}","False","","","False","drewdidthis","","","","False","1421177546.0","1421177546.0","","self.askgaybros","0","False","0","True","False","2sb9ge","True","","","","","","{}","[]","t3_2sb9ge","126","","False","http://www.reddit.com/r/askgaybros/comments/2sb9ge/partnered_bros_how_monogamous_are_you/","Unauthenticated reddit sesssion","","False","29","","{}","I've seen a lot of 'I think my boyfriend is cheating on me' posts here in the past few days. I've always been very open with sex even in the context of committed partners. I thought my views were more in the majority with youngerish gay guys. I'm curious to hear how people deal with the subject of condoned outside sex, whether it's something you and your partner have tried, discussed, decided against, etc.","&lt;!-- SC_OFF --&gt;&lt;div class=""md""&gt;&lt;p&gt;I&amp;#39;ve seen a lot of &amp;#39;I think my boyfriend is cheating on me&amp;#39; posts here in the past few days. I&amp;#39;ve always been very open with sex even in the context of committed partners. I thought my views were more in the majority with youngerish gay guys. I&amp;#39;m curious to hear how people deal with the subject of condoned outside sex, whether it&amp;#39;s something you and your partner have tried, discussed, decided against, etc.&lt;/p&gt;
&lt;/div&gt;&lt;!-- SC_ON --&gt;","False","askgaybros","t5_2vgfw","","","Partnered bros, how monogamous are you?","29","http://www.reddit.com/r/askgaybros/comments/2sb9ge/partnered_bros_how_monogamous_are_you/","[]","False"
"30","","","{}","http://www.reddit.com/api/info/","{}","{}","False","","","False","floridageek","","","","False","1421175906.0","1421175906.0","","self.askgaybros","0","False","0","True","False","2sb5qp","True","","","","","","{}","[]","t3_2sb5qp","16","","False","http://www.reddit.com/r/askgaybros/comments/2sb5qp/why_tell_someone_lets_hang_out_again_if_you_dont/","Unauthenticated reddit sesssion","","False","14","","{}","I know this has been talked about before but this is grinding my gears and I just have to vent. After a date, why would someone specifically ask to hang out again, then text right after you leave the date that he had a good time and was glad you came out if he really didn't have a good time and didn't want to hang out again? This baffles my mind. If I didn't want to hang out again, I'm not going to suggest it or ask you, and I certainly wouldn't text you right after the date saying that I had a good time.

Is there a scientific study on this shit somewhere because I just can't wrap my head around it and it's making me question my judgement of people.","&lt;!-- SC_OFF --&gt;&lt;div class=""md""&gt;&lt;p&gt;I know this has been talked about before but this is grinding my gears and I just have to vent. After a date, why would someone specifically ask to hang out again, then text right after you leave the date that he had a good time and was glad you came out if he really didn&amp;#39;t have a good time and didn&amp;#39;t want to hang out again? This baffles my mind. If I didn&amp;#39;t want to hang out again, I&amp;#39;m not going to suggest it or ask you, and I certainly wouldn&amp;#39;t text you right after the date saying that I had a good time.&lt;/p&gt;

&lt;p&gt;Is there a scientific study on this shit somewhere because I just can&amp;#39;t wrap my head around it and it&amp;#39;s making me question my judgement of people.&lt;/p&gt;
&lt;/div&gt;&lt;!-- SC_ON --&gt;","False","askgaybros","t5_2vgfw","","","Why tell someone ""let's hang out again"" if you don't want to hang out again.","14","http://www.reddit.com/r/askgaybros/comments/2sb5qp/why_tell_someone_lets_hang_out_again_if_you_dont/","[]","False"
"31","","","{}","http://www.reddit.com/api/info/","{}","{}","False","","","False","haightor","","","","False","1421173190.0","1421173190.0","","self.askgaybros","0","False","0","True","False","2sazq5","True","","","","","","{}","[]","t3_2sazq5","36","","False","http://www.reddit.com/r/askgaybros/comments/2sazq5/maybe_im_not_gay_after_all/","Unauthenticated reddit sesssion","","False","16","","{}","Long post ahead. I'm 25 btw.

So I was driving to work this morning and stuck in traffic when I got to thinking. Maybe I've been wrong all this time. I know I'm not straight because I'm not attracted or interested in women at all. But after the 100% failure rate in relationships with men that I've had, and the complete disinterest I have in dating, I've come to a fork in the road. Am I really gay? My reasoning is as follows.

1. I have never been in love. I've never had a crush, or felt anything more than a momentary lust for a man. I'm not kidding, the male face and body appeals to me on a generic level, but at no time have I ever envisioned myself being with any guy I've ever met. I have dated 3 men (all less than 3 months) and all ended poorly because I had no interest in the beginning. I thought I would feel something if I kept with it, but that never materialized. I know this is wrong because it's a way of leading the guy on, but in my most messed up moments I justify it by thinking that the feelings of affection will just come around naturally. They haven't.

2. I have never had an enjoyable sexual encounter. I have had full on sex with 8 different guys and oral with about 15. I have never been glad I did it. Either it ends with me going limp or I have to strain with all my might to finish myself off. No matter what I feel regretful it happened. You might think, why did he have sex when he wasn't attracted to these people? The reason is because I've been thinking it would come along naturally, that maybe it just wasn't the right time or something. So I kept trying. 

3. When guys try to chat me up or compliment me, it's a total turn off. The most surefire to get me to not want to talk to you is to come on to me. It makes me fill up with dread and anxiety because I cannot reciprocate the feelings you might have for me. Cue the guilt about misleading the guy if I respond the wrong way. This has basically ruined friendships for me and I'm sure has made people think I'm a real jerk when in reality I think I'm just messed up.

4. I have one of the lowest sex drives of anyone I've ever met. I would be literally 100% okay if I never had sex again. I jack off maybe once a week if I have time, otherwise I've gone for over a month without even thinking about it.

So there you go. After living life as a gay man for 7 years I'm starting to doubt it's for me. I actually like the stereotypical scene, clubs, drinks, drag queens and underwear parties but aside from that, nothing else interests me. This is causing me a lot of turmoil and pain and I'm not sure what to do about it. Maybe I'm mostly asexual? Can anyone relate? Any advice?

**tl;dr** Be 25. Don't like girls at all. Attracted to men SOMETIMES. Never had a crush/been in love. All relationships fail due to my lack of interest. Never had sex I enjoyed. Hate it when men compliment/flirt with me. Very low sex drive. Feeling really shitty. What do?","&lt;!-- SC_OFF --&gt;&lt;div class=""md""&gt;&lt;p&gt;Long post ahead. I&amp;#39;m 25 btw.&lt;/p&gt;

&lt;p&gt;So I was driving to work this morning and stuck in traffic when I got to thinking. Maybe I&amp;#39;ve been wrong all this time. I know I&amp;#39;m not straight because I&amp;#39;m not attracted or interested in women at all. But after the 100% failure rate in relationships with men that I&amp;#39;ve had, and the complete disinterest I have in dating, I&amp;#39;ve come to a fork in the road. Am I really gay? My reasoning is as follows.&lt;/p&gt;

&lt;ol&gt;
&lt;li&gt;&lt;p&gt;I have never been in love. I&amp;#39;ve never had a crush, or felt anything more than a momentary lust for a man. I&amp;#39;m not kidding, the male face and body appeals to me on a generic level, but at no time have I ever envisioned myself being with any guy I&amp;#39;ve ever met. I have dated 3 men (all less than 3 months) and all ended poorly because I had no interest in the beginning. I thought I would feel something if I kept with it, but that never materialized. I know this is wrong because it&amp;#39;s a way of leading the guy on, but in my most messed up moments I justify it by thinking that the feelings of affection will just come around naturally. They haven&amp;#39;t.&lt;/p&gt;&lt;/li&gt;
&lt;li&gt;&lt;p&gt;I have never had an enjoyable sexual encounter. I have had full on sex with 8 different guys and oral with about 15. I have never been glad I did it. Either it ends with me going limp or I have to strain with all my might to finish myself off. No matter what I feel regretful it happened. You might think, why did he have sex when he wasn&amp;#39;t attracted to these people? The reason is because I&amp;#39;ve been thinking it would come along naturally, that maybe it just wasn&amp;#39;t the right time or something. So I kept trying. &lt;/p&gt;&lt;/li&gt;
&lt;li&gt;&lt;p&gt;When guys try to chat me up or compliment me, it&amp;#39;s a total turn off. The most surefire to get me to not want to talk to you is to come on to me. It makes me fill up with dread and anxiety because I cannot reciprocate the feelings you might have for me. Cue the guilt about misleading the guy if I respond the wrong way. This has basically ruined friendships for me and I&amp;#39;m sure has made people think I&amp;#39;m a real jerk when in reality I think I&amp;#39;m just messed up.&lt;/p&gt;&lt;/li&gt;
&lt;li&gt;&lt;p&gt;I have one of the lowest sex drives of anyone I&amp;#39;ve ever met. I would be literally 100% okay if I never had sex again. I jack off maybe once a week if I have time, otherwise I&amp;#39;ve gone for over a month without even thinking about it.&lt;/p&gt;&lt;/li&gt;
&lt;/ol&gt;

&lt;p&gt;So there you go. After living life as a gay man for 7 years I&amp;#39;m starting to doubt it&amp;#39;s for me. I actually like the stereotypical scene, clubs, drinks, drag queens and underwear parties but aside from that, nothing else interests me. This is causing me a lot of turmoil and pain and I&amp;#39;m not sure what to do about it. Maybe I&amp;#39;m mostly asexual? Can anyone relate? Any advice?&lt;/p&gt;

&lt;p&gt;&lt;strong&gt;tl;dr&lt;/strong&gt; Be 25. Don&amp;#39;t like girls at all. Attracted to men SOMETIMES. Never had a crush/been in love. All relationships fail due to my lack of interest. Never had sex I enjoyed. Hate it when men compliment/flirt with me. Very low sex drive. Feeling really shitty. What do?&lt;/p&gt;
&lt;/div&gt;&lt;!-- SC_ON --&gt;","False","askgaybros","t5_2vgfw","","","Maybe I'm not gay after all?","16","http://www.reddit.com/r/askgaybros/comments/2sazq5/maybe_im_not_gay_after_all/","[]","False"
