"","_comment_sort","_comments","_comments_by_id","_info_url","_orphaned","_params","_replaced_more","_underscore_names","approved_by","archived","author","author_flair_css_class","author_flair_text","banned_by","clicked","created","created_utc","distinguished","domain","downs","edited","gilded","has_fetched","hidden","id","is_self","json_dict","likes","link_flair_css_class","link_flair_text","media","media_embed","mod_reports","name","num_comments","num_reports","over_18","permalink","reddit_session","report_reasons","saved","score","secure_media","secure_media_embed","selftext","selftext_html","stickied","subreddit","subreddit_id","suggested_sort","thumbnail","title","ups","url","user_reports","visited"
"10","","","{}","http://www.reddit.com/api/info/","{}","{}","False","","","True","BigBearBrendo","","","","False","1414416060.0","1414412460.0","","self.askgaybros","0","False","0","True","False","2kghgu","True","","","","","","{}","[]","t3_2kghgu","8","","False","http://www.reddit.com/r/askgaybros/comments/2kghgu/how_to_deal_with_constant_increasing_stress/","Unauthenticated reddit sesssion","","False","14","","{}","Lately I've been feeling run down, tired, stressed and just generally bleh, despite my outward show of bravado, energy, enthusiasm and happiness.  I've got a beautiful bf, a stable job earning an okay income, friends that would do anything for me and family that loves me.  However I work full time, study full time, run my own business which is failing (not from a lack of trying to keep it from sinking), massive debt due to said business, slipping grades, jealousy issues with relationship, family issues and trying to find my feet as a self sufficient adult.  I am the sounding board for everyone else's problems, the rock for everyone to lean on, I'm generous, loyal and trusting to a fault.  

I've propped up my family since the age of 18, I've potentially sacrificed my future in an attempt to help my parents financially.  I have lost loved ones, I have failed successively 3 times to finish law school with each time failing being because I've had to choose between family and school or have had some kind of loss of a loved one.  I just feel like a failure right now, I feel stressed, burnt out, exhausted and rundown.  I know I'm rambling right now but I just need to get this the fuck out of my system so as I don't end up burdening the guy I love and stressing him out or my friends or family.  I don't know what the fucking point of this all is but to say fuck this right now I want to quit and run away.  Or at least get blind rotten drunk or high as fuck so as to calm my thoughts.  

Anyone else ever felt so fucking I don't know stressed, fuzzy, tired and rundown?  I used to deal with this well just by not thinking about it and pushing through ""smile it's not that bad"" but I just can't right now.  I want to punch and kick and scream.  How the fuck do I go back to being ""normal"" and just pushing through it?","&lt;!-- SC_OFF --&gt;&lt;div class=""md""&gt;&lt;p&gt;Lately I&amp;#39;ve been feeling run down, tired, stressed and just generally bleh, despite my outward show of bravado, energy, enthusiasm and happiness.  I&amp;#39;ve got a beautiful bf, a stable job earning an okay income, friends that would do anything for me and family that loves me.  However I work full time, study full time, run my own business which is failing (not from a lack of trying to keep it from sinking), massive debt due to said business, slipping grades, jealousy issues with relationship, family issues and trying to find my feet as a self sufficient adult.  I am the sounding board for everyone else&amp;#39;s problems, the rock for everyone to lean on, I&amp;#39;m generous, loyal and trusting to a fault.  &lt;/p&gt;

&lt;p&gt;I&amp;#39;ve propped up my family since the age of 18, I&amp;#39;ve potentially sacrificed my future in an attempt to help my parents financially.  I have lost loved ones, I have failed successively 3 times to finish law school with each time failing being because I&amp;#39;ve had to choose between family and school or have had some kind of loss of a loved one.  I just feel like a failure right now, I feel stressed, burnt out, exhausted and rundown.  I know I&amp;#39;m rambling right now but I just need to get this the fuck out of my system so as I don&amp;#39;t end up burdening the guy I love and stressing him out or my friends or family.  I don&amp;#39;t know what the fucking point of this all is but to say fuck this right now I want to quit and run away.  Or at least get blind rotten drunk or high as fuck so as to calm my thoughts.  &lt;/p&gt;

&lt;p&gt;Anyone else ever felt so fucking I don&amp;#39;t know stressed, fuzzy, tired and rundown?  I used to deal with this well just by not thinking about it and pushing through &amp;quot;smile it&amp;#39;s not that bad&amp;quot; but I just can&amp;#39;t right now.  I want to punch and kick and scream.  How the fuck do I go back to being &amp;quot;normal&amp;quot; and just pushing through it?&lt;/p&gt;
&lt;/div&gt;&lt;!-- SC_ON --&gt;","False","askgaybros","t5_2vgfw","","","How to deal with constant increasing stress","14","http://www.reddit.com/r/askgaybros/comments/2kghgu/how_to_deal_with_constant_increasing_stress/","[]","False"
"11","","","{}","http://www.reddit.com/api/info/","{}","{}","False","","","True","multiplesarcasms31","","","","False","1414409195.0","1414405595.0","","self.askgaybros","0","False","0","True","False","2kgahw","True","","","","","","{}","[]","t3_2kgahw","41","","False","http://www.reddit.com/r/askgaybros/comments/2kgahw/how_do_you_feel_about_cute_guys/","Unauthenticated reddit sesssion","","False","21","","{}","So recently, I've been thinking about the intimate interactions I've had with men, and realized that all of them have described me as ""cute"". I've been called hot maybe a few times, and seldom things like ""pretty"" (which is kind of funny IMO) and gorgeous, but have been called ""cute"" or ""cutie"" more times than I can count and have heard guys go ""Aww"" at things I do/say a lot as well. 

In all honesty, I think it's a great compliment and I have no problem with this (it beats the hell out of being called ugly!) but was just wondering when it comes to dating and what not, how guys feel about being with someone who is cute as opposed to hot or sexy. Do you think cute/adorable guys are appealing or that hot is more preferable?
","&lt;!-- SC_OFF --&gt;&lt;div class=""md""&gt;&lt;p&gt;So recently, I&amp;#39;ve been thinking about the intimate interactions I&amp;#39;ve had with men, and realized that all of them have described me as &amp;quot;cute&amp;quot;. I&amp;#39;ve been called hot maybe a few times, and seldom things like &amp;quot;pretty&amp;quot; (which is kind of funny IMO) and gorgeous, but have been called &amp;quot;cute&amp;quot; or &amp;quot;cutie&amp;quot; more times than I can count and have heard guys go &amp;quot;Aww&amp;quot; at things I do/say a lot as well. &lt;/p&gt;

&lt;p&gt;In all honesty, I think it&amp;#39;s a great compliment and I have no problem with this (it beats the hell out of being called ugly!) but was just wondering when it comes to dating and what not, how guys feel about being with someone who is cute as opposed to hot or sexy. Do you think cute/adorable guys are appealing or that hot is more preferable?&lt;/p&gt;
&lt;/div&gt;&lt;!-- SC_ON --&gt;","False","askgaybros","t5_2vgfw","","","How do you feel about ""cute"" guys?","21","http://www.reddit.com/r/askgaybros/comments/2kgahw/how_do_you_feel_about_cute_guys/","[]","False"
"12","","","{}","http://www.reddit.com/api/info/","{}","{}","False","","","True","PM_ME_YOUR_BONERS","","","","False","1414400118.0","1414396518.0","","self.askgaybros","0","False","0","True","False","2kg2pu","True","","","","","","{}","[]","t3_2kg2pu","14","","False","http://www.reddit.com/r/askgaybros/comments/2kg2pu/rape_fantasies/","Unauthenticated reddit sesssion","","False","19","","{}","*Emphasis* on the word fantasy.

Would never want to rape someone, be raped, have someone be raped, or watch somebody be actually raped.

But the entire concept is just so hot as a fantasy.

Any other bros have the same fetish? Anyone got particularly good vids (of staged rape with actors)? Bonus points if the actor getting boned is portrayed as straight.","&lt;!-- SC_OFF --&gt;&lt;div class=""md""&gt;&lt;p&gt;&lt;em&gt;Emphasis&lt;/em&gt; on the word fantasy.&lt;/p&gt;

&lt;p&gt;Would never want to rape someone, be raped, have someone be raped, or watch somebody be actually raped.&lt;/p&gt;

&lt;p&gt;But the entire concept is just so hot as a fantasy.&lt;/p&gt;

&lt;p&gt;Any other bros have the same fetish? Anyone got particularly good vids (of staged rape with actors)? Bonus points if the actor getting boned is portrayed as straight.&lt;/p&gt;
&lt;/div&gt;&lt;!-- SC_ON --&gt;","False","askgaybros","t5_2vgfw","","","Rape fantasies?","19","http://www.reddit.com/r/askgaybros/comments/2kg2pu/rape_fantasies/","[]","False"
"13","","","{}","http://www.reddit.com/api/info/","{}","{}","False","","","True","that429writer","","","","False","1414395074.0","1414391474.0","","self.askgaybros","0","False","0","True","False","2kfxz8","True","","","","","","{}","[]","t3_2kfxz8","4","","False","http://www.reddit.com/r/askgaybros/comments/2kfxz8/coming_out_and_extended_family/","Unauthenticated reddit sesssion","","False","1","","{}","I just recently started thinking about this and I have two questions for you guys. 

1. What is your personal definition of coming out and being out of the closet? 

2. Does everyone in your family know that you are gay? 

I'm out to my immediate family and my father spread the word to my extended family, but I have yet to tell them myself. While I'm personally fine with this situation, I want to know any other similar or different situations you guys are in as far as being out. ","&lt;!-- SC_OFF --&gt;&lt;div class=""md""&gt;&lt;p&gt;I just recently started thinking about this and I have two questions for you guys. &lt;/p&gt;

&lt;ol&gt;
&lt;li&gt;&lt;p&gt;What is your personal definition of coming out and being out of the closet? &lt;/p&gt;&lt;/li&gt;
&lt;li&gt;&lt;p&gt;Does everyone in your family know that you are gay? &lt;/p&gt;&lt;/li&gt;
&lt;/ol&gt;

&lt;p&gt;I&amp;#39;m out to my immediate family and my father spread the word to my extended family, but I have yet to tell them myself. While I&amp;#39;m personally fine with this situation, I want to know any other similar or different situations you guys are in as far as being out. &lt;/p&gt;
&lt;/div&gt;&lt;!-- SC_ON --&gt;","False","askgaybros","t5_2vgfw","","","Coming out and extended family?","1","http://www.reddit.com/r/askgaybros/comments/2kfxz8/coming_out_and_extended_family/","[]","False"
"14","","","{}","http://www.reddit.com/api/info/","{}","{}","False","","","True","h3dg3-Wytch","","","","False","1414392422.0","1414388822.0","","self.askgaybros","0","False","0","True","False","2kfv2t","True","","","","","","{}","[]","t3_2kfv2t","9","","False","http://www.reddit.com/r/askgaybros/comments/2kfv2t/why_is_gay_life_so_centered_around_bars/","Unauthenticated reddit sesssion","","False","3","","{}","Hey there. I am a 19 year old gay male, and have just moved to a major metropolitan area for university. I have noticed a lot of gay socializing, events, and meeting up is often in bars or clubs. Why is this?  ","&lt;!-- SC_OFF --&gt;&lt;div class=""md""&gt;&lt;p&gt;Hey there. I am a 19 year old gay male, and have just moved to a major metropolitan area for university. I have noticed a lot of gay socializing, events, and meeting up is often in bars or clubs. Why is this?  &lt;/p&gt;
&lt;/div&gt;&lt;!-- SC_ON --&gt;","False","askgaybros","t5_2vgfw","","","Why is gay life so centered around bars?","3","http://www.reddit.com/r/askgaybros/comments/2kfv2t/why_is_gay_life_so_centered_around_bars/","[]","False"
"15","","","{}","http://www.reddit.com/api/info/","{}","{}","False","","","True","Laika_Come_Home","","","","False","1414385266.0","1414381666.0","","self.askgaybros","0","False","0","True","False","2kflvb","True","","","","","","{}","[]","t3_2kflvb","10","","False","http://www.reddit.com/r/askgaybros/comments/2kflvb/what_can_i_do_if_i_dont_photograph_well/","Unauthenticated reddit sesssion","","False","1","","{}","I mean, I can tinker around with shots and angles on my own, but what I'm talking about is whenever OTHER people take my pictures.

Often times, I look HIDEOUS. ESPECIALLY if it's dark and/or the flash is utilized.

What can I do? I feel like it sends the wrong impression of me to other people.","&lt;!-- SC_OFF --&gt;&lt;div class=""md""&gt;&lt;p&gt;I mean, I can tinker around with shots and angles on my own, but what I&amp;#39;m talking about is whenever OTHER people take my pictures.&lt;/p&gt;

&lt;p&gt;Often times, I look HIDEOUS. ESPECIALLY if it&amp;#39;s dark and/or the flash is utilized.&lt;/p&gt;

&lt;p&gt;What can I do? I feel like it sends the wrong impression of me to other people.&lt;/p&gt;
&lt;/div&gt;&lt;!-- SC_ON --&gt;","False","askgaybros","t5_2vgfw","","","What can I do if I don't photograph well?","1","http://www.reddit.com/r/askgaybros/comments/2kflvb/what_can_i_do_if_i_dont_photograph_well/","[]","False"
"16","","","{}","http://www.reddit.com/api/info/","{}","{}","False","","","True","YoBro_CanIBlow","","","","False","1414382061.0","1414378461.0","","self.askgaybros","0","False","0","True","False","2kfgt7","True","","","","","","{}","[]","t3_2kfgt7","19","","False","http://www.reddit.com/r/askgaybros/comments/2kfgt7/infatuated_with_my_own_dick/","Unauthenticated reddit sesssion","","False","12","","{}","Hey, bros. Been hesitant to post, but am curious as to how common this is. 

Over the last few years, I've found myself more and more attracted to my own junk.  
I truly believe that I have one of THE hottest dicks I've ever seen (and I've had my share over the years). Hangs low, great hard/soft length, girth, perfectly-shaped head, coloring, etc. From a grooming standpoint, he's always ready for his close-up. Yes... If I could, I'd totally do the self-suck 'thing'. I've recently started free ballin' whenever I'm able (I especially love the stares that I get from other guys). At home, I'm naked almost all of the time. It's freeing. I'm just in awe of him.

Before anyone suggests that I'm vain, I'm NOT; far from it, actually.  I'm average-looking, and have always lacked self-confidence. That's why this recent obsession of mine is worth looking into.

Thoughts? Be kind, please.
","&lt;!-- SC_OFF --&gt;&lt;div class=""md""&gt;&lt;p&gt;Hey, bros. Been hesitant to post, but am curious as to how common this is. &lt;/p&gt;

&lt;p&gt;Over the last few years, I&amp;#39;ve found myself more and more attracted to my own junk.&lt;br/&gt;
I truly believe that I have one of THE hottest dicks I&amp;#39;ve ever seen (and I&amp;#39;ve had my share over the years). Hangs low, great hard/soft length, girth, perfectly-shaped head, coloring, etc. From a grooming standpoint, he&amp;#39;s always ready for his close-up. Yes... If I could, I&amp;#39;d totally do the self-suck &amp;#39;thing&amp;#39;. I&amp;#39;ve recently started free ballin&amp;#39; whenever I&amp;#39;m able (I especially love the stares that I get from other guys). At home, I&amp;#39;m naked almost all of the time. It&amp;#39;s freeing. I&amp;#39;m just in awe of him.&lt;/p&gt;

&lt;p&gt;Before anyone suggests that I&amp;#39;m vain, I&amp;#39;m NOT; far from it, actually.  I&amp;#39;m average-looking, and have always lacked self-confidence. That&amp;#39;s why this recent obsession of mine is worth looking into.&lt;/p&gt;

&lt;p&gt;Thoughts? Be kind, please.&lt;/p&gt;
&lt;/div&gt;&lt;!-- SC_ON --&gt;","False","askgaybros","t5_2vgfw","","","Infatuated with my own dick","12","http://www.reddit.com/r/askgaybros/comments/2kfgt7/infatuated_with_my_own_dick/","[]","False"
"17","","","{}","http://www.reddit.com/api/info/","{}","{}","False","","","True","Throwagay9876","","","","False","1414381885.0","1414378285.0","","self.askgaybros","0","False","0","True","False","2kfgjz","True","","","","","","{}","[]","t3_2kfgjz","18","","False","http://www.reddit.com/r/askgaybros/comments/2kfgjz/cant_seem_to_like_a_guy_unless_we_are_friends/","Unauthenticated reddit sesssion","","False","6","","{}","So here is my problem: I can't seem to fall for a guy unless we are friends first. I have a really bad habit of falling for my friends. I've had several straight crushes on my best friends that led to me having my heart very broken. My only gay friend lives two states away and I feel for him too. 

Now, I've only been on two dates in my entire life, but It's really hard for me to be interested in a guy when we go on dates. I don't know if this is because gay guys are just really hard to find and the ones that are actually willing to go out with me are just desperate and incompatible or if I really just can't fall for a guy unless we are friends first. 

Any advice? I think this is going to make my chances of ever finding a guy to love very unlikely. Is there something I'm doing wrong? ","&lt;!-- SC_OFF --&gt;&lt;div class=""md""&gt;&lt;p&gt;So here is my problem: I can&amp;#39;t seem to fall for a guy unless we are friends first. I have a really bad habit of falling for my friends. I&amp;#39;ve had several straight crushes on my best friends that led to me having my heart very broken. My only gay friend lives two states away and I feel for him too. &lt;/p&gt;

&lt;p&gt;Now, I&amp;#39;ve only been on two dates in my entire life, but It&amp;#39;s really hard for me to be interested in a guy when we go on dates. I don&amp;#39;t know if this is because gay guys are just really hard to find and the ones that are actually willing to go out with me are just desperate and incompatible or if I really just can&amp;#39;t fall for a guy unless we are friends first. &lt;/p&gt;

&lt;p&gt;Any advice? I think this is going to make my chances of ever finding a guy to love very unlikely. Is there something I&amp;#39;m doing wrong? &lt;/p&gt;
&lt;/div&gt;&lt;!-- SC_ON --&gt;","False","askgaybros","t5_2vgfw","","","Can't seem to like a guy unless we are friends first.","6","http://www.reddit.com/r/askgaybros/comments/2kfgjz/cant_seem_to_like_a_guy_unless_we_are_friends/","[]","False"
"18","","","{}","http://www.reddit.com/api/info/","{}","{}","False","","","True","possibly_quadruped","","","","False","1414379079.0","1414375479.0","","self.askgaybros","0","False","0","True","False","2kfbto","True","","","","","","{}","[]","t3_2kfbto","43","","False","http://www.reddit.com/r/askgaybros/comments/2kfbto/alright_bros_lets_talk_cum_rags/","Unauthenticated reddit sesssion","","False","14","","{}","Legit.

I've gotten addicted to blowing my load in the boxers I've word that day, which then obviously get kicked into the laundry.

Bonus: I like smooth boxers, so that pretty much eliminates the need for messy lube.

Downside: My washing machine might wind up pregnant.

What do you guys do?  Toilet paper, paper towel, kleenex, eat that shit up, what.

Oh, and if we could get through this topic without anyone mentioning the cum box, the 2-liter bottle guy, etc etc, that'd be *just great.*  (Seriously, please don't even ask, just google those if you want to know.)  Unless that's actually your freak.","&lt;!-- SC_OFF --&gt;&lt;div class=""md""&gt;&lt;p&gt;Legit.&lt;/p&gt;

&lt;p&gt;I&amp;#39;ve gotten addicted to blowing my load in the boxers I&amp;#39;ve word that day, which then obviously get kicked into the laundry.&lt;/p&gt;

&lt;p&gt;Bonus: I like smooth boxers, so that pretty much eliminates the need for messy lube.&lt;/p&gt;

&lt;p&gt;Downside: My washing machine might wind up pregnant.&lt;/p&gt;

&lt;p&gt;What do you guys do?  Toilet paper, paper towel, kleenex, eat that shit up, what.&lt;/p&gt;

&lt;p&gt;Oh, and if we could get through this topic without anyone mentioning the cum box, the 2-liter bottle guy, etc etc, that&amp;#39;d be &lt;em&gt;just great.&lt;/em&gt;  (Seriously, please don&amp;#39;t even ask, just google those if you want to know.)  Unless that&amp;#39;s actually your freak.&lt;/p&gt;
&lt;/div&gt;&lt;!-- SC_ON --&gt;","False","askgaybros","t5_2vgfw","","","Alright, bros, let's talk cum rags.","14","http://www.reddit.com/r/askgaybros/comments/2kfbto/alright_bros_lets_talk_cum_rags/","[]","False"
"19","","","{}","http://www.reddit.com/api/info/","{}","{}","False","","","True","theseeker1991","","","","False","1414378037.0","1414374437.0","","self.askgaybros","0","1414374709.0","0","True","False","2kfa3r","True","","","","","","{}","[]","t3_2kfa3r","1","","False","http://www.reddit.com/r/askgaybros/comments/2kfa3r/what_should_i_do_i_need_some_advice/","Unauthenticated reddit sesssion","","False","2","","{}","Hi guys... So I'm from Singapore, currently going through my second year in college. Since earlier this year, I've realized and started to accept that I'm gay. As it stands now, the local government doesn't give a crap about us LGBT folk (gay sex is illegal here, although it's supposedly just ""symbolic""), the society here is generally too conservative (because Asia) to be openly gay or show any forms of homosexual PDA. Most parents - mine included, [from what I've heard from them](http://www.reddit.com/r/askgaybros/comments/2b7m3z/what_do_you_make_of_my_dads_opinion/) - basically can't accept their children being gay, attributes it to improper upbringing and/or bad influence. There ***are*** some sort of a gay community/scene here, however minute, and while I've never really been in a relationship before (straight or gay), from what I've heard from a close friend, relationships are extremely uncommon here........either due to societal pressures, or most are just looking for hookups anyway. 

So what I'm asking is, what should I do then? I've talked to some guys from here on Reddit, and their best advice would be to move to somewhere more LGBT-friendly. But where would be the best place? US? Canada? And how do I go about doing that exactly? It isn't exactly that easy to up and leave somewhere that I've been living in for my entire life, and move to somewhere completely foreign..... and not to mention other stuff such as citizenship and employment. I've heard of stuff such as LGBT countries accepting LGBT refugees that are seeking asylum, but I doubt the situation here is dire/fatal enough that I'd be seen as such. And has anyone been through this before? Is there anyone out there in a similar situation that can give advice to this? Is there a course of action that I should start taking now?  ","&lt;!-- SC_OFF --&gt;&lt;div class=""md""&gt;&lt;p&gt;Hi guys... So I&amp;#39;m from Singapore, currently going through my second year in college. Since earlier this year, I&amp;#39;ve realized and started to accept that I&amp;#39;m gay. As it stands now, the local government doesn&amp;#39;t give a crap about us LGBT folk (gay sex is illegal here, although it&amp;#39;s supposedly just &amp;quot;symbolic&amp;quot;), the society here is generally too conservative (because Asia) to be openly gay or show any forms of homosexual PDA. Most parents - mine included, &lt;a href=""http://www.reddit.com/r/askgaybros/comments/2b7m3z/what_do_you_make_of_my_dads_opinion/""&gt;from what I&amp;#39;ve heard from them&lt;/a&gt; - basically can&amp;#39;t accept their children being gay, attributes it to improper upbringing and/or bad influence. There &lt;strong&gt;&lt;em&gt;are&lt;/em&gt;&lt;/strong&gt; some sort of a gay community/scene here, however minute, and while I&amp;#39;ve never really been in a relationship before (straight or gay), from what I&amp;#39;ve heard from a close friend, relationships are extremely uncommon here........either due to societal pressures, or most are just looking for hookups anyway. &lt;/p&gt;

&lt;p&gt;So what I&amp;#39;m asking is, what should I do then? I&amp;#39;ve talked to some guys from here on Reddit, and their best advice would be to move to somewhere more LGBT-friendly. But where would be the best place? US? Canada? And how do I go about doing that exactly? It isn&amp;#39;t exactly that easy to up and leave somewhere that I&amp;#39;ve been living in for my entire life, and move to somewhere completely foreign..... and not to mention other stuff such as citizenship and employment. I&amp;#39;ve heard of stuff such as LGBT countries accepting LGBT refugees that are seeking asylum, but I doubt the situation here is dire/fatal enough that I&amp;#39;d be seen as such. And has anyone been through this before? Is there anyone out there in a similar situation that can give advice to this? Is there a course of action that I should start taking now?  &lt;/p&gt;
&lt;/div&gt;&lt;!-- SC_ON --&gt;","False","askgaybros","t5_2vgfw","","","What should I do? I need some advice...","2","http://www.reddit.com/r/askgaybros/comments/2kfa3r/what_should_i_do_i_need_some_advice/","[]","False"
