"","_comment_sort","_comments","_comments_by_id","_info_url","_orphaned","_params","_replaced_more","_underscore_names","approved_by","archived","author","author_flair_css_class","author_flair_text","banned_by","clicked","created","created_utc","distinguished","domain","downs","edited","gilded","has_fetched","hidden","id","is_self","json_dict","likes","link_flair_css_class","link_flair_text","media","media_embed","mod_reports","name","num_comments","num_reports","over_18","permalink","reddit_session","report_reasons","saved","score","secure_media","secure_media_embed","selftext","selftext_html","stickied","subreddit","subreddit_id","suggested_sort","thumbnail","title","ups","url","user_reports","visited"
"15","","","{}","http://www.reddit.com/api/info/","{}","{}","False","","","True","oneLguy","","","","False","1410223610.0","1410220010.0","","self.askgaybros","0","False","0","True","False","2fuv10","True","","","","","","{}","[]","t3_2fuv10","10","","False","http://www.reddit.com/r/askgaybros/comments/2fuv10/dealing_with_hot_guys_you_cant_date/","Unauthenticated reddit sesssion","","False","1","","{}","College freshman here. It hasn't even been a month, and I'm already blown away by how many attractive guys there are around here. Every time I stop by the cafeteria or walk the halls, I see dozens of bros take make me do a double take.

And they're all straight of course, all out of my league. What the heck can I do about this? ","&lt;!-- SC_OFF --&gt;&lt;div class=""md""&gt;&lt;p&gt;College freshman here. It hasn&amp;#39;t even been a month, and I&amp;#39;m already blown away by how many attractive guys there are around here. Every time I stop by the cafeteria or walk the halls, I see dozens of bros take make me do a double take.&lt;/p&gt;

&lt;p&gt;And they&amp;#39;re all straight of course, all out of my league. What the heck can I do about this? &lt;/p&gt;
&lt;/div&gt;&lt;!-- SC_ON --&gt;","False","askgaybros","t5_2vgfw","","","Dealing with hot guys you can't date?","1","http://www.reddit.com/r/askgaybros/comments/2fuv10/dealing_with_hot_guys_you_cant_date/","[]","False"
"16","","","{}","http://www.reddit.com/api/info/","{}","{}","False","","","True","ayjaydit","","","","False","1410223136.0","1410219536.0","","self.askgaybros","0","1410220345.0","0","True","False","2fuu9o","True","","","","","","{}","[]","t3_2fuu9o","13","","False","http://www.reddit.com/r/askgaybros/comments/2fuu9o/i_need_help_raskgaybros_in_the_name_of_love_which/","Unauthenticated reddit sesssion","","False","0","","{}","First off, I apologize if this is kind of an unusual request for advice.  Anyways, I hope you won't mind giving your upvote/downvote in the comments.  Feel free to provide feedback as well.  Thanks!

* [Picture One](http://i.imgur.com/H4gJwIg.jpg)

* [Picture Two](http://i.imgur.com/qjpydjI.jpg)

* [Picture Three](http://i.imgur.com/tqYTkyO.jpg)

","&lt;!-- SC_OFF --&gt;&lt;div class=""md""&gt;&lt;p&gt;First off, I apologize if this is kind of an unusual request for advice.  Anyways, I hope you won&amp;#39;t mind giving your upvote/downvote in the comments.  Feel free to provide feedback as well.  Thanks!&lt;/p&gt;

&lt;ul&gt;
&lt;li&gt;&lt;p&gt;&lt;a href=""http://i.imgur.com/H4gJwIg.jpg""&gt;Picture One&lt;/a&gt;&lt;/p&gt;&lt;/li&gt;
&lt;li&gt;&lt;p&gt;&lt;a href=""http://i.imgur.com/qjpydjI.jpg""&gt;Picture Two&lt;/a&gt;&lt;/p&gt;&lt;/li&gt;
&lt;li&gt;&lt;p&gt;&lt;a href=""http://i.imgur.com/tqYTkyO.jpg""&gt;Picture Three&lt;/a&gt;&lt;/p&gt;&lt;/li&gt;
&lt;/ul&gt;
&lt;/div&gt;&lt;!-- SC_ON --&gt;","False","askgaybros","t5_2vgfw","","","I need help /r/askgaybros in the name of love... Which of these 3 pics is good as a profile pic on dating sites/apps?","0","http://www.reddit.com/r/askgaybros/comments/2fuu9o/i_need_help_raskgaybros_in_the_name_of_love_which/","[]","False"
"17","","","{}","http://www.reddit.com/api/info/","{}","{}","False","","","True","SmilingLimes","","","","False","1410219576.0","1410215976.0","","self.askgaybros","0","False","0","True","False","2fuo4g","True","","","","","","{}","[]","t3_2fuo4g","26","","False","http://www.reddit.com/r/askgaybros/comments/2fuo4g/any_good_graphic_novels/","Unauthenticated reddit sesssion","","False","7","","{}","I'm just getting into to graphic novels and were looking for some recommendations of titles and authors. ","&lt;!-- SC_OFF --&gt;&lt;div class=""md""&gt;&lt;p&gt;I&amp;#39;m just getting into to graphic novels and were looking for some recommendations of titles and authors. &lt;/p&gt;
&lt;/div&gt;&lt;!-- SC_ON --&gt;","False","askgaybros","t5_2vgfw","","","Any good graphic novels?","7","http://www.reddit.com/r/askgaybros/comments/2fuo4g/any_good_graphic_novels/","[]","False"
"18","","","{}","http://www.reddit.com/api/info/","{}","{}","False","","","True","InsertW1ttyNameHere","","","","False","1410218409.0","1410214809.0","","self.askgaybros","0","False","0","True","False","2fulzm","True","","","","","","{}","[]","t3_2fulzm","7","","False","http://www.reddit.com/r/askgaybros/comments/2fulzm/feeling_distracted_and_i_cant_really_pin_point_why/","Unauthenticated reddit sesssion","","False","6","","{}","Hey all, I have a question for you and I don't know if you guys ever experienced this.

For the past few years since graduating out of high school, I've noticed that I've been *distracted* more than usual. I can't seem to focus on university, work, and even every day things like chores. 

It feels like my mind is ""clouded"", and I can't seem to pin point the reason why. I'm in my final year of university and I don't really know where I'm going after that. I'm also still in the closet (if that matters to anyone), 22 years old and I've been a little guy crazy, checking out hotties at school and in class more than usual. 

I've never felt like this ever when I was younger and now that I'm in my final year of uni, I kind of want to finish strong. So what's going on?

Am I going through a 20-something year old crisis?
Could being in the closet cause my brain fog?
Something else? All of the above? I could really use the advice.","&lt;!-- SC_OFF --&gt;&lt;div class=""md""&gt;&lt;p&gt;Hey all, I have a question for you and I don&amp;#39;t know if you guys ever experienced this.&lt;/p&gt;

&lt;p&gt;For the past few years since graduating out of high school, I&amp;#39;ve noticed that I&amp;#39;ve been &lt;em&gt;distracted&lt;/em&gt; more than usual. I can&amp;#39;t seem to focus on university, work, and even every day things like chores. &lt;/p&gt;

&lt;p&gt;It feels like my mind is &amp;quot;clouded&amp;quot;, and I can&amp;#39;t seem to pin point the reason why. I&amp;#39;m in my final year of university and I don&amp;#39;t really know where I&amp;#39;m going after that. I&amp;#39;m also still in the closet (if that matters to anyone), 22 years old and I&amp;#39;ve been a little guy crazy, checking out hotties at school and in class more than usual. &lt;/p&gt;

&lt;p&gt;I&amp;#39;ve never felt like this ever when I was younger and now that I&amp;#39;m in my final year of uni, I kind of want to finish strong. So what&amp;#39;s going on?&lt;/p&gt;

&lt;p&gt;Am I going through a 20-something year old crisis?
Could being in the closet cause my brain fog?
Something else? All of the above? I could really use the advice.&lt;/p&gt;
&lt;/div&gt;&lt;!-- SC_ON --&gt;","False","askgaybros","t5_2vgfw","","","Feeling distracted and I can't really pin point why...","6","http://www.reddit.com/r/askgaybros/comments/2fulzm/feeling_distracted_and_i_cant_really_pin_point_why/","[]","False"
"19","","","{}","http://www.reddit.com/api/info/","{}","{}","False","","","True","Bottomnewbie","","","","False","1410218352.0","1410214752.0","","self.askgaybros","0","False","0","True","False","2fulvj","True","","","","","","{}","[]","t3_2fulvj","7","","False","http://www.reddit.com/r/askgaybros/comments/2fulvj/should_i_go_down/","Unauthenticated reddit sesssion","","False","0","","{}","25 year old, bi guy.

Have a gf of 3 years.

Also have a much older booty call (60 year old man).

I've been seeing him for about 1.5 years...about 10 times in total so far.  I'm a bottom, he's a top.  We like 420 and poppers.  He loves to kiss my body, give me head (he swallows) and top me (condoms of course).  I like to make out with him and bottom.  I've never given him head, but I really want to.  I'm afraid of stds.  He says he is clean.  Should I suck him or avoid it?","&lt;!-- SC_OFF --&gt;&lt;div class=""md""&gt;&lt;p&gt;25 year old, bi guy.&lt;/p&gt;

&lt;p&gt;Have a gf of 3 years.&lt;/p&gt;

&lt;p&gt;Also have a much older booty call (60 year old man).&lt;/p&gt;

&lt;p&gt;I&amp;#39;ve been seeing him for about 1.5 years...about 10 times in total so far.  I&amp;#39;m a bottom, he&amp;#39;s a top.  We like 420 and poppers.  He loves to kiss my body, give me head (he swallows) and top me (condoms of course).  I like to make out with him and bottom.  I&amp;#39;ve never given him head, but I really want to.  I&amp;#39;m afraid of stds.  He says he is clean.  Should I suck him or avoid it?&lt;/p&gt;
&lt;/div&gt;&lt;!-- SC_ON --&gt;","False","askgaybros","t5_2vgfw","","","Should I Go Down?","0","http://www.reddit.com/r/askgaybros/comments/2fulvj/should_i_go_down/","[]","False"
"20","","","{}","http://www.reddit.com/api/info/","{}","{}","False","","","True","Bird_Or_The_Cage","","","","False","1410213469.0","1410209869.0","","self.askgaybros","0","False","0","True","False","2fuczk","True","","","","","","{}","[]","t3_2fuczk","21","","False","http://www.reddit.com/r/askgaybros/comments/2fuczk/how_do_i_lower_my_standards/","Unauthenticated reddit sesssion","","False","0","","{}","My standards are super fucking high, if I fell from my standards, my blood could paint a 10 by 10 meter square. Any help?","&lt;!-- SC_OFF --&gt;&lt;div class=""md""&gt;&lt;p&gt;My standards are super fucking high, if I fell from my standards, my blood could paint a 10 by 10 meter square. Any help?&lt;/p&gt;
&lt;/div&gt;&lt;!-- SC_ON --&gt;","False","askgaybros","t5_2vgfw","","","How do I lower my standards?","0","http://www.reddit.com/r/askgaybros/comments/2fuczk/how_do_i_lower_my_standards/","[]","False"
"21","","","{}","http://www.reddit.com/api/info/","{}","{}","False","","","True","amioverthinkingthiss","","","","False","1410211817.0","1410208217.0","","self.askgaybros","0","False","0","True","False","2fu9vt","True","","","","","","{}","[]","t3_2fu9vt","21","","False","http://www.reddit.com/r/askgaybros/comments/2fu9vt/did_i_break_a_cardinal_rule_by_messing_around/","Unauthenticated reddit sesssion","","False","20","","{}","I'll set the scene:

Basically, I grew up with this guy. I've always pegged him for straight and maybe I still do. He's insanely attractive, smart, funny, sweet, and athletic. First off, I definitely have had/do have feelings for this guy so I guess that's a cardinal rule broken right there.

But here's what happened: We went out clubbing one night and were everything but sober when we got back home. Queue sexual tension. I convinced myself I made it up and went to sleep.

Two weeks later, I get a dick pic. By ""accident."" Okay..

Well this weekend we were at a party together drinking and blazing all day/night. Tension from the start. Everyone goes to bed and then I get a message from him on my phone - ""suck my dick.""

And I did. Almost without hesitation. We went outside and out of sight and did the deed. I was pretty intoxicated and consequently sloppy. Not my best work by a long shot.

After he came he said ""That felt really good, but I don't know man I'm sorry. I'm just don't know.."" Then I apologized? A few times. And was like ""oh, it's cool"", brushed my knees off and kissed his neck out of sheer awkwardness.

We both said something to the effect of ""nothing's going to be weird between us, I love you man."" and hugged it out. I went inside to clean up while he went to bed.

We haven't spoken of it since and I honestly don't know if I should say anything/what I would say even if I did.

Was I just an experiment? Did I mess up by messing around with this guy who I'm going to be around for the rest of my life?

I really like him but I don't know if I could ever expect anything more than what happened this weekend.

tl;dr: Messed around with presumably straight guy I grew up with that I've had feelings for, not sure of next move.","&lt;!-- SC_OFF --&gt;&lt;div class=""md""&gt;&lt;p&gt;I&amp;#39;ll set the scene:&lt;/p&gt;

&lt;p&gt;Basically, I grew up with this guy. I&amp;#39;ve always pegged him for straight and maybe I still do. He&amp;#39;s insanely attractive, smart, funny, sweet, and athletic. First off, I definitely have had/do have feelings for this guy so I guess that&amp;#39;s a cardinal rule broken right there.&lt;/p&gt;

&lt;p&gt;But here&amp;#39;s what happened: We went out clubbing one night and were everything but sober when we got back home. Queue sexual tension. I convinced myself I made it up and went to sleep.&lt;/p&gt;

&lt;p&gt;Two weeks later, I get a dick pic. By &amp;quot;accident.&amp;quot; Okay..&lt;/p&gt;

&lt;p&gt;Well this weekend we were at a party together drinking and blazing all day/night. Tension from the start. Everyone goes to bed and then I get a message from him on my phone - &amp;quot;suck my dick.&amp;quot;&lt;/p&gt;

&lt;p&gt;And I did. Almost without hesitation. We went outside and out of sight and did the deed. I was pretty intoxicated and consequently sloppy. Not my best work by a long shot.&lt;/p&gt;

&lt;p&gt;After he came he said &amp;quot;That felt really good, but I don&amp;#39;t know man I&amp;#39;m sorry. I&amp;#39;m just don&amp;#39;t know..&amp;quot; Then I apologized? A few times. And was like &amp;quot;oh, it&amp;#39;s cool&amp;quot;, brushed my knees off and kissed his neck out of sheer awkwardness.&lt;/p&gt;

&lt;p&gt;We both said something to the effect of &amp;quot;nothing&amp;#39;s going to be weird between us, I love you man.&amp;quot; and hugged it out. I went inside to clean up while he went to bed.&lt;/p&gt;

&lt;p&gt;We haven&amp;#39;t spoken of it since and I honestly don&amp;#39;t know if I should say anything/what I would say even if I did.&lt;/p&gt;

&lt;p&gt;Was I just an experiment? Did I mess up by messing around with this guy who I&amp;#39;m going to be around for the rest of my life?&lt;/p&gt;

&lt;p&gt;I really like him but I don&amp;#39;t know if I could ever expect anything more than what happened this weekend.&lt;/p&gt;

&lt;p&gt;tl;dr: Messed around with presumably straight guy I grew up with that I&amp;#39;ve had feelings for, not sure of next move.&lt;/p&gt;
&lt;/div&gt;&lt;!-- SC_ON --&gt;","False","askgaybros","t5_2vgfw","","","Did I break a cardinal rule by messing around with a presumably straight guy?","20","http://www.reddit.com/r/askgaybros/comments/2fu9vt/did_i_break_a_cardinal_rule_by_messing_around/","[]","False"
"22","","","{}","http://www.reddit.com/api/info/","{}","{}","False","","","True","irishartistry","","","","False","1410209254.0","1410205654.0","","self.askgaybros","0","1410205984.0","0","True","False","2fu4zu","True","","","","","","{}","[]","t3_2fu4zu","17","","False","http://www.reddit.com/r/askgaybros/comments/2fu4zu/ever_feel_like_the_universe_is_trying_to_tell_you/","Unauthenticated reddit sesssion","","False","7","","{}","This is so stupid but have you ever felt like the universe is telling you things? Over the past week or so, a lot of threads that relate to whatever situation my love life is going through atm have been popping up and answering questions I have but don't want to ask. 

Currently interested in a 31 year old guy (I'm 21) and I've noticed a few threads pop up with people asking about age differences etc. Even today in the ELI5 sub there was an answer from a user who is 30 dating a 20 year old girl:

&gt;Basically, if people have a problem with (legal) age differences in relationships it's because they themselves are insecure and still attempting to define an identity. This is why they're so hung up on outside metrics (age) to attempt evaluation of other people. They're still unaware, internally, what a person is. They haven't become one yet. Many people never do.
Once a person has forged an actual identity, they recognize that age means very little so far as meaningful interpersonal relationships. Let 'em hate. It doesn't affect me anyway.


I love that so much, honestly it's something I'll probably say to the guy I'm interested in because he is interested in me but I have this gut feeling, which is normally right unfortunately, that he's worried what people will think if anything serious ever came about because of the age difference. 

Also, at the minute, he got called back to another country for work. He's a scientist who works pay check to pay check not a steady 9-5. We were chatting and he said he definitely wants coffee when he gets back and asked me to check in with him to let him know how I was getting on. Well, I did and he hasn't replied. He always does reply and once before it took him a week to reply but he's very busy and also quite forgetful. Yesterday there was a post written about someone not replying to a text even though they're online on Grindr and another user wrote this to the OP that just clicked with me: 

&gt;The better question is why are you keeping tabs on his Grindr activity, and is it your business to be doing so?
""Busy"" means ""I'm doing something that is occupying my time"". He could be walking the dog, cleaning the house, going on Grindr... it doesn't matter. He is occupied with something that doesn't involve you. Unless you've agreed to start an exclusive relationship, you have no ground to stand on.
If you're losing a good feeling because he isn't dropping everything to talk to you, that's on you. 

Literally this one post made me go 'Ooh. Ok' and something in my head has clicked and quelled the fire in my head that made me overthink. 

I said earlier in the post that this guy is quite forgetful which is something I wouldn't have found out if I hadn't went my original route to where I was meeting him on our date. Basically, I was walking through the city centre and said to myself: 'Right I'll go *this* way to City Hall' but then I just had this feeling that I should go another way. I did and I ended up meeting him outside a bookstore (which is near City Hall) writing an email on his phone. He said to me that he's sorry for ignoring me but he really needed to send this email otherwise he'd forget. I then asked him how his weekend was and he looked so lost and just told me: 'If it isn't happening today I forget. I'm very forgetful.' This sounds so stupid but I do feel like this was more than a coincidence and finding out he was forgetful, something that wouldn't of happened if I went my original route, then I would definitely be freaking out 100% because he has forgot to reply to a stupid text, lol. 

EDIT: Just wanted to add for a bit of context, I am a bit of a spiritual person and I do believe what you put out there you will get back. Whether it's the Law of Attraction or whether it's karma I do feel like things happen for reasons :)


**TL;DR: So, is there anything that has made you think ""the universe is trying to tell me something?""**","&lt;!-- SC_OFF --&gt;&lt;div class=""md""&gt;&lt;p&gt;This is so stupid but have you ever felt like the universe is telling you things? Over the past week or so, a lot of threads that relate to whatever situation my love life is going through atm have been popping up and answering questions I have but don&amp;#39;t want to ask. &lt;/p&gt;

&lt;p&gt;Currently interested in a 31 year old guy (I&amp;#39;m 21) and I&amp;#39;ve noticed a few threads pop up with people asking about age differences etc. Even today in the ELI5 sub there was an answer from a user who is 30 dating a 20 year old girl:&lt;/p&gt;

&lt;blockquote&gt;
&lt;p&gt;Basically, if people have a problem with (legal) age differences in relationships it&amp;#39;s because they themselves are insecure and still attempting to define an identity. This is why they&amp;#39;re so hung up on outside metrics (age) to attempt evaluation of other people. They&amp;#39;re still unaware, internally, what a person is. They haven&amp;#39;t become one yet. Many people never do.
Once a person has forged an actual identity, they recognize that age means very little so far as meaningful interpersonal relationships. Let &amp;#39;em hate. It doesn&amp;#39;t affect me anyway.&lt;/p&gt;
&lt;/blockquote&gt;

&lt;p&gt;I love that so much, honestly it&amp;#39;s something I&amp;#39;ll probably say to the guy I&amp;#39;m interested in because he is interested in me but I have this gut feeling, which is normally right unfortunately, that he&amp;#39;s worried what people will think if anything serious ever came about because of the age difference. &lt;/p&gt;

&lt;p&gt;Also, at the minute, he got called back to another country for work. He&amp;#39;s a scientist who works pay check to pay check not a steady 9-5. We were chatting and he said he definitely wants coffee when he gets back and asked me to check in with him to let him know how I was getting on. Well, I did and he hasn&amp;#39;t replied. He always does reply and once before it took him a week to reply but he&amp;#39;s very busy and also quite forgetful. Yesterday there was a post written about someone not replying to a text even though they&amp;#39;re online on Grindr and another user wrote this to the OP that just clicked with me: &lt;/p&gt;

&lt;blockquote&gt;
&lt;p&gt;The better question is why are you keeping tabs on his Grindr activity, and is it your business to be doing so?
&amp;quot;Busy&amp;quot; means &amp;quot;I&amp;#39;m doing something that is occupying my time&amp;quot;. He could be walking the dog, cleaning the house, going on Grindr... it doesn&amp;#39;t matter. He is occupied with something that doesn&amp;#39;t involve you. Unless you&amp;#39;ve agreed to start an exclusive relationship, you have no ground to stand on.
If you&amp;#39;re losing a good feeling because he isn&amp;#39;t dropping everything to talk to you, that&amp;#39;s on you. &lt;/p&gt;
&lt;/blockquote&gt;

&lt;p&gt;Literally this one post made me go &amp;#39;Ooh. Ok&amp;#39; and something in my head has clicked and quelled the fire in my head that made me overthink. &lt;/p&gt;

&lt;p&gt;I said earlier in the post that this guy is quite forgetful which is something I wouldn&amp;#39;t have found out if I hadn&amp;#39;t went my original route to where I was meeting him on our date. Basically, I was walking through the city centre and said to myself: &amp;#39;Right I&amp;#39;ll go &lt;em&gt;this&lt;/em&gt; way to City Hall&amp;#39; but then I just had this feeling that I should go another way. I did and I ended up meeting him outside a bookstore (which is near City Hall) writing an email on his phone. He said to me that he&amp;#39;s sorry for ignoring me but he really needed to send this email otherwise he&amp;#39;d forget. I then asked him how his weekend was and he looked so lost and just told me: &amp;#39;If it isn&amp;#39;t happening today I forget. I&amp;#39;m very forgetful.&amp;#39; This sounds so stupid but I do feel like this was more than a coincidence and finding out he was forgetful, something that wouldn&amp;#39;t of happened if I went my original route, then I would definitely be freaking out 100% because he has forgot to reply to a stupid text, lol. &lt;/p&gt;

&lt;p&gt;EDIT: Just wanted to add for a bit of context, I am a bit of a spiritual person and I do believe what you put out there you will get back. Whether it&amp;#39;s the Law of Attraction or whether it&amp;#39;s karma I do feel like things happen for reasons :)&lt;/p&gt;

&lt;p&gt;&lt;strong&gt;TL;DR: So, is there anything that has made you think &amp;quot;the universe is trying to tell me something?&amp;quot;&lt;/strong&gt;&lt;/p&gt;
&lt;/div&gt;&lt;!-- SC_ON --&gt;","False","askgaybros","t5_2vgfw","","","Ever feel like the universe is trying to tell you something?","7","http://www.reddit.com/r/askgaybros/comments/2fu4zu/ever_feel_like_the_universe_is_trying_to_tell_you/","[]","False"
