"","_comment_sort","_comments","_comments_by_id","_info_url","_orphaned","_params","_replaced_more","_underscore_names","approved_by","archived","author","author_flair_css_class","author_flair_text","banned_by","clicked","created","created_utc","distinguished","domain","downs","edited","gilded","has_fetched","hidden","id","is_self","json_dict","likes","link_flair_css_class","link_flair_text","media","media_embed","mod_reports","name","num_comments","num_reports","over_18","permalink","reddit_session","report_reasons","saved","score","secure_media","secure_media_embed","selftext","selftext_html","stickied","subreddit","subreddit_id","suggested_sort","thumbnail","title","ups","url","user_reports","visited"
"0","","","{}","http://www.reddit.com/api/info/","{}","{}","False","","","False","nixonbeach","","","","False","1416841091.0","1416841091.0","","self.askgaybros","0","False","0","True","False","2n9mh9","True","","","","","","{}","[]","t3_2n9mh9","29","","False","http://www.reddit.com/r/askgaybros/comments/2n9mh9/choosing_not_to_partake_in_gay_culture/","Unauthenticated reddit sesssion","","False","0","","{}","Hey bros. Always interested in anthropology so I'll pose this question: do you as a gay man partake in ""gay culture""? This could be pride parades, gay bars, or having exclusively hanging with other gay people. 

I, myself, am a gay and married 26 year old and do not partake in anything I would define as ""gay culture"". Two of my best friends are straight dudes who I met at my corporate gym, I've never been to a pride parade or even a gay bar. I just haven't ever found myself with the desire. 

I think for me personally, I don't want to be defined by the gender I sleep with. Therefore, I want to be my friends' bro and not their gay-bro. And I hope I've accomplished that. 

Also, not hating or judging with this post, just curious as to the set of people on the thread. ","&lt;!-- SC_OFF --&gt;&lt;div class=""md""&gt;&lt;p&gt;Hey bros. Always interested in anthropology so I&amp;#39;ll pose this question: do you as a gay man partake in &amp;quot;gay culture&amp;quot;? This could be pride parades, gay bars, or having exclusively hanging with other gay people. &lt;/p&gt;

&lt;p&gt;I, myself, am a gay and married 26 year old and do not partake in anything I would define as &amp;quot;gay culture&amp;quot;. Two of my best friends are straight dudes who I met at my corporate gym, I&amp;#39;ve never been to a pride parade or even a gay bar. I just haven&amp;#39;t ever found myself with the desire. &lt;/p&gt;

&lt;p&gt;I think for me personally, I don&amp;#39;t want to be defined by the gender I sleep with. Therefore, I want to be my friends&amp;#39; bro and not their gay-bro. And I hope I&amp;#39;ve accomplished that. &lt;/p&gt;

&lt;p&gt;Also, not hating or judging with this post, just curious as to the set of people on the thread. &lt;/p&gt;
&lt;/div&gt;&lt;!-- SC_ON --&gt;","False","askgaybros","t5_2vgfw","","","Choosing not to partake in ""gay culture""","0","http://www.reddit.com/r/askgaybros/comments/2n9mh9/choosing_not_to_partake_in_gay_culture/","[]","False"
"1","","","{}","http://www.reddit.com/api/info/","{}","{}","False","","","False","swedishgaybro","","","","False","1416838336.0","1416838336.0","","self.askgaybros","0","1416839459.0","0","True","False","2n9ib2","True","","","","","","{}","[]","t3_2n9ib2","28","","False","http://www.reddit.com/r/askgaybros/comments/2n9ib2/catholic_boyfriend_coming_out_to_his_religious/","Unauthenticated reddit sesssion","","False","10","","{}","Sorry if my post is a little too long. But this is something that concerns me and that I need to discuss and vent. It concerns my fiancé / boyfriend and me (I'm a guy). We have been together for a little more than 3 years now. We met at university. Since he was open about his sexuality with his friends and everyone I met when we started dating, it didn't bother me that he hadn't come out of the closet to any of his relatives or close family. Worth noting is that my boyfriend moved here (to Sweden) from a Catholic country in Southern Europe, and that his family is religiously Catholic. We talked about this a little loosely in the first months of our relationship, and he said that he intended to come out to his family as soon as he had a fixed income and felt financially secure, in case they would reject him. Now he has a fixed employment and works alongside his studies, he also takes financial student aid. I've mentioned this a few times, but he points out that he is afraid of the consequences that a ""coming out"" would have on his family. He's afraid that they'll give up any contact with him, or that he'll be beaten up by his father and brother. Now, my boyfriend and me live together, and each time he calls or chats on skype with his family, I have to hide or keep me quiet, so that they don't know that I'm there. However, he has told me that they know that we live together, but they don't know about our relationship status. It is also worth noting that I payed his family a visit two years ago, during our vacations in the mediterranean, and then I had to play his ""buddy"". I like this guy VERY MUCH. Most of the time, we have a good time together, and all of our friends, colleagues and my family in Sweden know that we are a couple. What makes me think of this whole closet story is among other things when my friends talk about how they're going to celebrate Christmas or other holidays, whether to celebrate them with their own family or with their partner's family, even gay couples that I know bring up these subjects. This hurts me badly, because we don't have the same situation. I have also thought about how it will be when we're done with our studies. Will I be his ""little secret"" to his family forever? When he dies, will I be welcome at his funeral? We spend a very large part of our time together. So I feel that it is unfair to both me and his family that he keeps this a secret. At the same time I do not know whether I’m entitled to demand that he come out? On several occasions when I have raised this subject, he has been pissed off and closed himself. Yesterday we talked about this, I told him how depressed I get of it. I also said that I did not know if I wanted this situation in my life. I don't know what to do. While this situation makes me sad, I love him very much. What right do I have to require him to come out to his family? How much time should I give him? Should I make any kind of ultimatum? Do you think he could come out to his family smoothly, even though they are religiosly Catholic? If so, how? Feel free to tell me if you have any tips or similar stories. All I want is to avoid living in his closet.","&lt;!-- SC_OFF --&gt;&lt;div class=""md""&gt;&lt;p&gt;Sorry if my post is a little too long. But this is something that concerns me and that I need to discuss and vent. It concerns my fiancé / boyfriend and me (I&amp;#39;m a guy). We have been together for a little more than 3 years now. We met at university. Since he was open about his sexuality with his friends and everyone I met when we started dating, it didn&amp;#39;t bother me that he hadn&amp;#39;t come out of the closet to any of his relatives or close family. Worth noting is that my boyfriend moved here (to Sweden) from a Catholic country in Southern Europe, and that his family is religiously Catholic. We talked about this a little loosely in the first months of our relationship, and he said that he intended to come out to his family as soon as he had a fixed income and felt financially secure, in case they would reject him. Now he has a fixed employment and works alongside his studies, he also takes financial student aid. I&amp;#39;ve mentioned this a few times, but he points out that he is afraid of the consequences that a &amp;quot;coming out&amp;quot; would have on his family. He&amp;#39;s afraid that they&amp;#39;ll give up any contact with him, or that he&amp;#39;ll be beaten up by his father and brother. Now, my boyfriend and me live together, and each time he calls or chats on skype with his family, I have to hide or keep me quiet, so that they don&amp;#39;t know that I&amp;#39;m there. However, he has told me that they know that we live together, but they don&amp;#39;t know about our relationship status. It is also worth noting that I payed his family a visit two years ago, during our vacations in the mediterranean, and then I had to play his &amp;quot;buddy&amp;quot;. I like this guy VERY MUCH. Most of the time, we have a good time together, and all of our friends, colleagues and my family in Sweden know that we are a couple. What makes me think of this whole closet story is among other things when my friends talk about how they&amp;#39;re going to celebrate Christmas or other holidays, whether to celebrate them with their own family or with their partner&amp;#39;s family, even gay couples that I know bring up these subjects. This hurts me badly, because we don&amp;#39;t have the same situation. I have also thought about how it will be when we&amp;#39;re done with our studies. Will I be his &amp;quot;little secret&amp;quot; to his family forever? When he dies, will I be welcome at his funeral? We spend a very large part of our time together. So I feel that it is unfair to both me and his family that he keeps this a secret. At the same time I do not know whether I’m entitled to demand that he come out? On several occasions when I have raised this subject, he has been pissed off and closed himself. Yesterday we talked about this, I told him how depressed I get of it. I also said that I did not know if I wanted this situation in my life. I don&amp;#39;t know what to do. While this situation makes me sad, I love him very much. What right do I have to require him to come out to his family? How much time should I give him? Should I make any kind of ultimatum? Do you think he could come out to his family smoothly, even though they are religiosly Catholic? If so, how? Feel free to tell me if you have any tips or similar stories. All I want is to avoid living in his closet.&lt;/p&gt;
&lt;/div&gt;&lt;!-- SC_ON --&gt;","False","askgaybros","t5_2vgfw","","","Catholic boyfriend, coming out to his religious family issues","10","http://www.reddit.com/r/askgaybros/comments/2n9ib2/catholic_boyfriend_coming_out_to_his_religious/","[]","False"
"2","","","{}","http://www.reddit.com/api/info/","{}","{}","False","","","False","duckterrorist","","","","False","1416834848.0","1416834848.0","","self.askgaybros","0","False","0","True","False","2n9drv","True","","","","","","{}","[]","t3_2n9drv","15","","False","http://www.reddit.com/r/askgaybros/comments/2n9drv/hello_txt_me/","Unauthenticated reddit sesssion","","False","25","","{}","Has anyone dealt with this Grindr spammer/scammer before or recently? In the past couple of days I've been getting messages every 18 hours or so from a new account with no profile/pic with the message ""Hello, txt me [number]""

I report and block every time. It's super annoying and more than a little unsettling. Anyone know of a better solution and/or any more insight about who might be targeting me?","&lt;!-- SC_OFF --&gt;&lt;div class=""md""&gt;&lt;p&gt;Has anyone dealt with this Grindr spammer/scammer before or recently? In the past couple of days I&amp;#39;ve been getting messages every 18 hours or so from a new account with no profile/pic with the message &amp;quot;Hello, txt me [number]&amp;quot;&lt;/p&gt;

&lt;p&gt;I report and block every time. It&amp;#39;s super annoying and more than a little unsettling. Anyone know of a better solution and/or any more insight about who might be targeting me?&lt;/p&gt;
&lt;/div&gt;&lt;!-- SC_ON --&gt;","False","askgaybros","t5_2vgfw","","","""Hello, txt me""","25","http://www.reddit.com/r/askgaybros/comments/2n9drv/hello_txt_me/","[]","False"
"3","","","{}","http://www.reddit.com/api/info/","{}","{}","False","","","False","godokazilla","","","","False","1416833955.0","1416833955.0","","self.askgaybros","0","False","0","True","False","2n9cpv","True","","","","","","{}","[]","t3_2n9cpv","10","","False","http://www.reddit.com/r/askgaybros/comments/2n9cpv/coming_out_extended_family/","Unauthenticated reddit sesssion","","False","10","","{}","A brief intro: this past August I finally came out to my parents and sibling, after three years or so of being out to all of my friends and essentially my college as a whole. I also posted a Facebook status about the event, and a good chunk of my extended relatives (cousins mostly) heard the news. Everyone has been 400% positive, especially my father, who I think of as one of my primary role models.

Okay, so: recently I've been debating telling my grandparents; my grandfather is one of my other role models, a bit of a hero really, and for him to pass away without him knowing this important part of myself is a lil' troubling to me. However, my parents are deeply, deeply against  me telling my grandparents. Here's a snippet of an email my dad sent me, right before he visited his own parents: 

""If you haven't told them, or Oma [my maternal grandmother], I'm respectfully asking you not to say anything to them. They simply don't need to know. And I just don't know how they would handle the news at their advanced ages, and in Oma's case, her declining health.""

What is y'all's take on this? Have you been in a similar situation? It's difficult to process: my immediate family are so wonderfully supportive, but their insistence that I remain closeted to my grandparents is really troubling. I'm not sure what to do, or how to process this. 

TL;DR: Wonderful, supporting parents (especially my dad) urge me not to come out to my grandparents, who I'm close to and also love (and who also often host family reunions). I'm unsure how to deal with all of this emotionally.","&lt;!-- SC_OFF --&gt;&lt;div class=""md""&gt;&lt;p&gt;A brief intro: this past August I finally came out to my parents and sibling, after three years or so of being out to all of my friends and essentially my college as a whole. I also posted a Facebook status about the event, and a good chunk of my extended relatives (cousins mostly) heard the news. Everyone has been 400% positive, especially my father, who I think of as one of my primary role models.&lt;/p&gt;

&lt;p&gt;Okay, so: recently I&amp;#39;ve been debating telling my grandparents; my grandfather is one of my other role models, a bit of a hero really, and for him to pass away without him knowing this important part of myself is a lil&amp;#39; troubling to me. However, my parents are deeply, deeply against  me telling my grandparents. Here&amp;#39;s a snippet of an email my dad sent me, right before he visited his own parents: &lt;/p&gt;

&lt;p&gt;&amp;quot;If you haven&amp;#39;t told them, or Oma [my maternal grandmother], I&amp;#39;m respectfully asking you not to say anything to them. They simply don&amp;#39;t need to know. And I just don&amp;#39;t know how they would handle the news at their advanced ages, and in Oma&amp;#39;s case, her declining health.&amp;quot;&lt;/p&gt;

&lt;p&gt;What is y&amp;#39;all&amp;#39;s take on this? Have you been in a similar situation? It&amp;#39;s difficult to process: my immediate family are so wonderfully supportive, but their insistence that I remain closeted to my grandparents is really troubling. I&amp;#39;m not sure what to do, or how to process this. &lt;/p&gt;

&lt;p&gt;TL;DR: Wonderful, supporting parents (especially my dad) urge me not to come out to my grandparents, who I&amp;#39;m close to and also love (and who also often host family reunions). I&amp;#39;m unsure how to deal with all of this emotionally.&lt;/p&gt;
&lt;/div&gt;&lt;!-- SC_ON --&gt;","False","askgaybros","t5_2vgfw","","","Coming out: extended family.","10","http://www.reddit.com/r/askgaybros/comments/2n9cpv/coming_out_extended_family/","[]","False"
"4","","","{}","http://www.reddit.com/api/info/","{}","{}","False","","","False","wowincrediblename","","","","False","1416826142.0","1416826142.0","","self.askgaybros","0","1416826432.0","0","True","False","2n9514","True","","","","","","{}","[]","t3_2n9514","14","","False","http://www.reddit.com/r/askgaybros/comments/2n9514/is_it_normal_to_be_angry_at_a_friend_for_not/","Unauthenticated reddit sesssion","","False","1","","{}","I am a gay guy and I just found out rather indirectly today that a really good friend of mine is gay. I was actually really pissed to have found out this way. Not because he's gay, obviously, but because nobody bothered to communicate this to me in all of the many social interactions we have had over the past few months. Apparently a bunch of people knew this except for me. The reason no one told me is people just assumed that because I'm gay I would also know he was gay somehow. Well, no, in fact, I don't know that unless someone frigging tells me. Ugh.

Now I'm really upset that I was left out because people just assumed I would know. This is the second time this has happened to me with a friend and it's even worse this time, because I'm closer to this friend than the previous one. The worst part is people think this is funny. While I can understand why people would think that, this is not funny to me. I feel actually really angry about this. I know that's probably not a good reaction, and that I'm probably just being petulant. I don't wish any ill will on my friend, but I am genuinely really pissed about this whole situation. Does this make sense to anybody or am I just being crazy? :/

tl;dr Found out indirectly a good friend of mine is gay, was really pissed no one told me sooner when others knew and just assumed I would know because I'm gay, and now my friends think its funny I didn't know this.","&lt;!-- SC_OFF --&gt;&lt;div class=""md""&gt;&lt;p&gt;I am a gay guy and I just found out rather indirectly today that a really good friend of mine is gay. I was actually really pissed to have found out this way. Not because he&amp;#39;s gay, obviously, but because nobody bothered to communicate this to me in all of the many social interactions we have had over the past few months. Apparently a bunch of people knew this except for me. The reason no one told me is people just assumed that because I&amp;#39;m gay I would also know he was gay somehow. Well, no, in fact, I don&amp;#39;t know that unless someone frigging tells me. Ugh.&lt;/p&gt;

&lt;p&gt;Now I&amp;#39;m really upset that I was left out because people just assumed I would know. This is the second time this has happened to me with a friend and it&amp;#39;s even worse this time, because I&amp;#39;m closer to this friend than the previous one. The worst part is people think this is funny. While I can understand why people would think that, this is not funny to me. I feel actually really angry about this. I know that&amp;#39;s probably not a good reaction, and that I&amp;#39;m probably just being petulant. I don&amp;#39;t wish any ill will on my friend, but I am genuinely really pissed about this whole situation. Does this make sense to anybody or am I just being crazy? :/&lt;/p&gt;

&lt;p&gt;tl;dr Found out indirectly a good friend of mine is gay, was really pissed no one told me sooner when others knew and just assumed I would know because I&amp;#39;m gay, and now my friends think its funny I didn&amp;#39;t know this.&lt;/p&gt;
&lt;/div&gt;&lt;!-- SC_ON --&gt;","False","askgaybros","t5_2vgfw","","","Is it normal to be angry at a friend for not coming out to you?","1","http://www.reddit.com/r/askgaybros/comments/2n9514/is_it_normal_to_be_angry_at_a_friend_for_not/","[]","False"
"5","","","{}","http://www.reddit.com/api/info/","{}","{}","False","","","False","lchambers9448","","","","False","1416816939.0","1416816939.0","","self.askgaybros","0","1416818954.0","0","True","False","2n8wkr","True","","","","","","{}","[]","t3_2n8wkr","7","","False","http://www.reddit.com/r/askgaybros/comments/2n8wkr/friends_acting_weird/","Unauthenticated reddit sesssion","","False","2","","{}","One of my really close straight bros keeps asking me to tell him the details of when I'm having sex. He also asks me a lot about bottoming which I know nothing about (I'm a top). I told him he should use grindr and try it out and he tells me no. I just want to know your guys input on the situation. 

Sorry for punctuation I'm in a car.

I originally posted this is in gaybros but was removed.

I forgot to clarify that he always asks how it feels to bottom and to let him no if I ever do bottom.","&lt;!-- SC_OFF --&gt;&lt;div class=""md""&gt;&lt;p&gt;One of my really close straight bros keeps asking me to tell him the details of when I&amp;#39;m having sex. He also asks me a lot about bottoming which I know nothing about (I&amp;#39;m a top). I told him he should use grindr and try it out and he tells me no. I just want to know your guys input on the situation. &lt;/p&gt;

&lt;p&gt;Sorry for punctuation I&amp;#39;m in a car.&lt;/p&gt;

&lt;p&gt;I originally posted this is in gaybros but was removed.&lt;/p&gt;

&lt;p&gt;I forgot to clarify that he always asks how it feels to bottom and to let him no if I ever do bottom.&lt;/p&gt;
&lt;/div&gt;&lt;!-- SC_ON --&gt;","False","askgaybros","t5_2vgfw","","","Friends acting weird","2","http://www.reddit.com/r/askgaybros/comments/2n8wkr/friends_acting_weird/","[]","False"
