"","_comment_sort","_comments","_comments_by_id","_info_url","_orphaned","_params","_replaced_more","_underscore_names","approved_by","archived","author","author_flair_css_class","author_flair_text","banned_by","clicked","created","created_utc","distinguished","domain","downs","edited","gilded","has_fetched","hidden","id","is_self","json_dict","likes","link_flair_css_class","link_flair_text","media","media_embed","mod_reports","name","num_comments","num_reports","over_18","permalink","reddit_session","report_reasons","saved","score","secure_media","secure_media_embed","selftext","selftext_html","stickied","subreddit","subreddit_id","suggested_sort","thumbnail","title","ups","url","user_reports","visited"
"0","","","{}","http://www.reddit.com/api/info/","{}","{}","False","","","False","jself1989","","","","False","1422891829.0","1422891829.0","","self.askgaybros","0","False","0","True","False","2uiwac","True","","","","","","{}","[]","t3_2uiwac","26","","False","http://www.reddit.com/r/askgaybros/comments/2uiwac/if_my_straight_bro_friends_only_knew_the/","Unauthenticated reddit sesssion","","False","10","","{}","In my office I have a group of straight bros that I talk to everyday. We talk about gaming, lifting, sex, etc. Every day they talk about sex, and they go into explicit details about their sexual escapades. I don’t particularly mind. Usually I like hearing about it, and I’ll voice my opinions in the matters. It can be kind of hot really. The problem I have is that every time I bring up gay sexual escapades they get grossed out. They act like it’s just too much information. It’s actually to a point where the atmosphere gets tense if I even start to mention my personal sexual life. Most of the time I just don’t bring anything up. But I wish my friends knew how much restraint I have to exercise on a daily basis. It’s pretty much a one way street. I can’t talk about myself really. 

It’s never really bothered me until recently. I just started to analyze the situation and it makes me feel like I’m out of the closet but I shouldn’t talk about myself. Like I have to hide facets of my life to comply with social norms. Anyone ever have these or similar issues? I would also really like to hear from our straight bros that peruse this subreddit. Are my friends just too close minded? Would talking about myself more make them more comfortable over time? What are your thoughts? Am I alone in this occurrence or is this something others go through as well? 
","&lt;!-- SC_OFF --&gt;&lt;div class=""md""&gt;&lt;p&gt;In my office I have a group of straight bros that I talk to everyday. We talk about gaming, lifting, sex, etc. Every day they talk about sex, and they go into explicit details about their sexual escapades. I don’t particularly mind. Usually I like hearing about it, and I’ll voice my opinions in the matters. It can be kind of hot really. The problem I have is that every time I bring up gay sexual escapades they get grossed out. They act like it’s just too much information. It’s actually to a point where the atmosphere gets tense if I even start to mention my personal sexual life. Most of the time I just don’t bring anything up. But I wish my friends knew how much restraint I have to exercise on a daily basis. It’s pretty much a one way street. I can’t talk about myself really. &lt;/p&gt;

&lt;p&gt;It’s never really bothered me until recently. I just started to analyze the situation and it makes me feel like I’m out of the closet but I shouldn’t talk about myself. Like I have to hide facets of my life to comply with social norms. Anyone ever have these or similar issues? I would also really like to hear from our straight bros that peruse this subreddit. Are my friends just too close minded? Would talking about myself more make them more comfortable over time? What are your thoughts? Am I alone in this occurrence or is this something others go through as well? &lt;/p&gt;
&lt;/div&gt;&lt;!-- SC_ON --&gt;","False","askgaybros","t5_2vgfw","","","If my straight bro friends only knew the restraint I excise on a daily basis!","10","http://www.reddit.com/r/askgaybros/comments/2uiwac/if_my_straight_bro_friends_only_knew_the/","[]","False"
"1","","","{}","http://www.reddit.com/api/info/","{}","{}","False","","","False","lisdhf","","","","False","1422891528.0","1422891528.0","","self.askgaybros","0","False","0","True","False","2uivnt","True","","","","","","{}","[]","t3_2uivnt","28","","False","http://www.reddit.com/r/askgaybros/comments/2uivnt/what_do_you_bros_think_of_the_word_handsome/","Unauthenticated reddit sesssion","","False","7","","{}","Recently a lot of people (mainly people older than me) have been saying that I look very handsome. 

I know it's a compliment but what does it mean exactly? How does it differ to ""hot"" or ""cute""?","&lt;!-- SC_OFF --&gt;&lt;div class=""md""&gt;&lt;p&gt;Recently a lot of people (mainly people older than me) have been saying that I look very handsome. &lt;/p&gt;

&lt;p&gt;I know it&amp;#39;s a compliment but what does it mean exactly? How does it differ to &amp;quot;hot&amp;quot; or &amp;quot;cute&amp;quot;?&lt;/p&gt;
&lt;/div&gt;&lt;!-- SC_ON --&gt;","False","askgaybros","t5_2vgfw","","","What do you bros think of the word ""handsome""?","7","http://www.reddit.com/r/askgaybros/comments/2uivnt/what_do_you_bros_think_of_the_word_handsome/","[]","False"
"2","","","{}","http://www.reddit.com/api/info/","{}","{}","False","","","False","Weedy88","","","","False","1422880504.0","1422880504.0","","self.askgaybros","0","False","0","True","False","2uiees","True","","","","","","{}","[]","t3_2uiees","13","","False","http://www.reddit.com/r/askgaybros/comments/2uiees/want_this_friend_back_and_i_dont_want_this_friend/","Unauthenticated reddit sesssion","","False","4","","{}","I'll try to make this as short as possible without boring you.

I'm a mostly closeted gay and this friend of mine is straight.  We knew each other for about 6 years as I got to know him from a summer rec program.  We clicked and got pretty close.  Then last summer he was old enough to work there (and of legal age).  Gradually we got closer and even hung out outside of the program.  During all this, I started having these funny feelings towards him, like I knew we could be something more.  The feelings were inappropriate and I tried to push them away, but I just couldn't. 

 He became more distant on top of that, blowing me off more (this was when he at first didn't notice my feelings) and it was getting me upset.  I called him out on it and he didn't seem to show much sympathy towards it.  Down the road, he eventually realized how I felt about him and he wasn't interested, but saw that I was always upset around him, especially at work (yes, this is where I fucked up).  He got even more distant From me at work and I tried to save the friendship, but the feelings also got in the way.  If you're wondering, I never tried to get physical with him.

After the program ended I apologized for everything and he then blew up and told me he couldn't deal with me anymore and it was weird to want to do something with him at his age (im in my 20s btw) and the fact that it was with someone I worked with.  He cut me off social media, I was upset but tried to move on.

Couple months later I messaged him just to try to fix things and he told me not to talk to him because that will only make it worse.  A couple weeks later, I found out I was excluded from a summer rec program staff reunion, and I had a suspicion that this guy told my bosses that I was acting inappropriate over the summer.  

Sure enough, I spoke to the head honcho about what happened, and he said he couldn't hire me back next summer and tried his best to keep me.  He didn't go into details, and I was also still mostly closeted at the time.  He said he doesn't want us to burn bridges and will recommend me to anywhere I apply to for the future.  The second in command however unfriended me on FB and was in charge with organizing the reunion.  Meanwhile this female second in command has had a history of hooking up with workers, and she can get away with that, yet I couldn't for not even doing a 10th of what she's done.

So for a short period of time I was depressed and kept wondering what if this got out.  I tried to play it cool and ended up booking a trip for the summer with some friends this year.  To try to move on.  Also, after New Years I sent my ex friend a text telling him I understand he did what he had to do and that I forgive him for it, and that i have no grudge towards him.  Go figure he didn't reply.

So now to the issue of being confused whether or not I want to restore this friendship.  I really wish this guy would at least admit to me what he did without any warning and we would have a mutual closure.  I don't know if he has a reason to apologize or not, but after half a year for some reason he is still on the back of my mind.  Is there anything else I could do besides wait and move on in this situation?  Thanks","&lt;!-- SC_OFF --&gt;&lt;div class=""md""&gt;&lt;p&gt;I&amp;#39;ll try to make this as short as possible without boring you.&lt;/p&gt;

&lt;p&gt;I&amp;#39;m a mostly closeted gay and this friend of mine is straight.  We knew each other for about 6 years as I got to know him from a summer rec program.  We clicked and got pretty close.  Then last summer he was old enough to work there (and of legal age).  Gradually we got closer and even hung out outside of the program.  During all this, I started having these funny feelings towards him, like I knew we could be something more.  The feelings were inappropriate and I tried to push them away, but I just couldn&amp;#39;t. &lt;/p&gt;

&lt;p&gt;He became more distant on top of that, blowing me off more (this was when he at first didn&amp;#39;t notice my feelings) and it was getting me upset.  I called him out on it and he didn&amp;#39;t seem to show much sympathy towards it.  Down the road, he eventually realized how I felt about him and he wasn&amp;#39;t interested, but saw that I was always upset around him, especially at work (yes, this is where I fucked up).  He got even more distant From me at work and I tried to save the friendship, but the feelings also got in the way.  If you&amp;#39;re wondering, I never tried to get physical with him.&lt;/p&gt;

&lt;p&gt;After the program ended I apologized for everything and he then blew up and told me he couldn&amp;#39;t deal with me anymore and it was weird to want to do something with him at his age (im in my 20s btw) and the fact that it was with someone I worked with.  He cut me off social media, I was upset but tried to move on.&lt;/p&gt;

&lt;p&gt;Couple months later I messaged him just to try to fix things and he told me not to talk to him because that will only make it worse.  A couple weeks later, I found out I was excluded from a summer rec program staff reunion, and I had a suspicion that this guy told my bosses that I was acting inappropriate over the summer.  &lt;/p&gt;

&lt;p&gt;Sure enough, I spoke to the head honcho about what happened, and he said he couldn&amp;#39;t hire me back next summer and tried his best to keep me.  He didn&amp;#39;t go into details, and I was also still mostly closeted at the time.  He said he doesn&amp;#39;t want us to burn bridges and will recommend me to anywhere I apply to for the future.  The second in command however unfriended me on FB and was in charge with organizing the reunion.  Meanwhile this female second in command has had a history of hooking up with workers, and she can get away with that, yet I couldn&amp;#39;t for not even doing a 10th of what she&amp;#39;s done.&lt;/p&gt;

&lt;p&gt;So for a short period of time I was depressed and kept wondering what if this got out.  I tried to play it cool and ended up booking a trip for the summer with some friends this year.  To try to move on.  Also, after New Years I sent my ex friend a text telling him I understand he did what he had to do and that I forgive him for it, and that i have no grudge towards him.  Go figure he didn&amp;#39;t reply.&lt;/p&gt;

&lt;p&gt;So now to the issue of being confused whether or not I want to restore this friendship.  I really wish this guy would at least admit to me what he did without any warning and we would have a mutual closure.  I don&amp;#39;t know if he has a reason to apologize or not, but after half a year for some reason he is still on the back of my mind.  Is there anything else I could do besides wait and move on in this situation?  Thanks&lt;/p&gt;
&lt;/div&gt;&lt;!-- SC_ON --&gt;","False","askgaybros","t5_2vgfw","","","Want this friend back and I don't want this friend back. Maybe I'm just looking for the right closure.","4","http://www.reddit.com/r/askgaybros/comments/2uiees/want_this_friend_back_and_i_dont_want_this_friend/","[]","False"
"3","","","{}","http://www.reddit.com/api/info/","{}","{}","False","","","False","Drezus","","","","False","1422876882.0","1422876882.0","","self.askgaybros","0","False","0","True","False","2uial9","True","","","","","","{}","[]","t3_2uial9","15","","False","http://www.reddit.com/r/askgaybros/comments/2uial9/i_dont_feel_attracted_to_him_but_i_kinda_love_the/","Unauthenticated reddit sesssion","","False","15","","{}","There's this guy I actually am friends with for as long as a whole year for now. For some months in the beggining, I found him to be cute, but I guess over time my tastes have changed and I don't find him that attractive anymore.

Thing is, I always though he was straight (and it seems he did too, about me, aswell). But that ended when I signed up to Scruff last week and he just woofed me. It was a surprise for both sides, except he seems to find me attractive *as well* as nice.


I ended up giving him a chance to develop something and I found out he actually really cares about me, something I wasn't really expecting after so many frustrated dates.

Now I'm not sure if I should keep up the pace even though I'm not attracted to him, or if I should avoid bigger penalties and stop before things get worse.

**tl;dr: I'm afraid I might hurt a guy that loves me but which I don't find attractive. Not sure what should I do**

Thanks for the help, bros.","&lt;!-- SC_OFF --&gt;&lt;div class=""md""&gt;&lt;p&gt;There&amp;#39;s this guy I actually am friends with for as long as a whole year for now. For some months in the beggining, I found him to be cute, but I guess over time my tastes have changed and I don&amp;#39;t find him that attractive anymore.&lt;/p&gt;

&lt;p&gt;Thing is, I always though he was straight (and it seems he did too, about me, aswell). But that ended when I signed up to Scruff last week and he just woofed me. It was a surprise for both sides, except he seems to find me attractive &lt;em&gt;as well&lt;/em&gt; as nice.&lt;/p&gt;

&lt;p&gt;I ended up giving him a chance to develop something and I found out he actually really cares about me, something I wasn&amp;#39;t really expecting after so many frustrated dates.&lt;/p&gt;

&lt;p&gt;Now I&amp;#39;m not sure if I should keep up the pace even though I&amp;#39;m not attracted to him, or if I should avoid bigger penalties and stop before things get worse.&lt;/p&gt;

&lt;p&gt;&lt;strong&gt;tl;dr: I&amp;#39;m afraid I might hurt a guy that loves me but which I don&amp;#39;t find attractive. Not sure what should I do&lt;/strong&gt;&lt;/p&gt;

&lt;p&gt;Thanks for the help, bros.&lt;/p&gt;
&lt;/div&gt;&lt;!-- SC_ON --&gt;","False","askgaybros","t5_2vgfw","","","I don't feel attracted to him, but I kinda love the way he loves me. Do I have a imminent problem?","15","http://www.reddit.com/r/askgaybros/comments/2uial9/i_dont_feel_attracted_to_him_but_i_kinda_love_the/","[]","False"
"4","","","{}","http://www.reddit.com/api/info/","{}","{}","False","","","False","throwawayscaredaf","","","","False","1422872656.0","1422872656.0","","self.askgaybros","0","1422872969.0","0","True","False","2ui6e7","True","","","","","","{}","[]","t3_2ui6e7","14","","False","http://www.reddit.com/r/askgaybros/comments/2ui6e7/im_so_paranoid_over_stds_can_anyone_please/","Unauthenticated reddit sesssion","","False","2","","{}","I fucked up. I blew a guy, though I only sucked his dick for like 4 mins. I know the risk for HIV is VERY low via oral, but I did taste a bit of precum. I didn't swallow. I should be worried about HIV, but I am trying not to let that fear control me. I know I am mostly at risk for chlamydia and gonorrhea, so I am very scared. I knew the risks, but my hormones got the best out of me :( 

I am 18 and still live with my parents, so I really can't afford to have an STD right now. But I realize that I have to accept my actions. 

I will have to go get tested in two weeks. I rarely hook up, too. Can anyone please console me? I need some uplifting advice. ","&lt;!-- SC_OFF --&gt;&lt;div class=""md""&gt;&lt;p&gt;I fucked up. I blew a guy, though I only sucked his dick for like 4 mins. I know the risk for HIV is VERY low via oral, but I did taste a bit of precum. I didn&amp;#39;t swallow. I should be worried about HIV, but I am trying not to let that fear control me. I know I am mostly at risk for chlamydia and gonorrhea, so I am very scared. I knew the risks, but my hormones got the best out of me :( &lt;/p&gt;

&lt;p&gt;I am 18 and still live with my parents, so I really can&amp;#39;t afford to have an STD right now. But I realize that I have to accept my actions. &lt;/p&gt;

&lt;p&gt;I will have to go get tested in two weeks. I rarely hook up, too. Can anyone please console me? I need some uplifting advice. &lt;/p&gt;
&lt;/div&gt;&lt;!-- SC_ON --&gt;","False","askgaybros","t5_2vgfw","","","I'm so paranoid over STD's. Can anyone please console me?","2","http://www.reddit.com/r/askgaybros/comments/2ui6e7/im_so_paranoid_over_stds_can_anyone_please/","[]","False"
"5","","","{}","http://www.reddit.com/api/info/","{}","{}","False","","","False","throawayhivquestion","","","","False","1422871689.0","1422871689.0","","self.askgaybros","0","False","0","True","False","2ui5dr","True","","","","","","{}","[]","t3_2ui5dr","9","","False","http://www.reddit.com/r/askgaybros/comments/2ui5dr/a_question_about_hiv_infection/","Unauthenticated reddit sesssion","","False","1","","{}","Dear gaybros.

So like the title suggests, I have a question about HIV infection. Now this might seem paranoid, but I hope you bear with it and give me some advise.
I am in a 10+ year relationship and have never had sex with anyone else other than my partner. That change about a week ago. I met up with this guy, and at first I insisted that there will be no penetration, no BJs. We talked a bit before beginning and the HIV talk somehow got picked up. He told me some stories about the behaviour of his friends endangering themselves with unsafe sex and he is quite against it. He also has check ups every 3 months and his doctor is good. I have a feeling he can be trusted.

During sex, we kissed, there were blow jobs and in the heat of the moment he began rubbing his dick against my ass and very briefly stuck his penis head in my hole, but really just the tip. So I told him to stop, which he did immediately and we finished off ""conventionally"" with our hands.

So I know the basics of contracting HIV. As in you cant get it via kissing and we were not visibly wounded. The ""penetration"" was sorta non-existant and I realised he did not have any precum. Logically I believe I am just being extremely paranoid but what are the chances really of catching anything like this? I will be going for a test in 2 weeks, but before that, I am semi-worried. Would be thankful for any insight.","&lt;!-- SC_OFF --&gt;&lt;div class=""md""&gt;&lt;p&gt;Dear gaybros.&lt;/p&gt;

&lt;p&gt;So like the title suggests, I have a question about HIV infection. Now this might seem paranoid, but I hope you bear with it and give me some advise.
I am in a 10+ year relationship and have never had sex with anyone else other than my partner. That change about a week ago. I met up with this guy, and at first I insisted that there will be no penetration, no BJs. We talked a bit before beginning and the HIV talk somehow got picked up. He told me some stories about the behaviour of his friends endangering themselves with unsafe sex and he is quite against it. He also has check ups every 3 months and his doctor is good. I have a feeling he can be trusted.&lt;/p&gt;

&lt;p&gt;During sex, we kissed, there were blow jobs and in the heat of the moment he began rubbing his dick against my ass and very briefly stuck his penis head in my hole, but really just the tip. So I told him to stop, which he did immediately and we finished off &amp;quot;conventionally&amp;quot; with our hands.&lt;/p&gt;

&lt;p&gt;So I know the basics of contracting HIV. As in you cant get it via kissing and we were not visibly wounded. The &amp;quot;penetration&amp;quot; was sorta non-existant and I realised he did not have any precum. Logically I believe I am just being extremely paranoid but what are the chances really of catching anything like this? I will be going for a test in 2 weeks, but before that, I am semi-worried. Would be thankful for any insight.&lt;/p&gt;
&lt;/div&gt;&lt;!-- SC_ON --&gt;","False","askgaybros","t5_2vgfw","","","A question about HIV infection..","1","http://www.reddit.com/r/askgaybros/comments/2ui5dr/a_question_about_hiv_infection/","[]","False"
