"","_comment_sort","_comments","_comments_by_id","_info_url","_orphaned","_params","_replaced_more","_underscore_names","approved_by","archived","author","author_flair_css_class","author_flair_text","banned_by","clicked","created","created_utc","distinguished","domain","downs","edited","gilded","has_fetched","hidden","id","is_self","json_dict","likes","link_flair_css_class","link_flair_text","media","media_embed","mod_reports","name","num_comments","num_reports","over_18","permalink","reddit_session","report_reasons","saved","score","secure_media","secure_media_embed","selftext","selftext_html","stickied","subreddit","subreddit_id","suggested_sort","thumbnail","title","ups","url","user_reports","visited"
"9","","","{}","http://www.reddit.com/api/info/","{}","{}","False","","","True","gayhelp1","","","","False","1407290686.0","1407287086.0","","self.askgaybros","0","False","0","True","False","2cqs5a","True","","","","","","{}","[]","t3_2cqs5a","14","","False","http://www.reddit.com/r/askgaybros/comments/2cqs5a/im_young_closeted_and_my_behavior_has_become_more/","Unauthenticated reddit sesssion","","False","22","","{}","So I'm really in need of some advice from some of you bros. I've appreciated advice thats been given to other people in the past from you all so I thought this was the best place to post my feelings....

So I'm 18 years old, closeted, and from a wealthy, conservative/catholic family in PA. I feel like everything, from the way I realized I was gay, to my first gay experiences has been fucked up and I've gotten to the point where I just don't feel anything anymore. 

So I first discovered I was gay after goofing around on the internet and coming across really graphic, leather/daddy porn on google. It was hand drawn black and white shit and after I found it I kept looking at it all the time. From 7th-8th grade up I was on cam sites (Ala Chatroulette) lying about my age and doing stuff with older guys over the internet. After every time I felt so bad and a lot of the times cried because I knew it was fucked up what I was doing. As I got into high school some of that stopped, and I got more into ""normal porn"" stuff and all that. I still had this weird ""daddy/older"" thing I guess because that would sometimes come up in my searches but it wasnt super extreme which is pretty normal I think. So normal high school stuff/ crushes on certain guys/being in the closet making everything more difficult. Luckily at the time I came across as pretty straight so no one had caught onto me. Summer before 11th grade I met a really nice guy who really like me and I liked him, but I flaked out on him because of my own insecurities. He was my age, and really cute but I couldn;t handle myself and what I was feeling. So I go into the year with a crush on another guy, but neither of us was willing to make the first move so in anger I gave up. The latter half of my senior year I downloaded grindr but didn't use it. I hooked up with my first guy at a party which was awesome, and it was fun and normal. Neither of us said anything and only knew eachother from mutual friends.

 As the year went by I gave up on relationships I guess and went back on grindr. I hooked up with a guy in the same housing complex me and my friends were staying at for our ""senior week"" the morning we were leaving. He was 42 and I'm 18. It was the first guy I'd blown and immediatly afterward I felt weird because why would I hookup with a guy like that. When I got home though I kept using it. I hooked up with another slight bigger(weight wise) guy a few times and had a good time I guess. I didn't feel that weird about it, except that he was 32. With him I was actually able to talk a bit and we smoked some weed but I ended up blocking his number because i didn't want to get with him again.

After about a week on two I decided to try fucking craigslist of all places. I thought it was kinky and pervy. Just another shady thing that turned me on I guess. I decide to meet up with a guy who lived in the city and went to meet him at his apartment. He told me he was 29 and I got to his apartment and clearly he lied. He was probably mid to late 30's and had a tiny, dusty, one room apartment. He had weird collections of newspaper clippings covering his entire wall. I fucking blew im, but he didnt cum and neither did I. I realized that this was fucked up and told him I had to go. That night I went into the park outside the franklin institute and called the trevor project because I felt like dirt about my entire shady life. The lady helped me, and even though I wasnt suicidal made me realize I probably need to work on myself. 

Despite my talk with the trevor project I met up with a guy on grindr who I messaged myself this time. He was clearly was older but he was a fit, bearish guy. He was 50 and again I'm 18. The hookup relationship turned into a kind of sugar daddy thing and after a few weeks of hooking up, and going to his place to hang out  I slowly stopped talking to him. I know grindr is for hooking up and you don't need to be attached to people, but I kept thinking that I should atleast feel something from all of this stuff. From every adult hookup I had I felt more or less like a hooker on my own terms. Every night I feel like shit for getting with older guys, in really aggresively sexual situations while I'm still closeted, and turn away good happy and healthy relationships with other guys my age.

Now this brings me to tonight. I drove to an adult bookstore to but a dildo because I wanted to get better at bottoming (don't judge me please) I felt like a perv going into the store, and decided to walk upstairs and look at the porn they had. I stumbled across the screens and booths in the back area with some doors closed, and some guys standing outside. I wen't into one and started flipping through the channels. I locked the door too so no one could come in, but I heard the door slightly wiggle and realized that people cruise there. I'm 18 but for whatever reason cruising, vintage 70's/80's porn and older guys have always been turn ons for me. I've never in my life cruised (outside of grindr which is kind of differed imo) but decided to unlock the door and see if someone came in . A guy did, almost a minute or two after I unlocked it. Neither of used sucked eachother off but we jerked eachother off and he sucked my nipples. After I came I left the store and got in my car. THis guy was also clearly way older than me, probably mid forties. I felt like such a perv and slut for doing what I did. Cruising like that is not something people my age do and Its so messed up that in the 21st century I CHOOSE to be shady and slimy, when there are perfectly nice, happy, cute guys that actually like me. There have been a bunch lately that have really showed there interest in me, but with me  being closested thanks to my ultra conservative family, and having this weird thing with older guys I turn them down. What is wrong with me. I feel honestly nothing, I feel emotionless and if one feeling ever comes up its anger. I keep trying to completed forget the things I do, but then go back and do them. I feel like if I keep doing the shit I'm doing I'll end up in a bad place, and in my mind and even worse place then I'm at. 

I'm sorry this is so long, but thank you if you read this. What should I do with my fucking life?","&lt;!-- SC_OFF --&gt;&lt;div class=""md""&gt;&lt;p&gt;So I&amp;#39;m really in need of some advice from some of you bros. I&amp;#39;ve appreciated advice thats been given to other people in the past from you all so I thought this was the best place to post my feelings....&lt;/p&gt;

&lt;p&gt;So I&amp;#39;m 18 years old, closeted, and from a wealthy, conservative/catholic family in PA. I feel like everything, from the way I realized I was gay, to my first gay experiences has been fucked up and I&amp;#39;ve gotten to the point where I just don&amp;#39;t feel anything anymore. &lt;/p&gt;

&lt;p&gt;So I first discovered I was gay after goofing around on the internet and coming across really graphic, leather/daddy porn on google. It was hand drawn black and white shit and after I found it I kept looking at it all the time. From 7th-8th grade up I was on cam sites (Ala Chatroulette) lying about my age and doing stuff with older guys over the internet. After every time I felt so bad and a lot of the times cried because I knew it was fucked up what I was doing. As I got into high school some of that stopped, and I got more into &amp;quot;normal porn&amp;quot; stuff and all that. I still had this weird &amp;quot;daddy/older&amp;quot; thing I guess because that would sometimes come up in my searches but it wasnt super extreme which is pretty normal I think. So normal high school stuff/ crushes on certain guys/being in the closet making everything more difficult. Luckily at the time I came across as pretty straight so no one had caught onto me. Summer before 11th grade I met a really nice guy who really like me and I liked him, but I flaked out on him because of my own insecurities. He was my age, and really cute but I couldn;t handle myself and what I was feeling. So I go into the year with a crush on another guy, but neither of us was willing to make the first move so in anger I gave up. The latter half of my senior year I downloaded grindr but didn&amp;#39;t use it. I hooked up with my first guy at a party which was awesome, and it was fun and normal. Neither of us said anything and only knew eachother from mutual friends.&lt;/p&gt;

&lt;p&gt;As the year went by I gave up on relationships I guess and went back on grindr. I hooked up with a guy in the same housing complex me and my friends were staying at for our &amp;quot;senior week&amp;quot; the morning we were leaving. He was 42 and I&amp;#39;m 18. It was the first guy I&amp;#39;d blown and immediatly afterward I felt weird because why would I hookup with a guy like that. When I got home though I kept using it. I hooked up with another slight bigger(weight wise) guy a few times and had a good time I guess. I didn&amp;#39;t feel that weird about it, except that he was 32. With him I was actually able to talk a bit and we smoked some weed but I ended up blocking his number because i didn&amp;#39;t want to get with him again.&lt;/p&gt;

&lt;p&gt;After about a week on two I decided to try fucking craigslist of all places. I thought it was kinky and pervy. Just another shady thing that turned me on I guess. I decide to meet up with a guy who lived in the city and went to meet him at his apartment. He told me he was 29 and I got to his apartment and clearly he lied. He was probably mid to late 30&amp;#39;s and had a tiny, dusty, one room apartment. He had weird collections of newspaper clippings covering his entire wall. I fucking blew im, but he didnt cum and neither did I. I realized that this was fucked up and told him I had to go. That night I went into the park outside the franklin institute and called the trevor project because I felt like dirt about my entire shady life. The lady helped me, and even though I wasnt suicidal made me realize I probably need to work on myself. &lt;/p&gt;

&lt;p&gt;Despite my talk with the trevor project I met up with a guy on grindr who I messaged myself this time. He was clearly was older but he was a fit, bearish guy. He was 50 and again I&amp;#39;m 18. The hookup relationship turned into a kind of sugar daddy thing and after a few weeks of hooking up, and going to his place to hang out  I slowly stopped talking to him. I know grindr is for hooking up and you don&amp;#39;t need to be attached to people, but I kept thinking that I should atleast feel something from all of this stuff. From every adult hookup I had I felt more or less like a hooker on my own terms. Every night I feel like shit for getting with older guys, in really aggresively sexual situations while I&amp;#39;m still closeted, and turn away good happy and healthy relationships with other guys my age.&lt;/p&gt;

&lt;p&gt;Now this brings me to tonight. I drove to an adult bookstore to but a dildo because I wanted to get better at bottoming (don&amp;#39;t judge me please) I felt like a perv going into the store, and decided to walk upstairs and look at the porn they had. I stumbled across the screens and booths in the back area with some doors closed, and some guys standing outside. I wen&amp;#39;t into one and started flipping through the channels. I locked the door too so no one could come in, but I heard the door slightly wiggle and realized that people cruise there. I&amp;#39;m 18 but for whatever reason cruising, vintage 70&amp;#39;s/80&amp;#39;s porn and older guys have always been turn ons for me. I&amp;#39;ve never in my life cruised (outside of grindr which is kind of differed imo) but decided to unlock the door and see if someone came in . A guy did, almost a minute or two after I unlocked it. Neither of used sucked eachother off but we jerked eachother off and he sucked my nipples. After I came I left the store and got in my car. THis guy was also clearly way older than me, probably mid forties. I felt like such a perv and slut for doing what I did. Cruising like that is not something people my age do and Its so messed up that in the 21st century I CHOOSE to be shady and slimy, when there are perfectly nice, happy, cute guys that actually like me. There have been a bunch lately that have really showed there interest in me, but with me  being closested thanks to my ultra conservative family, and having this weird thing with older guys I turn them down. What is wrong with me. I feel honestly nothing, I feel emotionless and if one feeling ever comes up its anger. I keep trying to completed forget the things I do, but then go back and do them. I feel like if I keep doing the shit I&amp;#39;m doing I&amp;#39;ll end up in a bad place, and in my mind and even worse place then I&amp;#39;m at. &lt;/p&gt;

&lt;p&gt;I&amp;#39;m sorry this is so long, but thank you if you read this. What should I do with my fucking life?&lt;/p&gt;
&lt;/div&gt;&lt;!-- SC_ON --&gt;","False","askgaybros","t5_2vgfw","","","I'm young, closeted, and my behavior has become more and more pervy/wreckless. I feel like im dead inside because I know the things I do not healthy for me, yet i dont stop.","22","http://www.reddit.com/r/askgaybros/comments/2cqs5a/im_young_closeted_and_my_behavior_has_become_more/","[]","False"
"10","","","{}","http://www.reddit.com/api/info/","{}","{}","False","","","True","DevonDoesTomahawk","","","","False","1407285568.0","1407281968.0","","self.askgaybros","0","False","0","True","False","2cqk07","True","","","","","","{}","[]","t3_2cqk07","10","","False","http://www.reddit.com/r/askgaybros/comments/2cqk07/question_about_this_hiv_chart_from_cdc/","Unauthenticated reddit sesssion","","False","9","","{}","Heres the link: http://www.cdc.gov/hiv/policies/law/risk.html

the title of this chart is **Estimated Per-Act Probability of Acquiring HIV from an Infected Source, by Exposure Act**

So lets say **if I'm a top, and I have a bareback sex with a HIV possitive bottom, the odds of me getting HIV is 11 out of 10,000?** Or is it a condomed sex? the article also stats that *consistent use of condoms reduces the risk of getting or transmitting HIV by about 80%* ; **if** the 11/10000 is the odds of getting HIV via condomed sex, the odds of getting HIV via bareback sex is 55/10000. Either way, the odd seems to be very low, I always thought that the odds are way higher, around 50% chance. This really blew my mind. Am I reading this report correctly?

P.S. I'm not advocating bareback sex, PLEASE have sex responsibly.

P.S 2 : I'm bringing this up because always I told myself that I should never get into a relationship with a HIV positive man, but if the odds are really somewhere between 0.0011% (Top) and 0.0138% (bottom) then I might have a change of heart; it doesnt seem likely at all...","&lt;!-- SC_OFF --&gt;&lt;div class=""md""&gt;&lt;p&gt;Heres the link: &lt;a href=""http://www.cdc.gov/hiv/policies/law/risk.html""&gt;http://www.cdc.gov/hiv/policies/law/risk.html&lt;/a&gt;&lt;/p&gt;

&lt;p&gt;the title of this chart is &lt;strong&gt;Estimated Per-Act Probability of Acquiring HIV from an Infected Source, by Exposure Act&lt;/strong&gt;&lt;/p&gt;

&lt;p&gt;So lets say &lt;strong&gt;if I&amp;#39;m a top, and I have a bareback sex with a HIV possitive bottom, the odds of me getting HIV is 11 out of 10,000?&lt;/strong&gt; Or is it a condomed sex? the article also stats that &lt;em&gt;consistent use of condoms reduces the risk of getting or transmitting HIV by about 80%&lt;/em&gt; ; &lt;strong&gt;if&lt;/strong&gt; the 11/10000 is the odds of getting HIV via condomed sex, the odds of getting HIV via bareback sex is 55/10000. Either way, the odd seems to be very low, I always thought that the odds are way higher, around 50% chance. This really blew my mind. Am I reading this report correctly?&lt;/p&gt;

&lt;p&gt;P.S. I&amp;#39;m not advocating bareback sex, PLEASE have sex responsibly.&lt;/p&gt;

&lt;p&gt;P.S 2 : I&amp;#39;m bringing this up because always I told myself that I should never get into a relationship with a HIV positive man, but if the odds are really somewhere between 0.0011% (Top) and 0.0138% (bottom) then I might have a change of heart; it doesnt seem likely at all...&lt;/p&gt;
&lt;/div&gt;&lt;!-- SC_ON --&gt;","False","askgaybros","t5_2vgfw","","","Question about this HIV chart from CDC","9","http://www.reddit.com/r/askgaybros/comments/2cqk07/question_about_this_hiv_chart_from_cdc/","[]","False"
"11","","","{}","http://www.reddit.com/api/info/","{}","{}","False","","","True","gay--throwaway","","","","False","1407282008.0","1407278408.0","","self.askgaybros","0","False","0","True","False","2cqe8q","True","","","","","","{}","[]","t3_2cqe8q","32","","True","http://www.reddit.com/r/askgaybros/comments/2cqe8q/do_you_kiss_the_guy_after_he_gave_you_head_and/","Unauthenticated reddit sesssion","","False","16","","{}","I have a bit of a cum fetish, I love knowing I got a guy off and feeling him shoot is fantastic.  Just wondering how GayBros deal with cum. ","&lt;!-- SC_OFF --&gt;&lt;div class=""md""&gt;&lt;p&gt;I have a bit of a cum fetish, I love knowing I got a guy off and feeling him shoot is fantastic.  Just wondering how GayBros deal with cum. &lt;/p&gt;
&lt;/div&gt;&lt;!-- SC_ON --&gt;","False","askgaybros","t5_2vgfw","","","Do you kiss the guy after he gave you head and cum in his mouth? How do you feel about cum in your mouth (or on your face)?","16","http://www.reddit.com/r/askgaybros/comments/2cqe8q/do_you_kiss_the_guy_after_he_gave_you_head_and/","[]","False"
"12","","","{}","http://www.reddit.com/api/info/","{}","{}","False","","","True","beanry","","","","False","1407281499.0","1407277899.0","","self.askgaybros","0","1407386384.0","0","True","False","2cqdcx","True","","","","","","{}","[]","t3_2cqdcx","37","","False","http://www.reddit.com/r/askgaybros/comments/2cqdcx/i_lost_weight_but_i_still_feel_horrible/","Unauthenticated reddit sesssion","","False","8","","{}","Hey, I lurked on here and I decided to join. :)
Anyways, I used to weigh 220 lbs from September 2013 but I lost some weight and I'm down to 155 lbs. I'm 5'6"". I think I'll stop at 140 but honestly I do not know how I feel right now. I am proud that I have lost weight and I want to be healthy and eventually build muscle but I feel like I will never look good enough compared to some other fit guys or like in gay porn where everyone has a nice body. Sometimes I feel awesome the way I look at myself in the morning and sometimes I feel like I am still ""fat and ugly"" compared to other gay guys. 

Do any of you feel like this? I would just like some advice or input from you guys..

UPDATE: I forgot to upload a pic but here's a ""transformation"" pic. Left was when I went down to 200 lbs and right is now where I'm at 155.
http://imgur.com/whq6s8I","&lt;!-- SC_OFF --&gt;&lt;div class=""md""&gt;&lt;p&gt;Hey, I lurked on here and I decided to join. :)
Anyways, I used to weigh 220 lbs from September 2013 but I lost some weight and I&amp;#39;m down to 155 lbs. I&amp;#39;m 5&amp;#39;6&amp;quot;. I think I&amp;#39;ll stop at 140 but honestly I do not know how I feel right now. I am proud that I have lost weight and I want to be healthy and eventually build muscle but I feel like I will never look good enough compared to some other fit guys or like in gay porn where everyone has a nice body. Sometimes I feel awesome the way I look at myself in the morning and sometimes I feel like I am still &amp;quot;fat and ugly&amp;quot; compared to other gay guys. &lt;/p&gt;

&lt;p&gt;Do any of you feel like this? I would just like some advice or input from you guys..&lt;/p&gt;

&lt;p&gt;UPDATE: I forgot to upload a pic but here&amp;#39;s a &amp;quot;transformation&amp;quot; pic. Left was when I went down to 200 lbs and right is now where I&amp;#39;m at 155.
&lt;a href=""http://imgur.com/whq6s8I""&gt;http://imgur.com/whq6s8I&lt;/a&gt;&lt;/p&gt;
&lt;/div&gt;&lt;!-- SC_ON --&gt;","False","askgaybros","t5_2vgfw","","","I lost weight, but I still feel horrible?","8","http://www.reddit.com/r/askgaybros/comments/2cqdcx/i_lost_weight_but_i_still_feel_horrible/","[]","False"
"13","","","{}","http://www.reddit.com/api/info/","{}","{}","False","","","True","cogito444","","","","False","1407276121.0","1407272521.0","","self.askgaybros","0","False","0","True","False","2cq3hu","True","","","","","","{}","[]","t3_2cq3hu","4","","False","http://www.reddit.com/r/askgaybros/comments/2cq3hu/need_advice_on_changing_a_job_a_bit_tricky/","Unauthenticated reddit sesssion","","False","6","","{}","Hey, I don't really know any HR people, and I cannot talk to colleagues about this, so maybe you guys can help me. I saw many of you work in something related to IT/Tech.
I have 3 years of work experience and have changed a couple of jobs, and now I'm looking for a new one. What I've learned in the meantime is that you should try to quit nicely.

The situation:
I'm interested in a position that is offered at a company that wants to sell it's products (BI Tools) to my company. The deal is unlikely to happen though for objective reasons (and actually I'm involved largely into this decision). So I have a direct contact to he sales director of the supplier.

The question is: 
Do you think it makes sense for me to privately ask the sales director about that job opening in his company or should I just use the official channels as any other candidate would?
PS:
This is all happening in Germany, but I'm not German, so any special working culture / legislation advice would be highly appreciated.

Thanks.","&lt;!-- SC_OFF --&gt;&lt;div class=""md""&gt;&lt;p&gt;Hey, I don&amp;#39;t really know any HR people, and I cannot talk to colleagues about this, so maybe you guys can help me. I saw many of you work in something related to IT/Tech.
I have 3 years of work experience and have changed a couple of jobs, and now I&amp;#39;m looking for a new one. What I&amp;#39;ve learned in the meantime is that you should try to quit nicely.&lt;/p&gt;

&lt;p&gt;The situation:
I&amp;#39;m interested in a position that is offered at a company that wants to sell it&amp;#39;s products (BI Tools) to my company. The deal is unlikely to happen though for objective reasons (and actually I&amp;#39;m involved largely into this decision). So I have a direct contact to he sales director of the supplier.&lt;/p&gt;

&lt;p&gt;The question is: 
Do you think it makes sense for me to privately ask the sales director about that job opening in his company or should I just use the official channels as any other candidate would?
PS:
This is all happening in Germany, but I&amp;#39;m not German, so any special working culture / legislation advice would be highly appreciated.&lt;/p&gt;

&lt;p&gt;Thanks.&lt;/p&gt;
&lt;/div&gt;&lt;!-- SC_ON --&gt;","False","askgaybros","t5_2vgfw","","","Need advice on changing a job - a bit tricky","6","http://www.reddit.com/r/askgaybros/comments/2cq3hu/need_advice_on_changing_a_job_a_bit_tricky/","[]","False"
"14","","","{}","http://www.reddit.com/api/info/","{}","{}","False","","","True","Weezy916","","","","False","1407274690.0","1407271090.0","","self.askgaybros","0","False","0","True","False","2cq0qa","True","","","","","","{}","[]","t3_2cq0qa","9","","False","http://www.reddit.com/r/askgaybros/comments/2cq0qa/tell_me_your_stories_of_your_time_at_a_bathhouse/","Unauthenticated reddit sesssion","","False","1","","{}","","","False","askgaybros","t5_2vgfw","","","Tell me your stories of your time at a bathhouse! ;)","1","http://www.reddit.com/r/askgaybros/comments/2cq0qa/tell_me_your_stories_of_your_time_at_a_bathhouse/","[]","False"
