"","_comment_sort","_comments","_comments_by_id","_info_url","_orphaned","_params","_replaced_more","_underscore_names","approved_by","archived","author","author_flair_css_class","author_flair_text","banned_by","clicked","created","created_utc","distinguished","domain","downs","edited","gilded","has_fetched","hidden","id","is_self","json_dict","likes","link_flair_css_class","link_flair_text","media","media_embed","mod_reports","name","num_comments","num_reports","over_18","permalink","reddit_session","report_reasons","saved","score","secure_media","secure_media_embed","selftext","selftext_html","stickied","subreddit","subreddit_id","suggested_sort","thumbnail","title","ups","url","user_reports","visited"
"18","","","{}","http://www.reddit.com/api/info/","{}","{}","False","","","False","hazardousnorth","","","","False","1422838264.0","1422838264.0","","self.askgaybros","0","1422841318.0","0","True","False","2ugpk2","True","","","","","","{}","[]","t3_2ugpk2","10","","False","http://www.reddit.com/r/askgaybros/comments/2ugpk2/please_help_im_devastated_after_a_breakup_i_need/","Unauthenticated reddit sesssion","","False","3","","{}","So...I put off writing this for some time. It's likely to be a long one because there is prologue, exposition, and the epilogue. It's a sort of ""Please, sit back, listen to the whole story, and, when I am finished, if you have an opinion, advice, or remark I gladly welcome it, good or bad.""


So, we've all been there. We've had our hearts stomped on &amp; crushed into powder by the indifference of other gay men. Maybe we're fortunate enough to grow and learn from the experiences, the mistakes we made and the mistakes they made. 


Christ I can't seem to stop sighing. 


I consider myself fairly, and understandably, guarded against the pitfalls of gay dating. I wouldn't say I wear my heart on my sleeve - not since my mid-20s anyway. Previous relationships had given me the experience to more successfully navigate the treacherous waters. 


It would be a challenging but not impossible journey to my heart.


So, I met R in July. We had started talking on scruff and by all appearances we wanted to hook up, but R works in the medicine and his schedule thwarted our efforts to meet up. But we continued talking and out of the blue R asked if I would be interested in going on a date instead? 


We met at his place july 12th and I was unprepared for the man that answered the door. He was beyond gorgeous; his pictures did no justice. And I'm a sucker for great smiles and his was...breathtaking. It still is. 


We went to a tapas place that was crowded, noisy, and we talked for hours. I consider myself fairly skilled in the art of conversation, and I felt confident in my ability to interact well with this man who was dazzling me with his charm, wit, intelligence, and host of other positive attributes. I was in retrospect, quite surprised that this incredible man was as interested in me. I'm not Quasimodo in the looks department or Lenny from Of Mice and Men in the brains department. But I've been shat upon and have struggled with my own issues of self-worth, and personal struggles in my life often had me questioning the point of the struggles of life and of seeking a relationship. This particular period of my life wasn't a particularly low point, but I digress.


I'm sure there are men who, if they absolutely did not want to, would not have fell under this man's spell, and even though I had voiced my qualms about returning to his domicile with him that evening to ""watch a movie"", return with him I did.


And while I did not move in, in essence, I never left. We hit it off so spectacularly. I was dazzled, and despite my efforts to remain aloof for a period, I could not find a single fault with R, and the things that would have otherwise given me pause or trepidation...it was like...those issues just melted away. It was this sort of paradigm shift for my own wants and needs. I never felt like the issues I would have had I changed to accommodate him. I was so completely taken by R that it was like, my body and mind evolved. 


And that was the best thing; R was as equally taken, if not more so. He wasn't promiscuous or a serial dater, but he seemed to evolve as well. His career made great demands on his time - I mean far in excess of the normal 40 hour week, but he accommodated me, made time for me as equally as he made time for the people in his life he'd known for years. And he did so, seemingly magically finding extra time in the day to accommodate his friends and family, and me. 


There were things R did that no man had ever really done for me or done at all point blank, that went so far to conveying the sincerity of his emotions that I felt innately that this man's affection was true and without reservation. The chief thing in my mind is R has a twin brother and R said it was not likely I would meet him, as no man he'd yet dated ever had, and there were guys he'd dated far longer than him and I ultimately wound up lasting. It came as close a sticking point I had as any to our relationship, but like the fact that he made so much of his time available to me when he had so little for himself, and the way he looked at me and how it made me feel...I felt truly, even before he said it, that this man loved me. 


And after a month, he said so, and I knew...despite how crazy it seemed to do so, I knew that I loved him as well. Even with my distaste for those who would say they loved me after knowing me for a time period that seemed inappropriately short to say such a thing, I knew. I KNEW we loved each other. Previously in my life I have, as I think have we all, to some extent, said we loved someone, and whether we meant it or not, or truly believed it or not, said it all the same because it seemed/felt right. 


I actually pushed back against his telling me he loved me, because I was so desperately afraid of loving this man because I had been so badly hurt in the past and I felt that I couldn't bear this ending. Thinking in such a way is no way to love but that's just how it was. But even the mightiest fortress around a stalwart heart will crumble with enough love and mine was no exception.


I think, apart from the love I had for my family, I would never had been party to such love. I'd read the love poems of Rumi and dreamed that one day I might love someone in that way. Sure, I'd said I'd loved guys I'd dated but - well, it's not that I lied but in retrospect I don't think I ever knew really what love truly was. Not until this, because no love ever hurt like this. 


By 3 months, we were inseparable. Even though staying over at R's added greatly to my already insanely early morning commute, I stayed over as often as he'd have me. And he as often came to my place even though it added to his equally. There were other things R did that every day contributed to my belief that this man's love was true, generous in its manifest, and pure. But even without all of that, it was the way he looked at me. I never specifically thought brown eyes would be beautiful but the weight of his gaze was...


I don't how to put it into words. I just knew. And he told me he loved every day. And when he held me, I felt safe. I felt warm. I felt at home. 


It was on Halloween that I met his brother. His sister in law was all over me. She was so excited to meet someone her brother in law was dating. The venue was loud and bodies pressed in as thick as a pea soup, but his twin brother and sister in law were charming, and they loved me from the start. 


R's friends had all loved me, conveying that they were so pleased that someone had entered R's life who was as kind and wonderful an individual as R was, and they welcomed me immediately. And now his twin brother had accepted me. R enjoyed that Halloween and that was a turning point.


R asked me a question not long before Halloween. His residency here in Boston would be finished in 2 years time and, having done his medical studies at a prominent university in new york city, he wanted to return there when he finished. Listening to him frame this question, I thought at first he was setting up the fact that we could not continue dating - as I had been party to such a breakup once before. But then R added what I never expected.


""I can't imagine you not being there with me.""


R reiterated his desire for this development a few times more over the next month and a half, and while waiting for the bus one night after dinner to celebrate our 3rd month together the conversation, through a ludicrously funny thought completely aside from the subject of marriage, alluded to it nonetheless, and R made it clear that his thoughts were leaning in that direction. But he couldn't...go there while he was still under the duress of his residency. In time...in time he said. 


It's a testament to how I felt that, despite what otherwise would have felt like things were moving insanely fast, everything felt right. And it wasn't like we were talking about moving in next week and getting married the following month. Yes, this was very far-off talk. New York and marriage two years away seemed like an insanely reasonable amount of time to wait. We had all the time in the world.


After that night my last inhibitions crumbled, what little there were left. I surrendered to this love completely. It seemed silly to create further obstacles for obstacle's sake. I believed now that, for the first time in my life, I had met someone for whom the previously terrifying prospect of commitment, of settling down and accepting one person as my mate, now seemed not only possible, but very wanted, very desired. The mental floodgates relented and I allowed myself to envision a life beyond the sort of month to month existence. In steps, of course. I wasn't naming our children or anything. But we talked about adopting a pet together. We were very much in love and all our issues didn't bother us.


And for a time, it was good.


I don't think I can pinpoint when things started to veer. R was always busy with work, but I never felt that I had to remind him to pay attention to me. Even though I didn't see him as much as my loving heart keened for, I saw him plenty for someone who was in his second year of a medical residency. So when he became even busier and was more frequently tired - this being something he had warned me of months previously - and not as up to seeing me as frequently, I didn't pay it a mind.


And when he started to seem aloof, sort of sullen, quiet, not making it out to my place anymore and instead my spending our nights together at his place near exclusively, I paid it no mind because I felt that, for someone so loving and loved, this was a small price to pay for a future together, if it was even a price at all. 


But then the aloofness became greater. The daily communication - which I'm well aware outside of a honeymoon phase cannot realistically be sustained, particularly by someone in his line of work, but, it was just...little things here and there that it was easy to ignore or explain away. I don't think I realized I was in denial yet. I was so in love. 


Sure, as all couples do, we'd had a smattering of...""passioned disagreements"" and even something that I could say approached an argument, but by his words and deeds, it still felt like we were in the honeymoon phase. But - and maybe some would disagree, but I finally realized something was up when our fourth month date rolled around and I mentioned it he seemed disconnected, and when the fifth month date arrived and we hadn't been seeing much of each other because he was working 28 hour shifts, I felt I almost had to convince him to see me to celebrate the (admittedly minor) 5th milestone when the practice had been initiated by him from the beginning. 


By this time I knew that something was up. I'd given him space, encouraged him to make time for his own friends and family, encouraging him on his time off to see them instead of me (and still seeing him when he endearingly begged that we see each other anyway) and had been open, up front, and communicative, but not overbearing. I dug deep into my sack of relationship pitfall awareness and scraped the sides. I was determined from day one to do everything in my power to see the success of this relationship and now, here in December I could no longer deny, could no longer tell myself that he was just exhausted, tired, worn out. 


Several months prior I had floated the idea of a trip to New York together on a weekend in December. A treat for us both, as we were both from New York, and it would be my primary Christmas gift to him. This was the first time I ever went away with a boyfriend. I had previously dated guys long distance, but to travel to a destination together for a vacation was something I'd never done before.


As the departure date drew nigh, there was tension, and the night before I asked him if he wanted to go on this trip. He said yes. The trip down was pleasant enough. First class on Amtrak's Acela, and a nice room in a high rise hotel in the financial district. We made love in the hotel room, and it was like how we made love when we first knew our love.


And for a brief time in New York, it was good. But it soon became clear during the time in New York that R was...not there. We went out, we saw sights, we met up with friends, ate in nice places, and unbeknownst to him, I had even toyed with the idea some time previously, of proposing to him. As the time between that first thought and the tensions arising in December, I certainly thought better of such a thought, but perhaps it bears to mention at this point that I had once been previously engaged and when that relationship ended, I swore that it would be unlikely, if ever that I would consider marriage again.


Our first real argument and I think you could pin it as the beginning of the end was on the train ride home. R's distance and aloofness during a trip I had financed (R insisted on paying for the hotel but I paid for most everything else, a trip I had painstakingly scrimped and saved for) had worn on me, and when a glass of wine spilled in my lap during the dinner service, I snapped. I didn't throw my frustrations about his own behavior whilst in new york city in his face; instead framing my unhappiness with being subject to so much bad luck and in essence the punchline to some cosmic joke. R completely misread my unhappiness and said I was throwing a tantrum to which I responded that I was in pain and that if he was going to trivialize it so blithely I didn't want to sit next to him, and I got up and sat in the old cell phone vestibule for about an hour, returning to my seat when we had about 45 minutes left in the journey.


R was silent the entire time. We disembarked at Back Bay station and Uber'ed to his home. R said we would discuss what happened when we got back to his place. In the car, I quietly took his hand and though he held it, he remained silent. 


Up the stairs, into his apartment, quietly. Undressed, teeth brushed. Silence betwixt us so thick you could part it with your hands and yet here neither dared to break the stillness interrupted only by the sounds of teeth being brushed, belts clicking and clothing falling to the floor. 


I was ready and in his bed first, and out of the corner of my eye I allowed myself to watch this man undress and move about. Even as frustrated as I was, as terrified at the silence and stillness; still, I loved him. 


I still love him.


He climbed into bed and nary a word he spoke. He had turned off the light and turned his back to me. 


I was burning. How could he just pass what transpired between us this evening unaddressed? I lay there listening to his breathing and growing ore hurt and frustrated by the second. It seemed like hours but really was only minutes, perhaps 5, maybe 10? I don't know. This had never happened and my heart was hammering. I was terrified. All relationships are tested, and I wasn't so naive to think ours never would be


***Continued in comments due to great length***","&lt;!-- SC_OFF --&gt;&lt;div class=""md""&gt;&lt;p&gt;So...I put off writing this for some time. It&amp;#39;s likely to be a long one because there is prologue, exposition, and the epilogue. It&amp;#39;s a sort of &amp;quot;Please, sit back, listen to the whole story, and, when I am finished, if you have an opinion, advice, or remark I gladly welcome it, good or bad.&amp;quot;&lt;/p&gt;

&lt;p&gt;So, we&amp;#39;ve all been there. We&amp;#39;ve had our hearts stomped on &amp;amp; crushed into powder by the indifference of other gay men. Maybe we&amp;#39;re fortunate enough to grow and learn from the experiences, the mistakes we made and the mistakes they made. &lt;/p&gt;

&lt;p&gt;Christ I can&amp;#39;t seem to stop sighing. &lt;/p&gt;

&lt;p&gt;I consider myself fairly, and understandably, guarded against the pitfalls of gay dating. I wouldn&amp;#39;t say I wear my heart on my sleeve - not since my mid-20s anyway. Previous relationships had given me the experience to more successfully navigate the treacherous waters. &lt;/p&gt;

&lt;p&gt;It would be a challenging but not impossible journey to my heart.&lt;/p&gt;

&lt;p&gt;So, I met R in July. We had started talking on scruff and by all appearances we wanted to hook up, but R works in the medicine and his schedule thwarted our efforts to meet up. But we continued talking and out of the blue R asked if I would be interested in going on a date instead? &lt;/p&gt;

&lt;p&gt;We met at his place july 12th and I was unprepared for the man that answered the door. He was beyond gorgeous; his pictures did no justice. And I&amp;#39;m a sucker for great smiles and his was...breathtaking. It still is. &lt;/p&gt;

&lt;p&gt;We went to a tapas place that was crowded, noisy, and we talked for hours. I consider myself fairly skilled in the art of conversation, and I felt confident in my ability to interact well with this man who was dazzling me with his charm, wit, intelligence, and host of other positive attributes. I was in retrospect, quite surprised that this incredible man was as interested in me. I&amp;#39;m not Quasimodo in the looks department or Lenny from Of Mice and Men in the brains department. But I&amp;#39;ve been shat upon and have struggled with my own issues of self-worth, and personal struggles in my life often had me questioning the point of the struggles of life and of seeking a relationship. This particular period of my life wasn&amp;#39;t a particularly low point, but I digress.&lt;/p&gt;

&lt;p&gt;I&amp;#39;m sure there are men who, if they absolutely did not want to, would not have fell under this man&amp;#39;s spell, and even though I had voiced my qualms about returning to his domicile with him that evening to &amp;quot;watch a movie&amp;quot;, return with him I did.&lt;/p&gt;

&lt;p&gt;And while I did not move in, in essence, I never left. We hit it off so spectacularly. I was dazzled, and despite my efforts to remain aloof for a period, I could not find a single fault with R, and the things that would have otherwise given me pause or trepidation...it was like...those issues just melted away. It was this sort of paradigm shift for my own wants and needs. I never felt like the issues I would have had I changed to accommodate him. I was so completely taken by R that it was like, my body and mind evolved. &lt;/p&gt;

&lt;p&gt;And that was the best thing; R was as equally taken, if not more so. He wasn&amp;#39;t promiscuous or a serial dater, but he seemed to evolve as well. His career made great demands on his time - I mean far in excess of the normal 40 hour week, but he accommodated me, made time for me as equally as he made time for the people in his life he&amp;#39;d known for years. And he did so, seemingly magically finding extra time in the day to accommodate his friends and family, and me. &lt;/p&gt;

&lt;p&gt;There were things R did that no man had ever really done for me or done at all point blank, that went so far to conveying the sincerity of his emotions that I felt innately that this man&amp;#39;s affection was true and without reservation. The chief thing in my mind is R has a twin brother and R said it was not likely I would meet him, as no man he&amp;#39;d yet dated ever had, and there were guys he&amp;#39;d dated far longer than him and I ultimately wound up lasting. It came as close a sticking point I had as any to our relationship, but like the fact that he made so much of his time available to me when he had so little for himself, and the way he looked at me and how it made me feel...I felt truly, even before he said it, that this man loved me. &lt;/p&gt;

&lt;p&gt;And after a month, he said so, and I knew...despite how crazy it seemed to do so, I knew that I loved him as well. Even with my distaste for those who would say they loved me after knowing me for a time period that seemed inappropriately short to say such a thing, I knew. I KNEW we loved each other. Previously in my life I have, as I think have we all, to some extent, said we loved someone, and whether we meant it or not, or truly believed it or not, said it all the same because it seemed/felt right. &lt;/p&gt;

&lt;p&gt;I actually pushed back against his telling me he loved me, because I was so desperately afraid of loving this man because I had been so badly hurt in the past and I felt that I couldn&amp;#39;t bear this ending. Thinking in such a way is no way to love but that&amp;#39;s just how it was. But even the mightiest fortress around a stalwart heart will crumble with enough love and mine was no exception.&lt;/p&gt;

&lt;p&gt;I think, apart from the love I had for my family, I would never had been party to such love. I&amp;#39;d read the love poems of Rumi and dreamed that one day I might love someone in that way. Sure, I&amp;#39;d said I&amp;#39;d loved guys I&amp;#39;d dated but - well, it&amp;#39;s not that I lied but in retrospect I don&amp;#39;t think I ever knew really what love truly was. Not until this, because no love ever hurt like this. &lt;/p&gt;

&lt;p&gt;By 3 months, we were inseparable. Even though staying over at R&amp;#39;s added greatly to my already insanely early morning commute, I stayed over as often as he&amp;#39;d have me. And he as often came to my place even though it added to his equally. There were other things R did that every day contributed to my belief that this man&amp;#39;s love was true, generous in its manifest, and pure. But even without all of that, it was the way he looked at me. I never specifically thought brown eyes would be beautiful but the weight of his gaze was...&lt;/p&gt;

&lt;p&gt;I don&amp;#39;t how to put it into words. I just knew. And he told me he loved every day. And when he held me, I felt safe. I felt warm. I felt at home. &lt;/p&gt;

&lt;p&gt;It was on Halloween that I met his brother. His sister in law was all over me. She was so excited to meet someone her brother in law was dating. The venue was loud and bodies pressed in as thick as a pea soup, but his twin brother and sister in law were charming, and they loved me from the start. &lt;/p&gt;

&lt;p&gt;R&amp;#39;s friends had all loved me, conveying that they were so pleased that someone had entered R&amp;#39;s life who was as kind and wonderful an individual as R was, and they welcomed me immediately. And now his twin brother had accepted me. R enjoyed that Halloween and that was a turning point.&lt;/p&gt;

&lt;p&gt;R asked me a question not long before Halloween. His residency here in Boston would be finished in 2 years time and, having done his medical studies at a prominent university in new york city, he wanted to return there when he finished. Listening to him frame this question, I thought at first he was setting up the fact that we could not continue dating - as I had been party to such a breakup once before. But then R added what I never expected.&lt;/p&gt;

&lt;p&gt;&amp;quot;I can&amp;#39;t imagine you not being there with me.&amp;quot;&lt;/p&gt;

&lt;p&gt;R reiterated his desire for this development a few times more over the next month and a half, and while waiting for the bus one night after dinner to celebrate our 3rd month together the conversation, through a ludicrously funny thought completely aside from the subject of marriage, alluded to it nonetheless, and R made it clear that his thoughts were leaning in that direction. But he couldn&amp;#39;t...go there while he was still under the duress of his residency. In time...in time he said. &lt;/p&gt;

&lt;p&gt;It&amp;#39;s a testament to how I felt that, despite what otherwise would have felt like things were moving insanely fast, everything felt right. And it wasn&amp;#39;t like we were talking about moving in next week and getting married the following month. Yes, this was very far-off talk. New York and marriage two years away seemed like an insanely reasonable amount of time to wait. We had all the time in the world.&lt;/p&gt;

&lt;p&gt;After that night my last inhibitions crumbled, what little there were left. I surrendered to this love completely. It seemed silly to create further obstacles for obstacle&amp;#39;s sake. I believed now that, for the first time in my life, I had met someone for whom the previously terrifying prospect of commitment, of settling down and accepting one person as my mate, now seemed not only possible, but very wanted, very desired. The mental floodgates relented and I allowed myself to envision a life beyond the sort of month to month existence. In steps, of course. I wasn&amp;#39;t naming our children or anything. But we talked about adopting a pet together. We were very much in love and all our issues didn&amp;#39;t bother us.&lt;/p&gt;

&lt;p&gt;And for a time, it was good.&lt;/p&gt;

&lt;p&gt;I don&amp;#39;t think I can pinpoint when things started to veer. R was always busy with work, but I never felt that I had to remind him to pay attention to me. Even though I didn&amp;#39;t see him as much as my loving heart keened for, I saw him plenty for someone who was in his second year of a medical residency. So when he became even busier and was more frequently tired - this being something he had warned me of months previously - and not as up to seeing me as frequently, I didn&amp;#39;t pay it a mind.&lt;/p&gt;

&lt;p&gt;And when he started to seem aloof, sort of sullen, quiet, not making it out to my place anymore and instead my spending our nights together at his place near exclusively, I paid it no mind because I felt that, for someone so loving and loved, this was a small price to pay for a future together, if it was even a price at all. &lt;/p&gt;

&lt;p&gt;But then the aloofness became greater. The daily communication - which I&amp;#39;m well aware outside of a honeymoon phase cannot realistically be sustained, particularly by someone in his line of work, but, it was just...little things here and there that it was easy to ignore or explain away. I don&amp;#39;t think I realized I was in denial yet. I was so in love. &lt;/p&gt;

&lt;p&gt;Sure, as all couples do, we&amp;#39;d had a smattering of...&amp;quot;passioned disagreements&amp;quot; and even something that I could say approached an argument, but by his words and deeds, it still felt like we were in the honeymoon phase. But - and maybe some would disagree, but I finally realized something was up when our fourth month date rolled around and I mentioned it he seemed disconnected, and when the fifth month date arrived and we hadn&amp;#39;t been seeing much of each other because he was working 28 hour shifts, I felt I almost had to convince him to see me to celebrate the (admittedly minor) 5th milestone when the practice had been initiated by him from the beginning. &lt;/p&gt;

&lt;p&gt;By this time I knew that something was up. I&amp;#39;d given him space, encouraged him to make time for his own friends and family, encouraging him on his time off to see them instead of me (and still seeing him when he endearingly begged that we see each other anyway) and had been open, up front, and communicative, but not overbearing. I dug deep into my sack of relationship pitfall awareness and scraped the sides. I was determined from day one to do everything in my power to see the success of this relationship and now, here in December I could no longer deny, could no longer tell myself that he was just exhausted, tired, worn out. &lt;/p&gt;

&lt;p&gt;Several months prior I had floated the idea of a trip to New York together on a weekend in December. A treat for us both, as we were both from New York, and it would be my primary Christmas gift to him. This was the first time I ever went away with a boyfriend. I had previously dated guys long distance, but to travel to a destination together for a vacation was something I&amp;#39;d never done before.&lt;/p&gt;

&lt;p&gt;As the departure date drew nigh, there was tension, and the night before I asked him if he wanted to go on this trip. He said yes. The trip down was pleasant enough. First class on Amtrak&amp;#39;s Acela, and a nice room in a high rise hotel in the financial district. We made love in the hotel room, and it was like how we made love when we first knew our love.&lt;/p&gt;

&lt;p&gt;And for a brief time in New York, it was good. But it soon became clear during the time in New York that R was...not there. We went out, we saw sights, we met up with friends, ate in nice places, and unbeknownst to him, I had even toyed with the idea some time previously, of proposing to him. As the time between that first thought and the tensions arising in December, I certainly thought better of such a thought, but perhaps it bears to mention at this point that I had once been previously engaged and when that relationship ended, I swore that it would be unlikely, if ever that I would consider marriage again.&lt;/p&gt;

&lt;p&gt;Our first real argument and I think you could pin it as the beginning of the end was on the train ride home. R&amp;#39;s distance and aloofness during a trip I had financed (R insisted on paying for the hotel but I paid for most everything else, a trip I had painstakingly scrimped and saved for) had worn on me, and when a glass of wine spilled in my lap during the dinner service, I snapped. I didn&amp;#39;t throw my frustrations about his own behavior whilst in new york city in his face; instead framing my unhappiness with being subject to so much bad luck and in essence the punchline to some cosmic joke. R completely misread my unhappiness and said I was throwing a tantrum to which I responded that I was in pain and that if he was going to trivialize it so blithely I didn&amp;#39;t want to sit next to him, and I got up and sat in the old cell phone vestibule for about an hour, returning to my seat when we had about 45 minutes left in the journey.&lt;/p&gt;

&lt;p&gt;R was silent the entire time. We disembarked at Back Bay station and Uber&amp;#39;ed to his home. R said we would discuss what happened when we got back to his place. In the car, I quietly took his hand and though he held it, he remained silent. &lt;/p&gt;

&lt;p&gt;Up the stairs, into his apartment, quietly. Undressed, teeth brushed. Silence betwixt us so thick you could part it with your hands and yet here neither dared to break the stillness interrupted only by the sounds of teeth being brushed, belts clicking and clothing falling to the floor. &lt;/p&gt;

&lt;p&gt;I was ready and in his bed first, and out of the corner of my eye I allowed myself to watch this man undress and move about. Even as frustrated as I was, as terrified at the silence and stillness; still, I loved him. &lt;/p&gt;

&lt;p&gt;I still love him.&lt;/p&gt;

&lt;p&gt;He climbed into bed and nary a word he spoke. He had turned off the light and turned his back to me. &lt;/p&gt;

&lt;p&gt;I was burning. How could he just pass what transpired between us this evening unaddressed? I lay there listening to his breathing and growing ore hurt and frustrated by the second. It seemed like hours but really was only minutes, perhaps 5, maybe 10? I don&amp;#39;t know. This had never happened and my heart was hammering. I was terrified. All relationships are tested, and I wasn&amp;#39;t so naive to think ours never would be&lt;/p&gt;

&lt;p&gt;&lt;strong&gt;&lt;em&gt;Continued in comments due to great length&lt;/em&gt;&lt;/strong&gt;&lt;/p&gt;
&lt;/div&gt;&lt;!-- SC_ON --&gt;","False","askgaybros","t5_2vgfw","","","Please help! I'm devastated after a breakup! I need advice. (A very long post.)","3","http://www.reddit.com/r/askgaybros/comments/2ugpk2/please_help_im_devastated_after_a_breakup_i_need/","[]","False"
